,RANK,COUNTRY,PLAYER,CHANGE +/-,WIN - LOSE,PRIZE MONEY,POINTS / TOURNAMENTS
370,355,ENG ENG,Jessica PUGH Sarah WALKER,0,0 - 0,,"2,200 / 1"
371,355,CHI CHI,Nicole NAVARRETE Nicol SALINAS,0,0 - 0,,"2,200 / 1"
372,355,CHI CHI,Ashley MONTRE Javiera TORRES,0,0 - 0,,"2,200 / 1"
373,355,HUN HUN,Agnes KOROSI Laura SAROSI,4,0 - 0,,"2,200 / 1"
374,355,AUS AUS,Claudia LAM Susan WANG,4,0 - 0,,"2,200 / 1"
375,355,ESA ESA,URRUTIA Cecilia Georgina Penelope ORELLANA SANTOS,4,0 - 0,,"2,200 / 1"
376,355,RSA MRI,Michelle BUTLER-EMMETT Kate FOO KUNE,4,0 - 0,,"2,200 / 1"
377,355,JPN JPN,Saki HAYATA Haruko SUZUKI,4,0 - 0,,"2,200 / 1"
378,355,JPN JPN,Anna DOI Ayako SAKURAMOTO,4,0 - 0,,"2,200 / 1"
379,355,CAN CAN,Rachel HONDERICH Brittney TAM,4,0 - 0,,"2,200 / 1"
380,355,FRA FRA,Marie BATOMENE Lorraine BAUMANN,4,0 - 0,,"2,200 / 1"
381,355,RUS RUS,Anastasia NAZARCHUK Anastasia STOGOVA,4,0 - 0,,"2,200 / 1"
382,383,FRA FRA,Marie BATOMENE Anne TRAN,-1,0 - 0,,"2,130 / 1"
383,383,NGR ZAM,Grace GABRIEL Ogar SIAMUPANGILA,-1,0 - 0,,"2,130 / 1"
384,383,DEN SWE,Josephine VAN ZAANE Emma WENGBERG,-1,0 - 0,,"2,130 / 1"
385,383,TUR TUR,Kader İNAL Ebru YAZGAN,-1,0 - 0,,"2,130 / 1"
386,383,NED NED,Myke HALKEMA Lisa MALAIHOLLO,-1,0 - 0,,"2,130 / 1"
387,383,THA THA,Thidarat KLEEBYEESOON Ruethaichanok LAISUAN,-1,0 - 0,,"2,130 / 1"
388,383,ENG ENG,Chloe BIRCH Jessica PUGH,-1,0 - 0,,"2,130 / 1"
389,383,KOR KOR,Soo Bin LIM OH Bo Kyung,-1,0 - 0,,"2,130 / 1"
390,391,KOR KOR,Ji Sun BANG Ga Hee HAN,-1,0 - 0,,"2,110 / 1"
391,391,KOR KOR,Yoon Jung CHOI Yong Joo HAN,-1,0 - 0,,"2,110 / 1"
392,391,KOR KOR,KIM Min Jung Ki Bbeum SONG,-1,0 - 0,,"2,110 / 1"
393,391,TPE TPE,CHIANG Kai Hsin HUNG Shih Han,-1,0 - 0,,"2,110 / 1"
394,391,JAM JAM,Ruth WILLIAMS Katherine WYNTER,-1,0 - 0,,"2,110 / 1"
395,391,JPN JPN,KUGO Asumi Yui MIYAUCHI,-1,0 - 0,,"2,110 / 1"
396,391,HKG HKG,CHAN Hung Yung POON Lok Yan,-1,0 - 0,,"2,110 / 1"
397,391,USA USA,Panita PHONGASAVITHAS Vimla PHONGASAVITHAS,-1,0 - 0,,"2,110 / 1"
398,391,KOR KOR,Hyun Hee CHAE Hye Ryeon KO,-1,0 - 0,,"2,110 / 1"
399,391,USA USA,Ariel LEE Sydney LEE,-1,0 - 0,,"2,110 / 1"
400,391,KOR KOR,KIM So Yeong Hee Yong KONG,-1,0 - 0,,"2,110 / 1"
401,391,RUS RUS,Evgenia DIMOVA Nina VISLOVA,-1,0 - 0,,"2,110 / 1"
402,391,CUB CUB,Melissa AZCUY PEREZ Tahimara OROPEZA,-1,0 - 0,,"2,110 / 1"
403,391,NZL AUS,Ashleigh KARL Ruwindi SERASINGHE,-1,0 - 0,,"2,110 / 1"
404,391,NZL AUS,Maria MASINIPENI Melinda SUN,-1,0 - 0,,"2,110 / 1"
405,391,COK COK,Ngaoa RANGINUI Kate SCOTT,-1,0 - 0,,"2,110 / 1"
406,391,NZL NZL,Justine VILLEGAS Tegan WESTON,-1,0 - 0,,"2,110 / 1"
407,391,AUT GER,Elisabeth BALDAUF Isabel HERTTRICH,-1,0 - 0,,"2,110 / 1"
408,409,IND IND,Teenu DAHIYA Meenu SINGH,-1,0 - 0,,"2,100 / 2"
409,409,AUS TPE,Hsuan-Yu Wendy CHEN SHUAI Pei Ling,-1,0 - 0,,"2,100 / 2"
410,409,IND IND,Parssa NAQVI Saruni SHARMA,-1,0 - 0,,"2,100 / 2"
411,412,BUL BUL,Tsveti ASENOVA Mila IVANOVA,-1,0 - 0,,"2,070 / 2"
412,412,FRA FRA,Manon KRIEGER Juliane PIRON,-1,0 - 0,,"2,070 / 2"
413,414,FRA FRA,Marie BATOMENE Teshana VIGNES WARAN,-1,0 - 0,,"2,050 / 2"
414,415,INA INA,Ririn AMELIA Nugraheny RISTYA AYU,-1,0 - 0,,"2,040 / 2"
415,416,INA INA,Dwi Wahyuni ASHYARIATY Fransisca Angelica RAHARDJA,-1,0 - 0,,"2,020 / 3"
416,417,SIN SIN,Hui Zhen Grace CHUA Ai Ninna TAN,-1,0 - 0,,"1,980 / 3"
417,418,AUS AUS,Tiffany HO Janet SON,-1,0 - 0,,"1,950 / 2"
418,418,JPN JPN,Atsuko KOIKE Midori SAKURAI,-1,0 - 0,,"1,950 / 2"
419,420,SWE SWE,Emelie FABBEKE Emma WENGBERG,-1,0 - 0,,"1,860 / 2"
420,421,NOR NOR,Anne KLYVE Helene SOGAARD,-1,0 - 0,,"1,850 / 4"
421,422,THA THA,Ruethaichanok LAISUAN Supamart MINGCHUA,-1,0 - 0,,"1,840 / 2"
422,422,INA INA,Mayrina LUKMANDA Bunga Fitriani ROMADHINI,-1,0 - 0,,"1,840 / 2"
423,422,TPE TPE,Su Yu CHEN Yu-Ting HUANG,363,0 - 0,,"1,840 / 2"
424,422,GRE GRE,Ioanna KARAPETRIDOU Polyvia TZIKA,-1,0 - 0,,"1,840 / 2"
425,422,PHI PHI,Joella Geva DE VERA Jessie FRANCISCO,-1,0 - 0,,"1,840 / 2"
426,422,THA THA,Pattaranan CHAMNAKTAN Sanicha CHUMNIBANNAKARN,-1,0 - 0,,"1,840 / 2"
427,422,MAC MAC,Xue Xin GONG Weng Chi NG,-1,0 - 0,,"1,840 / 2"
428,422,BUL BUL,Mariya MITSOVA Dimitria POPSTOIKOVA,-1,0 - 0,,"1,840 / 2"
429,430,BUL BUL,Petya NEDELCHEVA Dimitria POPSTOIKOVA,-2,0 - 0,,"1,837 / 1"
430,431,HUN GER,Daniella GONDA Annika HORBACH,-1,0 - 0,,"1,780 / 3"
431,432,FRA FRA,Vimala HERIAU Margot LAMBERT,-1,0 - 0,,"1,770 / 2"
432,433,TUR TUR,Busra UNLU Ebru YAZGAN,-1,0 - 0,,"1,750 / 1"
433,433,INA INA,Marsheilla Gischa ISLAMI Rahmadhani Hasiyanti PUTRI,-1,0 - 0,,"1,750 / 1"
434,433,DEN DEN,Julie FINNE-IPSEN Josephine VAN ZAANE,-1,0 - 0,,"1,750 / 1"
435,433,TUR TUR,Büşra BENK Merve COBAN,-1,0 - 0,,"1,750 / 1"
436,433,FRA FRA,Delphine DELRUE Anne TRAN,-1,0 - 0,,"1,750 / 1"
437,433,INA INA,Jenna GOZALI Shendy Puspa IRAWATI,-1,0 - 0,,"1,750 / 1"
438,433,DEN DEN,Irina Amalie ANDERSEN Amalie Hertz HANSEN,-1,0 - 0,,"1,750 / 1"
439,433,DEN DEN,Iben BERGSTEIN Line Fleischer NIELSEN,-1,0 - 0,,"1,750 / 1"
440,433,MAS MAS,Jin Wei GOH Ying Ying LEE,-1,0 - 0,,"1,750 / 1"
441,433,NGR NGR,Dorcas Ajoke ADESOKAN Asisat OGUNKANBI,-1,0 - 0,,"1,750 / 1"
442,433,ETH ETH,Tigist GETACHEW Kidist HAILU,-1,0 - 0,,"1,750 / 1"
443,433,GUA GUA,Sara Michele BARRIOS CHIONG Alejandra SAMAYOA ARREAGA,-1,0 - 0,,"1,750 / 1"
444,433,KOR KOR,Min Ji CHOI Han Na YOON,-1,0 - 0,,"1,750 / 1"
445,433,SUI SUI,Nadia FANKHAUSER Celine TRIPET,-1,0 - 0,,"1,750 / 1"
446,433,SRI KAZ,Lekha SHEHANI Veronika SOROKINA,-1,0 - 0,,"1,750 / 1"
447,433,TRI TRI,Avril PLAZA MARCELLE Kamasha ROBERTSON,-1,0 - 0,,"1,750 / 1"
448,449,DEN DEN,Anna KLINKE Maja RINDSHOEJ,-1,0 - 0,,"1,730 / 2"
449,450,LUX LUX,Tessy AULNER Marie GOEDERT,-1,0 - 0,,"1,670 / 2"
450,451,IND IND,Juhi DEWANGAN Smriti NAGARKOTI,-1,0 - 0,,"1,670 / 1"
451,451,IND IND,Lalita DAHIYA Seema PANCHAL,-1,0 - 0,,"1,670 / 1"
452,451,MAS MAS,Kah Mun CHIN Yen Wei PECK,-1,0 - 0,,"1,670 / 1"
453,451,MAS MAS,SEE To Chia Vern Wei Chyi TI,-1,0 - 0,,"1,670 / 1"
454,451,GER GER,Pia BECHER Paula KICK,-1,0 - 0,,"1,670 / 1"
455,451,GER GER,Fabienne KOEHLER Theresa WURM,-1,0 - 0,,"1,670 / 1"
456,451,BUL SUI,Diana DIMOVA Celine TRIPET,-179,0 - 0,,"1,670 / 1"
457,451,IND IND,Sanskriti CHHABRA Ekta KALIA,-1,0 - 0,,"1,670 / 1"
458,451,SUI SUI,Susanne KELLER Yvonne KELLER,-132,0 - 0,,"1,670 / 1"
459,451,IND IND,Pragya RAI VADDEPALLY Pramada,-1,0 - 0,,"1,670 / 1"
460,451,FRA FRA,Emilie BEAUJEAN Joanna CHAUBE,-1,0 - 0,,"1,670 / 1"
461,451,SUI SUI,Cendrine HANTZ Sanya HERZIG,-1,0 - 0,,"1,670 / 1"
462,451,THA THA,Pattaranan CHAMNAKTAN Kwanchanok SUDJAIPRAPARAT,-1,0 - 0,,"1,670 / 1"
463,451,AUS INA,Hsuan-Yu Wendy CHEN SUSANTO Yulia Yosephin,-1,0 - 0,,"1,670 / 1"
464,451,SIN SIN,Shinta Mulia SARI Wei Han TAN,-1,0 - 0,,"1,670 / 1"
465,451,THA THA,Natchpapha CHATUPORNKARNCHANA Sanicha CHUMNIBANNAKARN,-1,0 - 0,,"1,670 / 1"
466,451,THA THA,Suchanya KANCHANASAKA Kornkamon SUKKLAD,-1,0 - 0,,"1,670 / 1"
467,451,USA ENG,Ariel LEE Jenny WALLWORK,-1,0 - 0,,"1,670 / 1"
468,451,NZL NZL,Kelly STERN Justine VILLEGAS,-1,0 - 0,,"1,670 / 1"
469,451,NZL NZL,Gaea GALVEZ Tamara OTENE,-1,0 - 0,,"1,670 / 1"
470,451,AUS AUS,Hsuan-Yu Wendy CHEN Gronya SOMERVILLE,-1,0 - 0,,"1,670 / 1"
471,472,TPE TPE,Pin Chi CHAO Ya Ting CHIANG,-2,0 - 0,,"1,580 / 2"
472,473,ETH ETH,BERHANU Samrawit Yerusksew Legssey TURA,-2,0 - 0,,"1,522 / 2"
473,474,CRO CZE,Stasa POZNANOVIC Katerina TOMALOVA,-2,0 - 0,,"1,520 / 2"
474,475,CAN CAN,Cynthia CHEN Camille LEBLANC,-1,0 - 0,,"1,520 / 1"
475,475,CAN CAN,Vicky GIRARD Nadianie OUAQOUAQ-BERGERON,-1,0 - 0,,"1,520 / 1"
476,475,INA INA,Brigita Marcelia RUMAMBI Merisa Cindy SAHPUTRI,-1,0 - 0,,"1,520 / 1"
477,475,GER GER,Anika DÖRR Isabel HERTTRICH,-1,0 - 0,,"1,520 / 1"
478,475,NEP NEP,Amita GIRI Meena SHRESTHA,-1,0 - 0,,"1,520 / 1"
479,475,IRI IND,Negin AMIRIPOUR Kristi DAS,-1,0 - 0,,"1,520 / 1"
480,475,IND IND,Nimmi PATEL Saruni SHARMA,-1,0 - 0,,"1,520 / 1"
481,475,DEN DEN,Julie Dawall JAKOBSEN Sara LUNDGAARD,-1,0 - 0,,"1,520 / 1"
482,475,CHN CHN,AN Yu ZHENG Yuwen,-1,0 - 0,,"1,520 / 1"
483,475,BUL BUL,Aneta Yaneva DUKOVA Petya NEDELCHEVA,-1,0 - 0,,"1,520 / 1"
484,475,IRI IRI,Sara KEYVAN SHABIHI Yasamin,-1,0 - 0,,"1,520 / 1"
485,475,IRQ IRQ,AL-BAYATI Inas Khalid Rashid Adhraa KH RASHID,-1,0 - 0,,"1,520 / 1"
486,475,NGR NGR,Olabisi IBIYEYE Oluwatosin SOLADEMI,-1,0 - 0,,"1,520 / 1"
487,475,SRI SRI,WADUTHANTRI Kavindika Binari De Silva DAYARATHNE Yasmitha Sankapale,-1,0 - 0,,"1,520 / 1"
488,475,IRI IRI,Moloud ESMAEILI Sahabeh FARD,-1,0 - 0,,"1,520 / 1"
489,475,UKR UKR,Larisa GRIGA Elena PRUS,-1,0 - 0,,"1,520 / 1"
490,475,BAN BAN,Aktar SHAPLA Alina SULTANA,-1,0 - 0,,"1,520 / 1"
491,475,SLO SLO,Kaja STANKOVIC Tina KODRIC,-1,0 - 0,,"1,520 / 1"
492,475,INA INA,Lya ERSALITA Ruselli HARTAWAN,-1,0 - 0,,"1,520 / 1"
493,475,NGR NGR,Tosin Damilola ATOLAGBE Fatima AZEEZ,-1,0 - 0,,"1,520 / 1"
494,475,DOM DOM,Daigenis SATURRIA VIBIECA BERONICA,-196,0 - 0,,"1,520 / 1"
495,475,SUI SUI,Nadia FANKHAUSER Michelle SCHAER,-1,0 - 0,,"1,520 / 1"
496,475,IND IND,Varsha V BELAWADI G. M. Nischitha,-1,0 - 0,,"1,520 / 1"
497,475,RUS RUS,Anastasia KHARLAMPOVICH Anastasia STOGOVA,-1,0 - 0,,"1,520 / 1"
498,475,JPN JPN,Karin HIRANO Haruka OSAKO,-1,0 - 0,,"1,520 / 1"
499,475,JPN JPN,Minami KAWASHIMA Nami MATSUYAMA,-1,0 - 0,,"1,520 / 1"
500,475,BRA BRA,Samia LIMA Gabriela SANTOS,-1,0 - 0,,"1,520 / 1"
501,475,BRA BRA,Isamara AGUIAR Talita CASONATTO,-1,0 - 0,,"1,520 / 1"
502,475,BRA BRA,Thayse CRUZ Paloma Eduarda da SILVA,-1,0 - 0,,"1,520 / 1"
503,475,UKR UKR,Anna ANDRUSHKO Yevgeniya PAKSYUTOVA,-1,0 - 0,,"1,520 / 1"
504,475,UKR UKR,Nataliia GOLOVKINA NADTOCHIY Olga,-1,0 - 0,,"1,520 / 1"
505,475,FRA FRA,Delphine DELRUE Lea PALERMO,-1,0 - 0,,"1,520 / 1"
506,475,NED BEL,Cheryl SEINEN Flore VANDENHOUCKE,-1,0 - 0,,"1,520 / 1"
507,475,FRA FRA,Lorraine BAUMANN Verlaine FAULMANN,-1,0 - 0,,"1,520 / 1"
508,475,AUS AUS,Elena Yee-Man KWOK Akane SEKIBA,-1,0 - 0,,"1,520 / 1"
509,475,NZL NZL,Celine SHAO Selena WU,-1,0 - 0,,"1,520 / 1"
510,475,AUS AUS,Ysabel SAY Jodee VEGA,-1,0 - 0,,"1,520 / 1"
511,475,AUS AUS,Kay CHAN Michelle TAM,-1,0 - 0,,"1,520 / 1"
512,475,UKR UKR,Maryna ILYINSKAYA Darya SAMARCHANTS,-1,0 - 0,,"1,520 / 1"
513,475,DEN DEN,Alexandra BOJE Gabriella BOJE,-1,0 - 0,,"1,520 / 1"
514,475,DEN LAT,Camilla MARTENS Monika RADOVSKA,-1,0 - 0,,"1,520 / 1"
515,475,UKR UKR,Anastasiya PROZOROVA Valeriya RUDAKOVA,-1,0 - 0,,"1,520 / 1"
516,475,GUA GUA,Diana Giselle FUENTES RIVERA Andrea Maria MORALES GUIROLA,-1,0 - 0,,"1,520 / 1"
517,475,JPN JPN,Natsuki SONE Yukiko TAKAHATA,-1,0 - 0,,"1,520 / 1"
518,475,JPN JPN,Yumi MURAYAMA Natsumi URATANI,-1,0 - 0,,"1,520 / 1"
519,475,JPN JPN,Reimi MOMOI Nao ONO,-1,0 - 0,,"1,520 / 1"
520,475,NGR NGR,Ruth AIYENUGBA Grace IJADARE,-1,0 - 0,,"1,520 / 1"
521,475,NGR NGR,Zainab AKINYEMI Adijat ONASANYA,-1,0 - 0,,"1,520 / 1"
522,475,MAS MAS,Lyddia Yi Yu CHEAH Li Lian YANG,-1,0 - 0,,"1,520 / 1"
523,475,INA INA,Surya DELLA AUGUSTIA Febriani Endar KUSUMAWATI,-1,0 - 0,,"1,520 / 1"
524,475,INA INA,Brigita Marcelia RUMAMBI Engelica WIRATAMA,-1,0 - 0,,"1,520 / 1"
525,475,GUA GUA,Sherly HERNANDEZ MEZ Ana Vanessa TONG CALIX,-1,0 - 0,,"1,520 / 1"
526,475,GUA GUA,Sara Michele BARRIOS CHIONG Alejandra Jose PAIZ QUAN,-1,0 - 0,,"1,520 / 1"
527,475,GUA GUA,Jaqueline ALVAREZ MOLINEROS Eliza Monica RAYMUNDO ALVAREZ,-1,0 - 0,,"1,520 / 1"
528,475,GUA GUA,Maria Regina DEL VALLE LEYSBETH Alejandra SAMAYOA ARREAGA,-1,0 - 0,,"1,520 / 1"
529,530,AUT AUT,Katrin NEUDOLT Bianca SCHIESTER,0,0 - 0,,"1,470 / 2"
530,530,FIN FIN,Noora AHOLA Linnea VAINULA,0,0 - 0,,"1,470 / 2"
531,530,EST EST,Kertu MARGUS Laura TOMBAND,0,0 - 0,,"1,470 / 2"
532,530,INA INA,Tania Oktaviani KUSUMAH Vania Arianti SUKOCO,0,0 - 0,,"1,470 / 2"
533,530,UKR UKR,Maryna ILYINSKAYA Anna MIKHALKOVA,0,0 - 0,,"1,470 / 2"
534,530,INA INA,Maria Natalia Kartika MAINAKY Monika SANDIA,0,0 - 0,,"1,470 / 2"
535,536,SUI SUI,Sabrina JAQUET Ayla HUSER,-205,0 - 0,,"1,459 / 1"
536,537,DEN DEN,Cecilie FINNE-IPSEN Julie FINNE-IPSEN,74,0 - 0,,"1,440 / 2"
537,537,DEN DEN,Camilla MARTENS Josephine VAN ZAANE,74,0 - 0,,"1,440 / 2"
538,539,TPE TPE,CHIU Yi Ju LIU Hsiao-Jo,380,0 - 0,,"1,420 / 2"
539,540,AUS AUS,Ruwindi SERASINGHE Alice WU,-2,0 - 0,,"1,420 / 1"
540,540,SLO SLO,Nika ARIH Petra POLANC,-2,0 - 0,,"1,420 / 1"
541,542,FRA FRA,Lise ORONOZ Diela PERIANAYAGOM,-2,0 - 0,,"1,370 / 1"
542,542,GRE GRE,Anna Maria FARSAKOGLOU Angeliki GEORGIADOU,-2,0 - 0,,"1,370 / 1"
543,542,CUB CUB,Adriana ARTIZ ATAURY Tahimara OROPEZA,-2,0 - 0,,"1,370 / 1"
544,542,CUB CUB,Yuvisleydis RAMIREZ CHAPMAN Laura Ines RODRIGUEZ PALACIO,-2,0 - 0,,"1,370 / 1"
545,542,UGA UGA,Annet NAKAMYA Norah NASSIMBWA,-2,0 - 0,,"1,370 / 1"
546,542,TUR TUR,Merve DEMIR Basak KILIC,-2,0 - 0,,"1,370 / 1"
547,542,ZAM ZAM,Elizaberth CHIPELEME Lucrecia CHISENGA,-2,0 - 0,,"1,370 / 1"
548,542,SWE SWE,Clara NISTAD Moa SJOO,-2,0 - 0,,"1,370 / 1"
549,542,HUN HUN,Nikolett BOGDAN Laura SAROSI,-2,0 - 0,,"1,370 / 1"
550,542,SUI SUI,Ronja STERN Simone VON ROTZ,-207,0 - 0,,"1,370 / 1"
551,542,TUR TUR,Bengisu ERCETIN Nazlıcan INCI,-2,0 - 0,,"1,370 / 1"
552,542,TGA TGA,Lusia Ki Taulanga FAUKAFA Litea Lupe Moe Valu TATAFU,-2,0 - 0,,"1,370 / 1"
553,542,FRA FRA,Marthe GUICHARD Audrey LEBON,-2,0 - 0,,"1,370 / 1"
554,542,SUI SUI,Cendrine HANTZ Tiffany GIRONA,-207,0 - 0,,"1,370 / 1"
555,542,RSA RSA,Elme DE VILLIERS Wilmarie LABUSCHANGE,-2,0 - 0,,"1,370 / 1"
556,542,BOT BOT,Bonolo AMOS MALEPA Dintle,-2,0 - 0,,"1,370 / 1"
557,542,RSA RSA,Stacey DOUBELL Jade MORGAN,-2,0 - 0,,"1,370 / 1"
558,542,KAZ KAZ,Yelizaveta KHARCHENKO Ademi SERIKBAYEVA,-2,0 - 0,,"1,370 / 1"
559,542,KAZ RUS,Vladlena KHARCHENKO Polina VORONKO,-2,0 - 0,,"1,370 / 1"
560,542,TPE TPE,Xiao Min LIN Nien-Tsen TSAI,-2,0 - 0,,"1,370 / 1"
561,542,SIN SIN,Hui Zhen Grace CHUA Ren-ne ONG,-2,0 - 0,,"1,370 / 1"
562,542,GHA GHA,Grace ATIPAKA Gifty MENSAH,-2,0 - 0,,"1,370 / 1"
563,542,COL COL,Laura Valentina LONDONO Cristina RAMIREZ,-2,0 - 0,,"1,370 / 1"
564,542,COL COL,Juliana GIRALDO Karen PATIÑO,-2,0 - 0,,"1,370 / 1"
565,542,CHI CHI,Jenny CEPEDA Belen TRONCOSO,-2,0 - 0,,"1,370 / 1"
566,542,COL COL,Tatiana CAICEDO MUNOZ Liceth Camila SANCHEZ LOZANO,-2,0 - 0,,"1,370 / 1"
567,542,MGL MGL,Khaliunaa BYAMBAA Undrakh DELGERMAA,-2,0 - 0,,"1,370 / 1"
568,542,MGL MGL,Khulangoo BAATAR Munkhchimeg MENDBAYAR,-2,0 - 0,,"1,370 / 1"
569,542,MGL MGL,Dashdondov BULGAMAA Kherlen DARKHANBAATAR,-2,0 - 0,,"1,370 / 1"
570,542,FRA FRA,Verlaine FAULMANN Katia NORMAND,-2,0 - 0,,"1,370 / 1"
571,542,RUS RUS,Anastasiia SEMENOVA Yulia VASILYEVA,-2,0 - 0,,"1,370 / 1"
572,542,RUS RUS,Ksenia EVGENOVA Maria SHEGUROVA,-2,0 - 0,,"1,370 / 1"
573,542,BUL BUL,Maria DELCHEVA Paola KIROVA,-2,0 - 0,,"1,370 / 1"
574,542,TPE TPE,Wen Chi HSU I-Ting LAI,-2,0 - 0,,"1,370 / 1"
575,542,POL POL,Magdalena MACHNIK Kornelia MARCZAK,-2,0 - 0,,"1,370 / 1"
576,542,MGL MGL,Saikhantuul BANZRAGCH Narantsetseg BAYARSAIKHAN,-2,0 - 0,,"1,370 / 1"
577,578,KOR KOR,Hee Yong KONG Seung Yeon SEONG,-4,0 - 0,,"1,290 / 1"
578,578,KOR KOR,Hee Yang HONG Cho Hee KIM,-4,0 - 0,,"1,290 / 1"
579,578,MAS MAS,Yin Loo LIM Khe Wei WOON,-4,0 - 0,,"1,290 / 1"
580,578,KOR KOR,Sun Min LEE PARK So Ri,-4,0 - 0,,"1,290 / 1"
581,578,RUS RUS,Valeriia MAKKOVEEVA Daria RADCHENKO,-4,0 - 0,,"1,290 / 1"
582,578,HKG HKG,NG Wing Yung CHEUNG Ying Mei,-4,0 - 0,,"1,290 / 1"
583,578,MAS MAS,Mei Kuan CHOW Meng Yean LEE,-4,0 - 0,,"1,290 / 1"
584,578,TPE TPE,Yu Chen CHANG Ling Fang HU,-4,0 - 0,,"1,290 / 1"
585,578,KOR KOR,Hye Jin PARK Saes Byeol YOON,-4,0 - 0,,"1,290 / 1"
586,578,TPE TPE,Yu Min HSIAO YEH Chiu Yu,0,0 - 0,,"1,290 / 1"
587,578,TPE TPE,Yu Chieh CHENG Ling Fang HU,0,0 - 0,,"1,290 / 1"
588,578,TPE TPE,Min Hsuan LI TAI Wei-Ling,0,0 - 0,,"1,290 / 1"
589,578,TPE TPE,Ying Chun LIN LIU Hsi Hsia,0,0 - 0,,"1,290 / 1"
590,578,NOR NOR,Charlotte LEINAN Marlene WÅLAND,-4,0 - 0,,"1,290 / 1"
591,578,MAC MAC,CHAN Kit Lei Chi Leng KUAN,-4,0 - 0,,"1,290 / 1"
592,578,CAN CAN,Joanne Yu CHEN Kyleigh O’DONOGHUE,-4,0 - 0,,"1,290 / 1"
593,594,LTU LTU,Vytaute FOMKINAITE Gerda VOITECHOVSKAJA,-7,0 - 0,,"1,272 / 3"
594,595,LAT LAT,Liana LENCEVICA Jekaterina ROMANOVA,-7,0 - 0,,"1,270 / 2"
595,595,FRA FRA,Yaelle HOYAUX Katia NORMAND,296,0 - 0,,"1,270 / 2"
596,597,THA THA,Benyapa AIMSAARD Pattarasuda CHAIWAN,-8,0 - 0,,"1,210 / 2"
597,598,NOR NOR,Cathrine FOSSMO Anne KLYVE,-8,0 - 0,,"1,198 / 1"
598,599,FIN FIN,Jenny NYSTROM Sonja PEKKOLA,-8,0 - 0,,"1,170 / 1"
599,599,NZL NZL,Felicity LEYDON-DAVIS Danielle TAHURI,-8,0 - 0,,"1,170 / 1"
600,599,CZE CZE,Tereza SVABIKOVA Katerina TOMALOVA,-8,0 - 0,,"1,170 / 1"
601,599,EGY EGY,Salma ASHRAF MOHAMED Noran Hassan EL BANNA,0,0 - 0,,"1,170 / 1"
602,599,JOR JOR,Haneen Derar AL-WEDYAN Mazahreh LEINA FEHMI,0,0 - 0,,"1,170 / 1"
603,604,SRI SRI,Lekha SHEHANI Thilini Pramodika HENDAHEWA,-10,0 - 0,,"1,160 / 2"
604,605,CZE CZE,Dominika BUDZELOVA Tereza SVABIKOVA,-10,0 - 0,,"1,150 / 2"
605,606,INA INA,Riska Ayu INDAH SARI Dewi Setyo RAHMAWATI,-10,0 - 0,,"1,130 / 2"
606,607,TUR TUR,Emine DEMIRTAS Busra UNLU,-10,0 - 0,,"1,100 / 2"
607,607,FIN FIN,Tuuli HARKONEN Annmarie OKSA,-10,0 - 0,,"1,100 / 2"
608,607,SUI SUI,Nadia FANKHAUSER Cendrine HANTZ,-10,0 - 0,,"1,100 / 2"
609,607,BEL BEL,Presence BEELEN Ann KNAEPEN,-10,0 - 0,,"1,100 / 2"
610,611,FRA CRO,Yaelle HOYAUX Maja PAVLINIC,-10,0 - 0,,"1,090 / 2"
611,611,HKG HKG,TSANG Wing Chiu Avery CHEUNG Ying Mei,-10,0 - 0,,"1,090 / 2"
612,611,ISL ISL,Sara HOGNADOTTIR Margrét JOHANNSDOTTIR,-10,0 - 0,,"1,090 / 2"
613,614,INA INA,Rika ROSITAWATI Annisa SAUFIKA,-10,0 - 0,,"1,060 / 1"
614,615,UGA UGA,Bridget Shamim BANGI Daisy NAKALYANGO,-9,0 - 0,,922 / 2
615,615,ALG ALG,Halla BOUKSANI Linda MAZRI,-9,0 - 0,,922 / 2
616,617,GHA GHA,Victoria ASMAH Gifty MENSAH,-9,0 - 0,,920 / 2
617,617,COD COD,Kanda MABUTA Katambua ODIA,-9,0 - 0,,920 / 2
618,617,BOT BOT,Kgalalelo KEGAKILWE Botho MAKUBATE,-9,0 - 0,,920 / 2
619,620,BOT BOT,Reitumetse MODISENYANE Leungo Bronia TSHWENEETSILE,-9,0 - 0,,920 / 1
620,620,RSA RSA,Tshepiso Annha Queen DANIELS Anke VAN DER MERWE,-9,0 - 0,,920 / 1
621,620,RSA RSA,Kanupi ROBERTS Karabelo Graticia ROBERTS,-9,0 - 0,,920 / 1
622,620,RSA RSA,Lehandre SCHOEMAN Johanita SCHOLTZ,-9,0 - 0,,920 / 1
623,620,ZAM ZAM,Lucrecia CHISENGA Evelyn SIAMUPANGILA,-9,0 - 0,,920 / 1
624,620,IRL IRL,Kate FROST Moya RYAN,-9,0 - 0,,920 / 1
625,620,IRL ESP,MCINTYRE Norma Laia OSET,-9,0 - 0,,920 / 1
626,620,ITA ITA,Silvia GARINO Lisa IVERSEN,-9,0 - 0,,920 / 1
627,620,ZAM ZAM,Joy CHIKWANDA Penelope MUDENDA,-9,0 - 0,,920 / 1
628,620,ZAM ZAM,Ngandwe MIYAMBO Jenipher PHIRI,-9,0 - 0,,920 / 1
629,620,TPE TPE,Hsiu Yu LIU TAI Ching Chieh,-9,0 - 0,,920 / 1
630,620,MAS MAS,Bao Ying LOH Johanna Adryana SAHA,-9,0 - 0,,920 / 1
631,620,NOR NOR,Cathrine FOSSMO Natalie SYVERTSEN,-9,0 - 0,,920 / 1
632,620,FIN FIN,Sanni RAUTALA Riikka SINKKO,-9,0 - 0,,920 / 1
633,620,DEN DEN,Anne Katrine HANSEN Marie Louise STEFFENSEN,-9,0 - 0,,920 / 1
634,620,ENG ENG,Fee Teng LIEW Miu Lin NGAN,-9,0 - 0,,920 / 1
635,620,ENG ENG,Evie BURBIDGE Lexi GILDERS,-9,0 - 0,,920 / 1
636,620,ENG ENG,Elizabeth MCMORROW Lizzie TOLMAN,-9,0 - 0,,920 / 1
637,620,MLT ESP,SADOWSKI Fiorella Marie Laia OSET,-9,0 - 0,,920 / 1
638,620,BOT BOT,Laone MOSEKIEMANG Maranyane TUELO,-9,0 - 0,,920 / 1
639,620,IRI IRI,HAMEDANCHI AZAD Hale Fatemeh SARVGHADI,-9,0 - 0,,920 / 1
640,620,ARM ARM,Anahit MANUKYAN Marieta NIKOYAN,-9,0 - 0,,920 / 1
641,620,TKM TKM,Alina KLYCHKOVA Yana SARKISYAN,-9,0 - 0,,920 / 1
642,620,AFG AFG,Fatema HAIDARY Somai RAJABI,-9,0 - 0,,920 / 1
643,620,ARM ARM,Knarik MARGARYAN Lilit POGHOSYAN,-9,0 - 0,,920 / 1
644,620,IRI IRI,Zeynab ABDOLKARIM Samin ABEDKHOJASTEH,-9,0 - 0,,920 / 1
645,620,TPE TPE,HUNG Shih Han Wan Ching LIN,-9,0 - 0,,920 / 1
646,620,CHN CHN,GAO Xiaoyuan LIN Liyun,-9,0 - 0,,920 / 1
647,620,ISL ISL,Lina Dora HANNESDOTTIR Jona Kristin HJARTARDOTTIR,-9,0 - 0,,920 / 1
648,620,ISL ISL,Margret FINNBOGADOTTIR Harpa HILMISDOTTIR,-9,0 - 0,,920 / 1
649,620,ISL ISL,Sigridur ARNADOTTIR Rakel JOHANNESDOTTIR,-9,0 - 0,,920 / 1
650,620,ISL ISL,Arna Karen JOHANNSDOTTIR Margret NILSDOTTIR,-9,0 - 0,,920 / 1
651,620,MAS HUN,Yee See CHEAH Laura SAROSI,-9,0 - 0,,920 / 1
652,620,FRA CRO,Lole COURTOIS Maja PAVLINIC,-9,0 - 0,,920 / 1
653,620,ZAM ZAM,Elizaberth CHIPELEME Jenipher PHIRI,-9,0 - 0,,920 / 1
654,620,BOT BOT,Tessa KABELO Kgalalelo KEGAKILWE,-9,0 - 0,,920 / 1
655,620,BOT BOT,Gaone MPATI Onkemetse PHOKONTSE,-9,0 - 0,,920 / 1
656,620,PER PER,Micaela FLORES VASQUEZ DE VELASCO Fernanda SAPONARA RIVVA,-9,0 - 0,,920 / 1
657,620,MAR MAR,Ghita ABDEL WAHID Oumaima ELHERZ,-9,0 - 0,,920 / 1
658,620,JOR JOR,Domou AMRO Mazahreh LEINA FEHMI,-9,0 - 0,,920 / 1
659,620,NGR NGR,Augustina EBHOMIEN SUNDAY Uchechukwu Deborah UKEH,-9,0 - 0,,920 / 1
660,620,ETH ETH,KIDANEMARIAM Eyerusalem LEYIKUN Radiate,-9,0 - 0,,920 / 1
661,620,POL POL,Weronika GRUDZINA WITEK MAGDALENA,-9,0 - 0,,920 / 1
662,620,SIN SIN,Chun Yi Deline QUEK Ai Ninna TAN,-9,0 - 0,,920 / 1
663,620,VIE VIE,Ha Trang LE Thi Mai Anh NGUYEN,-9,0 - 0,,920 / 1
664,620,AUS AUS,Vee Vian CHONG Eugenia TANAKA,-9,0 - 0,,920 / 1
665,620,SRI SRI,Kavindi Ishandika SIRIMANNAGE Oshadie KURUPPU,-9,0 - 0,,920 / 1
666,620,FIN FIN,Riikka SINKKO Noora VIRTA,-9,0 - 0,,920 / 1
667,620,ENG ENG,Hannah PREECE Sarah PREECE,-9,0 - 0,,920 / 1
668,620,ETH ETH,DANIEL Mahlet BERHANU Samrawit,-9,0 - 0,,920 / 1
669,620,ETH ETH,GETACHEW Firehiwot Yerusksew Legssey TURA,-9,0 - 0,,920 / 1
670,620,MAR MAR,Jinane BITARIE Sara ELMERNISSI,-9,0 - 0,,920 / 1
671,620,AZE AZE,Alizada PARVIN Huseynova ZULFIYYA,-9,0 - 0,,920 / 1
672,620,CRO CRO,Mateja CICA Stasa POZNANOVIC,-9,0 - 0,,920 / 1
673,620,ISL ISL,Johanna JOHANNSDOTTIR Sunna Osp RUNOLFSDOTTIR,-9,0 - 0,,920 / 1
674,620,ISL ISL,Tinna HELGADOTTIR Snjolaug JOHANNSDOTTIR,-9,0 - 0,,920 / 1
675,620,TPE TPE,CHEN Shih Ying Ying Chun LIN,-9,0 - 0,,920 / 1
676,620,DEN DEN,Emilie FURBO Karoline SYNNESTVEDT,-9,0 - 0,,920 / 1
677,620,ETH ETH,AFEWORK Rakeb TADESSE Samrawit,-9,0 - 0,,920 / 1
678,620,THA THA,Natthakorn JAIAREREE Laksika KANLAHA,-9,0 - 0,,920 / 1
679,620,VIE VIE,Kim Ngan DANG Thi Thanh Thuy LE,-9,0 - 0,,920 / 1
680,620,CZE CZE,Dominika KURZOVA Ivana ZYCHOVA,-9,0 - 0,,920 / 1
681,620,RUS RUS,Karina NAZAROVA Anastasia REDKINA,-9,0 - 0,,920 / 1
682,620,RUS RUS,Yana IGNATYEVA Kristina VIRVICH,-9,0 - 0,,920 / 1
683,620,SRI SRI,Sithara JANITHANJALI Ruvini Chathurika RATNASIRI,-9,0 - 0,,920 / 1
684,620,SRI SRI,Buthmi Asini GALAGAMAGE Hasara Chathumhari WIJAYARATHNE,-9,0 - 0,,920 / 1
685,620,SRI SRI,Dinushi GUNASEKARA Nayanathara JAYAWEERA HEWAGE,-9,0 - 0,,920 / 1
686,620,MAS MAS,Sin Er NG Harn Xin YAP,-9,0 - 0,,920 / 1
687,620,THA THA,Karnjanavadee BUNSOMBOON Rawimon IAMRATANAMAETHEEKUL,-9,0 - 0,,920 / 1
688,620,AUT AUT,Sonja LANGTHALER Nina SORGER,-9,0 - 0,,920 / 1
689,620,UGA UGA,Najjuka GLORIA Daisy NAKALYANGO,-9,0 - 0,,920 / 1
690,620,BOT BOT,Botho MAKUBATE Tebogo NDZINGE,-9,0 - 0,,920 / 1
691,620,ZAM ZAM,Mary CHILAMBE Evelyn SIAMUPANGILA,-9,0 - 0,,920 / 1
692,620,MRI MRI,Aurelie Marie Elisa ALLET Shaama SANDOOYEA,-9,0 - 0,,920 / 1
693,620,ENG ENG,Paige BUTLER Tsui-Yee LAU,-9,0 - 0,,920 / 1
694,620,SUI SUI,Monika FISCHER Sanya HERZIG,-9,0 - 0,,920 / 1
695,620,GER AUT,Annika HORBACH Sonja LANGTHALER,0,0 - 0,,920 / 1
696,620,GER GER,Ramona HACKS Kira KATTENBECK,-9,0 - 0,,920 / 1
697,620,INA INA,Jenna GOZALI Meiliana JAUHARI,-9,0 - 0,,920 / 1
698,620,INA INA,Violita DEWI Anggriati MUKUAN,-9,0 - 0,,920 / 1
699,620,INA INA,Febby ANGGUNI Ana ROVITA,-9,0 - 0,,920 / 1
700,620,INA INA,Rahma Dwi AMALIA Nur Aini REVANA SARI,-9,0 - 0,,920 / 1
701,620,LAT SVK,Monika RADOVSKA Martina REPISKA,-9,0 - 0,,920 / 1
702,620,SIN SIN,Ren-ne ONG Jia Ying Crystal WONG,-9,0 - 0,,920 / 1
703,620,TPE TPE,HUNG Yi-Ting TAI Wei-Ling,-9,0 - 0,,920 / 1
704,620,KAZ KAZ,Diana FAKHRUTDINOVA Ilyana FILIPCHUK,-9,0 - 0,,920 / 1
705,620,KAZ KAZ,Alina KERIMOVA Violetta YAKUSHEVA,-9,0 - 0,,920 / 1
706,620,KAZ KAZ,Veronika PROTASSOVA NATALYA TOLKACHYOVA,-9,0 - 0,,920 / 1
707,620,KAZ KAZ,KASSENOVA Akbayan Oxsana SHTELLE,-9,0 - 0,,920 / 1
708,620,RUS RUS,Anastasiya BATYROVA Natalya GUSEVA,-9,0 - 0,,920 / 1
709,620,RUS RUS,Mariya MALYGINA Alina ROMANKO,-9,0 - 0,,920 / 1
710,620,RUS RUS,Alina DAVLETOVA Natalia Rogova,-9,0 - 0,,920 / 1
711,620,FRA FRA,Lyndie MITHRA Virginie TESTAN,-9,0 - 0,,920 / 1
712,620,MRI MRI,Kobita DOKHEE Sheem SANDOOYEEA,-9,0 - 0,,920 / 1
713,620,GER GER,Annika HORBACH Fabienne KOEHLER,-9,0 - 0,,920 / 1
714,620,BEL BEL,Lise JAQUES Ann KNAEPEN,-9,0 - 0,,920 / 1
715,620,DEN DEN,Amalie Hertz HANSEN Maja RINDSHOEJ,0,0 - 0,,920 / 1
716,620,SUI SUI,Nicole PERROUD Celine TRIPET,0,0 - 0,,920 / 1
717,620,SUI INA,Ronja STERN Aprillia YUSWANDARI,0,0 - 0,,920 / 1
718,620,SUI SUI,Sanya HERZIG Michelle SCHAER,0,0 - 0,,920 / 1
719,620,BUL BUL,Rumiana IVANOVA Eva TONEVA,-9,0 - 0,,920 / 1
720,620,ARM ARM,Marieta NIKOYAN Lilit POGHOSYAN,-9,0 - 0,,920 / 1
721,620,RUS RUS,Evgenia DIMOVA Natalia Rogova,-9,0 - 0,,920 / 1
722,620,NGR NGR,Odunayo ADEKUNLE Juliana JACOB,-9,0 - 0,,920 / 1
723,620,NGR NGR,Zainab AKINYEMI Olabisi IBIYEYE,-9,0 - 0,,920 / 1
724,620,NGR NGR,Ruth AIYENUGBA Patricia AKPUSUGH,-9,0 - 0,,920 / 1
725,620,ETH ETH,Meaza FISSHA Lidia TADESE,-9,0 - 0,,920 / 1
726,620,AUS AUS,Grace HANRATTY Louisa MA,-9,0 - 0,,920 / 1
727,620,AUS AUS,Joy LAI Talia SAUNDERS,-9,0 - 0,,920 / 1
728,620,CGO CGO,Minelie KASSANGOYI Aisse SOUKOUMA,-9,0 - 0,,920 / 1
729,620,GHA GHA,Eunice ARTHUR Grace ATIPAKA,-9,0 - 0,,920 / 1
730,620,CGO CGO,Benele ISSOKO Bztecho LOUBAKI,-9,0 - 0,,920 / 1
731,620,ESP DEN,Isabel FERNANDEZ Ditte SØBY HANSEN,-9,0 - 0,,920 / 1
732,620,MDV MDV,Maisa Fathuhulla ISMAIL Aishath Afnaan RASHEED,-9,0 - 0,,920 / 1
733,620,PER PER,Thaina BELLIDO GARCIA Andrea ECHEVARRIA OSSA,-9,0 - 0,,920 / 1
734,620,DEN DEN,Sofie Zacho VESTERGAARD Amalie VESTMAR,-9,0 - 0,,920 / 1
735,620,TPE TPE,Hsin Tien CHANG Shuo Yun SUNG,-9,0 - 0,,920 / 1
736,620,JPN JPN,Momoka KIMURA Shizuka Uchida,-9,0 - 0,,920 / 1
737,620,JPN JPN,Hikari SAITO Chiharu SHIDA,-9,0 - 0,,920 / 1
738,620,JPN JPN,Sebun NAGAI Nagisa YURA,-9,0 - 0,,920 / 1
739,620,SWE SWE,Amanda ANDERN Berfin ASLAN,-9,0 - 0,,920 / 1
740,620,FIN FIN,Noora AHOLA Jenni RAUTIAINEN,-9,0 - 0,,920 / 1
741,620,FIN FIN,Pihla LINDBERG Inalotta SUUTARINEN,-9,0 - 0,,920 / 1
