,RANK,COUNTRY,PLAYER,CHANGE +/-,WIN - LOSE,PRIZE MONEY,POINTS / TOURNAMENTS
358,334,ESA ESA,URRUTIA Cecilia Georgina Penelope ORELLANA SANTOS,-3,0 - 0,,"2,200 / 1"
359,334,RUS RUS,Anastasia NAZARCHUK Anastasia STOGOVA,-3,0 - 0,,"2,200 / 1"
360,334,FRA FRA,Marie BATOMENE Lorraine BAUMANN,-3,0 - 0,,"2,200 / 1"
361,334,CAN CAN,Rachel HONDERICH Brittney TAM,-3,0 - 0,,"2,200 / 1"
362,363,FRA FRA,Marie BATOMENE Anne TRAN,-5,0 - 0,,"2,130 / 1"
363,363,JOR JOR,Domou AMRO Mazahreh LEINA FEHMI,-5,0 - 0,,"2,130 / 1"
364,363,NED NED,Myke HALKEMA Lisa MALAIHOLLO,-5,0 - 0,,"2,130 / 1"
365,363,THA THA,Thidarat KLEEBYEESOON Ruethaichanok LAISUAN,-5,0 - 0,,"2,130 / 1"
366,363,ENG ENG,Chloe BIRCH Jessica PUGH,-5,0 - 0,,"2,130 / 1"
367,363,KOR KOR,Soo Bin LIM OH Bo Kyung,-5,0 - 0,,"2,130 / 1"
368,363,RSA RSA,Stacey DOUBELL Jade KRAEMER,-5,0 - 0,,"2,130 / 1"
369,370,HKG HKG,CHAN Hung Yung POON Lok Yan,-5,0 - 0,,"2,110 / 1"
370,370,JAM JAM,Ruth WILLIAMS Katherine WYNTER,-5,0 - 0,,"2,110 / 1"
371,370,NZL NZL,Justine VILLEGAS Tegan WESTON,-5,0 - 0,,"2,110 / 1"
372,370,COK COK,Ngaoa RANGINUI Kate SCOTT,-5,0 - 0,,"2,110 / 1"
373,370,NZL AUS,Maria MASINIPENI Melinda SUN,-5,0 - 0,,"2,110 / 1"
374,370,NZL AUS,Ashleigh KARL Ruwindi SERASINGHE,-5,0 - 0,,"2,110 / 1"
375,370,CUB CUB,Melissa AZCUY PEREZ Tahimara OROPEZA,-5,0 - 0,,"2,110 / 1"
376,370,RUS RUS,Evgenia DIMOVA Nina VISLOVA,-5,0 - 0,,"2,110 / 1"
377,370,KOR KOR,KIM So Yeong Hee Yong KONG,-5,0 - 0,,"2,110 / 1"
378,370,SCO SCO,Rebekka FINDLAY Kirsten GEALS,-5,0 - 0,,"2,110 / 1"
379,370,USA USA,Yoshiko COHN SCHAFER Rong,-5,0 - 0,,"2,110 / 1"
380,381,IND IND,Teenu DAHIYA Meenu SINGH,-5,0 - 0,,"2,100 / 2"
381,381,IND IND,Parssa NAQVI Saruni SHARMA,-5,0 - 0,,"2,100 / 2"
382,383,TUR TUR,Ilayda Nur OZELGUL Dilara SUBASI,405,0 - 0,,"2,070 / 2"
383,383,BUL BUL,Tsveti ASENOVA Mila IVANOVA,-5,0 - 0,,"2,070 / 2"
384,383,FRA FRA,Manon KRIEGER Juliane PIRON,-5,0 - 0,,"2,070 / 2"
385,386,FRA FRA,Marie BATOMENE Teshana VIGNES WARAN,-6,0 - 0,,"2,050 / 2"
386,387,INA INA,Dwi Wahyuni ASHYARIATY Fransisca Angelica RAHARDJA,-6,0 - 0,,"2,020 / 3"
387,388,SIN SIN,Hui Zhen Grace CHUA Ai Ninna TAN,-6,0 - 0,,"1,980 / 3"
388,389,AUS AUS,Tiffany HO Janet SON,-6,0 - 0,,"1,950 / 2"
389,389,JPN JPN,Atsuko KOIKE Midori SAKURAI,-6,0 - 0,,"1,950 / 2"
390,391,SWE SWE,Emelie FABBEKE Emma WENGBERG,-6,0 - 0,,"1,860 / 1"
391,392,NOR NOR,Anne KLYVE Helene SOGAARD,-6,0 - 0,,"1,850 / 4"
392,393,TPE TPE,Su Yu CHEN Yu-Ting HUANG,-6,0 - 0,,"1,840 / 2"
393,393,THA THA,Ruethaichanok LAISUAN Supamart MINGCHUA,-6,0 - 0,,"1,840 / 2"
394,393,ENG ENG,Paige BUTLER Tsui-Yee LAU,-6,0 - 0,,"1,840 / 2"
395,393,MAS MAS,Kah Mun CHIN Wei Chyi TI,-6,0 - 0,,"1,840 / 2"
396,393,GRE GRE,Ioanna KARAPETRIDOU Polyvia TZIKA,-6,0 - 0,,"1,840 / 2"
397,393,PHI PHI,Joella Geva DE VERA Jessie FRANCISCO,-6,0 - 0,,"1,840 / 2"
398,393,THA THA,Pattaranan CHAMNAKTAN Sanicha CHUMNIBANNAKARN,-6,0 - 0,,"1,840 / 2"
399,393,MAC MAC,Xue Xin GONG Weng Chi NG,-6,0 - 0,,"1,840 / 2"
400,393,BUL BUL,Mariya MITSOVA Dimitria POPSTOIKOVA,-6,0 - 0,,"1,840 / 2"
401,393,NOR NOR,Charlotte LEINAN Marlene WÅLAND,-6,0 - 0,,"1,840 / 2"
402,403,GRE GRE,Ioanna KARAPETRIDOU Irini TENTA,-6,0 - 0,,"1,820 / 3"
403,403,LAT LAT,Liana LENCEVICA Jekaterina ROMANOVA,-6,0 - 0,,"1,820 / 3"
404,405,TPE TPE,Ya-Han CHANG WANG Pei Rong,-6,0 - 0,,"1,800 / 2"
405,406,HUN GER,Daniella GONDA Annika HORBACH,-6,0 - 0,,"1,780 / 3"
406,407,FRA FRA,Vimala HERIAU Margot LAMBERT,-6,0 - 0,,"1,770 / 2"
407,408,MAS MAS,Jin Wei GOH Ying Ying LEE,-6,0 - 0,,"1,750 / 1"
408,408,DEN DEN,Iben BERGSTEIN Line Fleischer NIELSEN,-6,0 - 0,,"1,750 / 1"
409,408,DEN DEN,Irina Amalie ANDERSEN Amalie Hertz HANSEN,-6,0 - 0,,"1,750 / 1"
410,408,INA INA,Jenna GOZALI Shendy Puspa IRAWATI,-6,0 - 0,,"1,750 / 1"
411,408,FRA FRA,Delphine DELRUE Anne TRAN,-6,0 - 0,,"1,750 / 1"
412,408,MRI NGR,Kate FOO KUNE Grace GABRIEL,-6,0 - 0,,"1,750 / 1"
413,408,INA INA,Ririn AMELIA Komala DEWI,-6,0 - 0,,"1,750 / 1"
414,408,INA INA,Marsheilla Gischa ISLAMI Rahmadhani Hasiyanti PUTRI,-6,0 - 0,,"1,750 / 1"
415,408,SUR SUR,Rugshaar ISHAAK Santusha RAMZAN,-6,0 - 0,,"1,750 / 1"
416,408,SRI KAZ,Lekha SHEHANI Veronika SOROKINA,-6,0 - 0,,"1,750 / 1"
417,408,SUI SUI,Nadia FANKHAUSER Celine TRIPET,-6,0 - 0,,"1,750 / 1"
418,408,KOR KOR,Min Ji CHOI Han Na YOON,-6,0 - 0,,"1,750 / 1"
419,408,RSA RSA,Louise HEDBERG Anri SCHOONEES,-6,0 - 0,,"1,750 / 1"
420,408,RSA RSA,Lee-Ann DE WET Jennifer FRY,-6,0 - 0,,"1,750 / 1"
421,408,ZAM ZAM,Ngandwe MIYAMBO Delphine NAKANYIKA,-6,0 - 0,,"1,750 / 1"
422,408,PER ECU,Daniela MACIAS Maria Delia ZAMBRANO,-6,0 - 0,,"1,750 / 1"
423,408,BRN BRN,Neha JOJO Sandra SAKARIA,-6,0 - 0,,"1,750 / 1"
424,408,JOR JOR,Sham AL-KHALILI Haneen Derar AL-WEDYAN,-6,0 - 0,,"1,750 / 1"
425,408,NGR NGR,Dorcas Ajoke ADESOKAN Asisat OGUNKANBI,-6,0 - 0,,"1,750 / 1"
426,408,ETH ETH,Tigist GETACHEW Kidist HAILU,-6,0 - 0,,"1,750 / 1"
427,408,GUA GUA,Sara Michele BARRIOS CHIONG Alejandra SAMAYOA ARREAGA,-6,0 - 0,,"1,750 / 1"
428,429,DEN DEN,Anna KLINKE Maja RINDSHOEJ,-5,0 - 0,,"1,730 / 2"
429,430,MAS MAS,SEE To Chia Vern Wei Chyi TI,-5,0 - 0,,"1,670 / 1"
430,430,MAS MAS,Kah Mun CHIN Yen Wei PECK,-5,0 - 0,,"1,670 / 1"
431,430,IND IND,Lalita DAHIYA Seema PANCHAL,-5,0 - 0,,"1,670 / 1"
432,430,IND IND,Juhi DEWANGAN Smriti NAGARKOTI,-5,0 - 0,,"1,670 / 1"
433,430,IND IND,Pragya RAI VADDEPALLY Pramada,-5,0 - 0,,"1,670 / 1"
434,430,FRA FRA,Emilie BEAUJEAN Joanna CHAUBE,-5,0 - 0,,"1,670 / 1"
435,430,SUI SUI,Cendrine HANTZ Sanya HERZIG,-5,0 - 0,,"1,670 / 1"
436,430,IND IND,Daksha GAUTAM Rachita SAHDEV,-5,0 - 0,,"1,670 / 1"
437,430,MAC MAC,Xue Xin GONG Chi Leng KUAN,-5,0 - 0,,"1,670 / 1"
438,430,MAC MAC,IEONG Pek San Teng Iok U,-5,0 - 0,,"1,670 / 1"
439,430,BUL SUI,Diana DIMOVA Celine TRIPET,-5,0 - 0,,"1,670 / 1"
440,430,TPE TPE,CHEN Shih Ying Su Yu CHEN,-5,0 - 0,,"1,670 / 1"
441,430,IND IND,Sanskriti CHHABRA Ekta KALIA,-5,0 - 0,,"1,670 / 1"
442,430,SUI SUI,Susanne KELLER Yvonne KELLER,-5,0 - 0,,"1,670 / 1"
443,430,TPE TPE,Shuo Yun SUNG Chien Hui YU,-5,0 - 0,,"1,670 / 1"
444,430,KOR KOR,KIM So Yeong GO Ah Ra,-5,0 - 0,,"1,670 / 1"
445,430,AUS AUS,Hsuan-Yu Wendy CHEN Gronya SOMERVILLE,-5,0 - 0,,"1,670 / 1"
446,430,NZL NZL,Gaea GALVEZ Tamara OTENE,-5,0 - 0,,"1,670 / 1"
447,430,KOR KOR,Min Ji KIM Ye Ji KIM,-5,0 - 0,,"1,670 / 1"
448,430,KOR KOR,Yoon You KIM Jung Hwa KO,-5,0 - 0,,"1,670 / 1"
449,430,KOR KOR,Tae Hee KIM Soo Hee SEO,-5,0 - 0,,"1,670 / 1"
450,430,KOR KOR,Jung Bin JI Ga Eun KIM,-5,0 - 0,,"1,670 / 1"
451,430,KOR KOR,Ki Bbeum SONG Min Ah YOON,-5,0 - 0,,"1,670 / 1"
452,430,KOR KOR,Ye Na LEE Yeon Soo PARK,-5,0 - 0,,"1,670 / 1"
453,430,KOR KOR,KIM Chan Mi Bo Ram LEE,-5,0 - 0,,"1,670 / 1"
454,430,KOR KOR,Young Seo CHO Sang Eun PARK,-5,0 - 0,,"1,670 / 1"
455,430,GER GER,Ramona HACKS Annika HORBACH,-5,0 - 0,,"1,670 / 1"
456,430,THA THA,Pattaranan CHAMNAKTAN Kwanchanok SUDJAIPRAPARAT,-5,0 - 0,,"1,670 / 1"
457,430,AUS INA,Hsuan-Yu Wendy CHEN SUSANTO Yulia Yosephin,-5,0 - 0,,"1,670 / 1"
458,430,THA THA,Natchpapha CHATUPORNKARNCHANA Sanicha CHUMNIBANNAKARN,-5,0 - 0,,"1,670 / 1"
459,430,THA THA,Suchanya KANCHANASAKA Kornkamon SUKKLAD,-5,0 - 0,,"1,670 / 1"
460,430,USA ENG,Ariel LEE Jenny WALLWORK,-5,0 - 0,,"1,670 / 1"
461,430,NZL NZL,Kelly STERN Justine VILLEGAS,-5,0 - 0,,"1,670 / 1"
462,430,INA INA,Rena ASELA Monika Intan TUTIHARTA,-5,0 - 0,,"1,670 / 1"
463,464,ETH ETH,BERHANU Samrawit Yerusksew Legssey TURA,-5,0 - 0,,"1,522 / 2"
464,465,CRO CZE,Stasa POZNANOVIC Katerina TOMALOVA,-5,0 - 0,,"1,520 / 2"
465,466,BRA BRA,Samia LIMA Gabriela SANTOS,-5,0 - 0,,"1,520 / 1"
466,466,BRA BRA,Isamara AGUIAR Talita CASONATTO,-5,0 - 0,,"1,520 / 1"
467,466,BRA BRA,Thayse CRUZ Paloma Eduarda da SILVA,-5,0 - 0,,"1,520 / 1"
468,466,JPN JPN,Natsuki SONE Yukiko TAKAHATA,-5,0 - 0,,"1,520 / 1"
469,466,JPN JPN,Yumi MURAYAMA Natsumi URATANI,-5,0 - 0,,"1,520 / 1"
470,466,JPN JPN,Reimi MOMOI Nao ONO,-5,0 - 0,,"1,520 / 1"
471,466,NGR NGR,Ruth AIYENUGBA Grace IJADARE,-5,0 - 0,,"1,520 / 1"
472,466,NGR NGR,Zainab AKINYEMI Adijat ONASANYA,-5,0 - 0,,"1,520 / 1"
473,466,MAS MAS,Lyddia Yi Yu CHEAH Li Lian YANG,-5,0 - 0,,"1,520 / 1"
474,466,INA INA,Brigita Marcelia RUMAMBI Engelica WIRATAMA,-5,0 - 0,,"1,520 / 1"
475,466,GUA GUA,Sherly HERNANDEZ MEZ Ana Vanessa TONG CALIX,-5,0 - 0,,"1,520 / 1"
476,466,GUA GUA,Sara Michele BARRIOS CHIONG Alejandra Jose PAIZ QUAN,-5,0 - 0,,"1,520 / 1"
477,466,GUA GUA,Jaqueline ALVAREZ MOLINEROS Eliza Monica RAYMUNDO ALVAREZ,-5,0 - 0,,"1,520 / 1"
478,466,GUA GUA,Maria Regina DEL VALLE LEYSBETH Alejandra SAMAYOA ARREAGA,-5,0 - 0,,"1,520 / 1"
479,466,IRQ IRQ,AL-BAYATI Inas Khalid Rashid Adhraa KH RASHID,-5,0 - 0,,"1,520 / 1"
480,466,IRI IRI,Sara KEYVAN SHABIHI Yasamin,-5,0 - 0,,"1,520 / 1"
481,466,UKR UKR,Larisa GRIGA Elena PRUS,-5,0 - 0,,"1,520 / 1"
482,466,BAN BAN,Aktar SHAPLA Alina SULTANA,-5,0 - 0,,"1,520 / 1"
483,466,SLO SLO,Kaja STANKOVIC Tina KODRIC,-5,0 - 0,,"1,520 / 1"
484,466,NGR NGR,Tosin Damilola ATOLAGBE Fatima AZEEZ,-5,0 - 0,,"1,520 / 1"
485,466,JPN JPN,Karin HIRANO Haruka OSAKO,-5,0 - 0,,"1,520 / 1"
486,466,JPN JPN,Minami KAWASHIMA Nami MATSUYAMA,-5,0 - 0,,"1,520 / 1"
487,466,SRI SRI,WADUTHANTRI Kavindika Binari De Silva DAYARATHNE Yasmitha Sankapale,-5,0 - 0,,"1,520 / 1"
488,466,NGR NGR,Olabisi IBIYEYE Oluwatosin SOLADEMI,-5,0 - 0,,"1,520 / 1"
489,466,INA INA,Nisak Puji LESTARI Rika ROSITAWATI,-5,0 - 0,,"1,520 / 1"
490,466,NEP NEP,Nangsal TAMANG Sara Devi TAMANG,-5,0 - 0,,"1,520 / 1"
491,466,DEN DEN,Julie Dawall JAKOBSEN Sara LUNDGAARD,-5,0 - 0,,"1,520 / 1"
492,466,CHN CHN,AN Yu ZHENG Yuwen,-5,0 - 0,,"1,520 / 1"
493,466,BUL BUL,Aneta Yaneva DUKOVA Petya NEDELCHEVA,-5,0 - 0,,"1,520 / 1"
494,466,IRI IRI,Moloud ESMAEILI Sahabeh FARD,-5,0 - 0,,"1,520 / 1"
495,466,GUA GUA,Diana Giselle FUENTES RIVERA Andrea Maria MORALES GUIROLA,-5,0 - 0,,"1,520 / 1"
496,466,ENG ENG,Sian KELLY Sophie MALES,-5,0 - 0,,"1,520 / 1"
497,466,WAL ENG,Emilie GWILT Rachel VICKERS,-5,0 - 0,,"1,520 / 1"
498,466,ENG ENG,Til'Shiloh SHAW Grace TAYLOR,-5,0 - 0,,"1,520 / 1"
499,466,NEP NEP,Amita GIRI Sichhya SHRESTHA,-5,0 - 0,,"1,520 / 1"
500,466,SIN SIN,Yun LIANG Xi Qing ONG,-5,0 - 0,,"1,520 / 1"
501,466,BAN BAN,Dulali HALDAR Bristy KHATUN,-5,0 - 0,,"1,520 / 1"
502,466,IND IND,Seema PANCHAL VADDEPALLY Pramada,-5,0 - 0,,"1,520 / 1"
503,466,INA INA,Sima Fatma KUSUMA Austin Cindy PRATIWI,-5,0 - 0,,"1,520 / 1"
504,466,IND IND,Ningshi Block HAZARIKA Harika VELUDURTHI,-5,0 - 0,,"1,520 / 1"
505,466,IND IND,Lalita DAHIYA Parssa NAQVI,-5,0 - 0,,"1,520 / 1"
506,466,IND IND,Shruti MUNDADA Anura PRABHUDESAI,-5,0 - 0,,"1,520 / 1"
507,466,IND IND,Pragya RAI Saruni SHARMA,-5,0 - 0,,"1,520 / 1"
508,466,KAZ BLR,Veronika SOROKINA Alesia ZAITSAVA,0,0 - 0,,"1,520 / 1"
509,466,TPE TPE,Ya-Han CHANG YU Wen KUO,-5,0 - 0,,"1,520 / 1"
510,466,MAS MAS,Rui Chen YAP Yee YAP,-5,0 - 0,,"1,520 / 1"
511,466,TPE TPE,Ling Fang HU Chien Hui YU,-5,0 - 0,,"1,520 / 1"
512,466,UKR UKR,Anastasiya PROZOROVA Valeriya RUDAKOVA,-5,0 - 0,,"1,520 / 1"
513,466,UKR UKR,Anna ANDRUSHKO Yevgeniya PAKSYUTOVA,-5,0 - 0,,"1,520 / 1"
514,466,UKR UKR,Nataliia GOLOVKINA NADTOCHIY Olga,-5,0 - 0,,"1,520 / 1"
515,466,FRA FRA,Delphine DELRUE Lea PALERMO,-5,0 - 0,,"1,520 / 1"
516,466,NED BEL,Cheryl SEINEN Flore VANDENHOUCKE,-5,0 - 0,,"1,520 / 1"
517,466,FRA FRA,Lorraine BAUMANN Verlaine FAULMANN,-5,0 - 0,,"1,520 / 1"
518,466,AUS AUS,Elena Yee-Man KWOK Akane SEKIBA,-5,0 - 0,,"1,520 / 1"
519,466,NZL NZL,Celine SHAO Selena WU,-5,0 - 0,,"1,520 / 1"
520,466,IND IND,Daksha GAUTAM Seema PANCHAL,-5,0 - 0,,"1,520 / 1"
521,466,DEN LAT,Camilla MARTENS Monika RADOVSKA,-5,0 - 0,,"1,520 / 1"
522,466,UKR UKR,Maryna ILYINSKAYA Darya SAMARCHANTS,-5,0 - 0,,"1,520 / 1"
523,466,AUS AUS,Kay CHAN Michelle TAM,-5,0 - 0,,"1,520 / 1"
524,466,AUS AUS,Ysabel SAY Jodee VEGA,-5,0 - 0,,"1,520 / 1"
525,526,AUT AUT,Katrin NEUDOLT Bianca SCHIESTER,-6,0 - 0,,"1,470 / 2"
526,526,FIN FIN,Noora AHOLA Linnea VAINULA,-6,0 - 0,,"1,470 / 2"
527,526,EST EST,Kertu MARGUS Laura TOMBAND,-6,0 - 0,,"1,470 / 2"
528,526,FIN FIN,Pihla LINDBERG Inalotta SUUTARINEN,-6,0 - 0,,"1,470 / 2"
529,526,INA INA,Tania Oktaviani KUSUMAH Vania Arianti SUKOCO,-6,0 - 0,,"1,470 / 2"
530,526,UKR UKR,Maryna ILYINSKAYA Anna MIKHALKOVA,-6,0 - 0,,"1,470 / 2"
531,526,INA INA,Maria Natalia Kartika MAINAKY Monika SANDIA,-6,0 - 0,,"1,470 / 2"
532,526,DEN DEN,Amalie Hertz HANSEN Maja RINDSHOEJ,-6,0 - 0,,"1,470 / 2"
533,534,DEN DEN,Cecilie FINNE-IPSEN Julie FINNE-IPSEN,-6,0 - 0,,"1,440 / 2"
534,534,MAS MAS,Erica Pei Shan KHOO SEE To Chia Vern,-6,0 - 0,,"1,440 / 2"
535,536,TPE TPE,CHIU Yi Ju LIU Hsiao-Jo,-6,0 - 0,,"1,420 / 2"
536,537,AUS AUS,Ruwindi SERASINGHE Alice WU,-6,0 - 0,,"1,420 / 1"
537,537,SLO SLO,Nika ARIH Petra POLANC,-6,0 - 0,,"1,420 / 1"
538,539,BUL BUL,Maria DELCHEVA Paola KIROVA,-6,0 - 0,,"1,370 / 1"
539,539,RUS RUS,Ksenia EVGENOVA Maria SHEGUROVA,-6,0 - 0,,"1,370 / 1"
540,539,RUS RUS,Anastasiia SEMENOVA Yulia VASILYEVA,-6,0 - 0,,"1,370 / 1"
541,539,FRA FRA,Verlaine FAULMANN Katia NORMAND,-6,0 - 0,,"1,370 / 1"
542,539,KAZ RUS,Vladlena KHARCHENKO Polina VORONKO,-6,0 - 0,,"1,370 / 1"
543,539,KAZ KAZ,Yelizaveta KHARCHENKO Ademi SERIKBAYEVA,-6,0 - 0,,"1,370 / 1"
544,539,FRA FRA,Lise ORONOZ Diela PERIANAYAGOM,-6,0 - 0,,"1,370 / 1"
545,539,GRE GRE,Anna Maria FARSAKOGLOU Angeliki GEORGIADOU,-6,0 - 0,,"1,370 / 1"
546,539,CUB CUB,Adriana ARTIZ ATAURY Tahimara OROPEZA,-6,0 - 0,,"1,370 / 1"
547,539,CUB CUB,Yuvisleydis RAMIREZ CHAPMAN Laura Ines RODRIGUEZ PALACIO,-6,0 - 0,,"1,370 / 1"
548,539,UGA UGA,Annet NAKAMYA Norah NASSIMBWA,-6,0 - 0,,"1,370 / 1"
549,539,UGA ZAM,Bridget Shamim BANGI Ogar SIAMUPANGILA,-6,0 - 0,,"1,370 / 1"
550,539,ENG ENG,Jessica HOPTON Lydia Jane POWELL,-6,0 - 0,,"1,370 / 1"
551,539,TGA TGA,Lusia Ki Taulanga FAUKAFA Litea Lupe Moe Valu TATAFU,-6,0 - 0,,"1,370 / 1"
552,539,ZAM ZAM,Mary CHILAMBE Evelyn SIAMUPANGILA,-6,0 - 0,,"1,370 / 1"
553,539,FRA FRA,Marthe GUICHARD Audrey LEBON,-6,0 - 0,,"1,370 / 1"
554,539,SUI SUI,Cendrine HANTZ Tiffany GIRONA,-6,0 - 0,,"1,370 / 1"
555,539,TPE TPE,Wen Chi HSU I-Ting LAI,-6,0 - 0,,"1,370 / 1"
556,539,POL POL,Magdalena MACHNIK Kornelia MARCZAK,-6,0 - 0,,"1,370 / 1"
557,539,MGL MGL,Saikhantuul BANZRAGCH Narantsetseg BAYARSAIKHAN,-6,0 - 0,,"1,370 / 1"
558,539,ZAM ZAM,Penelope MUDENDA Jenipher PHIRI,-6,0 - 0,,"1,370 / 1"
559,539,ZAM ZAM,Towela GONDWE Matildah KALANDANYA,-6,0 - 0,,"1,370 / 1"
560,539,ZAM ZAM,Joy CHIKWANDA Nieces CHISENGA,-6,0 - 0,,"1,370 / 1"
561,539,SWE SWE,Madeleine PERSSON Behnaz PIRZAMANBEIN,-6,0 - 0,,"1,370 / 1"
562,539,MAR MAR,Jinane BITARIE Oumaima ELHERZ,-6,0 - 0,,"1,370 / 1"
563,539,BRA BRA,Ana Paula CAMPOS Thalita CORREA,-6,0 - 0,,"1,370 / 1"
564,539,BRA BRA,Claudia LOW Estefane VENTURA,-6,0 - 0,,"1,370 / 1"
565,539,TPE TPE,Xiao Min LIN Nien-Tsen TSAI,-6,0 - 0,,"1,370 / 1"
566,539,SIN SIN,Hui Zhen Grace CHUA Ren-ne ONG,-6,0 - 0,,"1,370 / 1"
567,539,GHA GHA,Grace ATIPAKA Gifty MENSAH,-6,0 - 0,,"1,370 / 1"
568,539,MGL MGL,Dashdondov BULGAMAA Kherlen DARKHANBAATAR,-6,0 - 0,,"1,370 / 1"
569,539,MGL MGL,Khulangoo BAATAR Munkhchimeg MENDBAYAR,-6,0 - 0,,"1,370 / 1"
570,539,MGL MGL,Khaliunaa BYAMBAA Undrakh DELGERMAA,-6,0 - 0,,"1,370 / 1"
571,539,COL COL,Tatiana CAICEDO MUNOZ Liceth Camila SANCHEZ LOZANO,-6,0 - 0,,"1,370 / 1"
572,539,CHI CHI,Jenny CEPEDA Belen TRONCOSO,-6,0 - 0,,"1,370 / 1"
573,539,COL COL,Juliana GIRALDO Karen PATIÑO,-6,0 - 0,,"1,370 / 1"
574,539,COL COL,Laura Valentina LONDONO Cristina RAMIREZ,-6,0 - 0,,"1,370 / 1"
575,576,CAN CAN,Joanne Yu CHEN Kyleigh O’DONOGHUE,-4,0 - 0,,"1,290 / 1"
576,576,USA USA,Ariel LEE Sydney LEE,-4,0 - 0,,"1,290 / 1"
577,576,RUS RUS,Valeriia MAKKOVEEVA Daria RADCHENKO,-4,0 - 0,,"1,290 / 1"
578,576,SUI SUI,Sabrina JAQUET Ayla HUSER,-4,0 - 0,,"1,290 / 1"
579,576,HKG HKG,NG Wing Yung CHEUNG Ying Mei,-4,0 - 0,,"1,290 / 1"
580,576,USA USA,Panita PHONGASAVITHAS Vimla PHONGASAVITHAS,-4,0 - 0,,"1,290 / 1"
581,576,MAC MAC,CHAN Kit Lei Chi Leng KUAN,-4,0 - 0,,"1,290 / 1"
582,576,TPE TPE,Ying Chun LIN LIU Hsi Hsia,-4,0 - 0,,"1,290 / 1"
583,576,TPE TPE,Min Hsuan LI TAI Wei-Ling,-4,0 - 0,,"1,290 / 1"
584,576,MEX MEX,Anahi Paola DE LA TORRE MARTINEZ Adriana Irais VALERO MATA,0,0 - 0,,"1,290 / 1"
585,576,MEX MEX,Yaqueline DUARTE Adelina QUIÑONES,0,0 - 0,,"1,290 / 1"
586,576,WAL ENG,Jordan HART Jessica HOPTON,-4,0 - 0,,"1,290 / 1"
587,576,SCO SCO,Ciara TORRANCE Toni WOODS,-4,0 - 0,,"1,290 / 1"
588,576,TPE TPE,Yu Min HSIAO YEH Chiu Yu,-4,0 - 0,,"1,290 / 1"
589,576,TPE TPE,Yu Chieh CHENG Ling Fang HU,-4,0 - 0,,"1,290 / 1"
590,591,FRA FRA,Yaelle HOYAUX Katia NORMAND,-6,0 - 0,,"1,270 / 2"
591,591,LTU LTU,Vytaute FOMKINAITE Gerda VOITECHOVSKAJA,-6,0 - 0,,"1,270 / 2"
592,593,THA THA,Benyapa AIMSAARD Pattarasuda CHAIWAN,-6,0 - 0,,"1,210 / 2"
593,594,NZL NZL,Felicity LEYDON-DAVIS Danielle TAHURI,-6,0 - 0,,"1,170 / 1"
594,594,CZE CZE,Tereza SVABIKOVA Katerina TOMALOVA,-6,0 - 0,,"1,170 / 1"
595,594,EGY EGY,Salma ASHRAF MOHAMED Noran Hassan EL BANNA,-6,0 - 0,,"1,170 / 1"
596,594,JOR JOR,Haneen Derar AL-WEDYAN Mazahreh LEINA FEHMI,-6,0 - 0,,"1,170 / 1"
597,598,CZE CZE,Dominika BUDZELOVA Tereza SVABIKOVA,-6,0 - 0,,"1,150 / 2"
598,599,INA INA,Riska Ayu INDAH SARI Dewi Setyo RAHMAWATI,-6,0 - 0,,"1,130 / 2"
599,600,POL POL,WITEK MAGDALENA Aneta WOJTKOWSKA,-6,0 - 0,,"1,100 / 2"
600,600,NOR NOR,Solvar FLATEN JORGENSEN Linn Lilian STENRUD,-6,0 - 0,,"1,100 / 2"
601,600,SUI SUI,Nadia FANKHAUSER Cendrine HANTZ,-6,0 - 0,,"1,100 / 2"
602,600,BEL BEL,Presence BEELEN Ann KNAEPEN,-6,0 - 0,,"1,100 / 2"
603,600,ROU ROU,Andra OLARIU Sonia OLARIU,-6,0 - 0,,"1,100 / 2"
604,605,SWE SWE,Linda Marie DANIELSSON Rebecca JOHNSSON,-6,0 - 0,,"1,090 / 2"
605,605,ISL ISL,Sara HOGNADOTTIR Margrét JOHANNSDOTTIR,-6,0 - 0,,"1,090 / 2"
606,607,INA INA,Rika ROSITAWATI Annisa SAUFIKA,-6,0 - 0,,"1,060 / 1"
607,608,FRA FRA,Joanna CHAUBE Verlaine FAULMANN,-6,0 - 0,,"1,030 / 2"
608,609,UGA UGA,Bridget Shamim BANGI Daisy NAKALYANGO,-6,0 - 0,,922 / 2
609,609,ALG ALG,Halla BOUKSANI Linda MAZRI,-6,0 - 0,,922 / 2
610,611,GHA GHA,Victoria ASMAH Gifty MENSAH,-6,0 - 0,,920 / 2
611,611,COD COD,Kanda MABUTA Katambua ODIA,-6,0 - 0,,920 / 2
612,611,BOT BOT,Kgalalelo KEGAKILWE Botho MAKUBATE,-6,0 - 0,,920 / 2
613,614,ARM ARM,Anahit MANUKYAN Marieta NIKOYAN,-6,0 - 0,,920 / 1
614,614,IRI IRI,HAMEDANCHI AZAD Hale Fatemeh SARVGHADI,-6,0 - 0,,920 / 1
615,614,PER PER,Micaela FLORES VASQUEZ DE VELASCO Fernanda SAPONARA RIVVA,-6,0 - 0,,920 / 1
616,614,PER PER,Thaina BELLIDO GARCIA Andrea ECHEVARRIA OSSA,-6,0 - 0,,920 / 1
617,614,CHN CHN,XU Wei Manlin YANG,-6,0 - 0,,920 / 1
618,614,AUT AUT,Antonia MEINKE Carina MEINKE,-6,0 - 0,,920 / 1
619,614,UGA UGA,Suzan ASANO Olivia NAKAJJA,-6,0 - 0,,920 / 1
620,614,ZAM ZAM,Elizaberth CHIPELEME Evelyn SIAMUPANGILA,-6,0 - 0,,920 / 1
621,614,TKM TKM,Alina KLYCHKOVA Yana SARKISYAN,-6,0 - 0,,920 / 1
622,614,AFG AFG,Fatema HAIDARY Somai RAJABI,-6,0 - 0,,920 / 1
623,614,ARM ARM,Knarik MARGARYAN Lilit POGHOSYAN,-6,0 - 0,,920 / 1
624,614,MAS HUN,Yee See CHEAH Laura SAROSI,-6,0 - 0,,920 / 1
625,614,ISL ISL,Arna Karen JOHANNSDOTTIR Margret NILSDOTTIR,-6,0 - 0,,920 / 1
626,614,ISL ISL,Sigridur ARNADOTTIR Rakel JOHANNESDOTTIR,-6,0 - 0,,920 / 1
627,614,ISL ISL,Margret FINNBOGADOTTIR Harpa HILMISDOTTIR,-6,0 - 0,,920 / 1
628,614,ISL ISL,Lina Dora HANNESDOTTIR Jona Kristin HJARTARDOTTIR,-6,0 - 0,,920 / 1
629,614,CHN CHN,GAO Xiaoyuan LIN Liyun,-6,0 - 0,,920 / 1
630,614,TPE TPE,HUNG Shih Han Wan Ching LIN,-6,0 - 0,,920 / 1
631,614,IRI IRI,Zeynab ABDOLKARIM Samin ABEDKHOJASTEH,-6,0 - 0,,920 / 1
632,614,UGA UGA,Brenda MUGABI Aisha NAKIYEMBA,-6,0 - 0,,920 / 1
633,614,UGA UGA,Regina NAJJEMBA Ritah NAKIMERA,-6,0 - 0,,920 / 1
634,614,CRO CRO,Dora DRVODELIC Katarina GALENIC,-6,0 - 0,,920 / 1
635,614,NZL NZL,Stephanie LIAO Jasmin Chung Man NG,-6,0 - 0,,920 / 1
636,614,INA INA,Lya ERSALITA Brigita Marcelia RUMAMBI,-6,0 - 0,,920 / 1
637,614,INA INA,Surya DELLA AUGUSTIA Nugraheny RISTYA AYU,-6,0 - 0,,920 / 1
638,614,INA INA,Marsheilla Gischa ISLAMI Meiliana JAUHARI,-6,0 - 0,,920 / 1
639,614,PER PER,Stefany Ying Chie CHEN CHEN Valeria Carolina WONG LAM,-6,0 - 0,,920 / 1
640,614,PER PER,Camila DUANY Camilla GARCIA,-6,0 - 0,,920 / 1
641,614,GRE GRE,Vasiliki ANDREADOU Pantelia BARTZOU,-6,0 - 0,,920 / 1
642,614,DEN DEN,Sofie Zacho VESTERGAARD Amalie VESTMAR,-6,0 - 0,,920 / 1
643,614,TPE TPE,Hsin Tien CHANG Shuo Yun SUNG,-6,0 - 0,,920 / 1
644,614,POR POR,Ana DIAS Gabriela PEREIRA,-6,0 - 0,,920 / 1
645,614,VIE VIE,Thi Phuong Mai DO Ngoc Phuong LUU,-6,0 - 0,,920 / 1
646,614,VIE VIE,Ngoc Bich PHAM Truong Bao Vy TRAN,-6,0 - 0,,920 / 1
647,614,FIN FIN,Noora AHOLA Jenni RAUTIAINEN,-6,0 - 0,,920 / 1
648,614,SWE SWE,Amanda ANDERN Berfin ASLAN,-6,0 - 0,,920 / 1
649,614,JPN JPN,Sebun NAGAI Nagisa YURA,-6,0 - 0,,920 / 1
650,614,JPN JPN,Hikari SAITO Chiharu SHIDA,-6,0 - 0,,920 / 1
651,614,JPN JPN,Momoka KIMURA Shizuka Uchida,-6,0 - 0,,920 / 1
652,614,GRE GRE,Artemis ANASTASIOU Georgia ANASTASIOU,-6,0 - 0,,920 / 1
653,614,FRA CRO,Lole COURTOIS Maja PAVLINIC,-6,0 - 0,,920 / 1
654,614,PHI PHI,Alyssa Yasbel LEONARDO Thea Marie POMAR,-6,0 - 0,,920 / 1
655,614,SRI SRI,Kavindi Ishandika SIRIMANNAGE Oshadie KURUPPU,-6,0 - 0,,920 / 1
656,614,AUS AUS,Vee Vian CHONG Eugenia TANAKA,-6,0 - 0,,920 / 1
657,614,VIE VIE,Ha Trang LE Thi Mai Anh NGUYEN,-6,0 - 0,,920 / 1
658,614,SIN SIN,Chun Yi Deline QUEK Ai Ninna TAN,-6,0 - 0,,920 / 1
659,614,ETH ETH,KIDANEMARIAM Eyerusalem LEYIKUN Radiate,-6,0 - 0,,920 / 1
660,614,NGR NGR,Augustina EBHOMIEN SUNDAY Uchechukwu Deborah UKEH,-6,0 - 0,,920 / 1
661,614,TPE TPE,CHEN Shih Ying Ying Chun LIN,-6,0 - 0,,920 / 1
662,614,FIN FIN,Riikka SINKKO Noora VIRTA,-6,0 - 0,,920 / 1
663,614,ETH ETH,DANIEL Mahlet BERHANU Samrawit,-6,0 - 0,,920 / 1
664,614,ISL ISL,Tinna HELGADOTTIR Snjolaug JOHANNSDOTTIR,-6,0 - 0,,920 / 1
665,614,ISL ISL,Johanna JOHANNSDOTTIR Sunna Osp RUNOLFSDOTTIR,-6,0 - 0,,920 / 1
666,614,CRO CRO,Mateja CICA Stasa POZNANOVIC,-6,0 - 0,,920 / 1
667,614,IRL IRL,Sinead CHAMBERS Jennie KING,-6,0 - 0,,920 / 1
668,614,AZE AZE,Alizada PARVIN Huseynova ZULFIYYA,-6,0 - 0,,920 / 1
669,614,MAR MAR,Harag NAZIK Charaouite GHITA,-6,0 - 0,,920 / 1
670,614,RUS RUS,Anastasia STOGOVA Polina VORONKO,-6,0 - 0,,920 / 1
671,614,ETH ETH,GETACHEW Firehiwot Yerusksew Legssey TURA,-6,0 - 0,,920 / 1
672,614,MRI MRI,Aurelie Marie Elisa ALLET Shaama SANDOOYEA,-6,0 - 0,,920 / 1
673,614,TUR TUR,Sevval Buse ALSOY Arzu DELIBALTA,0,0 - 0,,920 / 1
674,614,VIE VIE,Kim Ngan DANG Thi Thanh Thuy LE,-6,0 - 0,,920 / 1
675,614,THA THA,Natthakorn JAIAREREE Laksika KANLAHA,-6,0 - 0,,920 / 1
676,614,ZAM ZAM,Evelyn SIAMUPANGILA Ogar SIAMUPANGILA,-6,0 - 0,,920 / 1
677,614,ETH ETH,AFEWORK Rakeb TADESSE Samrawit,-6,0 - 0,,920 / 1
678,614,TPE TPE,Yu Chen CHANG Chien Hui YU,-6,0 - 0,,920 / 1
679,614,IRL IRL,Kate FROST Moya RYAN,-6,0 - 0,,920 / 1
680,614,ITA ITA,Silvia GARINO Lisa IVERSEN,-6,0 - 0,,920 / 1
681,614,MLT ESP,SADOWSKI Fiorella Marie Laia OSET,-6,0 - 0,,920 / 1
682,614,CZE CZE,Dominika KURZOVA Ivana ZYCHOVA,-6,0 - 0,,920 / 1
683,614,RUS RUS,Karina NAZAROVA Anastasia REDKINA,-6,0 - 0,,920 / 1
684,614,TPE TPE,Ling Fang HU SHUAI Pei Ling,-6,0 - 0,,920 / 1
685,614,UGA UGA,Najjuka GLORIA Daisy NAKALYANGO,-6,0 - 0,,920 / 1
686,614,AUT AUT,Sonja LANGTHALER Nina SORGER,-6,0 - 0,,920 / 1
687,614,THA THA,Karnjanavadee BUNSOMBOON Rawimon IAMRATANAMAETHEEKUL,-6,0 - 0,,920 / 1
688,614,SRI SRI,Dinushi GUNASEKARA Nayanathara JAYAWEERA HEWAGE,-6,0 - 0,,920 / 1
689,614,SRI SRI,Buthmi Asini GALAGAMAGE Hasara Chathumhari WIJAYARATHNE,-6,0 - 0,,920 / 1
690,614,SRI SRI,Sithara JANITHANJALI Ruvini Chathurika RATNASIRI,-6,0 - 0,,920 / 1
691,614,RUS RUS,Yana IGNATYEVA Kristina VIRVICH,-6,0 - 0,,920 / 1
692,614,SUI SUI,Monika FISCHER Sanya HERZIG,-6,0 - 0,,920 / 1
693,614,TUR TUR,Filiz HALBURCU Aysin YESIL,0,0 - 0,,920 / 1
694,614,MAR MAR,Bouchra BOUZROUD Zineb EL GHOZAIL,-6,0 - 0,,920 / 1
695,614,ENG ENG,Chloe BIRCH Victoria WILLIAMS,-6,0 - 0,,920 / 1
696,614,THA THA,Natthakorn JAIAREREE Chasinee KOREPAP,-6,0 - 0,,920 / 1
697,614,MAS MAS,Wei Ying BOON Sylvia Kavita KUMARES,-6,0 - 0,,920 / 1
698,614,SIN SIN,Citra Dewi SARI Wei Han TAN,-6,0 - 0,,920 / 1
699,614,CHN CHN,LI Xuan ZHU Conglin,-6,0 - 0,,920 / 1
700,614,PHI PHI,Airah Mae Nicole ALBO Sarah Joy BARREDO,-6,0 - 0,,920 / 1
701,614,TPE TPE,Hao Yun WEN YANG Ching Tun,-6,0 - 0,,920 / 1
702,614,MAR MAR,Salma BENHARREF Khawla MAKRANE,-6,0 - 0,,920 / 1
703,614,MAR MAR,Fatima IDRISSI Chakib SAFAE,-6,0 - 0,,920 / 1
704,614,RUS RUS,Evgenia DIMOVA Natalia Rogova,-6,0 - 0,,920 / 1
705,614,ARM ARM,Marieta NIKOYAN Lilit POGHOSYAN,-6,0 - 0,,920 / 1
706,614,BUL BUL,Rumiana IVANOVA Eva TONEVA,-6,0 - 0,,920 / 1
707,614,SUI SUI,Sanya HERZIG Michelle SCHAER,-6,0 - 0,,920 / 1
708,614,SUI INA,Ronja STERN Aprillia YUSWANDARI,-6,0 - 0,,920 / 1
709,614,SUI SUI,Nicole PERROUD Celine TRIPET,-6,0 - 0,,920 / 1
710,614,GER AUT,Annika HORBACH Sonja LANGTHALER,-6,0 - 0,,920 / 1
711,614,MAR MAR,Abla EL GHOZAIL Loubna QUOUNOFOU,-6,0 - 0,,920 / 1
712,614,SUR SUR,Shemara LINDVELD Quennie PAWIROSEMITO,-6,0 - 0,,920 / 1
713,614,SUR SUR,Sherifa JAMESON Chan YANG,-6,0 - 0,,920 / 1
714,614,IND IND,Sruthi K.P Haritha MANAZHIYIL HARINARAYANAN,-6,0 - 0,,920 / 1
715,614,INA INA,Erlina KURNIANTI Guniarti RAFIKA MUTIARA,-6,0 - 0,,920 / 1
716,614,IND IND,Anoushka PARIKH Sanjana SANTOSH,-6,0 - 0,,920 / 1
717,614,TUR TUR,Aleyna ARSLAN Kurba OZTURK,0,0 - 0,,920 / 1
718,614,TUR TUR,Buse CEYLAN Emine DEMIRTAS,0,0 - 0,,920 / 1
719,614,TUR TUR,Aslihan AYNA Irem ÇELIK,0,0 - 0,,920 / 1
720,614,TUR TUR,Tuba GUNES Busra UNLU,0,0 - 0,,920 / 1
721,614,TUR TUR,Derya CALIMBAY Senem GULEROGLU,0,0 - 0,,920 / 1
722,614,ITA ITA,Giulia FIORITO Marah PUNTER,-6,0 - 0,,920 / 1
723,614,RSA RSA,Tarryn JACOBS Shereen MATTHEWS,-6,0 - 0,,920 / 1
724,614,SUR SUR,Cheryl NAI CHUNG TONG Priscilla WAARTS,-6,0 - 0,,920 / 1
725,614,SUR SUR,Anjali PARAGSINGH Mary - Ann ZHONG,-6,0 - 0,,920 / 1
726,614,SUR SUR,Crystal LEEFMANS Jill SJAUW - MOOK,-6,0 - 0,,920 / 1
727,614,ENG ENG,Rosemary ALLEN Meera SIVAKUMARAN,-6,0 - 0,,920 / 1
728,614,ENG ENG,Fee Teng LIEW Lizzie TOLMAN,-6,0 - 0,,920 / 1
729,614,ENG ENG,Evie BURBIDGE Abigail HOLDEN,-6,0 - 0,,920 / 1
