,RANK,COUNTRY,PLAYER,CHANGE +/-,WIN - LOSE,PRIZE MONEY,POINTS / TOURNAMENTS
0,1,CHN CHN,LUO Ying LUO Yu,0,111 - 39,"$304,025.00","74,640 / 14"
1,2,DEN DEN,Kamilla RYTTER JUHL Christinna PEDERSEN,0,170 - 76,"$396,789.67","73,330 / 17"
2,3,INA INA,Nitya Krishinda MAHESWARI Greysia POLII,0,119 - 55,"$267,572.13","72,592 / 18"
3,4,JPN JPN,Misaki MATSUTOMO Ayaka TAKAHASHI,0,199 - 96,"$385,108.50","70,379 / 17"
4,5,KOR KOR,CHANG Ye Na LEE So Hee,0,39 - 11,"$157,418.09","56,960 / 11"
5,6,KOR KOR,JUNG Kyung Eun SHIN Seung Chan,0,39 - 11,"$228,359.51","55,960 / 11"
6,7,CHN CHN,MA Jin TANG Yuanting,0,48 - 12,"$389,635.00","54,019 / 8"
7,8,JPN JPN,Naoko FUKUMAN Kurumi YONAO,0,70 - 42,"$34,253.72","52,850 / 20"
8,9,NED NED,Eefje MUSKENS Selena PIEK,0,99 - 41,"$78,860.48","52,755 / 21"
9,10,CHN CHN,TIAN Qing ZHAO Yunlei,0,178 - 35,"$780,869.25","50,270 / 6"
10,11,MAS MAS,Vivian Kah Mun HOO Khe Wei WOON,0,100 - 82,"$70,220.14","48,374 / 19"
11,12,JPN JPN,Reika KAKIIWA Miyuki MAEDA,0,73 - 51,"$250,601.45","47,430 / 15"
12,13,JPN JPN,Shizuka MATSUO Mami NAITO,3,160 - 94,"$152,280.82","47,100 / 16"
13,14,IND IND,Jwala GUTTA Ashwini PONNAPPA,-1,81 - 95,"$76,806.98","46,314 / 20"
14,15,KOR KOR,GO Ah Ra YOO Hae Won,-1,69 - 53,"$62,788.72","45,700 / 17"
15,16,KOR KOR,CHAE Yoo Jung KIM So Yeong,-1,19 - 16,"$59,649.35","45,550 / 14"
16,17,BUL BUL,Gabriela STOEVA Stefani STOEVA,0,191 - 62,"$50,652.74","44,680 / 19"
17,18,CHN CHN,WANG Xiaoli YU Yang (F),0,203 - 28,"$1,158,023.75","43,130 / 7"
18,19,MAS MAS,Amelia Alicia ANSCELLY Fie Cho SOONG,0,64 - 50,"$33,456.54","43,060 / 17"
19,20,HKG HKG,POON Lok Yan TSE Ying Suet,0,88 - 84,"$82,742.48","41,480 / 15"
20,21,THA THA,Puttita SUPAJIRAKUL Sapsiree TAERATTANACHAI,1,40 - 43,"$36,866.19","41,185 / 20"
21,22,THA THA,Jongkolphan KITITHARAKUL Rawinda PRAJONGJAI,-1,37 - 33,"$15,640.60","40,050 / 21"
22,23,JPN JPN,Yuki FUKUSHIMA Sayaka HIROTA,0,54 - 22,"$20,493.11","37,910 / 10"
23,24,KOR KOR,JUNG Kyung Eun CHANG Ye Na,0,15 - 10,"$265,067.01","37,845 / 8"
24,25,KOR KOR,LEE So Hee SHIN Seung Chan,0,108 - 51,"$120,710.59","37,590 / 10"
25,26,GER GER,Carla NELTE Johanna GOLISZEWSKI,0,70 - 66,"$31,072.49","37,560 / 25"
26,27,GER GER,Birgit MICHELS Isabel HERTTRICH,0,27 - 31,"$39,024.90","37,036 / 21"
27,28,USA USA,Eva LEE Paula Lynn OBANANA,0,122 - 84,"$30,156.19","36,841 / 25"
28,29,JPN JPN,Ayane KURIHARA Naru SHINOYA,0,41 - 20,"$23,406.11","36,840 / 14"
29,30,ENG ENG,Heather OLVER Lauren SMITH,0,51 - 32,"$38,677.25","36,119 / 26"
30,31,THA THA,Chaladchalam Chayanit Phataimas MUENWONG,0,45 - 23,"$11,221.18","34,920 / 22"
31,32,INA INA,Suci Rizky ANDINI Maretha Dea GIOVANI,0,25 - 13,"$32,375.35","33,560 / 14"
32,33,INA INA,Anggia Shitta AWANDA Mahadewi Istirani NI KETUT,0,23 - 17,"$19,254.98","33,560 / 12"
33,34,CHN CHN,TANG Yuanting YU Yang (F),0,27 - 1,"$830,441.25","33,368 / 5"
34,35,TUR TUR,Neslihan YIGIT Ozge BAYRAK,2,116 - 65,"$15,427.05","32,898 / 16"
35,36,NED NED,Samantha BARNING Iris TABELING,-1,48 - 45,"$27,741.45","32,422 / 19"
36,37,INA INA,Gebby Ristiyani IMAWAN Tiara Rosalia NURAIDAH,-1,73 - 51,"$30,704.20","31,960 / 14"
37,38,INA INA,Pia Zebadiah BERNADETH Rizki Amelia PRADIPTA,0,84 - 55,"$85,322.74","30,320 / 9"
38,39,TPE TPE,HSU Ya Ching PAI Yu Po,0,21 - 39,"$8,128.07","30,160 / 21"
39,40,BRA BRA,Lohaynny VICENTE Luana VICENTE,1,67 - 40,"$9,947.41","29,383 / 14"
40,41,JPN JPN,Shiho TANAKA Koharu YONEMOTO,-1,30 - 16,"$22,712.58","28,970 / 10"
41,42,TPE TPE,HSIEH Pei Chen WU Ti Jung,0,21 - 27,"$21,123.10","28,390 / 21"
42,43,INA INA,Devi Tika PERMATASARI Keshya Nurvita HANADIA,0,54 - 32,"$23,545.91","27,990 / 11"
43,44,IND IND,Pradnya GADRE NELAKURIHI Sikki Reddy,0,33 - 24,"$17,636.73","27,980 / 10"
44,45,CHN CHN,TANG Jinhua TIAN Qing,0,12 - 3,"$690,216.37","27,440 / 4"
45,46,SIN SIN,Yu Yan Vanessa NEO Shinta Mulia SARI,0,27 - 36,"$78,790.04","27,317 / 12"
46,47,CAN CAN,Alex BRUCE Phyllis CHAN,0,42 - 38,"$11,693.45","26,938 / 17"
47,48,CHN CHN,OU Dongni YU Xiaohan,0,27 - 4,"$94,622.49","25,940 / 4"
48,49,MAS MAS,Meng Yean LEE Yin Loo LIM,0,23 - 29,"$26,965.31","25,590 / 13"
49,50,CHN CHN,TANG Jinhua ZHONG Qianxin,0,11 - 4,"$407,998.74","25,340 / 5"
50,51,AUS AUS,Setyana MAPASA Gronya SOMERVILLE,4,34 - 8,"$4,331.74","25,220 / 11"
51,52,CHN CHN,CHEN Qingchen JIA Yifan,-1,54 - 11,"$23,363.75","24,820 / 6"
52,53,RUS RUS,Evgeniya KOSETSKAYA Ekaterina BOLOTOVA,-1,43 - 31,"$15,384.75","24,372 / 9"
53,54,CHN CHN,BAO Yixin TANG Yuanting,-1,13 - 1,"$446,433.74","23,950 / 3"
54,55,TPE TPE,CHIANG Kai Hsin WU Fang Chien,-1,20 - 27,"$9,092.42","23,590 / 18"
55,56,HKG HKG,CHAN Kaka Tsz Ka TSE Ying Suet,0,31 - 38,"$53,782.09","23,280 / 7"
56,57,INA INA,Della Destiara HARIS Rosyita Eka PUTRI SARI,0,17 - 5,"$35,156.73","23,170 / 6"
57,58,FRA FRA,Delphine LANSAC Emilie LEFEL,0,36 - 23,"$4,604.99","22,764 / 10"
58,59,DEN DEN,Maiken FRUERGAARD Sara THYGESEN,0,30 - 26,"$2,231.75","22,640 / 10"
59,60,MAS MAS,YAP Cheng Wen Joyce Wai Chi CHOONG,0,34 - 30,"$1,539.98","21,650 / 12"
60,61,ENG ENG,Sophie BROWN Kate ROBERTSHAW,0,17 - 19,"$9,480.13","21,360 / 10"
61,62,FRA FRA,Marie BATOMENE Emilie LEFEL,3,12 - 11,"$3,352.87","20,780 / 10"
62,63,THA THA,Duanganong AROONKESORN Kunchala VORAVICHITCHAIKUL,-1,164 - 184,"$120,720.00","20,773 / 7"
63,64,IRI IRI,Negin AMIRIPOUR AGHAEI Hajiagha Soraya,-1,19 - 17,"$4,136.31","20,620 / 13"
64,65,DEN DEN,Lena GREBAK Maria HELSBOL,-1,50 - 26,"$14,087.50","19,657 / 8"
65,66,TUR TUR,Cemre FERE Ebru YAZGAN,10,28 - 17,"$4,294.98","19,270 / 9"
66,67,INA INA,Dian FITRIANI Nadya MELATI,-1,20 - 18,"$38,039.44","19,060 / 8"
67,68,EGY EGY,Menna ELTANANY Nadine ASHRAF,-1,17 - 19,$772.48,"19,053 / 17"
68,69,MEX MEX,Haramara GAITAN Sabrina SOLIS,0,36 - 28,$609.34,"18,750 / 11"
69,70,UKR UKR,Natalya VOYTSEKH Yelyzaveta ZHARKA,-2,28 - 27,"$4,176.50","18,490 / 9"
70,71,INA INA,Pia Zebadiah BERNADETH Aprilsasi Putri LEJARSAR VARIELLA,-1,10 - 7,"$63,199.50","18,380 / 7"
71,72,FRA FRA,Audrey FONTAINE Anne TRAN,13,9 - 11,"$4,655.61","18,360 / 10"
72,73,INA INA,Komala DEWI Vita MARISSA,-2,25 - 12,"$150,066.44","18,310 / 7"
73,74,THA THA,Savitree AMITRAPAI Pacharapun CHOCHUWONG,-2,15 - 7,"$29,162.47","18,250 / 8"
74,75,HKG HKG,CHAN Kaka Tsz Ka YUEN Sin Ying,-2,10 - 10,"$12,398.97","18,046 / 10"
75,76,GER GER,Linda EFLER Lara KAEPPLEIN,-2,18 - 17,"$1,093.75","17,340 / 11"
76,77,INA INA,Apriani RAHAYU Jauza Fadhila SUGIARTO,-2,34 - 18,"$1,117.50","17,310 / 10"
77,78,TPE TPE,CHENG Chi Ya Chia Hsin LEE,-1,10 - 11,"$6,976.23","16,820 / 8"
78,79,DEN DEN,Emilie JUUL MOLLER Cecilie SENTOW,-1,20 - 14,$0.00,"16,550 / 11"
79,80,BRA BRA,Paula B PEREIRA Fabiana SILVA,-1,32 - 24,"$5,228.33","16,332 / 7"
80,81,KOR KOR,EOM Hye Won KIM Ha Na,-1,14 - 9,"$133,311.85","16,240 / 5"
81,82,IND IND,Dhanya NAIR Mohita SAHDEV,-1,18 - 19,"$4,432.43","16,100 / 9"
82,83,KOR KOR,Hye Rin KIM Hee Yong KONG,-1,8 - 8,"$1,472.50","16,080 / 7"
83,84,PER PER,Daniela MACIAS Danica NISHIMURA,4,34 - 28,"$3,442.42","15,860 / 8"
84,85,JPN JPN,Rie ETOH Aoi MATSUDA,-2,12 - 14,"$18,954.60","15,850 / 6"
85,86,DEN DEN,Amanda MADSEN Isabella NIELSEN,-2,22 - 17,$0.00,"15,370 / 9"
86,87,CHN CHN,YU Yang (F) ZHONG Qianxin,-1,8 - 1,"$771,391.87","14,700 / 2"
87,88,EGY EGY,Doha HANY Hadia HOSNY,-1,8 - 9,"$1,634.21","14,300 / 9"
88,89,FIN FIN,Mathilda LINDHOLM Jenny NYSTROM,0,32 - 52,$0.00,"13,180 / 9"
89,90,CHN CHN,TIAN Qing XIA Huan,0,5 - 2,"$438,427.00","12,740 / 2"
90,91,ENG ENG,Jenny MOORE Victoria WILLIAMS,0,40 - 32,$825.00,"12,590 / 8"
91,92,GER GER,Lisa KAMINSKI Hannah POHL,0,7 - 19,$543.75,"12,580 / 10"
92,93,MAS MAS,Yee See CHEAH Kah Mun CHIN,0,11 - 10,"$2,301.83","12,560 / 8"
93,94,JPN JPN,Mayu MATSUMOTO Wakana NAGAHARA,0,17 - 12,"$3,745.60","12,310 / 6"
94,95,BEL BEL,Steffi ANNYS Flore VANDENHOUCKE,0,23 - 19,"$1,375.00","12,225 / 9"
95,96,PER PER,Katherine WINDER Luz Maria ZORNOZA,0,21 - 18,"$3,629.31","12,220 / 7"
96,97,INA INA,Nisak Puji LESTARI Merisa Cindy SAHPUTRI,0,11 - 6,$309.36,"11,930 / 6"
97,98,CHN CHN,HUANG Yaqiong TANG Jinhua,0,5 - 1,"$331,144.37","11,860 / 2"
98,99,TPE TPE,Ching Hui CHANG Hsin Tien CHANG,0,36 - 27,"$2,433.10","11,740 / 6"
99,100,RUS RUS,Anastasia CHERVYAKOVA Olga MOROZOVA,0,11 - 5,"$15,469.25","11,670 / 5"
100,101,GER GER,Carola BOTT Jennifer KARNOTT,0,0 - 0,,"11,480 / 7"
101,102,CHN CHN,BAO Yixin TANG Jinhua,0,0 - 0,,"10,740 / 2"
102,103,EST EST,Kristin KUUBA Helina RÜÜTEL,0,0 - 0,,"10,630 / 8"
103,104,RUS RUS,Anastasia CHERVYAKOVA Nina VISLOVA,0,0 - 0,,"10,530 / 4"
104,105,VIE VIE,Thi Sen NGUYEN Thi Trang (B) VU,0,0 - 0,,"10,292 / 6"
105,106,ESP ESP,Laura MOLINA Haidee OJEDA,0,0 - 0,,"9,970 / 7"
106,107,MAS MAS,Yea Ching GOH Zhen YAP,0,0 - 0,,"9,960 / 7"
107,108,KOR KOR,CHANG Ye Na YOO Hae Won,0,0 - 0,,"9,940 / 2"
108,108,CHN CHN,HUANG Yaqiong MA Jin,0,0 - 0,,"9,940 / 2"
109,110,GER GER,Barbara BELLENBERG Eva JANSSENS,0,0 - 0,,"9,850 / 7"
110,111,ARG ARG,Florencia BERNATENE Daiana GARMENDIA,0,0 - 0,,"9,790 / 7"
111,112,ENG ENG,Chloe BIRCH Jenny WALLWORK,0,0 - 0,,"9,760 / 5"
112,113,THA THA,Supanida KATETHONG Panjarat PRANSOPON,0,0 - 0,,"9,730 / 6"
113,113,RUS RUS,Irina KHLEBKO Elena KOMENDROVSKAJA,0,0 - 0,,"9,730 / 6"
114,115,TUR TUR,Cemre FERE Ebru TUNALI,0,0 - 0,,"9,720 / 5"
115,116,IRL IRL,Sara BOYLE Rachael DARRAGH,0,0 - 0,,"9,581 / 8"
116,117,INA INA,Della Destiara HARIS Rizki Amelia PRADIPTA,0,0 - 0,,"9,550 / 4"
117,118,SWE SWE,Clara NISTAD Emma WENGBERG,20,0 - 0,,"9,320 / 4"
118,119,CHN CHN,ZHAO Yunlei ZHONG Qianxin,-1,0 - 0,,"9,200 / 1"
119,120,FRA FRA,Laura CHOINET Teshana VIGNES WARAN,-1,0 - 0,,"9,150 / 5"
120,121,IND IND,Aparna BALAN Prajakta SAWANT,-1,0 - 0,,"9,110 / 4"
121,122,JPN JPN,Arisa HIGASHINO Chisato HOSHI,-1,0 - 0,,"9,050 / 4"
122,123,FRA FRA,Lorraine BAUMANN Audrey FONTAINE,-1,0 - 0,,"9,030 / 5"
123,124,SUI SUI,Celine BURKART Tiffany GIRONA,-1,0 - 0,,"8,840 / 10"
124,125,MAS MAS,Mei Kuan CHOW Pei Jing LAI,-1,0 - 0,,"8,770 / 3"
125,126,CHN CHN,HUANG Dongping OU Dongni,-1,0 - 0,,"8,770 / 2"
126,127,AUS AUS,Leanne CHOO Gronya SOMERVILLE,-1,0 - 0,,"8,672 / 2"
127,128,INA INA,Melvira OKLAMONA Rika ROSITAWATI,-1,0 - 0,,"8,670 / 5"
128,129,TPE TPE,CHENG Wen Hsing SHUAI Pei Ling,-1,0 - 0,,"8,620 / 3"
129,130,AUS SUI,Leanne CHOO Nadia FANKHAUSER,-1,0 - 0,,"8,550 / 3"
130,131,RUS RUS,Ekaterina KUT Daria SEREBRIAKOVA,-1,0 - 0,,"8,530 / 6"
131,132,CHN CHN,BAO Yixin ZHONG Qianxin,-1,0 - 0,,"8,480 / 3"
132,133,RUS RUS,Tatjana BIBIK Elena KOMENDROVSKAJA,-1,0 - 0,,"8,400 / 6"
133,134,IND IND,K. Maneesha NELAKURIHI Sikki Reddy,-1,0 - 0,,"8,400 / 3"
134,135,KOR KOR,CHAE Yoo Jung KIM Ji Won,-1,0 - 0,,"8,300 / 2"
135,136,TPE TPE,CHEN Hsiao Huan LAI Chia Wen,-1,0 - 0,,"8,260 / 4"
136,137,AUS AUS,Jennifer TAM Alice WU,-1,0 - 0,,"8,230 / 4"
137,138,INA INA,Komala DEWI Jenna GOZALI,-1,0 - 0,,"7,880 / 4"
138,139,GER GER,Kira KATTENBECK Franziska VOLKMANN,0,0 - 0,,"7,750 / 6"
139,140,TPE TPE,CHEN Hsiao Huan HUANG Mei Ching,0,0 - 0,,"7,740 / 3"
140,141,MEX MEX,Cynthia GONZALEZ Mariana UGALDE,18,0 - 0,,"7,460 / 5"
141,142,UZB UZB,Anait KHURSHUDYAN Valeriya MUSHTAKOVA,-1,0 - 0,,"7,360 / 6"
142,143,INA INA,Phita Haningtyas MENTARI Zarra Faza AZKA,-1,0 - 0,,"7,170 / 6"
143,144,DEN SWE,Thilde MATTISSON Emma WENGBERG,-1,0 - 0,,"7,160 / 5"
144,145,AUS TPE,Hsuan-Yu Wendy CHEN Shu Yu LIN,-1,0 - 0,,"7,140 / 4"
145,146,FRA FRA,Lea PALERMO Anne TRAN,-1,0 - 0,,"7,130 / 3"
146,147,CHN CHN,XIA Huan ZHONG Qianxin,-1,0 - 0,,"7,000 / 1"
147,147,CHN CHN,HUANG Dongping LI Yinhui,-1,0 - 0,,"7,000 / 1"
148,149,MRI MRI,Kate FOO KUNE Yeldy Marie LOUISON,-1,0 - 0,,"6,967 / 3"
149,150,MAS MAS,Erica Pei Shan KHOO Wei Chyi TI,-1,0 - 0,,"6,760 / 4"
150,151,MAS MAS,"Peiy Yee, Payee LIM Peiy Zhean LIM",-1,0 - 0,,"6,720 / 8"
151,152,NZL NZL,Alyse DERBY Rebecca GODDARD,-1,0 - 0,,"6,700 / 4"
152,153,FIN FIN,Jenny NYSTROM Sonja PEKKOLA,-1,0 - 0,,"6,660 / 5"
153,154,CHI CHI,Tingting CHOU Camila MACAYA,-1,0 - 0,,"6,620 / 5"
154,155,CHN CHN,HUANG Dongping ZHU Mai Ci,-1,0 - 0,,"6,470 / 5"
155,156,DEN DEN,Julie FINNE-IPSEN Rikke Søby HANSEN,-1,0 - 0,,"6,440 / 3"
156,157,INA INA,Dianita SARASWATI Yulfira BARKAH,-1,0 - 0,,"6,400 / 5"
157,158,LAT LAT,Ieva POPE Kristine SEFERE,-1,0 - 0,,"6,310 / 5"
158,159,GER GER,Barbara BELLENBERG Ramona HACKS,-1,0 - 0,,"6,270 / 6"
159,160,NED NED,Alida CHEN Cheryl SEINEN,0,0 - 0,,"6,160 / 4"
160,161,EST EST,Kati-Kreet MARRAN Sale - Liis TEESALU,0,0 - 0,,"6,130 / 7"
161,162,UKR UKR,Anastasiya DMYTRYSHYN Darya SAMARCHANTS,0,0 - 0,,"6,090 / 6"
162,163,IND IND,J. Meghana K. Maneesha,0,0 - 0,,"6,090 / 3"
163,164,RSA RSA,Michelle BUTLER-EMMETT Elme DE VILLIERS,0,0 - 0,,"6,070 / 3"
164,165,NZL NZL,Sally FU Christine ZHANG,0,0 - 0,,"6,030 / 5"
165,166,SIN SIN,Shinta Mulia SARI Wei Han TAN,0,0 - 0,,"5,990 / 3"
166,167,MAS MAS,Shevon Jemie LAI Yen Wei PECK,0,0 - 0,,"5,920 / 3"
167,168,RSA RSA,Jennifer FRY Sandra LE GRANGE,0,0 - 0,,"5,845 / 5"
168,169,SEY SEY,Juliette AH-WAN Allisen CAMILLE,0,0 - 0,,"5,840 / 4"
169,170,INA INA,Shendy Puspa IRAWATI Vita MARISSA,0,0 - 0,,"5,720 / 2"
170,171,VIE VIE,Thu Huyen LE Nhu Thao PHAM,0,0 - 0,,"5,640 / 4"
171,171,THA THA,Kilasu OSTERMEYER Natcha SAENGCHOTE,0,0 - 0,,"5,640 / 4"
172,173,CZE CZE,Katerina TOMALOVA Sarka KRIZKOVA,0,0 - 0,,"5,560 / 5"
173,174,NZL NZL,Emma CHAPPLE Danielle TAHURI,0,0 - 0,,"5,520 / 2"
174,175,HUN HUN,Agnes KOROSI Orsolya VARGA,0,0 - 0,,"5,510 / 5"
175,176,RUS RUS,Tatjana BIBIK Olga GOLOVANOVA,0,0 - 0,,"5,410 / 4"
176,177,AUS AUS,Leanne CHOO Setyana MAPASA,0,0 - 0,,"5,370 / 2"
177,178,ENG ENG,Jessica PUGH Sarah WALKER,0,0 - 0,,"5,320 / 3"
178,179,HKG HKG,TSANG Wing Chiu Avery CHEUNG Ying Mei,0,0 - 0,,"5,270 / 2"
179,180,THA THA,Nattcha CHATPUTTARN Fareeda LOOG,0,0 - 0,,"5,240 / 5"
180,181,ENG ENG,Chloe BIRCH Emily WESTWOOD,0,0 - 0,,"5,240 / 3"
181,182,AUS CAN,Leanne CHOO Rachel HONDERICH,0,0 - 0,,"5,230 / 2"
182,183,UKR UKR,Vladyslava LESNAYA Anna MIKHALKOVA,0,0 - 0,,"5,200 / 5"
183,184,DEN DEN,Cecilie FINNE-IPSEN Julie Dawall JAKOBSEN,0,0 - 0,,"5,110 / 4"
184,185,TPE TPE,Wan Ting CHEN Shih Jyun JHOU,0,0 - 0,,"5,060 / 4"
185,186,IND IND,Sanyogita GHORPADE J. Meghana,0,0 - 0,,"5,000 / 2"
186,187,TUR TUR,Neslihan KILIC Ebru YAZGAN,0,0 - 0,,"4,970 / 4"
187,188,PHI PHI,Eleanor Christine INLAYO Alyssa Yasbel LEONARDO,0,0 - 0,,"4,960 / 4"
188,189,NGR NGR,Grace GABRIEL Braimoh MARIA,0,0 - 0,,"4,932 / 3"
189,190,TPE TPE,CHENG Chi Ya Yu Chieh CHENG,0,0 - 0,,"4,860 / 3"
190,191,TPE TPE,Tsun Yu LIN YU Wen KUO,0,0 - 0,,"4,830 / 2"
191,192,SIN SIN,Yi Ling Elaine CHUA Wei Han TAN,0,0 - 0,,"4,785 / 3"
192,193,SIN SIN,Yi Ling Elaine CHUA Citra Dewi SARI,0,0 - 0,,"4,780 / 3"
193,194,TPE TPE,Wan Ching LIN Xiao Min LIN,0,0 - 0,,"4,750 / 5"
194,195,INA INA,Syifa FAUZIAH Virni Putri JAFAR,0,0 - 0,,"4,730 / 4"
195,196,RUS RUS,Olga GOLOVANOVA Viktoriia VOROBEVA,0,0 - 0,,"4,710 / 3"
196,197,KOR KOR,CHAE Yoo Jung Hye Rin KIM,0,0 - 0,,"4,700 / 2"
197,197,DOM DOM,Bermary Altagracia POLANCO MUNOZ Daigenis SATURRIA,0,0 - 0,,"4,700 / 2"
198,197,RUS RUS,Tatjana BIBIK Ksenia POLIKARPOVA,0,0 - 0,,"4,700 / 2"
199,200,AUS AUS,Talia SAUNDERS Jennifer TAM,0,0 - 0,,"4,680 / 1"
200,201,GRE GRE,Aristea APOSTOLIDOU Eirini GOYGLERI,0,0 - 0,,"4,650 / 5"
201,202,KEN KEN,Mercy JOSEPH Lavina MARTINS,0,0 - 0,,"4,640 / 3"
202,203,BRA BRA,Ana Paula CAMPOS Fabiana SILVA,0,0 - 0,,"4,630 / 2"
203,204,RUS RUS,Victoria DERGUNOVA Olga MOROZOVA,0,0 - 0,,"4,620 / 3"
204,205,TPE TPE,Pei Shan HSIEH Chih Chen LEE,0,0 - 0,,"4,580 / 4"
205,206,JPN JPN,Rira KAWASHIMA Saori OZAKI,0,0 - 0,,"4,520 / 2"
206,207,IRL WAL,Sinead CHAMBERS Jordan HART,0,0 - 0,,"4,490 / 3"
207,207,FIN FIN,Anna PAAVOLA Sonja PEKKOLA,0,0 - 0,,"4,490 / 3"
208,209,TPE TPE,HUNG Shih Chieh HUNG Shih Han,0,0 - 0,,"4,480 / 3"
209,210,MAS MAS,Kah Mun CHIN Mei Kuan CHOW,0,0 - 0,,"4,410 / 3"
210,211,WAL ENG,Aimee MORAN Kerri SCOTT,0,0 - 0,,"4,360 / 4"
211,212,PAK PAK,Palwasha BASHIR Sara MOHMAND,0,0 - 0,,"4,330 / 2"
212,213,CHN CHN,DU Yue LI Yinhui,0,0 - 0,,"4,260 / 3"
213,214,TPE TPE,Szu Yu CHEN Yu Chieh CHENG,0,0 - 0,,"4,240 / 4"
214,215,CZE CZE,Magdalena LAJDOVA Denisa SIKALOVA,0,0 - 0,,"4,230 / 5"
215,216,NED NED,Gayle MAHULETTE Cheryl SEINEN,0,0 - 0,,"4,200 / 2"
216,217,INA INA,Ratoputri FEBTRIA ADISTRA Rosy Oktavia PANCASARI,0,0 - 0,,"4,190 / 3"
217,218,DEN DEN,Camilla MARTENS Josephine VAN ZAANE,0,0 - 0,,"4,110 / 4"
218,219,DEN DEN,Maiken FRUERGAARD Camilla MARTENS,0,0 - 0,,"4,020 / 2"
219,219,TUR TUR,Fatma Nur YAVUZ Kader İNAL,89,0 - 0,,"4,020 / 2"
220,221,NGR NGR,Tosin Damilola ATOLAGBE Susan IDEH,-1,0 - 0,,"3,952 / 3"
221,222,HKG HKG,NG Tsz Yau YEUNG Nga Ting,-1,0 - 0,,"3,890 / 2"
222,222,HKG HKG,CHAN Hung Yung NG Wing Yung,-1,0 - 0,,"3,890 / 2"
223,224,NGR ZAM,Grace GABRIEL Ogar SIAMUPANGILA,-1,0 - 0,,"3,880 / 2"
224,225,IND IND,Jamuna Rani RACHAPALLI Leela Lakshmi RACHAPALLI,-1,0 - 0,,"3,850 / 1"
225,225,TPE TPE,HUANG Mei Ching LIU Shu Chih,-1,0 - 0,,"3,850 / 1"
226,225,CAN CAN,Rachel HONDERICH Michelle LI,-1,0 - 0,,"3,850 / 1"
227,225,KOR KOR,Hye Jeong KIM Keun Hye PARK,-1,0 - 0,,"3,850 / 1"
228,225,IND IND,Sanyogita GHORPADE Arathi Sara SUNIL,-1,0 - 0,,"3,850 / 1"
229,225,AUS AUS,Hsuan-Yu Wendy CHEN Louisa MA,-1,0 - 0,,"3,850 / 1"
230,225,KOR KOR,CHAE Yoo Jung JUNG Kyung Eun,-1,0 - 0,,"3,850 / 1"
231,232,THA THA,Sararat CHUEBOCA Chasinee KOREPAP,-1,0 - 0,,"3,810 / 3"
232,233,SCO SCO,Rebekka FINDLAY Caitlin PRINGLE,-1,0 - 0,,"3,760 / 4"
233,234,NZL NZL,Erena CALDER -HAWKINS Selena WU,-1,0 - 0,,"3,740 / 4"
234,235,IND IND,Komal ANTIL Lalita DAHIYA,-1,0 - 0,,"3,720 / 2"
235,235,RUS RUS,Anastasia KHARLAMPOVICH Polina VORONKO,-1,0 - 0,,"3,720 / 2"
236,235,THA THA,Pacharapun CHOCHUWONG Chanisa TEACHAVORASINSKUN,-1,0 - 0,,"3,720 / 2"
237,238,INA INA,Ririn AMELIA Nugraheny RISTYA AYU,-1,0 - 0,,"3,710 / 3"
238,239,SCO SCO,Julie MACPHERSON Eleanor O'DONNELL,-1,0 - 0,,"3,680 / 4"
239,240,THA THA,Thanaporn KIAWCHA-ON Thanyasuda WONGYA,-1,0 - 0,,"3,670 / 3"
240,241,DEN DEN,Julie FINNE-IPSEN Ditte SØBY HANSEN,-1,0 - 0,,"3,650 / 2"
241,241,DEN DEN,Alexandra BOJE Gabriella BOJE,-1,0 - 0,,"3,650 / 2"
242,243,INA INA,Melvira OKLAMONA Merisa Cindy SAHPUTRI,-1,0 - 0,,"3,640 / 2"
243,244,GUA GUA,Diana CORLETO SOTO Mariana Isabel PAIZ QUAN,-1,0 - 0,,"3,630 / 2"
244,245,IND IND,Kuhoo GARG Ningshi Block HAZARIKA,-1,0 - 0,,"3,600 / 1"
245,245,TPE TPE,Hsin Tien CHANG CHENG Chi Ya,-1,0 - 0,,"3,600 / 1"
246,247,TUR TUR,Bengisu ERCETIN Nazlıcan INCI,286,0 - 0,,"3,570 / 2"
247,247,RSA MRI,Michelle BUTLER-EMMETT Kate FOO KUNE,-1,0 - 0,,"3,570 / 2"
248,249,THA THA,Panjarat PRANSOPON Sarita SUWANNAKITBORIHAN,-2,0 - 0,,"3,510 / 3"
249,249,INA INA,Mayrina LUKMANDA Bunga Fitriani ROMADHINI,-2,0 - 0,,"3,510 / 3"
250,251,CAN CAN,Michelle TONG Josephine WU,-2,0 - 0,,"3,490 / 2"
251,251,TPE TPE,Ling Fang HU Shuo Yun SUNG,-2,0 - 0,,"3,490 / 2"
252,253,BRA BRA,Paloma Eduarda da SILVA Fabiana SILVA,-2,0 - 0,,"3,480 / 2"
253,254,BLR BLR,Anastasiya CHERNIAVSKAYA Alesia ZAITSAVA,-2,0 - 0,,"3,460 / 5"
254,255,IND IND,S. Poorvisha Ram Arathi Sara SUNIL,-2,0 - 0,,"3,410 / 3"
255,256,TPE TPE,Hsin Tien CHANG Ling Fang HU,-2,0 - 0,,"3,340 / 2"
256,256,INA INA,Puspita Richi DILI Rizki Amelia PRADIPTA,-2,0 - 0,,"3,340 / 2"
257,258,SIN SIN,Ren-ne ONG Chun Yi Deline QUEK,-2,0 - 0,,"3,320 / 3"
258,259,THA THA,Rawimon IAMRATANAMAETHEEKUL Supamart MINGCHUA,-2,0 - 0,,"3,270 / 2"
259,260,TPE TPE,Tzu Chin PAN Hsin-Yu TSAI,-2,0 - 0,,"3,230 / 3"
260,261,ESP ESP,Clara AZURMENDI Isabel FERNANDEZ,-2,0 - 0,,"3,210 / 3"
261,262,INA INA,Surya DELLA AUGUSTIA Febriani Endar KUSUMAWATI,-2,0 - 0,,"3,190 / 2"
262,262,IND IND,Jagriti NASHIER Jyoti NASHIER,-2,0 - 0,,"3,190 / 2"
263,264,GER GER,Luise HEIM Yvonne LI,-2,0 - 0,,"3,170 / 2"
264,265,THA THA,Natcha SAENGCHOTE Kornkamon SUKKLAD,-2,0 - 0,,"3,120 / 2"
265,265,DEN DEN,Line NOERGAARD Nanna VESTERGAARD,-2,0 - 0,,"3,120 / 2"
266,265,NGR NGR,Dorcas Ajoke ADESOKAN Grace GABRIEL,-2,0 - 0,,"3,120 / 2"
267,265,UKR UKR,Yuliya KAZARINOVA Mariya RUD,-2,0 - 0,,"3,120 / 2"
268,265,CHI CHI,HINOSTROZA Amparo SKARIC Mickaela,-2,0 - 0,,"3,120 / 2"
269,265,THA THA,Natchpapha CHATUPORNKARNCHANA Kwanchanok SUDJAIPRAPARAT,-2,0 - 0,,"3,120 / 2"
270,265,TRI TRI,Avril PLAZA MARCELLE Kamasha ROBERTSON,-2,0 - 0,,"3,120 / 2"
271,265,RUS RUS,Olga LIPKINA Julia ZAPOLSKAYA,-2,0 - 0,,"3,120 / 2"
272,273,ENG ENG,Lauren SMITH Gabrielle ADCOCK,-2,0 - 0,,"3,109 / 1"
273,274,RUS RUS,Irina KHLEBKO Ksenia POLIKARPOVA,-2,0 - 0,,"3,030 / 1"
274,274,MEX MEX,Haramara GAITAN Cynthia GONZALEZ,-2,0 - 0,,"3,030 / 1"
275,274,NZL NZL,Angie LEUNG Jasmin Chung Man NG,-2,0 - 0,,"3,030 / 1"
276,274,AUS AUS,Elena Yee-Man KWOK Claudia LAM,-2,0 - 0,,"3,030 / 1"
277,274,RUS RUS,Alina DAVLETOVA Ksenia EVGENOVA,-2,0 - 0,,"3,030 / 1"
278,279,ITA ITA,Ramona Gloria PIRVANESCU Megumi SONODA,-2,0 - 0,,"2,990 / 4"
279,280,INA INA,Weni ANGGRAINI Pia Zebadiah BERNADETH,-2,0 - 0,,"2,960 / 2"
280,281,SLO SLO,Katarina BETON Ana Marija SETINA,-2,0 - 0,,"2,940 / 4"
281,282,BRN BRN,Anza ABDULRAHIM Sapna PRABHU,-2,0 - 0,,"2,890 / 2"
282,283,AUT AUT,Janine LAIS Nathalie ZIESIG,-2,0 - 0,,"2,882 / 4"
283,284,GER GER,Jennifer KARNOTT Franziska VOLKMANN,-2,0 - 0,,"2,820 / 4"
284,285,GER GER,Linda EFLER Franziska VOLKMANN,-2,0 - 0,,"2,810 / 2"
285,285,USA USA,Jing Yu HONG Beiwen ZHANG,-2,0 - 0,,"2,810 / 2"
286,287,CHN CHN,JIANG Binbin TANG Pingyang,-2,0 - 0,,"2,800 / 1"
287,287,CHN CHN,WU Qianqian XIA Chunyu,-2,0 - 0,,"2,800 / 1"
288,287,ENG ENG,Jessica HOPTON Victoria WILLIAMS,-2,0 - 0,,"2,800 / 1"
289,290,MAS MAS,Yen Wei PECK Zhen YAP,-2,0 - 0,,"2,760 / 3"
290,291,SUI SUI,Celine BURKART Cendrine HANTZ,-2,0 - 0,,"2,740 / 2"
291,291,DEN DEN,Cecilie BJERGEN Trine VILLADSEN,-2,0 - 0,,"2,740 / 2"
292,293,GER NZL,Annika HORBACH Maria MASINIPENI,-2,0 - 0,,"2,720 / 1"
293,293,IND IND,D. Sudha Kalyani MUKHERJEE Riya,-2,0 - 0,,"2,720 / 1"
294,293,AUS NZL,Tiffany HO Angie LEUNG,-2,0 - 0,,"2,720 / 1"
295,293,THA THA,Natthakorn JAIAREREE Thanapim KAWEENUNTAVONG,-2,0 - 0,,"2,720 / 1"
296,293,KOR KOR,KIM Seul Bi Seung Yeon SEONG,-2,0 - 0,,"2,720 / 1"
297,298,FRA FRA,Audrey FONTAINE Emilie LEFEL,-2,0 - 0,,"2,680 / 4"
298,299,RUS RUS,Anna KRASNOSCHEKOVA Anastasia NESTEROVA,-2,0 - 0,,"2,670 / 2"
299,299,DEN DEN,Amalie Hertz HANSEN Ditte SØBY HANSEN,-2,0 - 0,,"2,670 / 2"
300,299,TUR TUR,Büşra BENK Merve COBAN,103,0 - 0,,"2,670 / 2"
301,299,DEN DEN,Sara ORTVANG Claudia PAREDES,-2,0 - 0,,"2,670 / 2"
302,299,DOM DOM,Nairoby Abigail JIMENEZ Bermary Altagracia POLANCO MUNOZ,-2,0 - 0,,"2,670 / 2"
303,299,SWE SWE,Louise ERIKSSON Clara NISTAD,-2,0 - 0,,"2,670 / 2"
304,305,DEN DEN,Julie FINNE-IPSEN Maiken FRUERGAARD,-3,0 - 0,,"2,660 / 2"
305,305,TPE TPE,LEE Wei Tzu YU Min Ju,-3,0 - 0,,"2,660 / 2"
306,307,TPE TPE,HUNG Shih Han Ying Chun LIN,-3,0 - 0,,"2,590 / 2"
307,307,THA THA,Ruethaichanok LAISUAN Kilasu OSTERMEYER,-3,0 - 0,,"2,590 / 2"
308,309,TPE TPE,YANG Ching Tun Jing Ya YE,-3,0 - 0,,"2,580 / 2"
309,310,HKG HKG,FAN Ka Yan WU Yi Ting,-3,0 - 0,,"2,550 / 2"
310,311,IND IND,NELAKURIHI Sikki Reddy S. Poorvisha Ram,-3,0 - 0,,"2,500 / 1"
311,311,KOR KOR,Ga Ae KANG Ja Yeong LEE,-3,0 - 0,,"2,500 / 1"
312,313,MAS MAS,Yee See CHEAH Yea Ching GOH,-2,0 - 0,,"2,440 / 2"
313,313,NGR NGR,Serimam BAJO Peace ORJI,-2,0 - 0,,"2,440 / 2"
314,313,THA THA,Kunjira KHONGDEE Sarita SUWANNAKITBORIHAN,-2,0 - 0,,"2,440 / 2"
315,313,RUS RUS,Maria SHEGUROVA Viktoriia VOROBEVA,-2,0 - 0,,"2,440 / 2"
316,313,AUS AUS,Celeste LEE Chloe LEE,-2,0 - 0,,"2,440 / 2"
317,318,SCO SCO,Kirsty GILMOUR Imogen BANKIER,-2,0 - 0,,"2,373 / 1"
318,319,SWE SWE,Berfin ASLAN Jenny WAN,-2,0 - 0,,"2,300 / 2"
319,320,PER PER,Camilla GARCIA Daniela ZAPATA,-2,0 - 0,,"2,290 / 2"
320,320,SLO SLO,Iza SALEHAR Lia SALEHAR,-2,0 - 0,,"2,290 / 2"
321,320,INA INA,Sinta Arum ANTASARI Linda Mutiara PERTIWI,-2,0 - 0,,"2,290 / 2"
322,320,PER PER,Chiara CARRANZA Camila DUANY,-2,0 - 0,,"2,290 / 2"
323,320,PER PER,Ines CASTILLO Paula LA TORRE REGAL,-2,0 - 0,,"2,290 / 2"
324,320,TUR TUR,Merve DEMIR Basak KILIC,213,0 - 0,,"2,290 / 2"
325,320,INA INA,Mychelle Crhystine BANDASO Serena KANI,-2,0 - 0,,"2,290 / 2"
326,327,NZL NZL,Vicki COPELAND Anona PAK,-3,0 - 0,,"2,270 / 2"
327,328,NZL NZL,Soomi Lina LEE Kylie LUO,-3,0 - 0,,"2,220 / 2"
328,329,IND IND,Shruti MUNDADA Riya PILLAI,-3,0 - 0,,"2,220 / 1"
329,329,IND IND,Nisha KARAMCHAND Rachita SAHDEV,-3,0 - 0,,"2,220 / 1"
330,329,IND IND,CH. Poornima Smriti NAGARKOTI,-3,0 - 0,,"2,220 / 1"
331,329,IND IND,Lalita DAHIYA Jyoti NASHIER,-3,0 - 0,,"2,220 / 1"
332,329,INA AUS,Sylvina KURNIAWAN Talia SAUNDERS,-3,0 - 0,,"2,220 / 1"
333,334,IRI IRI,Sara DELAVARI Pegah KAMRANI,-3,0 - 0,,"2,200 / 1"
334,334,IRI IRI,Feizmanesh ELNAZ Safora ZAMANLO,-3,0 - 0,,"2,200 / 1"
335,334,IRI IRI,Yosra BEIGI Yeganeh KERMANI,-3,0 - 0,,"2,200 / 1"
336,334,CHN CHN,DING Kexin WANG Zixian,-3,0 - 0,,"2,200 / 1"
337,334,CHN CHN,CHEN Xiaofei HUANG Zhiying,-3,0 - 0,,"2,200 / 1"
338,334,ENG ENG,Nicola GRESTY Devon MINNIS,-3,0 - 0,,"2,200 / 1"
339,334,NGR NGR,Grace DANIEL Braimoh MARIA,-3,0 - 0,,"2,200 / 1"
340,334,UKR UKR,Maryna ILYINSKAYA Yelyzaveta ZHARKA,0,0 - 0,,"2,200 / 1"
341,334,DEN DEN,Irina Amalie ANDERSEN Julie Dawall JAKOBSEN,-3,0 - 0,,"2,200 / 1"
342,334,IRI IRI,Kiana HASHEMI Zahra KAHRIZI,-3,0 - 0,,"2,200 / 1"
343,334,CHN CHN,CHEN Lu ZHOU Chaomin,-3,0 - 0,,"2,200 / 1"
344,334,TUR TUR,Aliye DEMIRBAG Kübra KARATAS,0,0 - 0,,"2,200 / 1"
345,334,SRI SRI,Achini RATNASIRI Upuli Samanthika WEERASINGHE,-3,0 - 0,,"2,200 / 1"
346,334,FRA FRA,Marie BATOMENE Lea PALERMO,-3,0 - 0,,"2,200 / 1"
347,334,JPN JPN,Saki HAYATA Haruko SUZUKI,-3,0 - 0,,"2,200 / 1"
348,334,JPN JPN,Anna DOI Ayako SAKURAMOTO,-3,0 - 0,,"2,200 / 1"
349,334,SLO SLO,Ana Marija SETINA Kaja STANKOVIC,-3,0 - 0,,"2,200 / 1"
350,334,TPE TPE,CHANG Ya Lan Chia Hsin LEE,-3,0 - 0,,"2,200 / 1"
351,334,ENG ENG,Molly CHAPMAN Freya PATEL-REDFEARN,-3,0 - 0,,"2,200 / 1"
352,334,TPE TPE,Szu Yu CHEN Tsun Yu LIN,-3,0 - 0,,"2,200 / 1"
353,334,GER GER,Anika DÖRR Kira KATTENBECK,-3,0 - 0,,"2,200 / 1"
354,334,CHI CHI,Nicole NAVARRETE Nicol SALINAS,-3,0 - 0,,"2,200 / 1"
355,334,CHI CHI,Ashley MONTRE Javiera TORRES,-3,0 - 0,,"2,200 / 1"
356,334,HUN HUN,Agnes KOROSI Laura SAROSI,-3,0 - 0,,"2,200 / 1"
357,334,AUS AUS,Claudia LAM Susan WANG,-3,0 - 0,,"2,200 / 1"
