,RANK,COUNTRY,PLAYER,CHANGE +/-,WIN - LOSE,PRIZE MONEY,POINTS / TOURNAMENTS
0,1,JPN JPN,Misaki MATSUTOMO Ayaka TAKAHASHI,0,173 - 91,"$332,502.26","75,029 / 17"
1,2,CHN CHN,LUO Ying LUO Yu,1,99 - 34,"$198,475.00","71,980 / 15"
2,3,DEN DEN,Kamilla RYTTER JUHL Christinna PEDERSEN,1,150 - 65,"$343,433.43","70,030 / 16"
3,4,INA INA,Nitya Krishinda MAHESWARI Greysia POLII,1,95 - 43,"$231,637.13","69,562 / 16"
4,5,CHN CHN,WANG Xiaoli YU Yang (F),-3,189 - 27,"$1,114,243.75","63,330 / 9"
5,6,CHN CHN,MA Jin TANG Yuanting,0,42 - 12,"$336,755.00","61,819 / 9"
6,7,JPN JPN,Reika KAKIIWA Miyuki MAEDA,0,71 - 43,"$241,501.45","57,090 / 16"
7,8,CHN CHN,TIAN Qing ZHAO Yunlei,0,161 - 32,"$718,719.25","56,950 / 6"
8,9,NED NED,Eefje MUSKENS Selena PIEK,0,83 - 33,"$71,029.24","51,385 / 20"
9,10,MAS MAS,Vivian Kah Mun HOO Khe Wei WOON,1,91 - 67,"$65,232.64","48,124 / 16"
10,11,JPN JPN,Shizuka MATSUO Mami NAITO,-1,141 - 85,"$147,388.32","47,440 / 14"
11,12,JPN JPN,Naoko FUKUMAN Kurumi YONAO,1,60 - 33,"$23,391.22","47,260 / 16"
12,13,IND IND,Jwala GUTTA Ashwini PONNAPPA,-1,68 - 78,"$75,325.74","46,314 / 17"
13,14,BUL BUL,Gabriela STOEVA Stefani STOEVA,0,162 - 58,"$38,986.00","44,590 / 16"
14,15,CHN CHN,OU Dongni YU Xiaohan,2,27 - 4,"$91,859.99","42,600 / 7"
15,16,KOR KOR,LEE So Hee SHIN Seung Chan,-1,101 - 50,"$66,981.22","41,860 / 12"
16,17,KOR KOR,GO Ah Ra YOO Hae Won,-1,61 - 45,"$56,582.48","41,550 / 12"
17,18,THA THA,Puttita SUPAJIRAKUL Sapsiree TAERATTANACHAI,0,26 - 36,"$34,726.19","39,645 / 18"
18,19,MAS MAS,Amelia Alicia ANSCELLY Fie Cho SOONG,1,61 - 43,"$27,931.54","39,230 / 14"
19,20,THA THA,Jongkolphan KITITHARAKUL Rawinda PRAJONGJAI,3,27 - 27,"$11,160.60","38,520 / 18"
20,21,USA USA,Eva LEE Paula Lynn OBANANA,1,100 - 67,"$27,952.45","38,271 / 21"
21,22,KOR KOR,JUNG Kyung Eun CHANG Ye Na,-1,11 - 9,"$211,337.64","37,845 / 8"
22,23,GER GER,Carla NELTE Johanna GOLISZEWSKI,-4,52 - 50,"$28,406.25","37,270 / 22"
23,24,ENG ENG,Heather OLVER Lauren SMITH,1,33 - 21,"$34,896.75","36,549 / 24"
24,25,JPN JPN,Ayane KURIHARA Naru SHINOYA,1,38 - 17,"$21,223.61","35,610 / 12"
25,26,RUS RUS,Evgeniya KOSETSKAYA Ekaterina BOLOTOVA,1,40 - 22,"$15,384.75","34,922 / 12"
26,27,INA INA,Pia Zebadiah BERNADETH Rizki Amelia PRADIPTA,-3,83 - 55,"$84,387.49","34,470 / 11"
27,28,GER GER,Birgit MICHELS Isabel HERTTRICH,0,17 - 19,"$37,414.90","34,266 / 16"
28,29,NED NED,Samantha BARNING Iris TABELING,1,41 - 37,"$22,970.45","33,122 / 19"
29,30,TUR TUR,Neslihan YIGIT Ozge BAYRAK,-1,91 - 54,"$15,160.81","32,898 / 18"
30,31,KOR KOR,CHAE Yoo Jung KIM So Yeong,10,11 - 8,"$48,735.61","31,460 / 8"
31,32,TPE TPE,HSU Ya Ching PAI Yu Po,3,19 - 33,"$5,503.07","31,100 / 19"
32,33,IND IND,Pradnya GADRE NELAKURIHI Sikki Reddy,-2,31 - 20,"$17,192.36","30,890 / 14"
33,34,HKG HKG,POON Lok Yan TSE Ying Suet,15,70 - 72,"$66,284.98","30,627 / 10"
34,35,TPE TPE,HSIEH Pei Chen WU Ti Jung,2,19 - 20,"$18,235.60","30,600 / 21"
35,36,SIN SIN,Yu Yan Vanessa NEO Shinta Mulia SARI,-4,25 - 35,"$78,656.92","30,237 / 15"
36,37,KOR KOR,CHANG Ye Na LEE So Hee,16,0 - 0,"$157,418.09","29,880 / 5"
37,38,INA INA,Devi Tika PERMATASARI Keshya Nurvita HANADIA,-4,0 - 0,"$23,545.91","29,620 / 11"
38,39,JPN JPN,Yuki FUKUSHIMA Sayaka HIROTA,7,0 - 0,,"29,240 / 9"
39,40,CAN CAN,Alex BRUCE Phyllis CHAN,-1,0 - 0,,"29,038 / 17"
40,41,BRA BRA,Lohaynny VICENTE Luana VICENTE,6,0 - 0,,"28,323 / 10"
41,42,THA THA,Chaladchalam Chayanit Phataimas MUENWONG,0,0 - 0,,"27,950 / 15"
42,43,THA THA,Duanganong AROONKESORN Kunchala VORAVICHITCHAIKUL,-5,0 - 0,,"27,893 / 9"
43,44,INA INA,Suci Rizky ANDINI Maretha Dea GIOVANI,-1,0 - 0,,"27,850 / 10"
44,45,FRA FRA,Delphine LANSAC Emilie LEFEL,-9,0 - 0,,"27,544 / 14"
45,46,INA INA,Anggia Shitta AWANDA Mahadewi Istirani NI KETUT,9,0 - 0,,"27,440 / 9"
46,47,CHN CHN,TANG Jinhua TIAN Qing,-7,0 - 0,,"27,440 / 4"
47,48,HKG HKG,CHAN Kaka Tsz Ka TSE Ying Suet,-15,0 - 0,,"27,170 / 9"
48,49,INA INA,Dian FITRIANI Nadya MELATI,-5,0 - 0,,"26,280 / 9"
49,50,JPN JPN,Shiho TANAKA Koharu YONEMOTO,6,0 - 0,,"26,250 / 9"
50,51,KOR KOR,JUNG Kyung Eun SHIN Seung Chan,26,0 - 0,,"25,960 / 5"
51,52,ENG ENG,Sophie BROWN Kate ROBERTSHAW,-7,0 - 0,,"25,580 / 11"
52,53,INA INA,Gebby Ristiyani IMAWAN Tiara Rosalia NURAIDAH,4,0 - 0,,"24,780 / 10"
53,54,CHN CHN,CHEN Qingchen JIA Yifan,-6,0 - 0,,"24,700 / 7"
54,55,MAS MAS,Meng Yean LEE Yin Loo LIM,-5,0 - 0,,"24,350 / 12"
55,56,CHN CHN,BAO Yixin TANG Yuanting,-5,0 - 0,,"23,950 / 3"
56,57,TPE TPE,CHIANG Kai Hsin WU Fang Chien,4,0 - 0,,"21,990 / 14"
57,58,RUS RUS,Anastasia CHERVYAKOVA Nina VISLOVA,-6,0 - 0,,"21,070 / 8"
58,59,BRA BRA,Paula B PEREIRA Fabiana SILVA,-1,0 - 0,,"20,882 / 9"
59,60,KOR KOR,CHANG Ye Na YOO Hae Won,0,0 - 0,,"20,670 / 4"
60,61,MAS MAS,YAP Cheng Wen Joyce Wai Chi CHOONG,1,0 - 0,,"20,370 / 13"
61,62,DEN DEN,Lena GREBAK Maria HELSBOL,1,0 - 0,,"19,657 / 8"
62,63,IRI IRI,Negin AMIRIPOUR AGHAEI Hajiagha Soraya,1,0 - 0,,"19,410 / 10"
63,64,DEN DEN,Maiken FRUERGAARD Sara THYGESEN,-5,0 - 0,,"18,680 / 9"
64,65,TUR TUR,Cemre FERE Ebru TUNALI,0,0 - 0,,"18,170 / 10"
65,66,GER GER,Linda EFLER Lara KAEPPLEIN,6,0 - 0,,"17,710 / 12"
66,67,CHN CHN,TANG Jinhua ZHONG Qianxin,1,0 - 0,,"17,420 / 3"
67,68,EGY EGY,Menna ELTANANY Nadine ASHRAF,2,0 - 0,,"17,303 / 16"
68,69,CHN CHN,BAO Yixin TANG Jinhua,-15,0 - 0,,"17,000 / 4"
69,70,GER GER,Carola BOTT Jennifer KARNOTT,-3,0 - 0,,"16,870 / 10"
70,71,FRA FRA,Lorraine BAUMANN Audrey FONTAINE,-5,0 - 0,,"16,860 / 9"
71,72,UKR UKR,Natalya VOYTSEKH Yelyzaveta ZHARKA,-3,0 - 0,,"16,840 / 9"
72,73,TPE TPE,CHENG Chi Ya Chia Hsin LEE,13,0 - 0,,"16,820 / 8"
73,74,FIN FIN,Mathilda LINDHOLM Jenny NYSTROM,-1,0 - 0,,"15,885 / 12"
74,75,INA INA,Apriani RAHAYU Jauza Fadhila SUGIARTO,-1,0 - 0,,"15,640 / 9"
75,76,JPN JPN,Rie ETOH Aoi MATSUDA,21,0 - 0,,"15,620 / 6"
76,77,TPE TPE,CHEN Hsiao Huan LAI Chia Wen,-1,0 - 0,,"15,310 / 7"
77,78,EGY EGY,Doha HANY Hadia HOSNY,11,0 - 0,,"14,870 / 10"
78,79,DEN DEN,Amanda MADSEN Isabella NIELSEN,0,0 - 0,,"14,760 / 9"
79,80,CHN CHN,YU Yang (F) ZHONG Qianxin,0,0 - 0,,"14,700 / 2"
80,81,CHN CHN,XIA Huan ZHONG Qianxin,1,0 - 0,,"14,560 / 3"
81,82,BEL BEL,Steffi ANNYS Flore VANDENHOUCKE,-4,0 - 0,,"14,535 / 11"
82,83,IND IND,Dhanya NAIR Mohita SAHDEV,0,0 - 0,,"14,500 / 8"
83,84,PER PER,Katherine WINDER Luz Maria ZORNOZA,-13,0 - 0,,"14,330 / 8"
84,85,HKG HKG,CHAN Kaka Tsz Ka YUEN Sin Ying,9,0 - 0,,"14,156 / 8"
85,86,ENG ENG,Jenny MOORE Victoria WILLIAMS,-1,0 - 0,,"13,870 / 8"
86,87,PER PER,Daniela MACIAS Danica NISHIMURA,-12,0 - 0,,"13,730 / 7"
87,88,INA INA,Komala DEWI Vita MARISSA,-1,0 - 0,,"13,410 / 6"
88,89,RUS RUS,Irina KHLEBKO Elena KOMENDROVSKAJA,-1,0 - 0,,"13,230 / 8"
89,90,FRA FRA,Lea PALERMO Anne TRAN,-9,0 - 0,,"13,170 / 6"
90,91,KOR KOR,CHAE Yoo Jung KIM Ji Won,0,0 - 0,,"13,130 / 4"
91,92,AUS AUS,Setyana MAPASA Gronya SOMERVILLE,0,0 - 0,,"13,090 / 6"
92,93,TPE TPE,Ching Hui CHANG Hsin Tien CHANG,0,0 - 0,,"13,030 / 7"
93,94,CHN CHN,TIAN Qing XIA Huan,2,0 - 0,,"12,740 / 2"
94,95,CZE CZE,Katerina TOMALOVA Sarka KRIZKOVA,3,0 - 0,,"12,577 / 9"
95,96,GER GER,Lisa KAMINSKI Hannah POHL,4,0 - 0,,"12,340 / 9"
96,97,JPN JPN,Mayu MATSUMOTO Wakana NAGAHARA,4,0 - 0,,"12,310 / 6"
97,98,INA INA,Pia Zebadiah BERNADETH Aprilsasi Putri LEJARSAR VARIELLA,31,0 - 0,,"11,980 / 4"
98,99,DEN DEN,Emilie JUUL MOLLER Cecilie SENTOW,3,0 - 0,,"11,750 / 8"
99,100,GER GER,Kira KATTENBECK Franziska VOLKMANN,-1,0 - 0,,"11,630 / 9"
100,101,EST EST,Kristin KUUBA Helina RÜÜTEL,3,0 - 0,,"11,550 / 9"
101,102,INA INA,Shendy Puspa IRAWATI Vita MARISSA,-18,0 - 0,,"11,540 / 4"
102,103,MEX MEX,Haramara GAITAN Sabrina SOLIS,20,0 - 0,,"11,320 / 6"
103,104,FRA FRA,Marie BATOMENE Emilie LEFEL,28,0 - 0,,"11,070 / 5"
104,105,ESP ESP,Laura MOLINA Haidee OJEDA,-10,0 - 0,,"10,650 / 7"
105,106,RUS RUS,Victoria DERGUNOVA Olga MOROZOVA,0,0 - 0,,"10,520 / 5"
106,107,IND IND,Aparna BALAN Prajakta SAWANT,1,0 - 0,,"10,310 / 4"
107,108,VIE VIE,Thi Sen NGUYEN Thi Trang (B) VU,1,0 - 0,,"10,292 / 6"
108,109,AUS AUS,Leanne CHOO Gronya SOMERVILLE,1,0 - 0,,"10,192 / 3"
109,110,CHN CHN,HUANG Yaqiong MA Jin,1,0 - 0,,"9,940 / 2"
110,111,TUR TUR,Cemre FERE Ebru YAZGAN,40,0 - 0,,"9,930 / 4"
111,112,KOR KOR,KIM So Yeong GO Ah Ra,0,0 - 0,,"9,840 / 3"
112,113,ARG ARG,Florencia BERNATENE Daiana GARMENDIA,-8,0 - 0,,"9,790 / 7"
113,114,THA THA,Supanida KATETHONG Panjarat PRANSOPON,0,0 - 0,,"9,730 / 6"
114,115,INA INA,Della Destiara HARIS Rizki Amelia PRADIPTA,0,0 - 0,,"9,550 / 4"
115,116,IND IND,J. Meghana K. Maneesha,0,0 - 0,,"9,490 / 4"
116,117,THA THA,Savitree AMITRAPAI Pacharapun CHOCHUWONG,2,0 - 0,,"9,250 / 5"
117,118,CHN CHN,TANG Yuanting HUANG Yaqiong,2,0 - 0,,"9,220 / 2"
118,119,CHN CHN,ZHAO Yunlei ZHONG Qianxin,2,0 - 0,,"9,200 / 1"
119,120,FRA FRA,Laura CHOINET Teshana VIGNES WARAN,2,0 - 0,,"9,150 / 5"
120,121,JPN JPN,Arisa HIGASHINO Chisato HOSHI,3,0 - 0,,"9,050 / 4"
121,122,KOR KOR,Hye Rin KIM Hee Yong KONG,57,0 - 0,,"8,970 / 4"
122,123,GER GER,Barbara BELLENBERG Ramona HACKS,-10,0 - 0,,"8,860 / 8"
123,124,SUI SUI,Celine BURKART Tiffany GIRONA,7,0 - 0,,"8,840 / 11"
124,125,DEN SWE,Lena GREBAK Emelie FABBEKE,-35,0 - 0,,"8,830 / 3"
125,126,INA INA,Della Destiara HARIS Rosyita Eka PUTRI SARI,-1,0 - 0,,"8,750 / 2"
126,127,INA INA,Nisak Puji LESTARI Merisa Cindy SAHPUTRI,-1,0 - 0,,"8,740 / 4"
127,128,MRI MRI,Kate FOO KUNE Yeldy Marie LOUISON,-1,0 - 0,,"8,717 / 4"
128,129,TPE TPE,CHENG Wen Hsing SHUAI Pei Ling,-1,0 - 0,,"8,620 / 3"
129,130,RSA RSA,Michelle BUTLER-EMMETT Elme DE VILLIERS,0,0 - 0,,"8,570 / 4"
130,131,KOR KOR,EOM Hye Won KIM Ha Na,51,0 - 0,,"8,480 / 3"
131,132,FRA FRA,Audrey FONTAINE Anne TRAN,6,0 - 0,,"8,330 / 5"
132,133,DEN SWE,Thilde MATTISSON Emma WENGBERG,42,0 - 0,,"8,290 / 5"
133,134,AUS AUS,Jennifer TAM Alice WU,0,0 - 0,,"8,230 / 4"
134,135,TUR TUR,Neslihan KILIC Ebru YAZGAN,0,0 - 0,,"8,180 / 7"
135,136,CHN CHN,HUANG Dongping ZHU Mai Ci,0,0 - 0,,"8,140 / 6"
136,137,IND IND,Shruti MUNDADA Riya PILLAI,0,0 - 0,,"7,820 / 3"
137,138,WAL ENG,Aimee MORAN Kerri SCOTT,1,0 - 0,,"7,720 / 7"
138,139,KOR KOR,JUNG Kyung Eun KIM Ha Na,-36,0 - 0,,"7,700 / 1"
139,140,MEX MEX,Cynthia GONZALEZ Mariana UGALDE,-22,0 - 0,,"7,690 / 5"
140,141,TPE TPE,Szu Yu CHEN Yu Chieh CHENG,-1,0 - 0,,"7,670 / 7"
141,142,UKR UKR,Anastasiya DMYTRYSHYN Darya SAMARCHANTS,-1,0 - 0,,"7,610 / 7"
142,143,RSA RSA,Jennifer FRY Sandra LE GRANGE,-1,0 - 0,,"7,595 / 6"
143,144,TPE TPE,CHENG Chi Ya PAI Hsiao Ma,-1,0 - 0,,"7,550 / 4"
144,145,RUS RUS,Tatjana BIBIK Elena KOMENDROVSKAJA,-1,0 - 0,,"7,480 / 5"
145,146,UZB UZB,Anait KHURSHUDYAN Valeriya MUSHTAKOVA,1,0 - 0,,"7,360 / 6"
146,147,INA INA,Suci Rizky ANDINI Tiara Rosalia NURAIDAH,1,0 - 0,,"7,360 / 3"
147,148,KOR KOR,EOM Hye Won JUNG Kyung Eun,1,0 - 0,,"7,350 / 2"
148,149,RUS RUS,Tatjana BIBIK Olga GOLOVANOVA,1,0 - 0,,"7,160 / 5"
149,150,RUS RUS,Anastasia CHERVYAKOVA Olga MOROZOVA,67,0 - 0,,"7,120 / 3"
150,151,CHN CHN,HUANG Dongping LI Yinhui,2,0 - 0,,"7,000 / 1"
151,152,SCO SCO,Rebekka FINDLAY Caitlin PRINGLE,3,0 - 0,,"6,890 / 7"
152,153,MAS MAS,Kah Mun CHIN Wei Chyi TI,3,0 - 0,,"6,840 / 4"
153,154,SEY SEY,Juliette AH-WAN Allisen CAMILLE,3,0 - 0,,"6,760 / 5"
154,155,MAS MAS,Erica Pei Shan KHOO Wei Chyi TI,3,0 - 0,,"6,760 / 4"
155,156,IRL IRL,Sara BOYLE Rachael DARRAGH,4,0 - 0,,"6,701 / 8"
156,157,NZL NZL,Alyse DERBY Rebecca GODDARD,4,0 - 0,,"6,700 / 4"
157,158,LAT LAT,Ieva POPE Kristine SEFERE,4,0 - 0,,"6,655 / 8"
158,159,CHI CHI,Tingting CHOU Camila MACAYA,4,0 - 0,,"6,620 / 5"
159,160,ENG ENG,Jessica HOPTON Lydia Jane POWELL,4,0 - 0,,"6,600 / 3"
160,161,INA INA,Komala DEWI Jenna GOZALI,4,0 - 0,,"6,590 / 3"
161,162,DEN DEN,Julie FINNE-IPSEN Rikke Søby HANSEN,4,0 - 0,,"6,440 / 3"
162,163,CAN CAN,Nicole GRETHER Charmaine REID,4,0 - 0,,"6,400 / 3"
163,164,FIN FIN,Anna PAAVOLA Sonja PEKKOLA,4,0 - 0,,"6,330 / 5"
164,165,THA THA,Pacharapun CHOCHUWONG Chanisa TEACHAVORASINSKUN,4,0 - 0,,"6,310 / 4"
165,166,SIN SIN,Yi Ling Elaine CHUA Citra Dewi SARI,4,0 - 0,,"6,300 / 4"
166,167,SCO SCO,Kirsty GILMOUR Imogen BANKIER,4,0 - 0,,"6,223 / 3"
167,168,UGA ZAM,Bridget Shamim BANGI Ogar SIAMUPANGILA,4,0 - 0,,"6,170 / 4"
168,169,MAS MAS,"Peiy Yee, Payee LIM Peiy Zhean LIM",4,0 - 0,,"6,120 / 8"
169,170,TUR TUR,Fatma Nur YAVUZ Kader İNAL,4,0 - 0,,"6,100 / 4"
170,171,INA INA,Melvira OKLAMONA Rika ROSITAWATI,5,0 - 0,,"6,080 / 3"
171,172,INA INA,Meiliana JAUHARI Aprilsasi Putri LEJARSAR VARIELLA,-55,0 - 0,,"6,070 / 2"
172,173,NZL NZL,Sally FU Christine ZHANG,4,0 - 0,,"6,030 / 5"
173,174,TPE TPE,Tsun Yu LIN YU Wen KUO,57,0 - 0,,"6,000 / 3"
174,175,CHN CHN,HUANG Yaqiong ZHONG Qianxin,3,0 - 0,,"5,950 / 1"
175,176,RUS RUS,Ekaterina KUT Daria SEREBRIAKOVA,4,0 - 0,,"5,880 / 5"
176,177,EST EST,Kati-Kreet MARRAN Sale - Liis TEESALU,4,0 - 0,,"5,860 / 8"
177,178,MAS MAS,Yee See CHEAH Yea Ching GOH,-32,0 - 0,,"5,860 / 4"
178,179,AUS SUI,Leanne CHOO Nadia FANKHAUSER,109,0 - 0,,"5,830 / 2"
179,180,DEN DEN,Cecilie FINNE-IPSEN Julie Dawall JAKOBSEN,-47,0 - 0,,"5,660 / 5"
180,181,NED NED,Alida CHEN Cheryl SEINEN,3,0 - 0,,"5,650 / 5"
181,182,THA THA,Kilasu OSTERMEYER Natcha SAENGCHOTE,3,0 - 0,,"5,640 / 4"
182,183,KOR KOR,CHOI Hye In KIM Ha Na,3,0 - 0,,"5,610 / 2"
183,184,INA INA,Maretha Dea GIOVANI Rosyita Eka PUTRI SARI,3,0 - 0,,"5,600 / 2"
184,185,INA INA,Ratoputri FEBTRIA ADISTRA Rosy Oktavia PANCASARI,-33,0 - 0,,"5,560 / 4"
185,186,NZL NZL,Emma CHAPPLE Danielle TAHURI,2,0 - 0,,"5,520 / 2"
186,187,TPE TPE,YANG Ching Tun YU Min Ju,2,0 - 0,,"5,500 / 3"
187,188,ENG ENG,Chloe BIRCH Alyssa LIM,-34,0 - 0,,"5,400 / 4"
188,189,AUS AUS,Leanne CHOO Setyana MAPASA,1,0 - 0,,"5,370 / 2"
189,190,MAS MAS,Yea Ching GOH Zhen YAP,77,0 - 0,,"5,320 / 4"
190,191,THA THA,Nattcha CHATPUTTARN Fareeda LOOG,1,0 - 0,,"5,240 / 5"
191,192,UKR UKR,Vladyslava LESNAYA Anna MIKHALKOVA,1,0 - 0,,"5,200 / 5"
192,193,TPE TPE,Wan Ting CHEN Shih Jyun JHOU,103,0 - 0,,"5,060 / 4"
193,194,CHN CHN,BAO Yixin WANG Xiaoli,1,0 - 0,,"5,040 / 1"
194,195,INA INA,Mahadewi Istirani NI KETUT Melvira OKLAMONA,1,0 - 0,,"5,000 / 2"
195,196,ENG ENG,Chloe BIRCH Jenny WALLWORK,1,0 - 0,,"4,990 / 3"
196,197,PHI PHI,Eleanor Christine INLAYO Alyssa Yasbel LEONARDO,1,0 - 0,,"4,960 / 4"
197,198,NGR NGR,Grace GABRIEL Braimoh MARIA,1,0 - 0,,"4,932 / 3"
198,199,CHN CHN,BAO Yixin ZHONG Qianxin,145,0 - 0,,"4,880 / 2"
199,200,MAS MAS,Yee See CHEAH Kah Mun CHIN,64,0 - 0,,"4,820 / 4"
200,201,SIN SIN,Yi Ling Elaine CHUA Wei Han TAN,-1,0 - 0,,"4,785 / 3"
201,202,INA INA,Phita Haningtyas MENTARI Zarra Faza AZKA,-1,0 - 0,,"4,730 / 4"
202,203,RUS RUS,Olga GOLOVANOVA Viktoriia VOROBEVA,-1,0 - 0,,"4,710 / 3"
203,204,RUS RUS,Tatjana BIBIK Ksenia POLIKARPOVA,0,0 - 0,,"4,700 / 2"
204,204,DOM DOM,Bermary Altagracia POLANCO MUNOZ Daigenis SATURRIA,0,0 - 0,,"4,700 / 2"
205,204,KOR KOR,CHAE Yoo Jung Hye Rin KIM,0,0 - 0,,"4,700 / 2"
206,207,AUS AUS,Talia SAUNDERS Jennifer TAM,0,0 - 0,,"4,680 / 1"
207,208,TPE TPE,Ling Fang HU SHUAI Pei Ling,0,0 - 0,,"4,640 / 3"
208,208,KEN KEN,Mercy JOSEPH Lavina MARTINS,0,0 - 0,,"4,640 / 3"
209,210,HUN HUN,Agnes KOROSI Orsolya VARGA,0,0 - 0,,"4,590 / 4"
210,211,TPE TPE,Pei Shan HSIEH Chih Chen LEE,54,0 - 0,,"4,580 / 4"
211,212,JPN JPN,Rira KAWASHIMA Saori OZAKI,-1,0 - 0,,"4,520 / 2"
212,213,FRA FRA,Marie BATOMENE Stacey GUERIN,-54,0 - 0,,"4,510 / 3"
213,214,IRL WAL,Sinead CHAMBERS Jordan HART,-2,0 - 0,,"4,490 / 3"
214,215,TPE TPE,HUNG Shih Chieh HUNG Shih Han,57,0 - 0,,"4,480 / 3"
215,216,GER GER,Barbara BELLENBERG Eva JANSSENS,-3,0 - 0,,"4,410 / 3"
216,216,MAS MAS,Kah Mun CHIN Mei Kuan CHOW,-3,0 - 0,,"4,410 / 3"
217,218,BLR BLR,Anastasiya CHERNIAVSKAYA Alesia ZAITSAVA,-3,0 - 0,,"4,380 / 6"
218,219,AUS TPE,Hsuan-Yu Wendy CHEN Shu Yu LIN,-3,0 - 0,,"4,330 / 2"
219,220,INA INA,Nisak Puji LESTARI Rika ROSITAWATI,-3,0 - 0,,"4,320 / 2"
220,221,KOR KOR,CHANG Ye Na KIM So Yeong,-114,0 - 0,,"4,320 / 1"
221,222,CZE CZE,Magdalena LAJDOVA Denisa SIKALOVA,-3,0 - 0,,"4,230 / 5"
222,223,THA THA,Kunjira KHONGDEE Sarita SUWANNAKITBORIHAN,-3,0 - 0,,"4,200 / 4"
223,224,NED NED,Gayle MAHULETTE Cheryl SEINEN,-3,0 - 0,,"4,200 / 2"
224,225,TPE TPE,Tzu Chin PAN Hsin-Yu TSAI,-3,0 - 0,,"4,150 / 4"
225,226,SLO SLO,Katarina BETON Ana Marija SETINA,-3,0 - 0,,"4,040 / 6"
226,227,DEN DEN,Maiken FRUERGAARD Camilla MARTENS,-3,0 - 0,,"4,020 / 2"
227,228,INA INA,Della Destiara HARIS Gebby Ristiyani IMAWAN,-3,0 - 0,,"4,010 / 2"
228,229,VIE VIE,Thu Huyen LE Nhu Thao PHAM,-3,0 - 0,,"3,970 / 3"
229,230,NGR NGR,Tosin Damilola ATOLAGBE Susan IDEH,-3,0 - 0,,"3,952 / 3"
230,231,NED NED,Soraya DE VISCH EIJBERGEN Iris TABELING,-3,0 - 0,,"3,950 / 2"
231,231,INA INA,Ririn AMELIA Komala DEWI,-3,0 - 0,,"3,950 / 2"
232,233,ITA ITA,Ramona Gloria PIRVANESCU Megumi SONODA,-3,0 - 0,,"3,910 / 5"
233,234,MRI NGR,Kate FOO KUNE Grace GABRIEL,-2,0 - 0,,"3,880 / 2"
234,235,MAS MAS,Vivian Kah Mun HOO Hui Lin NG,-2,0 - 0,,"3,850 / 1"
235,235,IND IND,Jamuna Rani RACHAPALLI Leela Lakshmi RACHAPALLI,-2,0 - 0,,"3,850 / 1"
236,235,TPE TPE,HUANG Mei Ching LIU Shu Chih,-2,0 - 0,,"3,850 / 1"
237,235,CAN CAN,Rachel HONDERICH Michelle LI,-90,0 - 0,,"3,850 / 1"
238,235,KOR KOR,EOM Hye Won YOO Hae Won,-2,0 - 0,,"3,850 / 1"
239,235,KOR KOR,CHOI Hye In GO Ah Ra,-2,0 - 0,,"3,850 / 1"
240,235,IND IND,Sanyogita GHORPADE Arathi Sara SUNIL,-2,0 - 0,,"3,850 / 1"
241,235,AUS AUS,Hsuan-Yu Wendy CHEN Louisa MA,-2,0 - 0,,"3,850 / 1"
242,235,KOR KOR,CHAE Yoo Jung JUNG Kyung Eun,-2,0 - 0,,"3,850 / 1"
243,235,TPE TPE,CHEN Hsiao Huan HUANG Mei Ching,-2,0 - 0,,"3,850 / 1"
244,245,THA THA,Chaladchalam Chayanit Natcha SAENGCHOTE,-3,0 - 0,,"3,840 / 3"
245,246,INA INA,Dianita SARASWATI Yulfira BARKAH,-3,0 - 0,,"3,810 / 3"
246,246,THA THA,Sararat CHUEBOCA Chasinee KOREPAP,-3,0 - 0,,"3,810 / 3"
247,248,POL POL,WITEK MAGDALENA Aneta WOJTKOWSKA,-45,0 - 0,,"3,780 / 4"
248,249,NZL NZL,Erena CALDER -HAWKINS Selena WU,-4,0 - 0,,"3,740 / 4"
249,250,GRE GRE,Aristea APOSTOLIDOU Eirini GOYGLERI,-4,0 - 0,,"3,730 / 4"
250,251,RUS RUS,Anastasia KHARLAMPOVICH Polina VORONKO,-4,0 - 0,,"3,720 / 2"
251,251,ENG ENG,Chloe BIRCH Emily WESTWOOD,-4,0 - 0,,"3,720 / 2"
252,251,NEP NEP,Nangsal TAMANG Sara Devi TAMANG,-4,0 - 0,,"3,720 / 2"
253,254,MAS MAS,Yen Wei PECK Zhen YAP,-4,0 - 0,,"3,680 / 4"
254,255,THA THA,Thanaporn KIAWCHA-ON Thanyasuda WONGYA,-4,0 - 0,,"3,670 / 3"
255,255,TUR TUR,Aliye DEMIRBAG Yaren DOLCU,-4,0 - 0,,"3,670 / 3"
256,257,DEN DEN,Julie FINNE-IPSEN Ditte SØBY HANSEN,-4,0 - 0,,"3,650 / 2"
257,258,INA INA,Melvira OKLAMONA Merisa Cindy SAHPUTRI,-4,0 - 0,,"3,640 / 2"
258,259,GUA GUA,Diana CORLETO SOTO Mariana Isabel PAIZ QUAN,-4,0 - 0,,"3,630 / 2"
259,260,KOR KOR,KIM Ha Na YOO Hae Won,-4,0 - 0,,"3,600 / 1"
260,260,TPE TPE,Hsin Tien CHANG CHENG Chi Ya,-4,0 - 0,,"3,600 / 1"
261,260,IND IND,Kuhoo GARG Ningshi Block HAZARIKA,-4,0 - 0,,"3,600 / 1"
262,263,RUS RUS,Olga GOLOVANOVA Victoria SLOBODJANUK,-4,0 - 0,,"3,570 / 2"
263,264,THA THA,Panjarat PRANSOPON Sarita SUWANNAKITBORIHAN,-4,0 - 0,,"3,510 / 3"
264,265,GER GER,Eva JANSSENS Yvonne LI,-4,0 - 0,,"3,440 / 3"
265,266,HKG HKG,CHAN Hung Yung YUEN Sin Ying,-4,0 - 0,,"3,390 / 3"
266,267,SIN SIN,Ren-ne ONG Chun Yi Deline QUEK,-4,0 - 0,,"3,320 / 3"
267,268,THA THA,Rawimon IAMRATANAMAETHEEKUL Supamart MINGCHUA,-2,0 - 0,,"3,270 / 2"
268,269,INA INA,Syifa FAUZIAH Virni Putri JAFAR,-2,0 - 0,,"3,210 / 3"
269,269,ESP ESP,Clara AZURMENDI Isabel FERNANDEZ,-2,0 - 0,,"3,210 / 3"
270,269,SLO SLO,Iza SALEHAR Lia SALEHAR,-2,0 - 0,,"3,210 / 3"
271,272,IND IND,Daksha GAUTAM Rachita SAHDEV,0,0 - 0,,"3,190 / 2"
272,272,IND IND,Jagriti NASHIER Jyoti NASHIER,0,0 - 0,,"3,190 / 2"
273,274,GER GER,Luise HEIM Yvonne LI,2,0 - 0,,"3,170 / 2"
274,275,THA THA,Phataimas MUENWONG Kilasu OSTERMEYER,2,0 - 0,,"3,150 / 2"
275,276,SCO SCO,Julie MACPHERSON Holly NEWALL,2,0 - 0,,"3,130 / 3"
276,277,IRL IRL,Sinead CHAMBERS Jennie KING,3,0 - 0,,"3,120 / 3"
277,278,NGR NGR,Dorcas Ajoke ADESOKAN Grace GABRIEL,3,0 - 0,,"3,120 / 2"
278,278,UKR UKR,Yuliya KAZARINOVA Mariya RUD,3,0 - 0,,"3,120 / 2"
279,278,RSA RSA,Michelle BUTLER-EMMETT Annari VILJOEN,3,0 - 0,,"3,120 / 2"
280,278,CHI CHI,HINOSTROZA Amparo SKARIC Mickaela,333,0 - 0,,"3,120 / 2"
281,278,THA THA,Natchpapha CHATUPORNKARNCHANA Kwanchanok SUDJAIPRAPARAT,3,0 - 0,,"3,120 / 2"
282,278,RUS RUS,Olga LIPKINA Julia ZAPOLSKAYA,3,0 - 0,,"3,120 / 2"
283,284,ENG ENG,Lauren SMITH Gabrielle ADCOCK,2,0 - 0,,"3,109 / 1"
284,285,TPE TPE,Wan Ching LIN Xiao Min LIN,144,0 - 0,,"3,080 / 4"
285,286,RUS RUS,Irina KHLEBKO Ksenia POLIKARPOVA,2,0 - 0,,"3,030 / 1"
286,286,USA USA,Jing Yu HONG Beiwen ZHANG,2,0 - 0,,"3,030 / 1"
287,286,CAN CAN,Grace GAO Rachel HONDERICH,-103,0 - 0,,"3,030 / 1"
288,286,MEX MEX,Haramara GAITAN Cynthia GONZALEZ,1,0 - 0,,"3,030 / 1"
289,286,KOR KOR,Hye Jeong KIM Keun Hye PARK,2,0 - 0,,"3,030 / 1"
290,286,NZL NZL,Angie LEUNG Jasmin Chung Man NG,2,0 - 0,,"3,030 / 1"
291,286,AUS AUS,Elena Yee-Man KWOK Claudia LAM,2,0 - 0,,"3,030 / 1"
292,286,RUS RUS,Alina DAVLETOVA Ksenia EVGENOVA,2,0 - 0,,"3,030 / 1"
293,294,INA INA,Weni ANGGRAINI Pia Zebadiah BERNADETH,1,0 - 0,,"2,960 / 2"
294,295,CRO CRO,Katarina GALENIC Stasa POZNANOVIC,2,0 - 0,,"2,850 / 3"
295,296,SUI MAS,Nadia FANKHAUSER Sannatasah SANIRU,-102,0 - 0,,"2,850 / 2"
296,297,ENG ENG,Helena LEWCZYNSKA Emily WESTWOOD,1,0 - 0,,"2,810 / 2"
297,298,SVK SVK,Jana CIZNAROVA Martina REPISKA,1,0 - 0,,"2,800 / 1"
298,298,CHN CHN,WU Qianqian XIA Chunyu,1,0 - 0,,"2,800 / 1"
299,298,CHN CHN,JIANG Binbin TANG Pingyang,1,0 - 0,,"2,800 / 1"
300,301,ENG ENG,Ira BANERJEE Jessica PUGH,1,0 - 0,,"2,750 / 2"
301,302,SUI SUI,Celine BURKART Cendrine HANTZ,1,0 - 0,,"2,740 / 2"
302,302,DEN DEN,Cecilie BJERGEN Trine VILLADSEN,1,0 - 0,,"2,740 / 2"
303,304,MAC MAC,WANG Rong ZHANG Zhibo,1,0 - 0,,"2,720 / 1"
304,304,GER NZL,Annika HORBACH Maria MASINIPENI,1,0 - 0,,"2,720 / 1"
305,304,HKG HKG,NG Wing Yung SHEK Hiu Yiu,1,0 - 0,,"2,720 / 1"
306,304,IND IND,D. Sudha Kalyani MUKHERJEE Riya,1,0 - 0,,"2,720 / 1"
307,304,AUS NZL,Tiffany HO Angie LEUNG,1,0 - 0,,"2,720 / 1"
308,304,THA THA,Natthakorn JAIAREREE Thanapim KAWEENUNTAVONG,1,0 - 0,,"2,720 / 1"
309,310,FRA FRA,Audrey FONTAINE Emilie LEFEL,1,0 - 0,,"2,680 / 4"
310,311,RUS RUS,Anna KRASNOSCHEKOVA Anastasia NESTEROVA,1,0 - 0,,"2,670 / 2"
311,311,DEN DEN,Amalie Hertz HANSEN Ditte SØBY HANSEN,-120,0 - 0,,"2,670 / 2"
312,311,DEN DEN,Sara ORTVANG Claudia PAREDES,1,0 - 0,,"2,670 / 2"
313,311,DOM DOM,Nairoby Abigail JIMENEZ Bermary Altagracia POLANCO MUNOZ,1,0 - 0,,"2,670 / 2"
314,315,TPE TPE,LEE Wei Tzu YU Min Ju,470,0 - 0,,"2,660 / 2"
315,316,CHN CHN,HUANG Yaqiong TANG Jinhua,0,0 - 0,,"2,660 / 1"
316,317,ITA ITA,Karin MARAN Marah PUNTER,1,0 - 0,,"2,590 / 3"
317,318,CHN CHN,DU Yue LI Yinhui,1,0 - 0,,"2,590 / 2"
318,318,THA THA,Ruethaichanok LAISUAN Kilasu OSTERMEYER,1,0 - 0,,"2,590 / 2"
319,320,TPE TPE,YANG Ching Tun Jing Ya YE,254,0 - 0,,"2,580 / 2"
320,321,RSA NGR,Elme DE VILLIERS Grace GABRIEL,1,0 - 0,,"2,500 / 1"
321,321,IND IND,NELAKURIHI Sikki Reddy S. Poorvisha Ram,1,0 - 0,,"2,500 / 1"
322,321,SWE SWE,Clara NISTAD Emma WENGBERG,1,0 - 0,,"2,500 / 1"
323,321,KOR KOR,Ga Ae KANG Ja Yeong LEE,1,0 - 0,,"2,500 / 1"
324,321,BRA BRA,Ana Paula CAMPOS Fabiana SILVA,1,0 - 0,,"2,500 / 1"
325,326,AUS AUS,Celeste LEE Chloe LEE,1,0 - 0,,"2,440 / 2"
326,326,RUS RUS,Maria SHEGUROVA Viktoriia VOROBEVA,1,0 - 0,,"2,440 / 2"
327,326,TPE TPE,Yu Chen CHANG Chien Hui YU,1,0 - 0,,"2,440 / 2"
328,326,NGR NGR,Serimam BAJO Peace ORJI,1,0 - 0,,"2,440 / 2"
329,330,GER GER,Jennifer KARNOTT Franziska VOLKMANN,200,0 - 0,,"2,390 / 3"
330,331,MAS MAS,Erica Pei Shan KHOO SEE To Chia Vern,1,0 - 0,,"2,360 / 3"
331,332,POL POL,Agnieszka WOJTKOWSKA Aneta WOJTKOWSKA,1,0 - 0,,"2,333 / 3"
332,333,AUT AUT,Janine LAIS Nathalie ZIESIG,1,0 - 0,,"2,332 / 4"
333,334,INA INA,Mychelle Crhystine BANDASO Serena KANI,1,0 - 0,,"2,290 / 2"
334,334,PER PER,Ines CASTILLO Paula LA TORRE REGAL,1,0 - 0,,"2,290 / 2"
335,334,PER PER,Chiara CARRANZA Camila DUANY,1,0 - 0,,"2,290 / 2"
336,334,INA INA,Sinta Arum ANTASARI Linda Mutiara PERTIWI,1,0 - 0,,"2,290 / 2"
337,334,PER PER,Camilla GARCIA Daniela ZAPATA,1,0 - 0,,"2,290 / 2"
338,339,NZL NZL,Vicki COPELAND Anona PAK,3,0 - 0,,"2,270 / 2"
339,340,NZL NZL,Soomi Lina LEE Kylie LUO,3,0 - 0,,"2,220 / 2"
340,341,FRA FRA,Manon KRIEGER Mathilde LIGNEAU,3,0 - 0,,"2,220 / 1"
341,341,FRA FRA,Audrey CHAILLOU Juliane PIRON,3,0 - 0,,"2,220 / 1"
342,341,FRA FRA,Emilie BEAUJEAN Verlaine FAULMANN,3,0 - 0,,"2,220 / 1"
343,341,HKG HKG,POON Lok Yan SHEK Hiu Yiu,3,0 - 0,,"2,220 / 1"
344,341,FRA FRA,Pauline FONTAINE Julie GRALL,3,0 - 0,,"2,220 / 1"
345,341,FRA FRA,Yaelle HOYAUX Flavie SOUILLARD,3,0 - 0,,"2,220 / 1"
346,341,KOR KOR,EOM Hye Won GO Ah Ra,3,0 - 0,,"2,220 / 1"
347,341,TPE TPE,CHENG Wen Hsing WANG Pei Rong,3,0 - 0,,"2,220 / 1"
348,341,IND IND,Nisha KARAMCHAND Rachita SAHDEV,3,0 - 0,,"2,220 / 1"
349,341,IND IND,CH. Poornima Smriti NAGARKOTI,3,0 - 0,,"2,220 / 1"
350,341,IND IND,Lalita DAHIYA Jyoti NASHIER,3,0 - 0,,"2,220 / 1"
351,341,INA AUS,Sylvina KURNIAWAN Talia SAUNDERS,3,0 - 0,,"2,220 / 1"
352,353,ENG ENG,Laura BAKER Laura WOODWARD,4,0 - 0,,"2,210 / 2"
353,353,ENG ENG,Nicola GRESTY Devon MINNIS,4,0 - 0,,"2,210 / 2"
354,355,IRI IRI,Feizmanesh ELNAZ Safora ZAMANLO,4,0 - 0,,"2,200 / 1"
355,355,IRI IRI,Yosra BEIGI Yeganeh KERMANI,4,0 - 0,,"2,200 / 1"
356,355,CHN CHN,DING Kexin WANG Zixian,4,0 - 0,,"2,200 / 1"
357,355,CHN CHN,CHEN Xiaofei HUANG Zhiying,4,0 - 0,,"2,200 / 1"
358,355,IND IND,Kuhoo GARG Harika VELUDURTHI,4,0 - 0,,"2,200 / 1"
359,355,TPE TPE,Ya-Han CHANG Wan Yi TANG,4,0 - 0,,"2,200 / 1"
360,355,NGR NGR,Grace DANIEL Braimoh MARIA,4,0 - 0,,"2,200 / 1"
361,355,INA INA,Shella Devi Aulia Masita MAHMUDIN,4,0 - 0,,"2,200 / 1"
362,355,DEN DEN,Irina Amalie ANDERSEN Julie Dawall JAKOBSEN,0,0 - 0,,"2,200 / 1"
363,355,PHI PHI,Aires Amor MONTILLA Kristel Dawn SALATAN,4,0 - 0,,"2,200 / 1"
364,355,IRI IRI,Kiana HASHEMI Zahra KAHRIZI,4,0 - 0,,"2,200 / 1"
365,355,CHN CHN,CHEN Lu ZHOU Chaomin,4,0 - 0,,"2,200 / 1"
366,355,SRI SRI,Achini RATNASIRI Upuli Samanthika WEERASINGHE,4,0 - 0,,"2,200 / 1"
367,355,IRI IRI,Sara DELAVARI Pegah KAMRANI,4,0 - 0,,"2,200 / 1"
368,355,FRA FRA,Marie BATOMENE Lea PALERMO,4,0 - 0,,"2,200 / 1"
369,355,GER GER,Anika DÖRR Kira KATTENBECK,0,0 - 0,,"2,200 / 1"
