,RANK,COUNTRY,PLAYER,CHANGE +/-,WIN - LOSE,PRIZE MONEY,POINTS / TOURNAMENTS
0,1,KOR KOR,LEE Yong Dae YOO Yeon Seong,0,63 - 11,"$989,580.61","87,738 / 11"
1,2,DEN DEN,Mathias BOE Carsten MOGENSEN,0,313 - 103,"$704,307.12","72,590 / 11"
2,3,TPE TPE,LEE Sheng Mu TSAI Chia Hsin,0,69 - 36,"$223,901.87","65,898 / 14"
3,4,CHN CHN,CHAI Biao HONG Wei,4,52 - 17,"$292,629.99","63,094 / 12"
4,5,JPN JPN,Hiroyuki ENDO Kenichi HAYAKAWA,0,156 - 81,"$244,282.85","59,702 / 13"
5,6,CHN CHN,LIU Xiaolong QIU Zihan,-2,108 - 73,"$185,273.73","59,173 / 11"
6,7,KOR KOR,KO Sung Hyun SHIN Baek Cheol,-1,37 - 19,"$393,415.23","58,570 / 11"
7,8,INA INA,Hendra SETIAWAN Mohammad AHSAN,-1,79 - 21,"$583,894.38","57,570 / 9"
8,9,DEN DEN,Mads CONRAD-PETERSEN Mads Pieler KOLDING,1,98 - 37,"$98,791.15","55,726 / 15"
9,10,RUS RUS,Vladimir IVANOV Ivan SOZONOV,1,157 - 68,"$99,359.74","50,475 / 16"
10,11,CHN CHN,FU Haifeng ZHANG Nan,-2,30 - 10,"$483,951.88","47,483 / 8"
11,12,JPN JPN,Hirokatsu HASHIMOTO Noriyasu HIRATA,0,142 - 102,"$124,585.59","46,360 / 13"
12,13,CHN CHN,CAI Yun LU Kai,0,18 - 10,"$347,816.88","46,270 / 11"
13,14,KOR KOR,KIM Gi Jung KIM Sa Rang,1,114 - 49,"$188,003.48","45,191 / 8"
14,15,DEN DEN,Kim ASTRUP Anders Skaarup RASMUSSEN,3,78 - 43,"$40,355.75","42,641 / 16"
15,16,THA THA,Maneepong JONGJIT Nipitphon PUANGPUAPECH,-2,46 - 30,"$79,543.08","42,115 / 12"
16,17,JPN JPN,Takeshi KAMURA Keigo SONODA,-1,74 - 40,"$56,210.23","41,401 / 14"
17,18,INA INA,Gideon Markus FERNALDI Markis KIDO,-1,40 - 20,"$255,277.47","40,030 / 9"
18,19,JPN JPN,Kenta KAZUNO Kazushi YAMADA,0,35 - 10,"$48,596.99","39,880 / 12"
19,20,GER GER,Michael FUCHS Johannes SCHOETTLER,0,28 - 25,"$62,635.38","39,252 / 14"
20,21,SIN SIN,Danny Bawa CHRISNANTA Chayut TRIYACHART,2,82 - 54,"$44,263.08","38,701 / 14"
21,22,POL POL,Adam CWALINA Przemyslaw WACHA,-1,105 - 37,"$58,153.85","37,616 / 20"
22,23,TPE TPE,CHEN Hung Ling Chi-Lin WANG,2,23 - 12,"$56,055.73","37,460 / 12"
23,24,INA INA,Andrei ADISTIA Hendra Aprida GUNAWAN,-2,25 - 12,"$110,124.61","37,340 / 11"
24,25,GER GER,Max SCHWENGER Josche ZURWONNE,-1,26 - 13,"$17,509.48","37,231 / 15"
25,26,CHN CHN,WANG YILYU ZHANG Wen,8,26 - 7,"$38,581.24","36,260 / 8"
26,27,CHN CHN,LI Junhui LIU Yuchen,-1,45 - 18,"$61,917.50","35,240 / 10"
27,28,IND IND,Manu ATTRI B. Sumeeth Reddy,-1,35 - 32,"$16,420.60","33,783 / 15"
28,29,USA USA,Sattawat PONGNAIRAT Phillip CHEW,-1,45 - 55,"$8,851.15","33,623 / 19"
29,30,JPN JPN,Takuto INOUE Yuki KANEKO,0,49 - 22,"$9,444.98","31,730 / 11"
30,31,FRA FRA,Baptiste CAREME Ronan LABAR,1,55 - 34,"$16,276.62","31,649 / 17"
31,32,POL POL,Lukasz MOREN Wojciech SZKUDLARCZYK,1,131 - 78,"$25,192.55","31,572 / 22"
32,33,INA INA,Wahyu Nayaka ARYA PANKARYANIRA Ade YUSUF,-4,49 - 31,"$30,034.98","31,250 / 11"
33,34,CAN CAN,Adrian LIU Derrick NG,1,97 - 49,"$15,718.75","30,332 / 11"
34,35,IND IND,Pranaav Jerry CHOPRA Akshay DEWALKAR,1,44 - 43,"$21,214.19","30,009 / 13"
35,36,BEL BEL,Matijs DIERICKX Freek GOLINSKI,1,70 - 84,"$4,684.98","29,886 / 19"
36,37,DEN DEN,Mathias CHRISTIANSEN David DAUGAARD,4,60 - 24,"$9,401.50","29,350 / 14"
37,38,CHN CHN,KANG Jun LIU Cheng,0,19 - 17,"$52,724.97","29,040 / 9"
38,39,GER GER,Raphael BECK Andreas HEINZ,1,27 - 16,"$9,773.75","28,830 / 14"
39,40,THA THA,Wannawat AMPUNSUWAN Patiphat CHALARDCHALEAM,-1,0 - 0,"$18,204.96","28,322 / 10"
40,41,INA INA,Angga PRATAMA Ryan Agung SAPUTRA,-10,0 - 0,"$109,903.76","28,100 / 6"
41,42,MAS MAS,V Shem GOH Wee Kiong TAN,2,0 - 0,"$125,690.59","27,530 / 7"
42,43,INA INA,Selvanus GEH Kevin Sanjaya SUKAMULJO,2,0 - 0,"$24,490.35","27,440 / 8"
43,44,ENG ENG,Andrew ELLIS Peter MILLS,2,0 - 0,"$48,783.17","27,420 / 11"
44,45,TPE TPE,HUANG Po Jui LU Ching Yao,-3,0 - 0,"$10,211.10","27,140 / 14"
45,46,ENG ENG,Matthew NOTTINGHAM Harley TOWLER,11,0 - 0,"$7,737.50","27,090 / 10"
46,47,NED NED,Jacco ARENDS Jelle MAAS,1,0 - 0,,"25,880 / 14"
47,48,TPE TPE,LIAO Min Chun TSENG Min Hao,1,0 - 0,,"25,460 / 11"
48,49,INA INA,Berry ANGRIAWAN Ricky Karanda SUWARDI,-6,0 - 0,,"25,330 / 7"
49,50,TPE TPE,LIN Chia Yu Hsiao-Lin WU,0,0 - 0,,"24,710 / 13"
50,51,FRA FRA,Laurent CONSTANTIN Matthieu LO YING PING,3,0 - 0,,"24,080 / 12"
51,52,TPE TPE,LIANG Jui Wei LU Chia Pin,7,0 - 0,,"23,890 / 9"
52,53,NED TPE,Ruud BOSCH TIEN Tzu Chieh,-1,0 - 0,,"23,650 / 10"
53,54,INA INA,Angga PRATAMA Ricky Karanda SUWARDI,-1,0 - 0,,"23,510 / 6"
54,55,INA INA,Fran KURNIAWAN Agripinna Prima Rahmanto PUTRA,0,0 - 0,,"23,430 / 8"
55,56,GER GER,Fabian HOLZER Mark LAMSFUSS,0,0 - 0,,"23,260 / 12"
56,57,GUA GUA,SOLIS JONATHAN Rodolfo RAMIREZ,-6,0 - 0,,"22,851 / 13"
57,58,ITA ITA,Giovanni GRECO Rosario MADDALONI,5,0 - 0,,"21,778 / 16"
58,59,TPE TPE,CHEN Hung Ling LU Chia Pin,-12,0 - 0,,"21,217 / 6"
59,60,FRA FRA,Bastian KERSAUDY Gaetan MITTELHEISSER,-2,0 - 0,,"21,214 / 13"
60,61,INA INA,Yohanes Rendy SUGIARTO Afiat Yuris WIRAWAN,-1,0 - 0,,"21,190 / 8"
61,62,PHI PHI,Peter Gabriel MAGNAYE Paul Jefferson VIVAS,-1,0 - 0,,"21,010 / 11"
62,63,PHI PHI,Philip Joper ESCUETA Ronel ESTANISLAO,-1,0 - 0,,"20,920 / 11"
63,64,THA THA,Puavaranukroh DECHAPOL Kedren KITTINUPONG,16,0 - 0,,"20,880 / 9"
64,65,MEX MEX,Job CASTILLO Antonio OCEGUEDA,-1,0 - 0,,"20,752 / 10"
65,66,CAN CAN,Kevin LI Nyl YAKURA,-1,0 - 0,,"20,328 / 13"
66,67,PER PER,Martin DEL VALLE Mario CUBA,2,0 - 0,,"20,144 / 13"
67,68,RUS RUS,Nikita KHAKIMOV Vasily KUZNETSOV,-2,0 - 0,,"20,130 / 8"
68,69,MAS MAS,Jagdish SINGH Wee Long Roni TAN,-2,0 - 0,,"20,120 / 11"
69,70,JPN JPN,Hiroyuki SAEKI Ryota TAOHATA,-2,0 - 0,,"19,740 / 6"
70,71,ENG ENG,Chris ADCOCK Andrew ELLIS,-1,0 - 0,,"19,265 / 5"
71,72,ENG ENG,Marcus ELLIS Chris LANGRIDGE,1,0 - 0,,"18,876 / 5"
72,73,SCO SCO,Martin CAMPBELL Patrick MACHUGH,1,0 - 0,,"18,459 / 12"
73,74,CRO CRO,Zvonimir DURKINJAK Zvonimir HOELBLING,2,0 - 0,,"17,689 / 12"
74,75,INA INA,Fajar ALFIAN Muhammad Rian ARDIANTO,2,0 - 0,,"17,630 / 7"
75,75,IND IND,Alwin FRANCIS Arun VISHNU,16,0 - 0,,"17,630 / 7"
76,77,BRA BRA,Hugo ARTHUSO Daniel PAIOLA,1,0 - 0,,"17,553 / 10"
77,78,RSA RSA,Andries MALAN Willem VILJOEN,-3,0 - 0,,"16,948 / 8"
78,79,USA USA,Mathew FOGARTY Bjorn SEGUIN,-8,0 - 0,,"16,780 / 9"
79,80,MAS MAS,Thien How HOON Wee Kiong TAN,-8,0 - 0,,"16,680 / 3"
80,81,ENG ENG,Peter BRIGGS Tom WOLFENDEN,13,0 - 0,,"16,530 / 8"
81,82,FRA FRA,Lucas CORVEE Brice LEVERDEZ,-3,0 - 0,,"16,528 / 8"
82,83,IRL IRL,Joshua MAGEE Sam MAGEE,-1,0 - 0,,"16,273 / 10"
83,84,RUS RUS,Rodion KARGAEV Anatoliy YARTSEV,-1,0 - 0,,"16,020 / 12"
84,85,INA INA,Christopher RUSDIANTO Trikusuma WARDHANA,-1,0 - 0,,"15,910 / 11"
85,86,MAS MAS,Kah Ming CHOOI Kok Siang TEO,-1,0 - 0,,"15,900 / 7"
86,87,TUR TUR,Emre VURAL Sİnan ZORLU,-1,0 - 0,,"15,600 / 15"
87,88,MAS MAS,Khim Wah LIM Yao Han OW,-1,0 - 0,,"15,580 / 7"
88,89,UKR UKR,Gennadiy NATAROV Artem POCHTAREV,0,0 - 0,,"15,030 / 11"
89,90,HKG HKG,CHAN Alan Yun Lung LEE Chun Hei Reginald,12,0 - 0,,"14,990 / 8"
90,91,SIN SIN,Yong Kai Terry HEE Hendra WIJAYA,-1,0 - 0,,"14,960 / 7"
91,92,MAS MAS,Boon Heong TAN Thien How HOON,0,0 - 0,,"14,853 / 5"
92,93,NZL NZL,Kevin DENNERLY-MINTURN Oliver LEYDON-DAVIS,0,0 - 0,,"14,520 / 6"
93,94,GUA GUA,Kevin CORDON Anibal MARROQUIN,1,0 - 0,,"14,209 / 7"
94,95,POL POL,Milosz BOCHAT Pawel PIETRYJA,4,0 - 0,,"14,050 / 10"
95,96,ENG SCO,Christopher COLES Paul VAN RIETVELDE,4,0 - 0,,"14,030 / 9"
96,97,ENG ENG,Chris LANGRIDGE Peter MILLS,-1,0 - 0,,"13,672 / 4"
97,98,MAS MAS,LOW Juan Shen Yew Sin ONG,-1,0 - 0,,"13,470 / 7"
98,99,CZE CZE,Pavel FLORIAN Ondrej KOPRIVA,2,0 - 0,,"12,967 / 15"
99,100,MAS MAS,Khim Wah LIM V Shem GOH,-19,0 - 0,,"12,861 / 4"
100,101,DEN DEN,Kasper ANTONSEN Oliver BABIC,3,0 - 0,,"12,780 / 9"
101,102,MAS MAS,Pak Chuu CHOW Hee Chun MAK,-14,0 - 0,,"12,690 / 5"
102,103,THA THA,Watchara BURANAKUEA Trawut POTIENG,0,0 - 0,,"12,540 / 6"
103,104,FIN FIN,Iikka HEINO Anton KAISTI,1,0 - 0,,"11,831 / 8"
104,105,IND IND,KONA Tarun Santosh RAVURI,44,0 - 0,,"11,710 / 5"
105,106,AUS AUS,Matthew CHAU Sawan SERASINGHE,1,0 - 0,,"11,670 / 6"
106,107,TPE TPE,Wei Chen LIU YANG Po Han,1,0 - 0,,"11,560 / 7"
107,108,MAS MAS,Kah Ming CHOOI Ee Yi TEO,2,0 - 0,,"11,420 / 5"
108,109,GER GER,Daniel BENZ Jones Ralfy JANSEN,17,0 - 0,,"11,160 / 8"
109,110,INA INA,Berry ANGRIAWAN Ryan Agung SAPUTRA,1,0 - 0,,"10,990 / 4"
110,111,INA INA,Gideon Markus FERNALDI Kevin Sanjaya SUKAMULJO,1,0 - 0,,"10,950 / 2"
111,112,INA INA,Ronald ALEXANDER Edi SUBAKTIAR,1,0 - 0,,"10,820 / 4"
112,113,USA USA,Ryan CHEW Rudi GUNAWAN,1,0 - 0,,"10,670 / 5"
113,114,JPN JPN,Yuya KOMATSUZAKI Hiroki TAKEUCHI,2,0 - 0,,"10,490 / 4"
114,115,CHN CHN,CHEN Zhuofu SHI Longfei,3,0 - 0,,"10,420 / 3"
115,116,MEX MEX,Arturo HERNANDEZ Lino MUNOZ,3,0 - 0,,"10,393 / 6"
116,117,DOM DOM,Nelson JAVIER Alberto RAPOSO,-2,0 - 0,,"10,093 / 6"
117,118,RUS RUS,Konstantin ABRAMOV Alexandr ZINCHENKO,3,0 - 0,,"9,940 / 6"
118,119,MAS MAS,Jian Yi LEE Zhen Ting LIM,4,0 - 0,,"9,860 / 7"
119,120,DEN DEN,Mathias BAY-SMIDT Frederik SØGAARD MORTENSEN,4,0 - 0,,"9,800 / 5"
120,121,GER GER,Johannes PISTORIUS Marvin Emil SEIDEL,14,0 - 0,,"9,730 / 8"
121,122,AUS AUS,Robin MIDDLETON Ross SMITH,-24,0 - 0,,"9,720 / 4"
122,123,MAS MAS,TAI An Khang Man Chun WOON,2,0 - 0,,"9,700 / 5"
123,124,BRA BRA,Fabio SOARES Alex Yuwan TJONG,3,0 - 0,,"9,619 / 7"
124,125,TPE TPE,LIANG Jui Wei LIAO Kuan HAO,-19,0 - 0,,"9,510 / 5"
125,126,MAS MAS,Wee Gieen TAN Ee Yi TEO,3,0 - 0,,"9,480 / 5"
126,127,MAS MAS,Nelson Wei Keat HEG LOW Juan Shen,3,0 - 0,,"9,300 / 4"
127,128,TPE TPE,LIN Chia Hsuan LIN Chia Hao,3,0 - 0,,"9,270 / 5"
128,129,AUS AUS,Raymond TAM Glenn WARFE,-20,0 - 0,,"9,270 / 4"
129,130,INA INA,Alvent Yulianto CHANDRA Yonathan Suryatama DASUKI,2,0 - 0,,"9,220 / 5"
130,131,ARG ARG,Federico DIAZ Pablo MACAGNO,15,0 - 0,,"9,219 / 9"
131,132,KOR KOR,JUN Bong Chan DukYoung KIM,1,0 - 0,,"9,070 / 3"
132,133,TPE TPE,HUNG Ying Yuan Cheng Heng SU,1,0 - 0,,"8,880 / 6"
133,134,CHN CHN,HUANG Kaixiang ZHENG Siwei,2,0 - 0,,"8,720 / 4"
134,135,JPN JPN,Takuro HOKI Yugo KOBAYASHI,2,0 - 0,,"8,660 / 4"
135,136,INA INA,Hardianto HARDIANTO Kenas Adi HARYANTO,2,0 - 0,,"8,640 / 4"
136,137,LTU LTU,Povilas BARTUSIS Alan PLAVIN,2,0 - 0,,"8,599 / 8"
137,138,BEL BEL,Nick MARCOEN Floris OLEFFE,2,0 - 0,,"8,590 / 11"
138,139,TPE TPE,CHANG Kai Liang SU Yi Neng,3,0 - 0,,"8,470 / 5"
139,140,KOR KOR,SolGyu CHOI KANG Ji Wook,3,0 - 0,,"8,470 / 3"
140,141,DEN DEN,Alexander BOND Joel EIPE,3,0 - 0,,"8,450 / 5"
141,142,RUS RUS,Evgenij DREMIN Sergey LUNEV,3,0 - 0,,"8,400 / 3"
142,143,IND IND,D. Guru Prasad Venkatesh PRASAD,-26,0 - 0,,"8,230 / 6"
143,144,IND IND,Shlok RAMCHANDRAN Sanyam SHUKLA,38,0 - 0,,"8,210 / 4"
144,145,GUA GUA,HUMBLERS HEYMARD Anibal MARROQUIN,7,0 - 0,,"8,200 / 4"
145,146,INA INA,Markis KIDO Agripinna Prima Rahmanto PUTRA,1,0 - 0,,"8,180 / 3"
146,147,CAN CAN,PHILLIPE Charron Toby NG,1,0 - 0,,"8,120 / 5"
147,148,MAS MAS,TAI An Khang Hong Kheng YEW,2,0 - 0,,"8,040 / 4"
148,149,DEN DEN,Frederik COLBERG Soren GRAVHOLT,2,0 - 0,,"8,040 / 3"
149,150,PER PER,Andres CORPANCHO Sebastian MACIAS,-9,0 - 0,,"7,988 / 6"
150,151,MAS MAS,Yan Sheng LEE Woon Fui LIN,2,0 - 0,,"7,720 / 7"
151,152,AUS AUS,Anthony JOE Pit Seng LOW,2,0 - 0,,"7,670 / 6"
152,153,NED NED,Ruud BOSCH Koen RIDDER,-31,0 - 0,,"7,670 / 4"
153,154,RUS RUS,Denis GRACHEV Sergey SIRANT,1,0 - 0,,"7,540 / 5"
154,155,GER GER,Peter KAESBAUER Josche ZURWONNE,1,0 - 0,,"7,530 / 3"
155,156,RUS RUS,Vladimir RUSIN Ilya ZHDANOV,1,0 - 0,,"7,490 / 7"
156,157,SCO SCO,Josh NEIL Ben TORRANCE,11,0 - 0,,"7,390 / 6"
157,158,IND IND,Jagadish YADAV S. Sanjeeth,-30,0 - 0,,"7,350 / 5"
158,159,INA FRA,Indra Viki OKVANA Florent RIANCHO,-1,0 - 0,,"7,320 / 9"
159,160,ENG ENG,Christopher COLES Matthew NOTTINGHAM,-1,0 - 0,,"7,120 / 3"
160,161,KOR KOR,SHIN Baek Cheol YOO Yeon Seong,0,0 - 0,,"7,000 / 1"
161,162,TPE TPE,CHEN Chung Jen Chi-Lin WANG,0,0 - 0,,"6,920 / 4"
162,163,TPE TPE,Chia-Hsin WAN Tzu Wei WANG,0,0 - 0,,"6,850 / 4"
163,164,JPN JPN,Taiki SHIMADA Yoshinori TAKEUCHI,0,0 - 0,,"6,790 / 2"
164,165,IND IND,K. Nandagopal Arjun Kumar Reddy MALGARI,0,0 - 0,,"6,650 / 2"
165,166,ENG ENG,Darren ADAMSON Scott SANKEY,0,0 - 0,,"6,640 / 6"
166,167,IND IND,M. Anilkumar Raju Venkat Gaurav PRASAD,72,0 - 0,,"6,610 / 3"
167,168,KOR KOR,JUN Bong Chan KIM Dae Eun,-1,0 - 0,,"6,570 / 2"
168,169,BRA BRA,Alex Yuwan TJONG Hugo ARTHUSO,0,0 - 0,,"6,430 / 3"
169,170,MAS MAS,Boon Heong TAN Wee Kiong TAN,0,0 - 0,,"6,428 / 2"
170,171,KOR KOR,KIM Sa Rang YOO Yeon Seong,-51,0 - 0,,"6,420 / 1"
171,172,BRA BRA,Luiz dos SANTOS JR Leonardo ALKIMIN,-1,0 - 0,,"6,320 / 5"
172,173,MAS MAS,Khek Wei CHUA Nelson Wei Keat HEG,-1,0 - 0,,"6,310 / 4"
173,174,SUI SUI,Pierrick DESCHENAUX Oliver SCHALLER,-1,0 - 0,,"6,290 / 7"
174,175,INA JPN,Alvent Yulianto CHANDRA Shintaro IKEDA,-1,0 - 0,,"6,260 / 2"
175,176,VIE VIE,Bao Duc DUONG Hoang Nam NGUYEN,-1,0 - 0,,"6,230 / 4"
176,177,SUI SUI,Mathias BONNY Christian KIRCHMAYR,-1,0 - 0,,"6,190 / 6"
177,178,TPE TPE,Li-Wei PO Ming-Tse YANG,-1,0 - 0,,"6,170 / 4"
178,179,IND IND,Arun GEORGE T. Hema Nagendra Babu,0,0 - 0,,"6,050 / 2"
179,180,TPE TPE,Hsuan Wen CHANG Shang Kai LIN,0,0 - 0,,"6,010 / 4"
180,181,FRA FRA,Ronan GUEGUIN Alexandre HAMMER,0,0 - 0,,"6,000 / 5"
181,182,DEN DEN,Rasmus FLADBERG Emil HOLST,1,0 - 0,,"5,980 / 2"
182,183,CZE SVK,Jan FROHLICH Matej HLINICAN,1,0 - 0,,"5,920 / 3"
183,184,INA INA,Wijaya RENDRA Rian SUKMAWAN,1,0 - 0,,"5,840 / 2"
184,185,SWE SWE,Magnus SAHLBERG Emil WELINDER,1,0 - 0,,"5,780 / 4"
185,186,AUT AUT,Vilson VATTANIRAPPEL Luka WRABER,1,0 - 0,,"5,620 / 3"
186,187,PHI PHI,DELOS SANTOS Aries Alvin MORADA,1,0 - 0,,"5,600 / 2"
187,188,NGR NGR,Enejoh ABAH Victor MAKANJU,1,0 - 0,,"5,548 / 4"
188,189,CHI CHI,Cristian ARAYA Bastian LIZAMA,1,0 - 0,,"5,490 / 6"
189,190,ENG ENG,Ben LANE Sean VENDY,1,0 - 0,,"5,430 / 4"
190,191,MAS MAS,Che Leong SOONG Beryno Jiann Tze WONG,2,0 - 0,,"5,400 / 7"
191,192,DEN DEN,Soren GRAVHOLT Nikolaj OVERGAARD,2,0 - 0,,"5,390 / 3"
192,193,AUT AUT,Dominik STIPSITS Roman ZIRNWALD,2,0 - 0,,"5,330 / 7"
193,194,GER GER,Peter LANG Thomas LEGLEITNER,2,0 - 0,,"5,330 / 6"
194,195,PER PER,Andres CORPANCHO Jose GUEVARA,95,0 - 0,,"5,320 / 3"
195,196,ESP ESP,Javier SANCHEZ SOLER Alejandro TORO,1,0 - 0,,"5,250 / 4"
196,197,UGA CZE,Edwin EKIRING Milan LUDIK,1,0 - 0,,"5,250 / 3"
197,197,IRI IRI,Vatannejad-Soroush ESKANDARI Hasan MOTAGHI,1,0 - 0,,"5,250 / 3"
198,199,AUT DEN,Jurgen KOCH Christian LIND THOMSEN,-21,0 - 0,,"5,180 / 5"
199,200,IRL IRL,Ciaran CHAMBERS Ryan STEWART,1,0 - 0,,"5,180 / 4"
200,201,MAS MAS,Zulfaiz Bin ZULKIFFLI Zulhelmi ZULKIFFLI,1,0 - 0,,"5,130 / 3"
201,202,NGR NGR,Ola FAGBEMI Jinkan Ifraimu BULUS,1,0 - 0,,"5,123 / 2"
202,203,NZL NZL,Kerwyn LEE Dylan SOEDJASA,1,0 - 0,,"5,120 / 3"
203,204,THA THA,CHOLPRASERTSUK Kritti TOVANNAKASEM Samatcha,1,0 - 0,,"5,090 / 3"
204,205,JPN JPN,Kazuya ITANI Tomoya TAKASHINA,1,0 - 0,,"5,070 / 4"
205,206,MAS MAS,Muhammad Hafifi HASHIM Muhammad Hafizi HASHIM,1,0 - 0,,"5,050 / 6"
206,207,FIN FIN,Kasper LEHIKOINEN Marko PYYKONEN,1,0 - 0,,"4,970 / 3"
207,208,IRI IRI,Farzin KHANJANI Mohamad Reza KHANJANI,1,0 - 0,,"4,940 / 3"
208,209,DEN DEN,Frederik COLBERG Mikkel MIKKELSEN,1,0 - 0,,"4,930 / 2"
209,210,MAS MAS,Darren Isaac DEVADASS TAI An Khang,1,0 - 0,,"4,920 / 2"
210,211,HKG HKG,TANG Chun Man LAW Cheuk Him,1,0 - 0,,"4,900 / 4"
211,212,INA INA,Fran KURNIAWAN Bona SEPTANO,-52,0 - 0,,"4,880 / 2"
212,213,PHI PHI,Carlos Antonie CAYANAN Paul John PANTIG,2,0 - 0,,"4,870 / 3"
213,214,CAN CAN,Joshua HURLBURT-YU Benny LIN,2,0 - 0,,"4,830 / 2"
214,215,INA INA,Muhammad FACHRIKAR Muhammad Reza Pahlevi ISFAHANI,2,0 - 0,,"4,810 / 4"
215,216,MAS MAS,Kien Keat KOO Boon Heong TAN,2,0 - 0,,"4,800 / 1"
216,217,NEP NEP,Bikash SHRESTHA Ratnajit TAMANG,2,0 - 0,,"4,790 / 3"
217,218,SCO SCO,Adam HALL Gordon THOMSON,2,0 - 0,,"4,770 / 2"
218,219,MAS MAS,Mohd Razif ABDUL LATIF Mohd Zakry ABDUL LATIF,2,0 - 0,,"4,750 / 3"
219,220,SUI SUI,Anthony DUMARTHERAY Gilles TRIPET,2,0 - 0,,"4,710 / 5"
220,221,ITA INA,Indra Bagus ADE CHANDRA Adi PRATAMA,2,0 - 0,,"4,700 / 4"
221,222,BUL BUL,Lilian MIHAYLOV Mihael MIHAYLOV,2,0 - 0,,"4,690 / 5"
222,223,INA HKG,Fernando KURNIAWAN LO Lok Kei,2,0 - 0,,"4,690 / 4"
223,224,BRA BRA,Rodolfo Augusto SALLES Filipe TOLEDO,2,0 - 0,,"4,650 / 4"
224,225,IND IND,Neeraj VASHIST Venkat Gaurav PRASAD,2,0 - 0,,"4,640 / 3"
225,226,INA INA,Hardianto HARDIANTO Agripinna Prima Rahmanto PUTRA,2,0 - 0,,"4,560 / 2"
226,227,AUS AUS,Simon Wing Hang LEUNG Mitchell WHELLER,2,0 - 0,,"4,550 / 2"
227,228,SEY SEY,Georgie CUPIDON Steve MALCOUZANNE,2,0 - 0,,"4,526 / 4"
228,229,ISR ISR,Alexander BASS Lior KROYTER,2,0 - 0,,"4,508 / 3"
229,230,MRI MRI,Aatish LUBAH Georges Julien PAUL,2,0 - 0,,"4,490 / 3"
230,231,POL POL,Milosz BOCHAT Maciej DABROWSKI,3,0 - 0,,"4,420 / 3"
231,232,ENG SCO,Harley TOWLER Paul VAN RIETVELDE,3,0 - 0,,"4,410 / 3"
232,233,EGY EGY,Ali Ahmed EL KHATEEB Abdelrahman KASHKAL,3,0 - 0,,"4,405 / 6"
233,234,NZL NZL,Maoni HU HE Kent PALMER,3,0 - 0,,"4,400 / 2"
234,234,FRA FRA,Marin BAUMANN Lucas CLAERBOUT,3,0 - 0,,"4,400 / 2"
235,236,MAS MAS,Wee Gieen TAN Hong Kheng YEW,5,0 - 0,,"4,350 / 4"
236,237,SUI SUI,Mathias BONNY Oliver SCHALLER,5,0 - 0,,"4,341 / 5"
237,238,FRA FRA,Toma Junior POPOV Thomas VALLEZ,5,0 - 0,,"4,340 / 3"
238,239,KOR KOR,SolGyu CHOI KO Sung Hyun,6,0 - 0,,"4,330 / 2"
239,240,ENG ENG,Robert GOLDING Victor LIEW,18,0 - 0,,"4,320 / 4"
240,241,MAS MAS,Jiann Shiarng CHIANG Kay Ee YEOH,-41,0 - 0,,"4,310 / 6"
241,242,MAS MAS,Yeet Siang LIN Guan Ming WONG,4,0 - 0,,"4,300 / 5"
242,243,SLO AUT,Alen ROJ Luka WRABER,4,0 - 0,,"4,260 / 2"
243,244,IND IND,Saurav KAPOOR Deepak KHATRI,4,0 - 0,,"4,240 / 2"
244,244,INA INA,Akbar Bintang CAHYONO Jeka WIRATAMA,4,0 - 0,,"4,240 / 2"
245,244,IND IND,G. Gopi Raju Shivam SHARMA,4,0 - 0,,"4,240 / 2"
246,247,NED NED,Mark CALJOUW Ruben JILLE,4,0 - 0,,"4,180 / 3"
247,248,ALG ALG,Mohamed Abderrahime BELARBI Adel HAMEK,9,0 - 0,,"4,140 / 4"
248,249,GRE GRE,George GALVAS Panagiotis SKARLATOS,3,0 - 0,,"4,130 / 4"
249,250,MEX MEX,Lopez ANDRES Lino MUNOZ,3,0 - 0,,"4,110 / 3"
250,251,CAN CAN,Andrew D'SOUZA Sergiy SHATENKO,3,0 - 0,,"4,090 / 2"
251,252,CHN CHN,BAO Zi Long QI Shuang Shuang,3,0 - 0,,"4,000 / 1"
252,252,TPE TPE,LU Ching Yao TIEN Tzu Chieh,3,0 - 0,,"4,000 / 1"
253,254,TPE TPE,Hsuan Ming LEE Chi-Hung LIAO,4,0 - 0,,"3,960 / 3"
254,254,MAS MAS,Darren Isaac DEVADASS Yew Sin ONG,4,0 - 0,,"3,960 / 3"
255,254,SUI SUI,Thomas HEINIGER Anthony DUMARTHERAY,-41,0 - 0,,"3,960 / 3"
256,257,BLR BLR,Vladzislav KUSHNIR Dzmitry SAIDAKOU,4,0 - 0,,"3,945 / 6"
257,258,FIN FIN,Marko PYYKONEN Pekka RYHANEN,4,0 - 0,,"3,940 / 5"
258,259,MAS MAS,"Winson NEO Qi Cong, Scott TSANG",4,0 - 0,,"3,930 / 5"
259,260,SWE SWE,Filip Michael Duwall MYHREN Jonatan NORDH,4,0 - 0,,"3,890 / 3"
260,261,INA INA,Angger SUDRAJAT Supriadi Tedi,4,0 - 0,,"3,880 / 3"
261,262,INA INA,- HANTORO Rian SWASTEDIAN,4,0 - 0,,"3,870 / 4"
262,263,IRL IRL,Jonathan DOLAN Sam MAGEE,4,0 - 0,,"3,870 / 2"
263,264,SCO USA,Alistair CASEY Kyle EMERICK,4,0 - 0,,"3,860 / 2"
264,265,ENG ENG,James LAUDER Andrew WAINWRIGHT,4,0 - 0,,"3,850 / 5"
265,265,MAS MAS,Tang Jie CHEN Jien Sern IAN WONG,4,0 - 0,,"3,850 / 5"
266,267,INA INA,Ronald ALEXANDER Alfian Eko PRASETYA,4,0 - 0,,"3,850 / 1"
267,267,KOR KOR,KIM Dae Eun DukYoung KIM,4,0 - 0,,"3,850 / 1"
268,267,TPE TPE,CHOU Tien Chen LIAO Chao Hsiang,4,0 - 0,,"3,850 / 1"
269,270,ITA ITA,Matteo BELLUCCI Pirmin KLOTZNER,4,0 - 0,,"3,810 / 4"
270,271,TPE TPE,Yu-Wei CHIANG Yang LEE,4,0 - 0,,"3,780 / 3"
271,272,UZB UZB,Amrullo BAKHSHULLAEV Artyom SAVATYUGIN,4,0 - 0,,"3,770 / 4"
272,273,GUA GUA,Ruben CASTELLANOS HUMBLERS HEYMARD,4,0 - 0,,"3,760 / 3"
273,274,SIN SIN,Kwan Ting Sean LEE Kean Yew LOH,4,0 - 0,,"3,740 / 5"
274,275,NED SWE,Koen RIDDER Nico RUPONEN,4,0 - 0,,"3,730 / 3"
275,276,RUS RUS,Andrey PARAKHODIN Nikolai UKK,4,0 - 0,,"3,720 / 2"
276,277,SRB SRB,Miodrag KALICANIN Borko PETROVIC,4,0 - 0,,"3,670 / 6"
277,278,BOT BOT,Orideetse THELA Gaone TAWANA,4,0 - 0,,"3,633 / 3"
278,279,ENG ENG,Peter BRIGGS Christopher COLES,4,0 - 0,,"3,630 / 2"
279,280,KOR KOR,SolGyu CHOI DukYoung KIM,0,0 - 0,,"3,600 / 1"
280,280,MAS MAS,Kwong Beng CHAN Jiann Shiarng CHIANG,5,0 - 0,,"3,600 / 1"
281,280,MAS MAS,V Shem GOH Boon Heong TAN,5,0 - 0,,"3,600 / 1"
282,283,MAS MAS,Jia Huo CHEN Chun Kang SHIA,4,0 - 0,,"3,590 / 3"
283,283,NED NED,Mark CALJOUW Justin TEEUWEN,4,0 - 0,,"3,590 / 3"
284,285,RUS RUS,Rodion ALIMOV Alexandr KOZYREV,4,0 - 0,,"3,580 / 2"
285,286,INA INA,Yonathan Suryatama DASUKI Didit JUANG,5,0 - 0,,"3,550 / 3"
286,287,SWE SWE,Filip Michael Duwall MYHREN Nico RUPONEN,5,0 - 0,,"3,550 / 2"
287,288,WAL WAL,Joe MORGAN Nicolas STRANGE,5,0 - 0,,"3,510 / 3"
288,288,CZE CZE,Zdenek SVATA Jan FROHLICH,-75,0 - 0,,"3,510 / 3"
289,290,THA HUN,Karnphop ATTHAVIROJ Gergely KRAUSZ,4,0 - 0,,"3,500 / 2"
290,291,AUT AUT,David OBERNOSTERER Roman ZIRNWALD,4,0 - 0,,"3,440 / 2"
291,292,FIN FIN,Mika KONGAS Jesper VON HERTZEN,4,0 - 0,,"3,410 / 3"
292,293,USA USA,Christian Yahya CHRISTIANTO Hock Lai LEE,4,0 - 0,,"3,400 / 1"
293,294,SCO JPN,Robert BLAIR Shintaro IKEDA,4,0 - 0,,"3,340 / 2"
294,295,MAS MAS,"Yu Leong, Alfred LAU Yu Ming, Adam LAU",4,0 - 0,,"3,330 / 3"
295,296,EGY EGY,Abdelrahman ABDELHAKIM Ahmed SALAH,4,0 - 0,,"3,290 / 3"
296,297,MAS MAS,Muhammad Adib Haiqal NURIZWAN Victor Jing Khai ONG,4,0 - 0,,"3,270 / 3"
297,298,MAS MAS,Khek Wei CHUA Muhammad Amzzar ZAINUDDIN,4,0 - 0,,"3,270 / 2"
298,299,TPE TPE,Wei Chi LIU Chia Hung LU,4,0 - 0,,"3,250 / 3"
299,300,NZL NZL,Jonathan CURTIN Dhanny OUD,4,0 - 0,,"3,250 / 2"
300,301,DEN DEN,Niclas NOHR Nikolaj OVERGAARD,-109,0 - 0,,"3,220 / 3"
301,302,TPE TPE,Chia-Han LEE Yuan Cheng WU,3,0 - 0,,"3,200 / 4"
302,303,INA INA,Arya Maulana ADIARTAMA Fran KURNIAWAN,3,0 - 0,,"3,190 / 2"
303,303,IND IND,Utkarsh ARORA Tanveer GILL,3,0 - 0,,"3,190 / 2"
304,303,SIN SIN,Yong Kai Terry HEE Kean Hean LOH,3,0 - 0,,"3,190 / 2"
305,306,MAS MAS,Yee Jian KWEK Wei Chong MAN,3,0 - 0,,"3,160 / 2"
306,307,THA THA,Watchara BURANAKUEA Pakkawat VILAILAK,459,0 - 0,,"3,140 / 2"
307,308,MAS MAS,Jiann Shiarng CHIANG Chun Seang TAN,2,0 - 0,,"3,130 / 3"
308,309,TUR TUR,Emre LALE Huseyin ORUC,2,0 - 0,,"3,120 / 5"
309,310,FRA FRA,Laurent CONSTANTIN Jordan CORVEE,2,0 - 0,,"3,120 / 2"
310,310,CZE DEN,Milan LUDIK Soeren TOFT HANSEN,2,0 - 0,,"3,120 / 2"
311,312,SLO SLO,Alen ROJ Iztok UTROSA,3,0 - 0,,"3,100 / 3"
312,313,REU SVK,Arnaud GENIN Matej HLINICAN,3,0 - 0,,"3,050 / 2"
313,314,INA INA,Indra LESMANA Wibowo SETYALDI PUTRA,243,0 - 0,,"3,040 / 2"
314,315,NZL NZL,Brock MATHESON Maika PHILLIPS,2,0 - 0,,"3,030 / 2"
315,316,AUS AUS,Edwin LUK Eric VUONG,2,0 - 0,,"3,030 / 1"
316,316,SWE SWE,Nico RUPONEN Andy Hartono TANDAPUTRA,2,0 - 0,,"3,030 / 1"
317,316,CAN CAN,Alvin LAU Duncan YAO,2,0 - 0,,"3,030 / 1"
318,316,USA USA,Calvin LIN Marvin LIN,2,0 - 0,,"3,030 / 1"
319,320,FIN FIN,Henri AARNIO Joonas KORHONEN,3,0 - 0,,"2,990 / 3"
320,321,KOR KOR,Dae Sun KIM DukYoung KIM,3,0 - 0,,"2,960 / 2"
321,321,USA USA,Agusriadi Wijaya AMPHIE Alan SHEKHTMAN,3,0 - 0,,"2,960 / 2"
322,321,MAS MAS,Vountus Indra MAWAN Mohd Fairuzizuan MOHD TAZARI,3,0 - 0,,"2,960 / 2"
323,324,AZE AZE,Orkhan QALANDAROV Kanan RZAYEV,3,0 - 0,,"2,940 / 4"
324,325,TPE TPE,TIEN Jen Chieh TIEN Tzu Chieh,3,0 - 0,,"2,920 / 2"
325,326,BEL BEL,Simon EECKHOUDT Nathan VERVAEKE,3,0 - 0,,"2,900 / 3"
326,327,BRA BRA,Mateus Carrijo CUTTI Gabriel Guimaraes NERY,3,0 - 0,,"2,890 / 2"
327,327,DEN DEN,Mathias Lund HANSEN Mads Emil KRISTENSEN,3,0 - 0,,"2,890 / 2"
328,329,BRA BRA,Felippe CURY FONSECA Matheus VOIGT,3,0 - 0,,"2,840 / 3"
329,330,TPE TPE,Chu-En HUANG WANG Chia Min,3,0 - 0,,"2,830 / 3"
330,331,INA INA,RIDHO AKbar Davin PRAWISSA,3,0 - 0,,"2,810 / 2"
331,331,ENG ENG,Matthew CLARE David KING,3,0 - 0,,"2,810 / 2"
332,333,THA THA,Trawut POTIENG Nipitphon PUANGPUAPECH,3,0 - 0,,"2,800 / 1"
333,333,CHN CHN,HE Jiting ZHENG Siwei,3,0 - 0,,"2,800 / 1"
334,333,INA INA,Ronald ALEXANDER HAFIZ Faisal,3,0 - 0,,"2,800 / 1"
335,333,INA INA,Stefan Indra HAPSARA Ismail RISKY HIDAYAT,3,0 - 0,,"2,800 / 1"
336,333,KOR KOR,SolGyu CHOI KIM Dae Eun,3,0 - 0,,"2,800 / 1"
337,333,BAN BAN,Moajjam HOSSAIN Minhaz MOHAMMAD,3,0 - 0,,"2,800 / 1"
338,333,ENG ENG,Gary FOX Ben STAWSKI,3,0 - 0,,"2,800 / 1"
339,340,POL POL,Maciej DABROWSKI SWIERCZYNKI MATEUSZ,3,0 - 0,,"2,760 / 3"
340,340,RUS RUS,Alexander VERNER Denis VERNER,3,0 - 0,,"2,760 / 3"
341,340,IRL IRL,Tony MURPHY Tony STEPHENSON,3,0 - 0,,"2,760 / 3"
342,343,SIN SIN,Yong Kai Terry HEE Zi Liang Derek WONG,3,0 - 0,,"2,740 / 3"
343,343,HKG HKG,TANG Chun Man LEE Chun Hei Reginald,3,0 - 0,,"2,740 / 3"
344,345,UGA UGA,Herbert EBAYO Jacob MUSISI,3,0 - 0,,"2,740 / 2"
345,346,IND IND,Ankit CHHIKARA Kamaldeep SINGH,3,0 - 0,,"2,720 / 1"
346,346,DEN DEN,Frederik COLBERG Niclas NOHR,3,0 - 0,,"2,720 / 1"
347,346,INA INA,Yahya Adi KUMARA Yantoni Edy SAPUTRA,3,0 - 0,,"2,720 / 1"
348,346,INA INA,Hermansyah . Eka Fajar KUSUMA,3,0 - 0,,"2,720 / 1"
349,346,USA USA,Andy (Weng Kai) CHONG Tahtat POJANAKANOKPORN,3,0 - 0,,"2,720 / 1"
350,346,KOR KOR,JUN Bong Chan Dae Sun KIM,3,0 - 0,,"2,720 / 1"
351,346,THA THA,Songphon ANUGRITAYAWON Pakkawat VILAILAK,3,0 - 0,,"2,720 / 1"
352,346,TPE TPE,CHEN Chung Jen LU Chia Pin,3,0 - 0,,"2,720 / 1"
353,354,AUS AUS,Cham CHEN Toby WONG,3,0 - 0,,"2,690 / 2"
354,355,BUL BUL,Stilian MAKARSKI Peyo BOICHINOV,3,0 - 0,,"2,687 / 2"
355,356,WAL WAL,Daniel FONT Oliver GWILT,-72,0 - 0,,"2,682 / 4"
356,357,ZAM ZAM,Ngosa CHONGO Chongo Ezra MULENGA,2,0 - 0,,"2,670 / 2"
357,357,SWE DEN,Filip Michael Duwall MYHREN Steve OLESEN,2,0 - 0,,"2,670 / 2"
358,357,CUB CUB,Leodannis MARTINEZ Ernesto REYES,-45,0 - 0,,"2,670 / 2"
359,357,MRI MRI,Denneshsing BABOOLALL Christopher PAUL,2,0 - 0,,"2,670 / 2"
360,361,ECU ECU,Diego TERAN Emilio ZAMBRANO,1,0 - 0,,"2,660 / 2"
361,362,MAS MAS,Thien How HOON Yao Han OW,1,0 - 0,,"2,660 / 1"
362,363,NED NED,Ruben JILLE Robin TABELING,1,0 - 0,,"2,640 / 3"
363,364,TUR TUR,Enis SESALAN Ramazan TEKDEMİR,1,0 - 0,,"2,620 / 3"
364,365,INA INA,HAFIZ Faisal Lukhi Apri NUGROHO,1,0 - 0,,"2,590 / 2"
365,365,POL POL,Mateusz DUBOWSKI Jacek KOLUMBAJEW,1,0 - 0,,"2,590 / 2"
366,365,IND IND,Prem Singh CHOUHAN Manish GUPTA,-43,0 - 0,,"2,590 / 2"
367,365,MAS MAS,Chee Tean TAN WONG Fai Yin,1,0 - 0,,"2,590 / 2"
