,RANK,COUNTRY,PLAYER,CHANGE +/-,WIN - LOSE,PRIZE MONEY,POINTS / TOURNAMENTS
368,369,JAM JAM,Gareth HENRY Samuel O’Brien RICKETTS,-125,0 - 0,,"2,580 / 2"
369,370,MRI MRI,Denneshsing BABOOLALL Georges Julien PAUL,-1,0 - 0,,"2,565 / 2"
370,371,FIN NED,Anton KAISTI Koen RIDDER,-1,0 - 0,,"2,500 / 1"
371,371,GUA GUA,HUMBLERS HEYMARD Adams RODRIGUEZ,-1,0 - 0,,"2,500 / 1"
372,371,POL POL,Adam CWALINA Pawel PIETRYJA,-1,0 - 0,,"2,500 / 1"
373,371,REU USA,Arnaud GENIN Bjorn SEGUIN,-1,0 - 0,,"2,500 / 1"
374,371,DEN DEN,Kasper ANTONSEN Mikkel DELBO LARSEN,-1,0 - 0,,"2,500 / 1"
375,371,TUR TUR,Yusuf Ramazan BAY Sİnan ZORLU,-1,0 - 0,,"2,500 / 1"
376,377,POR POR,Angelo SILVA Ricardo SILVA,-1,0 - 0,,"2,470 / 3"
377,377,CHI CHI,Nicolas FERRUZOLA Ivan LEON,-1,0 - 0,,"2,470 / 3"
378,379,BRA BRA,Ygor Coelho de OLIVEIRA Alex Yuwan TJONG,-1,0 - 0,,"2,440 / 2"
379,379,MEX DEN,Luis Ramon GARRIDO Mikkel Kaersgaard HENRIKSEN,-1,0 - 0,,"2,440 / 2"
380,379,RUS RUS,Maxim ROMANOV Ilya ZHDANOV,-1,0 - 0,,"2,440 / 2"
381,379,NZL AUS,James EUNSON Michael FARIMAN,-1,0 - 0,,"2,440 / 2"
382,379,JPN JPN,Kohei GONDO Tatsuya WATANABE,-1,0 - 0,,"2,440 / 2"
383,384,WAL WAL,Oliver GWILT Nicolas STRANGE,-1,0 - 0,,"2,430 / 3"
384,385,KOR KOR,BAE Kwon Young JUNG Jae Wook,-1,0 - 0,,"2,430 / 2"
385,386,ENG ENG,Robert GOLDING Gregory MAIRS,-1,0 - 0,,"2,390 / 3"
386,386,MAS INA,Khek Mong HO KUSUMAH Seo Danu,-1,0 - 0,,"2,390 / 3"
387,386,AUT AUT,Vilson VATTANIRAPPEL Lukas WEISSENBÄCK,-1,0 - 0,,"2,390 / 3"
388,386,MAS MAS,Kay Ee YEOH Kok Pong LOKE,-1,0 - 0,,"2,390 / 3"
389,390,EST EST,Kristjan KALJURAND Raul KÄSNER,-1,0 - 0,,"2,351 / 3"
390,391,UKR UKR,Kyrylo LEONOV DON SERGEY,-1,0 - 0,,"2,290 / 2"
391,391,HUN ITA,Rudolf DELLENBACH Bruno STEGANI,-1,0 - 0,,"2,290 / 2"
392,391,UGA UGA,Alex BABU Farook WAYA,-1,0 - 0,,"2,290 / 2"
393,391,ZAM ZAM,Kalombo MULENGA Obbery Kunda MULENGA,-1,0 - 0,,"2,290 / 2"
394,395,AUS AUS,Daniel FAN Alphonsus NG,0,0 - 0,,"2,280 / 2"
395,396,RUS RUS,Arseniy FISTIN Ryhor VARABYOU,0,0 - 0,,"2,270 / 3"
396,397,IND IND,Arun GEORGE K. Nandagopal,0,0 - 0,,"2,220 / 1"
397,397,IND IND,Talar LAA Sahil SIPANI,0,0 - 0,,"2,220 / 1"
398,397,IND IND,Arjun Kumar Reddy MALGARI T. Hema Nagendra Babu,0,0 - 0,,"2,220 / 1"
399,397,IND IND,Utkarsh ARORA Abhinav PRAKASH,0,0 - 0,,"2,220 / 1"
400,397,IND IND,Kamaldeep SINGH Neeraj VASHIST,0,0 - 0,,"2,220 / 1"
401,397,IND IND,Ankit CHHIKARA Deepak KHATRI,0,0 - 0,,"2,220 / 1"
402,397,IND IND,D. Guru Prasad S. Sanjeeth,0,0 - 0,,"2,220 / 1"
403,397,AUS INA,Michael FARIMAN Moses Tulaar REYHAN,1,0 - 0,,"2,220 / 1"
404,397,MAS MAS,Yao Han OW Boon Heong TAN,-164,0 - 0,,"2,220 / 1"
405,397,SIN SIN,Robin GONANSA Yong Zhao Ashton CHEN,1,0 - 0,,"2,220 / 1"
406,397,MAS MAS,Mohd Zakry ABDUL LATIF Mohd Fairuzizuan MOHD TAZARI,1,0 - 0,,"2,220 / 1"
407,408,ENG ENG,James FARMER Scott P WILLIAMS,-4,0 - 0,,"2,210 / 2"
408,408,ENG ENG,Conor BAMBRICK Thomas Joseph STANFORD,-4,0 - 0,,"2,210 / 2"
409,408,CAN CAN,Felix DEBLOIS-BEAUCAGE Alexis GOHIER-DROLET,-4,0 - 0,,"2,210 / 2"
410,408,BRA BRA,Fabrício DUARTE Gabriel GANDARA,-4,0 - 0,,"2,210 / 2"
411,412,IND IND,Chetan ANAND Raunaq MURADIA,-4,0 - 0,,"2,200 / 3"
412,412,HKG HKG,CHAN Tsz Kit HO Wai Lun,-4,0 - 0,,"2,200 / 3"
413,414,SUI BUL,Anthony DUMARTHERAY Stilian MAKARSKI,0,0 - 0,,"2,200 / 1"
414,414,MAS MAS,Mohd Zakry ABDUL LATIF Muhammad Hafizi HASHIM,-4,0 - 0,,"2,200 / 1"
415,414,HKG HKG,OR Chin Chung TANG Chun Man,-4,0 - 0,,"2,200 / 1"
416,414,RUS RUS,Evgenij DREMIN Nikita KHAKIMOV,-4,0 - 0,,"2,200 / 1"
417,414,CHN CHN,HUANG Kaixiang YU Xiaoyu,-4,0 - 0,,"2,200 / 1"
418,414,CHN CHN,HAN Chengkai ZHOU Haodong,-4,0 - 0,,"2,200 / 1"
419,414,CHN CHN,SUN Zhanming WANG Sijie,-4,0 - 0,,"2,200 / 1"
420,414,IND IND,Vighnesh DEVLEKAR Eshan NAQVI,-4,0 - 0,,"2,200 / 1"
421,414,BAN BAN,Parash Md.AHSUN HABIB Md Rais UDDIN,-4,0 - 0,,"2,200 / 1"
422,414,BAN BAN,Mohammad Anamul HAQUE AHMED Md.Jamil,-4,0 - 0,,"2,200 / 1"
423,414,BAN BAN,Md Zainal ABEDIN Ebadul Haque CHOWDHURY,-4,0 - 0,,"2,200 / 1"
424,414,ENG ENG,Gregory MAIRS Sam PARSONS,-4,0 - 0,,"2,200 / 1"
425,414,JPN JPN,Hashiru SHIMONO Kanta TSUNEYAMA,-4,0 - 0,,"2,200 / 1"
426,414,RUS RUS,Gordey KOSENKO Anatoliy YARTSEV,-4,0 - 0,,"2,200 / 1"
427,414,CHN CHN,HE Wenjun HUANG Guoxing,-4,0 - 0,,"2,200 / 1"
428,414,ESP ESP,Pablo ABIAN Eliecer OJEDA,-4,0 - 0,,"2,200 / 1"
429,414,SLO DEN,Alen ROJ Soeren TOFT HANSEN,-4,0 - 0,,"2,200 / 1"
430,414,RUS RUS,Gordey KOSENKO Vadim NOVOSELOV,-4,0 - 0,,"2,200 / 1"
431,414,NGR NGR,"Usman , Ayo ISIAQ Mustaopha MUHAMMED",-4,0 - 0,,"2,200 / 1"
432,414,NGR NGR,Femi BIOKU Kayode OLATUNJI,-4,0 - 0,,"2,200 / 1"
433,414,IND IND,Abhinav PRAKASH Siddhrath SABOO,-4,0 - 0,,"2,200 / 1"
434,414,CZE DEN,Jakub BITMAN Soren GRAVHOLT,-4,0 - 0,,"2,200 / 1"
435,414,INA INA,Alfian Eko PRASETYA Edi SUBAKTIAR,-4,0 - 0,,"2,200 / 1"
436,414,INA HKG,Fernando KURNIAWAN YEUNG Shing Choi,-4,0 - 0,,"2,200 / 1"
437,414,MAS MAS,Mohd Razif ABDUL LATIF Vountus Indra MAWAN,-4,0 - 0,,"2,200 / 1"
438,414,THA THA,Wannawat AMPUNSUWAN Tinn ISRIYANATE,-4,0 - 0,,"2,200 / 1"
439,440,MAS MAS,Ahmadi SAMAN Jinn Ye TAN,-5,0 - 0,,"2,190 / 4"
440,441,GER GER,Andreas HEINZ Max SCHWENGER,-201,0 - 0,,"2,189 / 1"
441,442,IND IND,Kabir KANZARKAR Akshay RAUT,-6,0 - 0,,"2,180 / 2"
442,442,HKG HKG,CHAN Dick Long Cotter OR Chin Chung,-6,0 - 0,,"2,180 / 2"
443,444,DEN DEN,Frederik AALESTRUP Kasper DINESEN,-6,0 - 0,,"2,130 / 1"
444,444,SUR SUR,Gilmar JONES Mitchel WONGSODIKROMO,-6,0 - 0,,"2,130 / 1"
445,444,DEN DEN,Andreas BERTHELSEN Kasper DINESEN,-6,0 - 0,,"2,130 / 1"
446,444,IRI IRI,Farzin KHANJANI Mehran SHAHBAZI,-6,0 - 0,,"2,130 / 1"
447,444,GER GER,Kai SCHAEFER Tobias WADENKA,-6,0 - 0,,"2,130 / 1"
448,444,INA INA,KUSDIANTO Seiko Wahyu Supriadi Tedi,-6,0 - 0,,"2,130 / 1"
449,444,DEN DEN,Theodor JOHANSEN Mads PEDERSEN,-6,0 - 0,,"2,130 / 1"
450,444,BRN BRN,JAFFER EBRAHIM Heri SETIAWAN,-6,0 - 0,,"2,130 / 1"
451,452,COK GUM,John TAULU David YAO,-6,0 - 0,,"2,110 / 1"
452,452,TGA TGA,Lauti NAANIUMOTU Metuisela Talakai VAINIKOLO,-6,0 - 0,,"2,110 / 1"
453,452,NZL PYF,Callum HARFIELD Glen LEFOLL,-6,0 - 0,,"2,110 / 1"
454,452,NZL NZL,Daniel Steven BECKERLEG Thomas ELLIS,-6,0 - 0,,"2,110 / 1"
455,452,SCO SCO,Robert BLAIR Adam HALL,-6,0 - 0,,"2,110 / 1"
456,452,TPE TPE,Yu-Hua LAI Yi-Hsiang YANG,-6,0 - 0,,"2,110 / 1"
457,452,TPE TPE,CHENG Po Wei Tzu Wei WANG,-6,0 - 0,,"2,110 / 1"
458,452,KOR KOR,JANG Seung Hoon Seung Min KIM,-6,0 - 0,,"2,110 / 1"
459,452,KOR KOR,Jun su LEE Seung Jae SEO,-6,0 - 0,,"2,110 / 1"
460,452,TPE TPE,Chi-Hung LIAO TIEN Jen Chieh,-6,0 - 0,,"2,110 / 1"
461,452,RUS RUS,Anton DERBENEV Roman DVORNIKOV,-6,0 - 0,,"2,110 / 1"
462,452,RUS RUS,Mikhail NESTERENKO Vladimir SHIPILENKO,-6,0 - 0,,"2,110 / 1"
463,452,RUS RUS,Pavel KOTSARENKO Grigoriy MARTYNENKO,-6,0 - 0,,"2,110 / 1"
464,452,KOR KOR,JUNG Young Joon Yoon Cheol KIM,-6,0 - 0,,"2,110 / 1"
465,452,KOR KOR,Ji Su LEE Soo Hwan RYU,-6,0 - 0,,"2,110 / 1"
466,452,CZE SUI,Jan FROHLICH Marco FUX,-6,0 - 0,,"2,110 / 1"
467,452,RUS RUS,Andrey JDANOV Viktor TIMOSHOK,-6,0 - 0,,"2,110 / 1"
468,452,ENG ENG,Gregory MAIRS ROE Michael,-6,0 - 0,,"2,110 / 1"
469,452,KOR KOR,CHUNG Eui Seok Sang Joon LEE,-6,0 - 0,,"2,110 / 1"
470,471,TPE NZL,Kuo PO CHENG Joe WU,-74,0 - 0,,"2,090 / 2"
471,472,AZE AZE,Karim MUSAYEV Tural RASULOV,-7,0 - 0,,"2,070 / 2"
472,472,MAS MAS,Ching Weng CHUA Vi Hen TAN,-7,0 - 0,,"2,070 / 2"
473,472,MAS INA,Kok Pong LOKE Andre MARTEEN,-7,0 - 0,,"2,070 / 2"
474,475,MAS MAS,Ming Hui LEW Seng Zoe YEOH,-6,0 - 0,,"2,020 / 3"
475,476,TPE TPE,En Chia CHANG Yu-Hua LAI,-6,0 - 0,,"2,000 / 4"
476,477,TPE TPE,CHEN Chung Jen Chia-Hsin WAN,-6,0 - 0,,"1,950 / 2"
477,477,JPN JPN,Keiichiro MATSUI Koshun MIURA,-6,0 - 0,,"1,950 / 2"
478,479,DEN DEN,Nicklas MATHIASEN Lasse MOELHEDE,-5,0 - 0,,"1,920 / 2"
479,479,DEN DEN,Philip SEERUP Mikkel STOFFERSEN,-5,0 - 0,,"1,920 / 2"
480,479,NOR NOR,Magnus CHRISTENSEN Anders LEIRUD,-5,0 - 0,,"1,920 / 2"
481,479,THA THA,Keerati LIKITANURUCKS Natdanai UAKOOLWARAWAT,-5,0 - 0,,"1,920 / 2"
482,479,UGA UGA,Bruno MASAABA Davies SENONO,-5,0 - 0,,"1,920 / 2"
483,484,MAS THA,Kien Keat KOO Pakkawat VILAILAK,-5,0 - 0,,"1,920 / 1"
484,484,MAS MAS,Mohamad Arif ABDUL LATIF Chun Seang TAN,-5,0 - 0,,"1,920 / 1"
485,486,VIE VIE,Tuan Duc DO Khanh Tan LUONG,-4,0 - 0,,"1,880 / 2"
486,487,MAS MAS,Di Hua NG Man Chun WOON,-4,0 - 0,,"1,840 / 2"
487,487,INA INA,Asuro RIZKO Ellen Frederika SETIAWAN,-4,0 - 0,,"1,840 / 2"
488,487,ZAM ZAM,Kalonde CHARLES Chalwe CHONGO,-4,0 - 0,,"1,840 / 2"
489,487,GER GER,Bjarne GEISS Daniel SEIFERT,-4,0 - 0,,"1,840 / 2"
490,487,MAS MAS,Muhammad Hafifi HASHIM Wei Song LAW,-4,0 - 0,,"1,840 / 2"
491,487,FRA FRA,Mateo MARTINEZ GRADT-URBAN Samson,-4,0 - 0,,"1,840 / 2"
492,487,ENG ENG,Farid AKROUM George ISHERWOOD,-4,0 - 0,,"1,840 / 2"
493,487,ENG ENG,Christopher COLES Tom WOLFENDEN,-4,0 - 0,,"1,840 / 2"
494,487,BRN BRN,Adnan EBRAHIM Saied TAKI,-4,0 - 0,,"1,840 / 2"
495,487,BRA BRA,Lucas Constant da SILVA Thomas De Almeida PADILHA,-4,0 - 0,,"1,840 / 2"
496,487,UKR UKR,ZINUKHOV Andriy Vladislav DRUZCHENKO,-4,0 - 0,,"1,840 / 2"
497,487,THA THA,Thaptimdong ARKORNNIT Supak JOMKOH,-4,0 - 0,,"1,840 / 2"
498,487,AUS AUS,James AUDLEY David CUTRONI,-4,0 - 0,,"1,840 / 2"
499,487,POL POL,SWIERCZYNKI MATEUSZ Piotr WASILUK,-4,0 - 0,,"1,840 / 2"
500,487,BRA BRA,Alisson VASCONCELLOS Eduardo VAZ,-4,0 - 0,,"1,840 / 2"
501,487,ENG ENG,Martin DRABBLE Joshua YOUNG,-4,0 - 0,,"1,840 / 2"
502,487,BRA BRA,Pedro CHEN Gabriel GANDARA,-4,0 - 0,,"1,840 / 2"
503,504,THA THA,Mek NARONGRIT Krit TANTIANANKUL,-4,0 - 0,,"1,830 / 3"
504,505,EST EST,Mihkel LAANES Mario SAUNPERE,-4,0 - 0,,"1,820 / 3"
505,506,SWE SWE,Jonatan NORDH Nico RUPONEN,-4,0 - 0,,"1,820 / 1"
506,507,AUS AUS,Wesley CAULKETT Mitchell WHELLER,-4,0 - 0,,"1,800 / 2"
507,507,JPN JPN,Akira KOGA Taichi SAITO,-4,0 - 0,,"1,800 / 2"
508,509,ISL ISL,Atli JOHANNESSON Kari GUNNARSSON,-4,0 - 0,,"1,769 / 2"
509,510,INA INA,Fachriza ABIMANYU Hendrik K CLINTON,-4,0 - 0,,"1,750 / 3"
510,511,BAR SUR,Dakeil Jonathan THORPE Mitchel WONGSODIKROMO,-4,0 - 0,,"1,750 / 1"
511,511,JAM JAM,Tremar BARHAM Shane WILSON,-4,0 - 0,,"1,750 / 1"
512,511,FRA FRA,Marin BAUMANN Jordan CORVEE,-4,0 - 0,,"1,750 / 1"
513,511,SCO SCO,Alexander DUNN Adam HALL,-4,0 - 0,,"1,750 / 1"
514,511,BUL SLO,Blagovest KISYOV Alen ROJ,-4,0 - 0,,"1,750 / 1"
515,511,GER GER,David PENG Max WEISSKIRCHEN,-4,0 - 0,,"1,750 / 1"
516,511,CZE SVK,Jan FROHLICH Jarolim VICEN,-4,0 - 0,,"1,750 / 1"
517,511,SUR SUR,Dylan DARMOHOETOMO Soren OPTI,-4,0 - 0,,"1,750 / 1"
518,511,MEX MEX,Humberto AGUIRRE FAJARDO Victor Manuel RAMIREZ,-4,0 - 0,,"1,750 / 1"
519,511,ISR ISR,Ilia SHNAIDMAN Matan ZYSKIND,-4,0 - 0,,"1,750 / 1"
520,511,ISR ISR,Daniel BEDRACK Yonathan LEVIT,-4,0 - 0,,"1,750 / 1"
521,511,COL COL,Diego LOPERA Barrientos MATEO,-4,0 - 0,,"1,750 / 1"
522,511,UZB UZB,Shakhriyor KHIKMATOV Alisher KHOLMIRZAEV,-4,0 - 0,,"1,750 / 1"
523,511,THA THA,Kittisak NAMDASH Nonpakorn NANTATHEERO,-4,0 - 0,,"1,750 / 1"
524,511,INA INA,Fajar ALFIAN RIDHO AKbar,-4,0 - 0,,"1,750 / 1"
525,511,ETH ETH,MARKOS Demis KEDIR Nuredin,-4,0 - 0,,"1,750 / 1"
526,511,INA INA,Muhd. Alfian Firsada Ternawan SANGAJI Rian SWASTEDIAN,-4,0 - 0,,"1,750 / 1"
527,511,ETH ETH,Ermiyas Tamrat DEGEFE Mekonen GEBRELU,-4,0 - 0,,"1,750 / 1"
528,511,CHI CHI,Ivan LEON Bastian LIZAMA,-4,0 - 0,,"1,750 / 1"
529,511,THA THA,Nuttaphon NARKTHONG Sarayut SAETANG,-4,0 - 0,,"1,750 / 1"
530,531,MAS MAS,Di Hua NG Muhammad Amzzar ZAINUDDIN,-4,0 - 0,,"1,730 / 2"
531,531,THA THA,Inkarat APISUK Boonyakorn THUMPANICHWONG,-4,0 - 0,,"1,730 / 2"
532,533,MAS MAS,Wong KIN YIK Krishna Kumar S,-3,0 - 0,,"1,710 / 3"
533,534,RUS RUS,Denis GRACHEV Artem KARPOV,-2,0 - 0,,"1,700 / 1"
534,535,SUI INA,Agung RUHANDA KUSUMAH Sandy Darma,-2,0 - 0,,"1,670 / 1"
535,535,BAN BAN,Mostafizar RAHMAN Uddin SAIF,-2,0 - 0,,"1,670 / 1"
536,535,IND IND,Jayan JAMES Vikranth Kumar KORUKONDA,-2,0 - 0,,"1,670 / 1"
537,535,IND IND,Sanidhya BANDOONI SINGH Vinay Kumar,-2,0 - 0,,"1,670 / 1"
538,535,IND IND,Kapil CHAUDHARY Chandrabhusan TRIPATHI,-2,0 - 0,,"1,670 / 1"
539,535,IND IND,Vikrant CHAWAT Rajat RATHORE,-2,0 - 0,,"1,670 / 1"
540,535,INA INA,Fran KURNIAWAN Afiat Yuris WIRAWAN,-2,0 - 0,,"1,670 / 1"
541,535,INA INA,Arya Maulana ADIARTAMA Muhammad ULINNUHA,-2,0 - 0,,"1,670 / 1"
542,535,INA INA,Putra BIANTO Galang DECKY RAMADHAN,-2,0 - 0,,"1,670 / 1"
543,535,INA INA,Ramadiansyah ANDIKA Rinov RIVALDY,-2,0 - 0,,"1,670 / 1"
544,535,INA INA,Viky ANINDITA Darmawandi JOKO ALI,-2,0 - 0,,"1,670 / 1"
545,535,IND IND,Abhishek AHLAWAT Ankit CHHIKARA,-2,0 - 0,,"1,670 / 1"
546,535,USA USA,Neil DAVIES Marc LAI,-2,0 - 0,,"1,670 / 1"
547,535,IND IND,J. B. S. Vidyadhar Srujan NANDALURI,-2,0 - 0,,"1,670 / 1"
548,535,UKR UKR,Valeriy ATRASHCHENKOV Gennadiy NATAROV,-2,0 - 0,,"1,670 / 1"
549,535,HKG HKG,HO Wai Lun LAW Cheuk Him,-2,0 - 0,,"1,670 / 1"
550,535,SLO SLO,Alen ROJ Kek JAMNIK,-2,0 - 0,,"1,670 / 1"
551,535,HKG HKG,LO Lok Kei CHAN Tsz Kit,-2,0 - 0,,"1,670 / 1"
552,553,AUT AUT,Paul DEMMELMAYER Philip KATSAROS,-2,0 - 0,,"1,650 / 3"
553,554,FRA CZE,Jocelyn DESCHAMP Maximilian KORENY,-2,0 - 0,,"1,640 / 3"
554,555,LTU LTU,Renaldas SILERIS Laurynas SPARNAUSKIS,-2,0 - 0,,"1,620 / 3"
555,556,MAS MAS,Darren Isaac DEVADASS Muhammad Amzzar ZAINUDDIN,-2,0 - 0,,"1,580 / 2"
556,557,RUS RUS,Evgenij DREMIN Vladimir MALKOV,-2,0 - 0,,"1,540 / 2"
557,557,ALG ALG,Mohamed Amine GUELMAOUI Youcef Sabri MEDEL,84,0 - 0,,"1,540 / 2"
558,559,THA THA,Parinyawat THONGNUAM TANKMANUSTONG Warut,-3,0 - 0,,"1,520 / 3"
559,560,HKG HKG,CHAN Tsz Kit LAW Cheuk Him,-3,0 - 0,,"1,520 / 1"
560,560,NZL TPE,Oliver LEYDON-DAVIS TIEN Jen Chieh,-3,0 - 0,,"1,520 / 1"
561,560,BRA BRA,Willian GUIMARAES Vinicius Oliveira SILVA,-3,0 - 0,,"1,520 / 1"
562,560,INA INA,Julian ARBITAMA Subhan HASAN,-3,0 - 0,,"1,520 / 1"
563,560,IRI IRI,NORI Erfan POREBRAHIM ZEMIDANI Saeed,-3,0 - 0,,"1,520 / 1"
564,560,IRQ IRQ,Ali Abduladheem Hamad AL-OGAILI AL- QAZZAZ Ali Muafaq Hadi,-3,0 - 0,,"1,520 / 1"
565,560,IRI IRI,Sepehr EIVANI Sadredin SADEGHI,-3,0 - 0,,"1,520 / 1"
566,560,IRI IRI,Zargan AMIRARSALAN HEYDARI SHAFAGH Hamid,-3,0 - 0,,"1,520 / 1"
567,560,TPE NZL,KAN Chao Yu Oliver LEYDON-DAVIS,-3,0 - 0,,"1,520 / 1"
568,560,CHN CHN,GUO Yuchen TANG Jincheng,-3,0 - 0,,"1,520 / 1"
569,560,FIN FIN,Anton KAISTI Marko PYYKONEN,-3,0 - 0,,"1,520 / 1"
570,560,THA THA,Thanadol JUMPANOI Viriyangkura TANUPAT,-3,0 - 0,,"1,520 / 1"
571,560,THA THA,Rachata CHANDAWAN Chavapat TOCHAREONBODEE,-3,0 - 0,,"1,520 / 1"
572,560,SIN SIN,Chao HUANG Ming Shun TAN,-3,0 - 0,,"1,520 / 1"
573,560,IND IND,Prem Singh CHOUHAN Abhinav PRAKASH,-3,0 - 0,,"1,520 / 1"
574,560,IND IND,Ravinder SINGH SINGH Vinay Kumar,-3,0 - 0,,"1,520 / 1"
575,560,FRA FRA,Tanguy CITRON Gregor DUNIKOWSKI,-3,0 - 0,,"1,520 / 1"
576,560,TPE TPE,KAN Chao Yu Hsu JUI TING,-3,0 - 0,,"1,520 / 1"
577,560,NEP NEP,Pankaj CHAND Indra MEHATA,-3,0 - 0,,"1,520 / 1"
578,560,MDV MDV,Mohamed Ajfan RASHEED Nasheeu SHARAFUDDEEN,-3,0 - 0,,"1,520 / 1"
579,560,BAN BAN,Tushar Krishna ROY Uddin SAIF,-3,0 - 0,,"1,520 / 1"
580,560,BAN BAN,Chand LAL Mohammed Jabed MOSTAFA,-3,0 - 0,,"1,520 / 1"
581,560,NEP NEP,Dipesh DHAMI Sajan Krishna TAMRAKAR,-3,0 - 0,,"1,520 / 1"
582,560,NED TPE,Ruud BOSCH KAN Chao Yu,-3,0 - 0,,"1,520 / 1"
583,560,ENG ENG,Jed ARKSEY Alex LANE,-3,0 - 0,,"1,520 / 1"
584,560,MAS MAS,Nelson Wei Keat HEG Hong Kheng YEW,-3,0 - 0,,"1,520 / 1"
585,560,MAS MAS,Muhammad Hafiz HASHIM Muhammad Hafizi HASHIM,-3,0 - 0,,"1,520 / 1"
586,560,PAK PAK,Wajid Ali CHAUDHRY Amir SAEED,-3,0 - 0,,"1,520 / 1"
587,560,CAN CAN,Francois BOURRET Pierre-Etienne PILOTE,-3,0 - 0,,"1,520 / 1"
588,560,INA INA,Titon GUSTAMAN Sandy I KOMANG,-3,0 - 0,,"1,520 / 1"
589,560,DEN DEN,Mads Emil CHRISTENSEN Jonas Arly RASMUSSEN,-3,0 - 0,,"1,520 / 1"
590,560,SUI SUI,Quentin FILLIETTAZ Cyril HOHL,-3,0 - 0,,"1,520 / 1"
591,560,PAK AUS,Rizwan AZAM Anthony CHANG,-3,0 - 0,,"1,520 / 1"
592,560,AUS AUS,Luke CHONG Lewis WANG,-3,0 - 0,,"1,520 / 1"
593,560,ENG ENG,Marcus ELLIS Matthew NOTTINGHAM,-3,0 - 0,,"1,520 / 1"
594,560,ESA GUA,PEÑA Christopher Eddy GARCIA,-3,0 - 0,,"1,520 / 1"
595,560,ESA ESA,GUZMAN Carlos MADRID Rene,-3,0 - 0,,"1,520 / 1"
596,560,INA INA,Arya Maulana ADIARTAMA Irfan FADHILAH,-3,0 - 0,,"1,520 / 1"
597,560,RUS RUS,Vadim ITCKOV Ilya ZHDANOV,-3,0 - 0,,"1,520 / 1"
598,560,RUS RUS,Andrey DOLOTOV Ivan MEDVEDEV,-3,0 - 0,,"1,520 / 1"
599,560,NGR NGR,Habeeb Temitope BELLO Abdulfatai SALAUDEEN,-3,0 - 0,,"1,520 / 1"
600,560,BEN BEN,Carlos ALLAMAGBO Senakpon Carlos BOSSOUVI,-3,0 - 0,,"1,520 / 1"
601,560,CZE AUT,Jan FROHLICH Luka WRABER,-3,0 - 0,,"1,520 / 1"
602,560,IND IND,S. Sunjith (Jr) Pranav SATHEESH,-89,0 - 0,,"1,520 / 1"
603,560,DEN DEN,Mads Emil KRISTENSEN Soeren TOFT HANSEN,-3,0 - 0,,"1,520 / 1"
604,560,SWE SWE,Richard EIDESTEDT Andy Hartono TANDAPUTRA,-3,0 - 0,,"1,520 / 1"
605,560,HKG INA,HO Wai Lun Fernando KURNIAWAN,-3,0 - 0,,"1,520 / 1"
606,560,JPN JPN,Katsunori ITO Ryota SANDO,-3,0 - 0,,"1,520 / 1"
607,560,MEX MEX,Lopez ANDRES Arturo HERNANDEZ,-95,0 - 0,,"1,520 / 1"
608,560,INA INA,Viky ANINDITA Wirawan IHSAN ADAM,-3,0 - 0,,"1,520 / 1"
609,560,IRI IRI,Erfan JOYANDEH Mehran SHAHBAZI,-3,0 - 0,,"1,520 / 1"
610,560,BAN BAN,Md. Rahad Kabir KHALED Saleh Ahmed SHAMOL,-3,0 - 0,,"1,520 / 1"
611,560,FRA FRA,Lucas CLAERBOUT Thomas ROUXEL,-3,0 - 0,,"1,520 / 1"
612,560,NGR NGR,Gideon BABALOLA Clement KROBAKPO,-3,0 - 0,,"1,520 / 1"
613,560,RUS RUS,Egor KURDYUKOV Egor OKOLOV,-3,0 - 0,,"1,520 / 1"
614,560,SRI SRI,Hasitha Chanaka MANANI HEWA Kasun Madusanka RATHNAYAKESENARATGE,-3,0 - 0,,"1,520 / 1"
615,560,MAS MAS,Mohd Razif ABDUL LATIF Muhammad Hafiz HASHIM,-3,0 - 0,,"1,520 / 1"
616,560,AUS AUS,Guy GIBSON Bernhard HALIM,-3,0 - 0,,"1,520 / 1"
617,560,FIN FIN,Mika KONGAS Oskari SAARINEN,-3,0 - 0,,"1,520 / 1"
618,560,RUS RUS,Andrej ASHMARIN Sergey SHUMILKIN,-3,0 - 0,,"1,520 / 1"
619,560,CZE CZE,Pavel FLORIAN Jaromir JANACEK,-3,0 - 0,,"1,520 / 1"
620,560,NGR NGR,Ibrahim ADAMU Olorunfemi ELEWA,-3,0 - 0,,"1,520 / 1"
621,560,AUT AUT,Ralph BITTENAUER Benjamin SCHLEMMER,-3,0 - 0,,"1,520 / 1"
622,560,SWE SWE,Richard EIDESTEDT Tim FOO,-3,0 - 0,,"1,520 / 1"
623,624,TUR TUR,Ömer ALTINKOPRU Enis SESALAN,-4,0 - 0,,"1,470 / 2"
624,624,TPE TPE,Hsu JUI TING Kuo PO CHENG,-4,0 - 0,,"1,470 / 2"
625,624,CHI CHI,Diego CASTILLO Alonso MEDEL,-4,0 - 0,,"1,470 / 2"
626,624,KEN KEN,Amos CHIRCHIR Edwin NJERI,-4,0 - 0,,"1,470 / 2"
627,624,POL POL,Pawel PRADZINSKI Patryk SZYMONIAK,-4,0 - 0,,"1,470 / 2"
628,624,BRA BRA,Victor ALVES Igor IBRAHIM,-4,0 - 0,,"1,470 / 2"
629,624,BRA BRA,Vagner ANTUNES Felipe Augusto De FARIA,-4,0 - 0,,"1,470 / 2"
630,624,PER PER,Leonardo ISA Diego MINI,-4,0 - 0,,"1,470 / 2"
631,624,IND IND,Mayank BEHAL Venkat Gaurav PRASAD,-143,0 - 0,,"1,470 / 2"
632,624,POL POL,Maciej OCIEPA Michal WALENTEK,-4,0 - 0,,"1,470 / 2"
633,624,INA INA,Setiawan HIDAYAT Darmawandi JOKO ALI,-4,0 - 0,,"1,470 / 2"
634,624,SLO SLO,Miha IVANIC Martin CERKOVNIK,-4,0 - 0,,"1,470 / 2"
635,624,AUT AUT,Rüdiger GNEDT Wolfgang GNEDT,-4,0 - 0,,"1,470 / 2"
636,624,INA INA,Didit JUANG Muhammad ULINNUHA,-4,0 - 0,,"1,470 / 2"
637,638,SIN SIN,Kean Hean LOH Guang Liang Jason WONG,-2,0 - 0,,"1,450 / 3"
638,639,VIE VIE,Minh BAO Nguyen Khang HUYNH,-2,0 - 0,,"1,430 / 2"
639,640,CZE CZE,Pavel DRANCAK Jaromir JANACEK,-2,0 - 0,,"1,420 / 1"
640,640,RUS RUS,Stanislav PUKHOV Sergey SIRANT,-2,0 - 0,,"1,420 / 1"
641,642,CGO CGO,Mbongo DMITRI Bikoumou JONATHAN,-2,0 - 0,,"1,370 / 2"
642,643,CUB CUB,Lazaro Yovani MADERA PADRINO Bryan VELIZ ARBOLAY,0,0 - 0,,"1,370 / 1"
643,643,JAM JAM,Jemarey GORDON Matthew LEE,-2,0 - 0,,"1,370 / 1"
644,643,DEN DEN,Patrick BUHL Steve OLESEN,-2,0 - 0,,"1,370 / 1"
645,643,DEN ESP,David Kim KRISTENSEN Ernesto VELAZQUEZ,-2,0 - 0,,"1,370 / 1"
646,643,DEN SWE,Rene MATTISSON Filip Michael Duwall MYHREN,-2,0 - 0,,"1,370 / 1"
647,643,UGA UGA,Riyaz SALEWALA Areej SHALWANI,-2,0 - 0,,"1,370 / 1"
648,643,PER PER,Daniel LA TORRE REGAL Sebastian MACIAS,-2,0 - 0,,"1,370 / 1"
649,643,DEN DEN,Jeppe Bruun CHRISTENSEN Mark Mohr Laursen DAMGAARD,-2,0 - 0,,"1,370 / 1"
650,643,FRA DEN,Jocelyn DESCHAMP Soeren TOFT HANSEN,-2,0 - 0,,"1,370 / 1"
651,643,POL POL,Maciej DABROWSKI Mateusz DUBOWSKI,-2,0 - 0,,"1,370 / 1"
652,643,INA INA,Kaizar Bobby ALEXANDER Gideon Markus FERNALDI,-2,0 - 0,,"1,370 / 1"
653,643,RSA RSA,Cameron COETZER Jason COETZER,-2,0 - 0,,"1,370 / 1"
654,643,SWE SWE,Toni HOLM-LOWEN Karl MURGARD,-2,0 - 0,,"1,370 / 1"
655,643,DEN DEN,Rene MATTISSON Mathias Rud PEDERSEN,-2,0 - 0,,"1,370 / 1"
656,643,SUR SUR,Jair LIEW Alain TONEY,-2,0 - 0,,"1,370 / 1"
657,643,MAR MAR,Ahmad Bachir EL MERGHADI Mehdi ERRAIHANI,-2,0 - 0,,"1,370 / 1"
658,643,MAR MAR,KSIKES AMINE Ahmed Amine KSIKES,-2,0 - 0,,"1,370 / 1"
659,643,JOR JOR,Ayham ABD ELEDDIN Mohd Naser Mansour NAYEF,-2,0 - 0,,"1,370 / 1"
660,643,ETH ETH,FANTHHUN Estefanos ABDULKADIR Tofik,-2,0 - 0,,"1,370 / 1"
661,643,JPN JPN,Kazuaki OSHIMA Yuki UMINO,-2,0 - 0,,"1,370 / 1"
662,643,VIE VIE,Cong Hai NGUYEN Hoang Anh NGUYEN,-2,0 - 0,,"1,370 / 1"
663,643,ECU ESP,Sergio CHEVASCO HANZE Oscar MARTINEZ SALAN,-2,0 - 0,,"1,370 / 1"
664,643,COL COL,Hugo ANDRADE Yamit GIRONZA,-2,0 - 0,,"1,370 / 1"
665,643,COL COL,Miguel SIERRA Henry VACA,-2,0 - 0,,"1,370 / 1"
666,643,INA INA,RIDHO AKbar Senatria Agus SETIA PUTRA,-2,0 - 0,,"1,370 / 1"
667,643,EST EST,Mihkel LAANES Heiko ZOOBER,-2,0 - 0,,"1,370 / 1"
668,643,IRQ IRQ,Haidar M. BESHA Eeleeshya Yousif IDWER,-2,0 - 0,,"1,370 / 1"
669,643,UGA UGA,Fred KIRABO Ivan MAYEGA,-2,0 - 0,,"1,370 / 1"
670,643,MRI MRI,Denneshsing BABOOLALL Vishal SAWARAM,-2,0 - 0,,"1,370 / 1"
671,643,POL SVK,Adrian DZIOLKO Jarolim VICEN,-2,0 - 0,,"1,370 / 1"
672,643,RUS RUS,Sergey MOLODOV Alexandr ZINCHENKO,-2,0 - 0,,"1,370 / 1"
673,643,RSA RSA,Michael JENNINGS James Hilton MCMANUS,-2,0 - 0,,"1,370 / 1"
674,643,EGY EGY,Monier Fayez BOTROS Ahmed SALAH,-2,0 - 0,,"1,370 / 1"
675,643,THA THA,Takdanai BOONRAWD Parinyawat THONGNUAM,-2,0 - 0,,"1,370 / 1"
676,643,NZL AUS,James EUNSON Jeff THO,-2,0 - 0,,"1,370 / 1"
677,643,INA INA,Hermansyah . Senatria Agus SETIA PUTRA,-2,0 - 0,,"1,370 / 1"
678,643,INA INA,Aldo Abdillah HARSONO Putra Eka RHOMA,-2,0 - 0,,"1,370 / 1"
679,643,SUI SUI,Mathias BONNY Gilles TRIPET,-116,0 - 0,,"1,370 / 1"
680,643,INA INA,Asuro RIZKO Atmaja WILDAN,-2,0 - 0,,"1,370 / 1"
681,643,AUS AUS,Luke CHONG Joel FINDLAY,-2,0 - 0,,"1,370 / 1"
682,643,VEN VEN,Wilmer Josue RAMIREZ CAÑIZALES Jesus Manuel SANCHEZ LAMA,-2,0 - 0,,"1,370 / 1"
683,643,ETH ETH,TEKLU Endale ASRAR Seid,-2,0 - 0,,"1,370 / 1"
684,643,INA INA,Riyo ARIEF Ismail RISKY HIDAYAT,-2,0 - 0,,"1,370 / 1"
685,643,GER GER,Jones Ralfy JANSEN Ari TRISNANTO,-2,0 - 0,,"1,370 / 1"
686,643,BUL BUL,Blagovest KISYOV Ivan RUSEV,-2,0 - 0,,"1,370 / 1"
687,643,AUT AUT,Benjamin SCHLEMMER Dominik STIPSITS,-2,0 - 0,,"1,370 / 1"
688,643,MRI MRI,Stephan BEEHARRY Neeresh RAMTOHUL,-2,0 - 0,,"1,370 / 1"
689,643,SUR SUR,Alrick TONEY Alroy TONEY,-2,0 - 0,,"1,370 / 1"
690,691,JPN JPN,Kazuki MATSUMARU Izumi OKOSHI,-3,0 - 0,,"1,350 / 2"
691,691,FRA FRA,Quentin VINCENT Sebastien VINCENT,-161,0 - 0,,"1,350 / 2"
692,691,JPN JPN,Yuki UMINO Yuta YAMASAKI,-3,0 - 0,,"1,350 / 2"
693,694,FRA FRA,Shinsai DESLAURIERS Jeremie VERIN,47,0 - 0,,"1,340 / 3"
694,695,CAN CAN,Pierre-Etienne PILOTE Maxime TÉTREAULT,-5,0 - 0,,"1,290 / 1"
695,695,USA USA,Dean SCHOPPE Tariq WADOOD,-5,0 - 0,,"1,290 / 1"
696,695,USA USA,Tony GUNAWAN Meng-Yung ONG,-5,0 - 0,,"1,290 / 1"
697,695,GUA GUA,Daniel HUMBLERS HUMBLERS HEYMARD,-5,0 - 0,,"1,290 / 1"
698,695,USA CAN,Hock Lai LEE Toby NG,-5,0 - 0,,"1,290 / 1"
699,695,ENG ENG,Nick HODGSON Joshua YOUNG,-5,0 - 0,,"1,290 / 1"
700,695,SCO SCO,Alexander DUNN Keith TURNBULL,-5,0 - 0,,"1,290 / 1"
701,695,SCO SCO,Sameer Scott AAMIR Brandon TSANG,-5,0 - 0,,"1,290 / 1"
702,695,KOR KOR,Se Sung AHN Ji Soo LIM,-5,0 - 0,,"1,290 / 1"
703,695,KOR KOR,JUNG Suk Hoon Ki Hoon KIM,-5,0 - 0,,"1,290 / 1"
704,695,KOR KOR,Jun Soo KIM KIM Kyung Tae,-5,0 - 0,,"1,290 / 1"
705,695,KOR KOR,HAN To Sung JUNG Young Keun,-5,0 - 0,,"1,290 / 1"
706,695,KOR KOR,Seung Yeop HAN Jae Woo LEE,-5,0 - 0,,"1,290 / 1"
707,695,KOR KOR,Hyuk Gyun CHOI Jong Woo CHOI,-5,0 - 0,,"1,290 / 1"
708,695,KOR KOR,Dong Joo KIM KIM Sung Hyo,-5,0 - 0,,"1,290 / 1"
709,695,HKG HKG,CHAN Alan Yun Lung TANG Chun Man,-5,0 - 0,,"1,290 / 1"
710,695,SUI SUI,Loïc GOTHUEY Nicolas LENGGENHAGER,-5,0 - 0,,"1,290 / 1"
711,695,BRA BRA,Paulo Lucas ROSA OLIVEIRA Thiago SILVA GOMES,-5,0 - 0,,"1,290 / 1"
712,695,BRA BRA,Felippe CURY FONSECA Thomas MORETTI,-5,0 - 0,,"1,290 / 1"
713,695,BRA BRA,Luiz Eduardo MARTINEZ Gabriel SALGADO,-5,0 - 0,,"1,290 / 1"
714,695,KOR KOR,Chae Sung JEON Ji Won YANG,-5,0 - 0,,"1,290 / 1"
715,695,KOR KOR,Dong Hoon KIM Ju Hyung SON,-5,0 - 0,,"1,290 / 1"
716,695,KOR KOR,BAE Kwon Young KIL Hyun Cheol,-5,0 - 0,,"1,290 / 1"
717,695,CAN CAN,Calvin CHE James Pin Kuan HO,-5,0 - 0,,"1,290 / 1"
718,695,CAN CAN,Jordon HON Daniel LEUNG,-5,0 - 0,,"1,290 / 1"
719,695,CAN CAN,Benjamin LEUNG Michael LIM,-5,0 - 0,,"1,290 / 1"
720,695,DEN DEN,Rasmus FLADBERG Joachim PERSSON,-5,0 - 0,,"1,290 / 1"
721,695,CAN CAN,Allen Tsz Ho LEE Alexander LIM,-5,0 - 0,,"1,290 / 1"
722,695,CAN CAN,Allan Yao-Zhong NG Bryan NG,-5,0 - 0,,"1,290 / 1"
723,695,CAN CAN,Jakob KRYCZKA Graydon ROBB,-5,0 - 0,,"1,290 / 1"
724,695,BRA BRA,Alex Yuwan TJONG Luiz dos SANTOS JR,-5,0 - 0,,"1,290 / 1"
725,695,SCO SCO,Danny LEINSTER Steven STEWART,-5,0 - 0,,"1,290 / 1"
726,695,UGA ZAM,Edwin EKIRING Eli MAMBWE,-5,0 - 0,,"1,290 / 1"
727,728,SCO SCO,Matthew CARDER Adam HALL,-5,0 - 0,,"1,280 / 2"
728,729,ENG ENG,Daniel MOSS David POOLE,-5,0 - 0,,"1,270 / 2"
729,729,SUI SUI,Pierrick DESCHENAUX Joel KOENIG,-5,0 - 0,,"1,270 / 2"
730,729,NOR NOR,Johannes HAGEN Jesper KRISTENSEN,-5,0 - 0,,"1,270 / 2"
731,732,TPE TPE,Chu-En HUANG Jhe-Huei LEE,-5,0 - 0,,"1,240 / 2"
732,732,INA INA,Rendi ISMANTO Nathaniel Ernestan SULISTYO,-5,0 - 0,,"1,240 / 2"
733,734,IND IND,Sandeep ANAND Himanshu SAROHA,575,0 - 0,,"1,200 / 2"
734,735,THA THA,Napat CHOONHAJINDA Soravis PIJITPALAKAD,-6,0 - 0,,"1,180 / 4"
735,736,POL POL,Maciej DABROWSKI Pawel PIETRYJA,-6,0 - 0,,"1,170 / 1"
736,736,FIN FIN,Petri HAUTALA Arttu MAHONEN,-6,0 - 0,,"1,170 / 1"
