,RANK,COUNTRY,PLAYER,CHANGE +/-,WIN - LOSE,PRIZE MONEY,POINTS / TOURNAMENTS
367,368,NZL NZL,Callum HARFIELD Valens SULAIMAN,-5,0 - 0,,"2,220 / 2"
368,368,INA INA,Ramadiansyah ANDIKA Rinov RIVALDY,-5,0 - 0,,"2,220 / 2"
369,370,IND IND,Talar LAA Sahil SIPANI,-5,0 - 0,,"2,220 / 1"
370,370,IND IND,Arjun Kumar Reddy MALGARI T. Hema Nagendra Babu,-5,0 - 0,,"2,220 / 1"
371,370,IND IND,Utkarsh ARORA Abhinav PRAKASH,-5,0 - 0,,"2,220 / 1"
372,370,IND IND,Kamaldeep SINGH Neeraj VASHIST,-5,0 - 0,,"2,220 / 1"
373,370,IND IND,Ankit CHHIKARA Deepak KHATRI,-5,0 - 0,,"2,220 / 1"
374,370,IND IND,D. Guru Prasad S. Sanjeeth,-5,0 - 0,,"2,220 / 1"
375,376,RUS RUS,Rodion ALIMOV Pavel KOTSARENKO,-5,0 - 0,,"2,210 / 2"
376,376,ENG ENG,James FARMER Scott P WILLIAMS,-5,0 - 0,,"2,210 / 2"
377,376,ENG ENG,Conor BAMBRICK Thomas Joseph STANFORD,-5,0 - 0,,"2,210 / 2"
378,376,CAN CAN,Felix DEBLOIS-BEAUCAGE Alexis GOHIER-DROLET,-5,0 - 0,,"2,210 / 2"
379,380,IND IND,Chetan ANAND Raunaq MURADIA,-5,0 - 0,,"2,200 / 3"
380,381,UKR UKR,Roman KONSTANTINOV Vladyslav VOLNYANSKIY,0,0 - 0,,"2,200 / 1"
381,381,RUS RUS,Mikhail GHELASHVILI Aleksandr VASILKIN,-5,0 - 0,,"2,200 / 1"
382,381,FRA FRA,Laurent CONSTANTIN Bastian KERSAUDY,-5,0 - 0,,"2,200 / 1"
383,381,SUI BUL,Anthony DUMARTHERAY Stilian MAKARSKI,-5,0 - 0,,"2,200 / 1"
384,381,RUS RUS,Evgenij DREMIN Nikita KHAKIMOV,-5,0 - 0,,"2,200 / 1"
385,381,CHN CHN,HAN Chengkai ZHOU Haodong,-5,0 - 0,,"2,200 / 1"
386,381,CHN CHN,SUN Zhanming WANG Sijie,-5,0 - 0,,"2,200 / 1"
387,381,IND IND,Vighnesh DEVLEKAR Eshan NAQVI,-5,0 - 0,,"2,200 / 1"
388,381,BAN BAN,Parash Md.AHSUN HABIB Md Rais UDDIN,-5,0 - 0,,"2,200 / 1"
389,381,BAN BAN,Mohammad Anamul HAQUE AHMED Md.Jamil,-5,0 - 0,,"2,200 / 1"
390,381,BAN BAN,Md Zainal ABEDIN Ebadul Haque CHOWDHURY,-5,0 - 0,,"2,200 / 1"
391,381,RUS RUS,Gordey KOSENKO Anatoliy YARTSEV,-5,0 - 0,,"2,200 / 1"
392,381,CHN CHN,HE Wenjun HUANG Guoxing,-5,0 - 0,,"2,200 / 1"
393,381,IRI IRI,Vatannejad-Soroush ESKANDARI Hasan MOTAGHI,-5,0 - 0,,"2,200 / 1"
394,381,NGR NGR,Godwin OLOFUA Anuoluwapo Juwon OPEYORI,-5,0 - 0,,"2,200 / 1"
395,381,JPN JPN,Kohei GONDO Tatsuya WATANABE,-5,0 - 0,,"2,200 / 1"
396,381,UKR UKR,ZINUKHOV Andriy MARTYNENKO Mykola,0,0 - 0,,"2,200 / 1"
397,381,FRA FRA,Marin BAUMANN Lucas CLAERBOUT,-5,0 - 0,,"2,200 / 1"
398,381,MEX MEX,Mauricio CASILLAS Arturo HERNANDEZ,0,0 - 0,,"2,200 / 1"
399,381,KOR KOR,CHUNG Eui Seok KIM Dae Eun,-5,0 - 0,,"2,200 / 1"
400,401,IND IND,Kabir KANZARKAR Akshay RAUT,-6,0 - 0,,"2,180 / 2"
401,402,TPE TPE,CHENG Po Wei LIN Yu Hsien,-6,0 - 0,,"2,160 / 3"
402,403,IRI IRI,Ashkan FESAHATI Mohamad Reza KHANJANI,-6,0 - 0,,"2,130 / 1"
403,403,BUL BUL,Daniel NIKOLOV Ivan RUSEV,-6,0 - 0,,"2,130 / 1"
404,403,DEN DEN,Frederik AALESTRUP Kasper DINESEN,-6,0 - 0,,"2,130 / 1"
405,403,SUR SUR,Gilmar JONES Mitchel WONGSODIKROMO,-6,0 - 0,,"2,130 / 1"
406,403,DEN DEN,Andreas BERTHELSEN Kasper DINESEN,-6,0 - 0,,"2,130 / 1"
407,408,MAS MAS,Krishna Kumar S Thanesh VEERAPPAN,253,0 - 0,,"2,120 / 4"
408,409,INA INA,Altof BARRIQ Reinard DHANRIANO,49,0 - 0,,"2,110 / 2"
409,410,MEX MEX,Luis Ramon GARRIDO Antonio OCEGUEDA,-7,0 - 0,,"2,110 / 1"
410,410,CAN CAN,Jason Anthony HO-SHUE Jonathan Bing Tsan LAI,-7,0 - 0,,"2,110 / 1"
411,410,COK GUM,John TAULU David YAO,-7,0 - 0,,"2,110 / 1"
412,410,TGA TGA,Lauti NAANIUMOTU Metuisela Talakai VAINIKOLO,-7,0 - 0,,"2,110 / 1"
413,410,NZL PYF,Callum HARFIELD Glen LEFOLL,-7,0 - 0,,"2,110 / 1"
414,410,NZL NZL,Daniel Steven BECKERLEG Thomas ELLIS,-7,0 - 0,,"2,110 / 1"
415,410,TPE TPE,Yu-Hua LAI Yi-Hsiang YANG,-7,0 - 0,,"2,110 / 1"
416,410,TPE TPE,CHENG Po Wei Tzu Wei WANG,-7,0 - 0,,"2,110 / 1"
417,410,KOR KOR,JANG Seung Hoon Seung Min KIM,-7,0 - 0,,"2,110 / 1"
418,410,KOR KOR,Jun su LEE Seung Jae SEO,-7,0 - 0,,"2,110 / 1"
419,410,ENG ENG,Gregory MAIRS ROE Michael,-7,0 - 0,,"2,110 / 1"
420,410,KOR KOR,CHUNG Eui Seok Sang Joon LEE,-7,0 - 0,,"2,110 / 1"
421,410,RUS RUS,Grigoriy MARTYNENKO Sergey SIRANT,-7,0 - 0,,"2,110 / 1"
422,410,CHI CHI,Cristian ARAYA Ivan LEON,-7,0 - 0,,"2,110 / 1"
423,424,THA THA,Watchara BURANAKUEA Trawut POTIENG,-7,0 - 0,,"2,100 / 2"
424,424,TPE TPE,CHANG Kai Liang SU Yi Neng,-7,0 - 0,,"2,100 / 2"
425,426,DOM DOM,Therry AQUINO Reimi Starling CABRERA ROSARIO,-7,0 - 0,,"2,090 / 2"
426,426,ENG ENG,Harry ARKSEY David JONES,-7,0 - 0,,"2,090 / 2"
427,428,MAS MAS,Yeet Siang LIN Wei Sheng LOH,528,0 - 0,,"2,070 / 2"
428,429,HKG HKG,CHAN Tsz Kit HO Wai Lun,-8,0 - 0,,"2,030 / 2"
429,430,SWE SWE,Filip Michael Duwall MYHREN Nico RUPONEN,-8,0 - 0,,"2,030 / 1"
430,431,MAS MAS,Ikmal Hussain JAAFAR Eizlan Shah MISFAHUL MUNEER,-8,0 - 0,,"2,020 / 5"
431,432,FRA FRA,Thomas BAURES Thom GICQUEL,-8,0 - 0,,"2,020 / 2"
432,432,NZL NZL,Abhinav MANOTA Dylan SOEDJASA,-8,0 - 0,,"2,020 / 2"
433,434,AUT DEN,Jurgen KOCH Christian LIND THOMSEN,-8,0 - 0,,"1,990 / 2"
434,435,BAR BAR,Dakeil Jonathan THORPE Bradley PILGRIM,-8,0 - 0,,"1,970 / 2"
435,436,TPE TPE,CHEN Chung Jen Chia-Hsin WAN,-8,0 - 0,,"1,950 / 2"
436,437,DEN DEN,Nicklas MATHIASEN Lasse MOELHEDE,-7,0 - 0,,"1,920 / 2"
437,437,NOR NOR,Magnus CHRISTENSEN Anders LEIRUD,-7,0 - 0,,"1,920 / 2"
438,437,MAS MAS,"Teng Fong, Aaron CHIA Guo Zheng SIM",-7,0 - 0,,"1,920 / 2"
439,440,SIN SIN,Kean Hean LOH Guang Liang Jason WONG,-7,0 - 0,,"1,890 / 4"
440,441,ISR ISR,Alexander BASS Daniel CHISLOV,-7,0 - 0,,"1,870 / 3"
441,442,TPE TPE,LU Jin-Song YANG Po-Hsuan,-7,0 - 0,,"1,840 / 2"
442,442,INA INA,Ramadhani AKBAR GUSTI Galang DECKY RAMADHAN,-7,0 - 0,,"1,840 / 2"
443,442,SRB SRB,Igor BJELAN Dragoslav PETROVIC,-7,0 - 0,,"1,840 / 2"
444,442,ESP ESP,Juan Manuel FERNANDEZ QUILES Javier SANCHEZ SOLER,-7,0 - 0,,"1,840 / 2"
445,442,FRA FRA,Jordan CORVEE Lucas CORVEE,-7,0 - 0,,"1,840 / 2"
446,442,ZAM ZAM,Kalonde CHARLES Chalwe CHONGO,-7,0 - 0,,"1,840 / 2"
447,442,GER GER,Bjarne GEISS Daniel SEIFERT,-7,0 - 0,,"1,840 / 2"
448,442,MAS MAS,Muhammad Hafifi HASHIM Wei Song LAW,-7,0 - 0,,"1,840 / 2"
449,442,FRA FRA,Mateo MARTINEZ GRADT-URBAN Samson,-7,0 - 0,,"1,840 / 2"
450,442,ENG ENG,Farid AKROUM George ISHERWOOD,-7,0 - 0,,"1,840 / 2"
451,442,ENG ENG,Christopher COLES Tom WOLFENDEN,-7,0 - 0,,"1,840 / 2"
452,442,ENG ENG,Robert GOLDING Gregory MAIRS,-7,0 - 0,,"1,840 / 2"
453,442,RUS RUS,Denis GRACHEV Sergey SIRANT,-7,0 - 0,,"1,840 / 2"
454,442,POL POL,SWIERCZYNKI MATEUSZ Piotr WASILUK,-7,0 - 0,,"1,840 / 2"
455,442,FIN FIN,Akseli DANSKANEN Julius VON PFALER,-7,0 - 0,,"1,840 / 2"
456,442,ENG ENG,Martin DRABBLE Joshua YOUNG,-7,0 - 0,,"1,840 / 2"
457,442,HKG HKG,TANG Chun Man LAW Cheuk Him,-7,0 - 0,,"1,840 / 2"
458,459,TPE TPE,En Chia CHANG Yu-Hua LAI,-7,0 - 0,,"1,830 / 3"
459,460,NED NED,Ruben JILLE Jelle MAAS,-7,0 - 0,,"1,825 / 2"
460,461,SWE SWE,Jonatan NORDH Nico RUPONEN,-7,0 - 0,,"1,820 / 1"
461,462,MAS MAS,Yeet Siang LIN Guan Ming WONG,-7,0 - 0,,"1,790 / 3"
462,463,ISL ISL,Atli JOHANNESSON Kari GUNNARSSON,-7,0 - 0,,"1,769 / 3"
463,464,MAS MAS,Darren Isaac DEVADASS Muhammad Amzzar ZAINUDDIN,-7,0 - 0,,"1,750 / 3"
464,465,TUR TUR,Oktay AYDIN Yunus BAS,-7,0 - 0,,"1,750 / 1"
465,465,RUS RUS,Aleksandr VASILKIN Anatoliy YARTSEV,-7,0 - 0,,"1,750 / 1"
466,465,TRI TRI,Alistair ESPINOZA Will LEE,-7,0 - 0,,"1,750 / 1"
467,465,THA THA,Poodchalat PISIT Sarayut SAETANG,-7,0 - 0,,"1,750 / 1"
468,465,FRA FRA,Lucas CLAERBOUT Bastian KERSAUDY,-7,0 - 0,,"1,750 / 1"
469,465,DEN DEN,Patrick BUHL Jeppe LUDVIGSEN,-7,0 - 0,,"1,750 / 1"
470,465,BAR SUR,Dakeil Jonathan THORPE Mitchel WONGSODIKROMO,-7,0 - 0,,"1,750 / 1"
471,465,JAM JAM,Tremar BARHAM Shane WILSON,-7,0 - 0,,"1,750 / 1"
472,465,SCO SCO,Alexander DUNN Adam HALL,-7,0 - 0,,"1,750 / 1"
473,465,BUL SLO,Blagovest KISYOV Alen ROJ,-7,0 - 0,,"1,750 / 1"
474,465,POL POL,Maciej DABROWSKI Mateusz DUBOWSKI,-7,0 - 0,,"1,750 / 1"
475,465,GER GER,David PENG Max WEISSKIRCHEN,-7,0 - 0,,"1,750 / 1"
476,465,CZE SVK,Jan FROHLICH Jarolim VICEN,-7,0 - 0,,"1,750 / 1"
477,465,SUR SUR,Dylan DARMOHOETOMO Soren OPTI,-7,0 - 0,,"1,750 / 1"
478,465,MEX MEX,Humberto AGUIRRE FAJARDO Victor Manuel RAMIREZ,-7,0 - 0,,"1,750 / 1"
479,465,ISR ISR,Ilia SHNAIDMAN Matan ZYSKIND,-7,0 - 0,,"1,750 / 1"
480,465,ISR ISR,Daniel BEDRACK Yonathan LEVIT,-7,0 - 0,,"1,750 / 1"
481,465,COL COL,Diego LOPERA Barrientos MATEO,-7,0 - 0,,"1,750 / 1"
482,465,ETH ETH,MARKOS Demis KEDIR Nuredin,-7,0 - 0,,"1,750 / 1"
483,465,ETH ETH,Ermiyas Tamrat DEGEFE Mekonen GEBRELU,-7,0 - 0,,"1,750 / 1"
484,465,CHI CHI,Ivan LEON Bastian LIZAMA,-7,0 - 0,,"1,750 / 1"
485,465,BUL SUI,Stilian MAKARSKI Gilles TRIPET,-7,0 - 0,,"1,750 / 1"
486,487,DEN DEN,Kristoffer KNUDSEN Steve OLESEN,-5,0 - 0,,"1,730 / 2"
487,488,DEN DEN,Mads Emil CHRISTENSEN Kristoffer KNUDSEN,-5,0 - 0,,"1,700 / 1"
488,489,INA INA,Irfan FADHILAH Markis KIDO,-5,0 - 0,,"1,670 / 1"
489,489,KOR KOR,SolGyu CHOI Jae Hwan KIM,-5,0 - 0,,"1,670 / 1"
490,489,AUS AUS,Simon Wing Hang LEUNG Pit Seng LOW,-5,0 - 0,,"1,670 / 1"
491,489,AUS AUS,Cham CHEN Michael FARIMAN,-5,0 - 0,,"1,670 / 1"
492,489,KOR NZL,LEE Jae Jin Oliver LEYDON-DAVIS,-5,0 - 0,,"1,670 / 1"
493,489,NZL AUS,Kevin DENNERLY-MINTURN Robin MIDDLETON,-5,0 - 0,,"1,670 / 1"
494,489,TPE TPE,Ko-Chi CHANG Chi-Lin WANG,-5,0 - 0,,"1,670 / 1"
495,489,SUI INA,Agung RUHANDA KUSUMAH Sandy Darma,-5,0 - 0,,"1,670 / 1"
496,489,BAN BAN,Mostafizar RAHMAN Uddin SAIF,-5,0 - 0,,"1,670 / 1"
497,489,IND IND,Jayan JAMES Vikranth Kumar KORUKONDA,-5,0 - 0,,"1,670 / 1"
498,489,IND IND,Sanidhya BANDOONI SINGH Vinay Kumar,-5,0 - 0,,"1,670 / 1"
499,489,IND IND,Kapil CHAUDHARY Chandrabhusan TRIPATHI,-5,0 - 0,,"1,670 / 1"
500,489,IND IND,Vikrant CHAWAT Rajat RATHORE,-5,0 - 0,,"1,670 / 1"
501,489,INA INA,Fran KURNIAWAN Afiat Yuris WIRAWAN,-5,0 - 0,,"1,670 / 1"
502,489,INA INA,Arya Maulana ADIARTAMA Muhammad ULINNUHA,-5,0 - 0,,"1,670 / 1"
503,489,INA INA,Putra BIANTO Galang DECKY RAMADHAN,-5,0 - 0,,"1,670 / 1"
504,489,INA INA,Viky ANINDITA Darmawandi JOKO ALI,-5,0 - 0,,"1,670 / 1"
505,489,INA INA,Angger SUDRAJAT Supriadi Tedi,-5,0 - 0,,"1,670 / 1"
506,489,IND IND,Prem Singh CHOUHAN Manish GUPTA,-5,0 - 0,,"1,670 / 1"
507,489,MAS MAS,Wee Gieen TAN Hong Kheng YEW,-5,0 - 0,,"1,670 / 1"
508,489,MAS MAS,Nelson Wei Keat HEG LOW Juan Shen,-5,0 - 0,,"1,670 / 1"
509,489,INA HKG,Fernando KURNIAWAN LO Lok Kei,-5,0 - 0,,"1,670 / 1"
510,489,CHN CHN,CHEN Zhuofu SHI Longfei,-5,0 - 0,,"1,670 / 1"
511,489,IND IND,J. B. S. Vidyadhar Srujan NANDALURI,-5,0 - 0,,"1,670 / 1"
512,489,MAS MAS,Vountus Indra MAWAN Mohd Fairuzizuan MOHD TAZARI,-5,0 - 0,,"1,670 / 1"
513,514,FRA CZE,Jocelyn DESCHAMP Maximilian KORENY,-5,0 - 0,,"1,640 / 3"
514,514,CYP CYP,Elias NICOLAOU George NICOLAOU,-5,0 - 0,,"1,640 / 3"
515,516,USA NED,Ryan CHEW Koen RIDDER,-5,0 - 0,,"1,610 / 2"
516,517,SIN SIN,Kean Yew LOH Zin Rei Ryan NG,-5,0 - 0,,"1,560 / 3"
517,518,RUS RUS,Evgenij DREMIN Vladimir MALKOV,-5,0 - 0,,"1,540 / 2"
518,518,ALG ALG,Mohamed Amine GUELMAOUI Youcef Sabri MEDEL,-5,0 - 0,,"1,540 / 2"
519,520,THA THA,Parinyawat THONGNUAM TANKMANUSTONG Warut,-5,0 - 0,,"1,520 / 3"
520,521,TRI TRI,Nicholas BONKOWSKY Jason RAMJASS,-5,0 - 0,,"1,520 / 2"
521,522,UKR UKR,Glib BEKETOV Mykhaylo MAKHNOVSKIY,0,0 - 0,,"1,520 / 1"
522,522,GUA GUA,Ivan Rodrigo LEON GARCIA Christopher Alexander MARTINEZ SALVADOR,0,0 - 0,,"1,520 / 1"
523,522,MAS MAS,Yew Sin ONG Hong Kheng YEW,0,0 - 0,,"1,520 / 1"
524,522,MAS MAS,Mohd Lutfi Zaim ABDUL KHALID Muhammad Hafizi HASHIM,0,0 - 0,,"1,520 / 1"
525,522,NGR NGR,Aaron ATAH Joshua Adeyemi ODELABI,-5,0 - 0,,"1,520 / 1"
526,522,NGR NGR,Femi BIOKU Oluseye POPOOLA,-5,0 - 0,,"1,520 / 1"
527,522,RUS RUS,Nikita AGALAKOV Alexander LOGINOV,-5,0 - 0,,"1,520 / 1"
528,522,RUS RUS,Vadim ITCKOV Artem SERPIONOV,-5,0 - 0,,"1,520 / 1"
529,522,MAS MAS,Mohd Lutfi Zaim ABDUL KHALID Mohd Razif ABDUL LATIF,-5,0 - 0,,"1,520 / 1"
530,522,IND IND,Krishna Prasad GARAGA Satwiksairaj RANKIREDDY,-5,0 - 0,,"1,520 / 1"
531,522,IND IND,Arjun Kumar Reddy MALGARI Santosh RAVURI,-5,0 - 0,,"1,520 / 1"
532,522,FRA FRA,Lucas CLAERBOUT Yoann TURLAN,-5,0 - 0,,"1,520 / 1"
533,522,GER GER,Fabian HOLZER Jones Ralfy JANSEN,-5,0 - 0,,"1,520 / 1"
534,522,JPN JPN,Katsunori ITO Akira KOBAYASHI,-5,0 - 0,,"1,520 / 1"
535,522,NZL TPE,Oliver LEYDON-DAVIS TIEN Jen Chieh,-5,0 - 0,,"1,520 / 1"
536,522,BRA BRA,Willian GUIMARAES Vinicius Oliveira SILVA,-5,0 - 0,,"1,520 / 1"
537,522,INA INA,Julian ARBITAMA Subhan HASAN,-5,0 - 0,,"1,520 / 1"
538,522,IRI IRI,NORI Erfan POREBRAHIM ZEMIDANI Saeed,-5,0 - 0,,"1,520 / 1"
539,522,IRQ IRQ,Ali Abduladheem Hamad AL-OGAILI AL- QAZZAZ Ali Muafaq Hadi,-5,0 - 0,,"1,520 / 1"
540,522,IRI IRI,Sepehr EIVANI Sadredin SADEGHI,-5,0 - 0,,"1,520 / 1"
541,522,IRI IRI,Zargan AMIRARSALAN HEYDARI SHAFAGH Hamid,-5,0 - 0,,"1,520 / 1"
542,522,TPE NZL,KAN Chao Yu Oliver LEYDON-DAVIS,-5,0 - 0,,"1,520 / 1"
543,522,CHN CHN,GUO Yuchen TANG Jincheng,-5,0 - 0,,"1,520 / 1"
544,522,FIN FIN,Anton KAISTI Marko PYYKONEN,-5,0 - 0,,"1,520 / 1"
545,522,THA THA,Thanadol JUMPANOI Viriyangkura TANUPAT,-5,0 - 0,,"1,520 / 1"
546,522,SIN SIN,Chao HUANG Ming Shun TAN,-5,0 - 0,,"1,520 / 1"
547,522,AZE AZE,Karim MUSAYEV Tural RASULOV,-5,0 - 0,,"1,520 / 1"
548,522,IND IND,Prem Singh CHOUHAN Abhinav PRAKASH,-5,0 - 0,,"1,520 / 1"
549,522,IND IND,Ravinder SINGH SINGH Vinay Kumar,-5,0 - 0,,"1,520 / 1"
550,522,FRA FRA,Tanguy CITRON Gregor DUNIKOWSKI,-5,0 - 0,,"1,520 / 1"
551,522,TPE TPE,KAN Chao Yu Hsu JUI TING,-5,0 - 0,,"1,520 / 1"
552,522,NEP NEP,Pankaj CHAND Indra MEHATA,-5,0 - 0,,"1,520 / 1"
553,522,BAN BAN,Tushar Krishna ROY Uddin SAIF,-5,0 - 0,,"1,520 / 1"
554,522,BAN BAN,Chand LAL Mohammed Jabed MOSTAFA,-5,0 - 0,,"1,520 / 1"
555,522,NEP NEP,Dipesh DHAMI Sajan Krishna TAMRAKAR,-5,0 - 0,,"1,520 / 1"
556,522,NED TPE,Ruud BOSCH KAN Chao Yu,-5,0 - 0,,"1,520 / 1"
557,522,ENG ENG,Jed ARKSEY Alex LANE,-5,0 - 0,,"1,520 / 1"
558,522,MAS MAS,Nelson Wei Keat HEG Hong Kheng YEW,-5,0 - 0,,"1,520 / 1"
559,522,MAS MAS,Muhammad Hafiz HASHIM Muhammad Hafizi HASHIM,-5,0 - 0,,"1,520 / 1"
560,522,PAK PAK,Wajid Ali CHAUDHRY Amir SAEED,-5,0 - 0,,"1,520 / 1"
561,522,CAN CAN,Francois BOURRET Pierre-Etienne PILOTE,-5,0 - 0,,"1,520 / 1"
562,522,INA INA,Titon GUSTAMAN Sandy I KOMANG,-5,0 - 0,,"1,520 / 1"
563,522,DEN DEN,Mads Emil CHRISTENSEN Jonas Arly RASMUSSEN,-5,0 - 0,,"1,520 / 1"
564,522,SUI SUI,Quentin FILLIETTAZ Cyril HOHL,-5,0 - 0,,"1,520 / 1"
565,522,PAK AUS,Rizwan AZAM Anthony CHANG,-5,0 - 0,,"1,520 / 1"
566,522,AUS AUS,Luke CHONG Lewis WANG,-5,0 - 0,,"1,520 / 1"
567,522,ENG ENG,Marcus ELLIS Matthew NOTTINGHAM,-5,0 - 0,,"1,520 / 1"
568,522,ESP ESP,Pablo ABIAN Eliecer OJEDA,-146,0 - 0,,"1,520 / 1"
569,522,INA INA,Akbar Bintang CAHYONO Angger SUDRAJAT,0,0 - 0,,"1,520 / 1"
570,522,IRI IRI,Erfan JOYANDEH Mehran SHAHBAZI,-5,0 - 0,,"1,520 / 1"
571,522,RUS RUS,Andrey PARAKHODIN Nikolai UKK,-5,0 - 0,,"1,520 / 1"
572,522,BAN BAN,Md. Rahad Kabir KHALED Saleh Ahmed SHAMOL,-5,0 - 0,,"1,520 / 1"
573,522,MAS MAS,LOW Juan Shen TAI An Khang,0,0 - 0,,"1,520 / 1"
574,522,BRA BRA,Mateus Carrijo CUTTI Gabriel Guimaraes NERY,-5,0 - 0,,"1,520 / 1"
575,522,AUS AUS,Guy GIBSON Bernhard HALIM,-5,0 - 0,,"1,520 / 1"
576,522,AUT AUT,Ralph BITTENAUER Benjamin SCHLEMMER,-5,0 - 0,,"1,520 / 1"
577,522,AUS AUS,Cham CHEN Toby WONG,-5,0 - 0,,"1,520 / 1"
578,579,THA THA,Chaloempon CHAROENKITAMORN Supakit JANDARA,-8,0 - 0,,"1,470 / 2"
579,579,PER PER,Bruno BARRUETO DEZA Diego MINI,-8,0 - 0,,"1,470 / 2"
580,579,TUR TUR,Nuh BASKIN Enis SESALAN,-8,0 - 0,,"1,470 / 2"
581,579,FRA MAR,Shinsai DESLAURIERS Bilal ELHARAB,-8,0 - 0,,"1,470 / 2"
582,579,MAS MAS,Ming Hui LEW Seng Zoe YEOH,-8,0 - 0,,"1,470 / 2"
583,584,MAS MAS,Yong Yuan HAW Chen Wet LIM,-8,0 - 0,,"1,440 / 4"
584,585,TUR TUR,Ali Bugra AKDOGAN Okan GULTEKIN,-8,0 - 0,,"1,370 / 1"
585,585,TUR TUR,Yusuf Ramazan BAY AhmetCan ORUC,-8,0 - 0,,"1,370 / 1"
586,585,FRA FRA,Ronan GUEGUIN Thomas VALLEZ,-8,0 - 0,,"1,370 / 1"
587,585,SRB BUL,Igor BJELAN Gergin NEDYALKOV,-8,0 - 0,,"1,370 / 1"
588,585,KAZ KAZ,Dmitriy PANARIN YERZHAKANOV SAMAT,-8,0 - 0,,"1,370 / 1"
589,585,RUS RUS,Alexander BUTOVETSTKIY Artem SERPIONOV,-8,0 - 0,,"1,370 / 1"
590,585,FRA FRA,Terry Sebastien AMEDEE Gianni MARTON,-8,0 - 0,,"1,370 / 1"
591,585,THA THA,Panu RAKMESI Viriyangkura TANUPAT,-8,0 - 0,,"1,370 / 1"
592,585,THA THA,CHOLPRASERTSUK Kritti Trawut POTIENG,-8,0 - 0,,"1,370 / 1"
593,585,SLO SLO,Aljosa TURK Urban TURK,-8,0 - 0,,"1,370 / 1"
594,585,CYP CYP,George NICOLAOU Kyriacos PISSIS,-8,0 - 0,,"1,370 / 1"
595,585,RUS RUS,Alexander BUTOVETSTKIY Vladimir NIKULOV,-8,0 - 0,,"1,370 / 1"
596,585,NED NED,Jim MIDDELBURG Russell MUNS,-8,0 - 0,,"1,370 / 1"
597,585,INA INA,Rinov RIVALDY Muhammad ULINNUHA,-8,0 - 0,,"1,370 / 1"
598,585,DEN DEN,Alexander BOND Theodor JOHANSEN,-8,0 - 0,,"1,370 / 1"
599,585,CUB CUB,Lazaro Yovani MADERA PADRINO Bryan VELIZ ARBOLAY,-8,0 - 0,,"1,370 / 1"
600,585,JAM JAM,Jemarey GORDON Matthew LEE,-8,0 - 0,,"1,370 / 1"
601,585,DEN DEN,Patrick BUHL Steve OLESEN,-8,0 - 0,,"1,370 / 1"
602,585,DEN ESP,David Kim KRISTENSEN Ernesto VELAZQUEZ,-8,0 - 0,,"1,370 / 1"
603,585,UGA UGA,Riyaz SALEWALA Areej SHALWANI,-8,0 - 0,,"1,370 / 1"
604,585,DEN DEN,Jeppe Bruun CHRISTENSEN Mark Mohr Laursen DAMGAARD,-8,0 - 0,,"1,370 / 1"
605,585,FRA DEN,Jocelyn DESCHAMP Soeren TOFT HANSEN,-8,0 - 0,,"1,370 / 1"
606,585,RSA RSA,Cameron COETZER Jason COETZER,-8,0 - 0,,"1,370 / 1"
607,585,SWE SWE,Toni HOLM-LOWEN Karl MURGARD,-8,0 - 0,,"1,370 / 1"
608,585,DEN DEN,Rene MATTISSON Mathias Rud PEDERSEN,-8,0 - 0,,"1,370 / 1"
609,585,SUR SUR,Jair LIEW Alain TONEY,-8,0 - 0,,"1,370 / 1"
610,585,MAR MAR,Ahmad Bachir EL MERGHADI Mehdi ERRAIHANI,-8,0 - 0,,"1,370 / 1"
611,585,MAR MAR,KSIKES AMINE Ahmed Amine KSIKES,-8,0 - 0,,"1,370 / 1"
612,585,JOR JOR,Ayham ABD ELEDDIN Mohd Naser Mansour NAYEF,-8,0 - 0,,"1,370 / 1"
613,585,ETH ETH,FANTHHUN Estefanos ABDULKADIR Tofik,-8,0 - 0,,"1,370 / 1"
614,585,VIE VIE,Cong Hai NGUYEN Hoang Anh NGUYEN,-8,0 - 0,,"1,370 / 1"
615,585,ECU ESP,Sergio CHEVASCO HANZE Oscar MARTINEZ SALAN,-8,0 - 0,,"1,370 / 1"
616,585,COL COL,Hugo ANDRADE Yamit GIRONZA,-8,0 - 0,,"1,370 / 1"
617,585,COL COL,Miguel SIERRA Henry VACA,-8,0 - 0,,"1,370 / 1"
618,585,VIE VIE,Tuan Duc DO Khanh Tan LUONG,-8,0 - 0,,"1,370 / 1"
619,585,ECU ECU,Haward CHALEN ASPIAZU Emilio ZAMBRANO,-8,0 - 0,,"1,370 / 1"
620,585,THA THA,Thaptimdong ARKORNNIT Supak JOMKOH,-8,0 - 0,,"1,370 / 1"
621,585,BAR BAR,Cory FANUS Sabeel FOSTER,-8,0 - 0,,"1,370 / 1"
622,585,DEN DEN,Patrick BJERREGAARD Soeren TOFT HANSEN,-8,0 - 0,,"1,370 / 1"
623,585,ETH ETH,TEKLU Endale ASRAR Seid,-8,0 - 0,,"1,370 / 1"
624,585,CHI CHI,Nicolas FERRUZOLA Ivan LEON,-8,0 - 0,,"1,370 / 1"
625,585,AUT AUT,Benjamin SCHLEMMER Dominik STIPSITS,-8,0 - 0,,"1,370 / 1"
626,585,TUR TUR,Burak Furkan DEMIR Muhammed Ali KURT,-8,0 - 0,,"1,370 / 1"
627,585,ECU ECU,Diego TERAN Emilio ZAMBRANO,-8,0 - 0,,"1,370 / 1"
628,585,UGA UGA,Herbert EBAYO Jacob MUSISI,-8,0 - 0,,"1,370 / 1"
629,585,SUR SUR,Alrick TONEY Alroy TONEY,-8,0 - 0,,"1,370 / 1"
630,631,FRA FRA,Shinsai DESLAURIERS Jeremie VERIN,-8,0 - 0,,"1,340 / 3"
631,632,INA INA,Eka Fajar KUSUMA Wibowo SETYALDI PUTRA,-8,0 - 0,,"1,290 / 1"
632,632,RUS RUS,Vladimir SHIPILENKO Kirill TIMOFEEV,-8,0 - 0,,"1,290 / 1"
633,632,RUS RUS,Egor EFANOV Mikhail NESTERENKO,-8,0 - 0,,"1,290 / 1"
634,632,CAN CAN,Austin James BAUER Graydon ROBB,-8,0 - 0,,"1,290 / 1"
635,632,CAN CAN,Byron Christopher HOLCEK Jakob KRYCZKA,-8,0 - 0,,"1,290 / 1"
636,632,CAN CAN,Pierre-Etienne PILOTE Maxime TÉTREAULT,-8,0 - 0,,"1,290 / 1"
637,632,USA USA,Dean SCHOPPE Tariq WADOOD,-8,0 - 0,,"1,290 / 1"
638,632,USA USA,Tony GUNAWAN Meng-Yung ONG,-8,0 - 0,,"1,290 / 1"
639,632,GUA GUA,Daniel HUMBLERS HUMBLERS HEYMARD,-8,0 - 0,,"1,290 / 1"
640,632,USA CAN,Hock Lai LEE Toby NG,-8,0 - 0,,"1,290 / 1"
641,632,ENG ENG,Nick HODGSON Joshua YOUNG,-8,0 - 0,,"1,290 / 1"
642,632,SCO SCO,Alexander DUNN Keith TURNBULL,-8,0 - 0,,"1,290 / 1"
643,632,SCO SCO,Sameer Scott AAMIR Brandon TSANG,-8,0 - 0,,"1,290 / 1"
644,632,KOR KOR,Se Sung AHN Ji Soo LIM,-8,0 - 0,,"1,290 / 1"
645,632,KOR KOR,JUNG Suk Hoon Ki Hoon KIM,-8,0 - 0,,"1,290 / 1"
646,632,KOR KOR,Jun Soo KIM KIM Kyung Tae,-8,0 - 0,,"1,290 / 1"
647,632,KOR KOR,HAN To Sung JUNG Young Keun,-8,0 - 0,,"1,290 / 1"
648,632,KOR KOR,Seung Yeop HAN Jae Woo LEE,-8,0 - 0,,"1,290 / 1"
649,632,KOR KOR,Hyuk Gyun CHOI Jong Woo CHOI,-8,0 - 0,,"1,290 / 1"
650,632,KOR KOR,Dong Joo KIM KIM Sung Hyo,-8,0 - 0,,"1,290 / 1"
651,632,HKG HKG,CHAN Alan Yun Lung TANG Chun Man,-8,0 - 0,,"1,290 / 1"
652,632,SUI SUI,Loïc GOTHUEY Nicolas LENGGENHAGER,-8,0 - 0,,"1,290 / 1"
653,632,NED NED,Mark CALJOUW Justin TEEUWEN,-8,0 - 0,,"1,290 / 1"
654,632,BRA BRA,Alex Yuwan TJONG Luiz dos SANTOS JR,-8,0 - 0,,"1,290 / 1"
655,632,RUS RUS,Evgenij DREMIN Denis GRACHEV,-8,0 - 0,,"1,290 / 1"
656,632,SCO SCO,Danny LEINSTER Steven STEWART,-8,0 - 0,,"1,290 / 1"
657,632,UGA ZAM,Edwin EKIRING Eli MAMBWE,-8,0 - 0,,"1,290 / 1"
658,659,SLO SLO,Alen ROJ Iztok UTROSA,-8,0 - 0,,"1,280 / 2"
659,659,SCO SCO,Matthew CARDER Adam HALL,-8,0 - 0,,"1,280 / 2"
660,661,FRA FRA,Arnaud MERKLE Leo ROSSI,-8,0 - 0,,"1,270 / 2"
661,662,ESP ESP,Blai RAMIREZ Manuel VAZQUEZ,-8,0 - 0,,"1,240 / 5"
662,663,NZL NZL,Shane MASINIPENI Kevin ZHANG,-8,0 - 0,,"1,240 / 2"
663,663,TPE TPE,Chu-En HUANG Jhe-Huei LEE,-8,0 - 0,,"1,240 / 2"
664,663,INA INA,Rendi ISMANTO Nathaniel Ernestan SULISTYO,-8,0 - 0,,"1,240 / 2"
665,663,INA INA,Fachriza ABIMANYU Hendrik K CLINTON,-8,0 - 0,,"1,240 / 2"
666,667,POL POL,Krzysztof JAKOWCZUK MATEUSZ BIERNACKI,-8,0 - 0,,"1,230 / 2"
667,668,PER PER,Andres CORPANCHO Sebastian MACIAS,-8,0 - 0,,"1,218 / 1"
668,669,IND IND,Sandeep ANAND Himanshu SAROHA,-7,0 - 0,,"1,200 / 2"
669,670,FRA FRA,Gregor DUNIKOWSKI Vincent MEDINA,-7,0 - 0,,"1,170 / 1"
670,670,POR POR,Bernardo ATILANO Ricardo SILVA,-7,0 - 0,,"1,170 / 1"
671,672,MAS MAS,Mohd Lutfi Zaim ABDUL KHALID Ahmad Maziri MAZLAN,-7,0 - 0,,"1,160 / 2"
672,673,MAS MAS,"Jimmy, Yu Lun TAY Kay Ee YEOH",-7,0 - 0,,"1,150 / 3"
673,674,POL POL,Pawel PRADZINSKI Patryk SZYMONIAK,-7,0 - 0,,"1,150 / 2"
674,674,FRA FRA,Thomas BAURES Marc LAPORTE,-7,0 - 0,,"1,150 / 2"
675,676,MAS MAS,Jia Huo CHEN Ming Hui LEW,-7,0 - 0,,"1,130 / 2"
676,676,THA THA,Kittisak NAMDASH Sirawit SUHARITDUMRONG,-7,0 - 0,,"1,130 / 2"
677,676,MAS MAS,A`Aamar HASHIM Tiat Long LIM,-7,0 - 0,,"1,130 / 2"
678,679,IND IND,Harinder MALIK Satinder MALIK,-7,0 - 0,,"1,110 / 3"
679,680,SLO SLO,Miha IVANIC Andraz KRAPEZ,-7,0 - 0,,"1,100 / 2"
680,681,ENG ENG,Max FLYNN Jonty RUSS,-7,0 - 0,,"1,090 / 2"
681,681,TPE TPE,Ko-Chi CHANG CHEN Chung Jen,-7,0 - 0,,"1,090 / 2"
682,683,THA THA,Watchara BURANAKUEA Parinyawat THONGNUAM,-7,0 - 0,,"1,060 / 2"
683,684,TPE TPE,Ko-Chi CHANG Yi-Hsiang YANG,-7,0 - 0,,"1,050 / 2"
684,684,HKG HKG,CHAN Dick Long Cotter HO Wai Lun,-7,0 - 0,,"1,050 / 2"
685,686,NOR NOR,Torjus FLAATTEN Peter Roenn STENSAETH,-7,0 - 0,,"1,020 / 4"
686,687,MAS MAS,Wen Hao LEONG Victor Jing Khai ONG,-7,0 - 0,,"1,020 / 2"
687,687,INA INA,Giovani Dicky OKTAVAN Wisnu Cahyo SAPUTRO,-7,0 - 0,,"1,020 / 2"
688,687,THA THA,Tanapat KITTINAOWARAT Artit UTHAITEERAKOMEN,-7,0 - 0,,"1,020 / 2"
689,687,IND IND,Pavan MALIK Aditya NAIR,-7,0 - 0,,"1,020 / 2"
690,687,MAS MAS,Muhammad Adib Haiqal NURIZWAN Muhammad Aliff NURIZWAN,-7,0 - 0,,"1,020 / 2"
691,687,MAS MAS,Nurdini MOHD SAID Deck Loong PAN,-7,0 - 0,,"1,020 / 2"
692,693,BUL BUL,Stilian MAKARSKI Peyo BOICHINOV,-7,0 - 0,,937 / 1
693,694,POL POL,Milosz BOCHAT Lukasz MOREN,0,0 - 0,,920 / 1
694,694,UKR UKR,Ivan DRUZCHENKO Oleksandr KOLESNIK,0,0 - 0,,920 / 1
695,694,AZE AZE,Cahid ALI HASANOV Tural RASULOV,0,0 - 0,,920 / 1
696,694,ESA ESA,Uriel Francisco CANJURA ARTIGA GUARDADO Jassiel,0,0 - 0,,920 / 1
697,694,GUA GUA,Carlos Daniel ALBANES CORDON Axel FLORES BARRONDO,0,0 - 0,,920 / 1
698,694,GUA GUA,Jose ESPNOZA LAY QUAN Julio Cesar,0,0 - 0,,920 / 1
699,694,CHI GUA,Bastian LIZAMA Brandon SAMAYOA,0,0 - 0,,920 / 1
700,694,ESA ESA,Victor GARCIA Mario Rodrigo GUTIERREZ SAMAYOA,0,0 - 0,,920 / 1
701,694,GUA GUA,Ruben CASTELLANOS UMANA RUIZ Mario,0,0 - 0,,920 / 1
702,694,GUA GUA,Jose Luis GRANADOS MORALES Antonio Esteban ORTIZ,0,0 - 0,,920 / 1
703,694,ESA ESA,Luis BERNAL Carlos RODRIGUEZ,0,0 - 0,,920 / 1
704,694,INA INA,Ardiansyah LastName Didit JUANG,0,0 - 0,,920 / 1
705,694,NZL TPE,Oliver LEYDON-DAVIS Chi-Hung LIAO,0,0 - 0,,920 / 1
706,694,INA INA,Fachriza ABIMANYU Richard KUNCORO,0,0 - 0,,920 / 1
707,694,INA INA,Wijaya RENDRA Christopher RUSDIANTO,0,0 - 0,,920 / 1
708,694,INA INA,Rian SYAOQI Muhammad Aria WIJAYA,0,0 - 0,,920 / 1
709,694,MAS MAS,Ahmad Maziri MAZLAN Muhammad Amzzar ZAINUDDIN,0,0 - 0,,920 / 1
710,694,SIN SIN,Bimo Adi PRAKOSO Hendra WIJAYA,0,0 - 0,,920 / 1
711,694,INA INA,Arya Maulana ADIARTAMA Supriadi Tedi,0,0 - 0,,920 / 1
712,694,MAS MAS,Di Hua NG Chun Kang SHIA,0,0 - 0,,920 / 1
713,694,SUR SUR,"Mitch, Aubrey NAI CHUNG TONG Soren OPTI",-7,0 - 0,,920 / 1
714,694,DOM DOM,Marcos Alexander CARMONA SANCHEZ Daniel REYES,-7,0 - 0,,920 / 1
715,694,MAS MAS,Nur Mohd Azriyn AYUB Muhammad Hafifi HASHIM,-7,0 - 0,,920 / 1
716,694,VIE VIE,Minh BAO Bao Duc DUONG,-7,0 - 0,,920 / 1
717,694,MAS MAS,Muhammad Hafizi HASHIM Muhammad Amzzar ZAINUDDIN,-7,0 - 0,,920 / 1
718,694,TUR TUR,Akin DENIZ Murathan EKEN,-7,0 - 0,,920 / 1
719,694,TUR TUR,Haktan DOĞAN Osman UYHAN,-7,0 - 0,,920 / 1
720,694,TUR TUR,Ömer ALTINKOPRU Fethican DEGIRMENCI,-7,0 - 0,,920 / 1
721,694,GER GER,Bjarne GEISS Jan Colin VÖLKER,-7,0 - 0,,920 / 1
722,694,RUS RUS,Victor KOKHANOV Nikita LEMESHKO,-7,0 - 0,,920 / 1
723,694,NGR NGR,Kayode OLATUNJI Julius OLUKOTUN,-7,0 - 0,,920 / 1
724,694,NGR NGR,Ganiyu SULYMAN Sulyman WASIU,-7,0 - 0,,920 / 1
725,694,NGR NGR,Mustaopha MUHAMMED Jafar Salihu UMAR,-7,0 - 0,,920 / 1
726,694,NGR NGR,"Usman , Ayo ISIAQ Kayode Samuel OYENIRAN",-7,0 - 0,,920 / 1
727,694,NGR NGR,Isaac OGBOLE Kabiru USMAN,-7,0 - 0,,920 / 1
728,694,NGR NGR,Idowu Timothy ADEKUNLE Tobi OWOLABI,-7,0 - 0,,920 / 1
729,694,NGR NGR,Habeeb Temitope BELLO Clement KROBAKPO,-7,0 - 0,,920 / 1
730,694,NGR NGR,Abdulhamid Waleed MUSA Mujittapha UMAR,-7,0 - 0,,920 / 1
731,694,NGR NGR,ALAYA Suleiman Idris Olatunji FADIPE,-7,0 - 0,,920 / 1
732,694,NGR NGR,Yunusa MOMOH Kingsley NELSON,-7,0 - 0,,920 / 1
733,694,NGR NGR,Olatunji Oladimeji ANIMASHAUN Folorunsho Ilesanmi OPEYORI,-7,0 - 0,,920 / 1
734,694,RUS RUS,Dmitrii KLIMENKO Mikhail LAVRIKOV,-7,0 - 0,,920 / 1
