,RANK,COUNTRY,PLAYER,CHANGE +/-,WIN - LOSE,PRIZE MONEY,POINTS / TOURNAMENTS
368,367,IND IND,Utkarsh ARORA Abhinav PRAKASH,2,0 - 0,,"2,220 / 1"
369,367,IND IND,Kamaldeep SINGH Neeraj VASHIST,2,0 - 0,,"2,220 / 1"
370,367,IND IND,Ankit CHHIKARA Deepak KHATRI,2,0 - 0,,"2,220 / 1"
371,367,IND IND,D. Guru Prasad S. Sanjeeth,2,0 - 0,,"2,220 / 1"
372,367,HKG HKG,CHUNG Yonny LI Kuen Hon,0,0 - 0,,"2,220 / 1"
373,374,RUS RUS,Rodion ALIMOV Pavel KOTSARENKO,2,0 - 0,,"2,210 / 2"
374,374,SLO SLO,Alen ROJ Iztok UTROSA,310,0 - 0,,"2,210 / 2"
375,376,IND IND,Chetan ANAND Raunaq MURADIA,4,0 - 0,,"2,200 / 3"
376,377,DEN DEN,Jeppe Bay MADSEN Rasmus Kjær PEDERSEN,4,0 - 0,,"2,200 / 1"
377,377,AUS AUS,Simon Wing Hang LEUNG Jonathan SUN,4,0 - 0,,"2,200 / 1"
378,377,UKR UKR,Roman KONSTANTINOV Vladyslav VOLNYANSKIY,4,0 - 0,,"2,200 / 1"
379,377,RUS RUS,Mikhail GHELASHVILI Aleksandr VASILKIN,4,0 - 0,,"2,200 / 1"
380,377,FRA FRA,Laurent CONSTANTIN Bastian KERSAUDY,4,0 - 0,,"2,200 / 1"
381,377,SUI BUL,Anthony DUMARTHERAY Stilian MAKARSKI,4,0 - 0,,"2,200 / 1"
382,377,RUS RUS,Evgenij DREMIN Nikita KHAKIMOV,4,0 - 0,,"2,200 / 1"
383,377,CHN CHN,SUN Zhanming WANG Sijie,4,0 - 0,,"2,200 / 1"
384,377,IND IND,Vighnesh DEVLEKAR Eshan NAQVI,4,0 - 0,,"2,200 / 1"
385,377,BAN BAN,Parash Md.AHSUN HABIB Md Rais UDDIN,4,0 - 0,,"2,200 / 1"
386,377,BAN BAN,Mohammad Anamul HAQUE AHMED Md.Jamil,4,0 - 0,,"2,200 / 1"
387,377,BAN BAN,Md Zainal ABEDIN Ebadul Haque CHOWDHURY,4,0 - 0,,"2,200 / 1"
388,377,INA HKG,Fernando KURNIAWAN OR Chin Chung,4,0 - 0,,"2,200 / 1"
389,377,FRA FRA,Laurent CONSTANTIN Jordan CORVEE,4,0 - 0,,"2,200 / 1"
390,377,DEN DEN,Mathias BAY-SMIDT Frederik SØGAARD MORTENSEN,-174,0 - 0,,"2,200 / 1"
391,377,IRI IRI,Vatannejad-Soroush ESKANDARI Hasan MOTAGHI,4,0 - 0,,"2,200 / 1"
392,377,KOR KOR,CHUNG Eui Seok KIM Dae Eun,4,0 - 0,,"2,200 / 1"
393,394,IND IND,Kabir KANZARKAR Akshay RAUT,3,0 - 0,,"2,180 / 2"
394,395,TPE TPE,CHENG Po Wei LIN Yu Hsien,3,0 - 0,,"2,160 / 3"
395,396,MAS MAS,Mohd Razif ABDUL LATIF Mohd Zakry ABDUL LATIF,3,0 - 0,,"2,130 / 3"
396,397,NZL NZL,Maoni HU HE Shane MASINIPENI,3,0 - 0,,"2,130 / 1"
397,397,KOR KOR,Yong Hoon JIN LEE Cheol Ho,3,0 - 0,,"2,130 / 1"
398,397,IRI IRI,Ashkan FESAHATI Mohamad Reza KHANJANI,3,0 - 0,,"2,130 / 1"
399,397,DEN DEN,Frederik AALESTRUP Kasper DINESEN,3,0 - 0,,"2,130 / 1"
400,397,INA INA,Yahya Adi KUMARA Yantoni Edy SAPUTRA,3,0 - 0,,"2,130 / 1"
401,397,MEX MEX,Job CASTILLO Antonio OCEGUEDA,3,0 - 0,,"2,130 / 1"
402,403,INA INA,Altof BARRIQ Reinard DHANRIANO,4,0 - 0,,"2,110 / 2"
403,404,SCO SCO,Christopher GRIMLEY Matthew GRIMLEY,0,0 - 0,,"2,110 / 1"
404,404,ENG NED,Christopher COLES Jelle MAAS,0,0 - 0,,"2,110 / 1"
405,404,MEX MEX,Luis Ramon GARRIDO Antonio OCEGUEDA,4,0 - 0,,"2,110 / 1"
406,404,CAN CAN,Jason Anthony HO-SHUE Jonathan Bing Tsan LAI,4,0 - 0,,"2,110 / 1"
407,404,COK GUM,John TAULU David YAO,4,0 - 0,,"2,110 / 1"
408,404,TGA TGA,Lauti NAANIUMOTU Metuisela Talakai VAINIKOLO,4,0 - 0,,"2,110 / 1"
409,404,NZL PYF,Callum HARFIELD Glen LEFOLL,4,0 - 0,,"2,110 / 1"
410,404,NZL NZL,Daniel Steven BECKERLEG Thomas ELLIS,4,0 - 0,,"2,110 / 1"
411,404,SCO USA,Alistair CASEY Kyle EMERICK,4,0 - 0,,"2,110 / 1"
412,404,RUS RUS,Grigoriy MARTYNENKO Sergey SIRANT,4,0 - 0,,"2,110 / 1"
413,404,CHI CHI,Cristian ARAYA Ivan LEON,4,0 - 0,,"2,110 / 1"
414,415,DOM DOM,Therry AQUINO Reimi Starling CABRERA ROSARIO,5,0 - 0,,"2,090 / 2"
415,415,POR POR,Bernardo ATILANO Ricardo SILVA,247,0 - 0,,"2,090 / 2"
416,415,ENG ENG,Harry ARKSEY David JONES,5,0 - 0,,"2,090 / 2"
417,418,ENG ENG,Martin DRABBLE Joshua YOUNG,25,0 - 0,,"2,080 / 3"
418,419,NZL NZL,Benjamin HILLIER Niccolo TAGLE,3,0 - 0,,"2,070 / 2"
419,419,MAS MAS,Yeet Siang LIN Wei Sheng LOH,3,0 - 0,,"2,070 / 2"
420,419,SUI CZE,Oliver COLIN Jan FROHLICH,3,0 - 0,,"2,070 / 2"
421,422,TPE TPE,LIN Yu Hsien Yi-Hsiang YANG,3,0 - 0,,"2,030 / 2"
422,422,SUI SUI,Anthony DUMARTHERAY Gilles TRIPET,3,0 - 0,,"2,030 / 2"
423,424,SWE SWE,Filip Michael Duwall MYHREN Nico RUPONEN,3,0 - 0,,"2,030 / 1"
424,425,MAS MAS,Wei Song LAW Man Hung WOON,3,0 - 0,,"2,020 / 3"
425,426,FRA FRA,Thomas BAURES Thom GICQUEL,3,0 - 0,,"2,020 / 2"
426,427,BAR BAR,Dakeil Jonathan THORPE Bradley PILGRIM,3,0 - 0,,"1,970 / 2"
427,428,TPE TPE,HUNG Tzu Wei LIN Yu Feng,3,0 - 0,,"1,950 / 2"
428,429,NOR NOR,Torjus FLAATTEN Peter Roenn STENSAETH,3,0 - 0,,"1,940 / 5"
429,430,THA THA,Panu RAKMESI Viriyangkura TANUPAT,3,0 - 0,,"1,920 / 2"
430,430,TPE TPE,Chun-Wei CHEN Yu-Hua LAI,3,0 - 0,,"1,920 / 2"
431,430,MGL MGL,Gerelsukh JARGALSAIKHAN Batdavaa MUNKHBAT,3,0 - 0,,"1,920 / 2"
432,430,MAS MAS,"Teng Fong, Aaron CHIA Guo Zheng SIM",3,0 - 0,,"1,920 / 2"
433,430,DEN DEN,Patrick BJERREGAARD Soeren TOFT HANSEN,3,0 - 0,,"1,920 / 2"
434,435,SIN SIN,Kean Hean LOH Guang Liang Jason WONG,3,0 - 0,,"1,890 / 4"
435,436,FIN FIN,Anton KAISTI Marko PYYKONEN,3,0 - 0,,"1,880 / 2"
436,436,WAL WAL,Oliver GWILT Nicolas STRANGE,3,0 - 0,,"1,880 / 2"
437,436,RUS RUS,Andrey PARAKHODIN Nikolai UKK,3,0 - 0,,"1,880 / 2"
438,439,BRN BRN,Sanjay JAIMY Nadeem NAHAZ,4,0 - 0,,"1,840 / 2"
439,439,BRN BRN,Stefan CRASTO Joshua Yap ZHE BIN,4,0 - 0,,"1,840 / 2"
440,439,CHI GUA,Bastian LIZAMA Brandon SAMAYOA,4,0 - 0,,"1,840 / 2"
441,439,NGR NGR,Abdulhamid Waleed MUSA Mujittapha UMAR,4,0 - 0,,"1,840 / 2"
442,439,TPE TPE,LU Jin-Song YANG Po-Hsuan,4,0 - 0,,"1,840 / 2"
443,439,INA INA,Ramadhani AKBAR GUSTI Galang DECKY RAMADHAN,4,0 - 0,,"1,840 / 2"
444,439,ESP ESP,Juan Manuel FERNANDEZ QUILES Javier SANCHEZ SOLER,4,0 - 0,,"1,840 / 2"
445,439,FRA FRA,Jordan CORVEE Lucas CORVEE,4,0 - 0,,"1,840 / 2"
446,439,ZAM ZAM,Kalonde CHARLES Chalwe CHONGO,4,0 - 0,,"1,840 / 2"
447,439,MAS MAS,Che Leong SOONG Beryno Jiann Tze WONG,-93,0 - 0,,"1,840 / 2"
448,439,MAS MAS,Tang Jie CHEN Jien Sern IAN WONG,4,0 - 0,,"1,840 / 2"
449,439,RUS RUS,Denis GRACHEV Sergey SIRANT,4,0 - 0,,"1,840 / 2"
450,439,DEN DEN,Mathias Lund HANSEN Mads Emil KRISTENSEN,-84,0 - 0,,"1,840 / 2"
451,439,HKG HKG,TANG Chun Man LAW Cheuk Him,4,0 - 0,,"1,840 / 2"
452,439,MAS MAS,Kay Ee YEOH Kok Pong LOKE,4,0 - 0,,"1,840 / 2"
453,439,GER GER,Peter LANG Thomas LEGLEITNER,4,0 - 0,,"1,840 / 2"
454,455,EST EST,Mikk OUNMAA Heiko ZOOBER,477,0 - 0,,"1,820 / 3"
455,455,POL POL,Maciej OCIEPA Michal WALENTEK,6,0 - 0,,"1,820 / 3"
456,457,ENG ENG,Jed ARKSEY Alex LANE,65,0 - 0,,"1,760 / 2"
457,458,MAS MAS,Darren Isaac DEVADASS Muhammad Amzzar ZAINUDDIN,4,0 - 0,,"1,750 / 3"
458,459,DEN DEN,Frederik AALESTRUP Mathias Moldt BASKJAER,0,0 - 0,,"1,750 / 1"
459,459,GER GER,Johannes PISTORIUS Tobias WADENKA,0,0 - 0,,"1,750 / 1"
460,459,TRI TRI,Nicholas BONKOWSKY Alistair ESPINOZA,0,0 - 0,,"1,750 / 1"
461,459,FRA INA,Florent RIANCHO Asuro RIZKO,4,0 - 0,,"1,750 / 1"
462,459,NCL AUS,Jeremy LEMAITRE Nathan TANG,4,0 - 0,,"1,750 / 1"
463,459,MEX USA,Arturo HERNANDEZ Bjorn SEGUIN,4,0 - 0,,"1,750 / 1"
464,459,PER PER,Daniel LA TORRE REGAL Diego MINI,4,0 - 0,,"1,750 / 1"
465,459,IRI SVK,Vatannejad-Soroush ESKANDARI Matej HLINICAN,4,0 - 0,,"1,750 / 1"
466,459,SUI SUI,Thomas HEINIGER Oliver SCHALLER,4,0 - 0,,"1,750 / 1"
467,459,TUR TUR,Oktay AYDIN Yunus BAS,4,0 - 0,,"1,750 / 1"
468,459,RUS RUS,Aleksandr VASILKIN Anatoliy YARTSEV,4,0 - 0,,"1,750 / 1"
469,459,TRI TRI,Alistair ESPINOZA Will LEE,4,0 - 0,,"1,750 / 1"
470,459,THA THA,Poodchalat PISIT Sarayut SAETANG,4,0 - 0,,"1,750 / 1"
471,459,FRA FRA,Lucas CLAERBOUT Bastian KERSAUDY,4,0 - 0,,"1,750 / 1"
472,459,DEN DEN,Patrick BUHL Jeppe LUDVIGSEN,4,0 - 0,,"1,750 / 1"
473,459,BAR SUR,Dakeil Jonathan THORPE Mitchel WONGSODIKROMO,4,0 - 0,,"1,750 / 1"
474,459,JAM JAM,Tremar BARHAM Shane WILSON,4,0 - 0,,"1,750 / 1"
475,459,SCO SCO,Alexander DUNN Adam HALL,4,0 - 0,,"1,750 / 1"
476,459,BUL SLO,Blagovest KISYOV Alen ROJ,4,0 - 0,,"1,750 / 1"
477,459,POL POL,Maciej DABROWSKI Mateusz DUBOWSKI,4,0 - 0,,"1,750 / 1"
478,459,CRO CRO,Zvonimir DURKINJAK Filip SPOLJAREC,4,0 - 0,,"1,750 / 1"
479,459,NED NED,Ruben JILLE Jelle MAAS,4,0 - 0,,"1,750 / 1"
480,459,CZE SVK,Jan FROHLICH Matej HLINICAN,0,0 - 0,,"1,750 / 1"
481,459,BUL SUI,Stilian MAKARSKI Gilles TRIPET,4,0 - 0,,"1,750 / 1"
482,483,DEN DEN,Kristoffer KNUDSEN Steve OLESEN,0,0 - 0,,"1,730 / 2"
483,484,ISR BUL,Shai GEFFEN Ivan RUSEV,0,0 - 0,,"1,720 / 2"
484,484,ENG ENG,Matthew CLARE Ben LANE,0,0 - 0,,"1,720 / 2"
485,486,MAS MAS,"Jimmy, Yu Lun TAY Kay Ee YEOH",0,0 - 0,,"1,700 / 4"
486,487,KOR KOR,Yo Saeb HAN Jung Dae KIM,0,0 - 0,,"1,670 / 1"
487,487,KOR KOR,Dae Sun KIM SONG Chang Yeop,0,0 - 0,,"1,670 / 1"
488,487,GER GER,Andreas HEINZ Fabian HOLZER,0,0 - 0,,"1,670 / 1"
489,487,GER GER,Jones Ralfy JANSEN Johannes PISTORIUS,0,0 - 0,,"1,670 / 1"
490,487,THA THA,CHOLPRASERTSUK Kritti Sirawit SUHARITDUMRONG,0,0 - 0,,"1,670 / 1"
491,487,INA THA,Irfan FADHILAH Pakkawat VILAILAK,0,0 - 0,,"1,670 / 1"
492,487,INA INA,Irfan FADHILAH Markis KIDO,0,0 - 0,,"1,670 / 1"
493,487,AUS AUS,Simon Wing Hang LEUNG Pit Seng LOW,0,0 - 0,,"1,670 / 1"
494,487,AUS AUS,Cham CHEN Michael FARIMAN,0,0 - 0,,"1,670 / 1"
495,487,KOR NZL,LEE Jae Jin Oliver LEYDON-DAVIS,0,0 - 0,,"1,670 / 1"
496,487,NZL AUS,Kevin DENNERLY-MINTURN Robin MIDDLETON,0,0 - 0,,"1,670 / 1"
497,487,TPE TPE,Ko-Chi CHANG Chi-Lin WANG,0,0 - 0,,"1,670 / 1"
498,487,SUI INA,Agung RUHANDA KUSUMAH Sandy Darma,0,0 - 0,,"1,670 / 1"
499,487,BAN BAN,Mostafizar RAHMAN Uddin SAIF,0,0 - 0,,"1,670 / 1"
500,487,IND IND,Jayan JAMES Vikranth Kumar KORUKONDA,0,0 - 0,,"1,670 / 1"
501,487,IND IND,Sanidhya BANDOONI SINGH Vinay Kumar,0,0 - 0,,"1,670 / 1"
502,487,IND IND,Kapil CHAUDHARY Chandrabhusan TRIPATHI,0,0 - 0,,"1,670 / 1"
503,487,IND IND,Vikrant CHAWAT Rajat RATHORE,0,0 - 0,,"1,670 / 1"
504,487,INA INA,Fran KURNIAWAN Afiat Yuris WIRAWAN,0,0 - 0,,"1,670 / 1"
505,487,KOR KOR,Dae Sun KIM DukYoung KIM,0,0 - 0,,"1,670 / 1"
506,487,INA INA,Ronald ALEXANDER Edi SUBAKTIAR,0,0 - 0,,"1,670 / 1"
507,487,INA INA,Fran KURNIAWAN Agripinna Prima Rahmanto PUTRA,0,0 - 0,,"1,670 / 1"
508,487,THA THA,Watchara BURANAKUEA Trawut POTIENG,-69,0 - 0,,"1,670 / 1"
509,487,IND IND,Prem Singh CHOUHAN Manish GUPTA,0,0 - 0,,"1,670 / 1"
510,487,INA HKG,Fernando KURNIAWAN LO Lok Kei,0,0 - 0,,"1,670 / 1"
511,487,IND IND,J. B. S. Vidyadhar Srujan NANDALURI,0,0 - 0,,"1,670 / 1"
512,487,TPE TPE,CHANG Kai Liang SU Yi Neng,-69,0 - 0,,"1,670 / 1"
513,487,KOR KOR,HAN To Sung Sang Joon LEE,0,0 - 0,,"1,670 / 1"
514,515,NOR NOR,Sturla Flaten JORGENSEN Carl Christian MORK,153,0 - 0,,"1,660 / 4"
515,516,TPE TPE,HUNG Ying Yuan Shang Kai LIN,-3,0 - 0,,"1,650 / 2"
516,517,BLR BLR,Vladzislav KUSHNIR Dzmitry SAIDAKOU,-3,0 - 0,,"1,610 / 4"
517,518,USA NED,Ryan CHEW Koen RIDDER,-3,0 - 0,,"1,610 / 2"
518,519,THA THA,Inkarat APISUK Sutichon POL-GUL,-3,0 - 0,,"1,580 / 2"
519,520,TPE TPE,Yu Chieh HSU Chun Yao LIAO,-3,0 - 0,,"1,570 / 3"
520,521,SIN SIN,Kean Yew LOH Zin Rei Ryan NG,-3,0 - 0,,"1,560 / 3"
521,522,CZE CZE,Zdenek SVATA Jan FROHLICH,-3,0 - 0,,"1,540 / 2"
522,523,TRI TRI,Nicholas BONKOWSKY Jason RAMJASS,-2,0 - 0,,"1,520 / 2"
523,524,CRO CRO,Igor CIMBUR Zvonimir DURKINJAK,-2,0 - 0,,"1,520 / 1"
524,524,CHI CHI,Patricio ALVAREZ Jose UNDURRAGA,-2,0 - 0,,"1,520 / 1"
525,524,CHI CHI,Cristobal CAMPOS Sebastian MARTINEZ,-2,0 - 0,,"1,520 / 1"
526,524,BUL CZE,Dimitar DELCHEV Jaromir JANACEK,-2,0 - 0,,"1,520 / 1"
527,524,INA INA,Moch. Revindra REYHALDI Andrew SUSANTO,-2,0 - 0,,"1,520 / 1"
528,524,GER GER,Mark LAMSFUSS Josche ZURWONNE,-2,0 - 0,,"1,520 / 1"
529,524,UKR UKR,Glib BEKETOV Mykhaylo MAKHNOVSKIY,-2,0 - 0,,"1,520 / 1"
530,524,GUA GUA,Ivan Rodrigo LEON GARCIA Christopher Alexander MARTINEZ SALVADOR,-2,0 - 0,,"1,520 / 1"
531,524,MAS MAS,Mohd Lutfi Zaim ABDUL KHALID Muhammad Hafizi HASHIM,-2,0 - 0,,"1,520 / 1"
532,524,RUS RUS,Nikita AGALAKOV Alexander LOGINOV,-2,0 - 0,,"1,520 / 1"
533,524,RUS RUS,Vadim ITCKOV Artem SERPIONOV,-2,0 - 0,,"1,520 / 1"
534,524,MAS MAS,Mohd Lutfi Zaim ABDUL KHALID Mohd Razif ABDUL LATIF,-2,0 - 0,,"1,520 / 1"
535,524,IND IND,Krishna Prasad GARAGA Satwiksairaj RANKIREDDY,-2,0 - 0,,"1,520 / 1"
536,524,IND IND,Arjun Kumar Reddy MALGARI Santosh RAVURI,-2,0 - 0,,"1,520 / 1"
537,524,FRA FRA,Lucas CLAERBOUT Yoann TURLAN,-2,0 - 0,,"1,520 / 1"
538,524,GER GER,Fabian HOLZER Jones Ralfy JANSEN,-2,0 - 0,,"1,520 / 1"
539,524,JPN JPN,Katsunori ITO Akira KOBAYASHI,-2,0 - 0,,"1,520 / 1"
540,524,NZL TPE,Oliver LEYDON-DAVIS TIEN Jen Chieh,-2,0 - 0,,"1,520 / 1"
541,524,BRA BRA,Willian GUIMARAES Vinicius Oliveira SILVA,-2,0 - 0,,"1,520 / 1"
542,524,INA INA,Julian ARBITAMA Subhan HASAN,-2,0 - 0,,"1,520 / 1"
543,524,IRI IRI,NORI Erfan POREBRAHIM ZEMIDANI Saeed,-2,0 - 0,,"1,520 / 1"
544,524,IRQ IRQ,Ali Abduladheem Hamad AL-OGAILI AL- QAZZAZ Ali Muafaq Hadi,-2,0 - 0,,"1,520 / 1"
545,524,IRI IRI,Sepehr EIVANI Sadredin SADEGHI,-2,0 - 0,,"1,520 / 1"
546,524,IRI IRI,Zargan AMIRARSALAN HEYDARI SHAFAGH Hamid,-2,0 - 0,,"1,520 / 1"
547,524,TPE NZL,KAN Chao Yu Oliver LEYDON-DAVIS,-2,0 - 0,,"1,520 / 1"
548,524,CHN CHN,GUO Yuchen TANG Jincheng,-2,0 - 0,,"1,520 / 1"
549,524,THA THA,Thanadol JUMPANOI Viriyangkura TANUPAT,-2,0 - 0,,"1,520 / 1"
550,524,SIN SIN,Chao HUANG Ming Shun TAN,-2,0 - 0,,"1,520 / 1"
551,524,AZE AZE,Karim MUSAYEV Tural RASULOV,-2,0 - 0,,"1,520 / 1"
552,524,IND IND,Prem Singh CHOUHAN Abhinav PRAKASH,-2,0 - 0,,"1,520 / 1"
553,524,IND IND,Ravinder SINGH SINGH Vinay Kumar,-2,0 - 0,,"1,520 / 1"
554,524,FRA FRA,Tanguy CITRON Gregor DUNIKOWSKI,-2,0 - 0,,"1,520 / 1"
555,524,TPE TPE,KAN Chao Yu Hsu JUI TING,-2,0 - 0,,"1,520 / 1"
556,524,NEP NEP,Pankaj CHAND Indra MEHATA,-2,0 - 0,,"1,520 / 1"
557,524,BAN BAN,Tushar Krishna ROY Uddin SAIF,-2,0 - 0,,"1,520 / 1"
558,524,BAN BAN,Chand LAL Mohammed Jabed MOSTAFA,-2,0 - 0,,"1,520 / 1"
559,524,NEP NEP,Dipesh DHAMI Sajan Krishna TAMRAKAR,-2,0 - 0,,"1,520 / 1"
560,524,NED TPE,Ruud BOSCH KAN Chao Yu,-2,0 - 0,,"1,520 / 1"
561,524,BRN BRN,Randy BACIA Emmanuelle UMALI,-2,0 - 0,,"1,520 / 1"
562,524,NED SWE,Koen RIDDER Nico RUPONEN,-2,0 - 0,,"1,520 / 1"
563,524,ESP ESP,Pablo ABIAN Eliecer OJEDA,-2,0 - 0,,"1,520 / 1"
564,524,HKG HKG,CHAN Tsz Kit HO Wai Lun,-2,0 - 0,,"1,520 / 1"
565,524,INA INA,Akbar Bintang CAHYONO Angger SUDRAJAT,-2,0 - 0,,"1,520 / 1"
566,524,IRI IRI,Erfan JOYANDEH Mehran SHAHBAZI,-2,0 - 0,,"1,520 / 1"
567,524,BAN BAN,Md. Rahad Kabir KHALED Saleh Ahmed SHAMOL,-2,0 - 0,,"1,520 / 1"
568,524,ENG ENG,Matthew CLARE David KING,-223,0 - 0,,"1,520 / 1"
569,524,BRA BRA,Mateus Carrijo CUTTI Gabriel Guimaraes NERY,-2,0 - 0,,"1,520 / 1"
570,524,ENG ENG,Ben LANE Sean VENDY,-223,0 - 0,,"1,520 / 1"
571,524,MAS MAS,Muhammad Hafifi HASHIM Muhammad Hafizi HASHIM,-2,0 - 0,,"1,520 / 1"
572,524,AUT AUT,Ralph BITTENAUER Benjamin SCHLEMMER,-2,0 - 0,,"1,520 / 1"
573,524,SIN SIN,Danny Bawa CHRISNANTA Hendra WIJAYA,-2,0 - 0,,"1,520 / 1"
574,575,MAS MAS,Ikmal Hussain JAAFAR Eizlan Shah MISFAHUL MUNEER,-3,0 - 0,,"1,470 / 4"
575,576,SWE SWE,Jin JUNYU Douglas LIDMAN,412,0 - 0,,"1,470 / 2"
576,576,NCL NCL,Yohan DE GEOFFROY Ronan HO-YAGUES,-3,0 - 0,,"1,470 / 2"
577,576,AUS MAS,David Seng Hong LEE Lishwan MUDUKASAN,-3,0 - 0,,"1,470 / 2"
578,576,AUS AUS,Ashwant GOBINATHAN Athi SELLADURAI,-3,0 - 0,,"1,470 / 2"
579,576,VIE VIE,Minh BAO Bao Duc DUONG,-3,0 - 0,,"1,470 / 2"
580,576,THA THA,Chaloempon CHAROENKITAMORN Supakit JANDARA,-3,0 - 0,,"1,470 / 2"
581,576,PER PER,Bruno BARRUETO DEZA Diego MINI,-3,0 - 0,,"1,470 / 2"
582,576,DEN DEN,Jeppe Bruun CHRISTENSEN Mark Mohr Laursen DAMGAARD,-3,0 - 0,,"1,470 / 2"
583,576,TUR TUR,Nuh BASKIN Enis SESALAN,-3,0 - 0,,"1,470 / 2"
584,576,BRN BRN,Adnan EBRAHIM Elyas JAFFAR,-3,0 - 0,,"1,470 / 2"
585,576,CHI CHI,Diego CASTILLO Alonso MEDEL,-3,0 - 0,,"1,470 / 2"
586,576,MAS MAS,Khek Wei CHUA Man Chun WOON,-3,0 - 0,,"1,470 / 2"
587,576,MAS MAS,Pak Chuu CHOW Bin Shen TAN,-3,0 - 0,,"1,470 / 2"
588,589,ISL ISL,Atli JOHANNESSON Kari GUNNARSSON,-3,0 - 0,,"1,469 / 2"
589,590,MAS MAS,Yong Yuan HAW Chen Wet LIM,-3,0 - 0,,"1,440 / 4"
590,591,DEN DEN,Patrick BUHL Kristoffer KNUDSEN,-3,0 - 0,,"1,440 / 2"
591,592,ISR ISR,Leon PUGACH Aviv SADE,-3,0 - 0,,"1,420 / 1"
592,593,FIN FIN,Oskari LARKIMO Tuomas NUORTEVA,0,0 - 0,,"1,370 / 1"
593,593,DEN DEN,Morten Skroeder BOEDSKOV Kasper DINESEN,0,0 - 0,,"1,370 / 1"
594,593,SUR SUR,Juan DEL PRADO Kevin Yao Lin ZOU,0,0 - 0,,"1,370 / 1"
595,593,SUR SUR,Alain TONEY Alroy TONEY,0,0 - 0,,"1,370 / 1"
596,593,MAR MAR,Omar KESIKES Ahmed Amine KSIKES,-3,0 - 0,,"1,370 / 1"
597,593,JOR JOR,Ayham ABD ELEDDIN Thaer AMRO,-3,0 - 0,,"1,370 / 1"
598,593,MAR MAR,Hicham ERRAJI Hamza HOUMIDA,-3,0 - 0,,"1,370 / 1"
599,593,MAS MAS,Mohd Razlan Shah MOHD RIDZUAN SHAH Nur Izzuddin MOHD RUMSANI,-3,0 - 0,,"1,370 / 1"
600,593,NGR NGR,Emmanuel CHIROMAH Jafar Salihu UMAR,-3,0 - 0,,"1,370 / 1"
601,593,NGR NGR,ALAYA Suleiman Idris Mustaopha MUHAMMED,-3,0 - 0,,"1,370 / 1"
602,593,ETH ETH,Asnake Getachew SAHILU ASRAR Seid,-3,0 - 0,,"1,370 / 1"
603,593,VEN VEN,Ivan ELYOURI PEROZO Guido FRATTA,-3,0 - 0,,"1,370 / 1"
604,593,DEN DEN,Frederik AALESTRUP Mads Emil KRISTENSEN,-3,0 - 0,,"1,370 / 1"
605,593,CAN CAN,Paul-Antoine DOSTIE-GUIDON Pierre-Etienne PILOTE,-3,0 - 0,,"1,370 / 1"
606,593,TUR TUR,Ali Bugra AKDOGAN Okan GULTEKIN,-3,0 - 0,,"1,370 / 1"
607,593,TUR TUR,Yusuf Ramazan BAY AhmetCan ORUC,-3,0 - 0,,"1,370 / 1"
608,593,SRB BUL,Igor BJELAN Gergin NEDYALKOV,-3,0 - 0,,"1,370 / 1"
609,593,KAZ KAZ,Dmitriy PANARIN YERZHAKANOV SAMAT,-3,0 - 0,,"1,370 / 1"
610,593,RUS RUS,Alexander BUTOVETSTKIY Artem SERPIONOV,-3,0 - 0,,"1,370 / 1"
611,593,FRA FRA,Terry Sebastien AMEDEE Gianni MARTON,-3,0 - 0,,"1,370 / 1"
612,593,THA THA,CHOLPRASERTSUK Kritti Trawut POTIENG,-3,0 - 0,,"1,370 / 1"
613,593,SLO SLO,Aljosa TURK Urban TURK,-3,0 - 0,,"1,370 / 1"
614,593,CYP CYP,George NICOLAOU Kyriacos PISSIS,-3,0 - 0,,"1,370 / 1"
615,593,RUS RUS,Alexander BUTOVETSTKIY Vladimir NIKULOV,-3,0 - 0,,"1,370 / 1"
616,593,NED NED,Jim MIDDELBURG Russell MUNS,-3,0 - 0,,"1,370 / 1"
617,593,INA INA,Rinov RIVALDY Muhammad ULINNUHA,-3,0 - 0,,"1,370 / 1"
618,593,CUB CUB,Lazaro Yovani MADERA PADRINO Bryan VELIZ ARBOLAY,-3,0 - 0,,"1,370 / 1"
619,593,JAM JAM,Jemarey GORDON Matthew LEE,-3,0 - 0,,"1,370 / 1"
620,593,DEN DEN,Patrick BUHL Steve OLESEN,-3,0 - 0,,"1,370 / 1"
621,593,DEN ESP,David Kim KRISTENSEN Ernesto VELAZQUEZ,-3,0 - 0,,"1,370 / 1"
622,593,UGA UGA,Riyaz SALEWALA Areej SHALWANI,-3,0 - 0,,"1,370 / 1"
623,593,FRA DEN,Jocelyn DESCHAMP Soeren TOFT HANSEN,-3,0 - 0,,"1,370 / 1"
624,593,RSA RSA,Cameron COETZER Jason COETZER,-3,0 - 0,,"1,370 / 1"
625,593,NOR NOR,Magnus CHRISTENSEN Anders LEIRUD,-3,0 - 0,,"1,370 / 1"
626,593,ECU ECU,Haward CHALEN ASPIAZU Emilio ZAMBRANO,-3,0 - 0,,"1,370 / 1"
627,593,THA THA,Thaptimdong ARKORNNIT Supak JOMKOH,-3,0 - 0,,"1,370 / 1"
628,593,BAR BAR,Cory FANUS Sabeel FOSTER,-3,0 - 0,,"1,370 / 1"
629,593,CHI CHI,Nicolas FERRUZOLA Ivan LEON,-3,0 - 0,,"1,370 / 1"
630,593,TUR TUR,Burak Furkan DEMIR Muhammed Ali KURT,-3,0 - 0,,"1,370 / 1"
631,593,AUS AUS,Cham CHEN Eric VUONG,-3,0 - 0,,"1,370 / 1"
632,593,UGA UGA,Herbert EBAYO Jacob MUSISI,-3,0 - 0,,"1,370 / 1"
633,593,NZL NZL,James EUNSON Kevin DENNERLY-MINTURN,-3,0 - 0,,"1,370 / 1"
634,635,JPN JPN,Takatoshi KUROSE Ryota SANDO,-6,0 - 0,,"1,350 / 2"
635,635,JPN JPN,Shuto MORIOKA Keita OGAWA,-6,0 - 0,,"1,350 / 2"
636,637,FRA FRA,Shinsai DESLAURIERS Jeremie VERIN,-6,0 - 0,,"1,340 / 3"
637,638,POL POL,Krzysztof JAKOWCZUK Marcin NOWAK,309,0 - 0,,"1,310 / 3"
638,639,ENG ENG,Jonathan MCDONALD Andrew WAINWRIGHT,0,0 - 0,,"1,290 / 1"
639,639,ENG ENG,Alex MARRITT ROE Michael,0,0 - 0,,"1,290 / 1"
640,639,ENG ENG,Oliver BACZALA Gregory MAIRS,0,0 - 0,,"1,290 / 1"
641,639,TPE TPE,OU Jardon YANG Po-Hsuan,-7,0 - 0,,"1,290 / 1"
642,639,TPE TPE,Tung Yuan SHANG WANG Chih Hao,-7,0 - 0,,"1,290 / 1"
643,639,TPE TPE,Wei Pin HSU Cheng Heng SU,-7,0 - 0,,"1,290 / 1"
644,639,INA GER,Senatria Agus SETIA PUTRA Ari TRISNANTO,-7,0 - 0,,"1,290 / 1"
645,639,INA INA,Eka Fajar KUSUMA Wibowo SETYALDI PUTRA,-7,0 - 0,,"1,290 / 1"
646,639,RUS RUS,Vladimir SHIPILENKO Kirill TIMOFEEV,-7,0 - 0,,"1,290 / 1"
647,639,RUS RUS,Egor EFANOV Mikhail NESTERENKO,-7,0 - 0,,"1,290 / 1"
648,639,CAN CAN,Austin James BAUER Graydon ROBB,-7,0 - 0,,"1,290 / 1"
649,639,CAN CAN,Byron Christopher HOLCEK Jakob KRYCZKA,-7,0 - 0,,"1,290 / 1"
650,639,CAN CAN,Pierre-Etienne PILOTE Maxime TÉTREAULT,-7,0 - 0,,"1,290 / 1"
651,639,USA USA,Dean SCHOPPE Tariq WADOOD,-7,0 - 0,,"1,290 / 1"
652,639,USA USA,Tony GUNAWAN Meng-Yung ONG,-7,0 - 0,,"1,290 / 1"
653,639,GUA GUA,Daniel HUMBLERS HUMBLERS HEYMARD,-7,0 - 0,,"1,290 / 1"
654,639,USA CAN,Hock Lai LEE Toby NG,-7,0 - 0,,"1,290 / 1"
655,639,CAN CAN,Felix DEBLOIS-BEAUCAGE Alexis GOHIER-DROLET,-7,0 - 0,,"1,290 / 1"
656,639,TPE TPE,Chi-Hung LIAO LIAO I Liang,-7,0 - 0,,"1,290 / 1"
657,639,BRA BRA,Alex Yuwan TJONG Luiz dos SANTOS JR,-7,0 - 0,,"1,290 / 1"
658,639,IND IND,Venkatesh PRASAD Jagadish YADAV,0,0 - 0,,"1,290 / 1"
659,660,FRA FRA,Arnaud MERKLE Leo ROSSI,-6,0 - 0,,"1,270 / 2"
660,661,THA THA,Pakin KUNA-ANUVIT Natthapat TRINKAJEE,-6,0 - 0,,"1,240 / 2"
661,661,THA THA,Ratchanon LOUNSIRI Korawi PIKUNNGAM,-6,0 - 0,,"1,240 / 2"
662,661,NZL NZL,Shane MASINIPENI Kevin ZHANG,-6,0 - 0,,"1,240 / 2"
663,661,SIN SIN,Kwan Ting Sean LEE Kean Yew LOH,-6,0 - 0,,"1,240 / 2"
664,665,THA THA,Kittithat CHEIKLINTHES Wipoo INKAEW,-6,0 - 0,,"1,230 / 3"
665,666,POL POL,Krzysztof JAKOWCZUK MATEUSZ BIERNACKI,-6,0 - 0,,"1,230 / 2"
666,667,IND IND,Sandeep ANAND Himanshu SAROHA,-6,0 - 0,,"1,200 / 2"
667,668,ISR CZE,Lior KROYTER Lukas ZEVL,-6,0 - 0,,"1,170 / 1"
668,668,FRA FRA,Gregor DUNIKOWSKI Vincent MEDINA,-6,0 - 0,,"1,170 / 1"
669,670,MAS MAS,Mohd Lutfi Zaim ABDUL KHALID Ahmad Maziri MAZLAN,-5,0 - 0,,"1,160 / 2"
670,671,FRA FRA,Thomas BAURES Marc LAPORTE,-5,0 - 0,,"1,150 / 2"
671,672,MAS MAS,Jia Huo CHEN Ming Hui LEW,-5,0 - 0,,"1,130 / 2"
672,673,IND IND,Harinder MALIK Satinder MALIK,-5,0 - 0,,"1,110 / 3"
673,674,EST EST,Mikk JÄRVEOJA Mihkel LAANES,314,0 - 0,,"1,100 / 2"
674,674,SLO SLO,Miha IVANIC Andraz KRAPEZ,-4,0 - 0,,"1,100 / 2"
675,676,ENG ENG,Max FLYNN Jonty RUSS,-5,0 - 0,,"1,090 / 2"
676,677,SVK SVK,Miroslav HARING Juraj VACHALEK,-5,0 - 0,,"1,080 / 4"
677,678,SUI SUI,Dominik BUETIKOFER Benedikt SCHALLER,-5,0 - 0,,"1,050 / 2"
678,678,TPE TPE,Ko-Chi CHANG Yi-Hsiang YANG,-5,0 - 0,,"1,050 / 2"
679,680,MAS MAS,Wen Hao LEONG Victor Jing Khai ONG,-5,0 - 0,,"1,020 / 2"
680,680,INA INA,Giovani Dicky OKTAVAN Wisnu Cahyo SAPUTRO,-5,0 - 0,,"1,020 / 2"
681,680,DEN DEN,Rene MATTISSON Mikkel Trusell MORTENSEN,-5,0 - 0,,"1,020 / 2"
682,680,THA THA,Tanapat KITTINAOWARAT Artit UTHAITEERAKOMEN,-5,0 - 0,,"1,020 / 2"
683,680,IND IND,Pavan MALIK Aditya NAIR,-5,0 - 0,,"1,020 / 2"
684,680,DEN DEN,Tobias SUDER Mathias WEBER ESTRUP,288,0 - 0,,"1,020 / 2"
685,680,MAS MAS,Nurdini MOHD SAID Deck Loong PAN,-5,0 - 0,,"1,020 / 2"
686,687,ETH ETH,Asnake Getachew SAHILU YAKOB Surafel,-6,0 - 0,,922 / 2
687,688,COD COD,Dimand Ja OKITO Mutombo TSHIZANGA,-6,0 - 0,,920 / 2
688,688,KEN KEN,Patrick Kinyua MBOGO Matheri Joseph GITHITU,-6,0 - 0,,920 / 2
689,690,RUS RUS,Shokhzod GULOMZODA EFREMOV Mikhail,0,0 - 0,,920 / 1
690,690,DEN DEN,Adam Klepp BJERRUM Martin BUNDGAARD,0,0 - 0,,920 / 1
691,690,SUR SUR,Dylan DARMOHOETOMO Gilmar JONES,0,0 - 0,,920 / 1
692,690,SUR SUR,Quinten KERTOTIKO Denzel SWEET,0,0 - 0,,920 / 1
693,690,SUR SUR,Jascha ATMODIKROMO Tariq SWEET,0,0 - 0,,920 / 1
694,690,SUR SUR,Jair LIEW Gerald MOHAMAD,0,0 - 0,,920 / 1
695,690,DEN DEN,Kian ANDERSEN Mikkel Kaersgaard HENRIKSEN,-6,0 - 0,,920 / 1
696,690,NOR NOR,Magnus CHRISTENSEN Vegard RIKHEIM,-6,0 - 0,,920 / 1
697,690,TPE TPE,Yu-Wei CHIANG Chu-En HUANG,-6,0 - 0,,920 / 1
698,690,MAS MAS,Chee Tean TAN Wee Gieen TAN,-6,0 - 0,,920 / 1
699,690,MAS MAS,Nur Mohd Azriyn AYUB Ahmad Maziri MAZLAN,-6,0 - 0,,920 / 1
700,690,INA INA,Hendrik K CLINTON Agripinna Prima Rahmanto PUTRA,-6,0 - 0,,920 / 1
701,690,TPE TPE,Cheng Heng SU YANG Po-Hsuan,-6,0 - 0,,920 / 1
702,690,BRN BRN,Arjun KARNAVAR Junith MOTTIL,-6,0 - 0,,920 / 1
703,690,PAK PAK,Amir SAEED Awais ZAHID,-6,0 - 0,,920 / 1
704,690,BRN BRN,Subhash AROLIVEETTIL Jayakumar PULLANI,-6,0 - 0,,920 / 1
705,690,BRN BRN,Togi MATHEW James VARGHESE,-6,0 - 0,,920 / 1
706,690,DEN DEN,Mads Emil CHRISTENSEN Rasmus RYLANDER,-6,0 - 0,,920 / 1
707,690,BRN BRN,Subhash AROLIVEETTIL James VARGHESE,-6,0 - 0,,920 / 1
708,690,BRN BRN,Junith MOTTIL Anirudh RAJEEV,-6,0 - 0,,920 / 1
709,690,NCL NCL,Carl NGUELA Thommy SARGITO,-6,0 - 0,,920 / 1
710,690,NCL NCL,Sebastien ARIAS Arnaud FRANZI,-6,0 - 0,,920 / 1
711,690,NCL NCL,Glenn GOWET Julien PACTAT,-6,0 - 0,,920 / 1
712,690,NCL NCL,Thomas LAHAUT Joey SANTINO,-6,0 - 0,,920 / 1
713,690,MAR MAR,Yassine EL MERNISSI Bilal ELHARAB,-6,0 - 0,,920 / 1
714,690,MAR MAR,Anwar MACHICHE Younes SAAD,-6,0 - 0,,920 / 1
715,690,ISR ISR,Maxim GRINBLAT Eitam ROZENSHTEIN,-6,0 - 0,,920 / 1
716,690,ISR ISR,may BAR NETZER Itamar DEGANI,-6,0 - 0,,920 / 1
717,690,BRA BRA,Pedro KAWAKAMI Luiz Eduardo MARTINEZ,-6,0 - 0,,920 / 1
718,690,BRA BRA,Rafael AURICHIO Lucas Constant da SILVA,-6,0 - 0,,920 / 1
719,690,BRA BRA,Rafael LAJUSTICIA Luis F MARTIN,-6,0 - 0,,920 / 1
720,690,BRA BRA,Gabriel Guimaraes NERY Filipe TOLEDO,-6,0 - 0,,920 / 1
721,690,EGY EGY,Monier Fayez BOTROS Omar EMAD,-6,0 - 0,,920 / 1
722,690,EGY EGY,Tarek AHMED SAYED Ahmed ALAA BAKR,-6,0 - 0,,920 / 1
723,690,SUI SUI,Jonas SCHWARZ Timon SCHWARZ,-6,0 - 0,,920 / 1
724,690,SUI SUI,Silvan FURRER Tobias KUENZI,-6,0 - 0,,920 / 1
725,690,ARG ARG,Matias BUSTILLO Mauro MARZULLO,-6,0 - 0,,920 / 1
726,690,ARG ARG,Dino DELMASTRO Mateo DELMASTRO,-6,0 - 0,,920 / 1
727,690,ISR ISR,Alexander BASS Shai GEFFEN,-6,0 - 0,,920 / 1
728,690,BUL BUL,Stilian MAKARSKI Alex VLAAR,-6,0 - 0,,920 / 1
729,690,BUL BUL,Peyo BOICHINOV Ivan PANEV,-6,0 - 0,,920 / 1
730,690,BUL BUL,Denis MARINOV Alex POPOV,-6,0 - 0,,920 / 1
731,690,MAS MAS,Yeet Siang LIN Vincent Cheng Wei PHUAH,-6,0 - 0,,920 / 1
732,690,NGR NGR,Julius OLUKOTUN Folorunsho Ilesanmi OPEYORI,-6,0 - 0,,920 / 1
733,690,ETH ETH,MARKOS Demis ASHENAFI Mikiyas,-6,0 - 0,,920 / 1
734,690,ETH ETH,Ermiyas Tamrat DEGEFE Teera RETA,-6,0 - 0,,920 / 1
735,690,ETH ETH,TEKLU Endale ABDULKADIR Tofik,-6,0 - 0,,920 / 1
736,690,COL COL,Harrison CARDENAS Garcia ESTEBEN,-6,0 - 0,,920 / 1
737,690,COL COL,Jhon BERDUGO Juan NOGUERA,-6,0 - 0,,920 / 1
738,690,MGL MGL,Tuguldur BOLDBAATAR Gunzorig ENKHJARGAL,-6,0 - 0,,920 / 1
