,RANK,COUNTRY,PLAYER,CHANGE +/-,WIN - LOSE,PRIZE MONEY,POINTS / TOURNAMENTS
1123,980,EST EST,Karl KIVINURM Vahur LUKIN,-24,0 - 0,,550 / 1
1124,980,BOT BOT,Adams NTUNGAMILI Keone OLATOSTE,-24,0 - 0,,550 / 1
1125,980,ISL ISL,Egill GUDLAUGSSON Ragnar HARDARSON,-24,0 - 0,,550 / 1
1126,980,CRO CRO,Filip SPOLJAREC Josip UGLESIC,-24,0 - 0,,550 / 1
1127,980,ARG ARG,Javier DE PAEPE Martin TREJO,-24,0 - 0,,550 / 1
1128,980,GRE GRE,Petros TENTAS Theodoros VELKOS,-24,0 - 0,,550 / 1
1129,980,ROU ROU,Robert CIOBOTARU Daniel COJOCARU,-24,0 - 0,,550 / 1
1130,980,FIN FIN,Henri AARNIO Joonas KORHONEN,-24,0 - 0,,550 / 1
1131,980,TUR TUR,Yusuf Ramazan BAY Muhammed Ali KURT,-24,0 - 0,,550 / 1
1132,980,BUL ISR,Sarkis AGOPYAN Shai GEFFEN,-24,0 - 0,,550 / 1
1133,980,TGA TGA,Metuisela Talakai VAINIKOLO Sione Vikilani VAINIKOLO,-24,0 - 0,,550 / 1
1134,980,MRI MRI,Stephan BEEHARRY Vishal SAWARAM,-24,0 - 0,,550 / 1
1135,980,GUA GUA,HUMBLERS HEYMARD SOLIS JONATHAN,-24,0 - 0,,550 / 1
1136,980,VIE VIE,Bang Duc BUI Manh Thang DAO,-24,0 - 0,,550 / 1
1137,1138,SIN SIN,Jian Liang LEE Bimo Adi PRAKOSO,-23,0 - 0,,530 / 2
1138,1139,INA INA,Arya Maulana ADIARTAMA Akbar Bintang CAHYONO,-23,0 - 0,,520 / 1
1139,1139,DEN DEN,Patrick BUHL Mikkel ELBJORN,-23,0 - 0,,520 / 1
1140,1141,CAN CAN,Alex LIN Andrew ZHUANG,-23,0 - 0,,510 / 1
1141,1141,CAN CAN,Alan CHOW Austin LIAW,-23,0 - 0,,510 / 1
1142,1141,CAN CAN,Logan CAMPBELL Darren HONG,-23,0 - 0,,510 / 1
1143,1141,ENG ENG,Jonathan MCDONALD Ryan Jing QUEK,-23,0 - 0,,510 / 1
1144,1141,KOR KOR,Seung Pyo KIM Min Young RA,-23,0 - 0,,510 / 1
1145,1141,MAS AUS,AI Wei Jian Shinan LIU,-23,0 - 0,,510 / 1
1146,1141,KOR KOR,LEE Haeng Ham SONG Chang Yeop,-23,0 - 0,,510 / 1
1147,1141,HKG HKG,CHANG Tak Ching YEUNG Shing Choi,-23,0 - 0,,510 / 1
1148,1149,ESP ESP,Adrian ALCAIDE Enrique PANCORBO,-23,0 - 0,,460 / 2
1149,1150,GER GER,Michael FUCHS Max SCHWENGER,-22,0 - 0,,442 / 1
1150,1151,AUS AUS,Kong Shing Billy CHEUNG Simon Wing Hang LEUNG,-22,0 - 0,,430 / 1
1151,1151,AUS AUS,Bernhard HALIM Ferry KURNIAWAN,-22,0 - 0,,430 / 1
1152,1151,AUS ENG,Hoe Keat OON Stuart ROWLANDS,-22,0 - 0,,430 / 1
1153,1151,AUS AUS,Cham CHEN Shinan LIU,-22,0 - 0,,430 / 1
1154,1151,IND IND,Mayank BEHAL Ketan CHAHAL,-22,0 - 0,,430 / 1
1155,1151,FRA FRA,Franck HEBERT Gregorie LOUIS,-22,0 - 0,,430 / 1
1156,1151,FRA FRA,Gregor DUNIKOWSKI Thomas VALLEZ,-22,0 - 0,,430 / 1
1157,1151,AUS AUS,Wesley CAULKETT Mitchell WHELLER,-22,0 - 0,,430 / 1
1158,1151,RUS RUS,Arseniy FISTIN Ryhor VARABYOU,-22,0 - 0,,430 / 1
1159,1151,IND IND,Vikrant CHAWAT Prem Singh CHOUHAN,-22,0 - 0,,430 / 1
1160,1151,FRA FRA,Quentin VINCENT Sebastien VINCENT,-22,0 - 0,,430 / 1
1161,1162,THA THA,Vichayapong KANJANAKEEREEWONG Patchara SINKUNAKORN,-22,0 - 0,,380 / 2
1162,1163,INA INA,Hendrik K CLINTON Danang Dwi SEPTIADI,0,0 - 0,,360 / 1
1163,1163,INA INA,Yodhi SATRIO Yustian SETIONO,0,0 - 0,,360 / 1
1164,1163,INA INA,Gea KAMAHAMAS Raynaldi Dita KUSUMA,0,0 - 0,,360 / 1
1165,1163,MAS MAS,Muhammad Fariqzuan FAUZIN Muhammad Hafifi HASHIM,0,0 - 0,,360 / 1
1166,1163,SRI SRI,Madusha DE SILVA Nimmika THISARA,-22,0 - 0,,360 / 1
1167,1163,SRI SRI,Imesh HASARANGA Madusha VIBHAVI,-22,0 - 0,,360 / 1
1168,1163,SRI SRI,Oshada Tilan DE SILVA Rajitha MANIMELWADU,-22,0 - 0,,360 / 1
1169,1163,JPN JPN,Taiki HONDA Naoki YAMAZAWA,-22,0 - 0,,360 / 1
1170,1163,JPN JPN,Kento SAKAI Koki WATANABE,-22,0 - 0,,360 / 1
1171,1163,JPN JPN,Hiroki OKAMURA Masayuki ONODERA,-22,0 - 0,,360 / 1
1172,1163,FRA FRA,Swann LENIK Mathieu PERRIN,-22,0 - 0,,360 / 1
1173,1163,FRA FRA,Cedric BERNIER Eric WASYLYK,-22,0 - 0,,360 / 1
1174,1163,MAS MAS,Jun Tsian TUNG Man Hung WOON,-22,0 - 0,,360 / 1
1175,1163,INA INA,Sakti KUSUMA Indra LESMANA,-22,0 - 0,,360 / 1
1176,1163,DEN DEN,Sebastian BUGTRUP Mikkel ENGHØJ,-22,0 - 0,,360 / 1
1177,1163,THA THA,Takdanai BOONRAWD Watchara BURANAKUEA,-22,0 - 0,,360 / 1
1178,1163,THA THA,Chutachalearm BUAKHAW Kandis WANAROON,-22,0 - 0,,360 / 1
1179,1163,THA THA,Noppasit BOONSOM Channarong MALAIKRONG,-22,0 - 0,,360 / 1
1180,1163,AUS THA,Pit Seng LOW Siwadol SOOKPRASDIT,-22,0 - 0,,360 / 1
1181,1163,IND IND,Jayank AHUJA Nishant DUA,-22,0 - 0,,360 / 1
1182,1163,THA THA,Panu RAKMESI Thanawats UDOMSIPRONKUL,-22,0 - 0,,360 / 1
1183,1163,THA THA,Porpol CHANDAWAN Supakit JANDARA,-22,0 - 0,,360 / 1
1184,1163,MAS MAS,Eizlan Shah MISFAHUL MUNEER Thanesh VEERAPPAN,-22,0 - 0,,360 / 1
1185,1163,THA THA,Chaloempon CHAROENKITAMORN Korawi PIKUNNGAM,-22,0 - 0,,360 / 1
1186,1163,THA THA,Phayoongpol THATPHONG Wasapon UTTAMANG,-22,0 - 0,,360 / 1
1187,1163,THA THA,Kittipong DUMRONGJITTI Jedthrin JERMJUTITUM,-22,0 - 0,,360 / 1
1188,1163,IND IND,Amey JOSHI Nikhil KOLHATKAR,-22,0 - 0,,360 / 1
1189,1163,IND IND,Abhidnya SAWANT Prasad SHETTY,-22,0 - 0,,360 / 1
1190,1163,ENG ENG,Craig SMITH Marcus SMITH,-22,0 - 0,,360 / 1
1191,1163,SIN SIN,Bimo Adi PRAKOSO Guang Liang Jason WONG,-22,0 - 0,,360 / 1
1192,1163,MAS MAS,Yan Sheng LEE Fang Yang LIM,-22,0 - 0,,360 / 1
1193,1163,TUR TUR,Murat SAKA Umutcan YILDIZ,-22,0 - 0,,360 / 1
1194,1163,CZE CZE,Petr HOSEK Petr JELINEK,-22,0 - 0,,360 / 1
1195,1163,AUS AUS,Eric HO Leon TAN,-22,0 - 0,,360 / 1
1196,1163,AUS AUS,Matthew K H LEE Ernest Yu Loong NG,-22,0 - 0,,360 / 1
1197,1163,THA THA,Karnphop ATTHAVIROJ Pollakorn JARASJINDAWONG,-22,0 - 0,,360 / 1
1198,1163,SRI SRI,Dakshika GUNATILLEKE Mahen Anjana SAMARANAYAKE,-22,0 - 0,,360 / 1
1199,1163,SRI SRI,Resintha Ridam DE SILVA Shamika Hasaranga DE SILVA,-22,0 - 0,,360 / 1
1200,1163,THA THA,Inkarat APISUK Boonyakorn THUMPANICHWONG,-22,0 - 0,,360 / 1
1201,1163,JPN JPN,Yu IGARASHI Yuki NAKAZATO,-22,0 - 0,,360 / 1
1202,1163,DEN DEN,Nicklas MATHIASEN Mads Storgaard SORENSEN,-22,0 - 0,,360 / 1
1203,1163,ITA ITA,Lukas OSELE Kevin STROBL,-22,0 - 0,,360 / 1
1204,1163,MAS MAS,Wong KIN YIK Krishna Kumar S,-22,0 - 0,,360 / 1
1205,1163,SRI SRI,Hasitha Chanaka MANANI HEWA Kasun Madusanka RATHNAYAKESENARATGE,-22,0 - 0,,360 / 1
1206,1163,VIE VIE,Tuan Duc DO Hong Nam PHAM,-22,0 - 0,,360 / 1
1207,1163,ENG ENG,Alex LANE Sam PARSONS,-22,0 - 0,,360 / 1
1208,1209,SCO SCO,Robert BLAIR Paul VAN RIETVELDE,-26,0 - 0,,358 / 2
1209,1210,SLO SLO,Martin CERKOVNIK Aljosa TURK,-26,0 - 0,,350 / 1
1210,1210,GRE GRE,Petros TENTAS Axilleas TSARTSIDIS,-26,0 - 0,,350 / 1
1211,1210,ENG ENG,Matthew CLARE Ben LANE,-26,0 - 0,,350 / 1
1212,1210,ENG ENG,Ryan Jing QUEK Andrew WAINWRIGHT,-26,0 - 0,,350 / 1
1213,1210,CZE CZE,Jaromir JANACEK Jan SOMERLIK,-26,0 - 0,,350 / 1
1214,1210,CZE CZE,Dean BRABEC Filip BUDZEL,-26,0 - 0,,350 / 1
1215,1210,AUT AUT,Jannik MACZEJKA Lukas WEISSENBÄCK,-26,0 - 0,,350 / 1
1216,1210,EST EST,Sander MERITS Tanel NAMM,-26,0 - 0,,350 / 1
1217,1210,CZE CZE,Filip BUDZEL David PTACEK,-26,0 - 0,,350 / 1
1218,1210,CZE CZE,Dean BRABEC Michal HUBACEK,-26,0 - 0,,350 / 1
1219,1210,CZE DEN,Maximilian KORENY Soeren TOFT HANSEN,-26,0 - 0,,350 / 1
1220,1210,NZL NZL,Jason SETO Dacmen VONG,-26,0 - 0,,350 / 1
1221,1210,NZL NZL,Vu DUONG Thomas ELLIS,-26,0 - 0,,350 / 1
1222,1210,NZL NZL,Jack BOYLE Jasmanjot VIRK,-26,0 - 0,,350 / 1
1223,1210,NZL NZL,Ben ROSE Douglas SHEPHARD,-26,0 - 0,,350 / 1
1224,1210,NZL AUS,Vincent HARRIS Pit Seng LOW,-26,0 - 0,,350 / 1
1225,1210,NZL NZL,Jack DING Matthew GRAHAM,-26,0 - 0,,350 / 1
1226,1210,NZL NZL,Joshua CURRY Chee Foong LIM,-26,0 - 0,,350 / 1
1227,1210,NZL NZL,Harrison JIN Eric LI,-26,0 - 0,,350 / 1
1228,1210,NZL NZL,Luke CHARLESWORTH Kevin DENNERLY-MINTURN,-26,0 - 0,,350 / 1
1229,1210,LAT LAT,Didzis GURECKIS Pauls GURECKIS,-26,0 - 0,,350 / 1
1230,1210,LAT LAT,Kristaps Janis GULBIS Teodors KERIMOVS,-26,0 - 0,,350 / 1
1231,1210,FIN FIN,Mika KONGAS Joonas KORHONEN,-26,0 - 0,,350 / 1
1232,1210,CZE CZE,Jiri LOUDA Premysl VORAC,-26,0 - 0,,350 / 1
1233,1210,POL POL,Aleksander JABLONSKI Pawel SMILOWSKI,-26,0 - 0,,350 / 1
1234,1210,NZL NZL,Valens SULAIMAN Niccolo TAGLE,-26,0 - 0,,350 / 1
1235,1236,ESP ESP,Pablo ABIAN Ernesto VELAZQUEZ,-26,0 - 0,,336 / 1
1236,1237,USA USA,Kyle EMERICK Dung TRUONG,-26,0 - 0,,332 / 1
1237,1238,SIN SIN,Chayut TRIYACHART Yong Kai Terry HEE,-26,0 - 0,,329 / 1
1238,1239,TPE TPE,Chia-Han LEE LIANG Jui Wei,-26,0 - 0,,320 / 1
1239,1239,TPE TPE,LIAO Kuan HAO LU Chia Pin,-26,0 - 0,,320 / 1
1240,1239,TPE TPE,Hung Ju CHIEN Yong Sheng LIN,-26,0 - 0,,320 / 1
1241,1239,CAN CAN,B. R. Sankeerth Yuge ZENG,-26,0 - 0,,320 / 1
1242,1239,NZL NZL,Niccolo TAGLE Daxxon VONG,-26,0 - 0,,320 / 1
1243,1239,AUS NZL,Alphonsus NG Shyam PURUSHOTHMAN,-26,0 - 0,,320 / 1
1244,1239,NZL NZL,Oscar GUO Dacmen VONG,-26,0 - 0,,320 / 1
1245,1239,NZL NZL,Chance CHENG Jian WANG,-26,0 - 0,,320 / 1
1246,1239,NZL NZL,Vu DUONG Oscar SUN,-26,0 - 0,,320 / 1
1247,1239,SUI MAS,Hafiz SHAHARUDIN Beryno Jiann Tze WONG,-26,0 - 0,,320 / 1
1248,1239,SUI BUL,Joel KOENIG Stilian MAKARSKI,-26,0 - 0,,320 / 1
1249,1239,GER GER,Lennart KONDER Tobias MUND,-26,0 - 0,,320 / 1
1250,1239,BUL BUL,Blagovest KISYOV Stilian MAKARSKI,-26,0 - 0,,320 / 1
1251,1239,IND IND,Sahil KATLARIA Gurbaksh SINGH,-26,0 - 0,,320 / 1
1252,1239,IND IND,Raj Kumar CHANDER Anand TIWARI,-26,0 - 0,,320 / 1
1253,1239,HKG HKG,LEE Chun Hei Reginald YEUNG Shing Choi,-26,0 - 0,,320 / 1
1254,1239,INA INA,Viky ANINDITA Setiawan HIDAYAT,-26,0 - 0,,320 / 1
1255,1239,INA INA,Viky ANINDITA Nathaniel Ernestan SULISTYO,-26,0 - 0,,320 / 1
1256,1239,INA INA,Danang HARYANDIKA Gunardi Ivan,-26,0 - 0,,320 / 1
1257,1239,INA INA,Rifki Nur ALAM Febriansyah MOEHAMMAT,-26,0 - 0,,320 / 1
1258,1239,INA INA,Saputra ALVINDO Wahyu TRIANSYAH,-26,0 - 0,,320 / 1
1259,1239,INA INA,Hilkiya BL Hiski RUMENGAN,-26,0 - 0,,320 / 1
1260,1239,INA INA,Richard KUNCORO Krishna Adi NUGRAHA,-26,0 - 0,,320 / 1
1261,1239,IND IND,Surender RATHEE Neeraj VASHIST,-26,0 - 0,,320 / 1
1262,1263,CAN CAN,Andy KO Nathan OSBORNE,-26,0 - 0,,240 / 1
1263,1263,CAN CAN,Antonio LI Imran WADIA,-26,0 - 0,,240 / 1
1264,1263,SCO SCO,Matthew DUGUID Jacob REYNOLDS,-26,0 - 0,,240 / 1
1265,1263,ENG ENG,Callum HEMMING Johnnie TORJUSSEN,-26,0 - 0,,240 / 1
1266,1263,SCO SCO,Callum MACMILLAN Darren REID,-26,0 - 0,,240 / 1
1267,1263,SCO SCO,Duncan GRANT Fraser HALDANE,-26,0 - 0,,240 / 1
1268,1263,KOR KOR,Jun Hee LEE Gun Soo SONG,-26,0 - 0,,240 / 1
1269,1263,KOR KOR,Sung Joon CHO Gyung Bo KO,-26,0 - 0,,240 / 1
1270,1263,HKG HKG,LEE Chak Wai LEE Cheuk Yiu,-26,0 - 0,,240 / 1
1271,1263,KOR KOR,Hyun Joon JOO Do Hyeob OH,-26,0 - 0,,240 / 1
1272,1263,NED NED,Leon HAM Mike PROOST,-26,0 - 0,,240 / 1
1273,1263,HKG HKG,OR Chin Chung YEUNG Shing Choi,-26,0 - 0,,240 / 1
1274,1263,NED NED,Nico HERMANS Ruben WIJNANDS,-26,0 - 0,,240 / 1
1275,1263,TPE TPE,Ko-Chi CHANG WANG Chih Hao,-26,0 - 0,,240 / 1
1276,1263,NED NED,Luc MAESSEN Nick SMALING,-26,0 - 0,,240 / 1
1277,1263,NEP NEP,Bikash SHRESTHA RATNAJEET TAMANG,-26,0 - 0,,240 / 1
1278,1279,AUT AUT,Matthias ALMER David OBERNOSTERER,-26,0 - 0,,214 / 2
1279,1280,SIN SIN,Bimo Adi PRAKOSO Wen Xing Abel TAN,-26,0 - 0,,210 / 1
1280,1280,KOR KOR,Sung Hoon KIM KWON Yi Goo,-26,0 - 0,,210 / 1
1281,1280,SIN SIN,Jian Liang LEE Guang Liang Jason WONG,-26,0 - 0,,210 / 1
1282,1280,THA THA,Setthanan PIYAWATCHARAVIJIT Kunlavut VITIDSARN,-26,0 - 0,,210 / 1
1283,1280,TUR TUR,Ferhat TIFTIKCI Kazim Mert TOPRAK,-26,0 - 0,,210 / 1
1284,1280,MRI MRI,Navin GUNNASAYA Manohar TOTAH,-26,0 - 0,,210 / 1
1285,1280,FRA FRA,Jean Richard PERIANAYAGOM Chrishna ZITTE,-26,0 - 0,,210 / 1
1286,1280,MRI MRI,Jean Christopher Stephane PERNE Yannick RIBET,-26,0 - 0,,210 / 1
1287,1280,MRI MRI,Girish Roy HEERAMUN Yudish Yogeshwar HEERAMUN,-26,0 - 0,,210 / 1
1288,1280,THA THA,Porpol CHANDAWAN Tanawat TOPATTANAKUL,-26,0 - 0,,210 / 1
1289,1280,THA THA,Ratchapol PHOOKPHAN Wasapon UTTAMANG,-26,0 - 0,,210 / 1
1290,1280,INA INA,Gitokardjono EDUARDO JEFFRY Danang HARYANDIKA,-26,0 - 0,,210 / 1
1291,1280,INA INA,Gabriel SAMBOUW Gusti Ahmad Ali SAPUTRA,-26,0 - 0,,210 / 1
1292,1280,POR POR,Paulo MENDONCA Pedro VELEZ,-26,0 - 0,,210 / 1
1293,1280,THA THA,Peerapong JUPRATHANSUK Nathanan TANSAYGA,-26,0 - 0,,210 / 1
1294,1280,VIE VIE,NGUYEN Xuan Thinh PHAM Duc Long,-26,0 - 0,,210 / 1
1295,1280,INA INA,Abhinaya ADIRA Alfandy Rizki KASTURO,-26,0 - 0,,210 / 1
1296,1280,POR POR,Joao MARQUES Ruben VIEIRA,-26,0 - 0,,210 / 1
1297,1280,POR POR,Bruno CARVALHO Tomas NERO,-26,0 - 0,,210 / 1
1298,1280,DEN DEN,Mark Mohr Laursen DAMGAARD Rasmus RYLANDER,-26,0 - 0,,210 / 1
1299,1280,VIE VIE,Khac Tuan NGUYEN Hai Nam PHAM,-26,0 - 0,,210 / 1
1300,1280,THA THA,Akrawin APISUK Puthaporn BVORNWATANUWONG,-26,0 - 0,,210 / 1
1301,1280,VIE VIE,Quoc Viet TRAN Hoang Viet VU,-26,0 - 0,,210 / 1
1302,1303,MGL MGL,Gerelsukh JARGALSAIKHAN Batdavaa MUNKHBAT,-26,0 - 0,,170 / 1
1303,1303,USA USA,Stephen Andrew BECKLEY Jarrett Ryan CAMPBELL,-26,0 - 0,,170 / 1
1304,1303,HKG HKG,CHANG Tak Ching LEE Chak Wai,-26,0 - 0,,170 / 1
1305,1303,FRA FRA,Nicolas KELLE Florian LALUQUE,-26,0 - 0,,170 / 1
1306,1303,MAS MAS,Vountus Indra MAWAN Muhd Yasrin S.RUSLAN,-26,0 - 0,,170 / 1
1307,1303,THA THA,Takdanai BOONRAWD Tawan HUANSURIYA,-26,0 - 0,,170 / 1
1308,1303,VIE VIE,Bang Duc BUI Khanh Tan LUONG,-26,0 - 0,,170 / 1
1309,1303,TPE TPE,Chi Yu LO Sheng-Jie YANG,-26,0 - 0,,170 / 1
1310,1303,SWE SWE,Felix NANDIN Oskar WESTERLUND,-26,0 - 0,,170 / 1
1311,1303,SWE SWE,Toni HOLM-LOWEN Johan Larsson,-26,0 - 0,,170 / 1
1312,1303,SWE SWE,David KARTBERG Kevin NILSSON,-26,0 - 0,,170 / 1
1313,1303,IRL IRL,Jack Joseph O’BRIEN Curtis PRESHO,-26,0 - 0,,170 / 1
1314,1303,IRL IRL,Sam MCKAY Nhat NGUYEN,-26,0 - 0,,170 / 1
1315,1303,ENG ENG,Callum HEMMING TOLMAN Matthew,-26,0 - 0,,170 / 1
1316,1303,ENG ENG,TOLMAN Matthew Joseph STEELE,-26,0 - 0,,170 / 1
1317,1303,ENG ENG,Sean CHAL Daniel LEERS,-26,0 - 0,,170 / 1
1318,1303,FRA FRA,Nicolas ROTH BOUVERET Lionel ZIERINGER,-26,0 - 0,,170 / 1
1319,1303,DEN DEN,Patrick BUHL Mikkel Trusell MORTENSEN,-26,0 - 0,,170 / 1
1320,1303,EST EST,Raul MUST Heiko ZOOBER,-26,0 - 0,,170 / 1
1321,1303,BEL BEL,Lawrence DE PAUW Stijn LENAERTS,-26,0 - 0,,170 / 1
1322,1303,ESP ESP,Javier ABIAN Pablo ABIAN,-26,0 - 0,,170 / 1
1323,1303,NED NED,Lennart BIJKERK Dennis VAN BEKKUM,-26,0 - 0,,170 / 1
1324,1303,SVK INA,Matej HLINICAN Sandy I KOMANG,-26,0 - 0,,170 / 1
1325,1303,FRA FRA,Sebastien ALIAS Tanguy BLANCHARD,-26,0 - 0,,170 / 1
1326,1303,CZE CZE,Adam MENDREK Michal SVĚTNIČKA,-26,0 - 0,,170 / 1
1327,1303,JPN JPN,Hikaru KOMACHIYA Daisuke SUZUKI,-26,0 - 0,,170 / 1
1328,1303,SWE SWE,Lars Johan BJORKHOLM Tommy Goran Gustav MAXE,-26,0 - 0,,170 / 1
1329,1330,CZE CZE,Jan FROHLICH Milan LUDIK,-26,0 - 0,,157 / 1
1330,1330,AUT AUT,Matthias ALMER Roman ZIRNWALD,-26,0 - 0,,157 / 1
1331,1332,VIE VIE,Manh Thang DAO Ha Anh LE,-26,0 - 0,,137 / 1
1332,1333,SUI SUI,Dominik BUETIKOFER Benedikt SCHALLER,-26,0 - 0,,130 / 1
1333,1333,ENG ENG,Peter CLEGG Jonathan MCDONALD,-26,0 - 0,,130 / 1
1334,1333,SVK SVK,Michal MATEJKA Marian SULKO,-26,0 - 0,,130 / 1
1335,1333,CZE CZE,Michal HUBACEK Jan LOUDA,-26,0 - 0,,130 / 1
1336,1333,TPE TPE,Chu-En HUANG HUANG Po Jui,-26,0 - 0,,130 / 1
1337,1333,AUS AUS,Cham CHEN Pit Seng LOW,-26,0 - 0,,130 / 1
1338,1333,MAC MAC,U Ieong IEK Hok Man LOU,-26,0 - 0,,130 / 1
1339,1340,LAT LAT,Kristaps KALNINS Niks PODOSINOVIKS,-26,0 - 0,,120 / 2
1340,1341,THA THA,Warit SARAPAT Panachai WORASAKTYANAN,-26,0 - 0,,100 / 1
1341,1341,MAS MAS,Ng JIN PING Kiang Weng TAN,-26,0 - 0,,100 / 1
1342,1341,IND IND,P. H. Suraj MIDHILESH SUNDER,-26,0 - 0,,100 / 1
1343,1341,TUR TUR,Murat GUNGOR Ahmet TAKMAK,-26,0 - 0,,100 / 1
1344,1341,TUR TUR,Cengizhan BAYRAK Sinan ER,-26,0 - 0,,100 / 1
1345,1341,RUS RUS,Nikita FEDOTOVSKIKH VENEDIKTOV Ilya,-26,0 - 0,,100 / 1
1346,1341,BUL BUL,Kostadin SIMEONOV Stoil ZHILEV,-26,0 - 0,,100 / 1
1347,1341,BUL BUL,Illian KRASTEV Krasimir KRASTEV,-26,0 - 0,,100 / 1
1348,1341,INA INA,Calvin KRISTANTO Bagas MAULANA,-26,0 - 0,,100 / 1
1349,1341,MAS MAS,Lip Seng CHANG Lishwan MUDUKASAN,-26,0 - 0,,100 / 1
1350,1341,INA INA,Febriansyah MOEHAMMAT Michael Henry TATANG,-26,0 - 0,,100 / 1
1351,1341,INA INA,Maftuki MUHAMMAD Yoga SIDIK,-26,0 - 0,,100 / 1
1352,1341,POR POR,Luís NESBITT Carlos RICARDO,-26,0 - 0,,100 / 1
1353,1341,POR POR,Rafael MIGUEL Antonio PAIVA,-26,0 - 0,,100 / 1
1354,1341,POR POR,Marco JORGE Daniel MENDES,-26,0 - 0,,100 / 1
1355,1341,POR POR,Guilherme PEREIRA Luis Miguel SILVA,-26,0 - 0,,100 / 1
1356,1341,TUR TUR,Ferhat CAVULDAK Yavuz ZURNACI,-26,0 - 0,,100 / 1
1357,1341,FIN FIN,Kristian HOLM Miikka-Matias HOLM,-26,0 - 0,,100 / 1
1358,1341,FIN FIN,Jesse LEHTIMAKI Valtteri NIEMINEN,-26,0 - 0,,100 / 1
1359,1341,FIN FIN,Roni LYYTINEN Tommi SAKSA,-26,0 - 0,,100 / 1
1360,1341,SWE NOR,Karel ERIKSSON Carl Christian HEM,-26,0 - 0,,100 / 1
1361,1341,VIE VIE,AN Thanh Huy Trung Luan PHAM,-26,0 - 0,,100 / 1
1362,1363,ISR ISR,Lior KROYTER Misha ZILBERMAN,-26,0 - 0,,79 / 1
1363,1363,AUT AUT,Matthias ALMER Luka WRABER,-26,0 - 0,,79 / 1
1364,1365,SLO SLO,Luka PETRIC Miha HORVAT,-26,0 - 0,,75 / 1
1365,1366,CZE CZE,Petr JELINEK Josef RICHTR,-26,0 - 0,,60 / 1
1366,1366,SVK SVK,Samuel IVANKA Richard SMATLAK,-26,0 - 0,,60 / 1
1367,1366,AUT AUT,Philip BIRKER Leon SEIWALD,-26,0 - 0,,60 / 1
1368,1366,CZE CZE,Lukáš HOLUB Jan HUBACEK,-26,0 - 0,,60 / 1
1369,1366,ENG ENG,Vivian LAWRENCE Chris WILLIAMS,-26,0 - 0,,60 / 1
1370,1366,SVK SVK,Tomas DRATVA Matej POLACEK,-26,0 - 0,,60 / 1
1371,1366,LTU LTU,Gedmantas CEPKAUSKAS Mark SAMES,-26,0 - 0,,60 / 1
1372,1366,LTU LTU,Saulius SALTMERIS Mantas SATRAUSKAS,-26,0 - 0,,60 / 1
1373,1366,LTU LTU,Paulius BERTASIUS Karolis EIMUTAITIS,-26,0 - 0,,60 / 1
1374,1366,SWE SWE,Jakob BURESTEDT Olle INGEMARSSON,-26,0 - 0,,60 / 1
1375,1366,FRA FRA,Alexis CHEVEREAU Romuald LEGOUBEY,-26,0 - 0,,60 / 1
1376,1377,SCO SCO,Paul VAN RIETVELDE Martin CAMPBELL,-26,0 - 0,,57 / 2
1377,1378,VIE VIE,NGUYEN Phi Hung TO Gia Bao,-26,0 - 0,,40 / 1
1378,1378,VIE VIE,LE VAN TU NGUYEN VAN DUC,-26,0 - 0,,40 / 1
1379,1378,VIE VIE,Dinh Tuan NGHIEM Minh Hieu PHUNG,-26,0 - 0,,40 / 1
1380,1378,INA INA,Wijaya ALFAT Hardianto KURNIAWAN,-26,0 - 0,,40 / 1
1381,1378,VIE VIE,BUI Quang Khai HOANG Anh Cuong,-26,0 - 0,,40 / 1
1382,1378,THA THA,Nonthawat SATTANAKO Panachai WORASAKTYANAN,-26,0 - 0,,40 / 1
1383,1378,VIE VIE,Hoang Hai NGUYEN Ngoc Thiet PHAM,-26,0 - 0,,40 / 1
1384,1385,ISR ISR,Ariel SHAINSKI Misha ZILBERMAN,-26,0 - 0,,24 / 1
1385,1386,IRL IRL,Scott EVANS Sam MAGEE,-26,0 - 0,,20 / 2
1386,1387,UGA UGA,Edwin EKIRING Brian KASIRYE,0,0 - 0,,19 / 1
1387,1388,SRI SRI,Dakshika GUNATILLEKE Nimmika THISARA,-27,0 - 0,,16 / 1
1388,1389,FIN FIN,Eetu HEINO Ville LANG,-27,0 - 0,,10 / 1
1389,1390,SWE SWE,Henri HURSKAINEN Nico RUPONEN,-27,0 - 0,,9 / 1
1390,1391,ESP ESP,Luís Enrique PEÑALVER Ernesto VELAZQUEZ,-27,0 - 0,,7 / 2
1391,1392,ETH ETH,Asnake Getachew SAHILU YAKOB Surafel,0,0 - 0,,2 / 1
1392,1392,ALG ALG,Yacoub BENADDA Adel HAMEK,0,0 - 0,,2 / 1
1393,1392,BUL BUL,Peyo BOICHINOV Blagovest KISYOV,-27,0 - 0,,2 / 1
1394,1392,SUI SUI,Christoph HEINIGER Oliver SCHALLER,-27,0 - 0,,2 / 1
1395,1392,NOR NOR,Jesper KRISTENSEN Marius MYHRE,-27,0 - 0,,2 / 1
1396,1392,MRI MRI,Christopher PAUL Aatish LUBAH,0,0 - 0,,2 / 1
1397,1392,TUR TUR,Emre LALE Emre VURAL,-27,0 - 0,,2 / 1
1398,1392,GHA GHA,Daniel SAM Emmanuel YAW DONKOR,0,0 - 0,,2 / 1
1399,1392,SEY SEY,Steve MALCOUZANNE Kervin GHISLAIN,0,0 - 0,,2 / 1
1400,1392,SEY SEY,Kervin GHISLAIN Georgie CUPIDON,0,0 - 0,,2 / 1
1401,1392,SLO SLO,Miha HORVAT Iztok UTROSA,-27,0 - 0,,2 / 1
1402,1392,CHN CHN,CAI Yun FU Haifeng,-27,0 - 0,,2 / 1
1403,1404,POL POL,Robert MATEUSIAK Lukasz MOREN,-33,0 - 0,,1 / 1
1404,1405,FRO FRO,Niclas Hojgaard EYSTUROY Nikolaj GUNNARSTEIN,-33,0 - 0,,1 / 1
