,RANK,COUNTRY,PLAYER,CHANGE +/-,WIN - LOSE,PRIZE MONEY,POINTS / TOURNAMENTS
369,370,IND IND,Talar LAA Sahil SIPANI,4,0 - 0,,"2,220 / 1"
370,370,IND IND,Arjun Kumar Reddy MALGARI T. Hema Nagendra Babu,4,0 - 0,,"2,220 / 1"
371,370,IND IND,Utkarsh ARORA Abhinav PRAKASH,4,0 - 0,,"2,220 / 1"
372,370,IND IND,Kamaldeep SINGH Neeraj VASHIST,4,0 - 0,,"2,220 / 1"
373,370,IND IND,Ankit CHHIKARA Deepak KHATRI,4,0 - 0,,"2,220 / 1"
374,370,IND IND,D. Guru Prasad S. Sanjeeth,4,0 - 0,,"2,220 / 1"
375,370,HKG HKG,TANG Chun Man LEE Chun Hei Reginald,4,0 - 0,,"2,220 / 1"
376,377,RUS RUS,Rodion ALIMOV Pavel KOTSARENKO,4,0 - 0,,"2,210 / 2"
377,377,IND IND,Vineeth MANUEL S. Sanjeeth,4,0 - 0,,"2,210 / 2"
378,377,ENG ENG,James FARMER Scott P WILLIAMS,4,0 - 0,,"2,210 / 2"
379,377,ENG ENG,Conor BAMBRICK Thomas Joseph STANFORD,4,0 - 0,,"2,210 / 2"
380,381,IND IND,Chetan ANAND Raunaq MURADIA,5,0 - 0,,"2,200 / 3"
381,382,DEN DEN,Jeppe Bay MADSEN Rasmus Kjær PEDERSEN,5,0 - 0,,"2,200 / 1"
382,382,AUS AUS,Simon Wing Hang LEUNG Jonathan SUN,5,0 - 0,,"2,200 / 1"
383,382,UKR UKR,Roman KONSTANTINOV Vladyslav VOLNYANSKIY,5,0 - 0,,"2,200 / 1"
384,382,RUS RUS,Mikhail GHELASHVILI Aleksandr VASILKIN,5,0 - 0,,"2,200 / 1"
385,382,FRA FRA,Laurent CONSTANTIN Bastian KERSAUDY,5,0 - 0,,"2,200 / 1"
386,382,SUI BUL,Anthony DUMARTHERAY Stilian MAKARSKI,5,0 - 0,,"2,200 / 1"
387,382,RUS RUS,Evgenij DREMIN Nikita KHAKIMOV,5,0 - 0,,"2,200 / 1"
388,382,CHN CHN,SUN Zhanming WANG Sijie,5,0 - 0,,"2,200 / 1"
389,382,IND IND,Vighnesh DEVLEKAR Eshan NAQVI,5,0 - 0,,"2,200 / 1"
390,382,BAN BAN,Parash Md.AHSUN HABIB Md Rais UDDIN,5,0 - 0,,"2,200 / 1"
391,382,BAN BAN,Mohammad Anamul HAQUE AHMED Md.Jamil,5,0 - 0,,"2,200 / 1"
392,382,BAN BAN,Md Zainal ABEDIN Ebadul Haque CHOWDHURY,5,0 - 0,,"2,200 / 1"
393,382,FRA FRA,Laurent CONSTANTIN Jordan CORVEE,5,0 - 0,,"2,200 / 1"
394,382,IRI IRI,Vatannejad-Soroush ESKANDARI Hasan MOTAGHI,5,0 - 0,,"2,200 / 1"
395,382,KOR KOR,CHUNG Eui Seok KIM Dae Eun,5,0 - 0,,"2,200 / 1"
396,397,IND IND,Kabir KANZARKAR Akshay RAUT,7,0 - 0,,"2,180 / 2"
397,398,TPE TPE,CHENG Po Wei LIN Yu Hsien,7,0 - 0,,"2,160 / 3"
398,399,MAS MAS,Mohd Razif ABDUL LATIF Mohd Zakry ABDUL LATIF,7,0 - 0,,"2,130 / 3"
399,400,KOR KOR,Yong Hoon JIN LEE Cheol Ho,7,0 - 0,,"2,130 / 1"
400,400,IRI IRI,Ashkan FESAHATI Mohamad Reza KHANJANI,7,0 - 0,,"2,130 / 1"
401,400,DEN DEN,Frederik AALESTRUP Kasper DINESEN,7,0 - 0,,"2,130 / 1"
402,400,SUR SUR,Gilmar JONES Mitchel WONGSODIKROMO,7,0 - 0,,"2,130 / 1"
403,400,DEN DEN,Andreas BERTHELSEN Kasper DINESEN,7,0 - 0,,"2,130 / 1"
404,400,POL POL,Milosz BOCHAT Maciej DABROWSKI,7,0 - 0,,"2,130 / 1"
405,400,INA INA,Yahya Adi KUMARA Yantoni Edy SAPUTRA,7,0 - 0,,"2,130 / 1"
406,400,MEX MEX,Job CASTILLO Antonio OCEGUEDA,-208,0 - 0,,"2,130 / 1"
407,408,INA INA,Altof BARRIQ Reinard DHANRIANO,7,0 - 0,,"2,110 / 2"
408,409,MEX MEX,Luis Ramon GARRIDO Antonio OCEGUEDA,7,0 - 0,,"2,110 / 1"
409,409,CAN CAN,Jason Anthony HO-SHUE Jonathan Bing Tsan LAI,7,0 - 0,,"2,110 / 1"
410,409,COK GUM,John TAULU David YAO,7,0 - 0,,"2,110 / 1"
411,409,TGA TGA,Lauti NAANIUMOTU Metuisela Talakai VAINIKOLO,7,0 - 0,,"2,110 / 1"
412,409,NZL PYF,Callum HARFIELD Glen LEFOLL,7,0 - 0,,"2,110 / 1"
413,409,NZL NZL,Daniel Steven BECKERLEG Thomas ELLIS,7,0 - 0,,"2,110 / 1"
414,409,SCO USA,Alistair CASEY Kyle EMERICK,7,0 - 0,,"2,110 / 1"
415,409,TPE TPE,Yu-Hua LAI Yi-Hsiang YANG,7,0 - 0,,"2,110 / 1"
416,409,TPE TPE,CHENG Po Wei Tzu Wei WANG,7,0 - 0,,"2,110 / 1"
417,409,KOR KOR,JANG Seung Hoon Seung Min KIM,7,0 - 0,,"2,110 / 1"
418,409,KOR KOR,Jun su LEE Seung Jae SEO,7,0 - 0,,"2,110 / 1"
419,409,ENG ENG,Gregory MAIRS ROE Michael,7,0 - 0,,"2,110 / 1"
420,409,KOR KOR,CHUNG Eui Seok Sang Joon LEE,7,0 - 0,,"2,110 / 1"
421,409,RUS RUS,Grigoriy MARTYNENKO Sergey SIRANT,7,0 - 0,,"2,110 / 1"
422,409,CHI CHI,Cristian ARAYA Ivan LEON,7,0 - 0,,"2,110 / 1"
423,424,THA THA,Watchara BURANAKUEA Trawut POTIENG,7,0 - 0,,"2,100 / 2"
424,424,TPE TPE,CHANG Kai Liang SU Yi Neng,7,0 - 0,,"2,100 / 2"
425,426,DOM DOM,Therry AQUINO Reimi Starling CABRERA ROSARIO,7,0 - 0,,"2,090 / 2"
426,426,ENG ENG,Harry ARKSEY David JONES,7,0 - 0,,"2,090 / 2"
427,428,NZL NZL,Benjamin HILLIER Niccolo TAGLE,7,0 - 0,,"2,070 / 2"
428,428,MAS MAS,Yeet Siang LIN Wei Sheng LOH,7,0 - 0,,"2,070 / 2"
429,428,SUI CZE,Oliver COLIN Jan FROHLICH,7,0 - 0,,"2,070 / 2"
430,431,SUI SUI,Anthony DUMARTHERAY Gilles TRIPET,7,0 - 0,,"2,030 / 2"
431,431,HKG HKG,CHAN Tsz Kit HO Wai Lun,7,0 - 0,,"2,030 / 2"
432,433,SWE SWE,Filip Michael Duwall MYHREN Nico RUPONEN,7,0 - 0,,"2,030 / 1"
433,434,MAS MAS,Wei Song LAW Man Hung WOON,7,0 - 0,,"2,020 / 3"
434,434,TUR TUR,Emre LALE Huseyin ORUC,7,0 - 0,,"2,020 / 3"
435,436,FRA FRA,Thomas BAURES Thom GICQUEL,7,0 - 0,,"2,020 / 2"
436,437,AUT DEN,Jurgen KOCH Christian LIND THOMSEN,7,0 - 0,,"1,990 / 2"
437,438,BAR BAR,Dakeil Jonathan THORPE Bradley PILGRIM,7,0 - 0,,"1,970 / 2"
438,439,TPE TPE,HUNG Tzu Wei LIN Yu Feng,7,0 - 0,,"1,950 / 2"
439,439,TPE TPE,CHEN Chung Jen Chia-Hsin WAN,7,0 - 0,,"1,950 / 2"
440,441,THA THA,Panu RAKMESI Viriyangkura TANUPAT,7,0 - 0,,"1,920 / 2"
441,441,TPE TPE,Chun-Wei CHEN Yu-Hua LAI,7,0 - 0,,"1,920 / 2"
442,441,MGL MGL,Gerelsukh JARGALSAIKHAN Batdavaa MUNKHBAT,7,0 - 0,,"1,920 / 2"
443,441,NOR NOR,Magnus CHRISTENSEN Anders LEIRUD,7,0 - 0,,"1,920 / 2"
444,441,MAS MAS,"Teng Fong, Aaron CHIA Guo Zheng SIM",7,0 - 0,,"1,920 / 2"
445,446,AUT AUT,David OBERNOSTERER Roman ZIRNWALD,-179,0 - 0,,"1,920 / 1"
446,447,SUI SUI,Mathias BONNY Oliver SCHALLER,6,0 - 0,,"1,901 / 3"
447,448,SIN SIN,Kean Hean LOH Guang Liang Jason WONG,6,0 - 0,,"1,890 / 4"
448,449,FIN FIN,Anton KAISTI Marko PYYKONEN,6,0 - 0,,"1,880 / 2"
449,449,RUS RUS,Andrey PARAKHODIN Nikolai UKK,6,0 - 0,,"1,880 / 2"
450,451,DEN DEN,Mads Emil CHRISTENSEN Kristoffer KNUDSEN,7,0 - 0,,"1,870 / 2"
451,452,CHI GUA,Bastian LIZAMA Brandon SAMAYOA,7,0 - 0,,"1,840 / 2"
452,452,SUR SUR,"Mitch, Aubrey NAI CHUNG TONG Soren OPTI",7,0 - 0,,"1,840 / 2"
453,452,NGR NGR,Abdulhamid Waleed MUSA Mujittapha UMAR,7,0 - 0,,"1,840 / 2"
454,452,TPE TPE,LU Jin-Song YANG Po-Hsuan,7,0 - 0,,"1,840 / 2"
455,452,INA INA,Ramadhani AKBAR GUSTI Galang DECKY RAMADHAN,7,0 - 0,,"1,840 / 2"
456,452,ESP ESP,Juan Manuel FERNANDEZ QUILES Javier SANCHEZ SOLER,7,0 - 0,,"1,840 / 2"
457,452,FRA FRA,Jordan CORVEE Lucas CORVEE,7,0 - 0,,"1,840 / 2"
458,452,ZAM ZAM,Kalonde CHARLES Chalwe CHONGO,7,0 - 0,,"1,840 / 2"
459,452,GER GER,Bjarne GEISS Daniel SEIFERT,7,0 - 0,,"1,840 / 2"
460,452,MAS MAS,Muhammad Hafifi HASHIM Wei Song LAW,7,0 - 0,,"1,840 / 2"
461,452,MAS MAS,Tang Jie CHEN Jien Sern IAN WONG,7,0 - 0,,"1,840 / 2"
462,452,RUS RUS,Denis GRACHEV Sergey SIRANT,7,0 - 0,,"1,840 / 2"
463,452,FIN FIN,Akseli DANSKANEN Julius VON PFALER,7,0 - 0,,"1,840 / 2"
464,452,ENG ENG,Martin DRABBLE Joshua YOUNG,7,0 - 0,,"1,840 / 2"
465,452,HKG HKG,TANG Chun Man LAW Cheuk Him,7,0 - 0,,"1,840 / 2"
466,452,MAS MAS,Kay Ee YEOH Kok Pong LOKE,7,0 - 0,,"1,840 / 2"
467,468,NED NED,Ruben JILLE Jelle MAAS,7,0 - 0,,"1,825 / 2"
468,469,POL POL,Maciej OCIEPA Michal WALENTEK,7,0 - 0,,"1,820 / 3"
469,470,SWE SWE,Jonatan NORDH Nico RUPONEN,7,0 - 0,,"1,820 / 1"
470,471,HKG HKG,CHANG Tak Ching YEUNG Shing Choi,7,0 - 0,,"1,800 / 2"
471,472,ISL ISL,Atli JOHANNESSON Kari GUNNARSSON,8,0 - 0,,"1,769 / 3"
472,473,MAS MAS,Darren Isaac DEVADASS Muhammad Amzzar ZAINUDDIN,8,0 - 0,,"1,750 / 3"
473,474,MEX USA,Arturo HERNANDEZ Bjorn SEGUIN,8,0 - 0,,"1,750 / 1"
474,474,PER PER,Daniel LA TORRE REGAL Diego MINI,8,0 - 0,,"1,750 / 1"
475,474,IRI SVK,Vatannejad-Soroush ESKANDARI Matej HLINICAN,8,0 - 0,,"1,750 / 1"
476,474,SUI SUI,Thomas HEINIGER Oliver SCHALLER,8,0 - 0,,"1,750 / 1"
477,474,TUR TUR,Oktay AYDIN Yunus BAS,8,0 - 0,,"1,750 / 1"
478,474,RUS RUS,Aleksandr VASILKIN Anatoliy YARTSEV,8,0 - 0,,"1,750 / 1"
479,474,TRI TRI,Alistair ESPINOZA Will LEE,8,0 - 0,,"1,750 / 1"
480,474,THA THA,Poodchalat PISIT Sarayut SAETANG,8,0 - 0,,"1,750 / 1"
481,474,FRA FRA,Lucas CLAERBOUT Bastian KERSAUDY,8,0 - 0,,"1,750 / 1"
482,474,DEN DEN,Patrick BUHL Jeppe LUDVIGSEN,8,0 - 0,,"1,750 / 1"
483,474,BAR SUR,Dakeil Jonathan THORPE Mitchel WONGSODIKROMO,8,0 - 0,,"1,750 / 1"
484,474,JAM JAM,Tremar BARHAM Shane WILSON,8,0 - 0,,"1,750 / 1"
485,474,SCO SCO,Alexander DUNN Adam HALL,8,0 - 0,,"1,750 / 1"
486,474,BUL SLO,Blagovest KISYOV Alen ROJ,8,0 - 0,,"1,750 / 1"
487,474,POL POL,Maciej DABROWSKI Mateusz DUBOWSKI,8,0 - 0,,"1,750 / 1"
488,474,GER GER,David PENG Max WEISSKIRCHEN,8,0 - 0,,"1,750 / 1"
489,474,CZE SVK,Jan FROHLICH Jarolim VICEN,8,0 - 0,,"1,750 / 1"
490,474,SUR SUR,Dylan DARMOHOETOMO Soren OPTI,8,0 - 0,,"1,750 / 1"
491,474,FIN FIN,Kasper LEHIKOINEN Marko PYYKONEN,8,0 - 0,,"1,750 / 1"
492,474,BUL SUI,Stilian MAKARSKI Gilles TRIPET,8,0 - 0,,"1,750 / 1"
493,494,DEN DEN,Kristoffer KNUDSEN Steve OLESEN,10,0 - 0,,"1,730 / 2"
494,495,ENG ENG,Matthew CLARE Ben LANE,10,0 - 0,,"1,720 / 2"
495,496,MAS MAS,"Jimmy, Yu Lun TAY Kay Ee YEOH",10,0 - 0,,"1,700 / 4"
496,497,THA THA,CHOLPRASERTSUK Kritti Sirawit SUHARITDUMRONG,10,0 - 0,,"1,670 / 1"
497,497,INA THA,Irfan FADHILAH Pakkawat VILAILAK,10,0 - 0,,"1,670 / 1"
498,497,INA INA,Irfan FADHILAH Markis KIDO,10,0 - 0,,"1,670 / 1"
499,497,AUS AUS,Simon Wing Hang LEUNG Pit Seng LOW,10,0 - 0,,"1,670 / 1"
500,497,AUS AUS,Cham CHEN Michael FARIMAN,10,0 - 0,,"1,670 / 1"
501,497,KOR NZL,LEE Jae Jin Oliver LEYDON-DAVIS,10,0 - 0,,"1,670 / 1"
502,497,NZL AUS,Kevin DENNERLY-MINTURN Robin MIDDLETON,10,0 - 0,,"1,670 / 1"
503,497,TPE TPE,Ko-Chi CHANG Chi-Lin WANG,10,0 - 0,,"1,670 / 1"
504,497,SUI INA,Agung RUHANDA KUSUMAH Sandy Darma,10,0 - 0,,"1,670 / 1"
505,497,BAN BAN,Mostafizar RAHMAN Uddin SAIF,10,0 - 0,,"1,670 / 1"
506,497,IND IND,Jayan JAMES Vikranth Kumar KORUKONDA,10,0 - 0,,"1,670 / 1"
507,497,IND IND,Sanidhya BANDOONI SINGH Vinay Kumar,10,0 - 0,,"1,670 / 1"
508,497,IND IND,Kapil CHAUDHARY Chandrabhusan TRIPATHI,10,0 - 0,,"1,670 / 1"
509,497,IND IND,Vikrant CHAWAT Rajat RATHORE,10,0 - 0,,"1,670 / 1"
510,497,INA INA,Fran KURNIAWAN Afiat Yuris WIRAWAN,10,0 - 0,,"1,670 / 1"
511,497,INA INA,Ronald ALEXANDER Edi SUBAKTIAR,10,0 - 0,,"1,670 / 1"
512,497,IND IND,Prem Singh CHOUHAN Manish GUPTA,10,0 - 0,,"1,670 / 1"
513,497,INA HKG,Fernando KURNIAWAN LO Lok Kei,10,0 - 0,,"1,670 / 1"
514,497,CHN CHN,CHEN Zhuofu SHI Longfei,10,0 - 0,,"1,670 / 1"
515,497,IND IND,J. B. S. Vidyadhar Srujan NANDALURI,10,0 - 0,,"1,670 / 1"
516,517,USA NED,Ryan CHEW Koen RIDDER,10,0 - 0,,"1,610 / 2"
517,518,THA THA,Inkarat APISUK Sutichon POL-GUL,10,0 - 0,,"1,580 / 2"
518,519,TPE TPE,Yu Chieh HSU Chun Yao LIAO,10,0 - 0,,"1,570 / 3"
519,520,SIN SIN,Kean Yew LOH Zin Rei Ryan NG,10,0 - 0,,"1,560 / 3"
520,521,RUS RUS,Evgenij DREMIN Vladimir MALKOV,10,0 - 0,,"1,540 / 2"
521,521,CZE CZE,Zdenek SVATA Jan FROHLICH,10,0 - 0,,"1,540 / 2"
522,523,THA THA,Parinyawat THONGNUAM TANKMANUSTONG Warut,10,0 - 0,,"1,520 / 3"
523,524,TRI TRI,Nicholas BONKOWSKY Jason RAMJASS,11,0 - 0,,"1,520 / 2"
524,525,CRO CRO,Igor CIMBUR Zvonimir DURKINJAK,11,0 - 0,,"1,520 / 1"
525,525,CHI CHI,Patricio ALVAREZ Jose UNDURRAGA,11,0 - 0,,"1,520 / 1"
526,525,CHI CHI,Cristobal CAMPOS Sebastian MARTINEZ,11,0 - 0,,"1,520 / 1"
527,525,BUL CZE,Dimitar DELCHEV Jaromir JANACEK,11,0 - 0,,"1,520 / 1"
528,525,INA INA,Moch. Revindra REYHALDI Andrew SUSANTO,11,0 - 0,,"1,520 / 1"
529,525,GER GER,Mark LAMSFUSS Josche ZURWONNE,11,0 - 0,,"1,520 / 1"
530,525,UKR UKR,Glib BEKETOV Mykhaylo MAKHNOVSKIY,11,0 - 0,,"1,520 / 1"
531,525,GUA GUA,Ivan Rodrigo LEON GARCIA Christopher Alexander MARTINEZ SALVADOR,11,0 - 0,,"1,520 / 1"
532,525,MAS MAS,Mohd Lutfi Zaim ABDUL KHALID Muhammad Hafizi HASHIM,11,0 - 0,,"1,520 / 1"
533,525,RUS RUS,Nikita AGALAKOV Alexander LOGINOV,11,0 - 0,,"1,520 / 1"
534,525,RUS RUS,Vadim ITCKOV Artem SERPIONOV,11,0 - 0,,"1,520 / 1"
535,525,MAS MAS,Mohd Lutfi Zaim ABDUL KHALID Mohd Razif ABDUL LATIF,11,0 - 0,,"1,520 / 1"
536,525,IND IND,Krishna Prasad GARAGA Satwiksairaj RANKIREDDY,11,0 - 0,,"1,520 / 1"
537,525,IND IND,Arjun Kumar Reddy MALGARI Santosh RAVURI,11,0 - 0,,"1,520 / 1"
538,525,FRA FRA,Lucas CLAERBOUT Yoann TURLAN,11,0 - 0,,"1,520 / 1"
539,525,GER GER,Fabian HOLZER Jones Ralfy JANSEN,11,0 - 0,,"1,520 / 1"
540,525,JPN JPN,Katsunori ITO Akira KOBAYASHI,11,0 - 0,,"1,520 / 1"
541,525,NZL TPE,Oliver LEYDON-DAVIS TIEN Jen Chieh,11,0 - 0,,"1,520 / 1"
542,525,BRA BRA,Willian GUIMARAES Vinicius Oliveira SILVA,11,0 - 0,,"1,520 / 1"
543,525,INA INA,Julian ARBITAMA Subhan HASAN,11,0 - 0,,"1,520 / 1"
544,525,IRI IRI,NORI Erfan POREBRAHIM ZEMIDANI Saeed,11,0 - 0,,"1,520 / 1"
545,525,IRQ IRQ,Ali Abduladheem Hamad AL-OGAILI AL- QAZZAZ Ali Muafaq Hadi,11,0 - 0,,"1,520 / 1"
546,525,IRI IRI,Sepehr EIVANI Sadredin SADEGHI,11,0 - 0,,"1,520 / 1"
547,525,IRI IRI,Zargan AMIRARSALAN HEYDARI SHAFAGH Hamid,11,0 - 0,,"1,520 / 1"
548,525,TPE NZL,KAN Chao Yu Oliver LEYDON-DAVIS,11,0 - 0,,"1,520 / 1"
549,525,CHN CHN,GUO Yuchen TANG Jincheng,11,0 - 0,,"1,520 / 1"
550,525,THA THA,Thanadol JUMPANOI Viriyangkura TANUPAT,11,0 - 0,,"1,520 / 1"
551,525,SIN SIN,Chao HUANG Ming Shun TAN,11,0 - 0,,"1,520 / 1"
552,525,AZE AZE,Karim MUSAYEV Tural RASULOV,11,0 - 0,,"1,520 / 1"
553,525,IND IND,Prem Singh CHOUHAN Abhinav PRAKASH,11,0 - 0,,"1,520 / 1"
554,525,IND IND,Ravinder SINGH SINGH Vinay Kumar,11,0 - 0,,"1,520 / 1"
555,525,FRA FRA,Tanguy CITRON Gregor DUNIKOWSKI,11,0 - 0,,"1,520 / 1"
556,525,TPE TPE,KAN Chao Yu Hsu JUI TING,11,0 - 0,,"1,520 / 1"
557,525,NEP NEP,Pankaj CHAND Indra MEHATA,11,0 - 0,,"1,520 / 1"
558,525,BAN BAN,Tushar Krishna ROY Uddin SAIF,11,0 - 0,,"1,520 / 1"
559,525,BAN BAN,Chand LAL Mohammed Jabed MOSTAFA,11,0 - 0,,"1,520 / 1"
560,525,NEP NEP,Dipesh DHAMI Sajan Krishna TAMRAKAR,11,0 - 0,,"1,520 / 1"
561,525,NED TPE,Ruud BOSCH KAN Chao Yu,11,0 - 0,,"1,520 / 1"
562,525,ENG ENG,Jed ARKSEY Alex LANE,11,0 - 0,,"1,520 / 1"
563,525,MAS MAS,Nelson Wei Keat HEG Hong Kheng YEW,11,0 - 0,,"1,520 / 1"
564,525,MAS MAS,Muhammad Hafiz HASHIM Muhammad Hafizi HASHIM,11,0 - 0,,"1,520 / 1"
565,525,PAK PAK,Wajid Ali CHAUDHRY Amir SAEED,11,0 - 0,,"1,520 / 1"
566,525,NED SWE,Koen RIDDER Nico RUPONEN,11,0 - 0,,"1,520 / 1"
567,525,MAS MAS,Khek Wei CHUA Muhammad Amzzar ZAINUDDIN,11,0 - 0,,"1,520 / 1"
568,525,ESP ESP,Pablo ABIAN Eliecer OJEDA,11,0 - 0,,"1,520 / 1"
569,525,INA INA,Akbar Bintang CAHYONO Angger SUDRAJAT,11,0 - 0,,"1,520 / 1"
570,525,IRI IRI,Erfan JOYANDEH Mehran SHAHBAZI,11,0 - 0,,"1,520 / 1"
571,525,BAN BAN,Md. Rahad Kabir KHALED Saleh Ahmed SHAMOL,11,0 - 0,,"1,520 / 1"
572,525,BRA BRA,Mateus Carrijo CUTTI Gabriel Guimaraes NERY,11,0 - 0,,"1,520 / 1"
573,525,AUT AUT,Ralph BITTENAUER Benjamin SCHLEMMER,11,0 - 0,,"1,520 / 1"
574,575,MAS MAS,Ikmal Hussain JAAFAR Eizlan Shah MISFAHUL MUNEER,12,0 - 0,,"1,470 / 4"
575,576,AUS MAS,David Seng Hong LEE Lishwan MUDUKASAN,12,0 - 0,,"1,470 / 2"
576,576,AUS AUS,Ashwant GOBINATHAN Athi SELLADURAI,12,0 - 0,,"1,470 / 2"
577,576,VIE VIE,Minh BAO Bao Duc DUONG,12,0 - 0,,"1,470 / 2"
578,576,THA THA,Chaloempon CHAROENKITAMORN Supakit JANDARA,12,0 - 0,,"1,470 / 2"
579,576,PER PER,Bruno BARRUETO DEZA Diego MINI,12,0 - 0,,"1,470 / 2"
580,576,TUR TUR,Nuh BASKIN Enis SESALAN,12,0 - 0,,"1,470 / 2"
581,576,CHI CHI,Diego CASTILLO Alonso MEDEL,12,0 - 0,,"1,470 / 2"
582,576,MAS MAS,Khek Wei CHUA Man Chun WOON,12,0 - 0,,"1,470 / 2"
583,576,MAS MAS,Pak Chuu CHOW Bin Shen TAN,12,0 - 0,,"1,470 / 2"
584,585,ISR ISR,Alexander BASS Lior KROYTER,-327,0 - 0,,"1,458 / 1"
585,586,MAS MAS,Yong Yuan HAW Chen Wet LIM,11,0 - 0,,"1,440 / 4"
586,587,ISR ISR,Leon PUGACH Aviv SADE,122,0 - 0,,"1,420 / 1"
587,588,MAR MAR,Omar KESIKES Ahmed Amine KSIKES,0,0 - 0,,"1,370 / 1"
588,588,JOR JOR,Ayham ABD ELEDDIN Thaer AMRO,0,0 - 0,,"1,370 / 1"
589,588,MAR MAR,Hicham ERRAJI Hamza HOUMIDA,0,0 - 0,,"1,370 / 1"
590,588,MAS MAS,Mohd Razlan Shah MOHD RIDZUAN SHAH Nur Izzuddin MOHD RUMSANI,11,0 - 0,,"1,370 / 1"
591,588,NGR NGR,Emmanuel CHIROMAH Jafar Salihu UMAR,11,0 - 0,,"1,370 / 1"
592,588,NGR NGR,ALAYA Suleiman Idris Mustaopha MUHAMMED,11,0 - 0,,"1,370 / 1"
593,588,ETH ETH,Asnake Getachew SAHILU ASRAR Seid,11,0 - 0,,"1,370 / 1"
594,588,VEN VEN,Ivan ELYOURI PEROZO Guido FRATTA,11,0 - 0,,"1,370 / 1"
595,588,VEN VEN,Jesus Manuel SANCHEZ LAMA Jhonatan WU ZHENG,11,0 - 0,,"1,370 / 1"
596,588,DEN DEN,Frederik AALESTRUP Mads Emil KRISTENSEN,11,0 - 0,,"1,370 / 1"
597,588,CAN CAN,Paul-Antoine DOSTIE-GUIDON Pierre-Etienne PILOTE,11,0 - 0,,"1,370 / 1"
598,588,TUR TUR,Ali Bugra AKDOGAN Okan GULTEKIN,11,0 - 0,,"1,370 / 1"
599,588,TUR TUR,Yusuf Ramazan BAY AhmetCan ORUC,11,0 - 0,,"1,370 / 1"
600,588,SRB BUL,Igor BJELAN Gergin NEDYALKOV,11,0 - 0,,"1,370 / 1"
601,588,KAZ KAZ,Dmitriy PANARIN YERZHAKANOV SAMAT,11,0 - 0,,"1,370 / 1"
602,588,RUS RUS,Alexander BUTOVETSTKIY Artem SERPIONOV,11,0 - 0,,"1,370 / 1"
603,588,FRA FRA,Terry Sebastien AMEDEE Gianni MARTON,11,0 - 0,,"1,370 / 1"
604,588,THA THA,CHOLPRASERTSUK Kritti Trawut POTIENG,11,0 - 0,,"1,370 / 1"
605,588,SLO SLO,Aljosa TURK Urban TURK,11,0 - 0,,"1,370 / 1"
606,588,CYP CYP,George NICOLAOU Kyriacos PISSIS,11,0 - 0,,"1,370 / 1"
607,588,RUS RUS,Alexander BUTOVETSTKIY Vladimir NIKULOV,11,0 - 0,,"1,370 / 1"
608,588,NED NED,Jim MIDDELBURG Russell MUNS,11,0 - 0,,"1,370 / 1"
609,588,INA INA,Rinov RIVALDY Muhammad ULINNUHA,11,0 - 0,,"1,370 / 1"
610,588,CUB CUB,Lazaro Yovani MADERA PADRINO Bryan VELIZ ARBOLAY,11,0 - 0,,"1,370 / 1"
611,588,JAM JAM,Jemarey GORDON Matthew LEE,11,0 - 0,,"1,370 / 1"
612,588,DEN DEN,Patrick BUHL Steve OLESEN,11,0 - 0,,"1,370 / 1"
613,588,DEN ESP,David Kim KRISTENSEN Ernesto VELAZQUEZ,11,0 - 0,,"1,370 / 1"
614,588,UGA UGA,Riyaz SALEWALA Areej SHALWANI,11,0 - 0,,"1,370 / 1"
615,588,DEN DEN,Jeppe Bruun CHRISTENSEN Mark Mohr Laursen DAMGAARD,11,0 - 0,,"1,370 / 1"
616,588,FRA DEN,Jocelyn DESCHAMP Soeren TOFT HANSEN,11,0 - 0,,"1,370 / 1"
617,588,RSA RSA,Cameron COETZER Jason COETZER,11,0 - 0,,"1,370 / 1"
618,588,SWE SWE,Toni HOLM-LOWEN Karl MURGARD,11,0 - 0,,"1,370 / 1"
619,588,DEN DEN,Rene MATTISSON Mathias Rud PEDERSEN,11,0 - 0,,"1,370 / 1"
620,588,SUR SUR,Jair LIEW Alain TONEY,11,0 - 0,,"1,370 / 1"
621,588,ECU ECU,Haward CHALEN ASPIAZU Emilio ZAMBRANO,11,0 - 0,,"1,370 / 1"
622,588,THA THA,Thaptimdong ARKORNNIT Supak JOMKOH,11,0 - 0,,"1,370 / 1"
623,588,BAR BAR,Cory FANUS Sabeel FOSTER,11,0 - 0,,"1,370 / 1"
624,588,FRA FRA,Ronan GUEGUIN Alexandre HAMMER,-110,0 - 0,,"1,370 / 1"
625,588,DEN DEN,Patrick BJERREGAARD Soeren TOFT HANSEN,11,0 - 0,,"1,370 / 1"
626,588,CHI CHI,Nicolas FERRUZOLA Ivan LEON,11,0 - 0,,"1,370 / 1"
627,588,AUT AUT,Benjamin SCHLEMMER Dominik STIPSITS,11,0 - 0,,"1,370 / 1"
628,588,TUR TUR,Burak Furkan DEMIR Muhammed Ali KURT,11,0 - 0,,"1,370 / 1"
629,588,AUS AUS,Cham CHEN Eric VUONG,11,0 - 0,,"1,370 / 1"
630,588,UGA UGA,Herbert EBAYO Jacob MUSISI,11,0 - 0,,"1,370 / 1"
631,588,SUR SUR,Alrick TONEY Alroy TONEY,11,0 - 0,,"1,370 / 1"
632,588,MAS MAS,Wee Tat TAN Yip Jiun TAN,11,0 - 0,,"1,370 / 1"
633,588,NZL NZL,James EUNSON Kevin DENNERLY-MINTURN,11,0 - 0,,"1,370 / 1"
634,635,JPN JPN,Takatoshi KUROSE Ryota SANDO,10,0 - 0,,"1,350 / 2"
635,635,JPN JPN,Shuto MORIOKA Keita OGAWA,10,0 - 0,,"1,350 / 2"
636,637,FRA FRA,Shinsai DESLAURIERS Jeremie VERIN,10,0 - 0,,"1,340 / 3"
637,638,TPE TPE,OU Jardon YANG Po-Hsuan,10,0 - 0,,"1,290 / 1"
638,638,TPE TPE,Tung Yuan SHANG WANG Chih Hao,10,0 - 0,,"1,290 / 1"
639,638,TPE TPE,HUNG Ying Yuan Shang Kai LIN,10,0 - 0,,"1,290 / 1"
640,638,TPE TPE,Wei Pin HSU Cheng Heng SU,10,0 - 0,,"1,290 / 1"
641,638,INA GER,Senatria Agus SETIA PUTRA Ari TRISNANTO,10,0 - 0,,"1,290 / 1"
642,638,INA INA,Eka Fajar KUSUMA Wibowo SETYALDI PUTRA,10,0 - 0,,"1,290 / 1"
643,638,RUS RUS,Vladimir SHIPILENKO Kirill TIMOFEEV,10,0 - 0,,"1,290 / 1"
644,638,RUS RUS,Egor EFANOV Mikhail NESTERENKO,10,0 - 0,,"1,290 / 1"
645,638,CAN CAN,Austin James BAUER Graydon ROBB,10,0 - 0,,"1,290 / 1"
646,638,CAN CAN,Byron Christopher HOLCEK Jakob KRYCZKA,10,0 - 0,,"1,290 / 1"
647,638,CAN CAN,Pierre-Etienne PILOTE Maxime TÉTREAULT,10,0 - 0,,"1,290 / 1"
648,638,USA USA,Dean SCHOPPE Tariq WADOOD,10,0 - 0,,"1,290 / 1"
649,638,USA USA,Tony GUNAWAN Meng-Yung ONG,10,0 - 0,,"1,290 / 1"
650,638,GUA GUA,Daniel HUMBLERS HUMBLERS HEYMARD,10,0 - 0,,"1,290 / 1"
651,638,USA CAN,Hock Lai LEE Toby NG,10,0 - 0,,"1,290 / 1"
652,638,ENG ENG,Nick HODGSON Joshua YOUNG,10,0 - 0,,"1,290 / 1"
653,638,SCO SCO,Alexander DUNN Keith TURNBULL,10,0 - 0,,"1,290 / 1"
654,638,SCO SCO,Sameer Scott AAMIR Brandon TSANG,10,0 - 0,,"1,290 / 1"
655,638,KOR KOR,Se Sung AHN Ji Soo LIM,10,0 - 0,,"1,290 / 1"
656,638,KOR KOR,JUNG Suk Hoon Ki Hoon KIM,10,0 - 0,,"1,290 / 1"
657,638,KOR KOR,Jun Soo KIM KIM Kyung Tae,10,0 - 0,,"1,290 / 1"
658,638,KOR KOR,HAN To Sung JUNG Young Keun,10,0 - 0,,"1,290 / 1"
659,638,KOR KOR,Seung Yeop HAN Jae Woo LEE,10,0 - 0,,"1,290 / 1"
660,638,KOR KOR,Hyuk Gyun CHOI Jong Woo CHOI,10,0 - 0,,"1,290 / 1"
661,638,KOR KOR,Dong Joo KIM KIM Sung Hyo,10,0 - 0,,"1,290 / 1"
662,638,CAN CAN,Felix DEBLOIS-BEAUCAGE Alexis GOHIER-DROLET,-257,0 - 0,,"1,290 / 1"
663,638,ENG ENG,Farid AKROUM George ISHERWOOD,10,0 - 0,,"1,290 / 1"
664,638,TPE TPE,Chi-Hung LIAO LIAO I Liang,10,0 - 0,,"1,290 / 1"
665,638,TPE TPE,HUANG Po Jui TIEN Tzu Chieh,10,0 - 0,,"1,290 / 1"
666,638,BRA BRA,Alex Yuwan TJONG Luiz dos SANTOS JR,10,0 - 0,,"1,290 / 1"
667,638,SCO SCO,Danny LEINSTER Steven STEWART,10,0 - 0,,"1,290 / 1"
668,669,FRA FRA,Arnaud MERKLE Leo ROSSI,9,0 - 0,,"1,270 / 2"
669,670,ESP ESP,Blai RAMIREZ Manuel VAZQUEZ,9,0 - 0,,"1,240 / 5"
670,671,THA THA,Pakin KUNA-ANUVIT Natthapat TRINKAJEE,9,0 - 0,,"1,240 / 2"
671,671,THA THA,Ratchanon LOUNSIRI Korawi PIKUNNGAM,9,0 - 0,,"1,240 / 2"
672,671,NZL NZL,Shane MASINIPENI Kevin ZHANG,9,0 - 0,,"1,240 / 2"
673,671,TPE TPE,Chu-En HUANG Jhe-Huei LEE,9,0 - 0,,"1,240 / 2"
674,675,THA THA,Kittithat CHEIKLINTHES Wipoo INKAEW,9,0 - 0,,"1,230 / 3"
675,676,POL POL,Krzysztof JAKOWCZUK MATEUSZ BIERNACKI,9,0 - 0,,"1,230 / 2"
676,677,IND IND,Sandeep ANAND Himanshu SAROHA,9,0 - 0,,"1,200 / 2"
677,678,ISR BUL,Shai GEFFEN Ivan RUSEV,0,0 - 0,,"1,170 / 1"
678,678,ISR CZE,Lior KROYTER Lukas ZEVL,0,0 - 0,,"1,170 / 1"
679,678,FRA FRA,Gregor DUNIKOWSKI Vincent MEDINA,9,0 - 0,,"1,170 / 1"
680,678,POR POR,Bernardo ATILANO Ricardo SILVA,9,0 - 0,,"1,170 / 1"
681,682,MAS MAS,Mohd Lutfi Zaim ABDUL KHALID Ahmad Maziri MAZLAN,7,0 - 0,,"1,160 / 2"
682,683,FRA FRA,Thomas BAURES Marc LAPORTE,7,0 - 0,,"1,150 / 2"
683,684,MAS MAS,Jia Huo CHEN Ming Hui LEW,7,0 - 0,,"1,130 / 2"
684,685,NOR NOR,Sturla Flaten JORGENSEN Carl Christian MORK,7,0 - 0,,"1,110 / 3"
685,685,IND IND,Harinder MALIK Satinder MALIK,7,0 - 0,,"1,110 / 3"
686,687,SLO SLO,Miha IVANIC Andraz KRAPEZ,7,0 - 0,,"1,100 / 2"
687,688,ENG ENG,Max FLYNN Jonty RUSS,7,0 - 0,,"1,090 / 2"
688,688,NED NED,Ruben JILLE Robin TABELING,-155,0 - 0,,"1,090 / 2"
689,690,SUI SUI,Dominik BUETIKOFER Benedikt SCHALLER,6,0 - 0,,"1,050 / 2"
690,690,TPE TPE,Ko-Chi CHANG Yi-Hsiang YANG,6,0 - 0,,"1,050 / 2"
691,692,NOR NOR,Torjus FLAATTEN Peter Roenn STENSAETH,6,0 - 0,,"1,020 / 4"
692,693,MAS MAS,Wen Hao LEONG Victor Jing Khai ONG,6,0 - 0,,"1,020 / 2"
693,693,INA INA,Giovani Dicky OKTAVAN Wisnu Cahyo SAPUTRO,6,0 - 0,,"1,020 / 2"
694,693,THA THA,Tanapat KITTINAOWARAT Artit UTHAITEERAKOMEN,6,0 - 0,,"1,020 / 2"
695,693,IND IND,Pavan MALIK Aditya NAIR,6,0 - 0,,"1,020 / 2"
696,693,MAS MAS,Muhammad Adib Haiqal NURIZWAN Muhammad Aliff NURIZWAN,6,0 - 0,,"1,020 / 2"
697,693,MAS MAS,Nurdini MOHD SAID Deck Loong PAN,6,0 - 0,,"1,020 / 2"
698,699,BUL BUL,Stilian MAKARSKI Peyo BOICHINOV,6,0 - 0,,937 / 1
699,700,ETH ETH,Asnake Getachew SAHILU YAKOB Surafel,6,0 - 0,,922 / 2
700,701,COD COD,Dimand Ja OKITO Mutombo TSHIZANGA,6,0 - 0,,920 / 2
701,701,KEN KEN,Patrick Kinyua MBOGO Matheri Joseph GITHITU,6,0 - 0,,920 / 2
702,703,MAR MAR,Yassine EL MERNISSI Bilal ELHARAB,0,0 - 0,,920 / 1
703,703,MAR MAR,Anwar MACHICHE Younes SAAD,0,0 - 0,,920 / 1
704,703,ISR ISR,Maxim GRINBLAT Eitam ROZENSHTEIN,0,0 - 0,,920 / 1
705,703,ISR ISR,may BAR NETZER Itamar DEGANI,0,0 - 0,,920 / 1
706,703,BRA BRA,Pedro KAWAKAMI Luiz Eduardo MARTINEZ,0,0 - 0,,920 / 1
707,703,BRA BRA,Rafael AURICHIO Lucas Constant da SILVA,0,0 - 0,,920 / 1
708,703,BRA BRA,Rafael LAJUSTICIA Luis F MARTIN,0,0 - 0,,920 / 1
709,703,BRA BRA,Gabriel Guimaraes NERY Filipe TOLEDO,0,0 - 0,,920 / 1
710,703,EGY EGY,Monier Fayez BOTROS Omar EMAD,6,0 - 0,,920 / 1
711,703,EGY EGY,Tarek AHMED SAYED Ahmed ALAA BAKR,6,0 - 0,,920 / 1
712,703,SUI SUI,Jonas SCHWARZ Timon SCHWARZ,6,0 - 0,,920 / 1
713,703,SUI SUI,Silvan FURRER Tobias KUENZI,6,0 - 0,,920 / 1
714,703,ARG ARG,Matias BUSTILLO Mauro MARZULLO,6,0 - 0,,920 / 1
715,703,ARG ARG,Dino DELMASTRO Mateo DELMASTRO,6,0 - 0,,920 / 1
716,703,ISR ISR,Alexander BASS Shai GEFFEN,6,0 - 0,,920 / 1
717,703,BUL BUL,Stilian MAKARSKI Alex VLAAR,6,0 - 0,,920 / 1
718,703,BUL BUL,Peyo BOICHINOV Ivan PANEV,6,0 - 0,,920 / 1
719,703,BUL BUL,Denis MARINOV Alex POPOV,6,0 - 0,,920 / 1
720,703,MAS MAS,Yeet Siang LIN Vincent Cheng Wei PHUAH,6,0 - 0,,920 / 1
721,703,NGR NGR,Julius OLUKOTUN Folorunsho Ilesanmi OPEYORI,6,0 - 0,,920 / 1
722,703,ETH ETH,MARKOS Demis ASHENAFI Mikiyas,6,0 - 0,,920 / 1
723,703,ETH ETH,Ermiyas Tamrat DEGEFE Teera RETA,6,0 - 0,,920 / 1
724,703,ETH ETH,TEKLU Endale ABDULKADIR Tofik,6,0 - 0,,920 / 1
725,703,COL COL,Harrison CARDENAS Garcia ESTEBEN,6,0 - 0,,920 / 1
726,703,COL COL,Jhon BERDUGO Juan NOGUERA,6,0 - 0,,920 / 1
727,703,ENG SCO,Christopher COLES Adam HALL,6,0 - 0,,920 / 1
728,703,MGL MGL,Tuguldur BOLDBAATAR Gunzorig ENKHJARGAL,6,0 - 0,,920 / 1
729,703,MGL MGL,Gankhuyag DASHNYAM Purevsuren ENKHMANDAKH,6,0 - 0,,920 / 1
730,703,MGL MGL,Battur DAVAASUREN Olonbayar ENKHBAT,6,0 - 0,,920 / 1
731,703,MGL MGL,Munkhbold BAASANDORJ Bat-Urel URELNIITUGUL,6,0 - 0,,920 / 1
732,703,MGL MGL,Khuvituguldur BYAMBAJAV Tsolmon MUNKHBAT,6,0 - 0,,920 / 1
733,703,AUS AUS,Blake HAGGERTY Dibyendu ROY,6,0 - 0,,920 / 1
734,703,AUS AUS,Arthur Jia Liang ANG Kingston CHAN,6,0 - 0,,920 / 1
735,703,AUS AUS,Francesco CHU Aaron MIAO,6,0 - 0,,920 / 1
736,703,AUS AUS,Vincent Tak Meng FONG Chia Sheng LIM,6,0 - 0,,920 / 1
737,703,AUS AUS,Cham CHEN Lukas DEFOLKY,6,0 - 0,,920 / 1
738,703,AUS AUS,Arrick Jia Yang ANG Marcus LOI,6,0 - 0,,920 / 1
739,703,NZL NZL,Christopher STEEGHS Niccolo TAGLE,6,0 - 0,,920 / 1
