,RANK,COUNTRY,PLAYER,CHANGE +/-,WIN - LOSE,PRIZE MONEY,POINTS / TOURNAMENTS
369,370,THA THA,Panachai WORASAKTYANAN Rawimon IAMRATANAMAETHEEKUL,3,0 - 0,,"2,620 / 3"
370,371,DEN DEN,Mathias BAY-SMIDT Nanna VESTERGAARD,3,0 - 0,,"2,600 / 3"
371,372,UZB UZB,Amrullo BAKHSHULLAEV Anait KHURSHUDYAN,3,0 - 0,,"2,590 / 5"
372,373,NZL NZL,Kevin DENNERLY-MINTURN Danielle TAHURI,3,0 - 0,,"2,590 / 2"
373,373,INA INA,Afiat Yuris WIRAWAN Jenna GOZALI,3,0 - 0,,"2,590 / 2"
374,373,CHN CHN,YU Xiaoyu ZHU Mai Ci,3,0 - 0,,"2,590 / 2"
375,373,SUI BUL,Gilles TRIPET Diana DIMOVA,3,0 - 0,,"2,590 / 2"
376,377,CRO CRO,Zvonimir DURKINJAK Mateja CICA,3,0 - 0,,"2,500 / 1"
377,377,TPE TPE,Chia-Han LEE Chia Hsin LEE,3,0 - 0,,"2,500 / 1"
378,377,DEN DEN,Nicklas MATHIASEN Cecilie BJERGEN,3,0 - 0,,"2,500 / 1"
379,380,JPN JPN,Tomoya TAKASHINA Rie ETOH,3,0 - 0,,"2,440 / 2"
380,381,CRO CRO,Igor CIMBUR Stasa POZNANOVIC,3,0 - 0,,"2,390 / 3"
381,381,POL POL,Milosz BOCHAT WITEK MAGDALENA,3,0 - 0,,"2,390 / 3"
382,383,FRA FRA,Vincent ESPEN Manon KRIEGER,3,0 - 0,,"2,350 / 5"
383,384,MAS MAS,"Zhen Ting LIM Peiy Yee, Payee LIM",3,0 - 0,,"2,320 / 3"
384,385,TUR TUR,Muhammed Ali KURT Kader İNAL,4,0 - 0,,"2,300 / 2"
385,385,BOT BOT,Orideetse THELA Botho MAKUBATE,4,0 - 0,,"2,300 / 2"
386,387,SLO SLO,Miha IVANIC Lia SALEHAR,5,0 - 0,,"2,290 / 2"
387,387,PHI PHI,Christian BERNARDO Eleanor Christine INLAYO,361,0 - 0,,"2,290 / 2"
388,387,UZB BLR,Artyom SAVATYUGIN Alesia ZAITSAVA,361,0 - 0,,"2,290 / 2"
389,387,PER PER,Daniel LA TORRE REGAL Camilla GARCIA,5,0 - 0,,"2,290 / 2"
390,387,UZB RUS,Artyom SAVATYUGIN Polina VORONKO,-118,0 - 0,,"2,290 / 2"
391,392,POL POL,Maciej DABROWSKI Weronika GRUDZINA,2,0 - 0,,"2,280 / 3"
392,393,NZL NZL,Benjamin HILLIER Selena WU,2,0 - 0,,"2,270 / 2"
393,394,FIN FIN,Marko PYYKONEN Mathilda LINDHOLM,2,0 - 0,,"2,260 / 4"
394,395,SUI SUI,Pierrick DESCHENAUX Tiffany GIRONA,-115,0 - 0,,"2,240 / 6"
395,396,INA INA,Drajat BENO Yulfira BARKAH,1,0 - 0,,"2,230 / 2"
396,397,IND IND,Kamaldeep SINGH Smriti NAGARKOTI,1,0 - 0,,"2,220 / 1"
397,397,IND IND,Rishabh SAHDEV Mohita SAHDEV,1,0 - 0,,"2,220 / 1"
398,397,IND IND,Varun SHARMA Rachita SAHDEV,1,0 - 0,,"2,220 / 1"
399,397,IND IND,Rajat RATHORE Parssa NAQVI,1,0 - 0,,"2,220 / 1"
400,397,DEN DEN,Joachim FISCHER NIELSEN Marie ROEPKE,1,0 - 0,,"2,220 / 1"
401,397,UZB UZB,Amrullo BAKHSHULLAEV Valeriya MUSHTAKOVA,1,0 - 0,,"2,220 / 1"
402,397,MAC MAC,WONG Chi Chong Teng Iok U,1,0 - 0,,"2,220 / 1"
403,397,CHN CHN,WANG YILYU XIA Huan,1,0 - 0,,"2,220 / 1"
404,397,FRA FRA,Sebastien VINCENT Andréa VANDERSTUKKEN,1,0 - 0,,"2,220 / 1"
405,397,KAZ KAZ,Artur NIYAZOV Ilyana FILIPCHUK,-9,0 - 0,,"2,220 / 1"
406,407,ENG ENG,James LAUDER Ira BANERJEE,0,0 - 0,,"2,210 / 2"
407,407,ENG ENG,Scott P WILLIAMS Jessica HOPTON,0,0 - 0,,"2,210 / 2"
408,407,ENG ENG,Matthew CLARE Devon MINNIS,0,0 - 0,,"2,210 / 2"
409,407,TPE TPE,Yi-Hsiang YANG Yu Chen CHANG,0,0 - 0,,"2,210 / 2"
410,407,TPE TPE,HUNG Ying Yuan CHEN Hung Yu,0,0 - 0,,"2,210 / 2"
411,412,DEN DEN,David DAUGAARD Mai SURROW,0,0 - 0,,"2,200 / 3"
412,413,RUS RUS,Konstantin ABRAMOV Natalia Rogova,0,0 - 0,,"2,200 / 1"
413,413,JPN JPN,Akira KOGA Yuki FUKUSHIMA,0,0 - 0,,"2,200 / 1"
414,413,JPN JPN,Takuto INOUE Naru SHINOYA,0,0 - 0,,"2,200 / 1"
415,413,DEN DEN,David DAUGAARD Maria HELSBOL,0,0 - 0,,"2,200 / 1"
416,413,TPE TPE,LU Ching Yao CHIANG Kai Hsin,0,0 - 0,,"2,200 / 1"
417,413,TPE TPE,HUANG Po Jui WU Fang Chien,0,0 - 0,,"2,200 / 1"
418,413,CHN CHN,GAO Xiangcheng WU Qianqian,0,0 - 0,,"2,200 / 1"
419,413,CHN CHN,GUO Yuchen ZHENG Yuwen,0,0 - 0,,"2,200 / 1"
420,413,THA THA,Wasapon UTTAMANG Thanaporn KIAWCHA-ON,0,0 - 0,,"2,200 / 1"
421,413,IND IND,S. Sanjeeth G. M. Nischitha,0,0 - 0,,"2,200 / 1"
422,413,IND IND,Chirag SHETTY Kuhoo GARG,0,0 - 0,,"2,200 / 1"
423,413,IND IND,KONA Tarun Prajakta SAWANT,0,0 - 0,,"2,200 / 1"
424,413,ITA ESP,Wisnu Haryo PUTRO Laia OSET,0,0 - 0,,"2,200 / 1"
425,413,IND IND,Satinder MALIK Kristi DAS,0,0 - 0,,"2,200 / 1"
426,413,INA INA,Rian SWASTEDIAN Nisak Puji LESTARI,0,0 - 0,,"2,200 / 1"
427,413,INA INA,Hardianto HARDIANTO Maretha Dea GIOVANI,0,0 - 0,,"2,200 / 1"
428,413,MAS MAS,Ren Cong CHAN Lyddia Yi Yu CHEAH,0,0 - 0,,"2,200 / 1"
429,413,TPE TPE,HUNG Ying Yuan YANG Ching Tun,0,0 - 0,,"2,200 / 1"
430,413,JPN JPN,Takuro HOKI Kurumi YONAO,0,0 - 0,,"2,200 / 1"
431,413,INA INA,Agripinna Prima Rahmanto PUTRA Ririn AMELIA,0,0 - 0,,"2,200 / 1"
432,413,INA INA,Afiat Yuris WIRAWAN Ririn AMELIA,0,0 - 0,,"2,200 / 1"
433,413,THA THA,Pakkawat VILAILAK Phataimas MUENWONG,0,0 - 0,,"2,200 / 1"
434,413,THA THA,Takdanai BOONRAWD Kilasu OSTERMEYER,0,0 - 0,,"2,200 / 1"
435,413,USA USA,Mathew FOGARTY Lina TAFT,0,0 - 0,,"2,200 / 1"
436,413,CHN CHN,LI Junhui OU Dongni,0,0 - 0,,"2,200 / 1"
437,413,THA THA,Nipitphon PUANGPUAPECH Savitree AMITRAPAI,0,0 - 0,,"2,200 / 1"
438,413,CZE CZE,Milan LUDIK Kristina GAVNHOLT,0,0 - 0,,"2,200 / 1"
439,440,SWE SWE,Christian PETTERSON Amanda ANDERN,0,0 - 0,,"2,190 / 4"
440,441,SVK SVK,Matej HLINICAN Jana CIZNAROVA,0,0 - 0,,"2,183 / 1"
441,442,NOR NOR,Fredrik KRISTENSEN Natalie SYVERTSEN,0,0 - 0,,"2,170 / 4"
442,443,MAS SUI,Beryno Jiann Tze WONG Ayla HUSER,0,0 - 0,,"2,160 / 3"
443,444,THA THA,Tinn ISRIYANATE Savitree AMITRAPAI,0,0 - 0,,"2,130 / 1"
444,444,TUR TUR,Serdar KOCA Emine DEMIRTAS,0,0 - 0,,"2,130 / 1"
445,444,DEN DEN,Maja RINDSHOEJ Kristoffer KNUDSEN,0,0 - 0,,"2,130 / 1"
446,444,DEN DEN,Lasse MOELHEDE Trine VILLADSEN,0,0 - 0,,"2,130 / 1"
447,444,RSA RSA,Prakash VIJAYANATH Stacey DOUBELL,0,0 - 0,,"2,130 / 1"
448,444,ETH ETH,Asnake Getachew SAHILU Yerusksew Legssey TURA,0,0 - 0,,"2,130 / 1"
449,444,JOR JOR,Bahaedeen Ahmad ALSHANNIK Domou AMRO,0,0 - 0,,"2,130 / 1"
450,451,IND IND,Dinesh CHAUDHRY Lalita DAHIYA,-1,0 - 0,,"2,110 / 1"
451,451,JPN JPN,Kenya MITSUHASHI Chisato HOSHI,-1,0 - 0,,"2,110 / 1"
452,451,JAM JAM,Dayvon REID Ruth WILLIAMS,-1,0 - 0,,"2,110 / 1"
453,451,AUS AUS,Edwin LUK Ruwindi SERASINGHE,-1,0 - 0,,"2,110 / 1"
454,451,AUS AUS,Simon Wing Hang LEUNG Claudia LAM,-1,0 - 0,,"2,110 / 1"
455,451,NZL NZL,Brock MATHESON Rebecca GODDARD,-1,0 - 0,,"2,110 / 1"
456,451,CAN CAN,Felix DEBLOIS-BEAUCAGE Nadianie OUAQOUAQ-BERGERON,-1,0 - 0,,"2,110 / 1"
457,451,NED NED,Ruben JILLE Iris TABELING,-1,0 - 0,,"2,110 / 1"
458,451,HKG HKG,YEUNG Shing Choi CHAN Hung Yung,-1,0 - 0,,"2,110 / 1"
459,451,JPN JPN,Kenta KAZUNO Yui MIYAUCHI,-1,0 - 0,,"2,110 / 1"
460,451,THA THA,Viriyangkura TANUPAT Pacharapun CHOCHUWONG,-128,0 - 0,,"2,110 / 1"
461,451,ENG WAL,Conor BAMBRICK Aimee MORAN,-1,0 - 0,,"2,110 / 1"
462,463,IND IND,Harinder MALIK Teenu DAHIYA,-2,0 - 0,,"2,100 / 2"
463,463,IND IND,Gaurav KALIA Ekta KALIA,-2,0 - 0,,"2,100 / 2"
464,463,INA INA,Didit JUANG Keshya Nurvita HANADIA,-2,0 - 0,,"2,100 / 2"
465,463,THA THA,Songphon ANUGRITAYAWON Kunchala VORAVICHITCHAIKUL,-2,0 - 0,,"2,100 / 2"
466,467,SRB SRB,Dragoslav PETROVIC Milica SIMIC,-1,0 - 0,,"2,090 / 3"
467,468,VIE VIE,Minh BAO Thi Thanh Thuy LE,-1,0 - 0,,"2,080 / 3"
468,469,THA THA,Pakin KUNA-ANUVIT Kwanchanok SUDJAIPRAPARAT,-1,0 - 0,,"2,070 / 2"
469,469,PER PER,Diego MINI Paula LA TORRE REGAL,-1,0 - 0,,"2,070 / 2"
470,469,CHI CHI,Cristian ARAYA Camila MACAYA,-1,0 - 0,,"2,070 / 2"
471,472,BLR BLR,Dzmitry SAIDAKOU Alesia ZAITSAVA,-1,0 - 0,,"2,020 / 5"
472,473,NZL NZL,Dhanny OUD Jasmin Chung Man NG,0,0 - 0,,"1,960 / 3"
473,474,NZL NZL,Dylan SOEDJASA Justine VILLEGAS,0,0 - 0,,"1,950 / 2"
474,474,NZL NZL,Maoni HU HE Ashleigh KARL,0,0 - 0,,"1,950 / 2"
475,476,TPE TPE,HUNG Ying Yuan CHIANG Kai Hsin,1,0 - 0,,"1,910 / 2"
476,477,NZL NZL,Thomas ELLIS Samantha MCCAMISH,1,0 - 0,,"1,890 / 2"
477,478,THA THA,Wannawat AMPUNSUWAN Pacharapun CHOCHUWONG,881,0 - 0,,"1,880 / 2"
478,479,TPE TPE,Yu Chieh HSU Chih Chen LEE,269,0 - 0,,"1,840 / 2"
479,479,INA INA,Indra LESMANA Hera DESI,0,0 - 0,,"1,840 / 2"
480,479,FRA CRO,Gregor DUNIKOWSKI Maja PAVLINIC,0,0 - 0,,"1,840 / 2"
481,479,TPE TPE,Chi-Hung LIAO Ling Fang HU,0,0 - 0,,"1,840 / 2"
482,479,NGR NGR,Kayode OLATUNJI Zainab AKINYEMI,0,0 - 0,,"1,840 / 2"
483,479,NGR NGR,Godwin OLOFUA Oluwatosin SOLADEMI,0,0 - 0,,"1,840 / 2"
484,479,NGR NGR,Kayode Samuel OYENIRAN Zainab MOMOH,0,0 - 0,,"1,840 / 2"
485,479,NGR NGR,Idowu Timothy ADEKUNLE Asisat OGUNKANBI,0,0 - 0,,"1,840 / 2"
486,479,MAS MAS,Khek Wei CHUA Yen Wei PECK,-180,0 - 0,,"1,840 / 2"
487,479,BRA BRA,Artur Silva POMOCENO Ana Paula CAMPOS,0,0 - 0,,"1,840 / 2"
488,489,TPE TPE,Hsuan Wen CHANG Tzu Chin PAN,0,0 - 0,,"1,830 / 3"
489,489,TPE TPE,En Chia CHANG Ya Ting CHIANG,0,0 - 0,,"1,830 / 3"
490,491,TPE TPE,Yu-Hua LAI Shuo Yun SUNG,0,0 - 0,,"1,800 / 5"
491,492,FRA FRA,Thom GICQUEL Vimala HERIAU,0,0 - 0,,"1,770 / 2"
492,492,RUS RUS,Kirill Romanuk Anna ASTRAKHANTSEVA,0,0 - 0,,"1,770 / 2"
493,494,ENG ENG,David KING Nicola GRESTY,0,0 - 0,,"1,760 / 2"
494,495,INA INA,Hendrik K CLINTON Phita Haningtyas MENTARI,0,0 - 0,,"1,750 / 1"
495,495,WAL WAL,Daniel FONT Carissa TURNER,0,0 - 0,,"1,750 / 1"
496,495,MRI MRI,Aatish LUBAH Kobita DOKHEE,0,0 - 0,,"1,750 / 1"
497,495,INA INA,Ramadiansyah ANDIKA Mychelle Crhystine BANDASO,0,0 - 0,,"1,750 / 1"
498,495,FIN FIN,Arttu MAHONEN Sonja PEKKOLA,0,0 - 0,,"1,750 / 1"
499,495,INA INA,Akbar Bintang CAHYONO Nugraheny RISTYA AYU,0,0 - 0,,"1,750 / 1"
500,495,JAM JAM,Willroy MILES Katherine WYNTER,0,0 - 0,,"1,750 / 1"
501,495,JAM JAM,Dennis COKE Mikaylia HALDANE,0,0 - 0,,"1,750 / 1"
502,495,TUR TUR,Burak Furkan DEMIR Büşra BENK,816,0 - 0,,"1,750 / 1"
503,495,ZAM ZAM,Ngosa CHONGO Ogar SIAMUPANGILA,0,0 - 0,,"1,750 / 1"
504,495,MEX MEX,Vicente CISNEROS Adelina QUIÑONES,0,0 - 0,,"1,750 / 1"
505,495,NGR NGR,Victor MAKANJU Augustina EBHOMIEN SUNDAY,0,0 - 0,,"1,750 / 1"
506,495,ETH ETH,YAKOB Surafel Tigist GETACHEW,0,0 - 0,,"1,750 / 1"
507,495,TPE TPE,Cheng Heng SU HUANG Mei Ching,0,0 - 0,,"1,750 / 1"
508,495,ISR ISR,Yonathan LEVIT Yana MOLODEZKI,-34,0 - 0,,"1,750 / 1"
509,495,TUR TUR,Bahadir Kaan KOLA Busra YALÇINKAYA,-19,0 - 0,,"1,750 / 1"
510,495,JOR JOR,Bani Mustafa HASAN ALI Mazahreh LEINA FEHMI,0,0 - 0,,"1,750 / 1"
511,495,ETH ETH,ASRAR Seid BELETE Melat,0,0 - 0,,"1,750 / 1"
512,495,MAR MAR,Hamza HOUMIDA Harag NAZIK,0,0 - 0,,"1,750 / 1"
513,495,SUR SUR,Dylan DARMOHOETOMO Rugshaar ISHAAK,0,0 - 0,,"1,750 / 1"
514,495,NED NED,Jelle MAAS Ilse VAESSEN,0,0 - 0,,"1,750 / 1"
515,495,NGR NGR,Olorunfemi ELEWA Braimoh MARIA,0,0 - 0,,"1,750 / 1"
516,517,TPE TPE,Chia Hung LU Su Yu CHEN,-3,0 - 0,,"1,730 / 2"
517,518,DEN FRA,Soeren TOFT HANSEN Teshana VIGNES WARAN,-3,0 - 0,,"1,700 / 1"
518,519,TPE TPE,CHENG Po Wei Chien Hui YU,-3,0 - 0,,"1,690 / 4"
519,520,CHN CHN,LIU Yuchen ZHONG Qianxin,-3,0 - 0,,"1,670 / 1"
520,520,CHN CHN,HE Jiting JIA Yifan,-3,0 - 0,,"1,670 / 1"
521,520,AUS AUS,Alphonsus NG Ruwindi SERASINGHE,-3,0 - 0,,"1,670 / 1"
522,520,NZL NZL,Brock MATHESON Angie LEUNG,-3,0 - 0,,"1,670 / 1"
523,520,NZL TPE,Joe WU HUNG Shih Han,-3,0 - 0,,"1,670 / 1"
524,520,CHN CHN,LI Junhui ZHONG Qianxin,-3,0 - 0,,"1,670 / 1"
525,520,TPE TPE,LU Chia Pin Chien Hui YU,-3,0 - 0,,"1,670 / 1"
526,520,FRA FRA,Bastian KERSAUDY Lorraine BAUMANN,-3,0 - 0,,"1,670 / 1"
527,520,FRA FRA,Ronan GUEGUIN Joanna CHAUBE,-3,0 - 0,,"1,670 / 1"
528,520,IND IND,Dinesh CHAUDHRY Rucha NIKAM,-3,0 - 0,,"1,670 / 1"
529,520,IND IND,Shivam SHARMA Sanskriti CHHABRA,-3,0 - 0,,"1,670 / 1"
530,520,MAS MAS,Khim Wah LIM Meng Yean LEE,-3,0 - 0,,"1,670 / 1"
531,520,HKG HKG,LAW Cheuk Him NG Wing Yung,-3,0 - 0,,"1,670 / 1"
532,520,GER INA,Jones Ralfy JANSEN Nadya MELATI,-3,0 - 0,,"1,670 / 1"
533,520,CHN CHN,CHEN Zhuofu YU Xiaohan,-3,0 - 0,,"1,670 / 1"
534,520,INA INA,Richard KUNCORO Mega Cahya Purnama LESTARI,-3,0 - 0,,"1,670 / 1"
535,520,INA INA,Supriadi Tedi Mychelle Crhystine BANDASO,-3,0 - 0,,"1,670 / 1"
536,520,INA INA,Jeka WIRATAMA Marsheilla Gischa ISLAMI,-3,0 - 0,,"1,670 / 1"
537,520,INA INA,Angger SUDRAJAT Felicia PAREMNAS,-3,0 - 0,,"1,670 / 1"
538,520,INA INA,Rian SWASTEDIAN Mahadewi Istirani NI KETUT,-3,0 - 0,,"1,670 / 1"
539,520,INA INA,Akbar Bintang CAHYONO Rahmadhani Hasiyanti PUTRI,-3,0 - 0,,"1,670 / 1"
540,520,INA INA,Tri KUSHARJANTO Keshya Nurvita HANADIA,-3,0 - 0,,"1,670 / 1"
541,520,INA INA,Achmad RIVAI Aris BUDIHARTI,-3,0 - 0,,"1,670 / 1"
542,520,TPE TPE,LIANG Jui Wei Chia Hsin LEE,-3,0 - 0,,"1,670 / 1"
543,520,KOR KOR,KANG Ji Wook EOM Hye Won,-3,0 - 0,,"1,670 / 1"
544,545,SLO SLO,Luka PETRIC Tina KODRIC,-3,0 - 0,,"1,655 / 2"
545,546,NZL NZL,Kent PALMER Emma CHAPPLE,-2,0 - 0,,"1,610 / 2"
546,546,VIE VIE,Thanh Long TRUONG Kim Ngan DANG,-2,0 - 0,,"1,610 / 2"
547,546,TPE TPE,Hsiao-Lin WU Tsun Yu LIN,-2,0 - 0,,"1,610 / 2"
548,549,TPE TPE,LIANG Jui Wei Yu Chieh CHENG,-2,0 - 0,,"1,580 / 2"
549,550,NGR NGR,Joshua Adeyemi ODELABI Fatima AZEEZ,-2,0 - 0,,"1,520 / 1"
550,550,NGR NGR,Folorunsho Ilesanmi OPEYORI Olabisi IBIYEYE,-2,0 - 0,,"1,520 / 1"
551,550,RUS RUS,Sergey SCHERBIN Anastasia NAZARCHUK,-2,0 - 0,,"1,520 / 1"
552,550,MAS MAS,Ahmad Maziri MAZLAN Sannatasah SANIRU,-2,0 - 0,,"1,520 / 1"
553,550,PER PER,Javier JIMENO Sandra JIMENO GOICOCHEA,-2,0 - 0,,"1,520 / 1"
554,550,KOR KOR,CHUNG Eui Seok Hee Yong KONG,-2,0 - 0,,"1,520 / 1"
555,550,JPN JPN,Kento SAKAI Hikari SAITO,-2,0 - 0,,"1,520 / 1"
556,550,THA THA,Trawut POTIENG Pacharapun CHOCHUWONG,-2,0 - 0,,"1,520 / 1"
557,550,THA THA,Parinyawat THONGNUAM Chaladchalam Chayanit,-2,0 - 0,,"1,520 / 1"
558,550,SIN SIN,Bimo Adi PRAKOSO Yu Yan Vanessa NEO,-2,0 - 0,,"1,520 / 1"
559,550,GUA PER,Rodolfo RAMIREZ Camila DUANY,-2,0 - 0,,"1,520 / 1"
560,550,ENG GER,Matthew NOTTINGHAM Jennifer KARNOTT,-2,0 - 0,,"1,520 / 1"
561,550,CHN CHN,YU Chen XIA Chunyu,-2,0 - 0,,"1,520 / 1"
562,550,NZL TPE,Oliver LEYDON-DAVIS WU Fang Chien,-2,0 - 0,,"1,520 / 1"
563,550,CHN CHN,LI Xun LI Yinhui,-2,0 - 0,,"1,520 / 1"
564,550,TPE TPE,Shang Kai LIN Ying Chun LIN,-2,0 - 0,,"1,520 / 1"
565,550,CHN CHN,ZHOU Haodong CHEN Lu,-2,0 - 0,,"1,520 / 1"
566,550,CHN CHN,ZHAO Jian JIANG Binbin,-2,0 - 0,,"1,520 / 1"
567,550,CHN CHN,OU Zhe CHEN Xiaofei,-2,0 - 0,,"1,520 / 1"
568,550,INA SWE,Wibowo SETYALDI PUTRA Cecilia BJUNER,-2,0 - 0,,"1,520 / 1"
569,550,THA THA,Pasin SONGHONG Sararat CHUEBOCA,-2,0 - 0,,"1,520 / 1"
570,550,INA INA,Fachriza ABIMANYU Phita Haningtyas MENTARI,-2,0 - 0,,"1,520 / 1"
571,550,INA INA,Hendrik K CLINTON Zarra Faza AZKA,-2,0 - 0,,"1,520 / 1"
572,550,IND IND,Abhinav PRAKASH Nimmi PATEL,-2,0 - 0,,"1,520 / 1"
573,550,BAN BAN,Mohammed Jabed MOSTAFA Alina SULTANA,-2,0 - 0,,"1,520 / 1"
574,550,NEP NEP,Indra MEHATA Meena SHRESTHA,-2,0 - 0,,"1,520 / 1"
575,550,NEP NEP,Pankaj CHAND Amita GIRI,-2,0 - 0,,"1,520 / 1"
576,550,BAN BAN,Tushar Krishna ROY MST Rehana PARVIN,-2,0 - 0,,"1,520 / 1"
577,550,TPE WAL,Hsuan Ming LEE Carissa TURNER,-2,0 - 0,,"1,520 / 1"
578,550,WAL WAL,Oliver GWILT Emilie GWILT,-2,0 - 0,,"1,520 / 1"
579,550,ENG ENG,Joel DOUSE Paige BUTLER,-2,0 - 0,,"1,520 / 1"
580,550,SCO ENG,Matthew CARDER Lexi GILDERS,-2,0 - 0,,"1,520 / 1"
581,550,TPE TPE,LIN Chia Yu Ya-Han CHANG,-2,0 - 0,,"1,520 / 1"
582,550,TPE TPE,Cheng Heng SU YU Min Ju,-2,0 - 0,,"1,520 / 1"
583,550,USA GER,Hendri WINARTO Cisita Joity JANSEN,-2,0 - 0,,"1,520 / 1"
584,550,INA INA,Andre Kurniawan TEDJONO Aprilsasi Putri LEJARSAR VARIELLA,-2,0 - 0,,"1,520 / 1"
585,550,BUL NED,Alex VLAAR Alida CHEN,-2,0 - 0,,"1,520 / 1"
586,550,GER NED,Raphael BECK Iris TABELING,-2,0 - 0,,"1,520 / 1"
587,550,CHN CHN,BAO Zi Long DING Kexin,-2,0 - 0,,"1,520 / 1"
588,550,CHN CHN,QI Shuang Shuang TONG Hao,-2,0 - 0,,"1,520 / 1"
589,550,AUS AUS,Ben GOMEZ Jessica LIM,-2,0 - 0,,"1,520 / 1"
590,550,AUS AUS,Cham CHEN Claudia LAM,-2,0 - 0,,"1,520 / 1"
591,550,AUS AUS,Bosco Lap-Chi KWOK Christine HE,-2,0 - 0,,"1,520 / 1"
592,550,GUA USA,Adams RODRIGUEZ Crystal PAN,-2,0 - 0,,"1,520 / 1"
593,550,RUS RUS,Aleksandr VASILKIN Kristina VIRVICH,-2,0 - 0,,"1,520 / 1"
594,550,UKR UKR,Gennadiy NATAROV Natalya VOYTSEKH,-2,0 - 0,,"1,520 / 1"
595,550,JPN JPN,Daisuke SUZUKI Midori SAKURAI,-2,0 - 0,,"1,520 / 1"
596,550,JPN JPN,Naoki ISHIKAWA Atsuko KOIKE,-2,0 - 0,,"1,520 / 1"
597,550,AUS AUS,Anthony JOE Lee Yen KHOO,-2,0 - 0,,"1,520 / 1"
598,550,AUS AUS,Mitchell WHELLER Melinda SUN,-2,0 - 0,,"1,520 / 1"
599,550,CAN CAN,Andrew LAU Danica LAU,-2,0 - 0,,"1,520 / 1"
600,550,MAS MAS,Kar Seong SOO Harn Xin YAP,-2,0 - 0,,"1,520 / 1"
601,550,FRA FRA,Thomas ROUXEL Lea PALERMO,-2,0 - 0,,"1,520 / 1"
602,550,BRA BRA,Luiz dos SANTOS JR Ana Paula CAMPOS,-2,0 - 0,,"1,520 / 1"
603,550,SRI SRI,Hasitha Chanaka MANANI HEWA Kavindi Ishandika SIRIMANNAGE,-2,0 - 0,,"1,520 / 1"
604,550,UKR UKR,Vitaly KONOV Yelyzaveta ZHARKA,-2,0 - 0,,"1,520 / 1"
605,550,RUS RUS,Tatjana BIBIK Nikolai UKK,-2,0 - 0,,"1,520 / 1"
606,607,THA THA,Natchanon TULAMOK Pattaranan CHAMNAKTAN,-2,0 - 0,,"1,470 / 2"
607,607,DOM DOM,Nelson JAVIER Bermary Altagracia POLANCO MUNOZ,-2,0 - 0,,"1,470 / 2"
608,607,CHI CHI,Bastian LIZAMA Niria BAEZA,-2,0 - 0,,"1,470 / 2"
609,607,TPE TPE,Chia-Han LEE Wen Chi HSU,141,0 - 0,,"1,470 / 2"
610,607,INA INA,Fachriza ABIMANYU Syifa FAUZIAH,19,0 - 0,,"1,470 / 2"
611,607,SLO SLO,Martin CERKOVNIK Ana Marija SETINA,-2,0 - 0,,"1,470 / 2"
612,607,AUT CZE,Dominik STIPSITS Katerina TOMALOVA,-2,0 - 0,,"1,470 / 2"
613,607,PER PER,Leonardo ISA Chiara CARRANZA,-2,0 - 0,,"1,470 / 2"
614,607,SWE SWE,Emil WELINDER Alexandra DERLE,-2,0 - 0,,"1,470 / 2"
615,607,DEN DEN,Steve OLESEN Anna KLINKE,-2,0 - 0,,"1,470 / 2"
616,607,BUL BUL,Illian KRASTEV Dimitria POPSTOIKOVA,141,0 - 0,,"1,470 / 2"
617,607,INA INA,Indra Viki OKVANA Rosy Oktavia PANCASARI,-2,0 - 0,,"1,470 / 2"
618,607,TUR TUR,Berk AVCI Sevval Buse ALSOY,137,0 - 0,,"1,470 / 2"
619,607,MLT MLT,Samuel CALI SADOWSKI Fiorella Marie,-2,0 - 0,,"1,470 / 2"
620,621,POL POL,Maciej OCIEPA GAJOS KAROLINA,-6,0 - 0,,"1,460 / 3"
621,622,PHI PHI,Paul Jefferson VIVAS Jessie FRANCISCO,-6,0 - 0,,"1,460 / 2"
622,623,FRA FRA,Toma Junior POPOV Yaelle HOYAUX,-319,0 - 0,,"1,450 / 3"
623,624,EST EST,Mihkel LAANES Kristin KUUBA,-3,0 - 0,,"1,410 / 3"
624,625,DOM DOM,Alberto RAPOSO Licelott SANCHEZ,-3,0 - 0,,"1,410 / 2"
625,626,FIN FIN,Anton KAISTI Jenny NYSTROM,-3,0 - 0,,"1,394 / 1"
626,627,WAL WAL,Nicolas STRANGE Jordan HART,-3,0 - 0,,"1,380 / 3"
627,628,CZE CZE,Bedrich VALENTA Veronika KOLDOVA,-3,0 - 0,,"1,370 / 3"
628,629,THA THA,Watchara BURANAKUEA Chaladchalam Chayanit,0,0 - 0,,"1,370 / 1"
629,629,TUR TUR,Mehmet OZTURK Kurba OZTURK,0,0 - 0,,"1,370 / 1"
630,629,FRA FRA,Jordan CORVEE Anne TRAN,0,0 - 0,,"1,370 / 1"
631,629,RUS RUS,Nikita FEDOTOVSKIKH Lela MINADZE,0,0 - 0,,"1,370 / 1"
632,629,RSA RSA,Cameron COETZER Sandra LE GRANGE,-3,0 - 0,,"1,370 / 1"
633,629,BAR CZE,Sabeel FOSTER Marcela RUZICKA,-3,0 - 0,,"1,370 / 1"
634,629,TRI TRI,Will LEE Avril PLAZA MARCELLE,-3,0 - 0,,"1,370 / 1"
635,629,CZE TRI,Jan FROHLICH Kamasha ROBERTSON,-3,0 - 0,,"1,370 / 1"
636,629,INA INA,Yantoni Edy SAPUTRA Marsheilla Gischa ISLAMI,-3,0 - 0,,"1,370 / 1"
637,629,MAS MAS,Sze Fei GOH Mei Xing TEOH,-3,0 - 0,,"1,370 / 1"
638,629,SWE SWE,Paul OHLSSON Berfin ASLAN,-3,0 - 0,,"1,370 / 1"
639,629,CHI CHI,Bastian LIZAMA Tingting CHOU,-3,0 - 0,,"1,370 / 1"
640,629,INA GER,Maziyyah NADHIR Ari TRISNANTO,-3,0 - 0,,"1,370 / 1"
641,629,INA INA,Supriadi Tedi Ririn AMELIA,-3,0 - 0,,"1,370 / 1"
642,629,INA INA,Arya Maulana ADIARTAMA Surya DELLA AUGUSTIA,-3,0 - 0,,"1,370 / 1"
643,629,SIN SIN,Kean Yew LOH Ai Ninna TAN,-3,0 - 0,,"1,370 / 1"
644,629,DEN DEN,Mathias Lund HANSEN Cecilie FINNE-IPSEN,-3,0 - 0,,"1,370 / 1"
645,629,FRA FRA,Toma Junior POPOV Delphine DELRUE,-3,0 - 0,,"1,370 / 1"
646,629,BOT BOT,Tlhoego CHAMO MALEPA Dintle,-3,0 - 0,,"1,370 / 1"
647,629,RSA RSA,Jason COETZER Karen COETZER,-3,0 - 0,,"1,370 / 1"
648,629,DEN DEN,Theodor JOHANSEN Josephine VAN ZAANE,-3,0 - 0,,"1,370 / 1"
649,629,NED CRO,Koen RIDDER Stasa POZNANOVIC,-3,0 - 0,,"1,370 / 1"
650,629,NED GRE,Dennis VAN BEKKUM Ioanna KARKANTZIA,-3,0 - 0,,"1,370 / 1"
651,629,MAR MAR,Omar KESIKES Jinane BITARIE,-3,0 - 0,,"1,370 / 1"
652,629,MEX MEX,Victor Manuel RAMIREZ Cassandra RIVERO,-3,0 - 0,,"1,370 / 1"
653,629,MEX MEX,Bruno MENDEZ Yaqueline DUARTE,-3,0 - 0,,"1,370 / 1"
654,629,DEN DEN,Mathias WEBER ESTRUP Cecilie FINNE-IPSEN,-3,0 - 0,,"1,370 / 1"
655,629,NGR NGR,Habeeb Temitope BELLO Ruth AIYENUGBA,-3,0 - 0,,"1,370 / 1"
656,629,NGR NGR,Paul FAGBEMI Ketu ILOFUAN,-3,0 - 0,,"1,370 / 1"
657,629,BLR ISR,Dmitriy SUPRUNIUK Margeret LURIE,-3,0 - 0,,"1,370 / 1"
658,629,ETH ETH,TEKLU Endale TADESSE Samrawit,-3,0 - 0,,"1,370 / 1"
659,629,MAS MAS,Beng Hong KUAN Sin Er NG,-3,0 - 0,,"1,370 / 1"
660,629,CRC CRC,Gianpiero CAVALLOTTI Lauren VILLALOBOS,-3,0 - 0,,"1,370 / 1"
661,629,COL COL,Raul PINEDA RODRIGUEZ Maria Julieth PEREZ TANGARIFE,-3,0 - 0,,"1,370 / 1"
662,629,AUS AUS,Matthew CHAU Setyana MAPASA,-3,0 - 0,,"1,370 / 1"
663,629,TUR TUR,Kubilay SADI Yaren DOLCU,100,0 - 0,,"1,370 / 1"
664,629,GRE GRE,George GALVAS Zoi ALELI,-3,0 - 0,,"1,370 / 1"
665,629,MRI MRI,Yeldy Marie LOUISON Denneshsing BABOOLALL,-3,0 - 0,,"1,370 / 1"
666,629,SUI SUI,Gilles TRIPET Tiffany GIRONA,-3,0 - 0,,"1,370 / 1"
667,629,DEN DEN,Mikkel STOFFERSEN Mathilde BJERGEN,-3,0 - 0,,"1,370 / 1"
668,629,DEN DEN,Mathias Lund HANSEN Emilie FURBO,-3,0 - 0,,"1,370 / 1"
669,629,GER GER,Tobias WADENKA Kira KATTENBECK,-3,0 - 0,,"1,370 / 1"
670,629,DOM DOM,Miguel MARINEZ Licelott SANCHEZ,-3,0 - 0,,"1,370 / 1"
671,629,INA INA,Yahya Adi KUMARA Rahmadhani Hasiyanti PUTRI,-3,0 - 0,,"1,370 / 1"
672,629,MDV MDV,Mohamed Ajfan RASHEED Aishath Afnaan RASHEED,-3,0 - 0,,"1,370 / 1"
673,629,BOT BOT,Tefo KABOMO Tessa KABELO,-3,0 - 0,,"1,370 / 1"
674,629,TRI TRI,Nicholas BONKOWSKY Kamasha ROBERTSON,-3,0 - 0,,"1,370 / 1"
675,629,PER PER,Sebastian MACIAS Danica NISHIMURA,-3,0 - 0,,"1,370 / 1"
676,629,ISL ISL,Daniel THOMSEN Margrét JOHANNSDOTTIR,-3,0 - 0,,"1,370 / 1"
677,678,RUS RUS,Andrey JDANOV Olesia KISTER,-4,0 - 0,,"1,290 / 1"
678,678,MEX MEX,Antonio OCEGUEDA Sabrina SOLIS,-4,0 - 0,,"1,290 / 1"
679,678,GUY GUY,Narayan RAMDHANI Priyanna RAMDHANI,-4,0 - 0,,"1,290 / 1"
680,678,ESA ESA,GUARDADO Jassiel Fatima Beatriz CENTENO FUENTES,-4,0 - 0,,"1,290 / 1"
681,678,SUR SUR,Dylan DARMOHOETOMO Priscila TJITRODIPO,-4,0 - 0,,"1,290 / 1"
682,678,CAN CAN,Austin James BAUER Joanne Yu CHEN,-4,0 - 0,,"1,290 / 1"
683,678,GUM COK,David YAO Kate SCOTT,-4,0 - 0,,"1,290 / 1"
684,678,COK COK,John TAULU Ngaoa RANGINUI,-4,0 - 0,,"1,290 / 1"
685,678,NZL NZL,Kerwyn LEE Angie LEUNG,-4,0 - 0,,"1,290 / 1"
686,678,NZL NZL,Luke CHARLESWORTH Alyse DERBY,-4,0 - 0,,"1,290 / 1"
687,678,AUS AUS,Mitchell WHELLER Hsuan-Yu Wendy CHEN,-4,0 - 0,,"1,290 / 1"
688,678,USA USA,Ryan CHEW Sydney LEE,-4,0 - 0,,"1,290 / 1"
689,678,TPE TPE,Chi Yu LO HSIEH Pei Chen,-4,0 - 0,,"1,290 / 1"
690,678,USA USA,Rudi GUNAWAN Ariel LEE,-4,0 - 0,,"1,290 / 1"
691,678,TPE TPE,KUO Ching-Hung YU Min Ju,-4,0 - 0,,"1,290 / 1"
692,678,SCO SCO,Alexander DUNN Holly NEWALL,-4,0 - 0,,"1,290 / 1"
693,678,ENG ENG,ROE Michael Rachel VICKERS,-4,0 - 0,,"1,290 / 1"
694,678,TPE TPE,LIANG Jui Wei Ching Hui CHANG,-4,0 - 0,,"1,290 / 1"
695,678,KOR KOR,Seung Gyu BAEK Yong Joo HAN,-4,0 - 0,,"1,290 / 1"
696,678,KOR KOR,Hyuk Gyun CHOI Hye Jeong KIM,-4,0 - 0,,"1,290 / 1"
697,678,TPE TPE,Chia-Hsin WAN Wan Ting CHEN,-4,0 - 0,,"1,290 / 1"
698,678,TPE TPE,YANG Po Han HUANG Mei Ching,-4,0 - 0,,"1,290 / 1"
699,678,TPE TPE,TIEN Tzu Chieh CHIANG Kai Hsin,-4,0 - 0,,"1,290 / 1"
700,678,TPE TPE,Cheng Heng SU Jing Ya YE,-4,0 - 0,,"1,290 / 1"
701,678,INA INA,Christopher RUSDIANTO Nadya MELATI,-4,0 - 0,,"1,290 / 1"
702,678,TPE TPE,Wei Chen LIU Hao Yun WEN,-4,0 - 0,,"1,290 / 1"
703,678,RUS RUS,Vladimir SHIPILENKO Valeriia MAKKOVEEVA,-4,0 - 0,,"1,290 / 1"
704,678,RUS RUS,Mikhail NESTERENKO Daria RADCHENKO,-4,0 - 0,,"1,290 / 1"
705,678,JPN JPN,Takuto INOUE Yuki FUKUSHIMA,-4,0 - 0,,"1,290 / 1"
706,678,VEN VEN,Jesus Manuel SANCHEZ LAMA Damaris Mercedes ORTIZ PARADA,-4,0 - 0,,"1,290 / 1"
707,678,RUS RUS,Konstantin ABRAMOV Irina KHLEBKO,-4,0 - 0,,"1,290 / 1"
708,678,SIN SIN,Kean Hean LOH Dellis YULIANA,-391,0 - 0,,"1,290 / 1"
709,678,KOR KOR,JANG Seung Hoon KO Hyun Jung,-4,0 - 0,,"1,290 / 1"
710,678,ENG ENG,Alex MARRITT Cristen Elizabeth MARRITT,-4,0 - 0,,"1,290 / 1"
711,678,NED NED,Russell MUNS Myke HALKEMA,-4,0 - 0,,"1,290 / 1"
712,678,KOR KOR,KANG Ji Wook JUNG Kyung Eun,-4,0 - 0,,"1,290 / 1"
713,678,GUA GUA,HUMBLERS HEYMARD Nikte Alejandra SOTOMAYOR,-4,0 - 0,,"1,290 / 1"
714,678,AUS AUS,Ashwant GOBINATHAN Louisa MA,-4,0 - 0,,"1,290 / 1"
715,716,PER PER,Bruno BARRUETO DEZA Ines CASTILLO,-5,0 - 0,,"1,280 / 2"
716,716,THA THA,Sirawit SUHARITDUMRONG Savitree AMITRAPAI,-5,0 - 0,,"1,280 / 2"
717,716,THA THA,Warit SARAPAT Ruethaichanok LAISUAN,-5,0 - 0,,"1,280 / 2"
718,719,UKR UKR,Kyryll NESTERENKO Anastasiya DMYTRYSHYN,-5,0 - 0,,"1,270 / 3"
719,720,DEN DEN,Mikkel Kaersgaard HENRIKSEN Emilie JUUL MOLLER,-4,0 - 0,,"1,260 / 3"
720,721,HKG HKG,OR Chin Chung CHAN Kaka Tsz Ka,-4,0 - 0,,"1,220 / 3"
721,722,INA INA,Yehezkiel Fritz MAINAKY Lyanny Alessandra MAINAKY,-4,0 - 0,,"1,180 / 4"
722,723,TPE TPE,Jhe-Huei LEE CHIANG Kai Hsin,-4,0 - 0,,"1,170 / 2"
723,723,HKG HKG,HO Wai Lun YUEN Sin Ying,-4,0 - 0,,"1,170 / 2"
724,725,RUS RUS,Vladimir NIKULOV Ekaterina KUT,-4,0 - 0,,"1,170 / 1"
725,725,DEN LTU,Soeren TOFT HANSEN Gerda VOITECHOVSKAJA,-4,0 - 0,,"1,170 / 1"
726,725,NZL AUS,James EUNSON Alice WU,-4,0 - 0,,"1,170 / 1"
727,728,PHI PHI,Philip Joper ESCUETA Eleanor Christine INLAYO,-2,0 - 0,,"1,160 / 2"
728,729,NZL NZL,Abhinav MANOTA Justine VILLEGAS,-2,0 - 0,,"1,150 / 2"
729,729,EST EST,Kristjan KALJURAND Laura TOMBAND,-2,0 - 0,,"1,150 / 2"
730,731,NGR NGR,Tobi OWOLABI Felicia OMOTOLA,-2,0 - 0,,"1,130 / 2"
731,732,INA INA,Rinov RIVALDY Vania Arianti SUKOCO,-1,0 - 0,,"1,100 / 2"
732,732,TPE TPE,Li-Wei PO Hsin-Yu TSAI,287,0 - 0,,"1,100 / 2"
733,732,SEY SEY,Steve MALCOUZANNE Juliette AH-WAN,-1,0 - 0,,"1,100 / 2"
734,732,FIN FIN,Arttu MAHONEN Annmarie OKSA,-1,0 - 0,,"1,100 / 2"
735,732,ISL ISL,Atli JOHANNESSON Snjolaug JOHANNSDOTTIR,-1,0 - 0,,"1,100 / 2"
736,737,RUS RUS,Vladimir RUSIN Tatjana BIBIK,-194,0 - 0,,"1,090 / 2"
737,737,DEN DEN,Frederik SØGAARD MORTENSEN Sara LUNDGAARD,-1,0 - 0,,"1,090 / 2"
738,737,ESP ESP,Juan Manuel FERNANDEZ QUILES Laura MOLINA,-1,0 - 0,,"1,090 / 2"
739,737,GER GER,Daniel BENZ Annika HORBACH,-1,0 - 0,,"1,090 / 2"
740,737,IRL IRL,Tony MURPHY Jennie KING,-1,0 - 0,,"1,090 / 2"
