,RANK,COUNTRY,PLAYER,CHANGE +/-,WIN - LOSE,PRIZE MONEY,POINTS / TOURNAMENTS
1108,1106,ZAM ZAM,Edgar SIKANIKA Zipporath KAUNDA,-12,0 - 0,,550 / 1
1109,1106,ZAM ZAM,Cephus BANDA Matildah KALANDANYA,-12,0 - 0,,550 / 1
1110,1106,ZAM ZAM,Nevers PHIRI Agness SIMALA,-12,0 - 0,,550 / 1
1111,1106,ZAM ZAM,Joseph BWALYA Muka HAMOONGA,-12,0 - 0,,550 / 1
1112,1106,ZAM ZAM,Shadreck MWANSA Elizaberth MULAUZI,-12,0 - 0,,550 / 1
1113,1106,ZAM ZAM,Mateyo MWANSA Patience MUKOKO,-12,0 - 0,,550 / 1
1114,1106,ZAM ZAM,Humphrey MWABA Ngambi LWISA,-12,0 - 0,,550 / 1
1115,1106,THA HUN,TOVANNAKASEM Samatcha Agnes KOROSI,-12,0 - 0,,550 / 1
1116,1106,FIN FIN,Artturi HELENIUS Mari MIKKONEN,-12,0 - 0,,550 / 1
1117,1106,FIN FIN,Akseli DANSKANEN Anna PAAVOLA,-12,0 - 0,,550 / 1
1118,1106,CRO DEN,Zvonimir DURKINJAK Josephine VAN ZAANE,-12,0 - 0,,550 / 1
1119,1106,SUR SUR,Juan DEL PRADO Mary - Ann ZHONG,-12,0 - 0,,550 / 1
1120,1106,SUR SUR,Jascha ATMODIKROMO Chan YANG,-12,0 - 0,,550 / 1
1121,1106,SUR SUR,Gerald MOHAMAD Priscilla WAARTS,-12,0 - 0,,550 / 1
1122,1106,TRI TRI,Alistair ESPINOZA Avril PLAZA MARCELLE,-12,0 - 0,,550 / 1
1123,1106,SUR SUR,Jair LIEW Cheryl NAI CHUNG TONG,-12,0 - 0,,550 / 1
1124,1106,SUR SUR,Alain TONEY Sherifa JAMESON,-12,0 - 0,,550 / 1
1125,1106,SWE NOR,Karel ERIKSSON Thea Kristina JOHANSEN,-12,0 - 0,,550 / 1
1126,1106,DEN SWE,Mikkel Kaersgaard HENRIKSEN Louise ERIKSSON,-12,0 - 0,,550 / 1
1127,1106,SWE SWE,Felix NANDIN Rebecca JOHNSSON,-12,0 - 0,,550 / 1
1128,1106,INA FIN,Asuro RIZKO Anna PAAVOLA,-12,0 - 0,,550 / 1
1129,1106,DEN DEN,Soeren TOFT HANSEN Gabriella BOJE,-12,0 - 0,,550 / 1
1130,1106,DEN DEN,Kasper DINESEN Marie Louise STEFFENSEN,-12,0 - 0,,550 / 1
1131,1106,DEN DEN,Mikkel STOFFERSEN Iben BERGSTEIN,-12,0 - 0,,550 / 1
1132,1106,MAR MAR,Omar KESIKES Oumaima ELHERZ,-12,0 - 0,,550 / 1
1133,1106,JOR JOR,Ayham ABD ELEDDIN Sham AL-KHALILI,-12,0 - 0,,550 / 1
1134,1106,MAR MAR,Ahmed Amine KSIKES Oumaina SAHDAN,-12,0 - 0,,550 / 1
1135,1106,MAR MAR,Mehdi ERRAIHANI Chakib SAFAE,-12,0 - 0,,550 / 1
1136,1106,VIE VIE,TO Gia Bao DONG Thi Thanh Hien,-12,0 - 0,,550 / 1
1137,1106,VIE VIE,Vinh Quang HO NGUYEN Thi Anh Duyen NGUYEN,-12,0 - 0,,550 / 1
1138,1106,VIE VIE,Minh Phuc VU Ngoc Bich PHAM,-12,0 - 0,,550 / 1
1139,1106,THA THA,Panu RAKMESI Thanaporn KIAWCHA-ON,-12,0 - 0,,550 / 1
1140,1106,VIE VIE,NGUYEN Phi Hung TRAN Huynh Nhu Tuyet,-12,0 - 0,,550 / 1
1141,1106,SIN SIN,Muhammad Elaf Wei TAN Chun Yi Deline QUEK,-12,0 - 0,,550 / 1
1142,1106,VIE VIE,Minh BAO Kim Chau DO,-12,0 - 0,,550 / 1
1143,1106,CZE CZE,Pavel DRANCAK Michaela FUCHSOVA,-12,0 - 0,,550 / 1
1144,1106,POL POL,Mateusz DANIELAK Karolina WLADZINSKA,-12,0 - 0,,550 / 1
1145,1106,NZL NZL,Christopher STEEGHS Celine SHAO,-12,0 - 0,,550 / 1
1146,1106,NZL NZL,Benjamin HILLIER Erena CALDER -HAWKINS,-12,0 - 0,,550 / 1
1147,1106,AUS AUS,Simon Wing Hang LEUNG Hsuan-Yu Wendy CHEN,-12,0 - 0,,550 / 1
1148,1106,NZL NZL,Sunil DAHIYA Samantha MCCAMISH,-12,0 - 0,,550 / 1
1149,1106,NZL NZL,Vincent HARRIS Erena CALDER -HAWKINS,-12,0 - 0,,550 / 1
1150,1106,AUS AUS,Ashwant GOBINATHAN Ruwindi SERASINGHE,-12,0 - 0,,550 / 1
1151,1106,MAS SIN,Mohd Razif ABDUL LATIF Aiying XING,-12,0 - 0,,550 / 1
1152,1106,TPE TPE,KUO Ching-Hung HUNG Yi-Ting,-12,0 - 0,,550 / 1
1153,1106,SIN SIN,Wen Xing Abel TAN Ming Hui LIM,-12,0 - 0,,550 / 1
1154,1106,TPE TPE,YANG Po-Hsuan YU Min Ju,-12,0 - 0,,550 / 1
1155,1106,PHI PHI,Carlos Antonie CAYANAN Jessie FRANCISCO,-12,0 - 0,,550 / 1
1156,1106,MAS MAS,Muhammad Hafifi HASHIM Peiy Zhean LIM,-12,0 - 0,,550 / 1
1157,1106,TUR TUR,Gokhan ZEMBILCI Inci GULER,-12,0 - 0,,550 / 1
1158,1106,RUS RUS,Victor KOKHANOV Anastasiia SHARAPOVA,-12,0 - 0,,550 / 1
1159,1106,GER GER,Jan Colin VÖLKER Stine Susan KÜSPERT,-12,0 - 0,,550 / 1
1160,1106,RUS RUS,Nikita LEMESHKO Anastasiia SEMENOVA,-12,0 - 0,,550 / 1
1161,1106,CYP GRE,Kyriacos PISSIS Ioanna KARAPETRIDOU,-12,0 - 0,,550 / 1
1162,1106,RUS RUS,VENEDIKTOV Ilya Yulia VASILYEVA,-12,0 - 0,,550 / 1
1163,1106,FRA FRA,Gregor DUNIKOWSKI Verlaine FAULMANN,-12,0 - 0,,550 / 1
1164,1106,KAZ KAZ,Ruslan ZINNUROV Alina KERIMOVA,-12,0 - 0,,550 / 1
1165,1106,UZB UZB,Sherzod ZOKHIDOV Dilrabo AHMEDOVA,-12,0 - 0,,550 / 1
1166,1106,KAZ KAZ,Evgeny EVSEEV Ademi SERIKBAYEVA,-12,0 - 0,,550 / 1
1167,1106,KAZ KAZ,ANDREI KLEMETS NATALYA TOLKACHYOVA,-12,0 - 0,,550 / 1
1168,1106,TJK TJK,Olimov AKHYO Malohat ISLOMQULOVA,-12,0 - 0,,550 / 1
1169,1106,KAZ KAZ,Tolagay DUISEBAYEV Veronika PROTASSOVA,-12,0 - 0,,550 / 1
1170,1106,KAZ KAZ,Dmitriy PANARIN Oxsana SHTELLE,-12,0 - 0,,550 / 1
1171,1106,KAZ KAZ,DMITRIY RUBLYOV LIUDMILA SAFRONOVA,-12,0 - 0,,550 / 1
1172,1106,KAZ KAZ,Ikramzhan YULDASHEV Yelizaveta KHARCHENKO,-12,0 - 0,,550 / 1
1173,1106,MRI MRI,Sadashayanand DUMREE Judith Virusha TEEROOVENGADUM,-12,0 - 0,,550 / 1
1174,1106,FRA FRA,LoïC BERTIL Virginie TESTAN,-12,0 - 0,,550 / 1
1175,1106,MRI MRI,Khabir TEELUCK Ganesha MUNGRAH,-12,0 - 0,,550 / 1
1176,1106,MDV MDV,Hussein SHAHEED Maisa Fathuhulla ISMAIL,-12,0 - 0,,550 / 1
1177,1106,FRA FRA,Nicolas CHANE SING Elodie RICHART,-12,0 - 0,,550 / 1
1178,1106,MRI MRI,Christopher PAUL Aurelie Marie Elisa ALLET,-12,0 - 0,,550 / 1
1179,1106,MRI MRI,RAMCHURN Sanjeev Smiti RAMCHURN,-12,0 - 0,,550 / 1
1180,1106,FRA FRA,Manual-Clement ASSING Lyndie MITHRA,-12,0 - 0,,550 / 1
1181,1106,MDV MDV,Sarim MOHAMED Moosa Aminath SHAHURUNAZ,-12,0 - 0,,550 / 1
1182,1106,FRA FRA,Stephane GOERTZ Lise ORONOZ,-12,0 - 0,,550 / 1
1183,1106,TRI TRI,Keeron Devane GARCIA Reba FLEARY,-12,0 - 0,,550 / 1
1184,1106,TRI TRI,Renaldo SINANAN Arielle GOMEZ,-12,0 - 0,,550 / 1
1185,1106,TRI TRI,Jewhel SMITH Leanna CASTANADA,-12,0 - 0,,550 / 1
1186,1106,TRI TRI,Alistair ESPINOZA Jada RENALES,-12,0 - 0,,550 / 1
1187,1106,TRI TRI,Anil SEEPAUL Kerian QUAN CHEE,-12,0 - 0,,550 / 1
1188,1106,THA THA,Korawi PIKUNNGAM Rujjanabordee SRIPAIBOON,-12,0 - 0,,550 / 1
1189,1106,MAC MAC,Kin Hei TAI Weng Chi NG,-12,0 - 0,,550 / 1
1190,1106,THA THA,Wasapon UTTAMANG Thanyasuda WONGYA,-12,0 - 0,,550 / 1
1191,1106,THA THA,Wipoo INKAEW Thanapim KAWEENUNTAVONG,-12,0 - 0,,550 / 1
1192,1106,THA THA,Puthaporn BVORNWATANUWONG Thunyathorn THAMNOPAKAO,-12,0 - 0,,550 / 1
1193,1106,THA THA,Viriyangkura TANUPAT Thanaporn KIAWCHA-ON,-12,0 - 0,,550 / 1
1194,1106,SLO SLO,Miha IVANCIC Petra POLANC,-12,0 - 0,,550 / 1
1195,1106,SLO SLO,Matic IVANCIC Kaja OKRSLAR,-12,0 - 0,,550 / 1
1196,1106,GRE GRE,Thomas ROUGLIOS Maria-Eleni ROUGLIOU,-12,0 - 0,,550 / 1
1197,1106,GRE GRE,Axilleas TSARTSIDIS Eirini GOYGLERI,-12,0 - 0,,550 / 1
1198,1106,GRE GRE,Marios Michail BOULIOS Pantelia BARTZOU,-12,0 - 0,,550 / 1
1199,1106,GRE GRE,Dimitris ORLIS Georgia ANASTASIOU,-12,0 - 0,,550 / 1
1200,1106,GRE GRE,Stamatis TSIGIRDAKIS Ioanna KONTOU FOUNTA,-12,0 - 0,,550 / 1
1201,1106,GRE GRE,Vasileios ORLIS Anna Maria FARSAKOGLOU,-12,0 - 0,,550 / 1
1202,1106,GRE GRE,Ilias XANTHOU Artemis ANASTASIOU,-12,0 - 0,,550 / 1
1203,1106,GRE GRE,Panagiotis BOTELIS Eleni MOUTEVELIDOU,-12,0 - 0,,550 / 1
1204,1106,GRE GRE,Dimitrios SKRONTAS Aristea APOSTOLIDOU,-12,0 - 0,,550 / 1
1205,1106,GRE GRE,Pantelis SITARENIOS Ioanna KARETSA,-12,0 - 0,,550 / 1
1206,1106,PER PER,Sebastian MACIAS Camila DUANY,-12,0 - 0,,550 / 1
1207,1106,CHI CHI,GOMPERTZ Matias Loreto PONTIGO,-12,0 - 0,,550 / 1
1208,1106,CHI CHI,CONTRERAS Gonzalo SKARIC Mickaela,-12,0 - 0,,550 / 1
1209,1106,ARG ARG,Pablo MACAGNO Daiana GARMENDIA,-12,0 - 0,,550 / 1
1210,1106,ARG ARG,Federico DIAZ Florencia BERNATENE,-12,0 - 0,,550 / 1
1211,1106,NED BUL,Imke VAN DER AAR Alex VLAAR,-12,0 - 0,,550 / 1
1212,1106,ENG ENG,Victoria WILLIAMS Peter BRIGGS,-12,0 - 0,,550 / 1
1213,1106,INA INA,Willian ASTAN Anisa Nur AZIZAH,-12,0 - 0,,550 / 1
1214,1106,INA INA,Calvin KRISTANTO Tania Oktaviani KUSUMAH,-12,0 - 0,,550 / 1
1215,1106,SIN SIN,Jin Lei CHUANG Ren-ne ONG,-12,0 - 0,,550 / 1
1216,1106,INA INA,Yodhi SATRIO Zarra Faza AZKA,-12,0 - 0,,550 / 1
1217,1106,TPE TPE,LIN Shih Kai Ying Chun LIN,-12,0 - 0,,550 / 1
1218,1106,SIN SIN,Zin Rei Ryan NG Chun Yi Deline QUEK,-12,0 - 0,,550 / 1
1219,1106,ROU ROU,PANFIL Eugeniu-Cosmin Andra OLARIU,-12,0 - 0,,550 / 1
1220,1106,UZB UZB,Artyom SAVATYUGIN Valeriya MUSHTAKOVA,-12,0 - 0,,550 / 1
1221,1106,ROU ROU,GROSU Mihai Maria Alexandra DUTU,-12,0 - 0,,550 / 1
1222,1106,ESP ESP,Juan Manuel FERNANDEZ QUILES Laura SAMANIEGO,-12,0 - 0,,550 / 1
1223,1106,AUT AUT,Dominik STIPSITS Sonja LANGTHALER,-12,0 - 0,,550 / 1
1224,1106,ZAM ZAM,Chongo Ezra MULENGA Ogar SIAMUPANGILA,-12,0 - 0,,550 / 1
1225,1106,UGA UGA,Brian KASIRYE Scovia NABASIRYE,-12,0 - 0,,550 / 1
1226,1106,UGA UGA,Ivan MAYEGA Annet NAKAMYA,-12,0 - 0,,550 / 1
1227,1106,UGA UGA,Ian SENOGA Najjuka GLORIA,-12,0 - 0,,550 / 1
1228,1106,IND UGA,Dinesh CHAUDHRY Aisha NAKIYEMBA,-12,0 - 0,,550 / 1
1229,1106,UGA UGA,Daniel MIHIGO Jovia KOMUHEMDO,-12,0 - 0,,550 / 1
1230,1106,CHI CHI,Nicolas FERRUZOLA Niria BAEZA,-12,0 - 0,,550 / 1
1231,1106,PER PER,Jose GUEVARA Daniela ZAPATA,-12,0 - 0,,550 / 1
1232,1106,ISL ISL,Bjarki STEFANSSON Sunna Osp RUNOLFSDOTTIR,-12,0 - 0,,550 / 1
1233,1106,ISL ISL,David Bjarni BJORNSSON Harpa HILMISDOTTIR,-12,0 - 0,,550 / 1
1234,1106,ISL ISL,Xuan Nguyen David PHUONG Arna Karen JOHANNSDOTTIR,-12,0 - 0,,550 / 1
1235,1106,ISL ISL,Birkir Steinn ERLINGSSON Sara HOGNADOTTIR,-12,0 - 0,,550 / 1
1236,1106,ISL ISL,Vignir HARALDSSON Jona Kristin HJARTARDOTTIR,-12,0 - 0,,550 / 1
1237,1106,LTU LTU,Laurynas SPARNAUSKIS Rebeka ALEKSEVICIUTE,-12,0 - 0,,550 / 1
1238,1106,FRA FRA,Vincent MEDINA Yaelle HOYAUX,-12,0 - 0,,550 / 1
1239,1106,FRA FRA,Jimmy NOBLECOURT Emilie BEAUJEAN,-12,0 - 0,,550 / 1
1240,1106,ZAM ZAM,Kalombo MULENGA Penelope MUDENDA,-12,0 - 0,,550 / 1
1241,1106,SCO SCO,Adam HALL Julie MACPHERSON,-12,0 - 0,,550 / 1
1242,1106,PUR PUR,Joshua SOLER Saribel CACERES,-12,0 - 0,,550 / 1
1243,1106,DEN DEN,Steve OLESEN Anna KLINKE,-12,0 - 0,,550 / 1
1244,1106,BUL BUL,Illian KRASTEV Dimitria POPSTOIKOVA,-12,0 - 0,,550 / 1
1245,1106,PYF PYF,Kyliam SCILLOUX Coralie BOUTTIN,-12,0 - 0,,550 / 1
1246,1106,MRI MRI,Andrew SEERUTHUN Shania LEUNG,-12,0 - 0,,550 / 1
1247,1106,GRE GRE,Antonios TOPOLIGKAS Ioanna KARAPETRIDOU,-12,0 - 0,,550 / 1
1248,1106,MAS MAS,Zi Heng OOI Shi Han OOI,-12,0 - 0,,550 / 1
1249,1106,INA INA,Alfandy Rizki KASTURO Phita Haningtyas MENTARI,-12,0 - 0,,550 / 1
1250,1106,INA INA,Rian SYAOQI Jovita Evaria CANDRA,-12,0 - 0,,550 / 1
1251,1106,PER PER,Kenshin SHIMABUKURO Camila DUANY,-12,0 - 0,,550 / 1
1252,1106,FIN FIN,Arttu MAHONEN Annmarie OKSA,-12,0 - 0,,550 / 1
1253,1106,UGA UGA,Alex BABU Brenda MUGABI,-12,0 - 0,,550 / 1
1254,1106,AUS AUS,Mitchell WHELLER Melinda SUN,-12,0 - 0,,550 / 1
1255,1106,ISL ISL,Sigurdur Sverrir GUNNARSSON Margret FINNBOGADOTTIR,-12,0 - 0,,550 / 1
1256,1106,ISL ISL,Kristofer Darri FINNSSON Margret NILSDOTTIR,-12,0 - 0,,550 / 1
1257,1106,TUR TUR,Berk AVCI Sevval Buse ALSOY,-12,0 - 0,,550 / 1
1258,1106,ESP ESP,Alberto ZAPICO Haidee OJEDA,-12,0 - 0,,550 / 1
1259,1106,SCO SCO,Adam HALL Rebekka FINDLAY,-12,0 - 0,,550 / 1
1260,1106,ZAM ZAM,MABO DONALD Delphine NAKANYIKA,-12,0 - 0,,550 / 1
1261,1106,KEN KEN,Alfred MUTHOMI Sheila MUTHONI,-12,0 - 0,,550 / 1
1262,1106,MAS MAS,Guo Zheng SIM Pui Yee ENG,-12,0 - 0,,550 / 1
1263,1106,KAZ KAZ,Khaitmurat KULMATOV Ilyana FILIPCHUK,-12,0 - 0,,550 / 1
1264,1106,VIE VIE,Van Tri TRAN Thi Linh Giang TRAN,-12,0 - 0,,550 / 1
1265,1106,ISL ISL,Daniel JOHANNESSON Sigridur ARNADOTTIR,-12,0 - 0,,550 / 1
1266,1106,AUS AUS,Jacinta JOE Anthony JOE,-12,0 - 0,,550 / 1
1267,1106,DEN DEN,Amanda MADSEN Theodor JOHANSEN,-12,0 - 0,,550 / 1
1268,1106,ISL ISL,Egill GUDLAUGSSON Rakel JOHANNESDOTTIR,-12,0 - 0,,550 / 1
1269,1106,TRI TRI,Nicholas BONKOWSKY Kamasha ROBERTSON,-12,0 - 0,,550 / 1
1270,1106,EST EST,Vahur LUKIN Grete TALVISTE,-12,0 - 0,,550 / 1
1271,1106,MAR MAR,Hicham ERRAJI Ghita CHAROUITE,-12,0 - 0,,550 / 1
1272,1106,ISL ISL,Einar OSKARSSON Johanna JOHANNSDOTTIR,-12,0 - 0,,550 / 1
1273,1106,ISL ISL,Atli JOHANNESSON Snjolaug JOHANNSDOTTIR,-12,0 - 0,,550 / 1
1274,1106,SUR SUR,Irfan DJABAR Quennie PAWIROSEMITO,-12,0 - 0,,550 / 1
1275,1276,DEN DEN,Mads Pieler KOLDING Sara THYGESEN,-11,0 - 0,,522 / 1
1276,1277,INA INA,Muhammad RIJAL Shendy Puspa IRAWATI,-11,0 - 0,,520 / 1
1277,1277,JPN JPN,Keigo SONODA Reika KAKIIWA,-11,0 - 0,,520 / 1
1278,1279,SCO SCO,Robbie PATTERSON Ciara TORRANCE,-11,0 - 0,,510 / 1
1279,1279,CAN CAN,Logan CAMPBELL Kyleigh O’DONOGHUE,-11,0 - 0,,510 / 1
1280,1279,HKG HKG,YEUNG Shing Choi CHAN Hung Yung,-11,0 - 0,,510 / 1
1281,1282,LTU LTU,Karolis EIMUTAITIS Gabija NARVILAITE,-11,0 - 0,,450 / 2
1282,1283,JPN JPN,Koshun MIURA Natsumi URATANI,-11,0 - 0,,430 / 1
1283,1283,JPN JPN,Shuto MORIOKA Chiharu SHIDA,-11,0 - 0,,430 / 1
1284,1283,AUS INA,Hoe Keat OON Sylvina KURNIAWAN,-11,0 - 0,,430 / 1
1285,1283,INA INA,Christopher RUSDIANTO Dian FITRIANI,-11,0 - 0,,430 / 1
1286,1283,IND IND,Dinesh CHAUDHRY Komal ANTIL,-11,0 - 0,,430 / 1
1287,1283,IND IND,Rajat JOON Jagriti NASHIER,-11,0 - 0,,430 / 1
1288,1283,AUS ENG,Talia SAUNDERS Stuart ROWLANDS,-11,0 - 0,,430 / 1
1289,1283,INA INA,Trikusuma WARDHANA Nadya MELATI,-11,0 - 0,,430 / 1
1290,1291,RUS RUS,Vladimir IVANOV Evgeniya KOSETSKAYA,-11,0 - 0,,398 / 1
1291,1292,IND IND,SINGH Vinay Kumar Karishma WADKAR,-11,0 - 0,,360 / 1
1292,1292,IND IND,VISHAL THAKRAN Seema PANCHAL,-11,0 - 0,,360 / 1
1293,1292,IND IND,Talar LAA ANKITA GUPTA,-11,0 - 0,,360 / 1
1294,1292,IND IND,Saurabh SHARMA Kuhoo GARG,-11,0 - 0,,360 / 1
1295,1292,ITA ITA,Lukas OSELE Silvia GARINO,-11,0 - 0,,360 / 1
1296,1292,ENG ENG,Jonathan MCDONALD Imogen LANGFORD,-11,0 - 0,,360 / 1
1297,1292,MAS MAS,"Amir Syazwan Al Razi MOHD SHAHRIMAN BAKHTIR Peiy Yee, Payee LIM",-11,0 - 0,,360 / 1
1298,1292,SIN SIN,Ming Shun TAN Hui Zhen Grace CHUA,-11,0 - 0,,360 / 1
1299,1292,MAS MAS,Muhammad Fariqzuan FAUZIN Peiy Zhean LIM,-11,0 - 0,,360 / 1
1300,1292,CHN CHN,TAN Zhendong ZHOU Meng,-11,0 - 0,,360 / 1
1301,1292,DEN DEN,Steve OLESEN Cecilie FINNE-IPSEN,-11,0 - 0,,360 / 1
1302,1292,BEL BEL,Elias BRACKE Lise JAQUES,-11,0 - 0,,360 / 1
1303,1292,INA INA,Kevin EZRA Engelica WIRATAMA,-11,0 - 0,,360 / 1
1304,1292,INA INA,Muhammad Taufiqul HAFIZH Vanadia PRANASA,-11,0 - 0,,360 / 1
1305,1292,INA INA,Indra Leonard PRASETYA Violita DEWI,-11,0 - 0,,360 / 1
1306,1292,INA INA,Aditya Muchlis WICAKSONO Annisa MUBAROKAH,-11,0 - 0,,360 / 1
1307,1292,PER PER,Alfonso GARCIA-ROSELL Flavia STIGLICH GUZMAN,-11,0 - 0,,360 / 1
1308,1292,PER PER,Matias ZAMORANO RAMOS Stefany Ying Chie CHEN CHEN,-11,0 - 0,,360 / 1
1309,1292,PER PER,Diego SUBAUSTE TOKUMURA Valeria Carolina WONG LAM,-11,0 - 0,,360 / 1
1310,1292,JPN JPN,Shuto MORIOKA Yukiko TAKAHATA,-11,0 - 0,,360 / 1
1311,1292,FRA FRA,Gaetan BRETHES Marie HERMELINE,-11,0 - 0,,360 / 1
1312,1292,FRA RUS,Maxime MICHEL Natalia PERMINOVA,-11,0 - 0,,360 / 1
1313,1292,VIE VIE,Quang Duy NGUYEN DUC HANH Vu,-11,0 - 0,,360 / 1
1314,1292,THA THA,Wipoo INKAEW Panjarat PRANSOPON,-11,0 - 0,,360 / 1
1315,1292,MAS INA,Kok Pong LOKE Millicent WIRANTO,-11,0 - 0,,360 / 1
1316,1292,THA THA,Pollawat BOONPAN Chasinee KOREPAP,-11,0 - 0,,360 / 1
1317,1292,THA THA,Kittipong DUMRONGJITTI Anawika INTARAWATTANA,-11,0 - 0,,360 / 1
1318,1292,THA THA,Ratchanon LOUNSIRI Sasina KULSIRI,-11,0 - 0,,360 / 1
1319,1292,ITA ITA,Fabio CAPONIO Giulia FIORITO,-11,0 - 0,,360 / 1
1320,1292,THA THA,Sirawit SUHARITDUMRONG Savitree AMITRAPAI,-11,0 - 0,,360 / 1
1321,1292,THA THA,Warit SARAPAT Ruethaichanok LAISUAN,-11,0 - 0,,360 / 1
1322,1292,DEN DEN,David DAUGAARD Mai SURROW,-11,0 - 0,,360 / 1
1323,1292,TPE TPE,Hsiao-Lin WU Tsun Yu LIN,-11,0 - 0,,360 / 1
1324,1292,FRA FRA,Toma Junior POPOV Yaelle HOYAUX,-11,0 - 0,,360 / 1
1325,1292,CHI CHI,Ivan LEON Tingting CHOU,-11,0 - 0,,360 / 1
1326,1292,INA INA,Achmad Fasich Firman SABDA Tays Rona LEGIAYEM,-11,0 - 0,,360 / 1
1327,1292,ESP ESP,Jesus LORENZO Maria MARQUEZ DIAZ,-11,0 - 0,,360 / 1
1328,1329,ENG ENG,Matthew CLARE Evie BURBIDGE,-11,0 - 0,,350 / 1
1329,1329,SLO SLO,Miha IVANIC Nika ARIH,-11,0 - 0,,350 / 1
1330,1329,AUT AUT,Roman ZIRNWALD Janine LAIS,-11,0 - 0,,350 / 1
1331,1329,ENG ENG,Jonty RUSS Elizabeth MCMORROW,-11,0 - 0,,350 / 1
1332,1329,SUI SUI,Joel KOENIG Ronja STERN,-11,0 - 0,,350 / 1
1333,1329,LTU LTU,Rokas MINDERIS Elzbieta BAJORINAITE,-11,0 - 0,,350 / 1
1334,1329,EST EST,Heiko ZOOBER Kertu MARGUS,-11,0 - 0,,350 / 1
1335,1329,EST EST,Raul KÄSNER Kristin KUUBA,-11,0 - 0,,350 / 1
1336,1329,POR CZE,Bernardo ATILANO Denisa SIKALOVA,-11,0 - 0,,350 / 1
1337,1329,LAT LAT,Teodors KERIMOVS Jekaterina ROMANOVA,-11,0 - 0,,350 / 1
1338,1329,NZL NZL,Douglas SHEPHARD Neisha BOUMA,-11,0 - 0,,350 / 1
1339,1329,NZL NZL,Eric LI Rebecca YE,-11,0 - 0,,350 / 1
1340,1329,NZL NZL,Jack BOYLE Jahvaya WHEKI,-11,0 - 0,,350 / 1
1341,1329,NZL NZL,Dylan HENTON Aviva PAK,-11,0 - 0,,350 / 1
1342,1329,NZL DEN,Jasmanjot VIRK Josefine Redkjær JENSEN,-11,0 - 0,,350 / 1
1343,1329,NZL NZL,Vincent HARRIS Felicity LEYDON-DAVIS,-11,0 - 0,,350 / 1
1344,1329,NZL NZL,Chee Foong LIM Maysell DOWNEY,-11,0 - 0,,350 / 1
1345,1329,NZL NZL,Joshua CURRY Caragh ALLEY,-11,0 - 0,,350 / 1
1346,1329,BLR BLR,Vladzislav KUSHNIR Krestina SILICH,-11,0 - 0,,350 / 1
1347,1329,POL POL,Piotr WASILUK JANOWSKA KAROLINA,-11,0 - 0,,350 / 1
1348,1349,ESP ESP,Ernesto VELAZQUEZ Beatriz CORRALES,-11,0 - 0,,349 / 1
1349,1350,MAS MAS,Yan Sheng LEE Erica Pei Shan KHOO,-11,0 - 0,,340 / 2
1350,1351,THA THA,Tanawat TOPATTANAKUL Rujjanabordee SRIPAIBOON,-11,0 - 0,,320 / 1
1351,1351,THA THA,Korawi PIKUNNGAM Thanapim KAWEENUNTAVONG,-11,0 - 0,,320 / 1
1352,1351,THA THA,Supakit JANDARA Thunyathorn THAMNOPAKAO,-11,0 - 0,,320 / 1
1353,1351,BRA BRA,Hugo ARTHUSO Paula B PEREIRA,-11,0 - 0,,320 / 1
1354,1351,NZL NZL,Shyam PURUSHOTHMAN Alyse DERBY,-11,0 - 0,,320 / 1
1355,1351,NZL NZL,Jian WANG Soomi Lina LEE,-11,0 - 0,,320 / 1
1356,1351,INA INA,Andrei ADISTIA Jenna GOZALI,-11,0 - 0,,320 / 1
1357,1351,MAS MAS,Khek Wei CHUA Zhen YAP,-11,0 - 0,,320 / 1
1358,1351,JPN JPN,Takuto INOUE Ayane KURIHARA,-11,0 - 0,,320 / 1
1359,1351,NZL NZL,Thomas ELLIS Hayley THOMPSON,-11,0 - 0,,320 / 1
1360,1361,EST EST,Mario SAUNPERE Kati-Kreet MARRAN,-11,0 - 0,,290 / 3
1361,1362,CHN CHN,LIU Cheng ZHAO Yunlei,-11,0 - 0,,285 / 1
1362,1363,CZE CZE,Jan SOMERLIK Dominika BUDZELOVA,-11,0 - 0,,270 / 2
1363,1364,MAC MAC,U Ieong IEK Xue Xin GONG,-11,0 - 0,,240 / 1
1364,1364,CAN CAN,Andy KO Valerie Pauline CHEUNG,-11,0 - 0,,240 / 1
1365,1364,CAN CAN,Darren HONG Erin O'DONOGHUE,-11,0 - 0,,240 / 1
1366,1364,HKG HKG,CHANG Tak Ching TSANG Wing Chiu Avery,-11,0 - 0,,240 / 1
1367,1364,CAN CAN,Nathan OSBORNE Josephine WU,-11,0 - 0,,240 / 1
1368,1369,NOR NOR,Magnus CHRISTENSEN Marie CHRISTENSEN,-11,0 - 0,,210 / 1
1369,1369,UKR UKR,Artem TKACHUK POTAPENKO Tetyana,-11,0 - 0,,210 / 1
1370,1369,DEN DEN,Soren GRAVHOLT Sara LUNDGAARD,-11,0 - 0,,210 / 1
1371,1369,SVK SVK,Bohumil KASELA Lenka DROTAROVA,-11,0 - 0,,210 / 1
1372,1369,TPE TPE,HUNG Jin-Yi TAI Wei-Ling,-11,0 - 0,,210 / 1
1373,1369,IND IND,Anup SRIDHAR Arathi Sara SUNIL,-11,0 - 0,,210 / 1
1374,1369,INA INA,Kaizar Bobby ALEXANDER Fransisca Angelica RAHARDJA,-11,0 - 0,,210 / 1
1375,1369,SUI SUI,Clément WERKMEISTER Diane RUSSI,-11,0 - 0,,210 / 1
1376,1369,FIN EST,Akseli DANSKANEN Melissa MAZURTSAK,-11,0 - 0,,210 / 1
1377,1369,NED NED,Remco KUILMAN Esther KUILMAN,-11,0 - 0,,210 / 1
1378,1369,ENG ENG,Robert GOLDING Tanapat PISITPONG,-11,0 - 0,,210 / 1
1379,1369,POR POR,Ricardo SILVA Daniela CONCEICAO,-11,0 - 0,,210 / 1
1380,1369,SRB SRB,Igor BJELAN Milica SIMIC,-11,0 - 0,,210 / 1
1381,1369,SUI SUI,Thomas HEINIGER Tiffany GIRONA,-11,0 - 0,,210 / 1
1382,1383,INA INA,Travis MONIAGA Tracy MONIAGA,-11,0 - 0,,200 / 2
1383,1384,DEN DEN,Frederik SØGAARD MORTENSEN Gabriella BOJE,-11,0 - 0,,170 / 1
1384,1384,ENG ENG,Jack MACGREGOR Molly CHAPMAN,-11,0 - 0,,170 / 1
1385,1384,WAL WAL,Tsung Fong MO Gean Sou MO,-11,0 - 0,,170 / 1
1386,1384,AUT GER,Roman ZIRNWALD Barbara BELLENBERG,-11,0 - 0,,170 / 1
1387,1384,POL POL,Pawel PIETRYJA Kornelia MARCZAK,-11,0 - 0,,170 / 1
1388,1384,FRA FRA,Thomas VALLEZ Verlaine FAULMANN,-11,0 - 0,,170 / 1
1389,1384,ESP ESP,Adrian ALCAIDE Lucia GALVIN,-11,0 - 0,,170 / 1
1390,1384,FRA FRA,Jocelyn DESCHAMP Delphine DELRUE,-11,0 - 0,,170 / 1
1391,1384,DEN DEN,Joel EIPE Cecilie FINNE-IPSEN,-11,0 - 0,,170 / 1
1392,1384,JPN JPN,Takahiro FUJIMAKI Misaki MAKINO,-11,0 - 0,,170 / 1
1393,1384,JPN JPN,Keiichiro MATSUI Mirai SHINODA,-11,0 - 0,,170 / 1
1394,1384,FRA FRA,Arif RASIDI Héloïse LE MOULEC,-11,0 - 0,,170 / 1
1395,1384,FRA FRA,Tanguy BLANCHARD Lauren FONTAINE,-11,0 - 0,,170 / 1
1396,1384,INA INA,Ivanudin RIFAN FAUZIN Ganis Nur RAHMADANI,-11,0 - 0,,170 / 1
1397,1384,VIE VIE,Binh Minh NGUYEN Ngoc Bich PHAM,-11,0 - 0,,170 / 1
1398,1384,VIE VIE,Nguyen Khang HUYNH Kim Ngan DANG,-11,0 - 0,,170 / 1
1399,1384,THA THA,Saran JAMSRI Nattcha CHATPUTTARN,-11,0 - 0,,170 / 1
1400,1384,UKR UKR,DON SERGEY Mariya RUD,-11,0 - 0,,170 / 1
1401,1384,CZE CZE,IVO Stoklas Sarka KRIZKOVA,-11,0 - 0,,170 / 1
1402,1384,BUL AUT,Peyo BOICHINOV Sonja LANGTHALER,-11,0 - 0,,170 / 1
1403,1384,SUI SUI,Anthony DUMARTHERAY Cendrine HANTZ,-11,0 - 0,,170 / 1
1404,1384,SWE SWE,Andy Hartono TANDAPUTRA Berfin ASLAN,-11,0 - 0,,170 / 1
1405,1384,DEN SWE,Kristoffer KNUDSEN Louise ERIKSSON,-11,0 - 0,,170 / 1
1406,1384,DEN DEN,Mathias BAY-SMIDT Nanna VESTERGAARD,-11,0 - 0,,170 / 1
1407,1384,JPN JPN,Yuki YONEMOTO Haruka YONEMOTO,-11,0 - 0,,170 / 1
1408,1384,FRA FRA,Jordan CORVEE Stacey GUERIN,-11,0 - 0,,170 / 1
1409,1384,ESP ESP,Eliecer OJEDA Noelia JIMENEZ,-11,0 - 0,,170 / 1
1410,1384,GER GER,Philipp WACHENFELD Fabienne KOEHLER,-11,0 - 0,,170 / 1
1411,1412,MAC MAC,U Ieong IEK Weng Chi NG,-11,0 - 0,,130 / 1
1412,1412,MAC MAC,Hok Man LOU Kit Ieng WONG,-11,0 - 0,,130 / 1
1413,1412,AUS AUS,Cham CHEN Jennifer TAM,-11,0 - 0,,130 / 1
1414,1412,LTU LTU,Donatas NARVILAS Gerda VOITECHOVSKAJA,-11,0 - 0,,130 / 1
1415,1416,FRA FRA,Thomas BAURES Margot LAMBERT,-11,0 - 0,,120 / 2
1416,1417,NOR NOR,Karl ØDEGÅRD Christiane DAHL NIELSEN,-11,0 - 0,,100 / 1
1417,1417,SWE SWE,Martin FORSSBERG Madeleine PERSSON,-11,0 - 0,,100 / 1
1418,1417,NOR NOR,Toheed Ahmad SAEED Frida SOTNES HAMANG,-11,0 - 0,,100 / 1
1419,1417,NOR NOR,Mads MARUM Marlene WÅLAND,-11,0 - 0,,100 / 1
1420,1417,NOR NOR,Jorgen ROSENLUND Jeanette SVENDSEN,-11,0 - 0,,100 / 1
1421,1417,HUN MAS,Gergely KRAUSZ Yee See CHEAH,-11,0 - 0,,100 / 1
1422,1417,SVK SVK,Bohumil KASELA Katarina SARISCANOVA,-11,0 - 0,,100 / 1
1423,1417,NOR NOR,Jorgen ROSENLUND Thea Kristina JOHANSEN,-11,0 - 0,,100 / 1
1424,1417,POL POL,Bartłomiej PARYSZ Daniela BIELINSKA,-11,0 - 0,,100 / 1
1425,1417,POL POL,Robert MIRGA Kornelia MARCZAK,-11,0 - 0,,100 / 1
1426,1417,POL POL,Jan RUDZINSKI Wiktoria FALANDYSZ,-11,0 - 0,,100 / 1
1427,1417,POL POL,Wojciech SAJDOK Barbara KNOPEK,-11,0 - 0,,100 / 1
1428,1417,PHI PHI,Paul John PANTIG Joella Geva DE VERA,-11,0 - 0,,100 / 1
1429,1417,MAS MAS,Yeet Siang LIN Wei Chyi TI,-11,0 - 0,,100 / 1
1430,1417,TPE TPE,LU Jin-Song LEE Wei Tzu,-11,0 - 0,,100 / 1
1431,1417,THA THA,Kunlavut VITIDSARN Pattarasuda CHAIWAN,-11,0 - 0,,100 / 1
1432,1417,SLO SLO,Urban TURK Katarina BETON,-11,0 - 0,,100 / 1
1433,1417,SLO SLO,Dani KLANCAR Nika POLANIC,-11,0 - 0,,100 / 1
1434,1417,SLO SLO,Beber ALJOSA Vesna BRLIČ,-11,0 - 0,,100 / 1
1435,1417,SLO SLO,Aljaž ROSKAR Eva GRUBER,-11,0 - 0,,100 / 1
1436,1417,INA INA,Axel Raditya VASYAH Vania Lystia VASYAH,-11,0 - 0,,100 / 1
1437,1417,INA INA,Muhmmad Shohibul FIKRI Triya NURSAADIYAH,-11,0 - 0,,100 / 1
1438,1417,INA INA,Muhammad Andi PURNOMO Violita DEWI,-11,0 - 0,,100 / 1
1439,1417,INA INA,Abhinaya ADIRA Virni Putri JAFAR,-11,0 - 0,,100 / 1
1440,1417,ROU ROU,Robert CIOBOTARU Adelina MARIN TERINTE,-11,0 - 0,,100 / 1
1441,1417,ROU ROU,David NITU Nitu MIRUNA ELENA,-11,0 - 0,,100 / 1
1442,1417,ROU ROU,Andreas THIEL Ioana IONICA,-11,0 - 0,,100 / 1
1443,1417,POR POR,Miguel PINTO Joana AMARAL,-11,0 - 0,,100 / 1
1444,1417,POR POR,Manuel LEITAO Ana ALBUQUERQUE,-11,0 - 0,,100 / 1
1445,1417,POR POR,Angelo SILVA Ana DIAS,-11,0 - 0,,100 / 1
1446,1417,POR POR,Joao MARQUES Joana LOPES,-11,0 - 0,,100 / 1
1447,1417,POR POR,Ruben VIEIRA Ana AMARAL,-11,0 - 0,,100 / 1
1448,1417,POR POR,Guilherme PEREIRA Gabriela PEREIRA,-11,0 - 0,,100 / 1
1449,1417,EST EST,Mikk OUNMAA Grete PALL,-11,0 - 0,,100 / 1
1450,1417,SLO SLO,Urban HERMAN Nastja STOVANJE,-11,0 - 0,,100 / 1
1451,1417,LTU LTU,Renaldas SILERIS Gabriele JANUSONYTE,-11,0 - 0,,100 / 1
1452,1417,POR POR,Bruno CARVALHO Sonia GONCALVES,-11,0 - 0,,100 / 1
1453,1417,POR POR,Paulo MENDONCA Isabel MATIAS,-11,0 - 0,,100 / 1
1454,1455,ISL ISL,Daniel THOMSEN Rakel JOHANNESDOTTIR,-11,0 - 0,,93 / 1
1455,1456,AUT AUT,Matthias ALMER Elisabeth BALDAUF,-11,0 - 0,,88 / 1
1456,1457,SVK SVK,Richard SMATLAK Lenka DROTAROVA,-11,0 - 0,,60 / 1
1457,1457,SVK SVK,Michal MATEJKA Julia POLACKOVA,-11,0 - 0,,60 / 1
1458,1457,NOR NOR,Sturla Flaten JORGENSEN Anne KLYVE,-11,0 - 0,,60 / 1
1459,1457,SVK SVK,Marian SMREK Lucia GRENCIKOVA,-11,0 - 0,,60 / 1
1460,1457,LAT LAT,Toms PREINBERGS Ieva POPE,-11,0 - 0,,60 / 1
1461,1457,RUS RUS,Kirill ERMAKOV Anastasia DOBRININA,-11,0 - 0,,60 / 1
1462,1457,EST EST,Marcus LÕO Mari Ann KARJUS,-11,0 - 0,,60 / 1
1463,1457,LAT LAT,Toms PREINBERGS Aija POPE,-11,0 - 0,,60 / 1
1464,1457,FRA FRA,Marc LAPORTE Yaelle HOYAUX,-11,0 - 0,,60 / 1
1465,1466,SRI SRI,Achini RATNASIRI Nimmika THISARA,-11,0 - 0,,36 / 1
1466,1467,ALG ALG,Mohamed Amine GUELMAOUI Baya NESRINE,-11,0 - 0,,2 / 1
1467,1467,GHA GHA,Gifty MENSAH Emmanuel YAW DONKOR,-11,0 - 0,,2 / 1
1468,1467,BOT BOT,Kgalalelo KEGAKILWE Orideetse THELA,-11,0 - 0,,2 / 1
1469,1467,NGR NGR,Dorcas Ajoke ADESOKAN Victor MAKANJU,-11,0 - 0,,2 / 1
1470,1467,TUR TUR,Ozge BAYRAK Ramazan OZTURK,-11,0 - 0,,2 / 1
1471,1467,ITA ITA,Rosario MADDALONI Karin MARAN,-11,0 - 0,,2 / 1
1472,1473,PHI PHI,Ronel ESTANISLAO Thea Marie POMAR,-11,0 - 0,,2 / 1
