,RANK,COUNTRY,PLAYER,CHANGE +/-,WIN - LOSE,PRIZE MONEY,POINTS / TOURNAMENTS
1122,1085,CYP GRE,Kyriacos PISSIS Ioanna KARAPETRIDOU,15,0 - 0,,550 / 1
1123,1085,RUS RUS,VENEDIKTOV Ilya Yulia VASILYEVA,15,0 - 0,,550 / 1
1124,1085,FRA FRA,Gregor DUNIKOWSKI Verlaine FAULMANN,15,0 - 0,,550 / 1
1125,1085,KAZ KAZ,Ruslan ZINNUROV Alina KERIMOVA,15,0 - 0,,550 / 1
1126,1085,UZB UZB,Sherzod ZOKHIDOV Dilrabo AHMEDOVA,15,0 - 0,,550 / 1
1127,1085,KAZ KAZ,Evgeny EVSEEV Ademi SERIKBAYEVA,15,0 - 0,,550 / 1
1128,1085,KAZ KAZ,ANDREI KLEMETS NATALYA TOLKACHYOVA,15,0 - 0,,550 / 1
1129,1085,TJK TJK,Olimov AKHYO Malohat ISLOMQULOVA,15,0 - 0,,550 / 1
1130,1085,KAZ KAZ,Tolagay DUISEBAYEV Veronika PROTASSOVA,15,0 - 0,,550 / 1
1131,1085,KAZ KAZ,Dmitriy PANARIN Oxsana SHTELLE,15,0 - 0,,550 / 1
1132,1085,KAZ KAZ,DMITRIY RUBLYOV LIUDMILA SAFRONOVA,15,0 - 0,,550 / 1
1133,1085,KAZ KAZ,Ikramzhan YULDASHEV Yelizaveta KHARCHENKO,15,0 - 0,,550 / 1
1134,1085,MRI MRI,Sadashayanand DUMREE Judith Virusha TEEROOVENGADUM,15,0 - 0,,550 / 1
1135,1085,FRA FRA,LoïC BERTIL Virginie TESTAN,15,0 - 0,,550 / 1
1136,1085,MRI MRI,Khabir TEELUCK Ganesha MUNGRAH,15,0 - 0,,550 / 1
1137,1085,MDV MDV,Hussein SHAHEED Maisa Fathuhulla ISMAIL,15,0 - 0,,550 / 1
1138,1085,FRA FRA,Nicolas CHANE SING Elodie RICHART,15,0 - 0,,550 / 1
1139,1085,MRI MRI,Christopher PAUL Aurelie Marie Elisa ALLET,15,0 - 0,,550 / 1
1140,1085,MRI MRI,RAMCHURN Sanjeev Smiti RAMCHURN,15,0 - 0,,550 / 1
1141,1085,FRA FRA,Manual-Clement ASSING Lyndie MITHRA,15,0 - 0,,550 / 1
1142,1085,MDV MDV,Sarim MOHAMED Moosa Aminath SHAHURUNAZ,15,0 - 0,,550 / 1
1143,1085,FRA FRA,Stephane GOERTZ Lise ORONOZ,15,0 - 0,,550 / 1
1144,1085,TRI TRI,Keeron Devane GARCIA Reba FLEARY,15,0 - 0,,550 / 1
1145,1085,TRI TRI,Renaldo SINANAN Arielle GOMEZ,15,0 - 0,,550 / 1
1146,1085,TRI TRI,Jewhel SMITH Leanna CASTANADA,15,0 - 0,,550 / 1
1147,1085,TRI TRI,Alistair ESPINOZA Jada RENALES,15,0 - 0,,550 / 1
1148,1085,TRI TRI,Anil SEEPAUL Kerian QUAN CHEE,15,0 - 0,,550 / 1
1149,1085,THA THA,Korawi PIKUNNGAM Rujjanabordee SRIPAIBOON,15,0 - 0,,550 / 1
1150,1085,MAC MAC,Kin Hei TAI Weng Chi NG,15,0 - 0,,550 / 1
1151,1085,THA THA,Wasapon UTTAMANG Thanyasuda WONGYA,15,0 - 0,,550 / 1
1152,1085,THA THA,Wipoo INKAEW Thanapim KAWEENUNTAVONG,15,0 - 0,,550 / 1
1153,1085,THA THA,Puthaporn BVORNWATANUWONG Thunyathorn THAMNOPAKAO,15,0 - 0,,550 / 1
1154,1085,THA THA,Viriyangkura TANUPAT Thanaporn KIAWCHA-ON,15,0 - 0,,550 / 1
1155,1085,SLO SLO,Miha IVANCIC Petra POLANC,15,0 - 0,,550 / 1
1156,1085,SLO SLO,Matic IVANCIC Kaja OKRSLAR,15,0 - 0,,550 / 1
1157,1085,GRE GRE,Thomas ROUGLIOS Maria-Eleni ROUGLIOU,15,0 - 0,,550 / 1
1158,1085,GRE GRE,Axilleas TSARTSIDIS Eirini GOYGLERI,15,0 - 0,,550 / 1
1159,1085,GRE GRE,Marios Michail BOULIOS Pantelia BARTZOU,15,0 - 0,,550 / 1
1160,1085,GRE GRE,Dimitris ORLIS Georgia ANASTASIOU,15,0 - 0,,550 / 1
1161,1085,GRE GRE,Stamatis TSIGIRDAKIS Ioanna KONTOU FOUNTA,15,0 - 0,,550 / 1
1162,1085,GRE GRE,Vasileios ORLIS Anna Maria FARSAKOGLOU,15,0 - 0,,550 / 1
1163,1085,GRE GRE,Ilias XANTHOU Artemis ANASTASIOU,15,0 - 0,,550 / 1
1164,1085,GRE GRE,Panagiotis BOTELIS Eleni MOUTEVELIDOU,15,0 - 0,,550 / 1
1165,1085,GRE GRE,Dimitrios SKRONTAS Aristea APOSTOLIDOU,15,0 - 0,,550 / 1
1166,1085,GRE GRE,Pantelis SITARENIOS Ioanna KARETSA,15,0 - 0,,550 / 1
1167,1085,PER PER,Sebastian MACIAS Camila DUANY,15,0 - 0,,550 / 1
1168,1085,CHI CHI,GOMPERTZ Matias Loreto PONTIGO,15,0 - 0,,550 / 1
1169,1085,CHI CHI,CONTRERAS Gonzalo SKARIC Mickaela,15,0 - 0,,550 / 1
1170,1085,ARG ARG,Pablo MACAGNO Daiana GARMENDIA,15,0 - 0,,550 / 1
1171,1085,ARG ARG,Federico DIAZ Florencia BERNATENE,15,0 - 0,,550 / 1
1172,1085,NED BUL,Imke VAN DER AAR Alex VLAAR,15,0 - 0,,550 / 1
1173,1085,ENG ENG,Victoria WILLIAMS Peter BRIGGS,15,0 - 0,,550 / 1
1174,1085,INA INA,Willian ASTAN Anisa Nur AZIZAH,15,0 - 0,,550 / 1
1175,1085,INA INA,Calvin KRISTANTO Tania Oktaviani KUSUMAH,15,0 - 0,,550 / 1
1176,1085,SIN SIN,Jin Lei CHUANG Ren-ne ONG,15,0 - 0,,550 / 1
1177,1085,INA INA,Yodhi SATRIO Zarra Faza AZKA,15,0 - 0,,550 / 1
1178,1085,TPE TPE,LIN Shih Kai Ying Chun LIN,15,0 - 0,,550 / 1
1179,1085,SIN SIN,Zin Rei Ryan NG Chun Yi Deline QUEK,15,0 - 0,,550 / 1
1180,1085,ROU ROU,PANFIL Eugeniu-Cosmin Andra OLARIU,15,0 - 0,,550 / 1
1181,1085,UZB UZB,Artyom SAVATYUGIN Valeriya MUSHTAKOVA,15,0 - 0,,550 / 1
1182,1085,ROU ROU,GROSU Mihai Maria Alexandra DUTU,15,0 - 0,,550 / 1
1183,1085,ESP ESP,Juan Manuel FERNANDEZ QUILES Laura SAMANIEGO,15,0 - 0,,550 / 1
1184,1085,AUT AUT,Dominik STIPSITS Sonja LANGTHALER,15,0 - 0,,550 / 1
1185,1085,ZAM ZAM,Chongo Ezra MULENGA Ogar SIAMUPANGILA,15,0 - 0,,550 / 1
1186,1085,UGA UGA,Brian KASIRYE Scovia NABASIRYE,15,0 - 0,,550 / 1
1187,1085,UGA UGA,Ivan MAYEGA Annet NAKAMYA,15,0 - 0,,550 / 1
1188,1085,UGA UGA,Ian SENOGA Najjuka GLORIA,15,0 - 0,,550 / 1
1189,1085,IND UGA,Dinesh CHAUDHRY Aisha NAKIYEMBA,15,0 - 0,,550 / 1
1190,1085,UGA UGA,Daniel MIHIGO Jovia KOMUHEMDO,15,0 - 0,,550 / 1
1191,1085,CHI CHI,Nicolas FERRUZOLA Niria BAEZA,15,0 - 0,,550 / 1
1192,1085,PER PER,Jose GUEVARA Daniela ZAPATA,15,0 - 0,,550 / 1
1193,1085,ISL ISL,Bjarki STEFANSSON Sunna Osp RUNOLFSDOTTIR,15,0 - 0,,550 / 1
1194,1085,ISL ISL,David Bjarni BJORNSSON Harpa HILMISDOTTIR,15,0 - 0,,550 / 1
1195,1085,ISL ISL,Xuan Nguyen David PHUONG Arna Karen JOHANNSDOTTIR,15,0 - 0,,550 / 1
1196,1085,ISL ISL,Birkir Steinn ERLINGSSON Sara HOGNADOTTIR,15,0 - 0,,550 / 1
1197,1085,ISL ISL,Vignir HARALDSSON Jona Kristin HJARTARDOTTIR,15,0 - 0,,550 / 1
1198,1085,LTU LTU,Laurynas SPARNAUSKIS Rebeka ALEKSEVICIUTE,15,0 - 0,,550 / 1
1199,1085,FRA FRA,Vincent MEDINA Yaelle HOYAUX,15,0 - 0,,550 / 1
1200,1085,FRA FRA,Jimmy NOBLECOURT Emilie BEAUJEAN,15,0 - 0,,550 / 1
1201,1085,BOT BOT,Omphile MARUMOAGAE Reitumetse MODISENYANE,15,0 - 0,,550 / 1
1202,1085,BOT BOT,Kagiso RANTSHADI Leungo Bronia TSHWENEETSILE,15,0 - 0,,550 / 1
1203,1085,BOT BOT,OLEFILE Katlego Bonolo AMOS,15,0 - 0,,550 / 1
1204,1085,RSA RSA,Johan CROUKAMP Lynn FRY,15,0 - 0,,550 / 1
1205,1085,RSA RSA,James Hilton MCMANUS Jade MORGAN,15,0 - 0,,550 / 1
1206,1085,RSA RSA,Ruan SNYMAN Johanita SCHOLTZ,15,0 - 0,,550 / 1
1207,1085,RSA RSA,Damien TOP Nadene DICKS,15,0 - 0,,550 / 1
1208,1085,RSA RSA,Jason MANN Candice MANN,15,0 - 0,,550 / 1
1209,1085,RSA RSA,Jaques VAN DYK Anke VAN DER MERWE,15,0 - 0,,550 / 1
1210,1085,RSA RSA,Jason WEISS Marijke MITTON,15,0 - 0,,550 / 1
1211,1085,DEN DEN,Alexander BOND Marie Louise STEFFENSEN,15,0 - 0,,550 / 1
1212,1085,DEN DEN,Jens Brokholm ANDERSEN Sarah FISKER,15,0 - 0,,550 / 1
1213,1085,DEN DEN,Mathias WEBER ESTRUP Cecilie BJERGEN,15,0 - 0,,550 / 1
1214,1085,DEN DEN,Mathias Moldt BASKJAER Anina NILSSON,15,0 - 0,,550 / 1
1215,1085,FIN FIN,Iiro NOKKALA Linnea VAINULA,15,0 - 0,,550 / 1
1216,1085,DEN DEN,Mikkel STOFFERSEN Karoline SYNNESTVEDT,15,0 - 0,,550 / 1
1217,1085,MEX MEX,Daniel MARTINEZ Chinas AILEEN,15,0 - 0,,550 / 1
1218,1085,PUR PUR,Joshua SOLER Saribel CACERES,-579,0 - 0,,550 / 1
1219,1085,DEN DEN,Steve OLESEN Anna KLINKE,15,0 - 0,,550 / 1
1220,1085,DEN DEN,Mads Emil CHRISTENSEN Maja RINDSHOEJ,15,0 - 0,,550 / 1
1221,1085,BUL BUL,Illian KRASTEV Dimitria POPSTOIKOVA,15,0 - 0,,550 / 1
1222,1085,PYF PYF,Kyliam SCILLOUX Coralie BOUTTIN,15,0 - 0,,550 / 1
1223,1085,MRI MRI,Andrew SEERUTHUN Shania LEUNG,15,0 - 0,,550 / 1
1224,1085,GRE GRE,Antonios TOPOLIGKAS Ioanna KARAPETRIDOU,15,0 - 0,,550 / 1
1225,1085,ZAM ZAM,MABO DONALD Ogar SIAMUPANGILA,15,0 - 0,,550 / 1
1226,1085,MAS MAS,Zi Heng OOI Shi Han OOI,15,0 - 0,,550 / 1
1227,1085,INA INA,Alfandy Rizki KASTURO Phita Haningtyas MENTARI,15,0 - 0,,550 / 1
1228,1085,INA INA,Rian SYAOQI Jovita Evaria CANDRA,15,0 - 0,,550 / 1
1229,1085,PER PER,Kenshin SHIMABUKURO Camila DUANY,15,0 - 0,,550 / 1
1230,1085,UGA UGA,Alex BABU Brenda MUGABI,15,0 - 0,,550 / 1
1231,1085,AUS AUS,Mitchell WHELLER Melinda SUN,15,0 - 0,,550 / 1
1232,1085,ISL ISL,Sigurdur Sverrir GUNNARSSON Margret FINNBOGADOTTIR,15,0 - 0,,550 / 1
1233,1085,ISL ISL,Kristofer Darri FINNSSON Margret NILSDOTTIR,15,0 - 0,,550 / 1
1234,1085,FIN FIN,Marko PYYKONEN Mathilda LINDHOLM,-579,0 - 0,,550 / 1
1235,1085,TUR TUR,Berk AVCI Sevval Buse ALSOY,15,0 - 0,,550 / 1
1236,1085,BOT BOT,Gaone TAWANA Tebogo NDZINGE,15,0 - 0,,550 / 1
1237,1085,ESP ESP,Alberto ZAPICO Haidee OJEDA,15,0 - 0,,550 / 1
1238,1085,RSA RSA,Bongani VON BODENSTEIN Lehandre SCHOEMAN,15,0 - 0,,550 / 1
1239,1085,SCO SCO,Adam HALL Rebekka FINDLAY,15,0 - 0,,550 / 1
1240,1085,KEN KEN,Alfred MUTHOMI Sheila MUTHONI,15,0 - 0,,550 / 1
1241,1085,MAS MAS,Guo Zheng SIM Pui Yee ENG,15,0 - 0,,550 / 1
1242,1085,KAZ KAZ,Khaitmurat KULMATOV Ilyana FILIPCHUK,15,0 - 0,,550 / 1
1243,1085,VIE VIE,Van Tri TRAN Thi Linh Giang TRAN,15,0 - 0,,550 / 1
1244,1085,ISL ISL,Daniel JOHANNESSON Sigridur ARNADOTTIR,15,0 - 0,,550 / 1
1245,1085,AUS AUS,Jacinta JOE Anthony JOE,15,0 - 0,,550 / 1
1246,1085,FIN FIN,Henrik HAKULINEN Sara TUOMALA,15,0 - 0,,550 / 1
1247,1085,DEN DEN,Amanda MADSEN Theodor JOHANSEN,15,0 - 0,,550 / 1
1248,1085,ISL ISL,Egill GUDLAUGSSON Rakel JOHANNESDOTTIR,15,0 - 0,,550 / 1
1249,1085,EST EST,Vahur LUKIN Grete TALVISTE,15,0 - 0,,550 / 1
1250,1085,BOT BOT,Godwin MATHUMO Kgalalelo KEGAKILWE,15,0 - 0,,550 / 1
1251,1085,MAR MAR,Hicham ERRAJI Ghita CHAROUITE,15,0 - 0,,550 / 1
1252,1085,ISL ISL,Einar OSKARSSON Johanna JOHANNSDOTTIR,15,0 - 0,,550 / 1
1253,1085,ISL ISL,Atli JOHANNESSON Snjolaug JOHANNSDOTTIR,15,0 - 0,,550 / 1
1254,1255,ENG ENG,Callum HEMMING Lizzie TOLMAN,14,0 - 0,,530 / 2
1255,1256,DEN DEN,Mads Pieler KOLDING Sara THYGESEN,14,0 - 0,,522 / 1
1256,1257,INA INA,Muhammad RIJAL Shendy Puspa IRAWATI,14,0 - 0,,520 / 1
1257,1257,JPN JPN,Keigo SONODA Reika KAKIIWA,14,0 - 0,,520 / 1
1258,1259,CAN CAN,Logan CAMPBELL Kyleigh O’DONOGHUE,14,0 - 0,,510 / 1
1259,1259,GER SWE,Jonathan PERSSON Matilda PETERSEN,14,0 - 0,,510 / 1
1260,1259,HKG HKG,YEUNG Shing Choi CHAN Hung Yung,14,0 - 0,,510 / 1
1261,1262,LTU LTU,Karolis EIMUTAITIS Gabija NARVILAITE,14,0 - 0,,450 / 2
1262,1263,JPN JPN,Koshun MIURA Natsumi URATANI,14,0 - 0,,430 / 1
1263,1263,JPN JPN,Shuto MORIOKA Chiharu SHIDA,14,0 - 0,,430 / 1
1264,1263,AUS INA,Hoe Keat OON Sylvina KURNIAWAN,14,0 - 0,,430 / 1
1265,1263,INA INA,Christopher RUSDIANTO Dian FITRIANI,14,0 - 0,,430 / 1
1266,1263,IND IND,Dinesh CHAUDHRY Komal ANTIL,14,0 - 0,,430 / 1
1267,1263,IND IND,Rajat JOON Jagriti NASHIER,14,0 - 0,,430 / 1
1268,1263,JPN JPN,Kenta KAZUNO Yuki FUKUSHIMA,14,0 - 0,,430 / 1
1269,1263,INA INA,Gideon Markus FERNALDI Rizki Amelia PRADIPTA,14,0 - 0,,430 / 1
1270,1263,AUS ENG,Talia SAUNDERS Stuart ROWLANDS,14,0 - 0,,430 / 1
1271,1263,INA INA,Trikusuma WARDHANA Nadya MELATI,14,0 - 0,,430 / 1
1272,1273,RUS RUS,Vladimir IVANOV Evgeniya KOSETSKAYA,14,0 - 0,,398 / 1
1273,1274,MAS MAS,"Amir Syazwan Al Razi MOHD SHAHRIMAN BAKHTIR Peiy Yee, Payee LIM",0,0 - 0,,360 / 1
1274,1274,SIN SIN,Ming Shun TAN Hui Zhen Grace CHUA,0,0 - 0,,360 / 1
1275,1274,MAS MAS,Muhammad Fariqzuan FAUZIN Peiy Zhean LIM,0,0 - 0,,360 / 1
1276,1274,CHN CHN,TAN Zhendong ZHOU Meng,0,0 - 0,,360 / 1
1277,1274,DEN DEN,Steve OLESEN Cecilie FINNE-IPSEN,14,0 - 0,,360 / 1
1278,1274,BEL BEL,Elias BRACKE Lise JAQUES,14,0 - 0,,360 / 1
1279,1274,INA INA,Kevin EZRA Engelica WIRATAMA,14,0 - 0,,360 / 1
1280,1274,INA INA,Muhammad Taufiqul HAFIZH Vanadia PRANASA,14,0 - 0,,360 / 1
1281,1274,INA INA,Indra Leonard PRASETYA Violita DEWI,14,0 - 0,,360 / 1
1282,1274,INA INA,Aditya Muchlis WICAKSONO Annisa MUBAROKAH,14,0 - 0,,360 / 1
1283,1274,PER PER,Alfonso GARCIA-ROSELL Flavia STIGLICH GUZMAN,14,0 - 0,,360 / 1
1284,1274,PER PER,Matias ZAMORANO RAMOS Stefany Ying Chie CHEN CHEN,14,0 - 0,,360 / 1
1285,1274,PER PER,Diego SUBAUSTE TOKUMURA Valeria Carolina WONG LAM,14,0 - 0,,360 / 1
1286,1274,JPN JPN,Shuto MORIOKA Yukiko TAKAHATA,14,0 - 0,,360 / 1
1287,1274,FRA FRA,Gaetan BRETHES Marie HERMELINE,14,0 - 0,,360 / 1
1288,1274,FRA RUS,Maxime MICHEL Natalia PERMINOVA,14,0 - 0,,360 / 1
1289,1274,VIE VIE,Quang Duy NGUYEN DUC HANH Vu,14,0 - 0,,360 / 1
1290,1274,THA THA,Wipoo INKAEW Panjarat PRANSOPON,14,0 - 0,,360 / 1
1291,1274,MAS INA,Kok Pong LOKE Millicent WIRANTO,14,0 - 0,,360 / 1
1292,1274,THA THA,Pollawat BOONPAN Chasinee KOREPAP,14,0 - 0,,360 / 1
1293,1274,THA THA,Kittipong DUMRONGJITTI Anawika INTARAWATTANA,14,0 - 0,,360 / 1
1294,1274,THA THA,Ratchanon LOUNSIRI Sasina KULSIRI,14,0 - 0,,360 / 1
1295,1274,ESP IRL,Juan Manuel FERNANDEZ QUILES Rachael DARRAGH,14,0 - 0,,360 / 1
1296,1274,THA THA,Sirawit SUHARITDUMRONG Savitree AMITRAPAI,-518,0 - 0,,360 / 1
1297,1274,THA THA,Warit SARAPAT Ruethaichanok LAISUAN,14,0 - 0,,360 / 1
1298,1274,DEN DEN,David DAUGAARD Mai SURROW,14,0 - 0,,360 / 1
1299,1274,CHI CHI,Ivan LEON Tingting CHOU,14,0 - 0,,360 / 1
1300,1274,INA INA,Achmad Fasich Firman SABDA Tays Rona LEGIAYEM,14,0 - 0,,360 / 1
1301,1274,ESP ESP,Jesus LORENZO Maria MARQUEZ DIAZ,14,0 - 0,,360 / 1
1302,1303,ENG ENG,Matthew CLARE Evie BURBIDGE,13,0 - 0,,350 / 1
1303,1303,SLO SLO,Miha IVANIC Nika ARIH,13,0 - 0,,350 / 1
1304,1303,AUT AUT,Roman ZIRNWALD Janine LAIS,13,0 - 0,,350 / 1
1305,1303,ENG ENG,Jonty RUSS Elizabeth MCMORROW,13,0 - 0,,350 / 1
1306,1303,SUI SUI,Joel KOENIG Ronja STERN,13,0 - 0,,350 / 1
1307,1303,LTU LTU,Rokas MINDERIS Elzbieta BAJORINAITE,13,0 - 0,,350 / 1
1308,1303,EST EST,Heiko ZOOBER Kertu MARGUS,13,0 - 0,,350 / 1
1309,1303,EST EST,Raul KÄSNER Kristin KUUBA,13,0 - 0,,350 / 1
1310,1303,POR CZE,Bernardo ATILANO Denisa SIKALOVA,13,0 - 0,,350 / 1
1311,1303,LAT LAT,Teodors KERIMOVS Jekaterina ROMANOVA,13,0 - 0,,350 / 1
1312,1303,NZL NZL,Douglas SHEPHARD Neisha BOUMA,13,0 - 0,,350 / 1
1313,1303,NZL NZL,Eric LI Rebecca YE,13,0 - 0,,350 / 1
1314,1303,NZL NZL,Jack BOYLE Jahvaya WHEKI,13,0 - 0,,350 / 1
1315,1303,NZL NZL,Dylan HENTON Aviva PAK,13,0 - 0,,350 / 1
1316,1303,NZL DEN,Jasmanjot VIRK Josefine Redkjær JENSEN,13,0 - 0,,350 / 1
1317,1303,NZL NZL,Vincent HARRIS Felicity LEYDON-DAVIS,13,0 - 0,,350 / 1
1318,1303,NZL NZL,Chee Foong LIM Maysell DOWNEY,13,0 - 0,,350 / 1
1319,1303,NZL NZL,Joshua CURRY Caragh ALLEY,13,0 - 0,,350 / 1
1320,1303,BLR BLR,Vladzislav KUSHNIR Krestina SILICH,13,0 - 0,,350 / 1
1321,1303,AUS AUS,Pit Seng LOW Melinda SUN,13,0 - 0,,350 / 1
1322,1303,POL POL,Piotr WASILUK JANOWSKA KAROLINA,13,0 - 0,,350 / 1
1323,1324,ESP ESP,Ernesto VELAZQUEZ Beatriz CORRALES,13,0 - 0,,349 / 1
1324,1325,MAS MAS,Yan Sheng LEE Erica Pei Shan KHOO,13,0 - 0,,340 / 2
1325,1326,THA THA,Tanawat TOPATTANAKUL Rujjanabordee SRIPAIBOON,13,0 - 0,,320 / 1
1326,1326,THA THA,Korawi PIKUNNGAM Thanapim KAWEENUNTAVONG,13,0 - 0,,320 / 1
1327,1326,THA THA,Supakit JANDARA Thunyathorn THAMNOPAKAO,13,0 - 0,,320 / 1
1328,1326,BRA BRA,Hugo ARTHUSO Paula B PEREIRA,13,0 - 0,,320 / 1
1329,1326,NZL NZL,Shyam PURUSHOTHMAN Alyse DERBY,13,0 - 0,,320 / 1
1330,1326,NZL NZL,Jian WANG Soomi Lina LEE,13,0 - 0,,320 / 1
1331,1326,INA INA,Andrei ADISTIA Jenna GOZALI,13,0 - 0,,320 / 1
1332,1326,MAS MAS,Khek Wei CHUA Zhen YAP,13,0 - 0,,320 / 1
1333,1326,JPN JPN,Takuto INOUE Ayane KURIHARA,13,0 - 0,,320 / 1
1334,1326,INA INA,Kaizar Bobby ALEXANDER Keshya Nurvita HANADIA,13,0 - 0,,320 / 1
1335,1326,NZL NZL,Thomas ELLIS Hayley THOMPSON,13,0 - 0,,320 / 1
1336,1326,TPE TPE,Chu-En HUANG YU Wen KUO,13,0 - 0,,320 / 1
1337,1326,HKG HKG,CHAN Tsz Kit SHEK Hiu Yiu,13,0 - 0,,320 / 1
1338,1339,FIN FIN,Julius VON PFALER Tuuli HARKONEN,14,0 - 0,,310 / 2
1339,1340,EST EST,Mario SAUNPERE Kati-Kreet MARRAN,14,0 - 0,,290 / 3
1340,1341,CHN CHN,LIU Cheng ZHAO Yunlei,14,0 - 0,,285 / 1
1341,1342,CZE CZE,Jan SOMERLIK Dominika BUDZELOVA,14,0 - 0,,270 / 2
1342,1343,MAC MAC,U Ieong IEK Xue Xin GONG,14,0 - 0,,240 / 1
1343,1343,CAN CAN,Andy KO Valerie Pauline CHEUNG,14,0 - 0,,240 / 1
1344,1343,CAN CAN,Darren HONG Erin O'DONOGHUE,14,0 - 0,,240 / 1
1345,1343,SCO SCO,Danny LEINSTER Kirsten GEALS,14,0 - 0,,240 / 1
1346,1343,SCO SCO,Callum MACMILLAN Sarah FINDLAY,14,0 - 0,,240 / 1
1347,1343,HKG HKG,CHANG Tak Ching TSANG Wing Chiu Avery,14,0 - 0,,240 / 1
1348,1343,CAN CAN,Nathan OSBORNE Josephine WU,14,0 - 0,,240 / 1
1349,1350,NOR NOR,Magnus CHRISTENSEN Marie CHRISTENSEN,0,0 - 0,,210 / 1
1350,1350,UKR UKR,Artem TKACHUK POTAPENKO Tetyana,14,0 - 0,,210 / 1
1351,1350,DEN DEN,Soren GRAVHOLT Sara LUNDGAARD,14,0 - 0,,210 / 1
1352,1350,SVK SVK,Bohumil KASELA Lenka DROTAROVA,14,0 - 0,,210 / 1
1353,1350,TPE TPE,HUNG Jin-Yi TAI Wei-Ling,14,0 - 0,,210 / 1
1354,1350,IND IND,Anup SRIDHAR Arathi Sara SUNIL,14,0 - 0,,210 / 1
1355,1350,INA INA,Kaizar Bobby ALEXANDER Fransisca Angelica RAHARDJA,14,0 - 0,,210 / 1
1356,1350,SUI SUI,Clément WERKMEISTER Diane RUSSI,14,0 - 0,,210 / 1
1357,1350,FIN EST,Akseli DANSKANEN Melissa MAZURTSAK,14,0 - 0,,210 / 1
1358,1350,NED NED,Remco KUILMAN Esther KUILMAN,14,0 - 0,,210 / 1
1359,1350,POR POR,Ricardo SILVA Daniela CONCEICAO,14,0 - 0,,210 / 1
1360,1350,SUI SUI,Thomas HEINIGER Tiffany GIRONA,14,0 - 0,,210 / 1
1361,1362,INA INA,Travis MONIAGA Tracy MONIAGA,13,0 - 0,,200 / 2
1362,1363,AUT GER,Roman ZIRNWALD Barbara BELLENBERG,13,0 - 0,,170 / 1
1363,1363,POL POL,Pawel PIETRYJA Kornelia MARCZAK,13,0 - 0,,170 / 1
1364,1363,FRA FRA,Thomas VALLEZ Verlaine FAULMANN,13,0 - 0,,170 / 1
1365,1363,ESP ESP,Adrian ALCAIDE Lucia GALVIN,13,0 - 0,,170 / 1
1366,1363,FRA FRA,Jocelyn DESCHAMP Delphine DELRUE,13,0 - 0,,170 / 1
1367,1363,DEN DEN,Joel EIPE Cecilie FINNE-IPSEN,13,0 - 0,,170 / 1
1368,1363,JPN JPN,Takahiro FUJIMAKI Misaki MAKINO,13,0 - 0,,170 / 1
1369,1363,JPN JPN,Keiichiro MATSUI Mirai SHINODA,13,0 - 0,,170 / 1
1370,1363,FRA FRA,Arif RASIDI Héloïse LE MOULEC,13,0 - 0,,170 / 1
1371,1363,FRA FRA,Tanguy BLANCHARD Lauren FONTAINE,13,0 - 0,,170 / 1
1372,1363,INA INA,Ivanudin RIFAN FAUZIN Ganis Nur RAHMADANI,13,0 - 0,,170 / 1
1373,1363,VIE VIE,Binh Minh NGUYEN Ngoc Bich PHAM,13,0 - 0,,170 / 1
1374,1363,VIE VIE,Nguyen Khang HUYNH Kim Ngan DANG,13,0 - 0,,170 / 1
1375,1363,THA THA,Saran JAMSRI Nattcha CHATPUTTARN,13,0 - 0,,170 / 1
1376,1363,UKR UKR,DON SERGEY Mariya RUD,13,0 - 0,,170 / 1
1377,1363,CZE CZE,IVO Stoklas Sarka KRIZKOVA,13,0 - 0,,170 / 1
1378,1363,BUL AUT,Peyo BOICHINOV Sonja LANGTHALER,13,0 - 0,,170 / 1
1379,1363,SUI SUI,Anthony DUMARTHERAY Cendrine HANTZ,13,0 - 0,,170 / 1
1380,1363,SWE SWE,Andy Hartono TANDAPUTRA Berfin ASLAN,13,0 - 0,,170 / 1
1381,1363,DEN SWE,Kristoffer KNUDSEN Louise ERIKSSON,13,0 - 0,,170 / 1
1382,1363,ITA ITA,Kevin STROBL Marah PUNTER,13,0 - 0,,170 / 1
1383,1363,ITA ITA,Fabio CAPONIO Giulia FIORITO,13,0 - 0,,170 / 1
1384,1363,FRA RUS,Sylvain TERNON Natalia PERMINOVA,13,0 - 0,,170 / 1
1385,1363,MAS IRL,Beryno Jiann Tze WONG Megan BREDIN,13,0 - 0,,170 / 1
1386,1363,IRL IRL,Norman Chun Hang LAU Moya RYAN,13,0 - 0,,170 / 1
1387,1363,BUL BUL,Mihael MIHAYLOV Rumiana IVANOVA,13,0 - 0,,170 / 1
1388,1363,JPN JPN,Yuki YONEMOTO Haruka YONEMOTO,13,0 - 0,,170 / 1
1389,1363,ESP ESP,Eliecer OJEDA Noelia JIMENEZ,13,0 - 0,,170 / 1
1390,1363,GER GER,Philipp WACHENFELD Fabienne KOEHLER,13,0 - 0,,170 / 1
1391,1392,MAC MAC,U Ieong IEK Weng Chi NG,13,0 - 0,,130 / 1
1392,1392,MAC MAC,Hok Man LOU Kit Ieng WONG,13,0 - 0,,130 / 1
1393,1392,AUS AUS,Cham CHEN Jennifer TAM,13,0 - 0,,130 / 1
1394,1392,LTU LTU,Donatas NARVILAS Gerda VOITECHOVSKAJA,13,0 - 0,,130 / 1
1395,1396,FRA FRA,Thomas BAURES Margot LAMBERT,13,0 - 0,,120 / 2
1396,1397,NOR NOR,Karl ØDEGÅRD Christiane DAHL NIELSEN,0,0 - 0,,100 / 1
1397,1397,SWE SWE,Martin FORSSBERG Madeleine PERSSON,0,0 - 0,,100 / 1
1398,1397,NOR NOR,Toheed Ahmad SAEED Frida SOTNES HAMANG,0,0 - 0,,100 / 1
1399,1397,NOR NOR,Mads MARUM Marlene WÅLAND,0,0 - 0,,100 / 1
1400,1397,NOR NOR,Jorgen ROSENLUND Jeanette SVENDSEN,0,0 - 0,,100 / 1
1401,1397,HUN MAS,Gergely KRAUSZ Yee See CHEAH,13,0 - 0,,100 / 1
1402,1397,SCO SCO,Adam HALL Eleanor O'DONNELL,13,0 - 0,,100 / 1
1403,1397,SVK SVK,Bohumil KASELA Katarina SARISCANOVA,13,0 - 0,,100 / 1
1404,1397,SCO SCO,Josh NEIL Rebekka FINDLAY,13,0 - 0,,100 / 1
1405,1397,NOR NOR,Jorgen ROSENLUND Thea Kristina JOHANSEN,13,0 - 0,,100 / 1
1406,1397,POL POL,Bartłomiej PARYSZ Daniela BIELINSKA,13,0 - 0,,100 / 1
1407,1397,POL POL,Robert MIRGA Kornelia MARCZAK,13,0 - 0,,100 / 1
1408,1397,POL POL,Jan RUDZINSKI Wiktoria FALANDYSZ,13,0 - 0,,100 / 1
1409,1397,POL POL,Wojciech SAJDOK Barbara KNOPEK,13,0 - 0,,100 / 1
1410,1397,PHI PHI,Paul John PANTIG Joella Geva DE VERA,13,0 - 0,,100 / 1
1411,1397,MAS MAS,Yeet Siang LIN Wei Chyi TI,13,0 - 0,,100 / 1
1412,1397,TPE TPE,LU Jin-Song LEE Wei Tzu,13,0 - 0,,100 / 1
1413,1397,THA THA,Kunlavut VITIDSARN Pattarasuda CHAIWAN,13,0 - 0,,100 / 1
1414,1397,SLO SLO,Urban TURK Katarina BETON,13,0 - 0,,100 / 1
1415,1397,SLO SLO,Dani KLANCAR Nika POLANIC,13,0 - 0,,100 / 1
1416,1397,SLO SLO,Beber ALJOSA Vesna BRLIČ,13,0 - 0,,100 / 1
1417,1397,SLO SLO,Aljaž ROSKAR Eva GRUBER,13,0 - 0,,100 / 1
1418,1397,INA INA,Axel Raditya VASYAH Vania Lystia VASYAH,13,0 - 0,,100 / 1
1419,1397,INA INA,Muhmmad Shohibul FIKRI Triya NURSAADIYAH,13,0 - 0,,100 / 1
1420,1397,INA INA,Muhammad Andi PURNOMO Violita DEWI,13,0 - 0,,100 / 1
1421,1397,INA INA,Abhinaya ADIRA Virni Putri JAFAR,13,0 - 0,,100 / 1
1422,1397,ROU ROU,Robert CIOBOTARU Adelina MARIN TERINTE,13,0 - 0,,100 / 1
1423,1397,ROU ROU,David NITU Nitu MIRUNA ELENA,13,0 - 0,,100 / 1
1424,1397,ROU ROU,Andreas THIEL Ioana IONICA,13,0 - 0,,100 / 1
1425,1397,POR POR,Miguel PINTO Joana AMARAL,13,0 - 0,,100 / 1
1426,1397,POR POR,Manuel LEITAO Ana ALBUQUERQUE,13,0 - 0,,100 / 1
1427,1397,POR POR,Angelo SILVA Ana DIAS,13,0 - 0,,100 / 1
1428,1397,POR POR,Joao MARQUES Joana LOPES,13,0 - 0,,100 / 1
1429,1397,POR POR,Ruben VIEIRA Ana AMARAL,13,0 - 0,,100 / 1
1430,1397,POR POR,Guilherme PEREIRA Gabriela PEREIRA,13,0 - 0,,100 / 1
1431,1397,EST EST,Mikk OUNMAA Grete PALL,13,0 - 0,,100 / 1
1432,1397,FIN FIN,Ville RASI Riina MAKELA,13,0 - 0,,100 / 1
1433,1397,SLO SLO,Urban HERMAN Nastja STOVANJE,13,0 - 0,,100 / 1
1434,1397,LTU LTU,Renaldas SILERIS Gabriele JANUSONYTE,13,0 - 0,,100 / 1
1435,1397,POR POR,Bruno CARVALHO Sonia GONCALVES,13,0 - 0,,100 / 1
1436,1397,POR POR,Paulo MENDONCA Isabel MATIAS,13,0 - 0,,100 / 1
1437,1438,ISL ISL,Daniel THOMSEN Rakel JOHANNESDOTTIR,12,0 - 0,,93 / 1
1438,1439,AUT AUT,Matthias ALMER Elisabeth BALDAUF,12,0 - 0,,88 / 1
1439,1440,SVK SVK,Richard SMATLAK Lenka DROTAROVA,12,0 - 0,,60 / 1
1440,1440,SVK SVK,Michal MATEJKA Julia POLACKOVA,12,0 - 0,,60 / 1
1441,1440,NOR NOR,Sturla Flaten JORGENSEN Anne KLYVE,12,0 - 0,,60 / 1
1442,1440,SVK SVK,Marian SMREK Lucia GRENCIKOVA,12,0 - 0,,60 / 1
1443,1440,LAT LAT,Toms PREINBERGS Ieva POPE,12,0 - 0,,60 / 1
1444,1440,RUS RUS,Kirill ERMAKOV Anastasia DOBRININA,12,0 - 0,,60 / 1
1445,1440,EST EST,Marcus LÕO Mari Ann KARJUS,12,0 - 0,,60 / 1
1446,1440,LAT LAT,Toms PREINBERGS Aija POPE,12,0 - 0,,60 / 1
1447,1440,FRA FRA,Marc LAPORTE Yaelle HOYAUX,12,0 - 0,,60 / 1
1448,1449,SRI SRI,Achini RATNASIRI Nimmika THISARA,13,0 - 0,,36 / 1
1449,1450,ALG ALG,Mohamed Amine GUELMAOUI Baya NESRINE,13,0 - 0,,2 / 1
1450,1450,GHA GHA,Gifty MENSAH Emmanuel YAW DONKOR,13,0 - 0,,2 / 1
1451,1450,BOT BOT,Kgalalelo KEGAKILWE Orideetse THELA,13,0 - 0,,2 / 1
1452,1450,NGR NGR,Dorcas Ajoke ADESOKAN Victor MAKANJU,13,0 - 0,,2 / 1
1453,1450,TUR TUR,Ozge BAYRAK Ramazan OZTURK,13,0 - 0,,2 / 1
1454,1450,ITA ITA,Rosario MADDALONI Karin MARAN,13,0 - 0,,2 / 1
1455,1456,PHI PHI,Ronel ESTANISLAO Thea Marie POMAR,13,0 - 0,,2 / 1
