,RANK,COUNTRY,PLAYER,CHANGE +/-,WIN - LOSE,PRIZE MONEY,POINTS / TOURNAMENTS
370,371,UZB UZB,Oleg SAVATUGIN Valeriya MUSHTAKOVA,7,0 - 0,,"2,650 / 3"
371,372,THA THA,Parinyawat THONGNUAM Phataimas MUENWONG,7,0 - 0,,"2,630 / 2"
372,373,THA THA,Panachai WORASAKTYANAN Rawimon IAMRATANAMAETHEEKUL,7,0 - 0,,"2,620 / 3"
373,374,DEN DEN,Mathias BAY-SMIDT Nanna VESTERGAARD,7,0 - 0,,"2,600 / 3"
374,375,UZB UZB,Amrullo BAKHSHULLAEV Anait KHURSHUDYAN,7,0 - 0,,"2,590 / 5"
375,376,NZL NZL,Kevin DENNERLY-MINTURN Danielle TAHURI,7,0 - 0,,"2,590 / 2"
376,376,INA INA,Afiat Yuris WIRAWAN Jenna GOZALI,7,0 - 0,,"2,590 / 2"
377,376,CHN CHN,YU Xiaoyu ZHU Mai Ci,7,0 - 0,,"2,590 / 2"
378,376,SUI BUL,Gilles TRIPET Diana DIMOVA,7,0 - 0,,"2,590 / 2"
379,380,CRO CRO,Zvonimir DURKINJAK Mateja CICA,8,0 - 0,,"2,500 / 1"
380,380,TPE TPE,Chia-Han LEE Chia Hsin LEE,8,0 - 0,,"2,500 / 1"
381,380,DEN DEN,Nicklas MATHIASEN Cecilie BJERGEN,8,0 - 0,,"2,500 / 1"
382,383,JPN JPN,Tomoya TAKASHINA Rie ETOH,8,0 - 0,,"2,440 / 2"
383,384,CRO CRO,Igor CIMBUR Stasa POZNANOVIC,8,0 - 0,,"2,390 / 3"
384,384,POL POL,Milosz BOCHAT WITEK MAGDALENA,8,0 - 0,,"2,390 / 3"
385,386,FRA FRA,Vincent ESPEN Manon KRIEGER,8,0 - 0,,"2,350 / 5"
386,387,MAS MAS,"Zhen Ting LIM Peiy Yee, Payee LIM",8,0 - 0,,"2,320 / 3"
387,388,KAZ KAZ,Artur NIYAZOV Ilyana FILIPCHUK,8,0 - 0,,"2,320 / 2"
388,389,AUT AUT,Roman ZIRNWALD Sonja LANGTHALER,8,0 - 0,,"2,300 / 2"
389,389,TUR TUR,Muhammed Ali KURT Kader İNAL,8,0 - 0,,"2,300 / 2"
390,389,BOT BOT,Orideetse THELA Botho MAKUBATE,8,0 - 0,,"2,300 / 2"
391,392,SLO SLO,Miha IVANIC Lia SALEHAR,8,0 - 0,,"2,290 / 2"
392,392,PER PER,Daniel LA TORRE REGAL Camilla GARCIA,8,0 - 0,,"2,290 / 2"
393,394,POL POL,Maciej DABROWSKI Weronika GRUDZINA,9,0 - 0,,"2,280 / 3"
394,395,NZL NZL,Benjamin HILLIER Selena WU,9,0 - 0,,"2,270 / 2"
395,396,FIN FIN,Marko PYYKONEN Mathilda LINDHOLM,9,0 - 0,,"2,260 / 4"
396,397,INA INA,Drajat BENO Yulfira BARKAH,9,0 - 0,,"2,230 / 2"
397,398,IND IND,Kamaldeep SINGH Smriti NAGARKOTI,9,0 - 0,,"2,220 / 1"
398,398,IND IND,Rishabh SAHDEV Mohita SAHDEV,9,0 - 0,,"2,220 / 1"
399,398,IND IND,Varun SHARMA Rachita SAHDEV,9,0 - 0,,"2,220 / 1"
400,398,IND IND,Rajat RATHORE Parssa NAQVI,9,0 - 0,,"2,220 / 1"
401,398,DEN DEN,Joachim FISCHER NIELSEN Marie ROEPKE,9,0 - 0,,"2,220 / 1"
402,398,UZB UZB,Amrullo BAKHSHULLAEV Valeriya MUSHTAKOVA,9,0 - 0,,"2,220 / 1"
403,398,MAC MAC,WONG Chi Chong Teng Iok U,9,0 - 0,,"2,220 / 1"
404,398,CHN CHN,WANG YILYU XIA Huan,9,0 - 0,,"2,220 / 1"
405,398,FRA FRA,Sebastien VINCENT Andréa VANDERSTUKKEN,9,0 - 0,,"2,220 / 1"
406,407,ENG ENG,James LAUDER Ira BANERJEE,9,0 - 0,,"2,210 / 2"
407,407,ENG ENG,Scott P WILLIAMS Jessica HOPTON,9,0 - 0,,"2,210 / 2"
408,407,ENG ENG,Matthew CLARE Devon MINNIS,9,0 - 0,,"2,210 / 2"
409,407,TPE TPE,Yi-Hsiang YANG Yu Chen CHANG,9,0 - 0,,"2,210 / 2"
410,407,TPE TPE,HUNG Ying Yuan CHEN Hung Yu,9,0 - 0,,"2,210 / 2"
411,412,DEN DEN,David DAUGAARD Mai SURROW,9,0 - 0,,"2,200 / 3"
412,413,RUS RUS,Konstantin ABRAMOV Natalia Rogova,9,0 - 0,,"2,200 / 1"
413,413,JPN JPN,Akira KOGA Yuki FUKUSHIMA,9,0 - 0,,"2,200 / 1"
414,413,JPN JPN,Takuto INOUE Naru SHINOYA,9,0 - 0,,"2,200 / 1"
415,413,DEN DEN,David DAUGAARD Maria HELSBOL,9,0 - 0,,"2,200 / 1"
416,413,TPE TPE,LU Ching Yao CHIANG Kai Hsin,9,0 - 0,,"2,200 / 1"
417,413,TPE TPE,HUANG Po Jui WU Fang Chien,9,0 - 0,,"2,200 / 1"
418,413,CHN CHN,GAO Xiangcheng WU Qianqian,9,0 - 0,,"2,200 / 1"
419,413,CHN CHN,GUO Yuchen ZHENG Yuwen,9,0 - 0,,"2,200 / 1"
420,413,THA THA,Wasapon UTTAMANG Thanaporn KIAWCHA-ON,9,0 - 0,,"2,200 / 1"
421,413,IND IND,S. Sanjeeth G. M. Nischitha,9,0 - 0,,"2,200 / 1"
422,413,IND IND,Chirag SHETTY Kuhoo GARG,9,0 - 0,,"2,200 / 1"
423,413,IND IND,KONA Tarun Prajakta SAWANT,9,0 - 0,,"2,200 / 1"
424,413,ITA ESP,Wisnu Haryo PUTRO Laia OSET,9,0 - 0,,"2,200 / 1"
425,413,IND IND,Satinder MALIK Kristi DAS,9,0 - 0,,"2,200 / 1"
426,413,INA INA,Rian SWASTEDIAN Nisak Puji LESTARI,9,0 - 0,,"2,200 / 1"
427,413,INA INA,Hardianto HARDIANTO Maretha Dea GIOVANI,9,0 - 0,,"2,200 / 1"
428,413,MAS MAS,Ren Cong CHAN Lyddia Yi Yu CHEAH,9,0 - 0,,"2,200 / 1"
429,413,TPE TPE,HUNG Ying Yuan YANG Ching Tun,9,0 - 0,,"2,200 / 1"
430,413,JPN JPN,Takuro HOKI Kurumi YONAO,9,0 - 0,,"2,200 / 1"
431,413,INA INA,Agripinna Prima Rahmanto PUTRA Ririn AMELIA,9,0 - 0,,"2,200 / 1"
432,413,INA INA,Afiat Yuris WIRAWAN Ririn AMELIA,-95,0 - 0,,"2,200 / 1"
433,413,THA THA,Pakkawat VILAILAK Phataimas MUENWONG,9,0 - 0,,"2,200 / 1"
434,413,THA THA,Takdanai BOONRAWD Kilasu OSTERMEYER,9,0 - 0,,"2,200 / 1"
435,413,USA USA,Mathew FOGARTY Lina TAFT,9,0 - 0,,"2,200 / 1"
436,413,CHN CHN,LI Junhui OU Dongni,9,0 - 0,,"2,200 / 1"
437,413,THA THA,Nipitphon PUANGPUAPECH Savitree AMITRAPAI,9,0 - 0,,"2,200 / 1"
438,413,CZE CZE,Milan LUDIK Kristina GAVNHOLT,9,0 - 0,,"2,200 / 1"
439,440,SWE SWE,Christian PETTERSON Amanda ANDERN,8,0 - 0,,"2,190 / 4"
440,441,SVK SVK,Matej HLINICAN Jana CIZNAROVA,8,0 - 0,,"2,183 / 1"
441,442,NOR NOR,Fredrik KRISTENSEN Natalie SYVERTSEN,8,0 - 0,,"2,170 / 4"
442,443,MAS SUI,Beryno Jiann Tze WONG Ayla HUSER,8,0 - 0,,"2,160 / 3"
443,444,DEN DEN,Maja RINDSHOEJ Kristoffer KNUDSEN,9,0 - 0,,"2,130 / 1"
444,444,DEN DEN,Lasse MOELHEDE Trine VILLADSEN,9,0 - 0,,"2,130 / 1"
445,444,INA BUL,Gideon Markus FERNALDI Gabriela STOEVA,9,0 - 0,,"2,130 / 1"
446,444,RSA RSA,Prakash VIJAYANATH Stacey DOUBELL,9,0 - 0,,"2,130 / 1"
447,444,ETH ETH,Asnake Getachew SAHILU Yerusksew Legssey TURA,9,0 - 0,,"2,130 / 1"
448,444,JOR JOR,Bahaedeen Ahmad ALSHANNIK Domou AMRO,9,0 - 0,,"2,130 / 1"
449,450,IND IND,Dinesh CHAUDHRY Lalita DAHIYA,9,0 - 0,,"2,110 / 1"
450,450,JPN JPN,Kenya MITSUHASHI Chisato HOSHI,9,0 - 0,,"2,110 / 1"
451,450,JAM JAM,Dayvon REID Ruth WILLIAMS,9,0 - 0,,"2,110 / 1"
452,450,AUS AUS,Edwin LUK Ruwindi SERASINGHE,9,0 - 0,,"2,110 / 1"
453,450,AUS AUS,Simon Wing Hang LEUNG Claudia LAM,9,0 - 0,,"2,110 / 1"
454,450,NZL NZL,Brock MATHESON Rebecca GODDARD,9,0 - 0,,"2,110 / 1"
455,450,CAN CAN,Felix DEBLOIS-BEAUCAGE Nadianie OUAQOUAQ-BERGERON,9,0 - 0,,"2,110 / 1"
456,450,NED NED,Ruben JILLE Iris TABELING,9,0 - 0,,"2,110 / 1"
457,450,HKG HKG,YEUNG Shing Choi CHAN Hung Yung,9,0 - 0,,"2,110 / 1"
458,450,JPN JPN,Kenta KAZUNO Yui MIYAUCHI,9,0 - 0,,"2,110 / 1"
459,450,ENG WAL,Conor BAMBRICK Aimee MORAN,9,0 - 0,,"2,110 / 1"
460,461,IND IND,Harinder MALIK Teenu DAHIYA,9,0 - 0,,"2,100 / 2"
461,461,IND IND,Gaurav KALIA Ekta KALIA,9,0 - 0,,"2,100 / 2"
462,461,INA INA,Didit JUANG Keshya Nurvita HANADIA,9,0 - 0,,"2,100 / 2"
463,461,ISR ISR,Yonathan LEVIT Yana MOLODEZKI,9,0 - 0,,"2,100 / 2"
464,461,THA THA,Songphon ANUGRITAYAWON Kunchala VORAVICHITCHAIKUL,9,0 - 0,,"2,100 / 2"
465,466,SRB SRB,Dragoslav PETROVIC Milica SIMIC,9,0 - 0,,"2,090 / 3"
466,467,VIE VIE,Minh BAO Thi Thanh Thuy LE,9,0 - 0,,"2,080 / 3"
467,468,THA THA,Pakin KUNA-ANUVIT Kwanchanok SUDJAIPRAPARAT,9,0 - 0,,"2,070 / 2"
468,468,PER PER,Diego MINI Paula LA TORRE REGAL,9,0 - 0,,"2,070 / 2"
469,468,CHI CHI,Cristian ARAYA Camila MACAYA,9,0 - 0,,"2,070 / 2"
470,471,BLR BLR,Dzmitry SAIDAKOU Alesia ZAITSAVA,10,0 - 0,,"2,020 / 5"
471,472,VIE VIE,Tuan Duc DO Thu Huyen LE,-20,0 - 0,,"1,980 / 3"
472,473,NZL NZL,Dhanny OUD Jasmin Chung Man NG,9,0 - 0,,"1,960 / 3"
473,474,NZL NZL,Dylan SOEDJASA Justine VILLEGAS,9,0 - 0,,"1,950 / 2"
474,474,NZL NZL,Maoni HU HE Ashleigh KARL,9,0 - 0,,"1,950 / 2"
475,476,TUR TUR,Bahadir Kaan KOLA Busra YALÇINKAYA,9,0 - 0,,"1,920 / 2"
476,477,TPE TPE,HUNG Ying Yuan CHIANG Kai Hsin,9,0 - 0,,"1,910 / 2"
477,478,NZL NZL,Thomas ELLIS Samantha MCCAMISH,9,0 - 0,,"1,890 / 2"
478,479,PHI PHI,Alvin MORADA Alyssa Yasbel LEONARDO,9,0 - 0,,"1,840 / 2"
479,479,INA INA,Indra LESMANA Hera DESI,9,0 - 0,,"1,840 / 2"
480,479,FRA CRO,Gregor DUNIKOWSKI Maja PAVLINIC,9,0 - 0,,"1,840 / 2"
481,479,TPE TPE,Chi-Hung LIAO Ling Fang HU,9,0 - 0,,"1,840 / 2"
482,479,NGR NGR,Kayode OLATUNJI Zainab AKINYEMI,9,0 - 0,,"1,840 / 2"
483,479,NGR NGR,Godwin OLOFUA Oluwatosin SOLADEMI,9,0 - 0,,"1,840 / 2"
484,479,NGR NGR,Kayode Samuel OYENIRAN Zainab MOMOH,9,0 - 0,,"1,840 / 2"
485,479,NGR NGR,Idowu Timothy ADEKUNLE Asisat OGUNKANBI,9,0 - 0,,"1,840 / 2"
486,479,BRA BRA,Artur Silva POMOCENO Ana Paula CAMPOS,9,0 - 0,,"1,840 / 2"
487,479,TUR TUR,Muhammed Ali KURT Ozge TOYRAN,9,0 - 0,,"1,840 / 2"
488,489,TPE TPE,Hsuan Wen CHANG Tzu Chin PAN,10,0 - 0,,"1,830 / 3"
489,489,TPE TPE,En Chia CHANG Ya Ting CHIANG,10,0 - 0,,"1,830 / 3"
490,491,TPE TPE,Yu-Hua LAI Shuo Yun SUNG,10,0 - 0,,"1,800 / 5"
491,492,FRA FRA,Thom GICQUEL Vimala HERIAU,10,0 - 0,,"1,770 / 2"
492,492,RUS RUS,Kirill Romanuk Anna ASTRAKHANTSEVA,10,0 - 0,,"1,770 / 2"
493,494,ENG ENG,David KING Nicola GRESTY,10,0 - 0,,"1,760 / 2"
494,495,RUS RUS,Artem SERPIONOV Tatjana BIBIK,11,0 - 0,,"1,750 / 1"
495,495,MRI MRI,Aatish LUBAH Kobita DOKHEE,11,0 - 0,,"1,750 / 1"
496,495,INA INA,Ramadiansyah ANDIKA Mychelle Crhystine BANDASO,11,0 - 0,,"1,750 / 1"
497,495,FIN FIN,Arttu MAHONEN Sonja PEKKOLA,11,0 - 0,,"1,750 / 1"
498,495,INA INA,Akbar Bintang CAHYONO Nugraheny RISTYA AYU,11,0 - 0,,"1,750 / 1"
499,495,JAM JAM,Willroy MILES Katherine WYNTER,11,0 - 0,,"1,750 / 1"
500,495,JAM JAM,Dennis COKE Mikaylia HALDANE,11,0 - 0,,"1,750 / 1"
501,495,ZAM ZAM,Ngosa CHONGO Ogar SIAMUPANGILA,11,0 - 0,,"1,750 / 1"
502,495,MEX MEX,Vicente CISNEROS Adelina QUIÑONES,11,0 - 0,,"1,750 / 1"
503,495,NGR NGR,Victor MAKANJU Augustina EBHOMIEN SUNDAY,11,0 - 0,,"1,750 / 1"
504,495,ETH ETH,YAKOB Surafel Tigist GETACHEW,11,0 - 0,,"1,750 / 1"
505,495,TPE TPE,Cheng Heng SU HUANG Mei Ching,11,0 - 0,,"1,750 / 1"
506,495,NED NED,Ruben JILLE Soraya DE VISCH EIJBERGEN,11,0 - 0,,"1,750 / 1"
507,495,JOR JOR,Bani Mustafa HASAN ALI Mazahreh LEINA FEHMI,11,0 - 0,,"1,750 / 1"
508,495,ETH ETH,ASRAR Seid BELETE Melat,11,0 - 0,,"1,750 / 1"
509,495,MAR MAR,Hamza HOUMIDA Harag NAZIK,11,0 - 0,,"1,750 / 1"
510,495,SUR SUR,Dylan DARMOHOETOMO Rugshaar ISHAAK,11,0 - 0,,"1,750 / 1"
511,495,NED NED,Jelle MAAS Ilse VAESSEN,11,0 - 0,,"1,750 / 1"
512,495,NGR NGR,Olorunfemi ELEWA Braimoh MARIA,11,0 - 0,,"1,750 / 1"
513,514,TPE TPE,Chia Hung LU Su Yu CHEN,11,0 - 0,,"1,730 / 2"
514,515,DEN FRA,Soeren TOFT HANSEN Teshana VIGNES WARAN,11,0 - 0,,"1,700 / 1"
515,516,TPE TPE,CHENG Po Wei Chien Hui YU,11,0 - 0,,"1,690 / 4"
516,517,CHN CHN,LIU Yuchen ZHONG Qianxin,11,0 - 0,,"1,670 / 1"
517,517,CHN CHN,HE Jiting JIA Yifan,11,0 - 0,,"1,670 / 1"
518,517,AUS AUS,Alphonsus NG Ruwindi SERASINGHE,11,0 - 0,,"1,670 / 1"
519,517,NZL NZL,Brock MATHESON Angie LEUNG,11,0 - 0,,"1,670 / 1"
520,517,NZL TPE,Joe WU HUNG Shih Han,11,0 - 0,,"1,670 / 1"
521,517,CHN CHN,LI Junhui ZHONG Qianxin,11,0 - 0,,"1,670 / 1"
522,517,TPE TPE,LU Chia Pin Chien Hui YU,11,0 - 0,,"1,670 / 1"
523,517,FRA FRA,Bastian KERSAUDY Lorraine BAUMANN,11,0 - 0,,"1,670 / 1"
524,517,FRA FRA,Ronan GUEGUIN Joanna CHAUBE,11,0 - 0,,"1,670 / 1"
525,517,IND IND,Dinesh CHAUDHRY Rucha NIKAM,11,0 - 0,,"1,670 / 1"
526,517,IND IND,Shivam SHARMA Sanskriti CHHABRA,11,0 - 0,,"1,670 / 1"
527,517,MAS MAS,Khim Wah LIM Meng Yean LEE,11,0 - 0,,"1,670 / 1"
528,517,HKG HKG,LAW Cheuk Him NG Wing Yung,11,0 - 0,,"1,670 / 1"
529,517,GER INA,Jones Ralfy JANSEN Nadya MELATI,11,0 - 0,,"1,670 / 1"
530,517,CHN CHN,CHEN Zhuofu YU Xiaohan,11,0 - 0,,"1,670 / 1"
531,517,INA INA,Richard KUNCORO Mega Cahya Purnama LESTARI,11,0 - 0,,"1,670 / 1"
532,517,INA INA,Supriadi Tedi Mychelle Crhystine BANDASO,11,0 - 0,,"1,670 / 1"
533,517,INA INA,Jeka WIRATAMA Marsheilla Gischa ISLAMI,11,0 - 0,,"1,670 / 1"
534,517,INA INA,Angger SUDRAJAT Felicia PAREMNAS,11,0 - 0,,"1,670 / 1"
535,517,INA INA,Rian SWASTEDIAN Mahadewi Istirani NI KETUT,11,0 - 0,,"1,670 / 1"
536,517,INA INA,Akbar Bintang CAHYONO Rahmadhani Hasiyanti PUTRI,11,0 - 0,,"1,670 / 1"
537,517,INA INA,Tri KUSHARJANTO Keshya Nurvita HANADIA,-261,0 - 0,,"1,670 / 1"
538,517,INA INA,Achmad RIVAI Aris BUDIHARTI,-134,0 - 0,,"1,670 / 1"
539,517,TPE TPE,LIANG Jui Wei Chia Hsin LEE,11,0 - 0,,"1,670 / 1"
540,517,KOR KOR,KANG Ji Wook EOM Hye Won,11,0 - 0,,"1,670 / 1"
541,542,SLO SLO,Luka PETRIC Tina KODRIC,9,0 - 0,,"1,655 / 2"
542,543,RUS RUS,Vladimir RUSIN Tatjana BIBIK,9,0 - 0,,"1,640 / 3"
543,544,NZL NZL,Kent PALMER Emma CHAPPLE,9,0 - 0,,"1,610 / 2"
544,544,VIE VIE,Thanh Long TRUONG Kim Ngan DANG,9,0 - 0,,"1,610 / 2"
545,544,TPE TPE,Hsiao-Lin WU Tsun Yu LIN,9,0 - 0,,"1,610 / 2"
546,547,TPE TPE,LIANG Jui Wei Yu Chieh CHENG,9,0 - 0,,"1,580 / 2"
547,548,NGR NGR,Joshua Adeyemi ODELABI Fatima AZEEZ,9,0 - 0,,"1,520 / 1"
548,548,NGR NGR,Folorunsho Ilesanmi OPEYORI Olabisi IBIYEYE,9,0 - 0,,"1,520 / 1"
549,548,RUS RUS,Sergey SCHERBIN Anastasia NAZARCHUK,9,0 - 0,,"1,520 / 1"
550,548,MAS MAS,Ahmad Maziri MAZLAN Sannatasah SANIRU,9,0 - 0,,"1,520 / 1"
551,548,PER PER,Javier JIMENO Sandra JIMENO GOICOCHEA,9,0 - 0,,"1,520 / 1"
552,548,KOR KOR,CHUNG Eui Seok Hee Yong KONG,9,0 - 0,,"1,520 / 1"
553,548,JPN JPN,Kento SAKAI Hikari SAITO,9,0 - 0,,"1,520 / 1"
554,548,THA THA,Trawut POTIENG Pacharapun CHOCHUWONG,9,0 - 0,,"1,520 / 1"
555,548,THA THA,Parinyawat THONGNUAM Chaladchalam Chayanit,9,0 - 0,,"1,520 / 1"
556,548,SIN SIN,Bimo Adi PRAKOSO Yu Yan Vanessa NEO,9,0 - 0,,"1,520 / 1"
557,548,GUA PER,Rodolfo RAMIREZ Camila DUANY,9,0 - 0,,"1,520 / 1"
558,548,ENG GER,Matthew NOTTINGHAM Jennifer KARNOTT,9,0 - 0,,"1,520 / 1"
559,548,CHN CHN,YU Chen XIA Chunyu,9,0 - 0,,"1,520 / 1"
560,548,NZL TPE,Oliver LEYDON-DAVIS WU Fang Chien,9,0 - 0,,"1,520 / 1"
561,548,CHN CHN,LI Xun LI Yinhui,9,0 - 0,,"1,520 / 1"
562,548,TPE TPE,Shang Kai LIN Ying Chun LIN,9,0 - 0,,"1,520 / 1"
563,548,CHN CHN,ZHOU Haodong CHEN Lu,9,0 - 0,,"1,520 / 1"
564,548,CHN CHN,ZHAO Jian JIANG Binbin,9,0 - 0,,"1,520 / 1"
565,548,CHN CHN,OU Zhe CHEN Xiaofei,9,0 - 0,,"1,520 / 1"
566,548,INA SWE,Wibowo SETYALDI PUTRA Cecilia BJUNER,9,0 - 0,,"1,520 / 1"
567,548,THA THA,Pasin SONGHONG Sararat CHUEBOCA,9,0 - 0,,"1,520 / 1"
568,548,INA INA,Fachriza ABIMANYU Phita Haningtyas MENTARI,9,0 - 0,,"1,520 / 1"
569,548,INA INA,Hendrik K CLINTON Zarra Faza AZKA,9,0 - 0,,"1,520 / 1"
570,548,IND IND,Abhinav PRAKASH Nimmi PATEL,9,0 - 0,,"1,520 / 1"
571,548,BAN BAN,Mohammed Jabed MOSTAFA Alina SULTANA,9,0 - 0,,"1,520 / 1"
572,548,NEP NEP,Indra MEHATA Meena SHRESTHA,9,0 - 0,,"1,520 / 1"
573,548,NEP NEP,Pankaj CHAND Amita GIRI,9,0 - 0,,"1,520 / 1"
574,548,BAN BAN,Tushar Krishna ROY MST Rehana PARVIN,9,0 - 0,,"1,520 / 1"
575,548,TPE WAL,Hsuan Ming LEE Carissa TURNER,9,0 - 0,,"1,520 / 1"
576,548,WAL WAL,Oliver GWILT Emilie GWILT,9,0 - 0,,"1,520 / 1"
577,548,ENG ENG,Joel DOUSE Paige BUTLER,9,0 - 0,,"1,520 / 1"
578,548,SCO ENG,Matthew CARDER Lexi GILDERS,9,0 - 0,,"1,520 / 1"
579,548,TPE TPE,LIN Chia Yu Ya-Han CHANG,9,0 - 0,,"1,520 / 1"
580,548,TPE TPE,Cheng Heng SU YU Min Ju,9,0 - 0,,"1,520 / 1"
581,548,USA GER,Hendri WINARTO Cisita Joity JANSEN,9,0 - 0,,"1,520 / 1"
582,548,INA INA,Andre Kurniawan TEDJONO Aprilsasi Putri LEJARSAR VARIELLA,9,0 - 0,,"1,520 / 1"
583,548,BUL NED,Alex VLAAR Alida CHEN,9,0 - 0,,"1,520 / 1"
584,548,GER NED,Raphael BECK Iris TABELING,9,0 - 0,,"1,520 / 1"
585,548,CHN CHN,BAO Zi Long DING Kexin,9,0 - 0,,"1,520 / 1"
586,548,CHN CHN,QI Shuang Shuang TONG Hao,9,0 - 0,,"1,520 / 1"
587,548,AUS AUS,Ben GOMEZ Jessica LIM,9,0 - 0,,"1,520 / 1"
588,548,AUS AUS,Cham CHEN Claudia LAM,9,0 - 0,,"1,520 / 1"
589,548,AUS AUS,Bosco Lap-Chi KWOK Christine HE,9,0 - 0,,"1,520 / 1"
590,548,GUA USA,Adams RODRIGUEZ Crystal PAN,9,0 - 0,,"1,520 / 1"
591,548,RUS RUS,Aleksandr VASILKIN Kristina VIRVICH,9,0 - 0,,"1,520 / 1"
592,548,UKR UKR,Gennadiy NATAROV Natalya VOYTSEKH,9,0 - 0,,"1,520 / 1"
593,548,JPN JPN,Daisuke SUZUKI Midori SAKURAI,9,0 - 0,,"1,520 / 1"
594,548,JPN JPN,Naoki ISHIKAWA Atsuko KOIKE,9,0 - 0,,"1,520 / 1"
595,548,AUS AUS,Anthony JOE Lee Yen KHOO,9,0 - 0,,"1,520 / 1"
596,548,AUS AUS,Mitchell WHELLER Melinda SUN,9,0 - 0,,"1,520 / 1"
597,548,CAN CAN,Andrew LAU Danica LAU,9,0 - 0,,"1,520 / 1"
598,548,MAS MAS,Kar Seong SOO Harn Xin YAP,9,0 - 0,,"1,520 / 1"
599,548,FRA FRA,Thomas ROUXEL Lea PALERMO,9,0 - 0,,"1,520 / 1"
600,548,BRA BRA,Luiz dos SANTOS JR Ana Paula CAMPOS,9,0 - 0,,"1,520 / 1"
601,548,SRI SRI,Hasitha Chanaka MANANI HEWA Kavindi Ishandika SIRIMANNAGE,9,0 - 0,,"1,520 / 1"
602,548,UKR UKR,Vitaly KONOV Yelyzaveta ZHARKA,9,0 - 0,,"1,520 / 1"
603,548,RUS RUS,Tatjana BIBIK Nikolai UKK,9,0 - 0,,"1,520 / 1"
604,605,THA THA,Natchanon TULAMOK Pattaranan CHAMNAKTAN,14,0 - 0,,"1,470 / 2"
605,605,DOM DOM,Nelson JAVIER Bermary Altagracia POLANCO MUNOZ,14,0 - 0,,"1,470 / 2"
606,605,CHI CHI,Bastian LIZAMA Niria BAEZA,14,0 - 0,,"1,470 / 2"
607,605,SLO SLO,Martin CERKOVNIK Ana Marija SETINA,14,0 - 0,,"1,470 / 2"
608,605,AUT CZE,Dominik STIPSITS Katerina TOMALOVA,14,0 - 0,,"1,470 / 2"
609,605,PER PER,Leonardo ISA Chiara CARRANZA,14,0 - 0,,"1,470 / 2"
610,605,SWE SWE,Emil WELINDER Alexandra DERLE,14,0 - 0,,"1,470 / 2"
611,605,DEN DEN,Steve OLESEN Anna KLINKE,14,0 - 0,,"1,470 / 2"
612,605,INA INA,Indra Viki OKVANA Rosy Oktavia PANCASARI,14,0 - 0,,"1,470 / 2"
613,605,MLT MLT,Samuel CALI SADOWSKI Fiorella Marie,14,0 - 0,,"1,470 / 2"
614,615,POL POL,Maciej OCIEPA GAJOS KAROLINA,15,0 - 0,,"1,460 / 3"
615,616,PHI PHI,Paul Jefferson VIVAS Jessie FRANCISCO,15,0 - 0,,"1,460 / 2"
616,617,BUL BUL,Mihael MIHAYLOV Rumiana IVANOVA,15,0 - 0,,"1,450 / 3"
617,617,NOR NOR,Carl Christian MORK Elisa WIBORG,15,0 - 0,,"1,450 / 3"
618,617,NOR NOR,Sturla Flaten JORGENSEN Solvar FLATEN JORGENSEN,15,0 - 0,,"1,450 / 3"
619,620,HKG HKG,CHANG Tak Ching TSANG Wing Chiu Avery,15,0 - 0,,"1,430 / 2"
620,621,EST EST,Mihkel LAANES Kristin KUUBA,15,0 - 0,,"1,410 / 3"
621,622,DOM DOM,Alberto RAPOSO Licelott SANCHEZ,15,0 - 0,,"1,410 / 2"
622,623,FIN FIN,Anton KAISTI Jenny NYSTROM,15,0 - 0,,"1,394 / 1"
623,624,WAL WAL,Nicolas STRANGE Jordan HART,15,0 - 0,,"1,380 / 3"
624,625,CZE CZE,Bedrich VALENTA Veronika KOLDOVA,15,0 - 0,,"1,370 / 3"
625,626,RSA RSA,Cameron COETZER Sandra LE GRANGE,15,0 - 0,,"1,370 / 1"
626,626,BAR CZE,Sabeel FOSTER Marcela RUZICKA,15,0 - 0,,"1,370 / 1"
627,626,TRI TRI,Will LEE Avril PLAZA MARCELLE,15,0 - 0,,"1,370 / 1"
628,626,CZE TRI,Jan FROHLICH Kamasha ROBERTSON,15,0 - 0,,"1,370 / 1"
629,626,INA INA,Yantoni Edy SAPUTRA Marsheilla Gischa ISLAMI,15,0 - 0,,"1,370 / 1"
630,626,MAS MAS,Sze Fei GOH Mei Xing TEOH,15,0 - 0,,"1,370 / 1"
631,626,SWE SWE,Paul OHLSSON Berfin ASLAN,15,0 - 0,,"1,370 / 1"
632,626,CHI CHI,Bastian LIZAMA Tingting CHOU,15,0 - 0,,"1,370 / 1"
633,626,INA GER,Maziyyah NADHIR Ari TRISNANTO,15,0 - 0,,"1,370 / 1"
634,626,INA INA,Fachriza ABIMANYU Syifa FAUZIAH,15,0 - 0,,"1,370 / 1"
635,626,INA INA,Supriadi Tedi Ririn AMELIA,15,0 - 0,,"1,370 / 1"
636,626,INA INA,Arya Maulana ADIARTAMA Surya DELLA AUGUSTIA,15,0 - 0,,"1,370 / 1"
637,626,SIN SIN,Kean Yew LOH Ai Ninna TAN,15,0 - 0,,"1,370 / 1"
638,626,DEN DEN,Mathias Lund HANSEN Cecilie FINNE-IPSEN,15,0 - 0,,"1,370 / 1"
639,626,FRA FRA,Toma Junior POPOV Delphine DELRUE,15,0 - 0,,"1,370 / 1"
640,626,BOT BOT,Tlhoego CHAMO MALEPA Dintle,15,0 - 0,,"1,370 / 1"
641,626,RSA RSA,Jason COETZER Karen COETZER,15,0 - 0,,"1,370 / 1"
642,626,DEN DEN,Theodor JOHANSEN Josephine VAN ZAANE,15,0 - 0,,"1,370 / 1"
643,626,NED CRO,Koen RIDDER Stasa POZNANOVIC,15,0 - 0,,"1,370 / 1"
644,626,NED GRE,Dennis VAN BEKKUM Ioanna KARKANTZIA,15,0 - 0,,"1,370 / 1"
645,626,MAR MAR,Omar KESIKES Jinane BITARIE,15,0 - 0,,"1,370 / 1"
646,626,MEX MEX,Victor Manuel RAMIREZ Cassandra RIVERO,15,0 - 0,,"1,370 / 1"
647,626,MEX MEX,Bruno MENDEZ Yaqueline DUARTE,15,0 - 0,,"1,370 / 1"
648,626,DEN DEN,Mathias WEBER ESTRUP Cecilie FINNE-IPSEN,15,0 - 0,,"1,370 / 1"
649,626,NGR NGR,Habeeb Temitope BELLO Ruth AIYENUGBA,15,0 - 0,,"1,370 / 1"
650,626,NGR NGR,Paul FAGBEMI Ketu ILOFUAN,15,0 - 0,,"1,370 / 1"
651,626,BLR ISR,Dmitriy SUPRUNIUK Margeret LURIE,15,0 - 0,,"1,370 / 1"
652,626,ETH ETH,TEKLU Endale TADESSE Samrawit,15,0 - 0,,"1,370 / 1"
653,626,MAS MAS,Beng Hong KUAN Sin Er NG,15,0 - 0,,"1,370 / 1"
654,626,CRC CRC,Gianpiero CAVALLOTTI Lauren VILLALOBOS,15,0 - 0,,"1,370 / 1"
655,626,COL COL,Raul PINEDA RODRIGUEZ Maria Julieth PEREZ TANGARIFE,15,0 - 0,,"1,370 / 1"
656,626,AUS AUS,Matthew CHAU Setyana MAPASA,15,0 - 0,,"1,370 / 1"
657,626,RUS RUS,Alexandr KOZYREV Ksenia EVGENOVA,15,0 - 0,,"1,370 / 1"
658,626,TPE TPE,TIEN Tzu Chieh Ya-En CHIANG,-226,0 - 0,,"1,370 / 1"
659,626,GRE GRE,George GALVAS Zoi ALELI,15,0 - 0,,"1,370 / 1"
660,626,MRI MRI,Yeldy Marie LOUISON Denneshsing BABOOLALL,15,0 - 0,,"1,370 / 1"
661,626,SUI SUI,Gilles TRIPET Tiffany GIRONA,15,0 - 0,,"1,370 / 1"
662,626,THA THA,Bowornwatanuwong PHUTTHAPORN Supanida KATETHONG,15,0 - 0,,"1,370 / 1"
663,626,DEN DEN,Mikkel STOFFERSEN Mathilde BJERGEN,15,0 - 0,,"1,370 / 1"
664,626,DEN DEN,Mathias Lund HANSEN Emilie FURBO,15,0 - 0,,"1,370 / 1"
665,626,GER GER,Tobias WADENKA Kira KATTENBECK,15,0 - 0,,"1,370 / 1"
666,626,DOM DOM,Miguel MARINEZ Licelott SANCHEZ,15,0 - 0,,"1,370 / 1"
667,626,INA INA,Yahya Adi KUMARA Rahmadhani Hasiyanti PUTRI,15,0 - 0,,"1,370 / 1"
668,626,MDV MDV,Mohamed Ajfan RASHEED Aishath Afnaan RASHEED,15,0 - 0,,"1,370 / 1"
669,626,BOT BOT,Tefo KABOMO Tessa KABELO,15,0 - 0,,"1,370 / 1"
670,626,TRI TRI,Nicholas BONKOWSKY Kamasha ROBERTSON,15,0 - 0,,"1,370 / 1"
671,626,PER PER,Sebastian MACIAS Danica NISHIMURA,15,0 - 0,,"1,370 / 1"
672,626,ISL ISL,Daniel THOMSEN Margrét JOHANNSDOTTIR,15,0 - 0,,"1,370 / 1"
673,674,RUS RUS,Andrey JDANOV Olesia KISTER,14,0 - 0,,"1,290 / 1"
674,674,MEX MEX,Antonio OCEGUEDA Sabrina SOLIS,14,0 - 0,,"1,290 / 1"
675,674,GUY GUY,Narayan RAMDHANI Priyanna RAMDHANI,14,0 - 0,,"1,290 / 1"
676,674,ESA ESA,GUARDADO Jassiel Fatima Beatriz CENTENO FUENTES,14,0 - 0,,"1,290 / 1"
677,674,SUR SUR,Dylan DARMOHOETOMO Priscila TJITRODIPO,14,0 - 0,,"1,290 / 1"
678,674,CAN CAN,Austin James BAUER Joanne Yu CHEN,14,0 - 0,,"1,290 / 1"
679,674,GUM COK,David YAO Kate SCOTT,14,0 - 0,,"1,290 / 1"
680,674,COK COK,John TAULU Ngaoa RANGINUI,14,0 - 0,,"1,290 / 1"
681,674,NZL NZL,Kerwyn LEE Angie LEUNG,14,0 - 0,,"1,290 / 1"
682,674,NZL NZL,Luke CHARLESWORTH Alyse DERBY,14,0 - 0,,"1,290 / 1"
683,674,AUS AUS,Mitchell WHELLER Hsuan-Yu Wendy CHEN,14,0 - 0,,"1,290 / 1"
684,674,USA USA,Ryan CHEW Sydney LEE,14,0 - 0,,"1,290 / 1"
685,674,TPE TPE,Chi Yu LO HSIEH Pei Chen,14,0 - 0,,"1,290 / 1"
686,674,USA USA,Rudi GUNAWAN Ariel LEE,14,0 - 0,,"1,290 / 1"
687,674,TPE TPE,KUO Ching-Hung YU Min Ju,14,0 - 0,,"1,290 / 1"
688,674,SCO SCO,Alexander DUNN Holly NEWALL,14,0 - 0,,"1,290 / 1"
689,674,ENG ENG,ROE Michael Rachel VICKERS,14,0 - 0,,"1,290 / 1"
690,674,TPE TPE,LIANG Jui Wei Ching Hui CHANG,14,0 - 0,,"1,290 / 1"
691,674,KOR KOR,Seung Gyu BAEK Yong Joo HAN,14,0 - 0,,"1,290 / 1"
692,674,KOR KOR,Hyuk Gyun CHOI Hye Jeong KIM,14,0 - 0,,"1,290 / 1"
693,674,TPE TPE,Chia-Hsin WAN Wan Ting CHEN,14,0 - 0,,"1,290 / 1"
694,674,TPE TPE,YANG Po Han HUANG Mei Ching,14,0 - 0,,"1,290 / 1"
695,674,TPE TPE,TIEN Tzu Chieh CHIANG Kai Hsin,14,0 - 0,,"1,290 / 1"
696,674,TPE TPE,Cheng Heng SU Jing Ya YE,14,0 - 0,,"1,290 / 1"
697,674,INA INA,Christopher RUSDIANTO Nadya MELATI,14,0 - 0,,"1,290 / 1"
698,674,TPE TPE,Wei Chen LIU Hao Yun WEN,14,0 - 0,,"1,290 / 1"
699,674,RUS RUS,Vladimir SHIPILENKO Valeriia MAKKOVEEVA,14,0 - 0,,"1,290 / 1"
700,674,RUS RUS,Mikhail NESTERENKO Daria RADCHENKO,14,0 - 0,,"1,290 / 1"
701,674,JPN JPN,Takuto INOUE Yuki FUKUSHIMA,14,0 - 0,,"1,290 / 1"
702,674,VEN VEN,Jesus Manuel SANCHEZ LAMA Damaris Mercedes ORTIZ PARADA,14,0 - 0,,"1,290 / 1"
703,674,RUS RUS,Konstantin ABRAMOV Irina KHLEBKO,14,0 - 0,,"1,290 / 1"
704,674,KOR KOR,JANG Seung Hoon KO Hyun Jung,14,0 - 0,,"1,290 / 1"
705,674,ENG ENG,Alex MARRITT Cristen Elizabeth MARRITT,14,0 - 0,,"1,290 / 1"
706,674,NED NED,Russell MUNS Myke HALKEMA,14,0 - 0,,"1,290 / 1"
707,674,KOR KOR,KANG Ji Wook JUNG Kyung Eun,14,0 - 0,,"1,290 / 1"
708,674,GUA GUA,HUMBLERS HEYMARD Nikte Alejandra SOTOMAYOR,14,0 - 0,,"1,290 / 1"
709,674,AUS AUS,Ashwant GOBINATHAN Louisa MA,14,0 - 0,,"1,290 / 1"
710,711,PER PER,Bruno BARRUETO DEZA Ines CASTILLO,14,0 - 0,,"1,280 / 2"
711,711,THA THA,Sirawit SUHARITDUMRONG Savitree AMITRAPAI,14,0 - 0,,"1,280 / 2"
712,711,THA THA,Warit SARAPAT Ruethaichanok LAISUAN,14,0 - 0,,"1,280 / 2"
713,714,UKR UKR,Kyryll NESTERENKO Anastasiya DMYTRYSHYN,14,0 - 0,,"1,270 / 3"
714,715,ISR ISR,Lior KROYTER Dana KUGEL,14,0 - 0,,"1,270 / 2"
715,716,DEN DEN,Mikkel Kaersgaard HENRIKSEN Emilie JUUL MOLLER,14,0 - 0,,"1,260 / 3"
716,717,HKG HKG,OR Chin Chung CHAN Kaka Tsz Ka,14,0 - 0,,"1,220 / 3"
717,718,INA INA,Yehezkiel Fritz MAINAKY Lyanny Alessandra MAINAKY,17,0 - 0,,"1,180 / 4"
718,719,TPE TPE,Jhe-Huei LEE CHIANG Kai Hsin,17,0 - 0,,"1,170 / 2"
719,719,HKG HKG,HO Wai Lun YUEN Sin Ying,17,0 - 0,,"1,170 / 2"
720,721,RUS RUS,Vladimir NIKULOV Ekaterina KUT,17,0 - 0,,"1,170 / 1"
721,721,DEN LTU,Soeren TOFT HANSEN Gerda VOITECHOVSKAJA,17,0 - 0,,"1,170 / 1"
722,721,NZL AUS,James EUNSON Alice WU,17,0 - 0,,"1,170 / 1"
723,721,CZE CZE,Jaromir JANACEK Sabina MILOVA,17,0 - 0,,"1,170 / 1"
724,721,NED NED,Justin TEEUWEN Cheryl SEINEN,17,0 - 0,,"1,170 / 1"
725,726,PHI PHI,Philip Joper ESCUETA Eleanor Christine INLAYO,17,0 - 0,,"1,160 / 2"
726,727,NZL NZL,Abhinav MANOTA Justine VILLEGAS,17,0 - 0,,"1,150 / 2"
727,727,EST EST,Kristjan KALJURAND Laura TOMBAND,17,0 - 0,,"1,150 / 2"
728,729,NGR NGR,Tobi OWOLABI Felicia OMOTOLA,17,0 - 0,,"1,130 / 2"
729,729,TUR TUR,Kubilay SADI Yaren DOLCU,17,0 - 0,,"1,130 / 2"
730,731,INA INA,Rinov RIVALDY Vania Arianti SUKOCO,17,0 - 0,,"1,100 / 2"
731,731,SEY SEY,Steve MALCOUZANNE Juliette AH-WAN,17,0 - 0,,"1,100 / 2"
732,731,FIN FIN,Arttu MAHONEN Annmarie OKSA,17,0 - 0,,"1,100 / 2"
733,731,RUS RUS,Alexander BUTOVETSTKIY Gusel YARMEEVA,17,0 - 0,,"1,100 / 2"
734,731,ISL ISL,Atli JOHANNESSON Snjolaug JOHANNSDOTTIR,17,0 - 0,,"1,100 / 2"
735,736,DEN DEN,Frederik SØGAARD MORTENSEN Sara LUNDGAARD,17,0 - 0,,"1,090 / 2"
736,736,ESP ESP,Juan Manuel FERNANDEZ QUILES Laura MOLINA,17,0 - 0,,"1,090 / 2"
737,736,GER GER,Daniel BENZ Annika HORBACH,17,0 - 0,,"1,090 / 2"
738,736,IRL IRL,Tony MURPHY Jennie KING,17,0 - 0,,"1,090 / 2"
739,740,RUS RUS,Ivan SOZONOV Ekaterina BOLOTOVA,17,0 - 0,,"1,060 / 1"
740,740,INA INA,Gideon Markus FERNALDI Nitya Krishinda MAHESWARI,17,0 - 0,,"1,060 / 1"
741,740,JPN JPN,Takeshi KAMURA Shizuka MATSUO,17,0 - 0,,"1,060 / 1"
742,740,CHN CHN,LI Junhui TANG Yuanting,17,0 - 0,,"1,060 / 1"
