,RANK,COUNTRY,PLAYER,CHANGE +/-,WIN - LOSE,PRIZE MONEY,POINTS / TOURNAMENTS
0,1,CHN CHN,ZHANG Nan ZHAO Yunlei,0,261 - 35,"$1,098,387.50","99,735 / 14"
1,2,INA INA,Tontowi AHMAD Liliyana NATSIR,0,221 - 60,"$765,219.99","80,512 / 17"
2,3,CHN CHN,LIU Cheng BAO Yixin,0,80 - 34,"$210,833.72","77,200 / 16"
3,4,KOR KOR,KO Sung Hyun KIM Ha Na,0,102 - 44,"$330,442.49","75,460 / 19"
4,5,DEN DEN,Joachim FISCHER NIELSEN Christinna PEDERSEN,0,239 - 74,"$697,027.73","73,764 / 14"
5,6,CHN CHN,XU Chen MA Jin,0,197 - 52,"$810,680.60","73,741 / 15"
6,7,ENG ENG,Chris ADCOCK Gabrielle ADCOCK,0,150 - 90,"$276,591.01","67,574 / 18"
7,8,INA INA,Praveen JORDAN Debby SUSANTO,0,73 - 40,"$167,370.59","66,382 / 25"
8,9,HKG HKG,LEE Chun Hei Reginald CHAU Hoi Wah,1,93 - 54,"$164,000.84","59,445 / 24"
9,10,CHN CHN,LU Kai HUANG Yaqiong,-1,69 - 29,"$135,143.73","59,290 / 17"
10,11,KOR KOR,SHIN Baek Cheol CHAE Yoo Jung,0,30 - 14,"$96,043.74","51,420 / 14"
11,12,MAS MAS,Peng Soon CHAN Liu Ying GOH,1,167 - 98,"$202,525.61","47,360 / 22"
12,13,KOR KOR,SolGyu CHOI EOM Hye Won,-1,30 - 16,"$106,338.74","47,150 / 18"
13,14,NED NED,Jacco ARENDS Selena PIEK,0,95 - 63,"$39,391.99","44,395 / 22"
14,15,INA INA,Edi SUBAKTIAR Gloria Emanuelle WIDJAJA,0,55 - 36,"$48,101.60","43,580 / 19"
15,16,GER GER,Michael FUCHS Birgit MICHELS,0,161 - 95,"$162,701.76","43,448 / 25"
16,17,POL POL,Robert MATEUSIAK Nadiezda ZIEBA,0,240 - 92,"$185,323.75","41,650 / 12"
17,18,INA INA,Ronald ALEXANDER Melati Daeva OKTAVIANI,0,49 - 25,"$22,671.10","40,170 / 18"
18,19,HKG HKG,CHAN Alan Yun Lung TSE Ying Suet,0,59 - 54,"$48,019.74","39,347 / 23"
19,20,JPN JPN,Kenichi HAYAKAWA Misaki MATSUTOMO,0,58 - 69,"$44,433.82","38,280 / 13"
20,21,INA INA,Riky WIDIANTO Puspita Richi DILI,0,83 - 56,"$101,621.08","38,010 / 17"
21,22,RUS RUS,Vitalij DURKIN Nina VISLOVA,0,173 - 80,"$73,647.72","37,010 / 22"
22,23,JPN JPN,Kenta KAZUNO Ayane KURIHARA,0,28 - 16,"$16,294.36","36,500 / 16"
23,24,USA USA,Phillip CHEW Jamie SUBANDHI,0,75 - 67,"$19,373.64","36,368 / 29"
24,25,FRA FRA,Ronan LABAR Emilie LEFEL,0,75 - 48,"$18,393.99","36,158 / 26"
25,26,JPN JPN,Keigo SONODA Naoko FUKUMAN,0,14 - 12,"$15,131.23","35,930 / 12"
26,27,KOR KOR,KIM Gi Jung SHIN Seung Chan,1,15 - 18,"$43,334.36","35,910 / 18"
27,28,SIN SIN,Danny Bawa CHRISNANTA Yu Yan Vanessa NEO,-1,130 - 108,"$71,518.62","35,854 / 21"
28,29,THA THA,Sudket PRAPAKAMOL Saralee THOUNGTHONGKAM,0,296 - 179,"$336,467.45","34,700 / 15"
29,30,CHN CHN,HUANG Kaixiang HUANG Dongping,6,24 - 9,"$29,128.12","33,740 / 9"
30,31,DEN DEN,Mads Pieler KOLDING Kamilla RYTTER JUHL,-1,49 - 30,"$155,575.62","33,260 / 6"
31,32,DEN DEN,Niclas NOHR Sara THYGESEN,-1,54 - 28,"$18,539.25","33,110 / 13"
32,33,AUS AUS,Robin MIDDLETON Leanne CHOO,-1,31 - 17,"$11,723.49","33,061 / 17"
33,34,CAN CAN,Toby NG Alex BRUCE,-1,62 - 34,"$19,557.44","32,874 / 17"
34,35,IRL IRL,Sam MAGEE Chloe MAGEE,-1,115 - 85,"$22,109.48","32,670 / 16"
35,36,RUS RUS,Evgenij DREMIN Evgenia DIMOVA,-1,59 - 43,"$21,322.99","32,128 / 17"
36,37,INA INA,Markis KIDO Pia Zebadiah BERNADETH,0,69 - 56,"$105,655.35","32,050 / 15"
37,38,FRA FRA,Gaetan MITTELHEISSER Audrey FONTAINE,0,55 - 44,"$8,662.00","31,310 / 21"
38,39,NED NED,Jorrit DE RUITER Samantha BARNING,0,67 - 48,"$24,159.41","31,107 / 12"
39,40,TPE TPE,LIAO Min Chun CHEN Hsiao Huan,0,51 - 61,"$17,509.98","29,730 / 16"
40,41,THA THA,Bodin ISSARA Savitree AMITRAPAI,6,28 - 7,"$26,794.83","29,710 / 9"
41,42,INA INA,Andrei ADISTIA Vita MARISSA,-1,13 - 10,"$165,500.00","29,590 / 10"
42,43,INA INA,Fran KURNIAWAN Komala DEWI,-1,30 - 13,"$52,784.73","28,190 / 13"
43,44,CHN CHN,ZHENG Siwei CHEN Qingchen,24,33 - 4,"$56,771.24","27,140 / 6"
44,45,SIN SIN,Yong Kai Terry HEE Wei Han TAN,5,32 - 13,"$6,103.11","26,799 / 10"
45,46,IND IND,Arun VISHNU Aparna BALAN,-3,61 - 55,"$16,719.24","26,520 / 10"
46,47,MAS MAS,Aik Quan TAN Pei Jing LAI,-3,62 - 55,"$33,229.57","26,140 / 10"
47,48,INA INA,Irfan FADHILAH Weni ANGGRAINI,6,75 - 54,"$38,457.48","26,020 / 12"
48,49,INA INA,HAFIZ Faisal Shella Devi Aulia,-4,33 - 18,"$6,491.24","25,580 / 11"
49,50,KOR KOR,LEE Yong Dae LEE So Hee,-4,12 - 9,"$152,963.97","24,880 / 8"
50,51,DEN DEN,Mathias CHRISTIANSEN Lena GREBAK,-3,28 - 12,"$13,784.24","24,570 / 9"
51,52,IND IND,KONA Tarun NELAKURIHI Sikki Reddy,-3,21 - 17,"$11,997.46","24,530 / 16"
52,53,AUT AUT,David OBERNOSTERER Elisabeth BALDAUF,-2,37 - 19,"$4,858.85","23,790 / 15"
53,54,MAS MAS,WONG Fai Yin Mei Kuan CHOW,-2,24 - 27,"$6,614.98","23,670 / 12"
54,55,KOR KOR,YOO Yeon Seong CHANG Ye Na,-2,58 - 39,"$128,726.86","23,600 / 8"
55,56,BRA BRA,Alex Yuwan TJONG Lohaynny VICENTE,-1,45 - 22,"$3,993.04","23,336 / 10"
56,57,SWE SWE,Nico RUPONEN Amanda HOGSTROM,-1,45 - 45,"$8,031.75","22,790 / 15"
57,58,SWE SWE,Jonatan NORDH Emelie FABBEKE,-1,38 - 42,"$4,677.38","22,634 / 13"
58,59,FRA FRA,Bastian KERSAUDY Lea PALERMO,-1,33 - 27,"$1,271.86","22,580 / 17"
59,60,TPE TPE,LIN Chia Yu WU Ti Jung,-1,16 - 17,"$6,269.85","22,280 / 15"
60,61,EGY EGY,Abdelrahman KASHKAL Hadia HOSNY,0,51 - 47,"$3,540.60","22,070 / 20"
61,62,AUS AUS,Matthew CHAU Gronya SOMERVILLE,-2,15 - 11,"$2,182.38","21,930 / 11"
62,63,KOR KOR,SolGyu CHOI CHAE Yoo Jung,-1,33 - 14,"$61,926.24","21,860 / 6"
63,64,GER GER,Mark LAMSFUSS Isabel HERTTRICH,-1,14 - 10,"$12,421.99","21,400 / 10"
64,65,TPE TPE,Ko-Chi CHANG Hsin Tien CHANG,-1,15 - 18,"$3,571.86","21,080 / 13"
65,66,SIN SIN,Chayut TRIYACHART Shinta Mulia SARI,-1,22 - 20,"$21,810.67","20,628 / 6"
66,67,INA INA,Alfian Eko PRASETYA Annisa SAUFIKA,3,36 - 18,"$28,173.07","20,530 / 9"
67,68,RUS RUS,Rodion KARGAEV Ekaterina BOLOTOVA,-2,27 - 24,"$1,627.49","20,520 / 10"
68,69,GER GER,Marvin Emil SEIDEL Linda EFLER,-2,28 - 19,"$2,001.00","20,250 / 14"
69,70,AUS AUS,Sawan SERASINGHE Setyana MAPASA,-1,30 - 10,"$2,470.00","19,210 / 9"
70,71,TPE TPE,Hsiao-Lin WU HSIEH Pei Chen,0,15 - 15,"$4,193.11","18,620 / 14"
71,72,PER PER,Mario CUBA Katherine WINDER,0,72 - 28,"$5,398.70","18,400 / 8"
72,73,ENG ENG,Matthew NOTTINGHAM Emily WESTWOOD,0,30 - 19,"$4,501.50","18,140 / 9"
73,74,DEN DEN,Kasper ANTONSEN Amanda MADSEN,0,33 - 17,"$4,000.00","17,980 / 10"
74,75,THA THA,Nipitphon PUANGPUAPECH Puttita SUPAJIRAKUL,0,16 - 23,"$13,263.72","17,098 / 6"
75,76,THA THA,Puavaranukroh DECHAPOL Sapsiree TAERATTANACHAI,14,12 - 5,"$18,735.00","16,820 / 5"
76,77,ENG ENG,Gregory MAIRS Jenny MOORE,-1,22 - 18,"$1,638.00","16,590 / 9"
77,78,HKG HKG,TANG Chun Man POON Lok Yan,-1,4 - 7,"$5,853.11","16,010 / 7"
78,79,SWE SWE,Filip Michael Duwall MYHREN Emma WENGBERG,-1,24 - 14,"$2,149.07","15,760 / 10"
79,80,GER GER,Max SCHWENGER Carla NELTE,-1,46 - 37,"$14,108.01","14,783 / 6"
80,81,POL POL,Pawel PIETRYJA Aneta WOJTKOWSKA,-1,39 - 22,$0.00,"14,550 / 13"
81,82,RUS RUS,Andrey PARAKHODIN Anastasia CHERVYAKOVA,-1,22 - 12,"$1,106.25","14,420 / 8"
82,83,EGY EGY,Ahmed SALAH Menna ELTANANY,-1,13 - 12,$563.73,"14,350 / 10"
83,84,MAS MAS,Chee Tean TAN Shevon Jemie LAI,-1,26 - 22,"$5,696.23","14,180 / 7"
84,85,RSA RSA,Andries MALAN Jennifer FRY,-1,36 - 14,"$1,118.12","14,113 / 7"
85,86,RUS RUS,Anatoliy YARTSEV Evgeniya KOSETSKAYA,-1,55 - 37,"$5,008.99","14,000 / 6"
86,87,PER PER,Andres CORPANCHO Luz Maria ZORNOZA,-1,42 - 18,"$1,783.99","13,890 / 7"
87,88,CAN CAN,PHILLIPE Charron Phyllis CHAN,-1,18 - 23,"$2,937.43","13,820 / 10"
88,89,GER GER,Peter KAESBAUER Franziska VOLKMANN,-1,6 - 8,"$12,700.75","13,610 / 8"
89,90,MAS MAS,Kian Meng TAN Pei Jing LAI,-1,8 - 5,"$22,915.85","13,160 / 5"
90,91,IND IND,Dinesh CHAUDHRY Lalita DAHIYA,0,4 - 14,$392.46,"12,610 / 12"
91,92,BRA BRA,Alex Yuwan TJONG Luana VICENTE,0,11 - 9,"$2,921.17","12,050 / 6"
92,93,DEN DEN,Soren GRAVHOLT Maiken FRUERGAARD,0,17 - 12,$0.00,"11,950 / 8"
93,94,KOR KOR,CHUNG Eui Seok Hee Yong KONG,0,10 - 6,"$2,073.73","11,390 / 6"
94,95,EGY EGY,Ali Ahmed EL KHATEEB Doha HANY,0,14 - 12,$337.48,"11,380 / 9"
95,96,GER GER,Jones Ralfy JANSEN Cisita Joity JANSEN,0,36 - 28,"$3,032.10","11,190 / 7"
96,97,CAN CAN,Nyl YAKURA Brittney TAM,0,9 - 12,"$1,751.23","11,000 / 7"
97,98,SUI SUI,Oliver SCHALLER Celine BURKART,0,16 - 25,$0.00,"10,670 / 13"
98,99,BRA BRA,Hugo ARTHUSO Fabiana SILVA,0,47 - 28,"$3,159.91","10,640 / 7"
99,100,FIN NED,Anton KAISTI Cheryl SEINEN,0,16 - 6,"$3,200.00","10,630 / 6"
100,101,IND IND,Juhi DEWANGAN Venkat Gaurav PRASAD,13,4 - 22,"$2,909.98","10,590 / 7"
101,102,FIN FIN,Henri AARNIO Jenny NYSTROM,-1,12 - 18,$500.00,"10,510 / 12"
102,103,NZL NZL,Shane MASINIPENI Maria MASINIPENI,-1,5 - 18,$108.74,"10,510 / 7"
103,104,ENG ENG,Harley TOWLER Emily WESTWOOD,-1,16 - 13,"$3,094.50","10,360 / 6"
104,105,MEX MEX,Lino MUNOZ Cynthia GONZALEZ,-1,49 - 42,"$3,149.30","10,180 / 6"
105,106,CZE CZE,Jaromir JANACEK Katerina TOMALOVA,-1,7 - 9,$187.50,"10,160 / 9"
106,107,HKG HKG,OR Chin Chung CHAN Kaka Tsz Ka,-1,5 - 8,"$1,279.37","10,090 / 8"
107,108,VIE VIE,Tuan Duc DO Nhu Thao PHAM,-1,12 - 5,"$2,085.01","9,860 / 6"
108,109,INA INA,Akbar PANJI Apriani RAHAYU,-1,10 - 11,$805.00,"9,760 / 8"
109,110,UKR UKR,Gennadiy NATAROV Natalya VOYTSEKH,-1,7 - 8,$804.37,"9,480 / 7"
110,111,GER GER,Peter KAESBAUER Carla NELTE,-1,4 - 4,"$18,969.13","9,240 / 4"
111,112,TPE TPE,CHEN Hung Ling Ling Fang HU,-1,5 - 4,"$70,026.23","9,170 / 4"
112,113,CAN CAN,Kevin LI Rachel HONDERICH,-1,8 - 15,"$1,286.21","8,970 / 7"
113,114,USA USA,Howard SHU Eva LEE,-1,21 - 17,"$13,710.98","8,952 / 6"
114,115,FRA FRA,Julien MAIO Lorraine BAUMANN,0,4 - 8,$28.12,"8,900 / 8"
115,116,ENG ENG,Ben LANE Jessica PUGH,0,18 - 11,"$1,000.00","8,780 / 6"
116,117,CHN CHN,LIU Yuchen LI Yinhui,0,5 - 2,"$25,624.37","8,750 / 2"
117,118,FIN EST,Marko PYYKONEN Karoliine HOIM,0,15 - 8,$0.00,"8,620 / 6"
118,119,GUA GUA,SOLIS JONATHAN Nikte Alejandra SOTOMAYOR,0,21 - 18,"$2,088.69","8,590 / 5"
119,120,TPE TPE,TSENG Min Hao LAI Chia Wen,0,18 - 17,"$6,696.86","8,586 / 4"
120,121,NED NED,Ruben JILLE Iris TABELING,0,8 - 5,"$2,288.25","8,400 / 4"
121,122,RSA RSA,Michelle BUTLER-EMMETT Willem VILJOEN,0,29 - 5,"$2,742.80","8,282 / 5"
122,123,JPN JPN,Akira KOGA Koharu YONEMOTO,0,5 - 3,"$8,306.22","8,180 / 3"
123,124,TPE TPE,Chi-Lin WANG CHENG Chi Ya,0,7 - 11,"$5,770.47","8,140 / 4"
124,125,MAS MAS,Yip Jiun TAN Li Lian YANG,0,6 - 5,$697.48,"8,120 / 6"
125,126,GER GER,Johannes PISTORIUS Eva JANSSENS,0,1 - 8,$0.00,"8,070 / 8"
126,127,KOR KOR,SHIN Baek Cheol CHANG Ye Na,0,46 - 24,"$122,713.73","8,040 / 2"
127,128,IND IND,Akshay DEWALKAR Pradnya GADRE,0,35 - 32,"$7,843.60","7,840 / 3"
128,129,TUR TUR,Ramazan OZTURK Neslihan KILIC,0,28 - 25,$558.74,"7,750 / 4"
129,130,CHN CHN,LIU Yuchen OU Dongni,0,3 - 2,"$24,431.87","7,720 / 2"
130,131,GER GER,Richard DOMKE Kira KATTENBECK,0,2 - 7,$318.75,"7,560 / 7"
131,132,THA THA,Tinn ISRIYANATE Savitree AMITRAPAI,0,9 - 4,"$23,154.58","7,520 / 4"
132,133,JPN JPN,Yuki KANEKO Shizuka MATSUO,0,5 - 3,"$18,618.75","7,450 / 3"
133,134,INA INA,Alfian Eko PRASETYA Shella Devi Aulia,0,8 - 3,"$16,893.72","7,270 / 3"
134,135,INA INA,Agripinna Prima Rahmanto PUTRA Rizki Amelia PRADIPTA,0,4 - 8,"$2,758.12","7,260 / 7"
135,136,NZL NZL,Maika PHILLIPS Anona PAK,0,9 - 13,$795.00,"7,220 / 4"
136,137,FRA FRA,Marin BAUMANN Lorraine BAUMANN,0,30 - 30,$56.24,"7,190 / 4"
137,138,MAS MAS,Chee Tean TAN Mei Kuan CHOW,0,5 - 3,"$6,028.11","7,190 / 3"
138,139,CHN CHN,WANG YILYU LUO Yu,0,0 - 3,"$20,481.25","7,100 / 3"
139,140,INA INA,Lukhi Apri NUGROHO Ulfa ZAKIA,0,6 - 6,"$5,035.60","7,080 / 5"
140,141,TPE TPE,LU Ching Yao CHENG Wen Hsing,0,3 - 3,"$79,896.21","7,040 / 3"
141,141,IND IND,Pranaav Jerry CHOPRA NELAKURIHI Sikki Reddy,0,9 - 9,"$7,301.20","7,040 / 3"
142,143,SCO INA,Robert BLAIR Pia Zebadiah BERNADETH,0,7 - 1,"$110,276.68","7,030 / 2"
143,144,CHN CHN,ZHENG Siwei LI Yinhui,0,5 - 0,"$35,101.87","7,000 / 1"
144,145,VIE VIE,Bao Duc DUONG Thi Hong Gam THAI,0,38 - 25,"$2,937.41","6,969 / 4"
145,146,PER PER,Jose GUEVARA Danica NISHIMURA,0,5 - 5,$140.60,"6,930 / 5"
146,147,THA THA,Wannawat AMPUNSUWAN Pacharapun CHOCHUWONG,0,8 - 6,$748.71,"6,910 / 6"
147,148,ENG ENG,Christopher COLES Victoria WILLIAMS,0,7 - 3,"$1,500.00","6,910 / 4"
148,149,MAS MAS,Kian Meng TAN Yen Wei PECK,0,7 - 2,"$3,362.50","6,900 / 3"
149,150,PER PER,Martin DEL VALLE Daniela MACIAS,0,11 - 15,$699.96,"6,880 / 6"
150,151,DEN DEN,Patrick BUHL Isabella NIELSEN,0,10 - 7,$0.00,"6,770 / 4"
151,152,AUS AUS,Daniel GUDA Joy LAI,0,8 - 6,$63.12,"6,700 / 5"
152,153,KOR KOR,Jae Hwan KIM KIM So Yeong,0,1 - 4,"$10,431.25","6,660 / 4"
153,154,IND IND,Akshay DEWALKAR Prajakta SAWANT,0,4 - 3,"$7,063.98","6,660 / 3"
154,154,IND IND,Pranaav Jerry CHOPRA Ashwini PONNAPPA,0,2 - 3,"$10,529.97","6,660 / 3"
155,156,UZB BLR,Artyom SAVATYUGIN Alesia ZAITSAVA,0,4 - 4,$982.11,"6,620 / 4"
156,157,SVK SVK,Matej HLINICAN Jana CIZNAROVA,0,7 - 9,"$1,072.46","6,480 / 5"
157,158,KAZ KAZ,Artur NIYAZOV Veronika SOROKINA,0,3 - 14,$36.24,"6,354 / 9"
158,159,INA INA,Drajat BENO Yulfira BARKAH,0,5 - 5,$246.24,"6,340 / 5"
159,160,NED NED,Robin TABELING Samantha BARNING,0,3 - 4,"$12,248.88","6,300 / 4"
160,161,DEN DEN,Kristoffer KNUDSEN Emilie JUUL MOLLER,0,12 - 5,$0.00,"6,260 / 5"
161,162,EGY EGY,Abdelrahman ABDELHAKIM Nadine ASHRAF,0,6 - 9,$642.50,"6,230 / 6"
162,163,RUS RUS,Ilya ZHDANOV Tatjana BIBIK,0,8 - 3,"$3,841.25","6,230 / 4"
163,164,HKG HKG,LAW Cheuk Him YUEN Sin Ying,0,3 - 11,$309.37,"6,170 / 8"
164,165,CHN CHN,HE Jiting DU Yue,0,7 - 4,"$1,975.00","6,100 / 3"
165,166,INA INA,Muhammad Rian ARDIANTO Masita MAHMUDIN,0,4 - 2,"$2,840.60","6,050 / 2"
166,167,JPN JPN,Yugo KOBAYASHI Yuki FUKUSHIMA,0,4 - 4,$839.99,"6,030 / 4"
167,168,CHN CHN,YU Xiaoyu XIA Huan,0,4 - 1,"$18,463.75","5,950 / 1"
168,169,USA MEX,Bjorn SEGUIN Mariana UGALDE,0,1 - 4,$308.74,"5,940 / 4"
169,170,CZE CZE,Jakub BITMAN Alzbeta BASOVA,0,55 - 54,"$1,450.50","5,898 / 5"
170,171,INA INA,Supriadi Tedi Ririn AMELIA,0,6 - 3,$461.24,"5,840 / 3"
171,172,KOR KOR,DukYoung KIM Hye Rin KIM,0,1 - 3,"$6,591.24","5,810 / 3"
172,173,MAS MAS,Bolriffin KHAIRUL TOR Sin Er NG,0,5 - 4,$282.48,"5,800 / 4"
173,174,HUN HUN,Gergely KRAUSZ Laura SAROSI,0,7 - 15,$0.00,"5,730 / 5"
174,175,ENG ENG,Christopher COLES Sophie BROWN,0,10 - 8,"$1,225.00","5,700 / 3"
175,176,THA THA,Parinyawat THONGNUAM Natcha SAENGCHOTE,0,3 - 5,$460.60,"5,680 / 5"
176,177,INA INA,Didit JUANG Keshya Nurvita HANADIA,12,3 - 5,"$3,213.09","5,670 / 4"
177,178,IND IND,Satwiksairaj RANKIREDDY K. Maneesha,-1,6 - 1,"$4,327.48","5,670 / 2"
178,179,ZAM ZAM,Juma MUWOWO Ogar SIAMUPANGILA,-1,10 - 8,$806.56,"5,630 / 3"
179,180,SCO SCO,Adam HALL Eleanor O'DONNELL,-1,4 - 5,$0.00,"5,580 / 5"
180,181,JPN JPN,Yuta WATANABE Arisa HIGASHINO,-1,6 - 3,"$1,928.12","5,560 / 2"
181,182,TPE TPE,HUANG Po Jui SHUAI Pei Ling,-1,9 - 15,"$2,139.36","5,550 / 4"
182,183,FRA FRA,Baptiste CAREME Anne TRAN,-1,25 - 23,"$5,423.13","5,510 / 2"
183,184,DOM DOM,Nelson JAVIER Daigenis SATURRIA,-1,5 - 5,$224.96,"5,500 / 4"
184,185,INA INA,Yehezkiel Fritz MAINAKY Lyanny Alessandra MAINAKY,-1,0 - 10,$0.00,"5,450 / 8"
185,186,KOR KOR,Jae Hwan KIM Hye Rin KIM,-1,2 - 2,"$2,843.75","5,440 / 2"
186,187,SIN SIN,Bimo Adi PRAKOSO Citra Dewi SARI,-1,5 - 5,$219.98,"5,410 / 4"
187,188,GER GER,Peter KAESBAUER Isabel HERTTRICH,-1,48 - 34,"$22,991.49","5,380 / 2"
188,189,DEN DEN,Alexander BOND Ditte SØBY HANSEN,-1,15 - 7,"$1,000.00","5,350 / 4"
189,190,THA THA,Parinyawat THONGNUAM Phataimas MUENWONG,0,9 - 3,"$1,001.85","5,290 / 4"
190,191,TPE TPE,Yang LEE YU Wen KUO,0,4 - 3,$865.60,"5,210 / 3"
191,192,RUS RUS,Alexandr ZINCHENKO Olga MOROZOVA,0,30 - 17,"$2,431.25","5,170 / 3"
192,193,TPE TPE,LU Ching Yao CHIANG Kai Hsin,0,2 - 3,"$1,982.45","5,160 / 3"
193,194,ARG ARG,Tomas THOUYARET Barbara Maria BERRUEZO,0,0 - 6,$0.00,"5,150 / 6"
194,195,TPE TPE,LU Chia Pin Chia Hsin LEE,0,4 - 2,"$4,338.10","5,140 / 2"
195,196,TPE TPE,LIANG Jui Wei Yu Chieh CHENG,0,3 - 6,$795.61,"5,120 / 5"
196,197,FRA FRA,Jordan CORVEE Anne TRAN,0,6 - 6,$378.75,"5,110 / 6"
197,198,LTU LTU,Povilas BARTUSIS Vytaute FOMKINAITE,0,8 - 13,$0.00,"5,110 / 5"
198,199,LAT LAT,Niks PODOSINOVIKS Kristine SEFERE,0,5 - 5,$108.74,"5,100 / 5"
199,200,PAK PAK,Rizwan AZAM Sara MOHMAND,0,4 - 4,$162.48,"5,090 / 3"
200,201,ARG ARG,Pablo MACAGNO Florencia BERNATENE,0,1 - 13,$0.00,"5,050 / 5"
201,202,DEN DEN,Rene MATTISSON Thilde MATTISSON,0,20 - 12,"$1,000.00","5,040 / 4"
202,203,CHN CHN,LIU Yuchen TANG Jinhua,0,4 - 1,"$41,373.74","5,040 / 1"
203,204,GRE GRE,Petros TENTAS Irini TENTA,0,1 - 14,$0.00,"5,010 / 7"
204,205,THA THA,Krit TANTIANANKUL Panjarat PRANSOPON,0,5 - 4,$163.74,"5,000 / 4"
205,206,RUS RUS,Vadim NOVOSELOV Julia ZAPOLSKAYA,0,9 - 11,$586.24,"5,000 / 3"
206,207,INA INA,Akbar Bintang CAHYONO Nugraheny RISTYA AYU,0,4 - 3,$233.12,"4,940 / 3"
207,208,TPE TPE,YANG Po Han YANG Ching Tun,0,3 - 3,$815.61,"4,920 / 3"
208,209,MAS MAS,Wee Gieen TAN Shevon Jemie LAI,0,4 - 2,"$3,506.86","4,920 / 2"
209,210,CHN CHN,WANG YILYU TANG Yuanting,0,3 - 1,"$17,833.75","4,900 / 1"
210,210,CHN CHN,LI Junhui HUANG Dongping,0,5 - 3,"$17,066.25","4,900 / 1"
211,212,BUL SUI,Stilian MAKARSKI Celine TRIPET,0,9 - 18,"$3,677.50","4,880 / 4"
212,213,TUR TUR,Serdar KOCA Emine DEMIRTAS,0,5 - 3,$0.00,"4,880 / 3"
213,214,THA THA,Tinn ISRIYANATE Pacharapun CHOCHUWONG,103,2 - 2,$614.35,"4,790 / 3"
214,215,TPE TPE,Yang LEE WU Fang Chien,-1,6 - 2,$832.47,"4,700 / 2"
215,216,NZL NZL,Oliver LEYDON-DAVIS Danielle TAHURI,-1,12 - 11,"$2,018.11","4,680 / 1"
216,217,FRA FRA,Vincent ESPEN Manon KRIEGER,-1,4 - 13,$260.00,"4,670 / 5"
217,218,IND IND,T. Hema Nagendra Babu S. Poorvisha Ram,-1,3 - 5,$194.97,"4,660 / 3"
218,219,FIN FIN,Pekka RYHANEN Sonja PEKKOLA,-1,3 - 8,$0.00,"4,640 / 6"
219,220,FRA SUI,Baptiste CAREME Sabrina JAQUET,-1,7 - 3,"$8,158.37","4,630 / 3"
220,221,BEL BEL,Floris OLEFFE Steffi ANNYS,-1,10 - 23,$93.75,"4,603 / 6"
221,222,FIN FIN,Anton KAISTI Mathilda LINDHOLM,-1,6 - 5,"$2,100.00","4,590 / 4"
222,223,GER GER,Mark LAMSFUSS Franziska VOLKMANN,-1,15 - 19,"$2,131.25","4,560 / 3"
223,224,CHN CHN,HAN Chengkai JIA Yifan,32,2 - 1,"$3,614.37","4,510 / 2"
224,225,SCO SCO,Robert BLAIR Imogen BANKIER,-2,111 - 42,"$96,596.76","4,458 / 1"
225,226,JAM JAM,Gareth HENRY Katherine WYNTER,-2,4 - 3,$28.12,"4,450 / 2"
226,227,SIN SIN,Guang Liang Jason WONG Citra Dewi SARI,-2,4 - 8,$166.25,"4,420 / 5"
227,228,AUT AUT,Roman ZIRNWALD Sonja LANGTHALER,-2,3 - 7,"$1,690.37","4,410 / 6"
228,229,ENG ENG,Harry ARKSEY Sarah WALKER,-2,1 - 3,$0.00,"4,410 / 3"
229,229,MEX MEX,Arturo HERNANDEZ Mariana UGALDE,-2,5 - 6,$28.12,"4,410 / 3"
230,231,CHI CHI,Cristian ARAYA Tingting CHOU,-2,4 - 4,$112.48,"4,400 / 3"
231,232,MAS MAS,Aik Quan TAN Yee See CHEAH,-2,3 - 2,"$13,312.46","4,400 / 2"
232,232,CUB CUB,Leodannis MARTINEZ Tahimara OROPEZA,-2,3 - 2,$500.00,"4,400 / 2"
233,232,CUB CUB,Ernesto REYES Melissa AZCUY PEREZ,-2,3 - 2,$0.00,"4,400 / 2"
234,232,POL SCO,Robert MATEUSIAK Imogen BANKIER,-2,5 - 2,"$143,797.44","4,400 / 2"
235,236,JPN JPN,Takuto INOUE Shizuka MATSUO,-2,1 - 2,"$19,083.12","4,390 / 2"
236,237,INA INA,Kevin Sanjaya SUKAMULJO Greysia POLII,-2,7 - 3,"$16,698.75","4,320 / 1"
237,238,TPE TPE,Chi-Lin WANG Shuo Yun SUNG,-2,2 - 2,"$3,539.85","4,310 / 2"
238,239,ECU ECU,Emilio ZAMBRANO Maria Delia ZAMBRANO,-2,5 - 10,$56.24,"4,280 / 4"
239,240,DOM DOM,William CABRERA Bermary Altagracia POLANCO MUNOZ,-2,2 - 3,$189.36,"4,270 / 3"
240,241,TPE TPE,Chia-Han LEE CHENG Chi Ya,-2,0 - 3,"$2,594.99","4,260 / 3"
241,241,GER GER,Raphael BECK Kira KATTENBECK,-2,9 - 20,$637.50,"4,260 / 3"
242,243,TPE TPE,Wei Chen LIU HUANG Mei Ching,-2,0 - 3,$222.49,"4,250 / 3"
243,244,GER BRA,Jonathan PERSSON Ana Paula CAMPOS,-2,5 - 1,$509.34,"4,250 / 2"
244,245,INA INA,Hendrik K CLINTON Phita Haningtyas MENTARI,-2,4 - 3,$182.48,"4,190 / 3"
245,246,TPE TPE,Chia Hao LEE Chia Hsin LEE,-2,0 - 4,"$2,233.74","4,050 / 4"
246,247,DEN DEN,Jeppe Bay MADSEN Cecilie FINNE-IPSEN,-2,4 - 3,$0.00,"4,040 / 3"
247,247,SIN SIN,Hendra WIJAYA Shinta Mulia SARI,-2,12 - 12,"$10,541.70","4,040 / 3"
248,249,NGR NGR,Olorunfemi ELEWA Susan IDEH,-2,6 - 1,"$1,602.49","4,022 / 3"
249,250,TPE TPE,LIANG Jui Wei CHENG Chi Ya,-2,5 - 4,"$2,989.98","4,010 / 2"
250,251,CHN CHN,WANG Sijie CHEN Lu,-2,4 - 0,"$4,137.50","4,000 / 1"
251,251,KOR KOR,DukYoung KIM EOM Hye Won,-2,5 - 0,"$79,893.11","4,000 / 1"
252,253,CHI CHI,Ivan LEON Camila MACAYA,-2,10 - 9,$221.22,"3,960 / 3"
253,254,SIN SIN,Kean Hean LOH Yi Ling Elaine CHUA,-2,10 - 8,$526.24,"3,950 / 3"
254,255,MAS MAS,Wee Long Roni TAN Wei Chyi TI,-2,3 - 2,$0.00,"3,950 / 2"
255,255,TUR TUR,Bahadir Kaan KOLA Busra YALÇINKAYA,-2,6 - 4,$0.00,"3,950 / 2"
256,255,RUS RUS,Rodion ALIMOV Alina DAVLETOVA,-2,1 - 4,$550.00,"3,950 / 2"
257,258,USA USA,Tony GUNAWAN Jamie HSU,-2,3 - 1,"$15,679.50","3,850 / 1"
258,258,INA INA,Alfian Eko PRASETYA Masita MAHMUDIN,-2,2 - 1,"$16,516.21","3,850 / 1"
259,258,INA INA,Rafiddias Akhdan NUGROHO Vita MARISSA,-2,2 - 1,"$162,858.75","3,850 / 1"
260,258,TPE TPE,Jhe-Huei LEE WANG Pei Rong,-2,3 - 1,"$10,628.74","3,850 / 1"
261,258,CHN CHN,ZHANG Wen JIA Yifan,-2,4 - 1,"$4,491.87","3,850 / 1"
262,258,AUS AUS,Michael FARIMAN Talia SAUNDERS,-2,2 - 1,$91.88,"3,850 / 1"
263,258,KOR KOR,DukYoung KIM GO Ah Ra,-2,11 - 4,"$8,417.48","3,850 / 1"
264,258,KOR KOR,KIM Dae Eun YOO Hae Won,-2,4 - 2,"$4,776.23","3,850 / 1"
265,266,CRO CRO,Igor CIMBUR Stasa POZNANOVIC,-1,5 - 7,"$4,529.88","3,840 / 6"
266,267,MRI MRI,Sahir Abdool EDOO Yeldy Marie LOUISON,191,26 - 13,$230.62,"3,830 / 2"
267,268,MAS MAS,Muhammad Shahdan MAT DESA Chew HAN HUEY,-2,3 - 3,$70.00,"3,820 / 3"
268,269,FRA FRA,Lucas CLAERBOUT Teshana VIGNES WARAN,-2,5 - 6,$285.00,"3,780 / 3"
269,270,NZL NZL,Benjamin HILLIER Selena WU,-2,2 - 4,$0.00,"3,740 / 4"
270,271,THA THA,Pakin KUNA-ANUVIT Kwanchanok SUDJAIPRAPARAT,-2,4 - 4,$75.00,"3,740 / 3"
271,272,GER GER,Raphael BECK Jennifer KARNOTT,-2,3 - 3,$318.75,"3,730 / 3"
272,273,MAS MAS,Chee Tean TAN Yen Wei PECK,-2,2 - 2,"$3,208.74","3,720 / 2"
273,273,IRL IRL,Joshua MAGEE Rachael DARRAGH,-2,2 - 5,$0.00,"3,720 / 2"
274,273,UKR UKR,Vitaly KONOV Yelyzaveta ZHARKA,-2,19 - 14,$594.00,"3,720 / 2"
275,273,UKR UKR,Gennadiy NATAROV Yuliya KAZARINOVA,-2,38 - 38,"$1,608.74","3,720 / 2"
276,273,RUS RUS,Vasily KUZNETSOV Victoria SLOBODJANUK,-2,8 - 13,$862.50,"3,720 / 2"
277,278,MAS IND,Yogendran KHRISHNAN Prajakta SAWANT,44,0 - 0,"$4,082.49","3,700 / 3"
278,278,IND IND,K. Nandagopal J. Meghana,-2,4 - 4,"$1,167.47","3,700 / 3"
279,280,KOR KOR,JUN Bong Chan Hye Rin KIM,-3,1 - 3,"$2,290.62","3,690 / 3"
280,281,MAS MAS,Mohd Razif ABDUL LATIF Sannatasah SANIRU,-3,2 - 4,"$5,952.47","3,640 / 4"
281,282,MAS MAS,Kah Ming CHOOI Meng Yean LEE,-3,2 - 2,"$3,695.00","3,640 / 2"
282,282,JPN JPN,Koshun MIURA Koharu YONEMOTO,-3,1 - 2,"$7,976.22","3,640 / 2"
283,282,MAS MAS,WONG Fai Yin Shevon Jemie LAI,-3,9 - 13,"$6,283.10","3,640 / 2"
284,285,AUS AUS,Simon Wing Hang LEUNG Tiffany HO,-3,3 - 5,$108.74,"3,620 / 3"
285,286,HKG HKG,LI Kuen Hon YEUNG Nga Ting,-3,2 - 2,$450.00,"3,600 / 2"
286,287,KOR KOR,DukYoung KIM YOO Hae Won,-3,5 - 2,"$6,533.11","3,600 / 1"
287,287,GER GER,Michael FUCHS Isabel HERTTRICH,-3,3 - 2,"$87,523.49","3,600 / 1"
288,287,VIE VIE,Manh Thang DAO Nhu Thao PHAM,-3,11 - 8,"$1,545.00","3,600 / 1"
289,290,MEX MEX,Job CASTILLO Sabrina SOLIS,-3,6 - 5,$82.49,"3,590 / 3"
290,291,DEN DEN,Mads Emil CHRISTENSEN Cecilie SENTOW,-3,7 - 6,$0.00,"3,580 / 5"
291,292,BAR BAR,Dakeil Jonathan THORPE Sabrina SCOTT,-3,1 - 3,$28.12,"3,580 / 3"
292,293,USA USA,Yan Tuck CHAN Yuko KAWASAKI,-3,0 - 2,$0.00,"3,500 / 3"
293,294,VEN VEN,Jhonatan WU ZHENG Damaris Mercedes ORTIZ PARADA,-3,4 - 2,$0.00,"3,500 / 2"
294,295,DEN DEN,Steve OLESEN Maja RINDSHOEJ,-3,2 - 3,$0.00,"3,440 / 3"
295,296,DEN DEN,Jeppe LUDVIGSEN Josephine VAN ZAANE,-3,7 - 5,$500.00,"3,420 / 4"
296,297,TUR TUR,Melih TURGUT Fatma Nur YAVUZ,-3,10 - 8,"$2,000.00","3,420 / 2"
297,298,USA CAN,Hock Lai LEE Phyllis CHAN,-3,4 - 5,"$4,223.70","3,400 / 2"
298,299,CHN CHN,ZHOU Haodong JIA Yifan,-3,2 - 1,"$4,041.87","3,400 / 1"
299,299,INA INA,HAFIZ Faisal Masita MAHMUDIN,-3,6 - 2,"$6,113.73","3,400 / 1"
300,299,CHN CHN,LIU Yuchen HUANG Dongping,-3,10 - 4,"$32,923.12","3,400 / 1"
301,302,MRI MRI,Georges Julien PAUL Kate FOO KUNE,-3,5 - 2,"$1,042.18","3,395 / 2"
302,303,SCO SCO,Josh NEIL Rebekka FINDLAY,-3,1 - 5,$0.00,"3,370 / 5"
303,304,TPE TPE,Chi-Lin WANG Chien Hui YU,-3,0 - 2,"$3,419.85","3,340 / 2"
304,305,RUS RUS,Vladimir RUSIN Ekaterina KUT,-3,3 - 6,$368.75,"3,310 / 4"
305,305,BRA BRA,Daniel PAIOLA Paula B PEREIRA,-3,27 - 23,"$2,346.19","3,310 / 4"
306,307,FIN FIN,Petri HAUTALA Noora AHOLA,-3,3 - 7,$0.00,"3,290 / 5"
307,308,MAS MAS,Jian Yi LEE Peiy Zhean LIM,-3,1 - 9,$18.76,"3,290 / 3"
308,309,THA THA,Trawut POTIENG Jongkolphan KITITHARAKUL,-3,3 - 2,"$1,693.72","3,280 / 2"
309,310,NGR NGR,Folorunsho Ilesanmi OPEYORI Olabisi IBIYEYE,-3,2 - 2,$84.36,"3,270 / 2"
310,311,NGR NGR,Ola FAGBEMI Braimoh MARIA,-3,6 - 5,"$1,741.86","3,243 / 3"
311,312,RUS IND,Vladimir IVANOV Ashwini PONNAPPA,-3,10 - 6,"$8,729.36","3,240 / 2"
312,313,IRL IRL,Ciaran CHAMBERS Sinead CHAMBERS,-3,16 - 22,$0.00,"3,220 / 3"
313,314,CZE CZE,Jaromir JANACEK Lucie CERNA,-3,8 - 19,$93.75,"3,210 / 3"
314,315,UZB UZB,Oleg SAVATUGIN Valeriya MUSHTAKOVA,-3,2 - 4,$54.36,"3,200 / 4"
315,316,INA INA,Yohanes Rendy SUGIARTO Dian FITRIANI,-3,1 - 2,$466.25,"3,190 / 2"
316,316,INA INA,Afiat Yuris WIRAWAN Nadya MELATI,-3,1 - 2,"$2,728.11","3,190 / 2"
317,316,TPE TPE,Cheng Heng SU WU Fang Chien,-3,2 - 4,$504.97,"3,190 / 2"
318,319,POL POL,Robert MATEUSIAK Agnieszka WOJTKOWSKA,-3,36 - 15,"$104,753.63","3,172 / 1"
319,320,MAS MAS,Jagdish SINGH Erica Pei Shan KHOO,-3,3 - 2,$0.00,"3,120 / 2"
320,321,GER GER,Daniel BENZ Annika HORBACH,-2,0 - 7,"$1,230.62","3,100 / 3"
321,322,BEL BEL,Nick MARCOEN Flore VANDENHOUCKE,-2,7 - 18,$0.00,"3,076 / 4"
322,323,POL POL,Maciej OCIEPA GAJOS KAROLINA,-2,4 - 9,$0.00,"3,050 / 7"
323,324,TPE TPE,LU Chia Pin Szu Yu CHEN,-2,3 - 5,"$2,586.84","3,040 / 2"
324,325,JAM JAM,Dayvon REID Ruth WILLIAMS,-1,2 - 2,$0.00,"3,030 / 2"
325,326,TPE TPE,YANG Po-Hsuan WU Yu Lun,-1,2 - 1,$362.50,"3,030 / 1"
326,326,NZL NZL,Joshua CURRY Tegan WESTON,-1,1 - 1,$0.00,"3,030 / 1"
327,328,GER GER,Daniel BENZ Lara KAEPPLEIN,-1,2 - 4,$5.62,"2,980 / 4"
328,329,GER INA,Firdaus M.GUSTAF Aprilsasi Putri LEJARSAR VARIELLA,-1,0 - 2,"$1,550.63","2,960 / 2"
