,RANK,COUNTRY,PLAYER,CHANGE +/-,WIN - LOSE,PRIZE MONEY,POINTS / TOURNAMENTS
0,1,CHN CHN,ZHANG Nan ZHAO Yunlei,0,244 - 37,"$955,150.00","99,785 / 12"
1,2,INA INA,Tontowi AHMAD Liliyana NATSIR,1,210 - 54,"$706,246.25","81,332 / 13"
2,3,CHN CHN,XU Chen MA Jin,-1,183 - 50,"$787,393.12","81,181 / 13"
3,4,CHN CHN,LIU Cheng BAO Yixin,0,72 - 28,"$170,296.24","77,000 / 14"
4,5,DEN DEN,Joachim FISCHER NIELSEN Christinna PEDERSEN,0,229 - 69,"$638,571.49","68,264 / 13"
5,6,ENG ENG,Chris ADCOCK Gabrielle ADCOCK,1,124 - 85,"$163,999.77","63,634 / 16"
6,7,CHN CHN,LU Kai HUANG Yaqiong,-1,58 - 23,"$117,704.99","60,940 / 15"
7,8,KOR KOR,KO Sung Hyun KIM Ha Na,0,67 - 36,"$187,924.99","59,315 / 14"
8,9,INA INA,Riky WIDIANTO Puspita Richi DILI,1,97 - 57,"$98,733.58","55,010 / 16"
9,10,INA INA,Praveen JORDAN Debby SUSANTO,1,46 - 26,"$103,931.85","54,782 / 15"
10,11,HKG HKG,LEE Chun Hei Reginald CHAU Hoi Wah,-2,82 - 41,"$134,802.10","52,995 / 17"
11,12,INA INA,Edi SUBAKTIAR Gloria Emanuelle WIDJAJA,0,52 - 28,"$44,619.10","50,460 / 15"
12,13,DEN DEN,Mads Pieler KOLDING Kamilla RYTTER JUHL,0,49 - 32,"$155,575.62","48,390 / 9"
13,14,GER GER,Michael FUCHS Birgit MICHELS,0,131 - 78,"$151,341.26","44,778 / 16"
14,15,NED NED,Jacco ARENDS Selena PIEK,0,83 - 55,"$30,311.99","43,175 / 20"
15,16,HKG HKG,CHAN Alan Yun Lung TSE Ying Suet,0,52 - 44,"$40,954.74","38,527 / 18"
16,17,JPN JPN,Kenichi HAYAKAWA Misaki MATSUTOMO,1,62 - 64,"$42,371.34","37,180 / 12"
17,18,SIN SIN,Danny Bawa CHRISNANTA Yu Yan Vanessa NEO,-1,106 - 99,"$66,066.12","36,204 / 17"
18,19,MAS MAS,Peng Soon CHAN Liu Ying GOH,9,143 - 87,"$188,501.87","36,040 / 10"
19,20,NED NED,Jorrit DE RUITER Samantha BARNING,-1,65 - 47,"$24,159.41","35,367 / 20"
20,21,USA USA,Phillip CHEW Jamie SUBANDHI,-1,60 - 53,"$16,532.40","34,518 / 19"
21,22,FRA FRA,Ronan LABAR Emilie LEFEL,2,62 - 39,"$9,973.49","33,578 / 25"
22,23,CAN CAN,Toby NG Alex BRUCE,3,48 - 21,"$16,404.96","33,384 / 13"
23,24,INA INA,Markis KIDO Pia Zebadiah BERNADETH,-1,80 - 58,"$102,761.10","33,000 / 12"
24,25,SIN SIN,Chayut TRIYACHART Shinta Mulia SARI,0,35 - 27,"$21,756.30","32,658 / 11"
25,26,RUS RUS,Vitalij DURKIN Nina VISLOVA,-4,157 - 71,"$63,584.23","32,650 / 17"
26,27,INA INA,Ronald ALEXANDER Melati Daeva OKTAVIANI,-6,40 - 21,"$10,919.86","32,650 / 13"
27,28,IRL IRL,Sam MAGEE Chloe MAGEE,-1,111 - 84,"$20,715.74","32,360 / 14"
28,29,RUS RUS,Evgenij DREMIN Evgenia DIMOVA,4,53 - 35,"$16,109.99","31,798 / 14"
29,30,FRA FRA,Gaetan MITTELHEISSER Audrey FONTAINE,0,49 - 37,"$6,399.00","30,860 / 22"
30,31,CHN CHN,ZHENG Siwei CHEN Qingchen,0,46 - 3,"$38,151.24","30,620 / 6"
31,32,GER GER,Peter KAESBAUER Isabel HERTTRICH,2,49 - 34,"$22,003.99","30,130 / 10"
32,33,DEN DEN,Niclas NOHR Sara THYGESEN,-1,47 - 20,"$10,150.75","29,740 / 12"
33,34,GER GER,Max SCHWENGER Carla NELTE,1,47 - 38,"$14,108.01","29,093 / 12"
34,35,AUS AUS,Robin MIDDLETON Leanne CHOO,11,21 - 14,"$10,723.49","26,971 / 10"
35,36,THA THA,Nipitphon PUANGPUAPECH Puttita SUPAJIRAKUL,1,18 - 24,"$13,038.72","26,858 / 10"
36,37,INA INA,Irfan FADHILAH Weni ANGGRAINI,1,70 - 48,"$36,337.48","26,790 / 10"
37,38,SIN SIN,Yong Kai Terry HEE Wei Han TAN,1,21 - 8,"$3,860.61","26,749 / 10"
38,39,MAS MAS,WONG Fai Yin Mei Kuan CHOW,4,22 - 23,"$5,159.98","26,510 / 14"
39,40,MAS MAS,Aik Quan TAN Pei Jing LAI,0,62 - 52,"$30,336.46","26,030 / 10"
40,41,PER PER,Mario CUBA Katherine WINDER,0,69 - 28,"$5,398.70","25,795 / 13"
41,42,TPE TPE,LIAO Min Chun CHEN Hsiao Huan,5,50 - 54,"$16,253.74","25,710 / 12"
42,43,MAS MAS,Chee Tean TAN Shevon Jemie LAI,-1,25 - 20,"$4,383.12","25,600 / 13"
43,44,RUS RUS,Anatoliy YARTSEV Evgeniya KOSETSKAYA,-8,68 - 42,"$5,008.99","25,260 / 15"
44,45,INA INA,Fran KURNIAWAN Komala DEWI,-1,30 - 14,"$49,784.73","25,090 / 10"
45,46,THA THA,Sudket PRAPAKAMOL Saralee THOUNGTHONGKAM,-17,275 - 167,"$326,022.47","24,490 / 7"
46,47,USA USA,Howard SHU Eva LEE,1,0 - 1,"$13,710.98","23,921 / 12"
47,48,INA INA,Alfian Eko PRASETYA Annisa SAUFIKA,1,0 - 0,"$27,530.57","23,480 / 7"
48,49,SWE SWE,Jonatan NORDH Emelie FABBEKE,-4,2 - 2,"$3,489.38","22,856 / 18"
49,50,KOR KOR,SolGyu CHOI CHAE Yoo Jung,0,0 - 0,"$50,436.24","22,850 / 7"
50,51,PER PER,Andres CORPANCHO Luz Maria ZORNOZA,0,0 - 0,"$1,783.99","22,497 / 13"
51,52,IND IND,KONA Tarun NELAKURIHI Sikki Reddy,0,0 - 0,"$11,772.46","22,250 / 14"
52,53,DEN DEN,Mathias CHRISTIANSEN Lena GREBAK,1,0 - 0,"$12,617.00","21,790 / 8"
53,54,ENG ENG,Harley TOWLER Emily WESTWOOD,1,0 - 0,,"20,900 / 13"
54,55,CHN CHN,HUANG Kaixiang HUANG Dongping,1,0 - 0,,"20,660 / 5"
55,56,GER GER,Jones Ralfy JANSEN Cisita Joity JANSEN,1,0 - 0,,"20,630 / 12"
56,57,INA INA,Andrei ADISTIA Vita MARISSA,1,0 - 0,,"20,450 / 6"
57,58,KOR KOR,SHIN Baek Cheol CHANG Ye Na,7,0 - 0,,"20,260 / 6"
58,59,FRA FRA,Bastian KERSAUDY Lea PALERMO,0,0 - 0,,"20,200 / 12"
59,60,RUS RUS,Rodion KARGAEV Ekaterina BOLOTOVA,2,0 - 0,,"20,140 / 13"
60,61,BRA BRA,Alex Yuwan TJONG Lohaynny VICENTE,-1,0 - 0,,"18,796 / 10"
61,62,CAN CAN,PHILLIPE Charron Phyllis CHAN,-1,0 - 0,,"18,775 / 11"
62,63,INA INA,Muhammad RIJAL Vita MARISSA,-10,0 - 0,,"18,440 / 5"
63,64,GER GER,Marvin Emil SEIDEL Linda EFLER,-1,0 - 0,,"18,000 / 11"
64,65,DEN DEN,Kasper ANTONSEN Amanda MADSEN,1,0 - 0,,"16,910 / 9"
65,66,KOR KOR,KIM Gi Jung SHIN Seung Chan,1,0 - 0,,"16,890 / 7"
66,67,KOR KOR,YOO Yeon Seong EOM Hye Won,1,0 - 0,,"16,800 / 3"
67,68,TPE TPE,LIN Chia Yu WU Ti Jung,1,0 - 0,,"16,660 / 10"
68,69,TPE TPE,TSENG Min Hao LAI Chia Wen,1,0 - 0,,"16,656 / 8"
69,70,TPE TPE,Chi-Lin WANG CHENG Chi Ya,9,0 - 0,,"16,440 / 9"
70,71,RUS IND,Vladimir IVANOV Ashwini PONNAPPA,2,0 - 0,,"16,070 / 6"
71,72,GER GER,Raphael BECK Kira KATTENBECK,2,0 - 0,,"15,620 / 9"
72,73,POL POL,Pawel PIETRYJA Aneta WOJTKOWSKA,3,0 - 0,,"15,560 / 12"
73,74,MEX MEX,Lino MUNOZ Cynthia GONZALEZ,3,0 - 0,,"15,519 / 9"
74,75,UKR UKR,Gennadiy NATAROV Yuliya KAZARINOVA,3,0 - 0,,"15,440 / 9"
75,76,BRA BRA,Hugo ARTHUSO Fabiana SILVA,-5,0 - 0,,"15,340 / 9"
76,77,FRA FRA,Marin BAUMANN Lorraine BAUMANN,3,0 - 0,,"14,770 / 11"
77,78,TUR TUR,Ramazan OZTURK Neslihan KILIC,3,0 - 0,,"14,578 / 12"
78,79,SWE SWE,Nico RUPONEN Amanda HOGSTROM,3,0 - 0,,"14,360 / 9"
79,80,RUS RUS,Andrey PARAKHODIN Anastasia CHERVYAKOVA,3,0 - 0,,"14,260 / 8"
80,81,CAN CAN,Nyl YAKURA Brittney TAM,8,0 - 0,,"14,170 / 8"
81,82,CZE CZE,Jakub BITMAN Alzbeta BASOVA,-10,0 - 0,,"14,158 / 11"
82,83,IND IND,Akshay DEWALKAR Pradnya GADRE,1,0 - 0,,"13,960 / 5"
83,84,ENG ENG,Christopher COLES Sophie BROWN,1,0 - 0,,"13,900 / 8"
84,85,IND IND,Arun VISHNU Aparna BALAN,-10,0 - 0,,"13,820 / 5"
85,86,SWE SWE,Filip Michael Duwall MYHREN Emma WENGBERG,1,0 - 0,,"13,650 / 10"
86,87,ENG ENG,Gregory MAIRS Jenny MOORE,1,0 - 0,,"13,190 / 8"
87,88,THA THA,Maneepong JONGJIT Sapsiree TAERATTANACHAI,-24,0 - 0,,"13,150 / 4"
88,89,PER PER,Martin DEL VALLE Daniela MACIAS,1,0 - 0,,"12,877 / 10"
89,90,GER GER,Mark LAMSFUSS Franziska VOLKMANN,2,0 - 0,,"12,730 / 9"
90,91,CAN CAN,Kevin LI Rachel HONDERICH,7,0 - 0,,"12,600 / 9"
91,92,JPN JPN,Keigo SONODA Naoko FUKUMAN,1,0 - 0,,"12,580 / 4"
92,93,JPN JPN,Hirokatsu HASHIMOTO Miyuki MAEDA,-7,0 - 0,,"12,520 / 4"
93,94,AUT AUT,David OBERNOSTERER Elisabeth BALDAUF,0,0 - 0,,"12,350 / 6"
94,95,EGY EGY,Abdelrahman KASHKAL Hadia HOSNY,-4,0 - 0,,"12,210 / 11"
95,96,KOR KOR,SHIN Baek Cheol CHAE Yoo Jung,-1,0 - 0,,"12,210 / 3"
96,97,SUI SUI,Oliver SCHALLER Celine BURKART,-1,0 - 0,,"12,000 / 15"
97,98,AUS AUS,Matthew CHAU Gronya SOMERVILLE,1,0 - 0,,"11,380 / 6"
98,99,KOR KOR,LEE Yong Dae LEE So Hee,2,0 - 0,,"11,300 / 3"
99,100,TPE TPE,Ko-Chi CHANG Hsin Tien CHANG,3,0 - 0,,"11,160 / 8"
100,101,KOR KOR,SolGyu CHOI EOM Hye Won,4,0 - 0,,"11,030 / 3"
101,102,FRA FRA,Baptiste CAREME Anne TRAN,4,0 - 0,,"10,920 / 8"
102,103,GUA GUA,SOLIS JONATHAN Nikte Alejandra SOTOMAYOR,4,0 - 0,,"10,790 / 6"
103,104,CHN CHN,LIU Yuchen YU Xiaohan,5,0 - 0,,"10,440 / 3"
104,105,KOR KOR,DukYoung KIM GO Ah Ra,5,0 - 0,,"10,420 / 3"
105,106,BRA BRA,Daniel PAIOLA Paula B PEREIRA,-6,0 - 0,,"10,135 / 8"
106,107,FRA FRA,Laurent CONSTANTIN Laura CHOINET,4,0 - 0,,"10,080 / 9"
107,108,BEL BEL,Floris OLEFFE Steffi ANNYS,4,0 - 0,,"10,073 / 14"
108,109,SCO SCO,Robert BLAIR Imogen BANKIER,-5,0 - 0,,"9,958 / 3"
109,110,INA INA,Fran KURNIAWAN Shendy Puspa IRAWATI,-2,0 - 0,,"9,810 / 3"
110,111,MAS MAS,Peng Soon CHAN Pei Jing LAI,3,0 - 0,,"9,800 / 2"
111,112,MAS IND,Vountus Indra MAWAN Prajakta SAWANT,3,0 - 0,,"9,760 / 5"
112,113,INA INA,Lukhi Apri NUGROHO Masita MAHMUDIN,-11,0 - 0,,"9,680 / 4"
113,114,TPE AUS,LU Ching Yao Hsuan-Yu Wendy CHEN,-17,0 - 0,,"9,460 / 4"
114,115,IND IND,Juhi DEWANGAN Venkat Gaurav PRASAD,1,0 - 0,,"9,450 / 6"
115,116,EGY EGY,Ali Ahmed EL KHATEEB Doha HANY,1,0 - 0,,"9,380 / 7"
116,117,FIN FIN,Henri AARNIO Jenny NYSTROM,1,0 - 0,,"9,250 / 12"
117,118,GER GER,Peter KAESBAUER Carla NELTE,1,0 - 0,,"9,240 / 4"
118,119,VIE VIE,Manh Thang DAO Nhu Thao PHAM,-6,0 - 0,,"9,130 / 4"
119,120,BUL SUI,Stilian MAKARSKI Celine TRIPET,0,0 - 0,,"9,110 / 7"
120,121,AUS AUS,Sawan SERASINGHE Setyana MAPASA,0,0 - 0,,"9,020 / 5"
121,122,RSA RSA,Andries MALAN Jennifer FRY,13,0 - 0,,"8,983 / 5"
122,123,INA INA,Agripinna Prima Rahmanto PUTRA Rizki Amelia PRADIPTA,-1,0 - 0,,"8,930 / 8"
123,124,CZE CZE,Ondrej KOPRIVA Katerina TOMALOVA,-1,0 - 0,,"8,830 / 10"
124,125,NED NED,Jelle MAAS Iris TABELING,-1,0 - 0,,"8,776 / 4"
125,126,GER GER,Mark LAMSFUSS Isabel HERTTRICH,0,0 - 0,,"8,370 / 4"
126,127,DOM DOM,Nelson JAVIER VIBIECA BERONICA,0,0 - 0,,"8,325 / 5"
127,128,IND IND,Manu ATTRI K. Maneesha,0,0 - 0,,"8,170 / 2"
128,129,EGY EGY,Ahmed SALAH Menna ELTANANY,1,0 - 0,,"8,120 / 8"
129,130,FIN NED,Anton KAISTI Cheryl SEINEN,1,0 - 0,,"8,040 / 4"
130,131,TPE TPE,Hsiao-Lin WU HSIEH Pei Chen,1,0 - 0,,"8,010 / 7"
131,132,IND IND,Manu ATTRI NELAKURIHI Sikki Reddy,1,0 - 0,,"7,976 / 3"
132,133,ENG ENG,Matthew NOTTINGHAM Alyssa LIM,1,0 - 0,,"7,900 / 5"
133,134,INA INA,Akbar PANJI Apriani RAHAYU,2,0 - 0,,"7,770 / 8"
134,135,MAS MAS,Mohd Lutfi Zaim ABDUL KHALID Fie Cho SOONG,3,0 - 0,,"7,700 / 6"
135,136,CHN CHN,WANG YILYU OU Dongni,3,0 - 0,,"7,630 / 3"
136,137,INA INA,Yonathan Suryatama DASUKI Aprilsasi Putri LEJARSAR VARIELLA,-12,0 - 0,,"7,530 / 5"
137,138,NED TPE,Ruud BOSCH SHUAI Pei Ling,2,0 - 0,,"7,450 / 4"
138,139,POL POL,Robert MATEUSIAK Nadiezda ZIEBA,2,0 - 0,,"7,400 / 2"
139,140,RSA RSA,Cameron COETZER Michelle BUTLER-EMMETT,2,0 - 0,,"7,370 / 4"
140,141,VIE VIE,Bao Duc DUONG Thi Hong Gam THAI,2,0 - 0,,"7,339 / 4"
141,142,INA INA,Alfian Eko PRASETYA Shella Devi Aulia,2,0 - 0,,"7,270 / 3"
142,143,INA INA,HAFIZ Faisal Shella Devi Aulia,-14,0 - 0,,"7,240 / 3"
143,144,RUS RUS,Alexandr ZINCHENKO Olga MOROZOVA,1,0 - 0,,"7,220 / 4"
144,145,CAN CAN,Henry WIEBE Grace GAO,1,0 - 0,,"7,210 / 5"
145,146,TPE TPE,LU Chia Pin Szu Yu CHEN,2,0 - 0,,"7,140 / 5"
146,147,TPE TPE,LU Ching Yao CHENG Wen Hsing,2,0 - 0,,"7,040 / 3"
147,148,FRA FRA,Lucas CLAERBOUT Teshana VIGNES WARAN,2,0 - 0,,"6,990 / 6"
148,149,HKG HKG,TANG Chun Man CHAN Kaka Tsz Ka,2,0 - 0,,"6,940 / 3"
149,150,PER PER,Jose GUEVARA Danica NISHIMURA,2,0 - 0,,"6,930 / 5"
150,151,INA INA,Muhammad Rian ARDIANTO Rosyita Eka PUTRI SARI,2,0 - 0,,"6,910 / 4"
151,152,TPE TPE,HUANG Po Jui SHUAI Pei Ling,2,0 - 0,,"6,870 / 6"
152,153,AUS AUS,Daniel GUDA Joy LAI,2,0 - 0,,"6,700 / 5"
153,154,NZL NZL,Maika PHILLIPS Anona PAK,2,0 - 0,,"6,670 / 3"
154,155,IND IND,Pranaav Jerry CHOPRA Ashwini PONNAPPA,2,0 - 0,,"6,660 / 3"
155,156,KOR KOR,DukYoung KIM YOO Hae Won,2,0 - 0,,"6,630 / 2"
156,157,CHN CHN,LIU Yuchen LUO Yu,2,0 - 0,,"6,540 / 2"
157,157,JPN JPN,Keigo SONODA Shizuka MATSUO,2,0 - 0,,"6,540 / 2"
158,159,JPN JPN,Kenta KAZUNO Ayane KURIHARA,2,0 - 0,,"6,433 / 4"
159,160,BEL BEL,Nick MARCOEN Flore VANDENHOUCKE,2,0 - 0,,"6,426 / 10"
160,161,IND IND,Shlok RAMCHANDRAN J. Meghana,2,0 - 0,,"6,270 / 4"
161,162,RUS RUS,Ilya ZHDANOV Tatjana BIBIK,2,0 - 0,,"6,230 / 4"
162,163,DEN DEN,Alexander BOND Ditte SØBY HANSEN,2,0 - 0,,"6,220 / 6"
163,164,HUN HUN,Gergely KRAUSZ Laura SAROSI,2,0 - 0,,"6,200 / 6"
164,165,EGY EGY,Abdelrahman ABDELHAKIM Nadine ASHRAF,2,0 - 0,,"6,150 / 7"
165,166,FRA MRI,Florent RIANCHO Kate FOO KUNE,2,0 - 0,,"6,140 / 6"
166,167,RUS RUS,Ilya ZHDANOV Irina KHLEBKO,2,0 - 0,,"6,110 / 7"
167,168,CHN CHN,KANG Jun LUO Ying,2,0 - 0,,"6,050 / 1"
168,169,DEN DEN,Jeppe LUDVIGSEN Mai SURROW,2,0 - 0,,"6,030 / 6"
169,170,SVK UGA,Matej HLINICAN Bridget Shamim BANGI,2,0 - 0,,"6,000 / 3"
170,171,DEN DEN,Soren GRAVHOLT Maiken FRUERGAARD,2,0 - 0,,"5,990 / 6"
171,172,TUR TUR,Melih TURGUT Fatma Nur YAVUZ,2,0 - 0,,"5,980 / 6"
172,173,POL POL,Robert MATEUSIAK Agnieszka WOJTKOWSKA,-26,0 - 0,,"5,977 / 3"
173,174,CHN CHN,YU Xiaoyu XIA Huan,1,0 - 0,,"5,950 / 1"
174,175,DEN DEN,Patrick BUHL Isabella NIELSEN,1,0 - 0,,"5,930 / 5"
175,176,MAS MAS,Wee Gieen TAN Yen Wei PECK,1,0 - 0,,"5,920 / 5"
176,177,NED NED,Ruben JILLE Alida CHEN,2,0 - 0,,"5,833 / 6"
177,178,ARG ARG,Pablo MACAGNO Florencia BERNATENE,2,0 - 0,,"5,766 / 6"
178,179,MEX MEX,Job CASTILLO Sabrina SOLIS,2,0 - 0,,"5,720 / 4"
179,180,HKG HKG,TANG Chun Man POON Lok Yan,3,0 - 0,,"5,680 / 3"
180,181,IRL IRL,Ciaran CHAMBERS Sinead CHAMBERS,3,0 - 0,,"5,660 / 5"
181,182,UKR UKR,Valeriy ATRASHCHENKOV Yelyzaveta ZHARKA,3,0 - 0,,"5,650 / 5"
182,182,ECU ECU,Emilio ZAMBRANO Maria Delia ZAMBRANO,3,0 - 0,,"5,650 / 5"
183,184,MAS MAS,Jian Yi LEE Peiy Zhean LIM,3,0 - 0,,"5,630 / 7"
184,185,NZL NZL,Shane MASINIPENI Maria MASINIPENI,3,0 - 0,,"5,620 / 3"
185,186,INA INA,HAFIZ Faisal Masita MAHMUDIN,3,0 - 0,,"5,600 / 2"
186,187,GER GER,Max WEISSKIRCHEN Eva JANSSENS,3,0 - 0,,"5,530 / 2"
187,188,KOR KOR,SolGyu CHOI SHIN Seung Chan,4,0 - 0,,"5,500 / 1"
188,189,GER GER,Fabian HOLZER Barbara BELLENBERG,4,0 - 0,,"5,390 / 7"
189,190,SIN SIN,Guang Liang Jason WONG Citra Dewi SARI,4,0 - 0,,"5,380 / 6"
190,191,CHI CHI,Ivan LEON Camila MACAYA,4,0 - 0,,"5,330 / 4"
191,192,ESP ESP,Pablo ABIAN Haidee OJEDA,4,0 - 0,,"5,320 / 3"
192,193,RUS RUS,Gordey KOSENKO Olga LIPKINA,4,0 - 0,,"5,260 / 4"
193,194,ARG ARG,Tomas THOUYARET Barbara Maria BERRUEZO,4,0 - 0,,"5,150 / 6"
194,195,TPE TPE,LU Chia Pin Chia Hsin LEE,4,0 - 0,,"5,140 / 2"
195,196,INA INA,Tontowi AHMAD Debby SUSANTO,4,0 - 0,,"5,040 / 1"
196,197,RUS RUS,Vadim NOVOSELOV Julia ZAPOLSKAYA,4,0 - 0,,"5,000 / 3"
197,198,ENG ENG,Oliver BACZALA Victoria WILLIAMS,4,0 - 0,,"4,930 / 4"
198,199,CHN CHN,HE Jiting DU Yue,4,0 - 0,,"4,920 / 2"
199,200,CHN CHN,WANG YILYU TANG Yuanting,4,0 - 0,,"4,900 / 1"
200,200,INA INA,Afiat Yuris WIRAWAN Komala DEWI,4,0 - 0,,"4,900 / 1"
201,202,SCO USA,Alistair CASEY Yuko KAWASAKI,4,0 - 0,,"4,880 / 4"
202,203,KOR KOR,YOO Yeon Seong CHANG Ye Na,4,0 - 0,,"4,880 / 2"
203,204,SCO SCO,Patrick MACHUGH Rebekka FINDLAY,4,0 - 0,,"4,872 / 6"
204,205,DEN DEN,Rene MATTISSON Thilde MATTISSON,4,0 - 0,,"4,870 / 3"
205,206,INA INA,Kevin Sanjaya SUKAMULJO Maretha Dea GIOVANI,4,0 - 0,,"4,830 / 2"
206,207,FIN FIN,Anton KAISTI Mathilda LINDHOLM,5,0 - 0,,"4,760 / 5"
207,208,AUT AUT,Roman ZIRNWALD Elisabeth BALDAUF,-71,0 - 0,,"4,748 / 5"
208,209,TPE TPE,CHEN Chung Jen Yu Chieh CHENG,4,0 - 0,,"4,700 / 3"
209,210,TPE TPE,Yang LEE WU Fang Chien,4,0 - 0,,"4,700 / 2"
210,210,NGR NGR,Jinkan Ifraimu BULUS Susan IDEH,4,0 - 0,,"4,700 / 2"
211,212,JPN JPN,Yuta WATANABE Arisa HIGASHINO,4,0 - 0,,"4,680 / 1"
212,212,NZL NZL,Oliver LEYDON-DAVIS Danielle TAHURI,4,0 - 0,,"4,680 / 1"
213,214,IND IND,T. Hema Nagendra Babu S. Poorvisha Ram,4,0 - 0,,"4,660 / 3"
214,215,FRA SUI,Baptiste CAREME Sabrina JAQUET,4,0 - 0,,"4,630 / 3"
215,216,RUS RUS,Rodion ALIMOV Alina DAVLETOVA,5,0 - 0,,"4,500 / 3"
216,217,FRA FRA,Jordan CORVEE Stacey GUERIN,5,0 - 0,,"4,440 / 6"
217,218,CHI CHI,Cristian ARAYA Tingting CHOU,5,0 - 0,,"4,400 / 3"
218,219,CUB CUB,Leodannis MARTINEZ Tahimara OROPEZA,5,0 - 0,,"4,400 / 2"
219,219,CUB CUB,Ernesto REYES Melissa AZCUY PEREZ,5,0 - 0,,"4,400 / 2"
220,219,POL SCO,Robert MATEUSIAK Imogen BANKIER,5,0 - 0,,"4,400 / 2"
221,222,JPN JPN,Takuto INOUE Shizuka MATSUO,5,0 - 0,,"4,390 / 2"
222,223,INA INA,Lukhi Apri NUGROHO Ulfa ZAKIA,6,0 - 0,,"4,360 / 4"
223,224,MAS MAS,Bolriffin KHAIRUL TOR Sin Er NG,7,0 - 0,,"4,330 / 2"
224,224,MAS MAS,Peng Soon CHAN Hui Lin NG,7,0 - 0,,"4,330 / 2"
225,224,NGR NGR,Ola FAGBEMI Dorcas Ajoke ADESOKAN,7,0 - 0,,"4,330 / 2"
226,227,INA INA,Kevin Sanjaya SUKAMULJO Greysia POLII,7,0 - 0,,"4,320 / 1"
227,227,KOR KOR,KIM Gi Jung KIM So Yeong,-36,0 - 0,,"4,320 / 1"
228,229,ENG ENG,Peter BRIGGS Helena LEWCZYNSKA,6,0 - 0,,"4,310 / 2"
229,230,AUS AUS,Simon Wing Hang LEUNG Tiffany HO,6,0 - 0,,"4,300 / 3"
230,231,POL POL,Maciej DABROWSKI WITEK MAGDALENA,6,0 - 0,,"4,290 / 6"
231,232,SCO SCO,Adam HALL Julie MACPHERSON,6,0 - 0,,"4,280 / 4"
232,233,DOM DOM,William CABRERA Bermary Altagracia POLANCO MUNOZ,6,0 - 0,,"4,270 / 3"
233,234,IND IND,Utkarsh ARORA Mohita SAHDEV,6,0 - 0,,"4,240 / 2"
234,234,CHN CHN,HUANG Kaixiang JIA Yifan,6,0 - 0,,"4,240 / 2"
235,236,FIN EST,Marko PYYKONEN Karoliine HOIM,6,0 - 0,,"4,200 / 3"
236,237,GER GER,Andreas HEINZ Jennifer KARNOTT,6,0 - 0,,"4,190 / 7"
237,238,GER GER,Johannes PISTORIUS Ramona HACKS,6,0 - 0,,"4,080 / 5"
238,239,IND IND,Prem Singh CHOUHAN Saruni SHARMA,6,0 - 0,,"4,070 / 3"
239,240,RUS RUS,Vladimir NIKULOV Daria SEREBRIAKOVA,6,0 - 0,,"4,030 / 6"
240,241,ENG ENG,Ben LANE Jessica PUGH,6,0 - 0,,"4,020 / 3"
241,242,TPE TPE,LIANG Jui Wei CHENG Chi Ya,6,0 - 0,,"4,010 / 2"
242,243,KOR KOR,DukYoung KIM EOM Hye Won,6,0 - 0,,"4,000 / 1"
243,244,NEP NEP,Ratnajit TAMANG Sara Devi TAMANG,6,0 - 0,,"3,960 / 3"
244,245,LTU LTU,Povilas BARTUSIS Vytaute FOMKINAITE,7,0 - 0,,"3,930 / 4"
245,246,FIN FIN,Pekka RYHANEN Sonja PEKKOLA,7,0 - 0,,"3,910 / 4"
246,247,MRI MRI,Sahir Abdool EDOO Yeldy Marie LOUISON,8,0 - 0,,"3,880 / 2"
247,248,MRI MRI,Georges Julien PAUL Kate FOO KUNE,8,0 - 0,,"3,870 / 2"
248,249,IND IND,Akshay DEWALKAR Prajakta SAWANT,9,0 - 0,,"3,850 / 1"
249,249,AUS AUS,Michael FARIMAN Talia SAUNDERS,9,0 - 0,,"3,850 / 1"
250,249,MAS MAS,Aik Quan TAN Meng Yean LEE,9,0 - 0,,"3,850 / 1"
251,249,IND IND,V. Gangadhara Rao D. Sudha Kalyani,9,0 - 0,,"3,850 / 1"
252,249,INA INA,Afiat Yuris WIRAWAN Vita MARISSA,9,0 - 0,,"3,850 / 1"
253,249,CHN CHN,SHI Longfei ZHONG Qianxin,9,0 - 0,,"3,850 / 1"
254,249,MAS MAS,Jian Guo ONG Meng Yean LEE,9,0 - 0,,"3,850 / 1"
255,249,USA USA,Halim Haryanto HO Jing Yu HONG,9,0 - 0,,"3,850 / 1"
256,249,TPE TPE,CHEN Hung Ling Chia Hsin LEE,9,0 - 0,,"3,850 / 1"
257,249,GER GER,Johannes SCHOETTLER Johanna GOLISZEWSKI,9,0 - 0,,"3,850 / 1"
258,259,TPE TPE,TIEN Tzu Chieh Ling Fang HU,9,0 - 0,,"3,810 / 3"
259,259,SWE SWE,Toni HOLM-LOWEN Berfin ASLAN,9,0 - 0,,"3,810 / 3"
260,261,DOM DOM,Nelson JAVIER Daigenis SATURRIA,9,0 - 0,,"3,800 / 4"
261,262,KOR KOR,KIM Dae Eun CHOI Hye In,9,0 - 0,,"3,780 / 2"
262,263,ENG ENG,Sean VENDY Lydia Jane POWELL,9,0 - 0,,"3,730 / 3"
263,264,IND IND,Sanyam SHUKLA K. Maneesha,9,0 - 0,,"3,720 / 2"
264,264,INA INA,Fajar ALFIAN Mahadewi Istirani NI KETUT,-86,0 - 0,,"3,720 / 2"
265,264,BRA BRA,Fabio SOARES Luana VICENTE,9,0 - 0,,"3,720 / 2"
266,264,RUS RUS,Vasily KUZNETSOV Victoria SLOBODJANUK,9,0 - 0,,"3,720 / 2"
267,268,RUS RUS,Vladimir RUSIN Ekaterina KUT,8,0 - 0,,"3,680 / 4"
268,269,UZB RUS,Artyom SAVATYUGIN Polina VORONKO,8,0 - 0,,"3,660 / 3"
269,270,JPN JPN,Koshun MIURA Koharu YONEMOTO,8,0 - 0,,"3,640 / 2"
270,271,INA INA,Praveen JORDAN Liliyana NATSIR,8,0 - 0,,"3,600 / 1"
271,271,INA HKG,Fernando KURNIAWAN POON Lok Yan,8,0 - 0,,"3,600 / 1"
272,271,GER GER,Michael FUCHS Isabel HERTTRICH,8,0 - 0,,"3,600 / 1"
273,274,POL POL,Milosz BOCHAT Aneta WOJTKOWSKA,8,0 - 0,,"3,590 / 3"
274,274,AUS AUS,Daniel GUDA Gronya SOMERVILLE,8,0 - 0,,"3,590 / 3"
275,276,BAR BAR,Dakeil Jonathan THORPE Sabrina SCOTT,8,0 - 0,,"3,580 / 3"
276,277,RSA RSA,Michelle BUTLER-EMMETT Willem VILJOEN,8,0 - 0,,"3,570 / 3"
277,278,THA THA,Krit TANTIANANKUL Panjarat PRANSOPON,8,0 - 0,,"3,570 / 2"
278,278,NGR NGR,Enejoh ABAH Tosin Damilola ATOLAGBE,8,0 - 0,,"3,570 / 2"
279,280,SUI SUI,Pierrick DESCHENAUX Tiffany GIRONA,8,0 - 0,,"3,510 / 8"
280,281,IND IND,Gaurav MALHAN Meenu SINGH,8,0 - 0,,"3,510 / 3"
281,282,ISR ISR,Ariel SHAINSKI Pugach ALINA,8,0 - 0,,"3,506 / 3"
282,283,GRE GRE,Petros TENTAS Irini TENTA,8,0 - 0,,"3,490 / 5"
283,284,INA INA,Kevin Sanjaya SUKAMULJO Della Destiara HARIS,-102,0 - 0,,"3,490 / 2"
284,285,TPE TPE,Li-Wei PO Hsin Tien CHANG,7,0 - 0,,"3,440 / 3"
285,286,SEY SEY,Georgie CUPIDON Allisen CAMILLE,7,0 - 0,,"3,435 / 3"
286,287,SIN SIN,Kean Hean LOH Dellis YULIANA,-57,0 - 0,,"3,420 / 2"
287,288,AUS AUS,Pit Seng LOW Alice WU,6,0 - 0,,"3,410 / 3"
288,289,AUS INA,Tran Hoang PHAM Sylvina KURNIAWAN,6,0 - 0,,"3,400 / 1"
289,289,CHN CHN,LIU Yuchen HUANG Dongping,6,0 - 0,,"3,400 / 1"
290,291,HKG HKG,WONG Wai Hong CHAN Hung Yung,6,0 - 0,,"3,390 / 3"
291,292,KAZ KAZ,Artur NIYAZOV Veronika SOROKINA,6,0 - 0,,"3,384 / 5"
292,293,GER GER,Johannes PISTORIUS Lara KAEPPLEIN,6,0 - 0,,"3,290 / 3"
293,294,THA THA,Trawut POTIENG Jongkolphan KITITHARAKUL,6,0 - 0,,"3,280 / 2"
294,295,MAS MAS,Muhammad Shahdan MAT DESA Chew HAN HUEY,6,0 - 0,,"3,270 / 2"
295,295,POL POL,Pawel PIETRYJA Agnieszka WOJTKOWSKA,6,0 - 0,,"3,270 / 2"
296,295,DOM DOM,William CABRERA Daigenis SATURRIA,6,0 - 0,,"3,270 / 2"
297,298,TPE TPE,Shang Kai LIN Hsin-Yu TSAI,6,0 - 0,,"3,220 / 3"
298,299,CRO CRO,Zvonimir HOELBLING Maja PAVLINIC,6,0 - 0,,"3,210 / 3"
299,299,TPE TPE,Yuan Cheng WU Ching Hui CHANG,6,0 - 0,,"3,210 / 3"
300,299,MAS MAS,Khek Wei CHUA Yen Wei PECK,6,0 - 0,,"3,210 / 3"
301,299,SUR SUR,Mitchel WONGSODIKROMO Crystal LEEFMANS,6,0 - 0,,"3,210 / 3"
302,299,CZE CZE,Jaromir JANACEK Lucie CERNA,6,0 - 0,,"3,210 / 3"
303,304,FRA FRA,Toma Junior POPOV Yaelle HOYAUX,6,0 - 0,,"3,200 / 4"
304,305,KOR KOR,JUN Bong Chan KIM Ji Won,6,0 - 0,,"3,190 / 2"
305,305,IND IND,Rishabh SAHDEV Rachita SAHDEV,6,0 - 0,,"3,190 / 2"
306,305,IND IND,Varun SHARMA Jyoti NASHIER,6,0 - 0,,"3,190 / 2"
307,308,INA INA,Gideon Markus FERNALDI Rizki Amelia PRADIPTA,-80,0 - 0,,"3,170 / 3"
308,309,IND IND,Kashish SHARMA Ritu VINAYAK,5,0 - 0,,"3,150 / 2"
309,310,ARG ARG,Federico DIAZ Daiana GARMENDIA,5,0 - 0,,"3,140 / 4"
310,311,SLO SLO,Primoz FLIS Kaja STANKOVIC,5,0 - 0,,"3,120 / 5"
311,312,BUL NED,Alex VLAAR Cheryl SEINEN,5,0 - 0,,"3,120 / 4"
312,313,THA THA,Pichaya CHEENADIT Fareeda LOOG,5,0 - 0,,"3,120 / 2"
313,313,NEP NEP,Bikash SHRESTHA Nangsal TAMANG,5,0 - 0,,"3,120 / 2"
314,313,PUR PUR,Pedro ZAPATA Genesis VALENTIN,5,0 - 0,,"3,120 / 2"
315,316,SIN SIN,Kean Hean LOH Yi Ling Elaine CHUA,6,0 - 0,,"3,100 / 3"
316,317,RSA RSA,Willem VILJOEN Annari VILJOEN,6,0 - 0,,"3,050 / 2"
317,318,INA INA,Hendra Aprida GUNAWAN Nadya MELATI,6,0 - 0,,"3,040 / 2"
318,318,BRA BRA,Alex Yuwan TJONG Ana Paula CAMPOS,6,0 - 0,,"3,040 / 2"
319,318,IRL IRL,Sam MAGEE Rachael DARRAGH,6,0 - 0,,"3,040 / 2"
320,318,THA THA,Kittisak NAMDASH Chanisa TEACHAVORASINSKUN,6,0 - 0,,"3,040 / 2"
321,318,INA INA,Ardiansyah LastName Devi Tika PERMATASARI,-98,0 - 0,,"3,040 / 2"
322,323,THA THA,Viriyangkura TANUPAT Pacharapun CHOCHUWONG,-72,0 - 0,,"3,030 / 2"
323,324,NZL NZL,Joshua CURRY Tegan WESTON,5,0 - 0,,"3,030 / 1"
324,324,USA USA,Tony GUNAWAN Eti GUNAWAN,5,0 - 0,,"3,030 / 1"
325,324,KOR KOR,JUNG Jae Wook GO Ah Ra,5,0 - 0,,"3,030 / 1"
326,324,TPE TPE,Tzu Wei WANG Ling Fang HU,5,0 - 0,,"3,030 / 1"
327,324,JAM JAM,Gareth HENRY Katherine WYNTER,5,0 - 0,,"3,030 / 1"
328,329,INA INA,Andrei ADISTIA Dian FITRIANI,7,0 - 0,,"2,990 / 2"
329,330,GER GER,Daniel BENZ Lara KAEPPLEIN,7,0 - 0,,"2,980 / 4"
330,331,GUA GUA,Anibal MARROQUIN Beatriz RAMOS,7,0 - 0,,"2,975 / 2"
331,332,TPE TPE,Cheng Heng SU HUNG Shih Han,7,0 - 0,,"2,960 / 2"
332,332,KOR KOR,BAE Kwon Young KIM Ji Won,7,0 - 0,,"2,960 / 2"
333,332,INA INA,Yohanes Rendy SUGIARTO Ririn AMELIA,7,0 - 0,,"2,960 / 2"
334,332,INA INA,Trikusuma WARDHANA Meiliana JAUHARI,-78,0 - 0,,"2,960 / 2"
335,336,THA THA,Kantawat LEELAVECHABUTR Panjarat PRANSOPON,6,0 - 0,,"2,950 / 3"
336,337,FIN FIN,Petri HAUTALA Noora AHOLA,6,0 - 0,,"2,920 / 5"
337,338,PUR PUR,Joshua SOLER Saribel CACERES,6,0 - 0,,"2,840 / 3"
338,338,TPE TPE,Ming-Tse YANG Pin Chi CHAO,6,0 - 0,,"2,840 / 3"
339,340,JPN JPN,Ryota TAOHATA Ayane KURIHARA,6,0 - 0,,"2,800 / 1"
340,340,ENG DEN,Matthew NOTTINGHAM Maria HELSBOL,6,0 - 0,,"2,800 / 1"
341,340,CHN CHN,FAN Qiuyue JIA Yifan,6,0 - 0,,"2,800 / 1"
342,340,THA THA,Thanadol JUMPANOI Thidarat KLEEBYEESOON,6,0 - 0,,"2,800 / 1"
343,340,BAN BAN,Moajjam HOSSAIN Bristy KHATUN,6,0 - 0,,"2,800 / 1"
344,340,JPN JPN,Kohei GONDO Naoko FUKUMAN,6,0 - 0,,"2,800 / 1"
345,340,CRO USA,Zvonimir DURKINJAK Eva LEE,6,0 - 0,,"2,800 / 1"
346,340,AUS AUS,Matthew CHAU Jacqueline GUAN,6,0 - 0,,"2,800 / 1"
347,340,BAN BAN,Parash Md.AHSUN HABIB Aktar SHAPLA,6,0 - 0,,"2,800 / 1"
348,349,DEN DEN,Mads Emil CHRISTENSEN Cecilie SENTOW,8,0 - 0,,"2,790 / 2"
349,350,CRO CRO,Zvonimir DURKINJAK Stasa POZNANOVIC,8,0 - 0,,"2,777 / 1"
350,351,PUR PUR,Torres HERIBERTO Jaylene FORESTIER,8,0 - 0,,"2,740 / 2"
351,351,FRA FRA,Thomas VALLEZ Delphine DELRUE,8,0 - 0,,"2,740 / 2"
352,353,MAS MAS,Mohd Razif ABDUL LATIF Sannatasah SANIRU,8,0 - 0,,"2,720 / 3"
353,354,THA THA,Bodin ISSARA Savitree AMITRAPAI,8,0 - 0,,"2,720 / 1"
354,354,CHN CHN,HUANG Kaixiang ZHONG Qianxin,8,0 - 0,,"2,720 / 1"
355,354,MAS MAS,Kah Ming CHOOI Meng Yean LEE,8,0 - 0,,"2,720 / 1"
356,354,IND IND,K. Ajay Kumar Smriti NAGARKOTI,8,0 - 0,,"2,720 / 1"
357,354,IND IND,SINGH Vinay Kumar MUKHERJEE Riya,8,0 - 0,,"2,720 / 1"
358,354,JPN JPN,Kenta KAZUNO Shizuka MATSUO,8,0 - 0,,"2,720 / 1"
359,354,CHN CHN,ZHANG Wen ZHU Mai Ci,8,0 - 0,,"2,720 / 1"
360,354,KOR KOR,SolGyu CHOI YOO Hae Won,8,0 - 0,,"2,720 / 1"
361,354,INA INA,Rafiddias Akhdan NUGROHO Ulfa ZAKIA,8,0 - 0,,"2,720 / 1"
362,354,INA INA,Hardianto HARDIANTO Della Destiara HARIS,8,0 - 0,,"2,720 / 1"
363,354,CHN CHN,ZHANG Wen XIA Huan,8,0 - 0,,"2,720 / 1"
364,354,IND IND,Sanyam SHUKLA Sanyogita GHORPADE,8,0 - 0,,"2,720 / 1"
365,354,NZL IND,Abhinav MANOTA Rachita SAHDEV,8,0 - 0,,"2,720 / 1"
366,354,GER GER,Andreas HEINZ Annika HORBACH,8,0 - 0,,"2,720 / 1"
367,368,FRA FRA,Alexandre HAMMER Joanna CHAUBE,8,0 - 0,,"2,670 / 2"
368,368,INA INA,Reinard DHANRIANO Sinta Arum ANTASARI,-40,0 - 0,,"2,670 / 2"
369,370,THA THA,Sudket PRAPAKAMOL Sapsiree TAERATTANACHAI,7,0 - 0,,"2,660 / 1"
