,RANK,COUNTRY,PLAYER,CHANGE +/-,WIN - LOSE,PRIZE MONEY,POINTS / TOURNAMENTS
1011,801,UKR UKR,Vitaly KONOV Darya SAMARCHANTS,-9,0 - 0,,920 / 1
1012,801,FRA FRA,Ronan GUEGUIN Delphine DELRUE,-9,0 - 0,,920 / 1
1013,801,RUS RUS,Mikhail GHELASHVILI Anastasia REDKINA,-9,0 - 0,,920 / 1
1014,801,BLR BLR,Dzmitry SAIDAKOU Anastasiya CHERNIAVSKAYA,-9,0 - 0,,920 / 1
1015,801,SRB SRB,Jovica RUJEVIC Sandra RUJEVIC,-9,0 - 0,,920 / 1
1016,801,MGL MGL,Batdavaa MUNKHBAT Khulangoo BAATAR,-9,0 - 0,,920 / 1
1017,801,MAS MAS,Wee Gieen TAN Yen Wei PECK,-9,0 - 0,,920 / 1
1018,801,DEN DEN,Morten Skroeder BOEDSKOV Nanna VESTERGAARD,-9,0 - 0,,920 / 1
1019,801,USA USA,Sandro ROSSI REDDY Deepti,-9,0 - 0,,920 / 1
1020,801,BRA BRA,Rafael AURICHIO Claudia LOW,-9,0 - 0,,920 / 1
1021,801,BRA BRA,Rodolfo Augusto SALLES Thayse CRUZ,-9,0 - 0,,920 / 1
1022,801,FIN FIN,Mika KOSKENNEVA Noora VIRTA,-9,0 - 0,,920 / 1
1023,801,BAR BAR,Bradley PILGRIM Tamisha WILLIAMS,-9,0 - 0,,920 / 1
1024,801,INA INA,Ardiansyah LastName Devi Tika PERMATASARI,-9,0 - 0,,920 / 1
1025,801,ISL ISL,Daniel THOMSEN Margrét JOHANNSDOTTIR,-9,0 - 0,,920 / 1
1026,801,UKR UKR,MARTYNENKO Mykola Mariya RUD,-9,0 - 0,,920 / 1
1027,801,GUA GUA,Anibal MARROQUIN Nikte Alejandra SOTOMAYOR,-9,0 - 0,,920 / 1
1028,801,AUT AUT,Lukas WEISSENBÄCK Julia HERNDLHOFER,-9,0 - 0,,920 / 1
1029,801,ISL ISL,Einar OSKARSSON Johanna JOHANNSDOTTIR,-9,0 - 0,,920 / 1
1030,801,SUI SUI,Thomas HEINIGER Sanya HERZIG,-9,0 - 0,,920 / 1
1031,801,PER PER,Sebastian MACIAS Daniela ZAPATA,-9,0 - 0,,920 / 1
1032,1033,SWE SWE,Felix NANDIN Rebecca JOHNSSON,-9,0 - 0,,910 / 2
1033,1033,VIE VIE,VAN NHAN Do PHAM Thi Khanh,-9,0 - 0,,910 / 2
1034,1035,USA ENG,Ryan CHEW Jenny WALLWORK,-9,0 - 0,,900 / 2
1035,1035,GRE GRE,Axilleas TSARTSIDIS Aristea APOSTOLIDOU,-9,0 - 0,,900 / 2
1036,1035,VIE VIE,Ngoc Manh NGUYEN Thu Huyen LE,-9,0 - 0,,900 / 2
1037,1038,IND IND,Utkarsh ARORA Dhanya NAIR,-9,0 - 0,,880 / 1
1038,1038,IND IND,Prem Singh CHOUHAN Saruni SHARMA,-9,0 - 0,,880 / 1
1039,1040,THA THA,Panachai WORASAKTYANAN Rawimon IAMRATANAMAETHEEKUL,-9,0 - 0,,870 / 2
1040,1041,FIN FIN,Akseli DANSKANEN Anna PAAVOLA,-9,0 - 0,,760 / 2
1041,1041,INA INA,Ramadhani AKBAR GUSTI Serena KANI,-9,0 - 0,,760 / 2
1042,1041,FIN FIN,Mika KONGAS Riikka SINKKO,-9,0 - 0,,760 / 2
1043,1044,CRO CRO,Josip UGLESIC Katarina GALENIC,-9,0 - 0,,750 / 3
1044,1045,CZE CZE,Michal HUBACEK Monika SVETNICKOVA,-9,0 - 0,,730 / 3
1045,1046,MLT MLT,Owen GRECH SADOWSKI Fiorella Marie,-9,0 - 0,,720 / 2
1046,1046,FRA FRA,Jonathan CASSIER Olivia MEUNIER,-9,0 - 0,,720 / 2
1047,1046,VIE VIE,Duy Nam LE Ngoc Huyen NGUYEN,-9,0 - 0,,720 / 2
1048,1046,VIE VIE,Duc Phat LE Thi Phuong Ha NGUYEN,-9,0 - 0,,720 / 2
1049,1050,LTU LTU,Karolis EIMUTAITIS Gerda VOITECHOVSKAJA,-9,0 - 0,,700 / 2
1050,1050,NOR NOR,Jorgen ROSENLUND Anne KLYVE,-9,0 - 0,,700 / 2
1051,1050,FRA FRA,Ronan GUEGUIN Katia NORMAND,-9,0 - 0,,700 / 2
1052,1053,IND IND,VISHAL THAKRAN Seema PANCHAL,-9,0 - 0,,680 / 2
1053,1054,NZL NZL,Christopher STEEGHS Erena CALDER -HAWKINS,-9,0 - 0,,670 / 2
1054,1055,INA THA,Lukhi Apri NUGROHO Kornkamon SUKKLAD,0,0 - 0,,660 / 1
1055,1055,THA THA,Krit TANTIANANKUL Papatsorn EKSORAKUL,0,0 - 0,,660 / 1
1056,1055,IND IND,Kapil CHAUDHARY AKANSHI BALIYAN,-9,0 - 0,,660 / 1
1057,1055,IND IND,Brijesh YADAV Sraddha TIWARI,-9,0 - 0,,660 / 1
1058,1055,INA INA,Ryan Agung SAPUTRA Mahadewi Istirani NI KETUT,-9,0 - 0,,660 / 1
1059,1055,MAS MAS,Aik Quan TAN Yen Wei PECK,-9,0 - 0,,660 / 1
1060,1055,KOR KOR,Seung Min KIM Soo Ji CHOI,-9,0 - 0,,660 / 1
1061,1055,KOR KOR,Jung Ho KIM Bo Ram LEE,-9,0 - 0,,660 / 1
1062,1055,INA INA,Agripinna Prima Rahmanto PUTRA Apriani RAHAYU,-9,0 - 0,,660 / 1
1063,1055,KOR KOR,Jae Hwan KIM GO Ah Ra,-9,0 - 0,,660 / 1
1064,1055,AUS AUS,Cham CHEN Xin Yi Joyce SEE,-9,0 - 0,,660 / 1
1065,1055,INA SUI,Titon GUSTAMAN Janine Andrea STOCKER,-9,0 - 0,,660 / 1
1066,1055,THA THA,Pachaarapol NIPORNRAM Ruethaichanok LAISUAN,-9,0 - 0,,660 / 1
1067,1055,AUS AUS,Pit Seng LOW Alice WU,-9,0 - 0,,660 / 1
1068,1055,FIN EST,Anton KAISTI Karoliine HOIM,-9,0 - 0,,660 / 1
1069,1070,TPE TPE,Yuan Cheng WU Shih Jyun JHOU,-11,0 - 0,,650 / 2
1070,1070,TPE TPE,Ming-Tse YANG Tzu Chin PAN,-11,0 - 0,,650 / 2
1071,1072,THA THA,Tinn ISRIYANATE Jongkolphan KITITHARAKUL,-11,0 - 0,,640 / 2
1072,1073,JPN JPN,Hikaru KOMACHIYA Kaede KAMEDA,-11,0 - 0,,600 / 2
1073,1073,FRA FRA,Swann LENIK Marine NOBLECOURT,-11,0 - 0,,600 / 2
1074,1075,MRI MRI,JATOONAH Ashley Lorna BODHA,0,0 - 0,,600 / 1
1075,1075,MRI MRI,Gilles ALLET Aurelie Marie Elisa ALLET,0,0 - 0,,600 / 1
1076,1075,MRI MRI,Melvin APPIAH Kobita DOKHEE,0,0 - 0,,600 / 1
1077,1075,MRI MRI,Andrew SEERUTHUN Amjum RASSOOLKHAN,0,0 - 0,,600 / 1
1078,1075,MRI MRI,Naadir EDOO Shania LEUNG,0,0 - 0,,600 / 1
1079,1075,ISR ISR,Gadi MOSES Michal HANDROS,-11,0 - 0,,600 / 1
1080,1075,ISR ISR,Tom BAR DAVID Imri ASHKENAZY,-11,0 - 0,,600 / 1
1081,1075,ISR ISR,Leon PUGACH Pugach ALINA,-11,0 - 0,,600 / 1
1082,1075,ISR ISR,may BAR NETZER Klil HOCHBERG,-11,0 - 0,,600 / 1
1083,1075,ISR ISR,Yonathan LEVIT Yuval PUGACH,-11,0 - 0,,600 / 1
1084,1075,ISR ISR,Yaron HETZRONI Yuliya SHRAMKOVA,-11,0 - 0,,600 / 1
1085,1075,EGY EGY,Ahmed ALAA BAKR Salma ASHRAF MOHAMED,-11,0 - 0,,600 / 1
1086,1075,EGY EGY,Abdalla Abdelhakim HUSSEIN Rahma MOHAMED SAAD ELADAWY,-11,0 - 0,,600 / 1
1087,1075,EGY EGY,Omar EMAD Hana TAREK MOHAMED,-11,0 - 0,,600 / 1
1088,1075,EGY EGY,Monier Fayez BOTROS Noran Hassan EL BANNA,-11,0 - 0,,600 / 1
1089,1075,PAN PAN,Kyle Alexander Munoz SEIXAS Joys Noemi De Hoyos ANINO,-11,0 - 0,,600 / 1
1090,1075,TRI TRI,Jason RAMJASS Avril PLAZA MARCELLE,-11,0 - 0,,600 / 1
1091,1075,BAR BAR,Dakeil Jonathan THORPE Monyata RIVIERA,-11,0 - 0,,600 / 1
1092,1075,TRI TRI,Alistair ESPINOZA Leanna CASTANADA,-11,0 - 0,,600 / 1
1093,1075,BAR BAR,Andre PADMORE Sabrina SCOTT,-11,0 - 0,,600 / 1
1094,1075,FIN FIN,Petri HAUTALA Riikka SINKKO,-11,0 - 0,,600 / 1
1095,1075,NZL NZL,Frederik Brogger STAPLETON Pingkan POLAK,-11,0 - 0,,600 / 1
1096,1075,NZL NZL,Brock MATHESON Vicki COPELAND,-11,0 - 0,,600 / 1
1097,1075,NZL NZL,Niccolo TAGLE Deborah YIN,-11,0 - 0,,600 / 1
1098,1075,NZL NZL,Oscar GUO Christine ZHANG,-11,0 - 0,,600 / 1
1099,1075,ISR ISR,Aviv SADE Svetlana KAPELIAN,-11,0 - 0,,600 / 1
1100,1075,EST EST,Kristjan KALJURAND Laura TOMBAND,-11,0 - 0,,600 / 1
1101,1102,RUS RUS,Evgeniya KOSETSKAYA Ivan SOZONOV,-16,0 - 0,,586 / 1
1102,1103,AUT AUT,Dominik STIPSITS Nathalie ZIESIG,-16,0 - 0,,560 / 3
1103,1104,CHN CHN,WANG Sijie ZHU Mai Ci,-16,0 - 0,,560 / 2
1104,1105,ISL ISL,Atli TOMASSON Thorunn EYLANDS,-16,0 - 0,,550 / 1
1105,1105,ISL ISL,Daniel JOHANNESSON Erla Bjorg HAFSTEINSDOTTIR,-16,0 - 0,,550 / 1
1106,1105,ISL ISL,Andri ARNASON Margret Dis STEFANSDOTTIR,-16,0 - 0,,550 / 1
1107,1105,ISL ISL,Bjarki STEFANSSON Sigridur ARNADOTTIR,-16,0 - 0,,550 / 1
1108,1105,ISL ISL,Egill GUDLAUGSSON Sara HOGNADOTTIR,-16,0 - 0,,550 / 1
1109,1105,ISL ISL,Robert Thor HENN Harpa HILMISDOTTIR,-16,0 - 0,,550 / 1
1110,1105,DEN DEN,Christoffer Holm VOLDSGAARD Filippa ROHDE,-16,0 - 0,,550 / 1
1111,1105,ISL ISL,Atli JOHANNESSON Margret NILSDOTTIR,-16,0 - 0,,550 / 1
1112,1105,ISL ISL,David Bjarni BJORNSSON Drifa HARDARDOTTIR,-16,0 - 0,,550 / 1
1113,1105,ISL ISL,Robert Ingi HULDARSSON Ulfheidur Embla ASGEIRSDOTTIR,-16,0 - 0,,550 / 1
1114,1105,ISL ISL,Sigurdur Sverrir GUNNARSSON Arna Karen JOHANNSDOTTIR,-16,0 - 0,,550 / 1
1115,1105,FIN FIN,Jesper PAUL Elina NIIRANEN,-16,0 - 0,,550 / 1
1116,1105,FIN FIN,Jere ÖVERMARK Inalotta SUUTARINEN,-16,0 - 0,,550 / 1
1117,1105,DEN DEN,Steve OLESEN Irina Amalie ANDERSEN,-16,0 - 0,,550 / 1
1118,1105,ZAM ZAM,Omel NJOBVU Racheal MUNEMO,-16,0 - 0,,550 / 1
1119,1105,ZAM ZAM,Andrew MUMBA Annet NJOBVU,-16,0 - 0,,550 / 1
1120,1105,ZAM ZAM,Matipa YOMBWE Martha MUSOLE,-16,0 - 0,,550 / 1
1121,1105,ZAM ZAM,Edgar SIKANIKA Zipporath KAUNDA,-16,0 - 0,,550 / 1
1122,1105,ZAM ZAM,Cephus BANDA Matildah KALANDANYA,-16,0 - 0,,550 / 1
1123,1105,ZAM ZAM,Nevers PHIRI Agness SIMALA,-16,0 - 0,,550 / 1
1124,1105,ZAM ZAM,Joseph BWALYA Muka HAMOONGA,-16,0 - 0,,550 / 1
1125,1105,ZAM ZAM,Shadreck MWANSA Elizaberth MULAUZI,-16,0 - 0,,550 / 1
1126,1105,ZAM ZAM,Mateyo MWANSA Patience MUKOKO,-16,0 - 0,,550 / 1
1127,1105,ZAM ZAM,Humphrey MWABA Ngambi LWISA,-16,0 - 0,,550 / 1
1128,1105,THA HUN,TOVANNAKASEM Samatcha Agnes KOROSI,-16,0 - 0,,550 / 1
1129,1105,FIN FIN,Artturi HELENIUS Mari MIKKONEN,-16,0 - 0,,550 / 1
1130,1105,CRO DEN,Zvonimir DURKINJAK Josephine VAN ZAANE,-16,0 - 0,,550 / 1
1131,1105,SUR SUR,Juan DEL PRADO Mary - Ann ZHONG,-16,0 - 0,,550 / 1
1132,1105,SUR SUR,Jascha ATMODIKROMO Chan YANG,-16,0 - 0,,550 / 1
1133,1105,SUR SUR,Gerald MOHAMAD Priscilla WAARTS,-16,0 - 0,,550 / 1
1134,1105,TRI TRI,Alistair ESPINOZA Avril PLAZA MARCELLE,-16,0 - 0,,550 / 1
1135,1105,SUR SUR,Jair LIEW Cheryl NAI CHUNG TONG,-16,0 - 0,,550 / 1
1136,1105,SUR SUR,Alain TONEY Sherifa JAMESON,-16,0 - 0,,550 / 1
1137,1105,SWE NOR,Karel ERIKSSON Thea Kristina JOHANSEN,-16,0 - 0,,550 / 1
1138,1105,DEN SWE,Mikkel Kaersgaard HENRIKSEN Louise ERIKSSON,-16,0 - 0,,550 / 1
1139,1105,INA FIN,Asuro RIZKO Anna PAAVOLA,-16,0 - 0,,550 / 1
1140,1105,DEN DEN,Soeren TOFT HANSEN Gabriella BOJE,-16,0 - 0,,550 / 1
1141,1105,DEN DEN,Kasper DINESEN Marie Louise STEFFENSEN,-16,0 - 0,,550 / 1
1142,1105,DEN DEN,Mikkel STOFFERSEN Iben BERGSTEIN,-16,0 - 0,,550 / 1
1143,1105,MAR MAR,Omar KESIKES Oumaima ELHERZ,-16,0 - 0,,550 / 1
1144,1105,JOR JOR,Ayham ABD ELEDDIN Sham AL-KHALILI,-16,0 - 0,,550 / 1
1145,1105,MAR MAR,Ahmed Amine KSIKES Oumaina SAHDAN,-16,0 - 0,,550 / 1
1146,1105,MAR MAR,Mehdi ERRAIHANI Chakib SAFAE,-16,0 - 0,,550 / 1
1147,1105,VIE VIE,TO Gia Bao DONG Thi Thanh Hien,-16,0 - 0,,550 / 1
1148,1105,VIE VIE,Vinh Quang HO NGUYEN Thi Anh Duyen NGUYEN,-16,0 - 0,,550 / 1
1149,1105,VIE VIE,Minh Phuc VU Ngoc Bich PHAM,-16,0 - 0,,550 / 1
1150,1105,THA THA,Panu RAKMESI Thanaporn KIAWCHA-ON,-16,0 - 0,,550 / 1
1151,1105,VIE VIE,NGUYEN Phi Hung TRAN Huynh Nhu Tuyet,-16,0 - 0,,550 / 1
1152,1105,SIN SIN,Muhammad Elaf Wei TAN Chun Yi Deline QUEK,-16,0 - 0,,550 / 1
1153,1105,VIE VIE,Minh BAO Kim Chau DO,-16,0 - 0,,550 / 1
1154,1105,CZE CZE,Pavel DRANCAK Michaela FUCHSOVA,-16,0 - 0,,550 / 1
1155,1105,POL POL,Mateusz DANIELAK Karolina WLADZINSKA,-16,0 - 0,,550 / 1
1156,1105,NZL NZL,Christopher STEEGHS Celine SHAO,-16,0 - 0,,550 / 1
1157,1105,NZL NZL,Benjamin HILLIER Erena CALDER -HAWKINS,-16,0 - 0,,550 / 1
1158,1105,AUS AUS,Simon Wing Hang LEUNG Hsuan-Yu Wendy CHEN,-16,0 - 0,,550 / 1
1159,1105,NZL NZL,Sunil DAHIYA Samantha MCCAMISH,-16,0 - 0,,550 / 1
1160,1105,NZL NZL,Vincent HARRIS Erena CALDER -HAWKINS,-16,0 - 0,,550 / 1
1161,1105,AUS AUS,Ashwant GOBINATHAN Ruwindi SERASINGHE,-16,0 - 0,,550 / 1
1162,1105,MAS SIN,Mohd Razif ABDUL LATIF Aiying XING,-16,0 - 0,,550 / 1
1163,1105,TPE TPE,KUO Ching-Hung HUNG Yi-Ting,-16,0 - 0,,550 / 1
1164,1105,SIN SIN,Wen Xing Abel TAN Ming Hui LIM,-16,0 - 0,,550 / 1
1165,1105,TPE TPE,YANG Po-Hsuan YU Min Ju,-16,0 - 0,,550 / 1
1166,1105,PHI PHI,Carlos Antonie CAYANAN Jessie FRANCISCO,-16,0 - 0,,550 / 1
1167,1105,MAS MAS,Muhammad Hafifi HASHIM Peiy Zhean LIM,-16,0 - 0,,550 / 1
1168,1105,TUR TUR,Gokhan ZEMBILCI Inci GULER,-16,0 - 0,,550 / 1
1169,1105,RUS RUS,Victor KOKHANOV Anastasiia SHARAPOVA,-16,0 - 0,,550 / 1
1170,1105,GER GER,Jan Colin VÖLKER Stine Susan KÜSPERT,-16,0 - 0,,550 / 1
1171,1105,RUS RUS,Nikita LEMESHKO Anastasiia SEMENOVA,-16,0 - 0,,550 / 1
1172,1105,CYP GRE,Kyriacos PISSIS Ioanna KARAPETRIDOU,-16,0 - 0,,550 / 1
1173,1105,RUS RUS,VENEDIKTOV Ilya Yulia VASILYEVA,-16,0 - 0,,550 / 1
1174,1105,FRA FRA,Gregor DUNIKOWSKI Verlaine FAULMANN,-16,0 - 0,,550 / 1
1175,1105,KAZ KAZ,Ruslan ZINNUROV Alina KERIMOVA,-16,0 - 0,,550 / 1
1176,1105,UZB UZB,Sherzod ZOKHIDOV Dilrabo AHMEDOVA,-16,0 - 0,,550 / 1
1177,1105,KAZ KAZ,Evgeny EVSEEV Ademi SERIKBAYEVA,-16,0 - 0,,550 / 1
1178,1105,KAZ KAZ,ANDREI KLEMETS NATALYA TOLKACHYOVA,-16,0 - 0,,550 / 1
1179,1105,TJK TJK,Olimov AKHYO Malohat ISLOMQULOVA,-16,0 - 0,,550 / 1
1180,1105,KAZ KAZ,Tolagay DUISEBAYEV Veronika PROTASSOVA,-16,0 - 0,,550 / 1
1181,1105,KAZ KAZ,Dmitriy PANARIN Oxsana SHTELLE,-16,0 - 0,,550 / 1
1182,1105,KAZ KAZ,DMITRIY RUBLYOV LIUDMILA SAFRONOVA,-16,0 - 0,,550 / 1
1183,1105,KAZ KAZ,Ikramzhan YULDASHEV Yelizaveta KHARCHENKO,-16,0 - 0,,550 / 1
1184,1105,MRI MRI,Sadashayanand DUMREE Judith Virusha TEEROOVENGADUM,-16,0 - 0,,550 / 1
1185,1105,FRA FRA,LoïC BERTIL Virginie TESTAN,-16,0 - 0,,550 / 1
1186,1105,MDV MDV,Hussein SHAHEED Maisa Fathuhulla ISMAIL,-16,0 - 0,,550 / 1
1187,1105,FRA FRA,Nicolas CHANE SING Elodie RICHART,-16,0 - 0,,550 / 1
1188,1105,MRI MRI,Christopher PAUL Aurelie Marie Elisa ALLET,-16,0 - 0,,550 / 1
1189,1105,MRI MRI,RAMCHURN Sanjeev Smiti RAMCHURN,-16,0 - 0,,550 / 1
1190,1105,FRA FRA,Manual-Clement ASSING Lyndie MITHRA,-16,0 - 0,,550 / 1
1191,1105,MDV MDV,Sarim MOHAMED Moosa Aminath SHAHURUNAZ,-16,0 - 0,,550 / 1
1192,1105,FRA FRA,Stephane GOERTZ Lise ORONOZ,-16,0 - 0,,550 / 1
1193,1105,TRI TRI,Keeron Devane GARCIA Reba FLEARY,-16,0 - 0,,550 / 1
1194,1105,TRI TRI,Renaldo SINANAN Arielle GOMEZ,-16,0 - 0,,550 / 1
1195,1105,TRI TRI,Jewhel SMITH Leanna CASTANADA,-16,0 - 0,,550 / 1
1196,1105,TRI TRI,Alistair ESPINOZA Jada RENALES,-16,0 - 0,,550 / 1
1197,1105,TRI TRI,Anil SEEPAUL Kerian QUAN CHEE,-16,0 - 0,,550 / 1
1198,1105,THA THA,Korawi PIKUNNGAM Rujjanabordee SRIPAIBOON,-16,0 - 0,,550 / 1
1199,1105,MAC MAC,Kin Hei TAI Weng Chi NG,-16,0 - 0,,550 / 1
1200,1105,THA THA,Wasapon UTTAMANG Thanyasuda WONGYA,-16,0 - 0,,550 / 1
1201,1105,THA THA,Wipoo INKAEW Thanapim KAWEENUNTAVONG,-16,0 - 0,,550 / 1
1202,1105,THA THA,Puthaporn BVORNWATANUWONG Thunyathorn THAMNOPAKAO,-16,0 - 0,,550 / 1
1203,1105,THA THA,Viriyangkura TANUPAT Thanaporn KIAWCHA-ON,-16,0 - 0,,550 / 1
1204,1105,SLO SLO,Miha IVANCIC Petra POLANC,-16,0 - 0,,550 / 1
1205,1105,SLO SLO,Matic IVANCIC Kaja OKRSLAR,-16,0 - 0,,550 / 1
1206,1105,GRE GRE,Thomas ROUGLIOS Maria-Eleni ROUGLIOU,-16,0 - 0,,550 / 1
1207,1105,GRE GRE,Axilleas TSARTSIDIS Eirini GOYGLERI,-16,0 - 0,,550 / 1
1208,1105,GRE GRE,Marios Michail BOULIOS Pantelia BARTZOU,-16,0 - 0,,550 / 1
1209,1105,GRE GRE,Dimitris ORLIS Georgia ANASTASIOU,-16,0 - 0,,550 / 1
1210,1105,GRE GRE,Stamatis TSIGIRDAKIS Ioanna KONTOU FOUNTA,-16,0 - 0,,550 / 1
1211,1105,GRE GRE,Vasileios ORLIS Anna Maria FARSAKOGLOU,-16,0 - 0,,550 / 1
1212,1105,GRE GRE,Ilias XANTHOU Artemis ANASTASIOU,-16,0 - 0,,550 / 1
1213,1105,GRE GRE,Panagiotis BOTELIS Eleni MOUTEVELIDOU,-16,0 - 0,,550 / 1
1214,1105,GRE GRE,Dimitrios SKRONTAS Aristea APOSTOLIDOU,-16,0 - 0,,550 / 1
1215,1105,GRE GRE,Pantelis SITARENIOS Ioanna KARETSA,-16,0 - 0,,550 / 1
1216,1105,PER PER,Sebastian MACIAS Camila DUANY,-16,0 - 0,,550 / 1
1217,1105,CHI CHI,GOMPERTZ Matias Loreto PONTIGO,-16,0 - 0,,550 / 1
1218,1105,CHI CHI,CONTRERAS Gonzalo SKARIC Mickaela,-16,0 - 0,,550 / 1
1219,1105,ARG ARG,Pablo MACAGNO Daiana GARMENDIA,-16,0 - 0,,550 / 1
1220,1105,ARG ARG,Federico DIAZ Florencia BERNATENE,-16,0 - 0,,550 / 1
1221,1105,NED BUL,Imke VAN DER AAR Alex VLAAR,-16,0 - 0,,550 / 1
1222,1105,ENG ENG,Victoria WILLIAMS Peter BRIGGS,-16,0 - 0,,550 / 1
1223,1105,INA INA,Willian ASTAN Anisa Nur AZIZAH,-16,0 - 0,,550 / 1
1224,1105,INA INA,Calvin KRISTANTO Tania Oktaviani KUSUMAH,-16,0 - 0,,550 / 1
1225,1105,SIN SIN,Jin Lei CHUANG Ren-ne ONG,-16,0 - 0,,550 / 1
1226,1105,INA INA,Yodhi SATRIO Zarra Faza AZKA,-16,0 - 0,,550 / 1
1227,1105,TPE TPE,LIN Shih Kai Ying Chun LIN,-16,0 - 0,,550 / 1
1228,1105,SIN SIN,Zin Rei Ryan NG Chun Yi Deline QUEK,-16,0 - 0,,550 / 1
1229,1105,ROU ROU,PANFIL Eugeniu-Cosmin Andra OLARIU,-16,0 - 0,,550 / 1
1230,1105,UZB UZB,Artyom SAVATYUGIN Valeriya MUSHTAKOVA,-16,0 - 0,,550 / 1
1231,1105,ROU ROU,GROSU Mihai Maria Alexandra DUTU,-16,0 - 0,,550 / 1
1232,1105,ESP ESP,Juan Manuel FERNANDEZ QUILES Laura SAMANIEGO,-16,0 - 0,,550 / 1
1233,1105,AUT AUT,Dominik STIPSITS Sonja LANGTHALER,-16,0 - 0,,550 / 1
1234,1105,ZAM ZAM,Chongo Ezra MULENGA Ogar SIAMUPANGILA,-16,0 - 0,,550 / 1
1235,1105,UGA UGA,Brian KASIRYE Scovia NABASIRYE,-16,0 - 0,,550 / 1
1236,1105,UGA UGA,Ivan MAYEGA Annet NAKAMYA,-16,0 - 0,,550 / 1
1237,1105,UGA UGA,Ian SENOGA Najjuka GLORIA,-16,0 - 0,,550 / 1
1238,1105,IND UGA,Dinesh CHAUDHRY Aisha NAKIYEMBA,-16,0 - 0,,550 / 1
1239,1105,UGA UGA,Daniel MIHIGO Jovia KOMUHEMDO,-16,0 - 0,,550 / 1
1240,1105,CHI CHI,Nicolas FERRUZOLA Niria BAEZA,-16,0 - 0,,550 / 1
1241,1105,PER PER,Jose GUEVARA Daniela ZAPATA,-16,0 - 0,,550 / 1
1242,1105,ZAM ZAM,Kalombo MULENGA Penelope MUDENDA,-16,0 - 0,,550 / 1
1243,1105,SCO SCO,Adam HALL Julie MACPHERSON,-16,0 - 0,,550 / 1
1244,1105,PUR PUR,Joshua SOLER Saribel CACERES,-16,0 - 0,,550 / 1
1245,1105,SCO SCO,Patrick MACHUGH Rebekka FINDLAY,-16,0 - 0,,550 / 1
1246,1105,DEN DEN,Steve OLESEN Anna KLINKE,-16,0 - 0,,550 / 1
1247,1105,BUL BUL,Illian KRASTEV Dimitria POPSTOIKOVA,-16,0 - 0,,550 / 1
1248,1105,PYF PYF,Kyliam SCILLOUX Coralie BOUTTIN,-16,0 - 0,,550 / 1
1249,1105,MRI MRI,Andrew SEERUTHUN Shania LEUNG,-16,0 - 0,,550 / 1
1250,1105,GRE GRE,Antonios TOPOLIGKAS Ioanna KARAPETRIDOU,-16,0 - 0,,550 / 1
1251,1105,MAS MAS,Zi Heng OOI Shi Han OOI,-16,0 - 0,,550 / 1
1252,1105,INA INA,Alfandy Rizki KASTURO Phita Haningtyas MENTARI,-16,0 - 0,,550 / 1
1253,1105,INA INA,Rian SYAOQI Jovita Evaria CANDRA,-16,0 - 0,,550 / 1
1254,1105,PER PER,Kenshin SHIMABUKURO Camila DUANY,-16,0 - 0,,550 / 1
1255,1105,UGA UGA,Alex BABU Brenda MUGABI,-16,0 - 0,,550 / 1
1256,1105,AUS AUS,Mitchell WHELLER Melinda SUN,-16,0 - 0,,550 / 1
1257,1105,DEN DEN,Nicklas MATHIASEN Cecilie BJERGEN,-16,0 - 0,,550 / 1
1258,1105,TUR TUR,Berk AVCI Sevval Buse ALSOY,-16,0 - 0,,550 / 1
1259,1105,ESP ESP,Alberto ZAPICO Haidee OJEDA,-16,0 - 0,,550 / 1
1260,1105,SCO SCO,Adam HALL Rebekka FINDLAY,-16,0 - 0,,550 / 1
1261,1105,ZAM ZAM,MABO DONALD Delphine NAKANYIKA,-16,0 - 0,,550 / 1
1262,1105,KEN KEN,Alfred MUTHOMI Sheila MUTHONI,-16,0 - 0,,550 / 1
1263,1105,MAS MAS,Guo Zheng SIM Pui Yee ENG,-16,0 - 0,,550 / 1
1264,1105,KAZ KAZ,Khaitmurat KULMATOV Ilyana FILIPCHUK,-16,0 - 0,,550 / 1
1265,1105,VIE VIE,Van Tri TRAN Thi Linh Giang TRAN,-16,0 - 0,,550 / 1
1266,1105,AUS AUS,Jacinta JOE Anthony JOE,-16,0 - 0,,550 / 1
1267,1105,DEN DEN,Amanda MADSEN Theodor JOHANSEN,-16,0 - 0,,550 / 1
1268,1105,TRI TRI,Nicholas BONKOWSKY Kamasha ROBERTSON,-16,0 - 0,,550 / 1
1269,1105,MAR MAR,Hicham ERRAJI Ghita CHAROUITE,-16,0 - 0,,550 / 1
1270,1105,SUR SUR,Irfan DJABAR Quennie PAWIROSEMITO,-16,0 - 0,,550 / 1
1271,1272,DEN DEN,Mads Pieler KOLDING Sara THYGESEN,-15,0 - 0,,522 / 1
1272,1273,INA INA,Muhammad RIJAL Shendy Puspa IRAWATI,-15,0 - 0,,520 / 1
1273,1273,JPN JPN,Keigo SONODA Reika KAKIIWA,-15,0 - 0,,520 / 1
1274,1275,SCO SCO,Robbie PATTERSON Ciara TORRANCE,-15,0 - 0,,510 / 1
1275,1275,CAN CAN,Logan CAMPBELL Kyleigh O’DONOGHUE,-15,0 - 0,,510 / 1
1276,1275,HKG HKG,YEUNG Shing Choi CHAN Hung Yung,-15,0 - 0,,510 / 1
1277,1278,BLR BLR,Vladzislav KUSHNIR Krestina SILICH,-15,0 - 0,,450 / 2
1278,1279,JPN JPN,Koshun MIURA Natsumi URATANI,-15,0 - 0,,430 / 1
1279,1279,JPN JPN,Shuto MORIOKA Chiharu SHIDA,-15,0 - 0,,430 / 1
1280,1279,AUS INA,Hoe Keat OON Sylvina KURNIAWAN,-15,0 - 0,,430 / 1
1281,1279,INA INA,Christopher RUSDIANTO Dian FITRIANI,-15,0 - 0,,430 / 1
1282,1279,IND IND,Dinesh CHAUDHRY Komal ANTIL,-15,0 - 0,,430 / 1
1283,1279,IND IND,Rajat JOON Jagriti NASHIER,-15,0 - 0,,430 / 1
1284,1279,IND IND,Harinder MALIK Teenu DAHIYA,-15,0 - 0,,430 / 1
1285,1279,IND IND,Gaurav KALIA Ekta KALIA,-15,0 - 0,,430 / 1
1286,1279,IND IND,Kashish SHARMA Ritu VINAYAK,-15,0 - 0,,430 / 1
1287,1279,IND IND,Gaurav MALHAN Meenu SINGH,-15,0 - 0,,430 / 1
1288,1279,AUS ENG,Talia SAUNDERS Stuart ROWLANDS,-15,0 - 0,,430 / 1
1289,1279,INA INA,Trikusuma WARDHANA Nadya MELATI,-15,0 - 0,,430 / 1
1290,1291,RUS RUS,Vladimir IVANOV Evgeniya KOSETSKAYA,-15,0 - 0,,398 / 1
1291,1292,IND IND,SINGH Vinay Kumar Karishma WADKAR,-15,0 - 0,,360 / 1
1292,1292,IND IND,Talar LAA ANKITA GUPTA,-15,0 - 0,,360 / 1
1293,1292,IND IND,Saurabh SHARMA Kuhoo GARG,-15,0 - 0,,360 / 1
1294,1292,ITA ITA,Lukas OSELE Silvia GARINO,-15,0 - 0,,360 / 1
1295,1292,ENG ENG,Jonathan MCDONALD Imogen LANGFORD,-15,0 - 0,,360 / 1
1296,1292,MAS MAS,"Amir Syazwan Al Razi MOHD SHAHRIMAN BAKHTIR Peiy Yee, Payee LIM",-15,0 - 0,,360 / 1
1297,1292,SIN SIN,Ming Shun TAN Hui Zhen Grace CHUA,-15,0 - 0,,360 / 1
1298,1292,MAS MAS,Muhammad Fariqzuan FAUZIN Peiy Zhean LIM,-15,0 - 0,,360 / 1
1299,1292,CHN CHN,TAN Zhendong ZHOU Meng,-15,0 - 0,,360 / 1
1300,1292,DEN DEN,Steve OLESEN Cecilie FINNE-IPSEN,-15,0 - 0,,360 / 1
1301,1292,BEL BEL,Elias BRACKE Lise JAQUES,-15,0 - 0,,360 / 1
1302,1292,INA INA,Kevin EZRA Engelica WIRATAMA,-15,0 - 0,,360 / 1
1303,1292,INA INA,Muhammad Taufiqul HAFIZH Vanadia PRANASA,-15,0 - 0,,360 / 1
1304,1292,INA INA,Indra Leonard PRASETYA Violita DEWI,-15,0 - 0,,360 / 1
1305,1292,INA INA,Aditya Muchlis WICAKSONO Annisa MUBAROKAH,-15,0 - 0,,360 / 1
1306,1292,PER PER,Alfonso GARCIA-ROSELL Flavia STIGLICH GUZMAN,-15,0 - 0,,360 / 1
1307,1292,PER PER,Matias ZAMORANO RAMOS Stefany Ying Chie CHEN CHEN,-15,0 - 0,,360 / 1
1308,1292,PER PER,Diego SUBAUSTE TOKUMURA Valeria Carolina WONG LAM,-15,0 - 0,,360 / 1
1309,1292,JPN JPN,Shuto MORIOKA Yukiko TAKAHATA,-15,0 - 0,,360 / 1
1310,1292,FRA FRA,Gaetan BRETHES Marie HERMELINE,-15,0 - 0,,360 / 1
1311,1292,FRA RUS,Maxime MICHEL Natalia PERMINOVA,-15,0 - 0,,360 / 1
1312,1292,VIE VIE,Quang Duy NGUYEN DUC HANH Vu,-15,0 - 0,,360 / 1
1313,1292,ITA ITA,Fabio CAPONIO Giulia FIORITO,-15,0 - 0,,360 / 1
1314,1292,TPE TPE,Hsiao-Lin WU Tsun Yu LIN,-15,0 - 0,,360 / 1
1315,1292,FRA FRA,Toma Junior POPOV Yaelle HOYAUX,-15,0 - 0,,360 / 1
1316,1292,CHI CHI,Ivan LEON Tingting CHOU,-15,0 - 0,,360 / 1
1317,1292,INA INA,Achmad Fasich Firman SABDA Tays Rona LEGIAYEM,-15,0 - 0,,360 / 1
1318,1292,ESP ESP,Jesus LORENZO Maria MARQUEZ DIAZ,-15,0 - 0,,360 / 1
1319,1320,ENG ENG,Matthew CLARE Evie BURBIDGE,-15,0 - 0,,350 / 1
1320,1320,SLO SLO,Miha IVANIC Nika ARIH,-15,0 - 0,,350 / 1
1321,1320,AUT AUT,Roman ZIRNWALD Janine LAIS,-15,0 - 0,,350 / 1
1322,1320,ENG ENG,Jonty RUSS Elizabeth MCMORROW,-15,0 - 0,,350 / 1
1323,1320,SUI SUI,Joel KOENIG Ronja STERN,-15,0 - 0,,350 / 1
1324,1320,LTU LTU,Rokas MINDERIS Elzbieta BAJORINAITE,-15,0 - 0,,350 / 1
1325,1320,EST EST,Heiko ZOOBER Kertu MARGUS,-15,0 - 0,,350 / 1
1326,1320,EST EST,Raul KÄSNER Kristin KUUBA,-15,0 - 0,,350 / 1
1327,1320,POR CZE,Bernardo ATILANO Denisa SIKALOVA,-15,0 - 0,,350 / 1
1328,1320,LAT LAT,Teodors KERIMOVS Jekaterina ROMANOVA,-15,0 - 0,,350 / 1
1329,1320,NZL NZL,Douglas SHEPHARD Neisha BOUMA,-15,0 - 0,,350 / 1
1330,1320,NZL NZL,Eric LI Rebecca YE,-15,0 - 0,,350 / 1
1331,1320,NZL NZL,Jack BOYLE Jahvaya WHEKI,-15,0 - 0,,350 / 1
1332,1320,NZL NZL,Dylan HENTON Aviva PAK,-15,0 - 0,,350 / 1
1333,1320,NZL DEN,Jasmanjot VIRK Josefine Redkjær JENSEN,-15,0 - 0,,350 / 1
1334,1320,NZL NZL,Vincent HARRIS Felicity LEYDON-DAVIS,-15,0 - 0,,350 / 1
1335,1320,NZL NZL,Chee Foong LIM Maysell DOWNEY,-15,0 - 0,,350 / 1
1336,1320,LTU LTU,Karolis EIMUTAITIS Gabija NARVILAITE,-15,0 - 0,,350 / 1
1337,1320,NZL NZL,Joshua CURRY Caragh ALLEY,-15,0 - 0,,350 / 1
1338,1320,POL POL,Piotr WASILUK JANOWSKA KAROLINA,-15,0 - 0,,350 / 1
1339,1320,EST EST,Mihkel LAANES Kristin KUUBA,-15,0 - 0,,350 / 1
1340,1320,EST EST,Mikk JÄRVEOJA Helina RÜÜTEL,-15,0 - 0,,350 / 1
1341,1342,ESP ESP,Ernesto VELAZQUEZ Beatriz CORRALES,-15,0 - 0,,349 / 1
1342,1343,MAS MAS,Yan Sheng LEE Erica Pei Shan KHOO,-15,0 - 0,,340 / 2
1343,1344,THA THA,Parinyawat THONGNUAM Sunitha PATIMON,0,0 - 0,,320 / 1
1344,1344,HKG HKG,LAW Cheuk Him YEUNG Nga Ting,0,0 - 0,,320 / 1
1345,1344,THA THA,Korawi PIKUNNGAM Chasinee KOREPAP,0,0 - 0,,320 / 1
1346,1344,THA THA,Panachai WORASAKTYANAN Alisa SAPNITI,0,0 - 0,,320 / 1
1347,1344,IND IND,Kashish SHARMA Daksha GAUTAM,-15,0 - 0,,320 / 1
1348,1344,IND IND,Rushikesh MALI Rucha NIKAM,-15,0 - 0,,320 / 1
1349,1344,IND IND,Shlok RAMCHANDRAN Kuhoo GARG,-15,0 - 0,,320 / 1
1350,1344,IND IND,B. Sumeeth Reddy S. Poorvisha Ram,-15,0 - 0,,320 / 1
1351,1344,INA INA,Christopher RUSDIANTO Aprilsasi Putri LEJARSAR VARIELLA,-15,0 - 0,,320 / 1
1352,1344,MAS MAS,Mohamad Syazmil Idham ZAINAL ABIDIN Peiy Zhean LIM,-15,0 - 0,,320 / 1
1353,1344,THA THA,Tanawat TOPATTANAKUL Rujjanabordee SRIPAIBOON,-15,0 - 0,,320 / 1
1354,1344,THA THA,Korawi PIKUNNGAM Thanapim KAWEENUNTAVONG,-15,0 - 0,,320 / 1
1355,1344,THA THA,Supakit JANDARA Thunyathorn THAMNOPAKAO,-15,0 - 0,,320 / 1
1356,1344,BRA BRA,Hugo ARTHUSO Paula B PEREIRA,-15,0 - 0,,320 / 1
1357,1344,NZL NZL,Shyam PURUSHOTHMAN Alyse DERBY,-15,0 - 0,,320 / 1
1358,1344,NZL NZL,Jian WANG Soomi Lina LEE,-15,0 - 0,,320 / 1
1359,1344,IND IND,SINGH Vinay Kumar MUKHERJEE Riya,-15,0 - 0,,320 / 1
1360,1344,INA INA,Hendra Aprida GUNAWAN Nadya MELATI,-15,0 - 0,,320 / 1
1361,1344,IND IND,Utkarsh ARORA Mohita SAHDEV,-15,0 - 0,,320 / 1
1362,1344,NZL NZL,Thomas ELLIS Hayley THOMPSON,-15,0 - 0,,320 / 1
1363,1344,TPE TPE,LIAO Kuan HAO CHENG Chi Ya,-15,0 - 0,,320 / 1
1364,1365,CHN CHN,LIU Cheng ZHAO Yunlei,-19,0 - 0,,285 / 1
1365,1366,CZE CZE,Jan SOMERLIK Dominika BUDZELOVA,-19,0 - 0,,270 / 2
1366,1367,MAC MAC,U Ieong IEK Xue Xin GONG,-19,0 - 0,,240 / 1
1367,1367,CAN CAN,Andy KO Valerie Pauline CHEUNG,-19,0 - 0,,240 / 1
1368,1367,CAN CAN,Darren HONG Erin O'DONOGHUE,-19,0 - 0,,240 / 1
1369,1367,HKG HKG,CHANG Tak Ching TSANG Wing Chiu Avery,-19,0 - 0,,240 / 1
1370,1367,CAN CAN,Nathan OSBORNE Josephine WU,-19,0 - 0,,240 / 1
1371,1372,NOR NOR,Magnus CHRISTENSEN Marie CHRISTENSEN,-19,0 - 0,,210 / 1
1372,1372,UKR UKR,Artem TKACHUK POTAPENKO Tetyana,-19,0 - 0,,210 / 1
1373,1372,DEN DEN,Soren GRAVHOLT Sara LUNDGAARD,-19,0 - 0,,210 / 1
1374,1372,SVK SVK,Bohumil KASELA Lenka DROTAROVA,-19,0 - 0,,210 / 1
1375,1372,TPE TPE,HUNG Jin-Yi TAI Wei-Ling,-19,0 - 0,,210 / 1
1376,1372,IND IND,Anup SRIDHAR Arathi Sara SUNIL,-19,0 - 0,,210 / 1
1377,1372,INA INA,Kaizar Bobby ALEXANDER Fransisca Angelica RAHARDJA,-19,0 - 0,,210 / 1
1378,1372,SUI SUI,Clément WERKMEISTER Diane RUSSI,-19,0 - 0,,210 / 1
1379,1372,FIN EST,Akseli DANSKANEN Melissa MAZURTSAK,-19,0 - 0,,210 / 1
1380,1372,NED NED,Remco KUILMAN Esther KUILMAN,-19,0 - 0,,210 / 1
1381,1372,ENG ENG,Robert GOLDING Tanapat PISITPONG,-19,0 - 0,,210 / 1
