,RANK,COUNTRY,PLAYER,CHANGE +/-,WIN - LOSE,PRIZE MONEY,POINTS / TOURNAMENTS
1114,1094,TUR TUR,Semih OZKAN Dilek OZKAN,0,0 - 0,,550 / 1
1115,1094,TUR TUR,Gokhan ZEMBILCI Inci GULER,0,0 - 0,,550 / 1
1116,1094,MLT MLT,Owen GRECH SADOWSKI Fiorella Marie,0,0 - 0,,550 / 1
1117,1094,RUS RUS,Victor KOKHANOV Anastasiia SHARAPOVA,0,0 - 0,,550 / 1
1118,1094,GER GER,Jan Colin VÖLKER Stine Susan KÜSPERT,0,0 - 0,,550 / 1
1119,1094,RUS RUS,Nikita LEMESHKO Anastasiia SEMENOVA,0,0 - 0,,550 / 1
1120,1094,CYP GRE,Kyriacos PISSIS Ioanna KARAPETRIDOU,0,0 - 0,,550 / 1
1121,1094,RUS RUS,VENEDIKTOV Ilya Yulia VASILYEVA,0,0 - 0,,550 / 1
1122,1094,FRA FRA,Gregor DUNIKOWSKI Verlaine FAULMANN,0,0 - 0,,550 / 1
1123,1094,KAZ KAZ,Ruslan ZINNUROV Alina KERIMOVA,0,0 - 0,,550 / 1
1124,1094,UZB UZB,Sherzod ZOKHIDOV Dilrabo AHMEDOVA,0,0 - 0,,550 / 1
1125,1094,KAZ KAZ,Evgeny EVSEEV Ademi SERIKBAYEVA,0,0 - 0,,550 / 1
1126,1094,KAZ KAZ,ANDREI KLEMETS NATALYA TOLKACHYOVA,0,0 - 0,,550 / 1
1127,1094,TJK TJK,Olimov AKHYO Malohat ISLOMQULOVA,0,0 - 0,,550 / 1
1128,1094,KAZ KAZ,Tolagay DUISEBAYEV Veronika PROTASSOVA,0,0 - 0,,550 / 1
1129,1094,KAZ KAZ,Dmitriy PANARIN Oxsana SHTELLE,0,0 - 0,,550 / 1
1130,1094,KAZ KAZ,DMITRIY RUBLYOV LIUDMILA SAFRONOVA,0,0 - 0,,550 / 1
1131,1094,KAZ KAZ,Ikramzhan YULDASHEV Yelizaveta KHARCHENKO,0,0 - 0,,550 / 1
1132,1094,MRI MRI,Sadashayanand DUMREE Judith Virusha TEEROOVENGADUM,0,0 - 0,,550 / 1
1133,1094,FRA FRA,LoïC BERTIL Virginie TESTAN,0,0 - 0,,550 / 1
1134,1094,MRI MRI,Khabir TEELUCK Ganesha MUNGRAH,0,0 - 0,,550 / 1
1135,1094,MDV MDV,Hussein SHAHEED Maisa Fathuhulla ISMAIL,0,0 - 0,,550 / 1
1136,1094,FRA FRA,Nicolas CHANE SING Elodie RICHART,0,0 - 0,,550 / 1
1137,1094,MRI MRI,Christopher PAUL Aurelie Marie Elisa ALLET,0,0 - 0,,550 / 1
1138,1094,MRI MRI,RAMCHURN Sanjeev Smiti RAMCHURN,0,0 - 0,,550 / 1
1139,1094,FRA FRA,Manual-Clement ASSING Lyndie MITHRA,0,0 - 0,,550 / 1
1140,1094,MDV MDV,Sarim MOHAMED Moosa Aminath SHAHURUNAZ,0,0 - 0,,550 / 1
1141,1094,FRA FRA,Stephane GOERTZ Lise ORONOZ,0,0 - 0,,550 / 1
1142,1094,TRI TRI,Keeron Devane GARCIA Reba FLEARY,0,0 - 0,,550 / 1
1143,1094,TRI TRI,Renaldo SINANAN Arielle GOMEZ,0,0 - 0,,550 / 1
1144,1094,TRI TRI,Jewhel SMITH Leanna CASTANADA,0,0 - 0,,550 / 1
1145,1094,TRI TRI,Alistair ESPINOZA Jada RENALES,0,0 - 0,,550 / 1
1146,1094,TRI TRI,Anil SEEPAUL Kerian QUAN CHEE,0,0 - 0,,550 / 1
1147,1094,THA THA,Korawi PIKUNNGAM Rujjanabordee SRIPAIBOON,0,0 - 0,,550 / 1
1148,1094,MAC MAC,Kin Hei TAI Weng Chi NG,0,0 - 0,,550 / 1
1149,1094,THA THA,Wasapon UTTAMANG Thanyasuda WONGYA,0,0 - 0,,550 / 1
1150,1094,THA THA,Wipoo INKAEW Thanapim KAWEENUNTAVONG,0,0 - 0,,550 / 1
1151,1094,THA THA,Puthaporn BVORNWATANUWONG Thunyathorn THAMNOPAKAO,0,0 - 0,,550 / 1
1152,1094,THA THA,Viriyangkura TANUPAT Thanaporn KIAWCHA-ON,0,0 - 0,,550 / 1
1153,1094,SLO SLO,Miha IVANCIC Petra POLANC,0,0 - 0,,550 / 1
1154,1094,SLO SLO,Matic IVANCIC Kaja OKRSLAR,0,0 - 0,,550 / 1
1155,1094,GRE GRE,Thomas ROUGLIOS Maria-Eleni ROUGLIOU,0,0 - 0,,550 / 1
1156,1094,GRE GRE,Axilleas TSARTSIDIS Eirini GOYGLERI,0,0 - 0,,550 / 1
1157,1094,GRE GRE,Marios Michail BOULIOS Pantelia BARTZOU,0,0 - 0,,550 / 1
1158,1094,GRE GRE,Dimitris ORLIS Georgia ANASTASIOU,0,0 - 0,,550 / 1
1159,1094,GRE GRE,Stamatis TSIGIRDAKIS Ioanna KONTOU FOUNTA,0,0 - 0,,550 / 1
1160,1094,GRE GRE,Vasileios ORLIS Anna Maria FARSAKOGLOU,0,0 - 0,,550 / 1
1161,1094,GRE GRE,Ilias XANTHOU Artemis ANASTASIOU,0,0 - 0,,550 / 1
1162,1094,GRE GRE,Panagiotis BOTELIS Eleni MOUTEVELIDOU,0,0 - 0,,550 / 1
1163,1094,GRE GRE,Dimitrios SKRONTAS Aristea APOSTOLIDOU,0,0 - 0,,550 / 1
1164,1094,GRE GRE,Pantelis SITARENIOS Ioanna KARETSA,0,0 - 0,,550 / 1
1165,1094,PER PER,Sebastian MACIAS Camila DUANY,0,0 - 0,,550 / 1
1166,1094,CHI CHI,GOMPERTZ Matias Loreto PONTIGO,0,0 - 0,,550 / 1
1167,1094,CHI CHI,CONTRERAS Gonzalo SKARIC Mickaela,0,0 - 0,,550 / 1
1168,1094,ARG ARG,Pablo MACAGNO Daiana GARMENDIA,0,0 - 0,,550 / 1
1169,1094,ARG ARG,Federico DIAZ Florencia BERNATENE,0,0 - 0,,550 / 1
1170,1094,NED BUL,Imke VAN DER AAR Alex VLAAR,0,0 - 0,,550 / 1
1171,1094,ENG ENG,Victoria WILLIAMS Peter BRIGGS,0,0 - 0,,550 / 1
1172,1094,INA INA,Willian ASTAN Anisa Nur AZIZAH,0,0 - 0,,550 / 1
1173,1094,INA INA,Calvin KRISTANTO Tania Oktaviani KUSUMAH,0,0 - 0,,550 / 1
1174,1094,SIN SIN,Jin Lei CHUANG Ren-ne ONG,0,0 - 0,,550 / 1
1175,1094,INA INA,Yodhi SATRIO Zarra Faza AZKA,0,0 - 0,,550 / 1
1176,1094,TPE TPE,LIN Shih Kai Ying Chun LIN,0,0 - 0,,550 / 1
1177,1094,SIN SIN,Zin Rei Ryan NG Chun Yi Deline QUEK,0,0 - 0,,550 / 1
1178,1094,ROU ROU,PANFIL Eugeniu-Cosmin Andra OLARIU,0,0 - 0,,550 / 1
1179,1094,UZB UZB,Artyom SAVATYUGIN Valeriya MUSHTAKOVA,0,0 - 0,,550 / 1
1180,1094,ROU ROU,GROSU Mihai Maria Alexandra DUTU,0,0 - 0,,550 / 1
1181,1094,ESP ESP,Juan Manuel FERNANDEZ QUILES Laura SAMANIEGO,0,0 - 0,,550 / 1
1182,1094,AUT AUT,Dominik STIPSITS Sonja LANGTHALER,0,0 - 0,,550 / 1
1183,1094,ZAM ZAM,Chongo Ezra MULENGA Ogar SIAMUPANGILA,0,0 - 0,,550 / 1
1184,1094,UGA UGA,Brian KASIRYE Scovia NABASIRYE,0,0 - 0,,550 / 1
1185,1094,UGA UGA,Ivan MAYEGA Annet NAKAMYA,0,0 - 0,,550 / 1
1186,1094,UGA UGA,Ian SENOGA Najjuka GLORIA,0,0 - 0,,550 / 1
1187,1094,IND UGA,Dinesh CHAUDHRY Aisha NAKIYEMBA,0,0 - 0,,550 / 1
1188,1094,UGA UGA,Daniel MIHIGO Jovia KOMUHEMDO,0,0 - 0,,550 / 1
1189,1094,CHI CHI,Nicolas FERRUZOLA Niria BAEZA,0,0 - 0,,550 / 1
1190,1094,PER PER,Jose GUEVARA Daniela ZAPATA,0,0 - 0,,550 / 1
1191,1094,ISL ISL,Bjarki STEFANSSON Sunna Osp RUNOLFSDOTTIR,0,0 - 0,,550 / 1
1192,1094,ISL ISL,David Bjarni BJORNSSON Harpa HILMISDOTTIR,0,0 - 0,,550 / 1
1193,1094,ISL ISL,Xuan Nguyen David PHUONG Arna Karen JOHANNSDOTTIR,0,0 - 0,,550 / 1
1194,1094,ISL ISL,Birkir Steinn ERLINGSSON Sara HOGNADOTTIR,0,0 - 0,,550 / 1
1195,1094,ISL ISL,Vignir HARALDSSON Jona Kristin HJARTARDOTTIR,0,0 - 0,,550 / 1
1196,1094,LTU LTU,Laurynas SPARNAUSKIS Rebeka ALEKSEVICIUTE,0,0 - 0,,550 / 1
1197,1094,FRA FRA,Vincent MEDINA Yaelle HOYAUX,0,0 - 0,,550 / 1
1198,1094,FRA FRA,Jimmy NOBLECOURT Emilie BEAUJEAN,0,0 - 0,,550 / 1
1199,1094,BOT BOT,Omphile MARUMOAGAE Reitumetse MODISENYANE,0,0 - 0,,550 / 1
1200,1094,BOT BOT,Kagiso RANTSHADI Leungo Bronia TSHWENEETSILE,0,0 - 0,,550 / 1
1201,1094,BOT BOT,OLEFILE Katlego Bonolo AMOS,0,0 - 0,,550 / 1
1202,1094,RSA RSA,Johan CROUKAMP Lynn FRY,0,0 - 0,,550 / 1
1203,1094,RSA RSA,James Hilton MCMANUS Jade MORGAN,0,0 - 0,,550 / 1
1204,1094,RSA RSA,Ruan SNYMAN Johanita SCHOLTZ,0,0 - 0,,550 / 1
1205,1094,RSA RSA,Damien TOP Nadene DICKS,0,0 - 0,,550 / 1
1206,1094,RSA RSA,Jason MANN Candice MANN,0,0 - 0,,550 / 1
1207,1094,RSA RSA,Jaques VAN DYK Anke VAN DER MERWE,0,0 - 0,,550 / 1
1208,1094,RSA RSA,Jason WEISS Marijke MITTON,0,0 - 0,,550 / 1
1209,1094,DEN DEN,Alexander BOND Marie Louise STEFFENSEN,0,0 - 0,,550 / 1
1210,1094,DEN DEN,Jens Brokholm ANDERSEN Sarah FISKER,0,0 - 0,,550 / 1
1211,1094,DEN DEN,Mathias WEBER ESTRUP Cecilie BJERGEN,0,0 - 0,,550 / 1
1212,1094,DEN DEN,Mathias Moldt BASKJAER Anina NILSSON,0,0 - 0,,550 / 1
1213,1094,FIN FIN,Iiro NOKKALA Linnea VAINULA,0,0 - 0,,550 / 1
1214,1094,DEN DEN,Mikkel STOFFERSEN Karoline SYNNESTVEDT,0,0 - 0,,550 / 1
1215,1094,MEX MEX,Daniel MARTINEZ Chinas AILEEN,0,0 - 0,,550 / 1
1216,1094,SWE SWE,Andy TSAI Klara JOHANSSON,0,0 - 0,,550 / 1
1217,1094,GER GER,Bjarne GEISS Eva JANSSENS,0,0 - 0,,550 / 1
1218,1094,NOR NOR,Anders LEIRUD Sophie OWEN-DAVIES,0,0 - 0,,550 / 1
1219,1094,MRI SWE,Joel COLLARD Karolina BRANDSTROM,0,0 - 0,,550 / 1
1220,1094,BUL BUL,Illian KRASTEV Dimitria POPSTOIKOVA,-469,0 - 0,,550 / 1
1221,1094,PYF PYF,Kyliam SCILLOUX Coralie BOUTTIN,0,0 - 0,,550 / 1
1222,1094,FRA FRA,Thomas VALLEZ Delphine DELRUE,0,0 - 0,,550 / 1
1223,1094,MRI MRI,Andrew SEERUTHUN Shania LEUNG,0,0 - 0,,550 / 1
1224,1094,GRE GRE,Antonios TOPOLIGKAS Ioanna KARAPETRIDOU,0,0 - 0,,550 / 1
1225,1094,ZAM ZAM,MABO DONALD Ogar SIAMUPANGILA,0,0 - 0,,550 / 1
1226,1094,MAS MAS,Zi Heng OOI Shi Han OOI,0,0 - 0,,550 / 1
1227,1094,INA INA,Alfandy Rizki KASTURO Phita Haningtyas MENTARI,0,0 - 0,,550 / 1
1228,1094,INA INA,Rian SYAOQI Jovita Evaria CANDRA,0,0 - 0,,550 / 1
1229,1094,PER PER,Kenshin SHIMABUKURO Camila DUANY,0,0 - 0,,550 / 1
1230,1094,AUT AUT,Paul DEMMELMAYER Anna DEMMELMAYER,0,0 - 0,,550 / 1
1231,1094,UGA UGA,Alex BABU Brenda MUGABI,0,0 - 0,,550 / 1
1232,1094,AUT AUT,Philip KATSAROS Sonja LANGTHALER,0,0 - 0,,550 / 1
1233,1094,AUS AUS,Mitchell WHELLER Melinda SUN,0,0 - 0,,550 / 1
1234,1094,ISL ISL,Sigurdur Sverrir GUNNARSSON Margret FINNBOGADOTTIR,0,0 - 0,,550 / 1
1235,1094,ISL ISL,Kristofer Darri FINNSSON Margret NILSDOTTIR,0,0 - 0,,550 / 1
1236,1094,SVK SVK,Matej HLINICAN Martina REPISKA,0,0 - 0,,550 / 1
1237,1094,TUR TUR,Berk AVCI Sevval Buse ALSOY,-469,0 - 0,,550 / 1
1238,1094,BOT BOT,Gaone TAWANA Tebogo NDZINGE,0,0 - 0,,550 / 1
1239,1094,ESP ESP,Alberto ZAPICO Haidee OJEDA,0,0 - 0,,550 / 1
1240,1094,RSA RSA,Bongani VON BODENSTEIN Lehandre SCHOEMAN,0,0 - 0,,550 / 1
1241,1094,SCO SCO,Adam HALL Rebekka FINDLAY,0,0 - 0,,550 / 1
1242,1094,KEN KEN,Alfred MUTHOMI Sheila MUTHONI,0,0 - 0,,550 / 1
1243,1094,MAS MAS,Guo Zheng SIM Pui Yee ENG,0,0 - 0,,550 / 1
1244,1094,KAZ KAZ,Khaitmurat KULMATOV Ilyana FILIPCHUK,0,0 - 0,,550 / 1
1245,1094,VIE VIE,Van Tri TRAN Thi Linh Giang TRAN,0,0 - 0,,550 / 1
1246,1094,TUR TUR,Huseyin ORUC Emine DEMIRTAS,0,0 - 0,,550 / 1
1247,1094,ISL ISL,Daniel JOHANNESSON Sigridur ARNADOTTIR,0,0 - 0,,550 / 1
1248,1094,AUS AUS,Jacinta JOE Anthony JOE,0,0 - 0,,550 / 1
1249,1094,FIN FIN,Henrik HAKULINEN Sara TUOMALA,0,0 - 0,,550 / 1
1250,1094,DEN DEN,Amanda MADSEN Theodor JOHANSEN,0,0 - 0,,550 / 1
1251,1094,NOR NOR,Jesper KRISTENSEN Anne KLYVE,0,0 - 0,,550 / 1
1252,1094,ISL ISL,Egill GUDLAUGSSON Rakel JOHANNESDOTTIR,0,0 - 0,,550 / 1
1253,1094,EST EST,Vahur LUKIN Grete TALVISTE,0,0 - 0,,550 / 1
1254,1094,BOT BOT,Godwin MATHUMO Kgalalelo KEGAKILWE,0,0 - 0,,550 / 1
1255,1094,ISL ISL,Einar OSKARSSON Johanna JOHANNSDOTTIR,0,0 - 0,,550 / 1
1256,1257,ENG ENG,Callum HEMMING Lizzie TOLMAN,0,0 - 0,,530 / 2
1257,1258,DEN DEN,Mads Pieler KOLDING Sara THYGESEN,1,0 - 0,,522 / 1
1258,1259,INA INA,Muhammad RIJAL Shendy Puspa IRAWATI,1,0 - 0,,520 / 1
1259,1259,JPN JPN,Keigo SONODA Reika KAKIIWA,1,0 - 0,,520 / 1
1260,1261,CAN CAN,Logan CAMPBELL Kyleigh O’DONOGHUE,1,0 - 0,,510 / 1
1261,1261,GER SWE,Jonathan PERSSON Matilda PETERSEN,1,0 - 0,,510 / 1
1262,1261,KOR KOR,Min Young RA Hye Ryeon KO,1,0 - 0,,510 / 1
1263,1261,KOR KOR,Ki Hoon KIM Ah Young EOM,1,0 - 0,,510 / 1
1264,1261,INA INA,Agripinna Prima Rahmanto PUTRA Komala DEWI,1,0 - 0,,510 / 1
1265,1261,ESP ESP,Alejandro TORO Manuela DIAZ,1,0 - 0,,510 / 1
1266,1267,LTU LTU,Karolis EIMUTAITIS Gabija NARVILAITE,1,0 - 0,,450 / 2
1267,1268,JPN JPN,Koshun MIURA Natsumi URATANI,1,0 - 0,,430 / 1
1268,1268,JPN JPN,Shuto MORIOKA Chiharu SHIDA,1,0 - 0,,430 / 1
1269,1268,AUS INA,Hoe Keat OON Sylvina KURNIAWAN,1,0 - 0,,430 / 1
1270,1268,INA INA,Christopher RUSDIANTO Dian FITRIANI,1,0 - 0,,430 / 1
1271,1268,IND IND,Dinesh CHAUDHRY Komal ANTIL,1,0 - 0,,430 / 1
1272,1268,IND IND,Rajat JOON Jagriti NASHIER,1,0 - 0,,430 / 1
1273,1268,JPN JPN,Kenta KAZUNO Yuki FUKUSHIMA,1,0 - 0,,430 / 1
1274,1268,FRA FRA,Alexandre HAMMER Emilie BEAUJEAN,1,0 - 0,,430 / 1
1275,1268,RUS RUS,Arseniy FISTIN Viktoriia VOROBEVA,1,0 - 0,,430 / 1
1276,1268,AUS ENG,Talia SAUNDERS Stuart ROWLANDS,1,0 - 0,,430 / 1
1277,1268,INA INA,Trikusuma WARDHANA Nadya MELATI,1,0 - 0,,430 / 1
1278,1268,FRA FRA,Bruno MATIAS Barbara MATIAS,1,0 - 0,,430 / 1
1279,1280,RUS RUS,Vladimir IVANOV Evgeniya KOSETSKAYA,1,0 - 0,,398 / 1
1280,1281,USA USA,Phillip CHEW Eva LEE,1,0 - 0,,369 / 1
1281,1282,DEN DEN,Steve OLESEN Cecilie FINNE-IPSEN,1,0 - 0,,360 / 1
1282,1282,BEL BEL,Elias BRACKE Lise JAQUES,1,0 - 0,,360 / 1
1283,1282,INA INA,Kevin EZRA Engelica WIRATAMA,1,0 - 0,,360 / 1
1284,1282,INA INA,Muhammad Taufiqul HAFIZH Vanadia PRANASA,1,0 - 0,,360 / 1
1285,1282,INA INA,Indra Leonard PRASETYA Violita DEWI,1,0 - 0,,360 / 1
1286,1282,INA INA,Aditya Muchlis WICAKSONO Annisa MUBAROKAH,1,0 - 0,,360 / 1
1287,1282,PER PER,Alfonso GARCIA-ROSELL Flavia STIGLICH GUZMAN,1,0 - 0,,360 / 1
1288,1282,PER PER,Matias ZAMORANO RAMOS Stefany Ying Chie CHEN CHEN,1,0 - 0,,360 / 1
1289,1282,PER PER,Diego SUBAUSTE TOKUMURA Valeria Carolina WONG LAM,1,0 - 0,,360 / 1
1290,1282,JPN JPN,Shuto MORIOKA Yukiko TAKAHATA,1,0 - 0,,360 / 1
1291,1282,FRA FRA,Gaetan BRETHES Marie HERMELINE,1,0 - 0,,360 / 1
1292,1282,FRA RUS,Maxime MICHEL Natalia PERMINOVA,1,0 - 0,,360 / 1
1293,1282,VIE VIE,Quang Duy NGUYEN DUC HANH Vu,1,0 - 0,,360 / 1
1294,1282,THA THA,Wipoo INKAEW Panjarat PRANSOPON,1,0 - 0,,360 / 1
1295,1282,MAS INA,Kok Pong LOKE Millicent WIRANTO,1,0 - 0,,360 / 1
1296,1282,THA THA,Pollawat BOONPAN Chasinee KOREPAP,1,0 - 0,,360 / 1
1297,1282,THA THA,Kittipong DUMRONGJITTI Anawika INTARAWATTANA,1,0 - 0,,360 / 1
1298,1282,THA THA,Ratchanon LOUNSIRI Sasina KULSIRI,1,0 - 0,,360 / 1
1299,1282,ESP IRL,Juan Manuel FERNANDEZ QUILES Rachael DARRAGH,1,0 - 0,,360 / 1
1300,1282,SUI SUI,Marco MARTUCCI Marion GRUBER,1,0 - 0,,360 / 1
1301,1282,SUI SUI,Silvan FURRER Celine DAGELET,1,0 - 0,,360 / 1
1302,1282,THA THA,Warit SARAPAT Ruethaichanok LAISUAN,-537,0 - 0,,360 / 1
1303,1282,TPE TPE,Hsuan Wen CHANG Tzu Chin PAN,-246,0 - 0,,360 / 1
1304,1282,TPE TPE,En Chia CHANG Ya Ting CHIANG,-246,0 - 0,,360 / 1
1305,1282,TPE TPE,Chia Hung LU Su Yu CHEN,1,0 - 0,,360 / 1
1306,1282,DEN DEN,David DAUGAARD Mai SURROW,1,0 - 0,,360 / 1
1307,1282,CHI CHI,Ivan LEON Tingting CHOU,1,0 - 0,,360 / 1
1308,1282,MAS MAS,Yan Sheng LEE Sin Er NG,1,0 - 0,,360 / 1
1309,1282,INA INA,Achmad Fasich Firman SABDA Tays Rona LEGIAYEM,1,0 - 0,,360 / 1
1310,1282,SRB SRB,Igor BJELAN Milica SIMIC,1,0 - 0,,360 / 1
1311,1282,ESP ESP,Jesus LORENZO Maria MARQUEZ DIAZ,1,0 - 0,,360 / 1
1312,1313,ENG ENG,Matthew CLARE Evie BURBIDGE,1,0 - 0,,350 / 1
1313,1313,SLO SLO,Miha IVANIC Nika ARIH,1,0 - 0,,350 / 1
1314,1313,AUT AUT,Roman ZIRNWALD Janine LAIS,1,0 - 0,,350 / 1
1315,1313,ENG ENG,Jonty RUSS Elizabeth MCMORROW,1,0 - 0,,350 / 1
1316,1313,SUI SUI,Joel KOENIG Ronja STERN,1,0 - 0,,350 / 1
1317,1313,LTU LTU,Rokas MINDERIS Elzbieta BAJORINAITE,1,0 - 0,,350 / 1
1318,1313,EST EST,Heiko ZOOBER Kertu MARGUS,1,0 - 0,,350 / 1
1319,1313,EST EST,Raul KÄSNER Kristin KUUBA,1,0 - 0,,350 / 1
1320,1313,POR CZE,Bernardo ATILANO Denisa SIKALOVA,1,0 - 0,,350 / 1
1321,1313,LAT LAT,Teodors KERIMOVS Jekaterina ROMANOVA,1,0 - 0,,350 / 1
1322,1313,NZL NZL,Douglas SHEPHARD Neisha BOUMA,1,0 - 0,,350 / 1
1323,1313,NZL NZL,Eric LI Rebecca YE,1,0 - 0,,350 / 1
1324,1313,NZL NZL,Jack BOYLE Jahvaya WHEKI,1,0 - 0,,350 / 1
1325,1313,NZL NZL,Dylan HENTON Aviva PAK,1,0 - 0,,350 / 1
1326,1313,NZL DEN,Jasmanjot VIRK Josefine Redkjær JENSEN,1,0 - 0,,350 / 1
1327,1313,NZL NZL,Vincent HARRIS Felicity LEYDON-DAVIS,1,0 - 0,,350 / 1
1328,1313,NZL NZL,Chee Foong LIM Maysell DOWNEY,1,0 - 0,,350 / 1
1329,1313,NZL NZL,Joshua CURRY Caragh ALLEY,1,0 - 0,,350 / 1
1330,1313,AUS AUS,Pit Seng LOW Melinda SUN,1,0 - 0,,350 / 1
1331,1313,POL POL,Piotr WASILUK JANOWSKA KAROLINA,1,0 - 0,,350 / 1
1332,1333,ESP ESP,Ernesto VELAZQUEZ Beatriz CORRALES,1,0 - 0,,349 / 2
1333,1334,MAS MAS,Yan Sheng LEE Erica Pei Shan KHOO,1,0 - 0,,340 / 2
1334,1335,THA THA,Tanawat TOPATTANAKUL Rujjanabordee SRIPAIBOON,0,0 - 0,,320 / 1
1335,1335,THA THA,Korawi PIKUNNGAM Thanapim KAWEENUNTAVONG,0,0 - 0,,320 / 1
1336,1335,THA THA,Supakit JANDARA Thunyathorn THAMNOPAKAO,0,0 - 0,,320 / 1
1337,1335,BRA BRA,Hugo ARTHUSO Paula B PEREIRA,1,0 - 0,,320 / 1
1338,1335,NZL NZL,Shyam PURUSHOTHMAN Alyse DERBY,1,0 - 0,,320 / 1
1339,1335,NZL NZL,Jian WANG Soomi Lina LEE,1,0 - 0,,320 / 1
1340,1335,INA INA,Andrei ADISTIA Jenna GOZALI,1,0 - 0,,320 / 1
1341,1335,MAS MAS,Khek Wei CHUA Zhen YAP,1,0 - 0,,320 / 1
1342,1335,JPN JPN,Takuto INOUE Ayane KURIHARA,1,0 - 0,,320 / 1
1343,1335,INA INA,Kaizar Bobby ALEXANDER Keshya Nurvita HANADIA,1,0 - 0,,320 / 1
1344,1335,TPE TPE,Hsiao-Lin WU Tsun Yu LIN,1,0 - 0,,320 / 1
1345,1335,NZL NZL,Thomas ELLIS Hayley THOMPSON,1,0 - 0,,320 / 1
1346,1335,TPE TPE,Chu-En HUANG YU Wen KUO,1,0 - 0,,320 / 1
1347,1335,HKG HKG,CHAN Tsz Kit SHEK Hiu Yiu,1,0 - 0,,320 / 1
1348,1349,FIN FIN,Julius VON PFALER Tuuli HARKONEN,-2,0 - 0,,310 / 2
1349,1350,EST EST,Mario SAUNPERE Kati-Kreet MARRAN,-2,0 - 0,,290 / 3
1350,1351,CHN CHN,LIU Cheng ZHAO Yunlei,-2,0 - 0,,285 / 1
1351,1352,CZE CZE,Jan SOMERLIK Dominika BUDZELOVA,-2,0 - 0,,270 / 2
1352,1353,MAC MAC,U Ieong IEK Xue Xin GONG,-2,0 - 0,,240 / 1
1353,1353,CAN CAN,Andy KO Valerie Pauline CHEUNG,-2,0 - 0,,240 / 1
1354,1353,CAN CAN,Darren HONG Erin O'DONOGHUE,-2,0 - 0,,240 / 1
1355,1353,SCO SCO,Danny LEINSTER Kirsten GEALS,-2,0 - 0,,240 / 1
1356,1353,SCO SCO,Callum MACMILLAN Sarah FINDLAY,-2,0 - 0,,240 / 1
1357,1353,KOR KOR,Jong Woo CHOI Keun Hye PARK,-2,0 - 0,,240 / 1
1358,1353,SRI SRI,Sachin DIAS Thilini Pramodika HENDAHEWA,-2,0 - 0,,240 / 1
1359,1353,TPE TPE,WANG Chih Hao Yen Yu WANG,-2,0 - 0,,240 / 1
1360,1353,KOR KOR,JUNG Suk Hoon Hyun Hee CHAE,-2,0 - 0,,240 / 1
1361,1353,NED NED,Ruben WIJNANDS Tamara HOEVEN VAN DER,-2,0 - 0,,240 / 1
1362,1353,CAN CAN,Nathan OSBORNE Josephine WU,-2,0 - 0,,240 / 1
1363,1353,GRE GRE,Dimitris ORLIS Ioanna KARKANTZIA,-2,0 - 0,,240 / 1
1364,1365,GUA GUA,Rodolfo RAMIREZ Nikte Alejandra SOTOMAYOR,-2,0 - 0,,227 / 1
1365,1366,SVK SVK,Bohumil KASELA Lenka DROTAROVA,-2,0 - 0,,210 / 1
1366,1366,TPE TPE,HUNG Jin-Yi TAI Wei-Ling,-2,0 - 0,,210 / 1
1367,1366,IND IND,Anup SRIDHAR Arathi Sara SUNIL,-2,0 - 0,,210 / 1
1368,1366,INA INA,Kaizar Bobby ALEXANDER Fransisca Angelica RAHARDJA,-2,0 - 0,,210 / 1
1369,1366,SUI SUI,Clément WERKMEISTER Diane RUSSI,-2,0 - 0,,210 / 1
1370,1366,FIN EST,Akseli DANSKANEN Melissa MAZURTSAK,-2,0 - 0,,210 / 1
1371,1366,NED NED,Remco KUILMAN Esther KUILMAN,-2,0 - 0,,210 / 1
1372,1366,POR POR,Ricardo SILVA Daniela CONCEICAO,-2,0 - 0,,210 / 1
1373,1374,INA INA,Travis MONIAGA Tracy MONIAGA,3,0 - 0,,200 / 2
1374,1375,AUT GER,Roman ZIRNWALD Barbara BELLENBERG,3,0 - 0,,170 / 1
1375,1375,POL POL,Pawel PIETRYJA Kornelia MARCZAK,3,0 - 0,,170 / 1
1376,1375,FRA FRA,Thomas VALLEZ Verlaine FAULMANN,3,0 - 0,,170 / 1
1377,1375,ESP ESP,Adrian ALCAIDE Lucia GALVIN,3,0 - 0,,170 / 1
1378,1375,FRA FRA,Jocelyn DESCHAMP Delphine DELRUE,3,0 - 0,,170 / 1
1379,1375,DEN DEN,Joel EIPE Cecilie FINNE-IPSEN,3,0 - 0,,170 / 1
1380,1375,JPN JPN,Takahiro FUJIMAKI Misaki MAKINO,3,0 - 0,,170 / 1
1381,1375,JPN JPN,Keiichiro MATSUI Mirai SHINODA,3,0 - 0,,170 / 1
1382,1375,FRA FRA,Arif RASIDI Héloïse LE MOULEC,3,0 - 0,,170 / 1
1383,1375,FRA FRA,Swann LENIK Marine NOBLECOURT,3,0 - 0,,170 / 1
1384,1375,FRA FRA,Tanguy BLANCHARD Lauren FONTAINE,3,0 - 0,,170 / 1
1385,1375,INA INA,Ivanudin RIFAN FAUZIN Ganis Nur RAHMADANI,3,0 - 0,,170 / 1
1386,1375,VIE VIE,Binh Minh NGUYEN Ngoc Bich PHAM,3,0 - 0,,170 / 1
1387,1375,VIE VIE,Nguyen Khang HUYNH Kim Ngan DANG,3,0 - 0,,170 / 1
1388,1375,THA THA,Saran JAMSRI Nattcha CHATPUTTARN,3,0 - 0,,170 / 1
1389,1375,UKR UKR,DON SERGEY Mariya RUD,3,0 - 0,,170 / 1
1390,1375,CZE CZE,IVO Stoklas Sarka KRIZKOVA,3,0 - 0,,170 / 1
1391,1375,BUL AUT,Peyo BOICHINOV Sonja LANGTHALER,3,0 - 0,,170 / 1
1392,1375,SUI SUI,Anthony DUMARTHERAY Cendrine HANTZ,3,0 - 0,,170 / 1
1393,1375,SWE SWE,Andy Hartono TANDAPUTRA Berfin ASLAN,3,0 - 0,,170 / 1
1394,1375,DEN SWE,Kristoffer KNUDSEN Louise ERIKSSON,3,0 - 0,,170 / 1
1395,1375,ITA ITA,Kevin STROBL Marah PUNTER,3,0 - 0,,170 / 1
1396,1375,ITA ITA,Fabio CAPONIO Giulia FIORITO,3,0 - 0,,170 / 1
1397,1375,FRA RUS,Sylvain TERNON Natalia PERMINOVA,3,0 - 0,,170 / 1
1398,1375,MAS IRL,Beryno Jiann Tze WONG Megan BREDIN,3,0 - 0,,170 / 1
1399,1375,IRL IRL,Norman Chun Hang LAU Moya RYAN,3,0 - 0,,170 / 1
1400,1375,SUI ESP,Christoph HEINIGER Haidee OJEDA,3,0 - 0,,170 / 1
1401,1375,SUI SUI,Cyril HOHL Chantal VON ROTZ,3,0 - 0,,170 / 1
1402,1375,SUI SUI,Thibault BERNETTI Michelle GREBER,3,0 - 0,,170 / 1
1403,1375,BUL BUL,Mihael MIHAYLOV Rumiana IVANOVA,-118,0 - 0,,170 / 1
1404,1375,FRA FRA,Alexandre HAMMER Joanna CHAUBE,3,0 - 0,,170 / 1
1405,1375,GER GER,Daniel BENZ Annika HORBACH,-604,0 - 0,,170 / 1
1406,1375,JPN JPN,Yuki YONEMOTO Haruka YONEMOTO,3,0 - 0,,170 / 1
1407,1375,SUI SUI,Pierrick DESCHENAUX Simone VON ROTZ,3,0 - 0,,170 / 1
1408,1375,ESP ESP,Eliecer OJEDA Noelia JIMENEZ,3,0 - 0,,170 / 1
1409,1375,GER GER,Philipp WACHENFELD Fabienne KOEHLER,3,0 - 0,,170 / 1
1410,1411,MAC MAC,U Ieong IEK Weng Chi NG,3,0 - 0,,130 / 1
1411,1411,MAC MAC,Hok Man LOU Kit Ieng WONG,3,0 - 0,,130 / 1
1412,1411,AUS AUS,Cham CHEN Jennifer TAM,3,0 - 0,,130 / 1
1413,1411,LTU LTU,Donatas NARVILAS Gerda VOITECHOVSKAJA,3,0 - 0,,130 / 1
1414,1415,FRA FRA,Thomas BAURES Margot LAMBERT,3,0 - 0,,120 / 2
1415,1416,NOR NOR,Jorgen ROSENLUND Thea Kristina JOHANSEN,3,0 - 0,,100 / 1
1416,1416,POL POL,Bartłomiej PARYSZ Daniela BIELINSKA,3,0 - 0,,100 / 1
1417,1416,POL POL,Robert MIRGA Kornelia MARCZAK,3,0 - 0,,100 / 1
1418,1416,POL POL,Jan RUDZINSKI Wiktoria FALANDYSZ,3,0 - 0,,100 / 1
1419,1416,POL POL,Wojciech SAJDOK Barbara KNOPEK,3,0 - 0,,100 / 1
1420,1416,PHI PHI,Paul John PANTIG Joella Geva DE VERA,3,0 - 0,,100 / 1
1421,1416,MAS MAS,Yeet Siang LIN Wei Chyi TI,3,0 - 0,,100 / 1
1422,1416,TPE TPE,LU Jin-Song LEE Wei Tzu,3,0 - 0,,100 / 1
1423,1416,THA THA,Kunlavut VITIDSARN Pattarasuda CHAIWAN,3,0 - 0,,100 / 1
1424,1416,SLO SLO,Urban TURK Katarina BETON,3,0 - 0,,100 / 1
1425,1416,SLO SLO,Dani KLANCAR Nika POLANIC,3,0 - 0,,100 / 1
1426,1416,SLO SLO,Beber ALJOSA Vesna BRLIČ,3,0 - 0,,100 / 1
1427,1416,SLO SLO,Aljaž ROSKAR Eva GRUBER,3,0 - 0,,100 / 1
1428,1416,INA INA,Axel Raditya VASYAH Vania Lystia VASYAH,3,0 - 0,,100 / 1
1429,1416,INA INA,Muhmmad Shohibul FIKRI Triya NURSAADIYAH,3,0 - 0,,100 / 1
1430,1416,INA INA,Muhammad Andi PURNOMO Violita DEWI,3,0 - 0,,100 / 1
1431,1416,INA INA,Abhinaya ADIRA Virni Putri JAFAR,3,0 - 0,,100 / 1
1432,1416,ROU ROU,Robert CIOBOTARU Adelina MARIN TERINTE,3,0 - 0,,100 / 1
1433,1416,ROU ROU,David NITU Nitu MIRUNA ELENA,3,0 - 0,,100 / 1
1434,1416,ROU ROU,Andreas THIEL Ioana IONICA,3,0 - 0,,100 / 1
1435,1416,POR POR,Miguel PINTO Joana AMARAL,3,0 - 0,,100 / 1
1436,1416,POR POR,Manuel LEITAO Ana ALBUQUERQUE,3,0 - 0,,100 / 1
1437,1416,POR POR,Angelo SILVA Ana DIAS,3,0 - 0,,100 / 1
1438,1416,POR POR,Joao MARQUES Joana LOPES,3,0 - 0,,100 / 1
1439,1416,POR POR,Ruben VIEIRA Ana AMARAL,3,0 - 0,,100 / 1
1440,1416,POR POR,Guilherme PEREIRA Gabriela PEREIRA,3,0 - 0,,100 / 1
1441,1416,EST EST,Mikk OUNMAA Grete PALL,3,0 - 0,,100 / 1
1442,1416,FIN FIN,Ville RASI Riina MAKELA,3,0 - 0,,100 / 1
1443,1416,BUL SWE,Gergin NEDYALKOV Malin ANDERSON,3,0 - 0,,100 / 1
1444,1416,NOR NOR,Vegard RIKHEIM Charlotte LEINAN,3,0 - 0,,100 / 1
1445,1416,SWE SWE,Morgan LIDMAN Moa SJOO,3,0 - 0,,100 / 1
1446,1416,NOR NOR,Thomas BERGE Hege ULSTEIN,3,0 - 0,,100 / 1
1447,1416,SLO SLO,Miha IVANIC Nika KONCUT,3,0 - 0,,100 / 1
1448,1416,SLO SLO,Urban HERMAN Nastja STOVANJE,3,0 - 0,,100 / 1
1449,1416,LTU LTU,Renaldas SILERIS Gabriele JANUSONYTE,3,0 - 0,,100 / 1
1450,1416,POR POR,Bruno CARVALHO Sonia GONCALVES,3,0 - 0,,100 / 1
1451,1416,AUT AUT,Benjamin SCHLEMMER Bianca SCHIESTER,3,0 - 0,,100 / 1
1452,1416,POR POR,Paulo MENDONCA Isabel MATIAS,3,0 - 0,,100 / 1
1453,1454,ISL ISL,Daniel THOMSEN Rakel JOHANNESDOTTIR,9,0 - 0,,93 / 2
1454,1455,AUT AUT,Matthias ALMER Elisabeth BALDAUF,9,0 - 0,,88 / 1
1455,1456,SVK SVK,Richard SMATLAK Lenka DROTAROVA,9,0 - 0,,60 / 1
1456,1456,SVK SVK,Michal MATEJKA Julia POLACKOVA,9,0 - 0,,60 / 1
1457,1456,NOR NOR,Sturla Flaten JORGENSEN Anne KLYVE,9,0 - 0,,60 / 1
1458,1456,SVK SVK,Marian SMREK Lucia GRENCIKOVA,9,0 - 0,,60 / 1
1459,1456,LAT LAT,Toms PREINBERGS Ieva POPE,9,0 - 0,,60 / 1
1460,1456,RUS RUS,Kirill ERMAKOV Anastasia DOBRININA,9,0 - 0,,60 / 1
1461,1456,SUI SUI,Benedikt SCHALLER Ronja STERN,9,0 - 0,,60 / 1
1462,1456,EST EST,Marcus LÕO Mari Ann KARJUS,9,0 - 0,,60 / 1
1463,1456,LAT LAT,Toms PREINBERGS Aija POPE,9,0 - 0,,60 / 1
1464,1456,NED NED,Justin TEEUWEN Cheryl SEINEN,9,0 - 0,,60 / 1
1465,1456,FRA FRA,Marc LAPORTE Yaelle HOYAUX,9,0 - 0,,60 / 1
1466,1467,MEX MEX,Lino MUNOZ Haramara GAITAN,9,0 - 0,,38 / 1
1467,1468,SRI SRI,Achini RATNASIRI Nimmika THISARA,9,0 - 0,,36 / 1
1468,1469,BUL BUL,Stilian MAKARSKI Dimitria POPSTOIKOVA,9,0 - 0,,10 / 1
1469,1470,ITA ITA,Rosario MADDALONI Karin MARAN,9,0 - 0,,2 / 2
1470,1471,ALG ALG,Mohamed Amine GUELMAOUI Baya NESRINE,9,0 - 0,,2 / 1
1471,1471,GHA GHA,Gifty MENSAH Emmanuel YAW DONKOR,9,0 - 0,,2 / 1
1472,1471,BOT BOT,Kgalalelo KEGAKILWE Orideetse THELA,9,0 - 0,,2 / 1
1473,1471,NGR NGR,Dorcas Ajoke ADESOKAN Victor MAKANJU,9,0 - 0,,2 / 1
1474,1471,TUR TUR,Ozge BAYRAK Ramazan OZTURK,9,0 - 0,,2 / 1
1475,1471,WAL WAL,Oliver GWILT Aimee MORAN,9,0 - 0,,2 / 1
1476,1471,SWE SWE,Henri HURSKAINEN Emelie FABBEKE,9,0 - 0,,2 / 1
1477,1471,LTU LTU,Povilas BARTUSIS Akvile STAPUSAITYTE,9,0 - 0,,2 / 1
1478,1479,PHI PHI,Ronel ESTANISLAO Thea Marie POMAR,9,0 - 0,,2 / 1
