,RANK,COUNTRY,PLAYER,CHANGE +/-,WIN - LOSE,PRIZE MONEY,POINTS / TOURNAMENTS
329,330,SUI SUI,Pierrick DESCHENAUX Tiffany GIRONA,-1,4 - 10,$0.00,"2,950 / 6"
330,331,THA THA,Kantawat LEELAVECHABUTR Panjarat PRANSOPON,-1,2 - 3,$81.87,"2,950 / 3"
331,332,WAL WAL,Daniel FONT Carissa TURNER,-1,3 - 3,$0.00,"2,900 / 3"
332,333,ENG ENG,Callum HEMMING Evie BURBIDGE,-1,0 - 0,$0.00,"2,890 / 2"
333,333,INA INA,Albert ADIDJUWONO Fransisca Angelica RAHARDJA,-1,0 - 0,$223.74,"2,890 / 2"
334,335,JPN JPN,Tomoya TAKASHINA Rie ETOH,-1,4 - 3,$386.24,"2,870 / 3"
335,336,DEN DEN,Jeppe LUDVIGSEN Mai SURROW,-1,17 - 10,"$1,000.00","2,840 / 3"
336,337,AUS AUS,Cham CHEN Hsuan-Yu Wendy CHEN,-1,1 - 2,"$1,163.11","2,810 / 2"
337,337,ENG ENG,Ryan Jing QUEK Meera SIVAKUMARAN,-1,1 - 2,$0.00,"2,810 / 2"
338,339,SEY SEY,Georgie CUPIDON Juliette AH-WAN,-1,51 - 31,"$12,757.50","2,802 / 2"
339,340,CHN CHN,FAN Qiuyue ZHOU Chaomin,-1,0 - 0,"$1,050.00","2,800 / 1"
340,340,TUR TUR,Yusuf Ramazan BAY Neslihan KILIC,-1,3 - 1,$279.37,"2,800 / 1"
341,340,CHI CHI,Cristobal CONEJEROS Ashley MONTRE,-1,1 - 1,$210.00,"2,800 / 1"
342,340,JPN JPN,Ryota TAOHATA Ayane KURIHARA,-1,3 - 1,"$12,267.47","2,800 / 1"
343,340,ENG DEN,Matthew NOTTINGHAM Maria HELSBOL,-1,3 - 1,"$5,100.13","2,800 / 1"
344,340,MAS IND,Vountus Indra MAWAN Prajakta SAWANT,-1,11 - 8,"$3,683.57","2,800 / 1"
345,340,CRO USA,Zvonimir DURKINJAK Eva LEE,-1,8 - 1,"$18,714.49","2,800 / 1"
346,347,FRA FRA,Thomas VALLEZ Delphine DELRUE,-1,5 - 4,$0.00,"2,770 / 2"
347,348,ENG ENG,Matthew CLARE Jessica HOPTON,-1,1 - 3,$0.00,"2,760 / 3"
348,348,CZE CZE,Filip BUDZEL Tereza SVABIKOVA,-1,8 - 3,$0.00,"2,760 / 3"
349,348,TPE TPE,Yu Chieh HSU Chih Chen LEE,-1,5 - 3,$56.26,"2,760 / 3"
350,348,PHI PHI,Alvin MORADA Alyssa Yasbel LEONARDO,-1,1 - 3,$84.38,"2,760 / 3"
351,352,AUT AUT,Roman ZIRNWALD Elisabeth BALDAUF,-1,48 - 61,"$4,793.23","2,753 / 2"
352,353,AUS AUS,Athi SELLADURAI Jennifer TAM,-1,1 - 3,$0.00,"2,750 / 2"
353,354,INA INA,Rian SWASTEDIAN Apriani RAHAYU,0,0 - 0,$937.50,"2,720 / 1"
354,354,INA INA,Henry Jansen Putra WIBOWO Rena ASELA,-1,0 - 1,$450.00,"2,720 / 1"
355,354,CHN CHN,LI Junhui DU Yue,-1,1 - 1,"$4,758.75","2,720 / 1"
356,354,KOR KOR,Dong Joo KIM KIM Chan Mi,-1,2 - 1,$993.75,"2,720 / 1"
357,354,TPE TPE,YANG Po Han CHEN Hsiao Huan,-1,1 - 1,"$9,827.48","2,720 / 1"
358,354,CHN CHN,HUANG Kaixiang ZHONG Qianxin,-1,1 - 1,"$16,730.62","2,720 / 1"
359,354,INA INA,Kevin Sanjaya SUKAMULJO Della Destiara HARIS,-1,0 - 0,"$3,610.00","2,720 / 1"
360,354,NZL IND,Abhinav MANOTA Rachita SAHDEV,-1,3 - 6,$450.00,"2,720 / 1"
361,354,THA THA,Nipitphon PUANGPUAPECH Jongkolphan KITITHARAKUL,0,0 - 0,"$9,832.45","2,720 / 1"
362,354,GER GER,Andreas HEINZ Annika HORBACH,-1,11 - 10,"$2,450.00","2,720 / 1"
363,364,RUS RUS,Artem SERPIONOV Tatjana BIBIK,-3,2 - 2,"$3,007.50","2,670 / 2"
364,364,DEN DEN,Philip SEERUP Irina Amalie ANDERSEN,-3,5 - 3,$0.00,"2,670 / 2"
365,364,TUR TUR,Burak Furkan DEMIR Büşra BENK,-3,3 - 3,$0.00,"2,670 / 2"
366,364,NGR NGR,Idowu Timothy ADEKUNLE Asisat OGUNKANBI,-3,1 - 3,$56.24,"2,670 / 2"
367,364,INA INA,Reinard DHANRIANO Sinta Arum ANTASARI,-3,5 - 4,$163.74,"2,670 / 2"
368,364,BOT BOT,Orideetse THELA Botho MAKUBATE,-3,14 - 20,$41.25,"2,670 / 2"
369,370,THA THA,Sudket PRAPAKAMOL Sapsiree TAERATTANACHAI,-3,0 - 1,"$178,163.73","2,660 / 1"
370,371,SLO SLO,Martin CERKOVNIK Ana Marija SETINA,-3,6 - 3,$0.00,"2,640 / 3"
371,372,UZB UZB,Amrullo BAKHSHULLAEV Anait KHURSHUDYAN,-3,1 - 6,$71.88,"2,590 / 5"
372,373,INA INA,Jeka WIRATAMA Surya DELLA AUGUSTIA,-3,0 - 2,$163.74,"2,590 / 2"
373,373,NZL NZL,Kevin DENNERLY-MINTURN Danielle TAHURI,-3,2 - 2,"$1,422.51","2,590 / 2"
374,373,INA INA,Afiat Yuris WIRAWAN Jenna GOZALI,-3,0 - 2,"$2,995.96","2,590 / 2"
375,376,SCO AUS,Alistair CASEY Melinda SUN,-3,0 - 2,$339.38,"2,580 / 2"
376,376,IND IND,Rajat RATHORE Parssa NAQVI,-3,1 - 2,$0.00,"2,580 / 2"
377,378,HKG HKG,CHUNG Yonny NG Tsz Yau,-3,1 - 2,$0.00,"2,550 / 2"
378,379,SEY SEY,Georgie CUPIDON Allisen CAMILLE,-3,11 - 11,"$6,378.75","2,515 / 2"
379,380,NZL NZL,Dhanny OUD Jasmin Chung Man NG,-3,0 - 5,$9.38,"2,510 / 4"
380,381,INA INA,David Yedija POHAN Jenna GOZALI,-3,0 - 0,"$1,910.11","2,500 / 1"
381,381,BRA BRA,Alex Yuwan TJONG Fabiana SILVA,-3,4 - 0,"$3,919.29","2,500 / 1"
382,381,KOR KOR,KIM Young Sun Ja Yeong LEE,-3,4 - 0,$698.90,"2,500 / 1"
383,381,CRO CRO,Zvonimir DURKINJAK Mateja CICA,-3,4 - 0,"$6,578.00","2,500 / 1"
384,381,TPE TPE,Chia-Han LEE Chia Hsin LEE,-3,9 - 0,"$2,449.99","2,500 / 1"
385,381,INA INA,Rian SWASTEDIAN Masita MAHMUDIN,-3,8 - 3,"$2,735.61","2,500 / 1"
386,387,BLR BLR,Dzmitry SAIDAKOU Alesia ZAITSAVA,-3,4 - 7,$779.62,"2,480 / 4"
387,388,TPE TPE,Li-Wei PO Hsin-Yu TSAI,-3,3 - 3,$81.24,"2,470 / 3"
388,389,ETH ETH,TEKLU Endale Yerusksew Legssey TURA,-3,2 - 2,$0.00,"2,442 / 3"
389,390,ESP ESP,Juan Manuel FERNANDEZ QUILES Haidee OJEDA,-3,0 - 2,$500.25,"2,440 / 2"
390,390,BUL BUL,Alex VLAAR Petya NEDELCHEVA,-3,2 - 2,$292.63,"2,440 / 2"
391,392,ESP ESP,Javier SANCHEZ SOLER Laura MOLINA,-3,3 - 6,$262.49,"2,410 / 4"
392,393,INA INA,Agripinna Prima Rahmanto PUTRA Aprilsasi Putri LEJARSAR VARIELLA,-3,2 - 2,"$1,867.50","2,400 / 2"
393,394,INA INA,Fachriza ABIMANYU Syifa FAUZIAH,-3,3 - 3,$154.99,"2,390 / 3"
394,394,GER GER,Johannes PISTORIUS Ramona HACKS,-3,4 - 6,$0.00,"2,390 / 3"
395,394,ARG ARG,Federico DIAZ Daiana GARMENDIA,-3,2 - 19,$0.00,"2,390 / 3"
396,397,WAL ENG,William KITCHING Til'Shiloh SHAW,-3,0 - 3,$0.00,"2,380 / 3"
397,398,ESP ESP,Pablo ABIAN Haidee OJEDA,-3,5 - 4,$511.13,"2,370 / 2"
398,399,JOR JOR,Mohd Naser Mansour NAYEF Mazahreh LEINA FEHMI,-3,2 - 2,$93.12,"2,350 / 2"
399,400,MAS MAS,"Zhen Ting LIM Peiy Yee, Payee LIM",-3,2 - 3,$18.76,"2,320 / 3"
400,401,IND IND,Manu ATTRI NELAKURIHI Sikki Reddy,-3,10 - 9,"$6,923.71","2,306 / 1"
401,402,INA FIN,Asuro RIZKO Riikka SINKKO,-3,3 - 2,$0.00,"2,290 / 2"
402,402,ZAM ZAM,Topsy PHIRI Elizaberth CHIPELEME,-3,1 - 2,$0.00,"2,290 / 2"
403,402,BRN BRN,Vishnu SREEKUMAR Anza ABDULRAHIM,-3,0 - 2,$92.48,"2,290 / 2"
404,402,SLO SLO,Miha IVANIC Lia SALEHAR,-3,2 - 2,$0.00,"2,290 / 2"
405,402,PHI PHI,Christian BERNARDO Eleanor Christine INLAYO,-3,4 - 2,$36.24,"2,290 / 2"
406,402,PER PER,Daniel LA TORRE REGAL Camilla GARCIA,-3,2 - 2,$226.85,"2,290 / 2"
407,402,UZB RUS,Artyom SAVATYUGIN Polina VORONKO,-3,3 - 3,$220.61,"2,290 / 2"
408,402,TUR TUR,Kubilay SADI Yaren DOLCU,-3,4 - 4,$0.00,"2,290 / 2"
409,402,NGR NGR,Ayila GWAMBEH Patricia AKPUSUGH,-3,2 - 3,$108.74,"2,290 / 2"
410,402,GRE GRE,George GALVAS Zoi ALELI,-3,1 - 3,$0.00,"2,290 / 2"
411,402,AUS AUS,Ashwant GOBINATHAN Alice WU,-3,3 - 4,$109.37,"2,290 / 2"
412,413,NOR NOR,Jesper KRISTENSEN Helene SOGAARD,-3,0 - 0,$0.00,"2,230 / 5"
413,414,TPE TPE,TSENG Min Hao HUANG Mei Ching,-3,0 - 1,"$3,316.86","2,220 / 1"
414,414,IND IND,Kamaldeep SINGH Smriti NAGARKOTI,-3,0 - 1,$253.12,"2,220 / 1"
415,414,IND IND,Rishabh SAHDEV Mohita SAHDEV,-3,0 - 1,"$1,136.25","2,220 / 1"
416,414,IND IND,Varun SHARMA Rachita SAHDEV,-3,0 - 1,$225.00,"2,220 / 1"
417,414,UZB UZB,Amrullo BAKHSHULLAEV Valeriya MUSHTAKOVA,-3,0 - 2,$63.74,"2,220 / 1"
418,414,MAC MAC,WONG Chi Chong Teng Iok U,-3,0 - 2,$0.00,"2,220 / 1"
419,414,CHN CHN,WANG YILYU XIA Huan,-3,5 - 2,"$30,892.50","2,220 / 1"
420,414,IND IND,Manu ATTRI K. Maneesha,-3,4 - 4,"$6,671.22","2,220 / 1"
421,414,KAZ KAZ,Artur NIYAZOV Ilyana FILIPCHUK,-3,0 - 3,$27.50,"2,220 / 1"
422,423,CAN CAN,Pierre-Etienne PILOTE Michelle TONG,-3,0 - 2,$110.61,"2,210 / 2"
423,424,MRI MRI,Yeldy Marie LOUISON Christopher PAUL,-3,5 - 1,$144.36,"2,202 / 2"
424,425,DEN DEN,Lasse MOELHEDE Josephine VAN ZAANE,-3,0 - 0,$0.00,"2,200 / 1"
425,425,CHN CHN,Xiangyu REN XU Ya,-3,0 - 0,$362.50,"2,200 / 1"
426,425,CHN CHN,HAN Chengkai HU Yuxiang,-3,0 - 0,$797.50,"2,200 / 1"
427,425,CHN CHN,DONG Weijie CAO Tong Wei,-3,0 - 0,$362.50,"2,200 / 1"
428,425,CHN CHN,ZHU Junhao TONG Hao,-3,0 - 0,$390.62,"2,200 / 1"
429,425,TUR TUR,Emre SONMEZ Bengisu ERCETIN,-3,0 - 1,$0.00,"2,200 / 1"
430,425,TUR TUR,Mert TUNCO Merve COBAN,-3,2 - 1,$0.00,"2,200 / 1"
431,425,INA INA,Amri SYAHNAWI AZISAH Syafitri Nur,-3,2 - 1,$108.74,"2,200 / 1"
432,425,CRO RUS,Zvonimir HOELBLING Olga MOROZOVA,-3,2 - 1,"$1,643.75","2,200 / 1"
433,425,CAN CAN,PHILLIPE Gaumond Josephine WU,-3,2 - 1,$108.74,"2,200 / 1"
434,425,ENG ENG,ROE Michael Nicola GRESTY,-3,2 - 1,$0.00,"2,200 / 1"
435,425,INA INA,Agripinna Prima Rahmanto PUTRA Syifa FAUZIAH,-3,2 - 1,$407.49,"2,200 / 1"
436,425,UKR UKR,Valeriy ATRASHCHENKOV Natalya VOYTSEKH,-3,1 - 1,"$10,446.49","2,200 / 1"
437,425,ESA ESA,GUARDADO Jassiel Georgina Penelope ORELLANA SANTOS,-3,0 - 1,$108.74,"2,200 / 1"
438,425,INA INA,Angger SUDRAJAT Jenna GOZALI,-3,2 - 1,"$1,620.35","2,200 / 1"
439,425,RUS RUS,Konstantin ABRAMOV Natalia Rogova,-3,2 - 1,$362.50,"2,200 / 1"
440,425,JPN JPN,Akira KOGA Yuki FUKUSHIMA,-3,2 - 1,"$1,104.36","2,200 / 1"
441,425,JPN JPN,Takuto INOUE Naru SHINOYA,-3,2 - 1,"$1,206.86","2,200 / 1"
442,425,DEN DEN,David DAUGAARD Maria HELSBOL,-3,2 - 1,"$3,055.63","2,200 / 1"
443,425,TPE TPE,HUANG Po Jui WU Fang Chien,-3,2 - 1,"$1,479.97","2,200 / 1"
444,425,CHN CHN,GAO Xiangcheng WU Qianqian,-3,2 - 1,$0.00,"2,200 / 1"
445,425,DEN DEN,Frederik SØGAARD MORTENSEN Sara LUNDGAARD,-3,0 - 0,$0.00,"2,200 / 1"
446,425,THA THA,Pakkawat VILAILAK Phataimas MUENWONG,-3,6 - 4,$971.86,"2,200 / 1"
447,425,THA THA,Takdanai BOONRAWD Kilasu OSTERMEYER,-3,1 - 2,$235.61,"2,200 / 1"
448,425,NGR NGR,Enejoh ABAH Tosin Damilola ATOLAGBE,-3,14 - 6,"$1,293.74","2,200 / 1"
449,425,NGR NGR,Ola FAGBEMI Dorcas Ajoke ADESOKAN,-3,23 - 7,"$2,346.86","2,200 / 1"
450,425,USA USA,Mathew FOGARTY Lina TAFT,-3,13 - 19,$248.74,"2,200 / 1"
451,425,IND IND,Pranaav Jerry CHOPRA K. Maneesha,-3,4 - 7,"$7,048.71","2,200 / 1"
452,425,THA THA,Nipitphon PUANGPUAPECH Savitree AMITRAPAI,-3,6 - 4,"$31,160.81","2,200 / 1"
453,425,BAN BAN,Parash Md.AHSUN HABIB Aktar SHAPLA,-3,3 - 2,$346.21,"2,200 / 1"
454,425,SEY SEY,Steve MALCOUZANNE Cynthia COURSE,-3,6 - 4,$14.06,"2,200 / 1"
455,425,NGR NGR,Jinkan Ifraimu BULUS Susan IDEH,-3,14 - 6,"$2,396.86","2,200 / 1"
456,425,CZE CZE,Milan LUDIK Kristina GAVNHOLT,-3,4 - 4,$618.12,"2,200 / 1"
457,458,IND IND,Satinder MALIK Teenu DAHIYA,-3,0 - 0,$56.24,"2,180 / 2"
458,459,MAS SUI,Beryno Jiann Tze WONG Ayla HUSER,-3,1 - 3,$279.37,"2,160 / 3"
459,460,GHA GHA,Daniel SAM Gifty MENSAH,-3,3 - 3,$294.37,"2,130 / 2"
460,461,USA USA,Tony GUNAWAN Mirabelle HUANG,-3,0 - 0,"$15,401.50","2,130 / 1"
461,461,SUR SUR,Dylan DARMOHOETOMO Jill SJAUW - MOOK,-3,3 - 1,$120.00,"2,130 / 1"
462,461,KOR KOR,KIM Dae Sung Ga Ae KANG,-3,3 - 1,$475.00,"2,130 / 1"
463,461,DEN DEN,Maja RINDSHOEJ Kristoffer KNUDSEN,-3,4 - 1,$0.00,"2,130 / 1"
464,461,TUR TUR,Muhammed Ali KURT Kader İNAL,-3,4 - 2,$120.00,"2,130 / 1"
465,461,TPE TPE,Yuan Cheng WU Hsin Tien CHANG,-3,4 - 2,"$1,850.61","2,130 / 1"
466,461,NCL NCL,Loic MENNESSON Johanna KOU,-3,5 - 3,$28.12,"2,130 / 1"
467,461,JOR JOR,Bahaedeen Ahmad ALSHANNIK Domou AMRO,-3,5 - 4,$249.37,"2,130 / 1"
468,461,PER PER,Daniel LA TORRE REGAL Daniela MACIAS,-3,3 - 2,$604.96,"2,130 / 1"
469,461,BRA BRA,Daniel PAIOLA Fabiana SILVA,-3,4 - 7,"$2,834.93","2,130 / 1"
470,471,MEX MEX,Humberto AGUIRRE FAJARDO Yesenia DUARTE,-2,0 - 1,$187.50,"2,110 / 1"
471,471,ENG ENG,Andrew SMITH Jenny WALLWORK,-2,2 - 1,"$22,178.56","2,110 / 1"
472,471,SCO SCO,Martin CAMPBELL Julie MACPHERSON,-2,1 - 1,"$1,187.50","2,110 / 1"
473,471,TPE TPE,HUNG Ying Yuan Pei Shan HSIEH,-2,1 - 1,$225.00,"2,110 / 1"
474,471,TPE TPE,Hsu JUI TING LEE Wei Tzu,-2,1 - 1,$187.50,"2,110 / 1"
475,471,CHN CHN,WANG Sijie OU Dongni,-2,1 - 1,"$6,985.00","2,110 / 1"
476,471,JPN JPN,Kenya MITSUHASHI Chisato HOSHI,-2,1 - 1,$187.50,"2,110 / 1"
477,471,AUS AUS,Edwin LUK Ruwindi SERASINGHE,-2,1 - 1,$9.38,"2,110 / 1"
478,471,AUS AUS,Simon Wing Hang LEUNG Claudia LAM,-2,1 - 1,$82.49,"2,110 / 1"
479,471,NZL NZL,Brock MATHESON Rebecca GODDARD,-2,1 - 1,$149.39,"2,110 / 1"
480,481,SRB SRB,Dragoslav PETROVIC Milica SIMIC,-2,4 - 4,$0.00,"2,090 / 3"
481,482,NZL NZL,Abhinav MANOTA Justine VILLEGAS,-2,1 - 4,$225.00,"2,070 / 3"
482,483,INA INA,Richard KUNCORO Zarra Faza AZKA,-2,1 - 2,$131.24,"2,070 / 2"
483,483,PER PER,Diego MINI Paula LA TORRE REGAL,-2,2 - 3,$56.24,"2,070 / 2"
484,483,CHI CHI,Cristian ARAYA Camila MACAYA,-2,9 - 16,$279.33,"2,070 / 2"
485,483,KEN KEN,Patrick Kinyua MBOGO Mercy JOSEPH,-2,10 - 11,$0.00,"2,070 / 2"
486,487,CZE CZE,Ondrej KOPRIVA Katerina TOMALOVA,-2,7 - 19,$93.75,"2,020 / 3"
487,487,SLO SLO,Primoz FLIS Kaja STANKOVIC,-2,1 - 14,$0.00,"2,020 / 3"
488,489,RUS RUS,Vladimir NIKULOV Daria SEREBRIAKOVA,-2,7 - 6,$0.00,"2,010 / 3"
489,490,NOR NOR,Carl Christian MORK Elisa WIBORG,-2,0 - 7,$0.00,"2,000 / 4"
490,490,NOR NOR,Sturla Flaten JORGENSEN Solvar FLATEN JORGENSEN,-2,0 - 7,$0.00,"2,000 / 4"
491,492,THA THA,Chaloempon CHAROENKITAMORN Panjarat PRANSOPON,53,0 - 0,$81.87,"1,990 / 2"
492,492,TPE TPE,Chi-Lin WANG Chia Hsin LEE,-2,0 - 0,"$5,625.47","1,990 / 2"
493,494,AUS AUS,Cham CHEN Susan WANG,-3,1 - 2,$65.62,"1,950 / 2"
494,494,NZL NZL,Dylan SOEDJASA Justine VILLEGAS,-3,1 - 2,$0.00,"1,950 / 2"
495,494,NZL NZL,Maoni HU HE Ashleigh KARL,-3,0 - 0,$44.38,"1,950 / 2"
496,494,JPN JPN,Daisuke SUZUKI Midori SAKURAI,-3,0 - 0,$56.24,"1,950 / 2"
497,498,TPE TPE,Yu-Hua LAI Shuo Yun SUNG,-3,0 - 0,$148.12,"1,920 / 2"
498,498,FIN FIN,Julius VON PFALER Tuuli HARKONEN,-3,0 - 0,$0.00,"1,920 / 2"
499,498,SUR SUR,Mitchel WONGSODIKROMO Crystal LEEFMANS,-3,0 - 0,$0.00,"1,920 / 2"
500,501,GER GER,Andreas HEINZ Jennifer KARNOTT,-3,0 - 0,"$1,225.00","1,900 / 3"
501,502,NZL NZL,Thomas ELLIS Samantha MCCAMISH,-3,0 - 0,$37.50,"1,890 / 2"
502,503,INA INA,Muhammad Reza Pahlevi ISFAHANI Zarra Faza AZKA,-3,0 - 0,$121.86,"1,880 / 2"
503,503,THA THA,Watchara BURANAKUEA Chaladchalam Chayanit,-3,0 - 0,"$1,155.61","1,880 / 2"
504,505,ENG ENG,Matthew NOTTINGHAM Jessica PUGH,-3,0 - 0,"$2,544.50","1,840 / 2"
505,505,TUR TUR,Mesut SEZER Edanur KOYBASI,-3,0 - 0,$0.00,"1,840 / 2"
506,505,GRE GRE,Panagiotis SKARLATOS Polyvia TZIKA,-3,0 - 0,$0.00,"1,840 / 2"
507,505,INA INA,Indra LESMANA Hera DESI,-3,0 - 0,$0.00,"1,840 / 2"
508,505,RUS RUS,Ilya ZHDANOV Irina KHLEBKO,-3,4 - 7,"$1,325.00","1,840 / 2"
509,505,DEN DEN,Tobias SUDER Line NOERGAARD,-3,0 - 0,$0.00,"1,840 / 2"
510,505,GUA GUA,Brandon SAMAYOA Alejandra SAMAYOA ARREAGA,-3,0 - 0,$56.24,"1,840 / 2"
511,512,IND IND,Shlok RAMCHANDRAN J. Meghana,-3,4 - 4,$56.24,"1,800 / 2"
512,513,MAS MAS,"Ahmad Maziri MAZLAN Peiy Yee, Payee LIM",-3,0 - 0,$37.50,"1,790 / 3"
513,514,CZE CZE,IVO Stoklas Denisa SIKALOVA,-3,0 - 0,$0.00,"1,770 / 4"
514,515,FRA FRA,Thom GICQUEL Vimala HERIAU,-3,0 - 0,$0.00,"1,770 / 2"
515,516,ISR ISR,Ariel SHAINSKI Pugach ALINA,-3,0 - 0,$0.00,"1,756 / 1"
516,517,USA USA,Shawn WHONG Lulu YU,-3,0 - 0,$0.00,"1,750 / 1"
517,517,BOT BOT,Tlamelang KEPALETSWE Penouua KAHAKA,-3,0 - 0,$0.00,"1,750 / 1"
518,517,RSA RSA,James Hilton MCMANUS Jade KRAEMER,-3,0 - 0,$28.12,"1,750 / 1"
519,517,RSA RSA,Dorian JAMES Shereen MATTHEWS,-3,0 - 0,$0.00,"1,750 / 1"
520,517,ZAM ZAM,Chongo Ezra MULENGA Mary CHILAMBE,-3,0 - 0,$0.00,"1,750 / 1"
521,517,DEN DEN,Mikkel MIKKELSEN Mai SURROW,-3,0 - 0,$500.00,"1,750 / 1"
522,517,BRN BRN,Heri SETIAWAN Sandra SAKARIA,-3,0 - 0,$750.60,"1,750 / 1"
523,517,NCL NCL,Yohan DE GEOFFROY Soizick HO-YAGUES,-3,0 - 0,$0.00,"1,750 / 1"
524,517,NCL NCL,Ronan HO-YAGUES Dgenyva MATAULI,-3,0 - 0,$0.00,"1,750 / 1"
525,517,JOR JOR,Quasi ABID Razan ALKOTOP,-3,0 - 0,$0.00,"1,750 / 1"
526,517,BRA BRA,Rafael LAJUSTICIA Estefane VENTURA,-3,0 - 0,$0.00,"1,750 / 1"
527,517,ARG ARG,Lucio CORONATO Ana MONTEFINALE,-3,0 - 0,$0.00,"1,750 / 1"
528,517,INA INA,Hardianto HARDIANTO Ulfa ZAKIA,-3,0 - 0,$861.88,"1,750 / 1"
529,517,KOR KOR,Yong Hoon JIN OH Bo Kyung,-3,0 - 0,$355.00,"1,750 / 1"
530,517,KOR KOR,LEE Cheol Ho Min Ji CHOI,-3,0 - 0,$70.00,"1,750 / 1"
531,517,CZE CZE,Jan FROHLICH Veronika KOLDOVA,-3,0 - 0,$0.00,"1,750 / 1"
532,517,TPE TPE,Ming-Tse YANG Wan Ting CHEN,-3,0 - 0,$46.24,"1,750 / 1"
533,517,MRI MRI,Aatish LUBAH Kobita DOKHEE,-3,0 - 0,$0.00,"1,750 / 1"
534,517,INA INA,Ramadiansyah ANDIKA Mychelle Crhystine BANDASO,-3,0 - 0,$88.75,"1,750 / 1"
535,517,FIN FIN,Arttu MAHONEN Sonja PEKKOLA,-3,0 - 0,$0.00,"1,750 / 1"
536,517,JAM JAM,Willroy MILES Katherine WYNTER,-3,0 - 0,$0.00,"1,750 / 1"
537,517,JAM JAM,Dennis COKE Mikaylia HALDANE,-3,0 - 0,$0.00,"1,750 / 1"
538,517,ZAM ZAM,Mark BANDA Evelyn SIAMUPANGILA,-3,0 - 0,$0.00,"1,750 / 1"
539,517,COL COL,Barrientos MATEO Laura SANCHEZ,-3,0 - 0,$0.00,"1,750 / 1"
540,517,NZL NZL,Kevin DENNERLY-MINTURN Susannah LEYDON-DAVIS,-3,0 - 0,"$1,193.76","1,750 / 1"
541,517,NED NED,Jelle MAAS Ilse VAESSEN,-3,0 - 0,"$4,447.25","1,750 / 1"
542,517,FIN FIN,Anton KAISTI Jenny NYSTROM,-3,0 - 0,"$2,600.00","1,750 / 1"
543,517,NGR NGR,Olorunfemi ELEWA Braimoh MARIA,-3,0 - 0,$314.37,"1,750 / 1"
544,545,POL POL,Maciej DABROWSKI Weronika GRUDZINA,-3,0 - 0,$0.00,"1,730 / 2"
545,546,DEN FRA,Soeren TOFT HANSEN Teshana VIGNES WARAN,-3,0 - 0,$785.00,"1,700 / 1"
546,546,ISR BLR,Ariel SHAINSKI Krestina SILICH,-3,0 - 0,$0.00,"1,700 / 1"
547,548,THA THA,Viriyangkura TANUPAT Thanyasuda WONGYA,106,0 - 0,$228.74,"1,690 / 2"
548,549,SIN THA,Chayut TRIYACHART Natcha SAENGCHOTE,0,0 - 0,"$15,840.83","1,670 / 1"
549,549,THA THA,Kittisak NAMDASH Natthakorn JAIAREREE,0,0 - 0,$37.50,"1,670 / 1"
550,549,HKG HKG,TANG Chun Man NG Tsz Yau,0,0 - 0,"$1,798.12","1,670 / 1"
551,549,IND IND,Chandrabhusan TRIPATHI D. Sudha Kalyani,-4,0 - 0,$435.00,"1,670 / 1"
552,549,IND IND,Bhaskar CHAKRABORTY Rachita SAHDEV,-4,0 - 0,$225.00,"1,670 / 1"
553,549,IND IND,Manu ATTRI Ashwini PONNAPPA,-4,0 - 0,"$10,152.48","1,670 / 1"
554,549,IND IND,Kamaldeep SINGH Komal ANTIL,-4,0 - 0,$28.12,"1,670 / 1"
555,549,IND IND,Aditya NAIR Smriti NAGARKOTI,-4,0 - 0,$225.00,"1,670 / 1"
556,549,TPE TPE,Jhe-Huei LEE Szu Yu CHEN,-4,0 - 0,$945.60,"1,670 / 1"
557,549,INA INA,Hendra TANDJAYA Monika Intan TUTIHARTA,-4,0 - 0,$0.00,"1,670 / 1"
558,549,INA INA,Riky WIDIANTO Annisa SAUFIKA,-4,0 - 0,"$63,834.19","1,670 / 1"
559,549,TPE TPE,YANG Po Han CHEN Shih Ying,-4,0 - 0,$693.74,"1,670 / 1"
560,549,TPE TPE,Wei Chen LIU HUNG Shih Han,-4,0 - 0,$112.48,"1,670 / 1"
561,549,TPE TPE,Yuan Cheng WU Shuo Yun SUNG,-4,0 - 0,$203.74,"1,670 / 1"
562,549,TPE TPE,YANG Po-Hsuan Su Yu CHEN,-4,0 - 0,$227.49,"1,670 / 1"
563,549,NZL TPE,Oliver LEYDON-DAVIS Xiao Min LIN,-4,0 - 0,"$1,132.48","1,670 / 1"
564,549,NED TPE,Ruud BOSCH Wan Ching LIN,-4,0 - 0,"$3,825.37","1,670 / 1"
565,549,TPE TPE,HUANG Po Jui CHIANG Kai Hsin,-4,0 - 0,"$1,578.09","1,670 / 1"
566,549,TPE TPE,TIEN Tzu Chieh WU Fang Chien,-4,0 - 0,$560.58,"1,670 / 1"
567,549,INA INA,Didit JUANG Aprilsasi Putri LEJARSAR VARIELLA,-4,0 - 0,"$1,894.37","1,670 / 1"
568,549,CHN CHN,LIU Yuchen ZHONG Qianxin,-4,0 - 0,"$20,525.62","1,670 / 1"
569,549,CHN CHN,HE Jiting JIA Yifan,-4,0 - 0,"$3,873.12","1,670 / 1"
570,549,AUS AUS,Alphonsus NG Ruwindi SERASINGHE,-4,0 - 0,$9.38,"1,670 / 1"
571,549,NZL NZL,Brock MATHESON Angie LEUNG,-4,0 - 0,$149.39,"1,670 / 1"
572,549,NZL TPE,Joe WU HUNG Shih Han,-4,0 - 0,"$1,826.54","1,670 / 1"
573,549,CHN CHN,LI Junhui ZHONG Qianxin,-4,0 - 0,"$4,668.75","1,670 / 1"
574,549,TPE TPE,LU Chia Pin Chien Hui YU,-4,0 - 0,"$2,132.48","1,670 / 1"
575,549,FRA FRA,Bastian KERSAUDY Lorraine BAUMANN,-4,0 - 0,$649.99,"1,670 / 1"
576,549,FRA FRA,Ronan GUEGUIN Joanna CHAUBE,-4,0 - 0,$500.00,"1,670 / 1"
577,549,CHN CHN,YU Xiaoyu ZHU Mai Ci,-4,0 - 2,"$2,505.00","1,670 / 1"
578,549,SUI BUL,Gilles TRIPET Diana DIMOVA,-4,0 - 0,"$3,654.64","1,670 / 1"
579,549,INA INA,Arya Maulana ADIARTAMA Febriani Endar KUSUMAWATI,-4,0 - 0,$92.51,"1,670 / 1"
580,549,CHN CHN,ZHANG Wen OU Dongni,-4,0 - 0,"$6,410.00","1,670 / 1"
581,549,JPN JPN,Ryota TAOHATA Koharu YONEMOTO,-4,0 - 0,"$13,373.08","1,670 / 1"
582,549,TPE TPE,LIANG Jui Wei Chia Hsin LEE,-4,0 - 0,"$2,844.98","1,670 / 1"
583,584,NZL NZL,Kent PALMER Emma CHAPPLE,-6,0 - 0,$348.76,"1,610 / 2"
584,585,NOR NOR,Fredrik KRISTENSEN Natalie SYVERTSEN,-6,0 - 0,$0.00,"1,600 / 4"
585,586,FRA MRI,Florent RIANCHO Kate FOO KUNE,-6,0 - 0,$542.18,"1,580 / 2"
586,587,ALG ALG,Adel HAMEK Baya NESRINE,-6,0 - 0,$0.00,"1,522 / 2"
587,588,NZL INA,Valens SULAIMAN Dwi Wahyuni ASHYARIATY,-6,0 - 0,$187.50,"1,520 / 1"
588,588,CHN CHN,OU Xuanyi SHEN Lingjie,-6,0 - 0,$187.50,"1,520 / 1"
589,588,VIE VIE,Hong Nam PHAM Thu Huyen LE,-6,0 - 0,"$1,042.49","1,520 / 1"
590,588,CHN CHN,Chengming REN Fanghui CHEN,-6,0 - 0,$187.50,"1,520 / 1"
591,588,CHN CHN,Yinzhi TANG Yuting XIA,-6,0 - 0,$187.50,"1,520 / 1"
592,588,CHN CHN,Shiwen LIU Siqi WANG,-6,0 - 0,$187.50,"1,520 / 1"
593,588,IND IND,Utkarsh ARORA Nimmi PATEL,-6,0 - 0,$281.24,"1,520 / 1"
594,588,IND IND,Kamaldeep SINGH Dhanya NAIR,-6,0 - 0,$74.36,"1,520 / 1"
595,588,GER GER,Raphael BECK Barbara BELLENBERG,-6,0 - 0,$318.75,"1,520 / 1"
596,588,IRL IRL,Paul REYNOLDS Moya RYAN,-6,0 - 0,$0.00,"1,520 / 1"
597,588,INA INA,Sandy I KOMANG Jenna GOZALI,-6,0 - 0,"$1,675.35","1,520 / 1"
598,588,CAN CAN,Maxime MARIN Stephanie PAKENHAM,-6,0 - 0,$161.24,"1,520 / 1"
599,588,ENG ENG,David JONES Freya PATEL-REDFEARN,-6,0 - 0,$0.00,"1,520 / 1"
600,588,TPE TPE,Jhe-Huei LEE Ya-Han CHANG,-6,0 - 0,$716.24,"1,520 / 1"
601,588,TPE TPE,Yuan Cheng WU Yu Chen CHANG,-6,0 - 0,$83.74,"1,520 / 1"
602,588,CHI CHI,Cristobal CAMPOS Nicole NAVARRETE,-6,0 - 0,$108.74,"1,520 / 1"
603,588,CHI CHI,Sebastian MARTINEZ Nicol SALINAS,-6,0 - 0,$108.74,"1,520 / 1"
604,588,ENG ENG,Ben LANE Emily WESTWOOD,-6,0 - 0,"$2,957.00","1,520 / 1"
605,588,AUS INA,Michael FARIMAN Sylvina KURNIAWAN,-6,0 - 0,$339.37,"1,520 / 1"
606,588,GHA GHA,Emmanuel YAW DONKOR Victoria ASMAH,-6,0 - 0,$0.00,"1,520 / 1"
607,588,NGR NGR,Clement KROBAKPO Augustina EBHOMIEN SUNDAY,-6,0 - 0,$0.00,"1,520 / 1"
608,588,GUA GUA,Christopher Alexander MARTINEZ SALVADOR Alejandra Jose PAIZ QUAN,-6,0 - 0,$28.12,"1,520 / 1"
609,588,NGR NGR,Joshua Adeyemi ODELABI Fatima AZEEZ,-6,0 - 0,$56.24,"1,520 / 1"
610,588,RUS RUS,Sergey SCHERBIN Anastasia NAZARCHUK,-6,0 - 0,$0.00,"1,520 / 1"
611,588,MAS MAS,Ahmad Maziri MAZLAN Sannatasah SANIRU,-6,0 - 0,"$1,360.60","1,520 / 1"
612,588,PER PER,Javier JIMENO Sandra JIMENO GOICOCHEA,-6,0 - 0,$56.24,"1,520 / 1"
613,588,JPN JPN,Kento SAKAI Hikari SAITO,-6,0 - 0,$56.24,"1,520 / 1"
614,588,THA THA,Trawut POTIENG Pacharapun CHOCHUWONG,-6,0 - 0,$481.85,"1,520 / 1"
615,588,THA THA,Parinyawat THONGNUAM Chaladchalam Chayanit,-6,0 - 0,"$1,249.35","1,520 / 1"
616,588,SIN SIN,Bimo Adi PRAKOSO Yu Yan Vanessa NEO,-6,0 - 0,"$37,495.62","1,520 / 1"
617,588,GUA PER,Rodolfo RAMIREZ Camila DUANY,-6,0 - 0,$138.73,"1,520 / 1"
618,588,ENG GER,Matthew NOTTINGHAM Jennifer KARNOTT,-6,0 - 0,"$2,044.50","1,520 / 1"
619,588,CHN CHN,YU Chen XIA Chunyu,-6,0 - 0,$0.00,"1,520 / 1"
620,588,IRL IRL,Sam MAGEE Rachael DARRAGH,-6,0 - 0,"$11,276.24","1,520 / 1"
621,588,ITA ESP,Wisnu Haryo PUTRO Laia OSET,-6,0 - 0,$54.37,"1,520 / 1"
622,588,NEP NEP,Ratnajit TAMANG Sara Devi TAMANG,-6,0 - 0,$128.73,"1,520 / 1"
623,588,CHN CHN,HUANG Kaixiang JIA Yifan,-6,0 - 0,"$18,718.74","1,520 / 1"
624,588,AUS AUS,Bernhard HALIM Elena Yee-Man KWOK,-6,0 - 0,$0.00,"1,520 / 1"
625,588,SWE SWE,Toni HOLM-LOWEN Berfin ASLAN,-6,0 - 0,$0.00,"1,520 / 1"
626,588,INA INA,Muhammad Rian ARDIANTO Rosyita Eka PUTRI SARI,-6,0 - 0,$632.49,"1,520 / 1"
627,588,INA INA,Yodhi SATRIO Wulan Sari SRI,-6,0 - 0,$744.37,"1,520 / 1"
628,588,RUS RUS,Aleksandr VASILKIN Kristina VIRVICH,-6,0 - 0,$0.00,"1,520 / 1"
629,588,JPN JPN,Naoki ISHIKAWA Atsuko KOIKE,-6,0 - 0,$112.48,"1,520 / 1"
630,588,BAN BAN,Chand LAL MST Rehana PARVIN,-6,0 - 0,$147.48,"1,520 / 1"
631,588,DEN DEN,Theodor JOHANSEN Isabella NIELSEN,-6,0 - 0,$0.00,"1,520 / 1"
632,588,FRA FRA,Thomas ROUXEL Lea PALERMO,-6,0 - 0,$678.11,"1,520 / 1"
633,588,BRA BRA,Luiz dos SANTOS JR Ana Paula CAMPOS,-6,0 - 0,$555.58,"1,520 / 1"
634,588,RUS RUS,Gordey KOSENKO Olga LIPKINA,-6,0 - 0,$830.62,"1,520 / 1"
635,588,SRI SRI,Hasitha Chanaka MANANI HEWA Kavindi Ishandika SIRIMANNAGE,-6,0 - 0,$721.24,"1,520 / 1"
636,588,KEN KEN,Matheri Joseph GITHITU Lavina MARTINS,-6,0 - 0,$0.00,"1,520 / 1"
637,588,RUS RUS,Tatjana BIBIK Nikolai UKK,-6,0 - 0,"$2,972.50","1,520 / 1"
638,639,CZE CZE,Bedrich VALENTA Veronika KOLDOVA,-6,0 - 0,$0.00,"1,500 / 4"
639,640,DEN SWE,Andreas HOFFMANN Berfin ASLAN,-6,0 - 0,$0.00,"1,470 / 2"
640,640,AUS AUS,Blake HAGGERTY Chloe LEE,-6,0 - 0,$0.00,"1,470 / 2"
641,640,NZL NZL,Niccolo TAGLE Sally FU,-6,0 - 0,$0.00,"1,470 / 2"
642,640,TUR TUR,Semih OZKAN Dilek OZKAN,-6,0 - 0,$0.00,"1,470 / 2"
643,640,POL POL,Pawel SMILOWSKI Magdalena SWIERCZYNSKA,-6,0 - 0,$0.00,"1,470 / 2"
644,640,THA THA,Natchanon TULAMOK Pattaranan CHAMNAKTAN,-6,0 - 0,$56.24,"1,470 / 2"
645,640,DOM DOM,Nelson JAVIER Bermary Altagracia POLANCO MUNOZ,-6,0 - 0,$168.72,"1,470 / 2"
646,640,CHI CHI,Bastian LIZAMA Niria BAEZA,-6,0 - 0,$0.00,"1,470 / 2"
647,640,INA INA,Gea KAMAHAMAS Brigita Marcelia RUMAMBI,-6,0 - 0,$0.00,"1,470 / 2"
648,640,TPE TPE,Chia-Han LEE Wen Chi HSU,-6,0 - 0,$235.00,"1,470 / 2"
649,640,NZL NZL,Dylan SOEDJASA Alyse DERBY,-6,0 - 0,$9.38,"1,470 / 2"
650,640,AUT CZE,Dominik STIPSITS Katerina TOMALOVA,-6,0 - 0,$93.75,"1,470 / 2"
651,640,PER PER,Leonardo ISA Chiara CARRANZA,-6,0 - 0,$56.24,"1,470 / 2"
652,640,FRA FRA,Ronan GUEGUIN Verlaine FAULMANN,-6,0 - 0,$0.00,"1,470 / 2"
653,640,BRN BRN,Rohit JAYKUMAR Sapna PRABHU,-6,0 - 0,$83.12,"1,470 / 2"
654,640,TRI TRI,Nicholas BONKOWSKY Solangel GUZMAN,-6,0 - 0,$0.00,"1,470 / 2"
655,640,FIN FIN,Tuomas NUORTEVA Sanni RAUTALA,-6,0 - 0,$121.01,"1,470 / 2"
656,657,ENG ENG,Oliver BACZALA Victoria WILLIAMS,-6,0 - 0,$500.00,"1,440 / 2"
657,658,GHA GHA,Gifty MENSAH Emmanuel YAW DONKOR,795,0 - 0,$120.00,"1,422 / 2"
658,659,ISR ISR,Lior KROYTER Dana KUGEL,-7,0 - 0,$0.00,"1,420 / 1"
659,660,MAS MAS,Mohd Lutfi Zaim ABDUL KHALID Fie Cho SOONG,-7,6 - 13,"$4,675.59","1,400 / 2"
660,661,ENG ENG,Christopher COLES Sarah WALKER,-7,0 - 0,"$1,000.00","1,370 / 1"
661,661,FIN FIN,Lauri NUORTEVA Linnea VAINULA,-7,0 - 0,$0.00,"1,370 / 1"
662,661,GER GER,Jan Colin VÖLKER Judith PETRIKOWSKI,-7,0 - 0,$0.00,"1,370 / 1"
663,661,RSA RSA,Enrico JAMES Lee-Ann DE WET,-7,0 - 0,$28.12,"1,370 / 1"
664,661,RSA RSA,Patric KRAEMER Stacey DOUBELL,-7,0 - 0,$28.12,"1,370 / 1"
