,RANK,COUNTRY,PLAYER,CHANGE +/-,WIN - LOSE,PRIZE MONEY,POINTS / TOURNAMENTS
370,363,CHN CHN,ZHANG Wen XIA Huan,-3,0 - 0,,"2,720 / 1"
371,363,IND IND,Sanyam SHUKLA Sanyogita GHORPADE,-3,0 - 0,,"2,720 / 1"
372,363,NZL IND,Abhinav MANOTA Rachita SAHDEV,-3,0 - 0,,"2,720 / 1"
373,363,GER GER,Andreas HEINZ Annika HORBACH,-3,0 - 0,,"2,720 / 1"
374,375,FRA FRA,Vincent ESPEN Manon KRIEGER,-4,0 - 0,,"2,700 / 6"
375,376,INA INA,Hendrik K CLINTON Phita Haningtyas MENTARI,-4,0 - 0,,"2,670 / 2"
376,376,RUS RUS,Artem SERPIONOV Tatjana BIBIK,-4,0 - 0,,"2,670 / 2"
377,376,DEN DEN,Philip SEERUP Irina Amalie ANDERSEN,-4,0 - 0,,"2,670 / 2"
378,376,NGR NGR,Idowu Timothy ADEKUNLE Asisat OGUNKANBI,-4,0 - 0,,"2,670 / 2"
379,376,INA INA,Reinard DHANRIANO Sinta Arum ANTASARI,-4,0 - 0,,"2,670 / 2"
380,381,THA THA,Sudket PRAPAKAMOL Sapsiree TAERATTANACHAI,-4,0 - 0,,"2,660 / 1"
381,382,SLO SLO,Martin CERKOVNIK Ana Marija SETINA,-4,0 - 0,,"2,640 / 3"
382,383,HKG HKG,YEUNG Shing Choi CHAN Hung Yung,-4,0 - 0,,"2,620 / 2"
383,384,DEN DEN,Mathias BAY-SMIDT Nanna VESTERGAARD,-4,0 - 0,,"2,600 / 3"
384,385,UZB UZB,Amrullo BAKHSHULLAEV Anait KHURSHUDYAN,-4,0 - 0,,"2,590 / 5"
385,386,NZL NZL,Kevin DENNERLY-MINTURN Danielle TAHURI,-4,0 - 0,,"2,590 / 2"
386,386,INA INA,Afiat Yuris WIRAWAN Jenna GOZALI,-4,0 - 0,,"2,590 / 2"
387,386,CHN CHN,YU Xiaoyu ZHU Mai Ci,-4,0 - 0,,"2,590 / 2"
388,386,SUI BUL,Gilles TRIPET Diana DIMOVA,-4,0 - 0,,"2,590 / 2"
389,390,SLO SLO,Primoz FLIS Kaja STANKOVIC,-4,0 - 0,,"2,570 / 4"
390,391,NOR NOR,Fredrik KRISTENSEN Natalie SYVERTSEN,-2,0 - 0,,"2,520 / 5"
391,392,TPE TPE,Yu-Hua LAI Shuo Yun SUNG,-2,0 - 0,,"2,520 / 4"
392,393,NZL NZL,Dhanny OUD Jasmin Chung Man NG,-2,0 - 0,,"2,510 / 4"
393,394,BRA BRA,Alex Yuwan TJONG Fabiana SILVA,-2,0 - 0,,"2,500 / 1"
394,394,KOR KOR,KIM Young Sun Ja Yeong LEE,-2,0 - 0,,"2,500 / 1"
395,394,CRO CRO,Zvonimir DURKINJAK Mateja CICA,-2,0 - 0,,"2,500 / 1"
396,394,TPE TPE,Chia-Han LEE Chia Hsin LEE,-2,0 - 0,,"2,500 / 1"
397,394,DEN DEN,Nicklas MATHIASEN Cecilie BJERGEN,-2,0 - 0,,"2,500 / 1"
398,394,INA INA,Rian SWASTEDIAN Masita MAHMUDIN,-2,0 - 0,,"2,500 / 1"
399,400,TPE TPE,Li-Wei PO Hsin-Yu TSAI,-2,0 - 0,,"2,470 / 3"
400,401,ETH ETH,TEKLU Endale Yerusksew Legssey TURA,-2,0 - 0,,"2,442 / 3"
401,402,BUL BUL,Alex VLAAR Petya NEDELCHEVA,-2,0 - 0,,"2,440 / 2"
402,402,SWE SWE,Toni HOLM-LOWEN Berfin ASLAN,-2,0 - 0,,"2,440 / 2"
403,402,BUL NED,Alex VLAAR Cheryl SEINEN,-65,0 - 0,,"2,440 / 2"
404,405,INA INA,Agripinna Prima Rahmanto PUTRA Aprilsasi Putri LEJARSAR VARIELLA,-3,0 - 0,,"2,400 / 2"
405,406,INA INA,Fachriza ABIMANYU Syifa FAUZIAH,-3,0 - 0,,"2,390 / 3"
406,406,THA THA,Panachai WORASAKTYANAN Rawimon IAMRATANAMAETHEEKUL,-3,0 - 0,,"2,390 / 3"
407,406,POL POL,Milosz BOCHAT WITEK MAGDALENA,-3,0 - 0,,"2,390 / 3"
408,409,MAS MAS,"Zhen Ting LIM Peiy Yee, Payee LIM",-2,0 - 0,,"2,320 / 3"
409,410,SLO SLO,Miha IVANIC Lia SALEHAR,-2,0 - 0,,"2,290 / 2"
410,410,PHI PHI,Christian BERNARDO Eleanor Christine INLAYO,-2,0 - 0,,"2,290 / 2"
411,410,UZB BLR,Artyom SAVATYUGIN Alesia ZAITSAVA,-2,0 - 0,,"2,290 / 2"
412,410,PER PER,Daniel LA TORRE REGAL Camilla GARCIA,-2,0 - 0,,"2,290 / 2"
413,410,UZB RUS,Artyom SAVATYUGIN Polina VORONKO,-2,0 - 0,,"2,290 / 2"
414,410,UKR UKR,Valeriy ATRASHCHENKOV Yelyzaveta ZHARKA,-22,0 - 0,,"2,290 / 2"
415,410,SIN SIN,Bimo Adi PRAKOSO Citra Dewi SARI,-2,0 - 0,,"2,290 / 2"
416,410,NGR NGR,Ayila GWAMBEH Patricia AKPUSUGH,-2,0 - 0,,"2,290 / 2"
417,410,GRE GRE,George GALVAS Zoi ALELI,-2,0 - 0,,"2,290 / 2"
418,410,AUS AUS,Ashwant GOBINATHAN Alice WU,-2,0 - 0,,"2,290 / 2"
419,420,POL POL,Maciej DABROWSKI Weronika GRUDZINA,-3,0 - 0,,"2,280 / 3"
420,421,SUI SUI,Pierrick DESCHENAUX Tiffany GIRONA,-3,0 - 0,,"2,240 / 6"
421,422,IND IND,Kamaldeep SINGH Smriti NAGARKOTI,-3,0 - 0,,"2,220 / 1"
422,422,IND IND,Rishabh SAHDEV Mohita SAHDEV,-3,0 - 0,,"2,220 / 1"
423,422,IND IND,Varun SHARMA Rachita SAHDEV,-3,0 - 0,,"2,220 / 1"
424,422,IND IND,Rajat RATHORE Parssa NAQVI,-3,0 - 0,,"2,220 / 1"
425,422,DEN DEN,Joachim FISCHER NIELSEN Marie ROEPKE,-3,0 - 0,,"2,220 / 1"
426,422,UZB UZB,Amrullo BAKHSHULLAEV Valeriya MUSHTAKOVA,-3,0 - 0,,"2,220 / 1"
427,422,MAC MAC,WONG Chi Chong Teng Iok U,-3,0 - 0,,"2,220 / 1"
428,422,CHN CHN,WANG YILYU XIA Huan,-3,0 - 0,,"2,220 / 1"
429,422,FRA FRA,Sebastien VINCENT Andréa VANDERSTUKKEN,-3,0 - 0,,"2,220 / 1"
430,422,KAZ KAZ,Artur NIYAZOV Ilyana FILIPCHUK,-3,0 - 0,,"2,220 / 1"
431,432,GER GER,Raphael BECK Jennifer KARNOTT,363,0 - 0,,"2,210 / 2"
432,432,ENG ENG,James LAUDER Ira BANERJEE,-3,0 - 0,,"2,210 / 2"
433,432,ENG ENG,Scott P WILLIAMS Jessica HOPTON,-3,0 - 0,,"2,210 / 2"
434,432,ENG ENG,Matthew CLARE Devon MINNIS,-3,0 - 0,,"2,210 / 2"
435,432,TPE TPE,Yi-Hsiang YANG Yu Chen CHANG,-3,0 - 0,,"2,210 / 2"
436,437,MRI MRI,Yeldy Marie LOUISON Christopher PAUL,-4,0 - 0,,"2,202 / 2"
437,438,UKR UKR,Valeriy ATRASHCHENKOV Natalya VOYTSEKH,-4,0 - 0,,"2,200 / 1"
438,438,ESA ESA,GUARDADO Jassiel Georgina Penelope ORELLANA SANTOS,-4,0 - 0,,"2,200 / 1"
439,438,INA INA,Angger SUDRAJAT Jenna GOZALI,-4,0 - 0,,"2,200 / 1"
440,438,RUS RUS,Konstantin ABRAMOV Natalia Rogova,-4,0 - 0,,"2,200 / 1"
441,438,JPN JPN,Akira KOGA Yuki FUKUSHIMA,-4,0 - 0,,"2,200 / 1"
442,438,JPN JPN,Takuto INOUE Naru SHINOYA,-4,0 - 0,,"2,200 / 1"
443,438,DEN DEN,David DAUGAARD Maria HELSBOL,-4,0 - 0,,"2,200 / 1"
444,438,TPE TPE,LU Ching Yao CHIANG Kai Hsin,-4,0 - 0,,"2,200 / 1"
445,438,TPE TPE,HUANG Po Jui WU Fang Chien,-4,0 - 0,,"2,200 / 1"
446,438,CHN CHN,GAO Xiangcheng WU Qianqian,-4,0 - 0,,"2,200 / 1"
447,438,CHN CHN,GUO Yuchen ZHENG Yuwen,-4,0 - 0,,"2,200 / 1"
448,438,THA THA,Wasapon UTTAMANG Thanaporn KIAWCHA-ON,-4,0 - 0,,"2,200 / 1"
449,438,IND IND,S. Sanjeeth G. M. Nischitha,-4,0 - 0,,"2,200 / 1"
450,438,IND IND,Chirag SHETTY Kuhoo GARG,-4,0 - 0,,"2,200 / 1"
451,438,IND IND,KONA Tarun Prajakta SAWANT,-4,0 - 0,,"2,200 / 1"
452,438,ITA ESP,Wisnu Haryo PUTRO Laia OSET,-4,0 - 0,,"2,200 / 1"
453,438,IND IND,Satinder MALIK Kristi DAS,-4,0 - 0,,"2,200 / 1"
454,438,INA INA,Rian SWASTEDIAN Nisak Puji LESTARI,-4,0 - 0,,"2,200 / 1"
455,438,INA INA,Hardianto HARDIANTO Maretha Dea GIOVANI,-4,0 - 0,,"2,200 / 1"
456,438,MAS MAS,Ren Cong CHAN Lyddia Yi Yu CHEAH,-4,0 - 0,,"2,200 / 1"
457,438,TPE TPE,HUNG Ying Yuan YANG Ching Tun,-4,0 - 0,,"2,200 / 1"
458,438,JPN JPN,Takuro HOKI Kurumi YONAO,-4,0 - 0,,"2,200 / 1"
459,438,INA INA,Afiat Yuris WIRAWAN Ririn AMELIA,-4,0 - 0,,"2,200 / 1"
460,438,THA THA,Pakkawat VILAILAK Phataimas MUENWONG,-4,0 - 0,,"2,200 / 1"
461,438,THA THA,Takdanai BOONRAWD Kilasu OSTERMEYER,-4,0 - 0,,"2,200 / 1"
462,438,NGR NGR,Enejoh ABAH Tosin Damilola ATOLAGBE,-4,0 - 0,,"2,200 / 1"
463,438,NGR NGR,Ola FAGBEMI Dorcas Ajoke ADESOKAN,-4,0 - 0,,"2,200 / 1"
464,438,USA USA,Mathew FOGARTY Lina TAFT,-4,0 - 0,,"2,200 / 1"
465,438,CHN CHN,LI Junhui OU Dongni,-4,0 - 0,,"2,200 / 1"
466,438,THA THA,Nipitphon PUANGPUAPECH Savitree AMITRAPAI,-4,0 - 0,,"2,200 / 1"
467,438,SEY SEY,Steve MALCOUZANNE Cynthia COURSE,-4,0 - 0,,"2,200 / 1"
468,438,PAK PAK,Rizwan AZAM Sara MOHMAND,-4,0 - 0,,"2,200 / 1"
469,438,NGR NGR,Jinkan Ifraimu BULUS Susan IDEH,-4,0 - 0,,"2,200 / 1"
470,438,CZE CZE,Milan LUDIK Kristina GAVNHOLT,-4,0 - 0,,"2,200 / 1"
471,472,SWE SWE,Christian PETTERSON Amanda ANDERN,-4,0 - 0,,"2,190 / 4"
472,473,MAS SUI,Beryno Jiann Tze WONG Ayla HUSER,-4,0 - 0,,"2,160 / 3"
473,474,GHA GHA,Daniel SAM Gifty MENSAH,-4,0 - 0,,"2,130 / 2"
474,475,KOR KOR,KIM Dae Sung Ga Ae KANG,-4,0 - 0,,"2,130 / 1"
475,475,TUR TUR,Serdar KOCA Emine DEMIRTAS,-4,0 - 0,,"2,130 / 1"
476,475,DEN DEN,Maja RINDSHOEJ Kristoffer KNUDSEN,-4,0 - 0,,"2,130 / 1"
477,475,DEN DEN,Lasse MOELHEDE Trine VILLADSEN,-4,0 - 0,,"2,130 / 1"
478,475,RSA RSA,Prakash VIJAYANATH Stacey DOUBELL,-4,0 - 0,,"2,130 / 1"
479,475,TUR TUR,Muhammed Ali KURT Kader İNAL,-4,0 - 0,,"2,130 / 1"
480,475,TPE TPE,Yuan Cheng WU Hsin Tien CHANG,-4,0 - 0,,"2,130 / 1"
481,475,JOR JOR,Bahaedeen Ahmad ALSHANNIK Domou AMRO,-4,0 - 0,,"2,130 / 1"
482,475,PER PER,Daniel LA TORRE REGAL Daniela MACIAS,-4,0 - 0,,"2,130 / 1"
483,484,HKG HKG,OR Chin Chung CHAN Kaka Tsz Ka,-4,0 - 0,,"2,120 / 5"
484,485,CHN CHN,WANG Sijie OU Dongni,-4,0 - 0,,"2,110 / 1"
485,485,JPN JPN,Kenya MITSUHASHI Chisato HOSHI,-4,0 - 0,,"2,110 / 1"
486,485,AUS AUS,Edwin LUK Ruwindi SERASINGHE,-4,0 - 0,,"2,110 / 1"
487,485,AUS AUS,Simon Wing Hang LEUNG Claudia LAM,-4,0 - 0,,"2,110 / 1"
488,485,NZL NZL,Brock MATHESON Rebecca GODDARD,-4,0 - 0,,"2,110 / 1"
489,485,CAN CAN,Felix DEBLOIS-BEAUCAGE Nadianie OUAQOUAQ-BERGERON,-4,0 - 0,,"2,110 / 1"
490,485,JPN JPN,Kenta KAZUNO Yui MIYAUCHI,-4,0 - 0,,"2,110 / 1"
491,485,ENG WAL,Conor BAMBRICK Aimee MORAN,-4,0 - 0,,"2,110 / 1"
492,493,IND IND,Harinder MALIK Teenu DAHIYA,-2,0 - 0,,"2,100 / 2"
493,493,IND IND,Gaurav KALIA Ekta KALIA,-2,0 - 0,,"2,100 / 2"
494,493,HKG HKG,WONG Wai Hong CHAN Hung Yung,-2,0 - 0,,"2,100 / 2"
495,493,THA THA,Songphon ANUGRITAYAWON Kunchala VORAVICHITCHAIKUL,-2,0 - 0,,"2,100 / 2"
496,497,SRB SRB,Dragoslav PETROVIC Milica SIMIC,-2,0 - 0,,"2,090 / 3"
497,497,FIN FIN,Marko PYYKONEN Mathilda LINDHOLM,-2,0 - 0,,"2,090 / 3"
498,499,NZL NZL,Abhinav MANOTA Justine VILLEGAS,-2,0 - 0,,"2,070 / 3"
499,500,INA INA,Richard KUNCORO Zarra Faza AZKA,-2,0 - 0,,"2,070 / 2"
500,500,POL POL,Milosz BOCHAT Aneta WOJTKOWSKA,-2,0 - 0,,"2,070 / 2"
501,500,PER PER,Diego MINI Paula LA TORRE REGAL,-2,0 - 0,,"2,070 / 2"
502,500,CHI CHI,Cristian ARAYA Camila MACAYA,-2,0 - 0,,"2,070 / 2"
503,500,KEN KEN,Patrick Kinyua MBOGO Mercy JOSEPH,-2,0 - 0,,"2,070 / 2"
504,505,POL POL,Maciej DABROWSKI WITEK MAGDALENA,-2,0 - 0,,"2,020 / 3"
505,506,POL POL,Maciej OCIEPA GAJOS KAROLINA,-2,0 - 0,,"1,950 / 5"
506,507,AUS AUS,Cham CHEN Susan WANG,-2,0 - 0,,"1,950 / 2"
507,507,NZL NZL,Dylan SOEDJASA Justine VILLEGAS,-2,0 - 0,,"1,950 / 2"
508,507,NZL NZL,Maoni HU HE Ashleigh KARL,-2,0 - 0,,"1,950 / 2"
509,507,JPN JPN,Daisuke SUZUKI Midori SAKURAI,-2,0 - 0,,"1,950 / 2"
510,511,PUR PUR,Joshua SOLER Saribel CACERES,-2,0 - 0,,"1,920 / 2"
511,512,TPE TPE,HUNG Ying Yuan CHIANG Kai Hsin,-2,0 - 0,,"1,910 / 2"
512,513,NZL NZL,Thomas ELLIS Samantha MCCAMISH,-2,0 - 0,,"1,890 / 2"
513,514,THA THA,Watchara BURANAKUEA Chaladchalam Chayanit,-2,0 - 0,,"1,880 / 2"
514,515,ENG ENG,Matthew NOTTINGHAM Jessica PUGH,-2,0 - 0,,"1,840 / 2"
515,515,DEN DEN,Kristoffer KNUDSEN Emilie JUUL MOLLER,-2,0 - 0,,"1,840 / 2"
516,515,GRE GRE,Panagiotis SKARLATOS Polyvia TZIKA,-2,0 - 0,,"1,840 / 2"
517,515,INA INA,Indra LESMANA Hera DESI,-2,0 - 0,,"1,840 / 2"
518,515,FRA CRO,Gregor DUNIKOWSKI Maja PAVLINIC,-2,0 - 0,,"1,840 / 2"
519,515,TPE TPE,Chi-Hung LIAO Ling Fang HU,-2,0 - 0,,"1,840 / 2"
520,515,GUA GUA,Brandon SAMAYOA Alejandra SAMAYOA ARREAGA,-2,0 - 0,,"1,840 / 2"
521,522,CZE CZE,IVO Stoklas Denisa SIKALOVA,-1,0 - 0,,"1,770 / 4"
522,523,FRA FRA,Thom GICQUEL Vimala HERIAU,-1,0 - 0,,"1,770 / 2"
523,523,RUS RUS,Kirill Romanuk Anna ASTRAKHANTSEVA,-1,0 - 0,,"1,770 / 2"
524,525,ENG ENG,David KING Nicola GRESTY,-1,0 - 0,,"1,760 / 2"
525,526,USA MEX,Bjorn SEGUIN Mariana UGALDE,0,0 - 0,,"1,750 / 1"
526,526,ARG ARG,Lucio CORONATO Ana MONTEFINALE,0,0 - 0,,"1,750 / 1"
527,526,INA INA,Hardianto HARDIANTO Ulfa ZAKIA,-1,0 - 0,,"1,750 / 1"
528,526,VEN VEN,Jhonatan WU ZHENG Damaris Mercedes ORTIZ PARADA,-1,0 - 0,,"1,750 / 1"
529,526,KOR KOR,Yong Hoon JIN OH Bo Kyung,-1,0 - 0,,"1,750 / 1"
530,526,KOR KOR,LEE Cheol Ho Min Ji CHOI,-1,0 - 0,,"1,750 / 1"
531,526,CZE CZE,Jan FROHLICH Veronika KOLDOVA,-1,0 - 0,,"1,750 / 1"
532,526,TPE TPE,Ming-Tse YANG Wan Ting CHEN,-1,0 - 0,,"1,750 / 1"
533,526,MRI MRI,Aatish LUBAH Kobita DOKHEE,-1,0 - 0,,"1,750 / 1"
534,526,INA INA,Ramadiansyah ANDIKA Mychelle Crhystine BANDASO,-1,0 - 0,,"1,750 / 1"
535,526,FIN FIN,Arttu MAHONEN Sonja PEKKOLA,-1,0 - 0,,"1,750 / 1"
536,526,JAM JAM,Willroy MILES Katherine WYNTER,-1,0 - 0,,"1,750 / 1"
537,526,JAM JAM,Dennis COKE Mikaylia HALDANE,-1,0 - 0,,"1,750 / 1"
538,526,TUR TUR,Burak Furkan DEMIR Büşra BENK,-1,0 - 0,,"1,750 / 1"
539,526,ZAM ZAM,Ngosa CHONGO Ogar SIAMUPANGILA,-1,0 - 0,,"1,750 / 1"
540,526,COL COL,Barrientos MATEO Laura SANCHEZ,-1,0 - 0,,"1,750 / 1"
541,526,ISR ISR,Yonathan LEVIT Yana MOLODEZKI,-1,0 - 0,,"1,750 / 1"
542,526,TUR TUR,Bahadir Kaan KOLA Busra YALÇINKAYA,-1,0 - 0,,"1,750 / 1"
543,526,JOR JOR,Bani Mustafa HASAN ALI Mazahreh LEINA FEHMI,-1,0 - 0,,"1,750 / 1"
544,526,MAR MAR,Hamza HOUMIDA Harag NAZIK,-1,0 - 0,,"1,750 / 1"
545,526,NZL NZL,Kevin DENNERLY-MINTURN Susannah LEYDON-DAVIS,-1,0 - 0,,"1,750 / 1"
546,526,SUR SUR,Dylan DARMOHOETOMO Rugshaar ISHAAK,-1,0 - 0,,"1,750 / 1"
547,526,NED NED,Jelle MAAS Ilse VAESSEN,-1,0 - 0,,"1,750 / 1"
548,526,NGR NGR,Olorunfemi ELEWA Braimoh MARIA,-1,0 - 0,,"1,750 / 1"
549,550,THA THA,Viriyangkura TANUPAT Thanyasuda WONGYA,-3,0 - 0,,"1,730 / 2"
550,551,DEN FRA,Soeren TOFT HANSEN Teshana VIGNES WARAN,-3,0 - 0,,"1,700 / 1"
551,552,TPE TPE,CHENG Po Wei Chien Hui YU,-3,0 - 0,,"1,690 / 4"
552,553,INA INA,Didit JUANG Aprilsasi Putri LEJARSAR VARIELLA,-3,0 - 0,,"1,670 / 1"
553,553,THA THA,Chaloempon CHAROENKITAMORN Panjarat PRANSOPON,-3,0 - 0,,"1,670 / 1"
554,553,CHN CHN,LIU Yuchen ZHONG Qianxin,-3,0 - 0,,"1,670 / 1"
555,553,CHN CHN,HE Jiting JIA Yifan,-3,0 - 0,,"1,670 / 1"
556,553,AUS AUS,Alphonsus NG Ruwindi SERASINGHE,-3,0 - 0,,"1,670 / 1"
557,553,NZL NZL,Brock MATHESON Angie LEUNG,-3,0 - 0,,"1,670 / 1"
558,553,NZL TPE,Joe WU HUNG Shih Han,-3,0 - 0,,"1,670 / 1"
559,553,CHN CHN,LI Junhui ZHONG Qianxin,-3,0 - 0,,"1,670 / 1"
560,553,TPE TPE,LU Chia Pin Chien Hui YU,-3,0 - 0,,"1,670 / 1"
561,553,FRA FRA,Bastian KERSAUDY Lorraine BAUMANN,-3,0 - 0,,"1,670 / 1"
562,553,FRA FRA,Ronan GUEGUIN Joanna CHAUBE,-3,0 - 0,,"1,670 / 1"
563,553,IND IND,Dinesh CHAUDHRY Rucha NIKAM,-3,0 - 0,,"1,670 / 1"
564,553,IND IND,Shivam SHARMA Sanskriti CHHABRA,-3,0 - 0,,"1,670 / 1"
565,553,MAS MAS,Khim Wah LIM Meng Yean LEE,-3,0 - 0,,"1,670 / 1"
566,553,HKG HKG,LAW Cheuk Him NG Wing Yung,-3,0 - 0,,"1,670 / 1"
567,553,GER INA,Jones Ralfy JANSEN Nadya MELATI,-3,0 - 0,,"1,670 / 1"
568,553,CHN CHN,CHEN Zhuofu YU Xiaohan,-3,0 - 0,,"1,670 / 1"
569,553,CHN CHN,ZHANG Wen OU Dongni,-3,0 - 0,,"1,670 / 1"
570,553,TPE TPE,LIANG Jui Wei Chia Hsin LEE,-3,0 - 0,,"1,670 / 1"
571,553,KOR KOR,KANG Ji Wook EOM Hye Won,-3,0 - 0,,"1,670 / 1"
572,573,BLR BLR,Dzmitry SAIDAKOU Alesia ZAITSAVA,-3,0 - 0,,"1,660 / 4"
573,574,FRA FRA,Jordan CORVEE Stacey GUERIN,-3,0 - 0,,"1,640 / 3"
574,575,NZL NZL,Kent PALMER Emma CHAPPLE,-3,0 - 0,,"1,610 / 2"
575,576,THA THA,Parinyawat THONGNUAM Natcha SAENGCHOTE,-3,0 - 0,,"1,580 / 2"
576,576,TPE TPE,LIANG Jui Wei Yu Chieh CHENG,-3,0 - 0,,"1,580 / 2"
577,578,INA INA,Yonathan Suryatama DASUKI Aprilsasi Putri LEJARSAR VARIELLA,-235,0 - 0,,"1,540 / 2"
578,579,ALG ALG,Adel HAMEK Baya NESRINE,-4,0 - 0,,"1,522 / 2"
579,580,HKG HKG,LAW Cheuk Him YUEN Sin Ying,-4,0 - 0,,"1,520 / 5"
580,581,ENG ENG,Ben LANE Emily WESTWOOD,-4,0 - 0,,"1,520 / 1"
581,581,AUS INA,Michael FARIMAN Sylvina KURNIAWAN,-4,0 - 0,,"1,520 / 1"
582,581,GHA GHA,Emmanuel YAW DONKOR Victoria ASMAH,-4,0 - 0,,"1,520 / 1"
583,581,NGR NGR,Clement KROBAKPO Augustina EBHOMIEN SUNDAY,-4,0 - 0,,"1,520 / 1"
584,581,GUA GUA,Christopher Alexander MARTINEZ SALVADOR Alejandra Jose PAIZ QUAN,-4,0 - 0,,"1,520 / 1"
585,581,INA INA,Yohanes Rendy SUGIARTO Dian FITRIANI,-4,0 - 0,,"1,520 / 1"
586,581,INA INA,Afiat Yuris WIRAWAN Nadya MELATI,-4,0 - 0,,"1,520 / 1"
587,581,NGR NGR,Joshua Adeyemi ODELABI Fatima AZEEZ,-4,0 - 0,,"1,520 / 1"
588,581,RUS RUS,Sergey SCHERBIN Anastasia NAZARCHUK,-4,0 - 0,,"1,520 / 1"
589,581,MAS MAS,Ahmad Maziri MAZLAN Sannatasah SANIRU,-4,0 - 0,,"1,520 / 1"
590,581,PER PER,Javier JIMENO Sandra JIMENO GOICOCHEA,-4,0 - 0,,"1,520 / 1"
591,581,JPN JPN,Kento SAKAI Hikari SAITO,-4,0 - 0,,"1,520 / 1"
592,581,THA THA,Trawut POTIENG Pacharapun CHOCHUWONG,-4,0 - 0,,"1,520 / 1"
593,581,THA THA,Parinyawat THONGNUAM Chaladchalam Chayanit,-4,0 - 0,,"1,520 / 1"
594,581,SIN SIN,Bimo Adi PRAKOSO Yu Yan Vanessa NEO,-4,0 - 0,,"1,520 / 1"
595,581,GUA PER,Rodolfo RAMIREZ Camila DUANY,-4,0 - 0,,"1,520 / 1"
596,581,ENG GER,Matthew NOTTINGHAM Jennifer KARNOTT,-4,0 - 0,,"1,520 / 1"
597,581,CHN CHN,YU Chen XIA Chunyu,-4,0 - 0,,"1,520 / 1"
598,581,NZL TPE,Oliver LEYDON-DAVIS WU Fang Chien,-4,0 - 0,,"1,520 / 1"
599,581,CHN CHN,LI Xun LI Yinhui,-4,0 - 0,,"1,520 / 1"
600,581,TPE TPE,Shang Kai LIN Ying Chun LIN,-4,0 - 0,,"1,520 / 1"
601,581,CHN CHN,ZHOU Haodong CHEN Lu,-4,0 - 0,,"1,520 / 1"
602,581,CHN CHN,ZHAO Jian JIANG Binbin,-4,0 - 0,,"1,520 / 1"
603,581,CHN CHN,OU Zhe CHEN Xiaofei,-4,0 - 0,,"1,520 / 1"
604,581,INA SWE,Wibowo SETYALDI PUTRA Cecilia BJUNER,-4,0 - 0,,"1,520 / 1"
605,581,THA THA,Pasin SONGHONG Sararat CHUEBOCA,-4,0 - 0,,"1,520 / 1"
606,581,INA INA,Fachriza ABIMANYU Phita Haningtyas MENTARI,-4,0 - 0,,"1,520 / 1"
607,581,INA INA,Hendrik K CLINTON Zarra Faza AZKA,-4,0 - 0,,"1,520 / 1"
608,581,IND IND,Abhinav PRAKASH Nimmi PATEL,-4,0 - 0,,"1,520 / 1"
609,581,BAN BAN,Mohammed Jabed MOSTAFA Alina SULTANA,-4,0 - 0,,"1,520 / 1"
610,581,NEP NEP,Indra MEHATA Meena SHRESTHA,-4,0 - 0,,"1,520 / 1"
611,581,NEP NEP,Pankaj CHAND Amita GIRI,-4,0 - 0,,"1,520 / 1"
612,581,BAN BAN,Tushar Krishna ROY MST Rehana PARVIN,-4,0 - 0,,"1,520 / 1"
613,581,TPE WAL,Hsuan Ming LEE Carissa TURNER,-4,0 - 0,,"1,520 / 1"
614,581,WAL WAL,Oliver GWILT Emilie GWILT,-4,0 - 0,,"1,520 / 1"
615,581,ENG ENG,Joel DOUSE Paige BUTLER,-4,0 - 0,,"1,520 / 1"
616,581,SCO ENG,Matthew CARDER Lexi GILDERS,-4,0 - 0,,"1,520 / 1"
617,581,TPE TPE,LIN Chia Yu Ya-Han CHANG,-4,0 - 0,,"1,520 / 1"
618,581,TPE TPE,Cheng Heng SU YU Min Ju,-4,0 - 0,,"1,520 / 1"
619,581,USA GER,Hendri WINARTO Cisita Joity JANSEN,-4,0 - 0,,"1,520 / 1"
620,581,INA INA,Andre Kurniawan TEDJONO Aprilsasi Putri LEJARSAR VARIELLA,-4,0 - 0,,"1,520 / 1"
621,581,AUS AUS,Bernhard HALIM Elena Yee-Man KWOK,-4,0 - 0,,"1,520 / 1"
622,581,TPE TPE,Li-Wei PO Hsin Tien CHANG,-4,0 - 0,,"1,520 / 1"
623,581,INA INA,Yodhi SATRIO Wulan Sari SRI,-4,0 - 0,,"1,520 / 1"
624,581,RUS RUS,Aleksandr VASILKIN Kristina VIRVICH,-4,0 - 0,,"1,520 / 1"
625,581,BRA BRA,Fabio SOARES Luana VICENTE,-4,0 - 0,,"1,520 / 1"
626,581,JPN JPN,Naoki ISHIKAWA Atsuko KOIKE,-4,0 - 0,,"1,520 / 1"
627,581,DEN DEN,Theodor JOHANSEN Isabella NIELSEN,-4,0 - 0,,"1,520 / 1"
628,581,CAN CAN,Andrew LAU Danica LAU,-4,0 - 0,,"1,520 / 1"
629,581,MAS MAS,Kar Seong SOO Harn Xin YAP,-4,0 - 0,,"1,520 / 1"
630,581,FRA FRA,Thomas ROUXEL Lea PALERMO,-4,0 - 0,,"1,520 / 1"
631,581,ENG ENG,Matthew NOTTINGHAM Emily WESTWOOD,-4,0 - 0,,"1,520 / 1"
632,581,DOM DOM,William CABRERA Daigenis SATURRIA,-4,0 - 0,,"1,520 / 1"
633,581,BRA BRA,Luiz dos SANTOS JR Ana Paula CAMPOS,-4,0 - 0,,"1,520 / 1"
634,581,SRI SRI,Hasitha Chanaka MANANI HEWA Kavindi Ishandika SIRIMANNAGE,-4,0 - 0,,"1,520 / 1"
635,581,KEN KEN,Matheri Joseph GITHITU Lavina MARTINS,-4,0 - 0,,"1,520 / 1"
636,581,RUS RUS,Tatjana BIBIK Nikolai UKK,-4,0 - 0,,"1,520 / 1"
637,638,CZE CZE,Bedrich VALENTA Veronika KOLDOVA,-4,0 - 0,,"1,500 / 4"
638,639,AUS AUS,Blake HAGGERTY Chloe LEE,-4,0 - 0,,"1,470 / 2"
639,639,NZL NZL,Niccolo TAGLE Sally FU,-4,0 - 0,,"1,470 / 2"
640,639,MAS MAS,Yip Jiun TAN Li Lian YANG,-4,0 - 0,,"1,470 / 2"
641,639,MAS MAS,"Ahmad Maziri MAZLAN Peiy Yee, Payee LIM",-4,0 - 0,,"1,470 / 2"
642,639,POL POL,Pawel SMILOWSKI Magdalena SWIERCZYNSKA,-4,0 - 0,,"1,470 / 2"
643,639,THA THA,Natchanon TULAMOK Pattaranan CHAMNAKTAN,-4,0 - 0,,"1,470 / 2"
644,639,DOM DOM,Nelson JAVIER Bermary Altagracia POLANCO MUNOZ,-4,0 - 0,,"1,470 / 2"
645,639,CHI CHI,Bastian LIZAMA Niria BAEZA,-4,0 - 0,,"1,470 / 2"
646,639,INA INA,Gea KAMAHAMAS Brigita Marcelia RUMAMBI,-4,0 - 0,,"1,470 / 2"
647,639,TPE TPE,Chia-Han LEE Wen Chi HSU,-4,0 - 0,,"1,470 / 2"
648,639,NZL NZL,Dylan SOEDJASA Alyse DERBY,-4,0 - 0,,"1,470 / 2"
649,639,AUT CZE,Dominik STIPSITS Katerina TOMALOVA,-4,0 - 0,,"1,470 / 2"
650,639,PER PER,Leonardo ISA Chiara CARRANZA,-4,0 - 0,,"1,470 / 2"
651,639,SWE SWE,Emil WELINDER Alexandra DERLE,-4,0 - 0,,"1,470 / 2"
652,639,DEN DEN,Steve OLESEN Anna KLINKE,-4,0 - 0,,"1,470 / 2"
653,639,TRI TRI,Nicholas BONKOWSKY Solangel GUZMAN,-4,0 - 0,,"1,470 / 2"
654,639,INA INA,Indra Viki OKVANA Rosy Oktavia PANCASARI,-4,0 - 0,,"1,470 / 2"
655,639,MLT MLT,Samuel CALI SADOWSKI Fiorella Marie,-4,0 - 0,,"1,470 / 2"
656,657,GUA GUA,Anibal MARROQUIN Beatriz RAMOS,-3,0 - 0,,"1,455 / 1"
657,658,FRA FRA,Toma Junior POPOV Yaelle HOYAUX,-3,0 - 0,,"1,450 / 3"
658,658,NOR NOR,Carl Christian MORK Elisa WIBORG,-3,0 - 0,,"1,450 / 3"
659,658,NOR NOR,Sturla Flaten JORGENSEN Solvar FLATEN JORGENSEN,-3,0 - 0,,"1,450 / 3"
660,661,EST EST,Mihkel LAANES Kristin KUUBA,-3,0 - 0,,"1,410 / 3"
661,662,DOM DOM,Alberto RAPOSO Licelott SANCHEZ,-3,0 - 0,,"1,410 / 2"
662,663,WAL WAL,Nicolas STRANGE Jordan HART,-3,0 - 0,,"1,380 / 3"
663,664,ARG ARG,Serafin ZAYAS Micaela SUAREZ,0,0 - 0,,"1,370 / 1"
664,664,INA INA,Albert ADIDJUWONO Fransisca Angelica RAHARDJA,-3,0 - 0,,"1,370 / 1"
665,664,NGR NGR,Julius OLUKOTUN Zainab AKINYEMI,-3,0 - 0,,"1,370 / 1"
666,664,CHI CHI,Alonso MEDEL Jenny CEPEDA,-3,0 - 0,,"1,370 / 1"
667,664,KOR KOR,RHO Ye Wook Soo Bin LIM,-3,0 - 0,,"1,370 / 1"
668,664,CRO NED,Zvonimir HOELBLING Gayle MAHULETTE,-3,0 - 0,,"1,370 / 1"
669,664,AUS AUS,David Seng Hong LEE Chloe CHEN,-3,0 - 0,,"1,370 / 1"
670,664,AUS AUS,Le The Hung PHAM Grace HANRATTY,-3,0 - 0,,"1,370 / 1"
671,664,AUS AUS,Eric VUONG Talia SAUNDERS,-3,0 - 0,,"1,370 / 1"
672,664,TPE TPE,Chia Hung LU Ching Hui CHANG,-3,0 - 0,,"1,370 / 1"
673,664,TPE TPE,Wei Chi LIU Tzu Chin PAN,-3,0 - 0,,"1,370 / 1"
674,664,TUR TUR,Mehmet OZTURK Kurba OZTURK,-3,0 - 0,,"1,370 / 1"
675,664,RUS RUS,Nikita FEDOTOVSKIKH Lela MINADZE,-3,0 - 0,,"1,370 / 1"
676,664,RSA RSA,Cameron COETZER Sandra LE GRANGE,-3,0 - 0,,"1,370 / 1"
677,664,BAR CZE,Sabeel FOSTER Marcela RUZICKA,-3,0 - 0,,"1,370 / 1"
678,664,TRI TRI,Will LEE Avril PLAZA MARCELLE,-3,0 - 0,,"1,370 / 1"
679,664,CZE TRI,Jan FROHLICH Kamasha ROBERTSON,-3,0 - 0,,"1,370 / 1"
680,664,INA INA,Yantoni Edy SAPUTRA Marsheilla Gischa ISLAMI,-3,0 - 0,,"1,370 / 1"
681,664,MAS MAS,Sze Fei GOH Mei Xing TEOH,-3,0 - 0,,"1,370 / 1"
682,664,SWE SWE,Paul OHLSSON Berfin ASLAN,-3,0 - 0,,"1,370 / 1"
683,664,CHI CHI,Bastian LIZAMA Tingting CHOU,-3,0 - 0,,"1,370 / 1"
684,664,INA GER,Maziyyah NADHIR Ari TRISNANTO,-3,0 - 0,,"1,370 / 1"
685,664,INA INA,Arya Maulana ADIARTAMA Surya DELLA AUGUSTIA,-3,0 - 0,,"1,370 / 1"
686,664,SIN SIN,Kean Yew LOH Ai Ninna TAN,-3,0 - 0,,"1,370 / 1"
687,664,DEN DEN,Mathias Lund HANSEN Cecilie FINNE-IPSEN,-3,0 - 0,,"1,370 / 1"
688,664,FRA FRA,Toma Junior POPOV Delphine DELRUE,-3,0 - 0,,"1,370 / 1"
689,664,BOT BOT,Tlhoego CHAMO MALEPA Dintle,-3,0 - 0,,"1,370 / 1"
690,664,DOM DOM,Cesar Adonis BRITO GONZALEZ Nairoby Abigail JIMENEZ,-3,0 - 0,,"1,370 / 1"
691,664,RSA RSA,Jason COETZER Karen COETZER,-3,0 - 0,,"1,370 / 1"
692,664,DEN DEN,Theodor JOHANSEN Josephine VAN ZAANE,-3,0 - 0,,"1,370 / 1"
693,664,NED CRO,Koen RIDDER Stasa POZNANOVIC,-3,0 - 0,,"1,370 / 1"
694,664,NED GRE,Dennis VAN BEKKUM Ioanna KARKANTZIA,-3,0 - 0,,"1,370 / 1"
695,664,MAR MAR,Omar KESIKES Jinane BITARIE,-3,0 - 0,,"1,370 / 1"
696,664,PUR PUR,Torres HERIBERTO Jaylene FORESTIER,-3,0 - 0,,"1,370 / 1"
697,664,DEN DEN,Mathias WEBER ESTRUP Cecilie FINNE-IPSEN,-3,0 - 0,,"1,370 / 1"
698,664,BLR ISR,Dmitriy SUPRUNIUK Margeret LURIE,-3,0 - 0,,"1,370 / 1"
699,664,TUR TUR,Kubilay SADI Yaren DOLCU,-3,0 - 0,,"1,370 / 1"
700,664,MRI MRI,Yeldy Marie LOUISON Denneshsing BABOOLALL,-3,0 - 0,,"1,370 / 1"
701,664,GUA GUA,Brandon SAMAYOA Maria Regina DEL VALLE LEYSBETH,-3,0 - 0,,"1,370 / 1"
702,664,SUI SUI,Gilles TRIPET Tiffany GIRONA,-3,0 - 0,,"1,370 / 1"
703,664,DEN DEN,Mikkel STOFFERSEN Mathilde BJERGEN,-3,0 - 0,,"1,370 / 1"
704,664,DEN DEN,Mathias Lund HANSEN Emilie FURBO,-3,0 - 0,,"1,370 / 1"
705,664,GER GER,Tobias WADENKA Kira KATTENBECK,-3,0 - 0,,"1,370 / 1"
706,664,PUR PUR,Pedro ZAPATA Genesis VALENTIN,-3,0 - 0,,"1,370 / 1"
707,664,DOM DOM,Miguel MARINEZ Licelott SANCHEZ,-3,0 - 0,,"1,370 / 1"
708,664,INA INA,Yahya Adi KUMARA Rahmadhani Hasiyanti PUTRI,-3,0 - 0,,"1,370 / 1"
709,664,MDV MDV,Mohamed Ajfan RASHEED Aishath Afnaan RASHEED,-3,0 - 0,,"1,370 / 1"
710,664,BOT BOT,Tefo KABOMO Tessa KABELO,-3,0 - 0,,"1,370 / 1"
711,664,TRI TRI,Nicholas BONKOWSKY Kamasha ROBERTSON,-3,0 - 0,,"1,370 / 1"
712,664,PER PER,Sebastian MACIAS Danica NISHIMURA,-3,0 - 0,,"1,370 / 1"
713,664,ISL ISL,Daniel THOMSEN Margrét JOHANNSDOTTIR,-3,0 - 0,,"1,370 / 1"
714,715,GER INA,Firdaus M.GUSTAF Aprilsasi Putri LEJARSAR VARIELLA,0,0 - 0,,"1,290 / 1"
715,715,GER GER,Tobias WADENKA Barbara BELLENBERG,0,0 - 0,,"1,290 / 1"
716,715,NED NED,Robin TABELING Samantha BARNING,0,0 - 0,,"1,290 / 1"
717,715,TPE TPE,YANG Po Han YANG Ching Tun,-4,0 - 0,,"1,290 / 1"
718,715,INA INA,Hendra Aprida GUNAWAN Shendy Puspa IRAWATI,-4,0 - 0,,"1,290 / 1"
719,715,TPE TPE,Wei Chen LIU HUANG Mei Ching,-4,0 - 0,,"1,290 / 1"
720,715,TPE TPE,TSENG Min Hao Jing Ya YE,-4,0 - 0,,"1,290 / 1"
721,715,RUS RUS,Andrey JDANOV Olesia KISTER,-4,0 - 0,,"1,290 / 1"
722,715,MEX MEX,Antonio OCEGUEDA Sabrina SOLIS,-4,0 - 0,,"1,290 / 1"
723,715,GUY GUY,Narayan RAMDHANI Priyanna RAMDHANI,-4,0 - 0,,"1,290 / 1"
724,715,ESA ESA,GUARDADO Jassiel Fatima Beatriz CENTENO FUENTES,-4,0 - 0,,"1,290 / 1"
725,715,SUR SUR,Dylan DARMOHOETOMO Priscila TJITRODIPO,-4,0 - 0,,"1,290 / 1"
726,715,CAN CAN,Austin James BAUER Joanne Yu CHEN,-4,0 - 0,,"1,290 / 1"
727,715,GUM COK,David YAO Kate SCOTT,-4,0 - 0,,"1,290 / 1"
728,715,COK COK,John TAULU Ngaoa RANGINUI,-4,0 - 0,,"1,290 / 1"
729,715,NZL NZL,Kerwyn LEE Angie LEUNG,-4,0 - 0,,"1,290 / 1"
730,715,NZL NZL,Luke CHARLESWORTH Alyse DERBY,-4,0 - 0,,"1,290 / 1"
731,715,AUS AUS,Mitchell WHELLER Hsuan-Yu Wendy CHEN,-4,0 - 0,,"1,290 / 1"
732,715,USA USA,Ryan CHEW Sydney LEE,-4,0 - 0,,"1,290 / 1"
733,715,TPE TPE,Chi Yu LO HSIEH Pei Chen,-4,0 - 0,,"1,290 / 1"
734,715,USA USA,Rudi GUNAWAN Ariel LEE,-4,0 - 0,,"1,290 / 1"
735,715,TPE TPE,KUO Ching-Hung YU Min Ju,-4,0 - 0,,"1,290 / 1"
736,715,SCO SCO,Alexander DUNN Holly NEWALL,-4,0 - 0,,"1,290 / 1"
737,715,ENG ENG,ROE Michael Rachel VICKERS,-4,0 - 0,,"1,290 / 1"
738,715,TPE TPE,LIANG Jui Wei Ching Hui CHANG,-4,0 - 0,,"1,290 / 1"
739,715,KOR KOR,Seung Gyu BAEK Yong Joo HAN,-4,0 - 0,,"1,290 / 1"
