,RANK,COUNTRY,PLAYER,CHANGE +/-,WIN - LOSE,PRIZE MONEY,POINTS / TOURNAMENTS
368,360,NZL IND,Abhinav MANOTA Rachita SAHDEV,-1,0 - 0,,"2,720 / 1"
369,360,GER GER,Andreas HEINZ Annika HORBACH,-1,0 - 0,,"2,720 / 1"
370,371,FRA FRA,Vincent ESPEN Manon KRIEGER,-1,0 - 0,,"2,700 / 6"
371,372,INA INA,Hendrik K CLINTON Phita Haningtyas MENTARI,-1,0 - 0,,"2,670 / 2"
372,372,RUS RUS,Artem SERPIONOV Tatjana BIBIK,-1,0 - 0,,"2,670 / 2"
373,372,DEN DEN,Philip SEERUP Irina Amalie ANDERSEN,-1,0 - 0,,"2,670 / 2"
374,372,NGR NGR,Idowu Timothy ADEKUNLE Asisat OGUNKANBI,132,0 - 0,,"2,670 / 2"
375,372,INA INA,Reinard DHANRIANO Sinta Arum ANTASARI,-1,0 - 0,,"2,670 / 2"
376,377,THA THA,Sudket PRAPAKAMOL Sapsiree TAERATTANACHAI,-2,0 - 0,,"2,660 / 1"
377,378,SLO SLO,Martin CERKOVNIK Ana Marija SETINA,-2,0 - 0,,"2,640 / 3"
378,379,HKG HKG,YEUNG Shing Choi CHAN Hung Yung,0,0 - 0,,"2,620 / 2"
379,380,DEN DEN,Mathias BAY-SMIDT Nanna VESTERGAARD,0,0 - 0,,"2,600 / 3"
380,381,UZB UZB,Amrullo BAKHSHULLAEV Anait KHURSHUDYAN,0,0 - 0,,"2,590 / 5"
381,382,NZL NZL,Kevin DENNERLY-MINTURN Danielle TAHURI,0,0 - 0,,"2,590 / 2"
382,382,INA INA,Afiat Yuris WIRAWAN Jenna GOZALI,0,0 - 0,,"2,590 / 2"
383,382,CHN CHN,YU Xiaoyu ZHU Mai Ci,0,0 - 0,,"2,590 / 2"
384,382,SUI BUL,Gilles TRIPET Diana DIMOVA,0,0 - 0,,"2,590 / 2"
385,386,SLO SLO,Primoz FLIS Kaja STANKOVIC,0,0 - 0,,"2,570 / 4"
386,387,FRA FRA,Julien MAIO Lorraine BAUMANN,0,0 - 0,,"2,540 / 3"
387,388,UKR UKR,Valeriy ATRASHCHENKOV Yelyzaveta ZHARKA,-96,0 - 0,,"2,530 / 3"
388,389,NOR NOR,Fredrik KRISTENSEN Natalie SYVERTSEN,-1,0 - 0,,"2,520 / 5"
389,390,TPE TPE,Yu-Hua LAI Shuo Yun SUNG,-13,0 - 0,,"2,520 / 4"
390,391,NZL NZL,Dhanny OUD Jasmin Chung Man NG,-2,0 - 0,,"2,510 / 4"
391,392,BRA BRA,Alex Yuwan TJONG Fabiana SILVA,-2,0 - 0,,"2,500 / 1"
392,392,KOR KOR,KIM Young Sun Ja Yeong LEE,-2,0 - 0,,"2,500 / 1"
393,392,CRO CRO,Zvonimir DURKINJAK Mateja CICA,-2,0 - 0,,"2,500 / 1"
394,392,TPE TPE,Chia-Han LEE Chia Hsin LEE,-2,0 - 0,,"2,500 / 1"
395,392,DEN DEN,Nicklas MATHIASEN Cecilie BJERGEN,-2,0 - 0,,"2,500 / 1"
396,392,INA INA,Rian SWASTEDIAN Masita MAHMUDIN,0,0 - 0,,"2,500 / 1"
397,398,TPE TPE,Li-Wei PO Hsin-Yu TSAI,-3,0 - 0,,"2,470 / 3"
398,399,ETH ETH,TEKLU Endale Yerusksew Legssey TURA,-3,0 - 0,,"2,442 / 3"
399,400,BUL BUL,Alex VLAAR Petya NEDELCHEVA,393,0 - 0,,"2,440 / 2"
400,400,SWE SWE,Toni HOLM-LOWEN Berfin ASLAN,-3,0 - 0,,"2,440 / 2"
401,402,INA INA,Agripinna Prima Rahmanto PUTRA Aprilsasi Putri LEJARSAR VARIELLA,-4,0 - 0,,"2,400 / 2"
402,403,GER GER,Richard DOMKE Kira KATTENBECK,222,0 - 0,,"2,390 / 3"
403,403,INA INA,Fachriza ABIMANYU Syifa FAUZIAH,-4,0 - 0,,"2,390 / 3"
404,403,THA THA,Panachai WORASAKTYANAN Rawimon IAMRATANAMAETHEEKUL,-25,0 - 0,,"2,390 / 3"
405,403,POL POL,Milosz BOCHAT WITEK MAGDALENA,-4,0 - 0,,"2,390 / 3"
406,407,MAS MAS,"Zhen Ting LIM Peiy Yee, Payee LIM",-4,0 - 0,,"2,320 / 3"
407,408,SLO SLO,Miha IVANIC Lia SALEHAR,-4,0 - 0,,"2,290 / 2"
408,408,PHI PHI,Christian BERNARDO Eleanor Christine INLAYO,-4,0 - 0,,"2,290 / 2"
409,408,UZB BLR,Artyom SAVATYUGIN Alesia ZAITSAVA,-4,0 - 0,,"2,290 / 2"
410,408,PER PER,Daniel LA TORRE REGAL Camilla GARCIA,-4,0 - 0,,"2,290 / 2"
411,408,UZB RUS,Artyom SAVATYUGIN Polina VORONKO,-4,0 - 0,,"2,290 / 2"
412,408,SIN SIN,Bimo Adi PRAKOSO Citra Dewi SARI,385,0 - 0,,"2,290 / 2"
413,408,NGR NGR,Ayila GWAMBEH Patricia AKPUSUGH,385,0 - 0,,"2,290 / 2"
414,408,GRE GRE,George GALVAS Zoi ALELI,248,0 - 0,,"2,290 / 2"
415,408,AUS AUS,Ashwant GOBINATHAN Alice WU,-4,0 - 0,,"2,290 / 2"
416,417,POL POL,Maciej DABROWSKI Weronika GRUDZINA,-6,0 - 0,,"2,280 / 3"
417,418,SUI SUI,Pierrick DESCHENAUX Tiffany GIRONA,-6,0 - 0,,"2,240 / 6"
418,419,IND IND,Kamaldeep SINGH Smriti NAGARKOTI,-6,0 - 0,,"2,220 / 1"
419,419,IND IND,Rishabh SAHDEV Mohita SAHDEV,-6,0 - 0,,"2,220 / 1"
420,419,IND IND,Varun SHARMA Rachita SAHDEV,-6,0 - 0,,"2,220 / 1"
421,419,IND IND,Rajat RATHORE Parssa NAQVI,-6,0 - 0,,"2,220 / 1"
422,419,DEN DEN,Joachim FISCHER NIELSEN Marie ROEPKE,-6,0 - 0,,"2,220 / 1"
423,419,UZB UZB,Amrullo BAKHSHULLAEV Valeriya MUSHTAKOVA,-6,0 - 0,,"2,220 / 1"
424,419,MAC MAC,WONG Chi Chong Teng Iok U,-6,0 - 0,,"2,220 / 1"
425,419,CHN CHN,WANG YILYU XIA Huan,-6,0 - 0,,"2,220 / 1"
426,419,FRA FRA,Sebastien VINCENT Andréa VANDERSTUKKEN,-6,0 - 0,,"2,220 / 1"
427,419,KAZ KAZ,Artur NIYAZOV Ilyana FILIPCHUK,-6,0 - 0,,"2,220 / 1"
428,429,ENG ENG,James LAUDER Ira BANERJEE,-6,0 - 0,,"2,210 / 2"
429,429,ENG ENG,Scott P WILLIAMS Jessica HOPTON,-6,0 - 0,,"2,210 / 2"
430,429,ENG ENG,Matthew CLARE Devon MINNIS,-6,0 - 0,,"2,210 / 2"
431,429,TPE TPE,Yi-Hsiang YANG Yu Chen CHANG,-6,0 - 0,,"2,210 / 2"
432,433,MRI MRI,Yeldy Marie LOUISON Christopher PAUL,-6,0 - 0,,"2,202 / 2"
433,434,UKR UKR,Valeriy ATRASHCHENKOV Natalya VOYTSEKH,-6,0 - 0,,"2,200 / 1"
434,434,ESA ESA,GUARDADO Jassiel Georgina Penelope ORELLANA SANTOS,-6,0 - 0,,"2,200 / 1"
435,434,INA INA,Angger SUDRAJAT Jenna GOZALI,-6,0 - 0,,"2,200 / 1"
436,434,RUS RUS,Konstantin ABRAMOV Natalia Rogova,-6,0 - 0,,"2,200 / 1"
437,434,JPN JPN,Akira KOGA Yuki FUKUSHIMA,-6,0 - 0,,"2,200 / 1"
438,434,JPN JPN,Takuto INOUE Naru SHINOYA,-6,0 - 0,,"2,200 / 1"
439,434,DEN DEN,David DAUGAARD Maria HELSBOL,-6,0 - 0,,"2,200 / 1"
440,434,TPE TPE,LU Ching Yao CHIANG Kai Hsin,-6,0 - 0,,"2,200 / 1"
441,434,TPE TPE,HUANG Po Jui WU Fang Chien,-6,0 - 0,,"2,200 / 1"
442,434,CHN CHN,GAO Xiangcheng WU Qianqian,-6,0 - 0,,"2,200 / 1"
443,434,CHN CHN,GUO Yuchen ZHENG Yuwen,-6,0 - 0,,"2,200 / 1"
444,434,THA THA,Wasapon UTTAMANG Thanaporn KIAWCHA-ON,-6,0 - 0,,"2,200 / 1"
445,434,IND IND,S. Sanjeeth G. M. Nischitha,-6,0 - 0,,"2,200 / 1"
446,434,IND IND,Chirag SHETTY Kuhoo GARG,-6,0 - 0,,"2,200 / 1"
447,434,IND IND,KONA Tarun Prajakta SAWANT,-6,0 - 0,,"2,200 / 1"
448,434,ITA ESP,Wisnu Haryo PUTRO Laia OSET,-6,0 - 0,,"2,200 / 1"
449,434,IND IND,Satinder MALIK Kristi DAS,-6,0 - 0,,"2,200 / 1"
450,434,INA INA,Rian SWASTEDIAN Nisak Puji LESTARI,-6,0 - 0,,"2,200 / 1"
451,434,INA INA,Hardianto HARDIANTO Maretha Dea GIOVANI,-6,0 - 0,,"2,200 / 1"
452,434,MAS MAS,Ren Cong CHAN Lyddia Yi Yu CHEAH,-6,0 - 0,,"2,200 / 1"
453,434,TPE TPE,HUNG Ying Yuan YANG Ching Tun,-6,0 - 0,,"2,200 / 1"
454,434,JPN JPN,Takuro HOKI Kurumi YONAO,-6,0 - 0,,"2,200 / 1"
455,434,INA INA,Afiat Yuris WIRAWAN Ririn AMELIA,-6,0 - 0,,"2,200 / 1"
456,434,THA THA,Pakkawat VILAILAK Phataimas MUENWONG,-6,0 - 0,,"2,200 / 1"
457,434,THA THA,Takdanai BOONRAWD Kilasu OSTERMEYER,-6,0 - 0,,"2,200 / 1"
458,434,NGR NGR,Enejoh ABAH Tosin Damilola ATOLAGBE,-150,0 - 0,,"2,200 / 1"
459,434,NGR NGR,Ola FAGBEMI Dorcas Ajoke ADESOKAN,-208,0 - 0,,"2,200 / 1"
460,434,USA USA,Mathew FOGARTY Lina TAFT,-6,0 - 0,,"2,200 / 1"
461,434,CHN CHN,LI Junhui OU Dongni,-6,0 - 0,,"2,200 / 1"
462,434,THA THA,Nipitphon PUANGPUAPECH Savitree AMITRAPAI,-6,0 - 0,,"2,200 / 1"
463,434,SEY SEY,Steve MALCOUZANNE Cynthia COURSE,-6,0 - 0,,"2,200 / 1"
464,434,PAK PAK,Rizwan AZAM Sara MOHMAND,-6,0 - 0,,"2,200 / 1"
465,434,NGR NGR,Jinkan Ifraimu BULUS Susan IDEH,-224,0 - 0,,"2,200 / 1"
466,434,CZE CZE,Milan LUDIK Kristina GAVNHOLT,-6,0 - 0,,"2,200 / 1"
467,468,SWE SWE,Christian PETTERSON Amanda ANDERN,-8,0 - 0,,"2,190 / 4"
468,469,MAS SUI,Beryno Jiann Tze WONG Ayla HUSER,-8,0 - 0,,"2,160 / 3"
469,470,GHA GHA,Daniel SAM Gifty MENSAH,0,0 - 0,,"2,130 / 2"
470,471,KOR KOR,KIM Dae Sung Ga Ae KANG,-9,0 - 0,,"2,130 / 1"
471,471,TUR TUR,Serdar KOCA Emine DEMIRTAS,-9,0 - 0,,"2,130 / 1"
472,471,DEN DEN,Maja RINDSHOEJ Kristoffer KNUDSEN,-9,0 - 0,,"2,130 / 1"
473,471,DEN DEN,Lasse MOELHEDE Trine VILLADSEN,-9,0 - 0,,"2,130 / 1"
474,471,RSA RSA,Prakash VIJAYANATH Stacey DOUBELL,-9,0 - 0,,"2,130 / 1"
475,471,TUR TUR,Muhammed Ali KURT Kader İNAL,-9,0 - 0,,"2,130 / 1"
476,471,TPE TPE,Yuan Cheng WU Hsin Tien CHANG,-9,0 - 0,,"2,130 / 1"
477,471,JOR JOR,Bahaedeen Ahmad ALSHANNIK Domou AMRO,-9,0 - 0,,"2,130 / 1"
478,471,PER PER,Daniel LA TORRE REGAL Daniela MACIAS,-9,0 - 0,,"2,130 / 1"
479,480,HKG HKG,OR Chin Chung CHAN Kaka Tsz Ka,167,0 - 0,,"2,120 / 5"
480,481,CHN CHN,WANG Sijie OU Dongni,-10,0 - 0,,"2,110 / 1"
481,481,JPN JPN,Kenya MITSUHASHI Chisato HOSHI,-10,0 - 0,,"2,110 / 1"
482,481,AUS AUS,Edwin LUK Ruwindi SERASINGHE,-10,0 - 0,,"2,110 / 1"
483,481,AUS AUS,Simon Wing Hang LEUNG Claudia LAM,-10,0 - 0,,"2,110 / 1"
484,481,NZL NZL,Brock MATHESON Rebecca GODDARD,-10,0 - 0,,"2,110 / 1"
485,481,CAN CAN,Felix DEBLOIS-BEAUCAGE Nadianie OUAQOUAQ-BERGERON,-10,0 - 0,,"2,110 / 1"
486,481,NED NED,Ruben JILLE Iris TABELING,-10,0 - 0,,"2,110 / 1"
487,481,JPN JPN,Kenta KAZUNO Yui MIYAUCHI,-10,0 - 0,,"2,110 / 1"
488,481,ENG WAL,Conor BAMBRICK Aimee MORAN,-10,0 - 0,,"2,110 / 1"
489,481,INA INA,Fran KURNIAWAN Shendy Puspa IRAWATI,-10,0 - 0,,"2,110 / 1"
490,491,IND IND,Harinder MALIK Teenu DAHIYA,-10,0 - 0,,"2,100 / 2"
491,491,IND IND,Gaurav KALIA Ekta KALIA,-10,0 - 0,,"2,100 / 2"
492,491,HKG HKG,WONG Wai Hong CHAN Hung Yung,-10,0 - 0,,"2,100 / 2"
493,491,THA THA,Songphon ANUGRITAYAWON Kunchala VORAVICHITCHAIKUL,-10,0 - 0,,"2,100 / 2"
494,495,SRB SRB,Dragoslav PETROVIC Milica SIMIC,-10,0 - 0,,"2,090 / 3"
495,495,FIN FIN,Marko PYYKONEN Mathilda LINDHOLM,-10,0 - 0,,"2,090 / 3"
496,497,NZL NZL,Abhinav MANOTA Justine VILLEGAS,-10,0 - 0,,"2,070 / 3"
497,498,INA INA,Richard KUNCORO Zarra Faza AZKA,-10,0 - 0,,"2,070 / 2"
498,498,POL POL,Milosz BOCHAT Aneta WOJTKOWSKA,-10,0 - 0,,"2,070 / 2"
499,498,PER PER,Diego MINI Paula LA TORRE REGAL,-10,0 - 0,,"2,070 / 2"
500,498,CHI CHI,Cristian ARAYA Camila MACAYA,-10,0 - 0,,"2,070 / 2"
501,498,KEN KEN,Patrick Kinyua MBOGO Mercy JOSEPH,-10,0 - 0,,"2,070 / 2"
502,503,POL POL,Maciej DABROWSKI WITEK MAGDALENA,-9,0 - 0,,"2,020 / 3"
503,504,POL POL,Maciej OCIEPA GAJOS KAROLINA,-9,0 - 0,,"1,950 / 5"
504,505,AUS AUS,Cham CHEN Susan WANG,-9,0 - 0,,"1,950 / 2"
505,505,NZL NZL,Dylan SOEDJASA Justine VILLEGAS,-9,0 - 0,,"1,950 / 2"
506,505,NZL NZL,Maoni HU HE Ashleigh KARL,-9,0 - 0,,"1,950 / 2"
507,505,JPN JPN,Daisuke SUZUKI Midori SAKURAI,-9,0 - 0,,"1,950 / 2"
508,509,PUR PUR,Joshua SOLER Saribel CACERES,-9,0 - 0,,"1,920 / 2"
509,510,TPE TPE,HUNG Ying Yuan CHIANG Kai Hsin,-9,0 - 0,,"1,910 / 2"
510,511,NZL NZL,Thomas ELLIS Samantha MCCAMISH,-9,0 - 0,,"1,890 / 2"
511,512,THA THA,Watchara BURANAKUEA Chaladchalam Chayanit,-9,0 - 0,,"1,880 / 2"
512,513,ENG ENG,Matthew NOTTINGHAM Jessica PUGH,280,0 - 0,,"1,840 / 2"
513,513,GER GER,Johannes PISTORIUS Eva JANSSENS,-9,0 - 0,,"1,840 / 2"
514,513,DEN DEN,Kristoffer KNUDSEN Emilie JUUL MOLLER,-9,0 - 0,,"1,840 / 2"
515,513,GRE GRE,Panagiotis SKARLATOS Polyvia TZIKA,280,0 - 0,,"1,840 / 2"
516,513,INA INA,Indra LESMANA Hera DESI,-9,0 - 0,,"1,840 / 2"
517,513,FRA CRO,Gregor DUNIKOWSKI Maja PAVLINIC,-9,0 - 0,,"1,840 / 2"
518,513,TPE TPE,Chi-Hung LIAO Ling Fang HU,-9,0 - 0,,"1,840 / 2"
519,513,GUA GUA,Brandon SAMAYOA Alejandra SAMAYOA ARREAGA,-9,0 - 0,,"1,840 / 2"
520,521,CZE CZE,IVO Stoklas Denisa SIKALOVA,-5,0 - 0,,"1,770 / 4"
521,522,FRA FRA,Thom GICQUEL Vimala HERIAU,-5,0 - 0,,"1,770 / 2"
522,522,RUS RUS,Kirill Romanuk Anna ASTRAKHANTSEVA,-5,0 - 0,,"1,770 / 2"
523,524,ENG ENG,David KING Nicola GRESTY,-5,0 - 0,,"1,760 / 2"
524,525,INA INA,Hardianto HARDIANTO Ulfa ZAKIA,0,0 - 0,,"1,750 / 1"
525,525,VEN VEN,Jhonatan WU ZHENG Damaris Mercedes ORTIZ PARADA,-5,0 - 0,,"1,750 / 1"
526,525,KOR KOR,Yong Hoon JIN OH Bo Kyung,-5,0 - 0,,"1,750 / 1"
527,525,KOR KOR,LEE Cheol Ho Min Ji CHOI,-5,0 - 0,,"1,750 / 1"
528,525,CZE CZE,Jan FROHLICH Veronika KOLDOVA,-5,0 - 0,,"1,750 / 1"
529,525,TPE TPE,Ming-Tse YANG Wan Ting CHEN,-5,0 - 0,,"1,750 / 1"
530,525,MRI MRI,Aatish LUBAH Kobita DOKHEE,-5,0 - 0,,"1,750 / 1"
531,525,INA INA,Ramadiansyah ANDIKA Mychelle Crhystine BANDASO,-5,0 - 0,,"1,750 / 1"
532,525,FIN FIN,Arttu MAHONEN Sonja PEKKOLA,-5,0 - 0,,"1,750 / 1"
533,525,JAM JAM,Willroy MILES Katherine WYNTER,-5,0 - 0,,"1,750 / 1"
534,525,JAM JAM,Dennis COKE Mikaylia HALDANE,-5,0 - 0,,"1,750 / 1"
535,525,TUR TUR,Burak Furkan DEMIR Büşra BENK,-5,0 - 0,,"1,750 / 1"
536,525,ZAM ZAM,Ngosa CHONGO Ogar SIAMUPANGILA,-5,0 - 0,,"1,750 / 1"
537,525,COL COL,Barrientos MATEO Laura SANCHEZ,-5,0 - 0,,"1,750 / 1"
538,525,ISR ISR,Yonathan LEVIT Yana MOLODEZKI,-5,0 - 0,,"1,750 / 1"
539,525,TUR TUR,Bahadir Kaan KOLA Busra YALÇINKAYA,-5,0 - 0,,"1,750 / 1"
540,525,JOR JOR,Bani Mustafa HASAN ALI Mazahreh LEINA FEHMI,-5,0 - 0,,"1,750 / 1"
541,525,MAR MAR,Hamza HOUMIDA Harag NAZIK,-5,0 - 0,,"1,750 / 1"
542,525,NZL NZL,Kevin DENNERLY-MINTURN Susannah LEYDON-DAVIS,-5,0 - 0,,"1,750 / 1"
543,525,SUR SUR,Dylan DARMOHOETOMO Rugshaar ISHAAK,-5,0 - 0,,"1,750 / 1"
544,525,NED NED,Jelle MAAS Ilse VAESSEN,-5,0 - 0,,"1,750 / 1"
545,525,NGR NGR,Olorunfemi ELEWA Braimoh MARIA,-238,0 - 0,,"1,750 / 1"
546,547,THA THA,Viriyangkura TANUPAT Thanyasuda WONGYA,736,0 - 0,,"1,730 / 2"
547,548,DEN FRA,Soeren TOFT HANSEN Teshana VIGNES WARAN,-6,0 - 0,,"1,700 / 1"
548,549,TPE TPE,CHENG Po Wei Chien Hui YU,-6,0 - 0,,"1,690 / 4"
549,550,INA INA,Didit JUANG Aprilsasi Putri LEJARSAR VARIELLA,0,0 - 0,,"1,670 / 1"
550,550,THA THA,Chaloempon CHAROENKITAMORN Panjarat PRANSOPON,0,0 - 0,,"1,670 / 1"
551,550,CHN CHN,LIU Yuchen ZHONG Qianxin,-6,0 - 0,,"1,670 / 1"
552,550,CHN CHN,HE Jiting JIA Yifan,-6,0 - 0,,"1,670 / 1"
553,550,AUS AUS,Alphonsus NG Ruwindi SERASINGHE,-6,0 - 0,,"1,670 / 1"
554,550,NZL NZL,Brock MATHESON Angie LEUNG,-6,0 - 0,,"1,670 / 1"
555,550,NZL TPE,Joe WU HUNG Shih Han,-6,0 - 0,,"1,670 / 1"
556,550,CHN CHN,LI Junhui ZHONG Qianxin,-6,0 - 0,,"1,670 / 1"
557,550,TPE TPE,LU Chia Pin Chien Hui YU,-6,0 - 0,,"1,670 / 1"
558,550,FRA FRA,Bastian KERSAUDY Lorraine BAUMANN,-6,0 - 0,,"1,670 / 1"
559,550,FRA FRA,Ronan GUEGUIN Joanna CHAUBE,-6,0 - 0,,"1,670 / 1"
560,550,IND IND,Dinesh CHAUDHRY Rucha NIKAM,-6,0 - 0,,"1,670 / 1"
561,550,IND IND,Shivam SHARMA Sanskriti CHHABRA,-6,0 - 0,,"1,670 / 1"
562,550,MAS MAS,Khim Wah LIM Meng Yean LEE,-6,0 - 0,,"1,670 / 1"
563,550,HKG HKG,LAW Cheuk Him NG Wing Yung,-6,0 - 0,,"1,670 / 1"
564,550,GER INA,Jones Ralfy JANSEN Nadya MELATI,-6,0 - 0,,"1,670 / 1"
565,550,CHN CHN,CHEN Zhuofu YU Xiaohan,-6,0 - 0,,"1,670 / 1"
566,550,CHN CHN,ZHANG Wen OU Dongni,0,0 - 0,,"1,670 / 1"
567,550,TPE TPE,LIANG Jui Wei Chia Hsin LEE,-6,0 - 0,,"1,670 / 1"
568,550,KOR KOR,KANG Ji Wook EOM Hye Won,-6,0 - 0,,"1,670 / 1"
569,570,BLR BLR,Dzmitry SAIDAKOU Alesia ZAITSAVA,-9,0 - 0,,"1,660 / 4"
570,571,FRA FRA,Jordan CORVEE Stacey GUERIN,-263,0 - 0,,"1,640 / 3"
571,572,NZL NZL,Kent PALMER Emma CHAPPLE,-10,0 - 0,,"1,610 / 2"
572,573,THA THA,Parinyawat THONGNUAM Natcha SAENGCHOTE,220,0 - 0,,"1,580 / 2"
573,573,TPE TPE,LIANG Jui Wei Yu Chieh CHENG,-10,0 - 0,,"1,580 / 2"
574,575,ALG ALG,Adel HAMEK Baya NESRINE,-11,0 - 0,,"1,522 / 2"
575,576,HKG HKG,LAW Cheuk Him YUEN Sin Ying,175,0 - 0,,"1,520 / 5"
576,577,ENG ENG,Ben LANE Emily WESTWOOD,0,0 - 0,,"1,520 / 1"
577,577,AUS INA,Michael FARIMAN Sylvina KURNIAWAN,-11,0 - 0,,"1,520 / 1"
578,577,GHA GHA,Emmanuel YAW DONKOR Victoria ASMAH,-11,0 - 0,,"1,520 / 1"
579,577,NGR NGR,Clement KROBAKPO Augustina EBHOMIEN SUNDAY,-11,0 - 0,,"1,520 / 1"
580,577,GUA GUA,Christopher Alexander MARTINEZ SALVADOR Alejandra Jose PAIZ QUAN,-11,0 - 0,,"1,520 / 1"
581,577,INA INA,Yohanes Rendy SUGIARTO Dian FITRIANI,-11,0 - 0,,"1,520 / 1"
582,577,INA INA,Afiat Yuris WIRAWAN Nadya MELATI,-11,0 - 0,,"1,520 / 1"
583,577,NGR NGR,Joshua Adeyemi ODELABI Fatima AZEEZ,-11,0 - 0,,"1,520 / 1"
584,577,RUS RUS,Sergey SCHERBIN Anastasia NAZARCHUK,-11,0 - 0,,"1,520 / 1"
585,577,MAS MAS,Ahmad Maziri MAZLAN Sannatasah SANIRU,-11,0 - 0,,"1,520 / 1"
586,577,PER PER,Javier JIMENO Sandra JIMENO GOICOCHEA,-11,0 - 0,,"1,520 / 1"
587,577,JPN JPN,Kento SAKAI Hikari SAITO,-11,0 - 0,,"1,520 / 1"
588,577,THA THA,Trawut POTIENG Pacharapun CHOCHUWONG,-11,0 - 0,,"1,520 / 1"
589,577,THA THA,Parinyawat THONGNUAM Chaladchalam Chayanit,-11,0 - 0,,"1,520 / 1"
590,577,SIN SIN,Bimo Adi PRAKOSO Yu Yan Vanessa NEO,-11,0 - 0,,"1,520 / 1"
591,577,GUA PER,Rodolfo RAMIREZ Camila DUANY,-11,0 - 0,,"1,520 / 1"
592,577,ENG GER,Matthew NOTTINGHAM Jennifer KARNOTT,-11,0 - 0,,"1,520 / 1"
593,577,CHN CHN,YU Chen XIA Chunyu,-11,0 - 0,,"1,520 / 1"
594,577,NZL TPE,Oliver LEYDON-DAVIS WU Fang Chien,-11,0 - 0,,"1,520 / 1"
595,577,CHN CHN,LI Xun LI Yinhui,-11,0 - 0,,"1,520 / 1"
596,577,TPE TPE,Shang Kai LIN Ying Chun LIN,-11,0 - 0,,"1,520 / 1"
597,577,CHN CHN,ZHOU Haodong CHEN Lu,-11,0 - 0,,"1,520 / 1"
598,577,CHN CHN,ZHAO Jian JIANG Binbin,-11,0 - 0,,"1,520 / 1"
599,577,CHN CHN,OU Zhe CHEN Xiaofei,-11,0 - 0,,"1,520 / 1"
600,577,INA SWE,Wibowo SETYALDI PUTRA Cecilia BJUNER,-11,0 - 0,,"1,520 / 1"
601,577,THA THA,Pasin SONGHONG Sararat CHUEBOCA,-11,0 - 0,,"1,520 / 1"
602,577,INA INA,Fachriza ABIMANYU Phita Haningtyas MENTARI,-11,0 - 0,,"1,520 / 1"
603,577,INA INA,Hendrik K CLINTON Zarra Faza AZKA,-11,0 - 0,,"1,520 / 1"
604,577,IND IND,Abhinav PRAKASH Nimmi PATEL,-11,0 - 0,,"1,520 / 1"
605,577,BAN BAN,Mohammed Jabed MOSTAFA Alina SULTANA,-11,0 - 0,,"1,520 / 1"
606,577,NEP NEP,Indra MEHATA Meena SHRESTHA,-11,0 - 0,,"1,520 / 1"
607,577,NEP NEP,Pankaj CHAND Amita GIRI,-11,0 - 0,,"1,520 / 1"
608,577,BAN BAN,Tushar Krishna ROY MST Rehana PARVIN,-11,0 - 0,,"1,520 / 1"
609,577,TPE WAL,Hsuan Ming LEE Carissa TURNER,-11,0 - 0,,"1,520 / 1"
610,577,WAL WAL,Oliver GWILT Emilie GWILT,-11,0 - 0,,"1,520 / 1"
611,577,ENG ENG,Joel DOUSE Paige BUTLER,-11,0 - 0,,"1,520 / 1"
612,577,SCO ENG,Matthew CARDER Lexi GILDERS,-11,0 - 0,,"1,520 / 1"
613,577,TPE TPE,LIN Chia Yu Ya-Han CHANG,-11,0 - 0,,"1,520 / 1"
614,577,TPE TPE,Cheng Heng SU YU Min Ju,-11,0 - 0,,"1,520 / 1"
615,577,USA GER,Hendri WINARTO Cisita Joity JANSEN,-11,0 - 0,,"1,520 / 1"
616,577,INA INA,Andre Kurniawan TEDJONO Aprilsasi Putri LEJARSAR VARIELLA,-11,0 - 0,,"1,520 / 1"
617,577,AUS AUS,Bernhard HALIM Elena Yee-Man KWOK,-11,0 - 0,,"1,520 / 1"
618,577,TPE TPE,Li-Wei PO Hsin Tien CHANG,-239,0 - 0,,"1,520 / 1"
619,577,INA INA,Yodhi SATRIO Wulan Sari SRI,-11,0 - 0,,"1,520 / 1"
620,577,RUS RUS,Aleksandr VASILKIN Kristina VIRVICH,-11,0 - 0,,"1,520 / 1"
621,577,BRA BRA,Fabio SOARES Luana VICENTE,-11,0 - 0,,"1,520 / 1"
622,577,JPN JPN,Naoki ISHIKAWA Atsuko KOIKE,-11,0 - 0,,"1,520 / 1"
623,577,DEN DEN,Theodor JOHANSEN Isabella NIELSEN,-11,0 - 0,,"1,520 / 1"
624,577,CAN CAN,Andrew LAU Danica LAU,-11,0 - 0,,"1,520 / 1"
625,577,MAS MAS,Kar Seong SOO Harn Xin YAP,-11,0 - 0,,"1,520 / 1"
626,577,FRA FRA,Thomas ROUXEL Lea PALERMO,-11,0 - 0,,"1,520 / 1"
627,577,ENG ENG,Matthew NOTTINGHAM Emily WESTWOOD,-11,0 - 0,,"1,520 / 1"
628,577,DOM DOM,William CABRERA Daigenis SATURRIA,-11,0 - 0,,"1,520 / 1"
629,577,BRA BRA,Luiz dos SANTOS JR Ana Paula CAMPOS,-11,0 - 0,,"1,520 / 1"
630,577,SRI SRI,Hasitha Chanaka MANANI HEWA Kavindi Ishandika SIRIMANNAGE,-11,0 - 0,,"1,520 / 1"
631,577,KEN KEN,Matheri Joseph GITHITU Lavina MARTINS,-11,0 - 0,,"1,520 / 1"
632,577,RUS RUS,Tatjana BIBIK Nikolai UKK,-11,0 - 0,,"1,520 / 1"
633,634,CZE CZE,Bedrich VALENTA Veronika KOLDOVA,-10,0 - 0,,"1,500 / 4"
634,635,AUS AUS,Blake HAGGERTY Chloe LEE,-10,0 - 0,,"1,470 / 2"
635,635,NZL NZL,Niccolo TAGLE Sally FU,-10,0 - 0,,"1,470 / 2"
636,635,MAS MAS,Yip Jiun TAN Li Lian YANG,784,0 - 0,,"1,470 / 2"
637,635,MAS MAS,"Ahmad Maziri MAZLAN Peiy Yee, Payee LIM",-10,0 - 0,,"1,470 / 2"
638,635,POL POL,Pawel SMILOWSKI Magdalena SWIERCZYNSKA,-10,0 - 0,,"1,470 / 2"
639,635,THA THA,Natchanon TULAMOK Pattaranan CHAMNAKTAN,-10,0 - 0,,"1,470 / 2"
640,635,DOM DOM,Nelson JAVIER Bermary Altagracia POLANCO MUNOZ,-10,0 - 0,,"1,470 / 2"
641,635,CHI CHI,Bastian LIZAMA Niria BAEZA,-10,0 - 0,,"1,470 / 2"
642,635,INA INA,Gea KAMAHAMAS Brigita Marcelia RUMAMBI,-10,0 - 0,,"1,470 / 2"
643,635,TPE TPE,Chia-Han LEE Wen Chi HSU,-10,0 - 0,,"1,470 / 2"
644,635,NZL NZL,Dylan SOEDJASA Alyse DERBY,-10,0 - 0,,"1,470 / 2"
645,635,AUT CZE,Dominik STIPSITS Katerina TOMALOVA,-10,0 - 0,,"1,470 / 2"
646,635,PER PER,Leonardo ISA Chiara CARRANZA,-10,0 - 0,,"1,470 / 2"
647,635,SWE SWE,Emil WELINDER Alexandra DERLE,-10,0 - 0,,"1,470 / 2"
648,635,DEN DEN,Steve OLESEN Anna KLINKE,-10,0 - 0,,"1,470 / 2"
649,635,TRI TRI,Nicholas BONKOWSKY Solangel GUZMAN,-10,0 - 0,,"1,470 / 2"
650,635,INA INA,Indra Viki OKVANA Rosy Oktavia PANCASARI,-10,0 - 0,,"1,470 / 2"
651,635,MLT MLT,Samuel CALI SADOWSKI Fiorella Marie,-10,0 - 0,,"1,470 / 2"
652,653,PHI PHI,Paul Jefferson VIVAS Jessie FRANCISCO,-5,0 - 0,,"1,460 / 2"
653,654,GUA GUA,Anibal MARROQUIN Beatriz RAMOS,-5,0 - 0,,"1,455 / 1"
654,655,FRA FRA,Toma Junior POPOV Yaelle HOYAUX,-5,0 - 0,,"1,450 / 3"
655,655,NOR NOR,Carl Christian MORK Elisa WIBORG,-5,0 - 0,,"1,450 / 3"
656,655,NOR NOR,Sturla Flaten JORGENSEN Solvar FLATEN JORGENSEN,-5,0 - 0,,"1,450 / 3"
657,658,EST EST,Mihkel LAANES Kristin KUUBA,-5,0 - 0,,"1,410 / 3"
658,659,DOM DOM,Alberto RAPOSO Licelott SANCHEZ,-5,0 - 0,,"1,410 / 2"
659,660,WAL WAL,Nicolas STRANGE Jordan HART,-5,0 - 0,,"1,380 / 3"
660,661,INA INA,Albert ADIDJUWONO Fransisca Angelica RAHARDJA,0,0 - 0,,"1,370 / 1"
661,661,NGR NGR,Julius OLUKOTUN Zainab AKINYEMI,0,0 - 0,,"1,370 / 1"
662,661,CHI CHI,Alonso MEDEL Jenny CEPEDA,-5,0 - 0,,"1,370 / 1"
663,661,KOR KOR,RHO Ye Wook Soo Bin LIM,-5,0 - 0,,"1,370 / 1"
664,661,CRO NED,Zvonimir HOELBLING Gayle MAHULETTE,-5,0 - 0,,"1,370 / 1"
665,661,AUS AUS,David Seng Hong LEE Chloe CHEN,-5,0 - 0,,"1,370 / 1"
666,661,AUS AUS,Le The Hung PHAM Grace HANRATTY,-5,0 - 0,,"1,370 / 1"
667,661,AUS AUS,Eric VUONG Talia SAUNDERS,-5,0 - 0,,"1,370 / 1"
668,661,TPE TPE,Chia Hung LU Ching Hui CHANG,-5,0 - 0,,"1,370 / 1"
669,661,TPE TPE,Wei Chi LIU Tzu Chin PAN,-5,0 - 0,,"1,370 / 1"
670,661,TUR TUR,Mehmet OZTURK Kurba OZTURK,-5,0 - 0,,"1,370 / 1"
671,661,RUS RUS,Nikita FEDOTOVSKIKH Lela MINADZE,-5,0 - 0,,"1,370 / 1"
672,661,RSA RSA,Cameron COETZER Sandra LE GRANGE,-5,0 - 0,,"1,370 / 1"
673,661,BAR CZE,Sabeel FOSTER Marcela RUZICKA,-5,0 - 0,,"1,370 / 1"
674,661,TRI TRI,Will LEE Avril PLAZA MARCELLE,-5,0 - 0,,"1,370 / 1"
675,661,CZE TRI,Jan FROHLICH Kamasha ROBERTSON,-5,0 - 0,,"1,370 / 1"
676,661,INA INA,Yantoni Edy SAPUTRA Marsheilla Gischa ISLAMI,-5,0 - 0,,"1,370 / 1"
677,661,MAS MAS,Sze Fei GOH Mei Xing TEOH,-5,0 - 0,,"1,370 / 1"
678,661,SWE SWE,Paul OHLSSON Berfin ASLAN,-5,0 - 0,,"1,370 / 1"
679,661,CHI CHI,Bastian LIZAMA Tingting CHOU,-5,0 - 0,,"1,370 / 1"
680,661,INA GER,Maziyyah NADHIR Ari TRISNANTO,-5,0 - 0,,"1,370 / 1"
681,661,INA INA,Arya Maulana ADIARTAMA Surya DELLA AUGUSTIA,-5,0 - 0,,"1,370 / 1"
682,661,SIN SIN,Kean Yew LOH Ai Ninna TAN,-5,0 - 0,,"1,370 / 1"
683,661,DEN DEN,Mathias Lund HANSEN Cecilie FINNE-IPSEN,-5,0 - 0,,"1,370 / 1"
684,661,FRA FRA,Toma Junior POPOV Delphine DELRUE,-5,0 - 0,,"1,370 / 1"
685,661,BOT BOT,Tlhoego CHAMO MALEPA Dintle,-5,0 - 0,,"1,370 / 1"
686,661,DOM DOM,Cesar Adonis BRITO GONZALEZ Nairoby Abigail JIMENEZ,-5,0 - 0,,"1,370 / 1"
687,661,RSA RSA,Jason COETZER Karen COETZER,-5,0 - 0,,"1,370 / 1"
688,661,DEN DEN,Theodor JOHANSEN Josephine VAN ZAANE,-5,0 - 0,,"1,370 / 1"
689,661,NED CRO,Koen RIDDER Stasa POZNANOVIC,-5,0 - 0,,"1,370 / 1"
690,661,NED GRE,Dennis VAN BEKKUM Ioanna KARKANTZIA,-5,0 - 0,,"1,370 / 1"
691,661,MAR MAR,Omar KESIKES Jinane BITARIE,-5,0 - 0,,"1,370 / 1"
692,661,PUR PUR,Torres HERIBERTO Jaylene FORESTIER,-5,0 - 0,,"1,370 / 1"
693,661,DEN DEN,Mathias WEBER ESTRUP Cecilie FINNE-IPSEN,-5,0 - 0,,"1,370 / 1"
694,661,BLR ISR,Dmitriy SUPRUNIUK Margeret LURIE,-5,0 - 0,,"1,370 / 1"
695,661,TUR TUR,Kubilay SADI Yaren DOLCU,-5,0 - 0,,"1,370 / 1"
696,661,MRI MRI,Yeldy Marie LOUISON Denneshsing BABOOLALL,-5,0 - 0,,"1,370 / 1"
697,661,GUA GUA,Brandon SAMAYOA Maria Regina DEL VALLE LEYSBETH,-5,0 - 0,,"1,370 / 1"
698,661,SUI SUI,Gilles TRIPET Tiffany GIRONA,-5,0 - 0,,"1,370 / 1"
699,661,DEN DEN,Mikkel STOFFERSEN Mathilde BJERGEN,-5,0 - 0,,"1,370 / 1"
700,661,DEN DEN,Mathias Lund HANSEN Emilie FURBO,-5,0 - 0,,"1,370 / 1"
701,661,GER GER,Tobias WADENKA Kira KATTENBECK,-5,0 - 0,,"1,370 / 1"
702,661,PUR PUR,Pedro ZAPATA Genesis VALENTIN,-5,0 - 0,,"1,370 / 1"
703,661,DOM DOM,Miguel MARINEZ Licelott SANCHEZ,-5,0 - 0,,"1,370 / 1"
704,661,INA INA,Yahya Adi KUMARA Rahmadhani Hasiyanti PUTRI,-5,0 - 0,,"1,370 / 1"
705,661,MDV MDV,Mohamed Ajfan RASHEED Aishath Afnaan RASHEED,-5,0 - 0,,"1,370 / 1"
706,661,BOT BOT,Tefo KABOMO Tessa KABELO,-5,0 - 0,,"1,370 / 1"
707,661,TRI TRI,Nicholas BONKOWSKY Kamasha ROBERTSON,-5,0 - 0,,"1,370 / 1"
708,661,PER PER,Sebastian MACIAS Danica NISHIMURA,-5,0 - 0,,"1,370 / 1"
709,661,ISL ISL,Daniel THOMSEN Margrét JOHANNSDOTTIR,-5,0 - 0,,"1,370 / 1"
710,711,TPE TPE,YANG Po Han YANG Ching Tun,-2,0 - 0,,"1,290 / 1"
711,711,INA INA,Hendra Aprida GUNAWAN Shendy Puspa IRAWATI,-2,0 - 0,,"1,290 / 1"
712,711,TPE TPE,Wei Chen LIU HUANG Mei Ching,-2,0 - 0,,"1,290 / 1"
713,711,TPE TPE,TSENG Min Hao Jing Ya YE,-2,0 - 0,,"1,290 / 1"
714,711,RUS RUS,Andrey JDANOV Olesia KISTER,-2,0 - 0,,"1,290 / 1"
715,711,MEX MEX,Antonio OCEGUEDA Sabrina SOLIS,-2,0 - 0,,"1,290 / 1"
716,711,GUY GUY,Narayan RAMDHANI Priyanna RAMDHANI,-2,0 - 0,,"1,290 / 1"
717,711,ESA ESA,GUARDADO Jassiel Fatima Beatriz CENTENO FUENTES,-2,0 - 0,,"1,290 / 1"
718,711,SUR SUR,Dylan DARMOHOETOMO Priscila TJITRODIPO,-2,0 - 0,,"1,290 / 1"
719,711,CAN CAN,Austin James BAUER Joanne Yu CHEN,-2,0 - 0,,"1,290 / 1"
720,711,GUM COK,David YAO Kate SCOTT,-2,0 - 0,,"1,290 / 1"
721,711,COK COK,John TAULU Ngaoa RANGINUI,-2,0 - 0,,"1,290 / 1"
722,711,NZL NZL,Kerwyn LEE Angie LEUNG,-2,0 - 0,,"1,290 / 1"
723,711,NZL NZL,Luke CHARLESWORTH Alyse DERBY,-2,0 - 0,,"1,290 / 1"
724,711,AUS AUS,Mitchell WHELLER Hsuan-Yu Wendy CHEN,-2,0 - 0,,"1,290 / 1"
725,711,USA USA,Ryan CHEW Sydney LEE,-2,0 - 0,,"1,290 / 1"
726,711,TPE TPE,Chi Yu LO HSIEH Pei Chen,-2,0 - 0,,"1,290 / 1"
727,711,USA USA,Rudi GUNAWAN Ariel LEE,-2,0 - 0,,"1,290 / 1"
728,711,TPE TPE,KUO Ching-Hung YU Min Ju,-2,0 - 0,,"1,290 / 1"
729,711,SCO SCO,Alexander DUNN Holly NEWALL,-2,0 - 0,,"1,290 / 1"
730,711,ENG ENG,ROE Michael Rachel VICKERS,-2,0 - 0,,"1,290 / 1"
731,711,TPE TPE,LIANG Jui Wei Ching Hui CHANG,-2,0 - 0,,"1,290 / 1"
732,711,KOR KOR,Seung Gyu BAEK Yong Joo HAN,-2,0 - 0,,"1,290 / 1"
733,711,KOR KOR,Hyuk Gyun CHOI Hye Jeong KIM,-2,0 - 0,,"1,290 / 1"
734,711,TPE TPE,Chia-Hsin WAN Wan Ting CHEN,-2,0 - 0,,"1,290 / 1"
735,711,INA INA,Kevin Sanjaya SUKAMULJO Della Destiara HARIS,-422,0 - 0,,"1,290 / 1"
