,RANK,COUNTRY,PLAYER,CHANGE +/-,WIN - LOSE,PRIZE MONEY,POINTS / TOURNAMENTS
369,361,CHN CHN,WANG YILYU OU Dongni,-96,0 - 0,,"2,720 / 1"
370,361,IND IND,Sanyam SHUKLA Sanyogita GHORPADE,2,0 - 0,,"2,720 / 1"
371,361,NZL IND,Abhinav MANOTA Rachita SAHDEV,2,0 - 0,,"2,720 / 1"
372,361,GER GER,Andreas HEINZ Annika HORBACH,2,0 - 0,,"2,720 / 1"
373,374,RUS RUS,Artem SERPIONOV Tatjana BIBIK,2,0 - 0,,"2,670 / 2"
374,374,NGR NGR,Idowu Timothy ADEKUNLE Asisat OGUNKANBI,2,0 - 0,,"2,670 / 2"
375,374,INA INA,Reinard DHANRIANO Sinta Arum ANTASARI,2,0 - 0,,"2,670 / 2"
376,377,THA THA,Sudket PRAPAKAMOL Sapsiree TAERATTANACHAI,3,0 - 0,,"2,660 / 1"
377,378,SLO SLO,Martin CERKOVNIK Ana Marija SETINA,3,0 - 0,,"2,640 / 3"
378,379,UZB UZB,Amrullo BAKHSHULLAEV Anait KHURSHUDYAN,3,0 - 0,,"2,590 / 5"
379,380,TPE TPE,Chia-Han LEE CHENG Chi Ya,174,0 - 0,,"2,590 / 2"
380,380,NZL NZL,Kevin DENNERLY-MINTURN Danielle TAHURI,3,0 - 0,,"2,590 / 2"
381,380,INA INA,Afiat Yuris WIRAWAN Jenna GOZALI,3,0 - 0,,"2,590 / 2"
382,380,CHN CHN,YU Xiaoyu ZHU Mai Ci,3,0 - 0,,"2,590 / 2"
383,384,GER GER,Johannes PISTORIUS Ramona HACKS,3,0 - 0,,"2,560 / 4"
384,385,NZL NZL,Dhanny OUD Jasmin Chung Man NG,3,0 - 0,,"2,510 / 4"
385,386,POL POL,Maciej OCIEPA GAJOS KAROLINA,115,0 - 0,,"2,500 / 6"
386,387,ENG ENG,Christopher COLES Victoria WILLIAMS,2,0 - 0,,"2,500 / 1"
387,387,BRA BRA,Alex Yuwan TJONG Fabiana SILVA,2,0 - 0,,"2,500 / 1"
388,387,KOR KOR,KIM Young Sun Ja Yeong LEE,2,0 - 0,,"2,500 / 1"
389,387,CRO CRO,Zvonimir DURKINJAK Mateja CICA,2,0 - 0,,"2,500 / 1"
390,387,TPE TPE,Chia-Han LEE Chia Hsin LEE,2,0 - 0,,"2,500 / 1"
391,387,INA INA,Rian SWASTEDIAN Masita MAHMUDIN,2,0 - 0,,"2,500 / 1"
392,393,TPE TPE,Li-Wei PO Hsin-Yu TSAI,2,0 - 0,,"2,470 / 3"
393,394,ETH ETH,TEKLU Endale Yerusksew Legssey TURA,2,0 - 0,,"2,442 / 3"
394,395,BUL BUL,Alex VLAAR Petya NEDELCHEVA,2,0 - 0,,"2,440 / 2"
395,395,BUL NED,Alex VLAAR Cheryl SEINEN,2,0 - 0,,"2,440 / 2"
396,397,INA INA,Agripinna Prima Rahmanto PUTRA Aprilsasi Putri LEJARSAR VARIELLA,4,0 - 0,,"2,400 / 2"
397,398,INA INA,Fachriza ABIMANYU Syifa FAUZIAH,4,0 - 0,,"2,390 / 3"
398,398,THA THA,Panachai WORASAKTYANAN Rawimon IAMRATANAMAETHEEKUL,4,0 - 0,,"2,390 / 3"
399,398,ARG ARG,Federico DIAZ Daiana GARMENDIA,4,0 - 0,,"2,390 / 3"
400,401,JOR JOR,Mohd Naser Mansour NAYEF Mazahreh LEINA FEHMI,4,0 - 0,,"2,350 / 2"
401,402,MAS MAS,"Zhen Ting LIM Peiy Yee, Payee LIM",4,0 - 0,,"2,320 / 3"
402,403,BRN BRN,Vishnu SREEKUMAR Anza ABDULRAHIM,4,0 - 0,,"2,290 / 2"
403,403,SLO SLO,Miha IVANIC Lia SALEHAR,4,0 - 0,,"2,290 / 2"
404,403,PHI PHI,Christian BERNARDO Eleanor Christine INLAYO,4,0 - 0,,"2,290 / 2"
405,403,PER PER,Daniel LA TORRE REGAL Camilla GARCIA,4,0 - 0,,"2,290 / 2"
406,403,UZB RUS,Artyom SAVATYUGIN Polina VORONKO,4,0 - 0,,"2,290 / 2"
407,403,UKR UKR,Valeriy ATRASHCHENKOV Yelyzaveta ZHARKA,4,0 - 0,,"2,290 / 2"
408,403,SIN SIN,Bimo Adi PRAKOSO Citra Dewi SARI,4,0 - 0,,"2,290 / 2"
409,403,NGR NGR,Ayila GWAMBEH Patricia AKPUSUGH,4,0 - 0,,"2,290 / 2"
410,403,GRE GRE,George GALVAS Zoi ALELI,4,0 - 0,,"2,290 / 2"
411,403,AUS AUS,Ashwant GOBINATHAN Alice WU,4,0 - 0,,"2,290 / 2"
412,413,IND IND,Kamaldeep SINGH Smriti NAGARKOTI,6,0 - 0,,"2,220 / 1"
413,413,IND IND,Rishabh SAHDEV Mohita SAHDEV,6,0 - 0,,"2,220 / 1"
414,413,IND IND,Varun SHARMA Rachita SAHDEV,6,0 - 0,,"2,220 / 1"
415,413,IND IND,Rajat RATHORE Parssa NAQVI,6,0 - 0,,"2,220 / 1"
416,413,MAS MAS,Peng Soon CHAN Hui Lin NG,6,0 - 0,,"2,220 / 1"
417,413,UZB UZB,Amrullo BAKHSHULLAEV Valeriya MUSHTAKOVA,6,0 - 0,,"2,220 / 1"
418,413,MAC MAC,WONG Chi Chong Teng Iok U,6,0 - 0,,"2,220 / 1"
419,413,CHN CHN,WANG YILYU XIA Huan,6,0 - 0,,"2,220 / 1"
420,413,KAZ KAZ,Artur NIYAZOV Ilyana FILIPCHUK,6,0 - 0,,"2,220 / 1"
421,413,THA THA,Maneepong JONGJIT Sapsiree TAERATTANACHAI,-204,0 - 0,,"2,220 / 1"
422,423,ENG ENG,James LAUDER Ira BANERJEE,5,0 - 0,,"2,210 / 2"
423,423,ENG ENG,Scott P WILLIAMS Jessica HOPTON,5,0 - 0,,"2,210 / 2"
424,423,ENG ENG,Matthew CLARE Devon MINNIS,5,0 - 0,,"2,210 / 2"
425,426,MRI MRI,Yeldy Marie LOUISON Christopher PAUL,5,0 - 0,,"2,202 / 2"
426,427,INA INA,Agripinna Prima Rahmanto PUTRA Syifa FAUZIAH,0,0 - 0,,"2,200 / 1"
427,427,UKR UKR,Valeriy ATRASHCHENKOV Natalya VOYTSEKH,5,0 - 0,,"2,200 / 1"
428,427,ESA ESA,GUARDADO Jassiel Georgina Penelope ORELLANA SANTOS,5,0 - 0,,"2,200 / 1"
429,427,INA INA,Angger SUDRAJAT Jenna GOZALI,5,0 - 0,,"2,200 / 1"
430,427,RUS RUS,Konstantin ABRAMOV Natalia Rogova,5,0 - 0,,"2,200 / 1"
431,427,JPN JPN,Akira KOGA Yuki FUKUSHIMA,5,0 - 0,,"2,200 / 1"
432,427,JPN JPN,Takuto INOUE Naru SHINOYA,5,0 - 0,,"2,200 / 1"
433,427,DEN DEN,David DAUGAARD Maria HELSBOL,5,0 - 0,,"2,200 / 1"
434,427,TPE TPE,HUANG Po Jui WU Fang Chien,5,0 - 0,,"2,200 / 1"
435,427,CHN CHN,GAO Xiangcheng WU Qianqian,5,0 - 0,,"2,200 / 1"
436,427,CHN CHN,GUO Yuchen ZHENG Yuwen,5,0 - 0,,"2,200 / 1"
437,427,THA THA,Wasapon UTTAMANG Thanaporn KIAWCHA-ON,5,0 - 0,,"2,200 / 1"
438,427,IND IND,S. Sanjeeth G. M. Nischitha,5,0 - 0,,"2,200 / 1"
439,427,IND IND,Chirag SHETTY Kuhoo GARG,5,0 - 0,,"2,200 / 1"
440,427,IND IND,KONA Tarun Prajakta SAWANT,5,0 - 0,,"2,200 / 1"
441,427,ITA ESP,Wisnu Haryo PUTRO Laia OSET,5,0 - 0,,"2,200 / 1"
442,427,IND IND,Satinder MALIK Kristi DAS,5,0 - 0,,"2,200 / 1"
443,427,THA THA,Pakkawat VILAILAK Phataimas MUENWONG,5,0 - 0,,"2,200 / 1"
444,427,THA THA,Takdanai BOONRAWD Kilasu OSTERMEYER,5,0 - 0,,"2,200 / 1"
445,427,NGR NGR,Enejoh ABAH Tosin Damilola ATOLAGBE,5,0 - 0,,"2,200 / 1"
446,427,NGR NGR,Ola FAGBEMI Dorcas Ajoke ADESOKAN,5,0 - 0,,"2,200 / 1"
447,427,USA USA,Mathew FOGARTY Lina TAFT,5,0 - 0,,"2,200 / 1"
448,427,IND IND,Pranaav Jerry CHOPRA K. Maneesha,5,0 - 0,,"2,200 / 1"
449,427,CHN CHN,LI Junhui OU Dongni,5,0 - 0,,"2,200 / 1"
450,427,THA THA,Nipitphon PUANGPUAPECH Savitree AMITRAPAI,5,0 - 0,,"2,200 / 1"
451,427,SEY SEY,Steve MALCOUZANNE Cynthia COURSE,5,0 - 0,,"2,200 / 1"
452,427,NGR NGR,Jinkan Ifraimu BULUS Susan IDEH,5,0 - 0,,"2,200 / 1"
453,427,CZE CZE,Milan LUDIK Kristina GAVNHOLT,5,0 - 0,,"2,200 / 1"
454,455,MAS SUI,Beryno Jiann Tze WONG Ayla HUSER,10,0 - 0,,"2,160 / 3"
455,455,GER GER,Fabian HOLZER Barbara BELLENBERG,10,0 - 0,,"2,160 / 3"
456,457,GHA GHA,Daniel SAM Gifty MENSAH,10,0 - 0,,"2,130 / 2"
457,458,KOR KOR,KIM Dae Sung Ga Ae KANG,10,0 - 0,,"2,130 / 1"
458,458,TUR TUR,Serdar KOCA Emine DEMIRTAS,10,0 - 0,,"2,130 / 1"
459,458,DEN DEN,Maja RINDSHOEJ Kristoffer KNUDSEN,10,0 - 0,,"2,130 / 1"
460,458,DEN DEN,Lasse MOELHEDE Trine VILLADSEN,10,0 - 0,,"2,130 / 1"
461,458,RSA RSA,Prakash VIJAYANATH Stacey DOUBELL,10,0 - 0,,"2,130 / 1"
462,458,TUR TUR,Muhammed Ali KURT Kader İNAL,10,0 - 0,,"2,130 / 1"
463,458,TPE TPE,Yuan Cheng WU Hsin Tien CHANG,10,0 - 0,,"2,130 / 1"
464,458,NCL NCL,Loic MENNESSON Johanna KOU,10,0 - 0,,"2,130 / 1"
465,458,JOR JOR,Bahaedeen Ahmad ALSHANNIK Domou AMRO,10,0 - 0,,"2,130 / 1"
466,458,PER PER,Daniel LA TORRE REGAL Daniela MACIAS,10,0 - 0,,"2,130 / 1"
467,458,BRA BRA,Daniel PAIOLA Fabiana SILVA,0,0 - 0,,"2,130 / 1"
468,469,TPE TPE,HUNG Ying Yuan Pei Shan HSIEH,9,0 - 0,,"2,110 / 1"
469,469,TPE TPE,Hsu JUI TING LEE Wei Tzu,9,0 - 0,,"2,110 / 1"
470,469,CHN CHN,WANG Sijie OU Dongni,9,0 - 0,,"2,110 / 1"
471,469,JPN JPN,Kenya MITSUHASHI Chisato HOSHI,9,0 - 0,,"2,110 / 1"
472,469,AUS AUS,Edwin LUK Ruwindi SERASINGHE,9,0 - 0,,"2,110 / 1"
473,469,AUS AUS,Simon Wing Hang LEUNG Claudia LAM,9,0 - 0,,"2,110 / 1"
474,469,NZL NZL,Brock MATHESON Rebecca GODDARD,9,0 - 0,,"2,110 / 1"
475,469,CAN CAN,Felix DEBLOIS-BEAUCAGE Nadianie OUAQOUAQ-BERGERON,9,0 - 0,,"2,110 / 1"
476,469,ENG WAL,Conor BAMBRICK Aimee MORAN,9,0 - 0,,"2,110 / 1"
477,478,IND IND,Harinder MALIK Teenu DAHIYA,9,0 - 0,,"2,100 / 2"
478,478,IND IND,Gaurav KALIA Ekta KALIA,9,0 - 0,,"2,100 / 2"
479,478,HKG HKG,WONG Wai Hong CHAN Hung Yung,9,0 - 0,,"2,100 / 2"
480,478,THA THA,Songphon ANUGRITAYAWON Kunchala VORAVICHITCHAIKUL,9,0 - 0,,"2,100 / 2"
481,482,SRB SRB,Dragoslav PETROVIC Milica SIMIC,9,0 - 0,,"2,090 / 3"
482,483,GER GER,Andreas HEINZ Jennifer KARNOTT,9,0 - 0,,"2,070 / 4"
483,484,NZL NZL,Abhinav MANOTA Justine VILLEGAS,9,0 - 0,,"2,070 / 3"
484,485,INA INA,Richard KUNCORO Zarra Faza AZKA,9,0 - 0,,"2,070 / 2"
485,485,PER PER,Diego MINI Paula LA TORRE REGAL,9,0 - 0,,"2,070 / 2"
486,485,CHI CHI,Cristian ARAYA Camila MACAYA,9,0 - 0,,"2,070 / 2"
487,485,KEN KEN,Patrick Kinyua MBOGO Mercy JOSEPH,9,0 - 0,,"2,070 / 2"
488,489,SLO SLO,Primoz FLIS Kaja STANKOVIC,10,0 - 0,,"2,020 / 3"
489,490,AUS AUS,Cham CHEN Susan WANG,12,0 - 0,,"1,950 / 2"
490,490,NZL NZL,Dylan SOEDJASA Justine VILLEGAS,12,0 - 0,,"1,950 / 2"
491,490,NZL NZL,Maoni HU HE Ashleigh KARL,12,0 - 0,,"1,950 / 2"
492,490,JPN JPN,Daisuke SUZUKI Midori SAKURAI,12,0 - 0,,"1,950 / 2"
493,494,TPE TPE,Yu-Hua LAI Shuo Yun SUNG,-76,0 - 0,,"1,920 / 2"
494,495,NZL NZL,Thomas ELLIS Samantha MCCAMISH,13,0 - 0,,"1,890 / 2"
495,496,INA INA,Muhammad Reza Pahlevi ISFAHANI Zarra Faza AZKA,95,0 - 0,,"1,880 / 2"
496,496,THA THA,Watchara BURANAKUEA Chaladchalam Chayanit,13,0 - 0,,"1,880 / 2"
497,498,ENG ENG,Matthew NOTTINGHAM Jessica PUGH,12,0 - 0,,"1,840 / 2"
498,498,GRE GRE,Panagiotis SKARLATOS Polyvia TZIKA,12,0 - 0,,"1,840 / 2"
499,498,INA INA,Indra LESMANA Hera DESI,12,0 - 0,,"1,840 / 2"
500,498,FRA CRO,Gregor DUNIKOWSKI Maja PAVLINIC,12,0 - 0,,"1,840 / 2"
501,498,TPE TPE,Chi-Hung LIAO Ling Fang HU,12,0 - 0,,"1,840 / 2"
502,498,CRO CRO,Zvonimir HOELBLING Maja PAVLINIC,12,0 - 0,,"1,840 / 2"
503,498,DEN DEN,Tobias SUDER Line NOERGAARD,12,0 - 0,,"1,840 / 2"
504,498,GUA GUA,Brandon SAMAYOA Alejandra SAMAYOA ARREAGA,12,0 - 0,,"1,840 / 2"
505,506,CZE CZE,IVO Stoklas Denisa SIKALOVA,12,0 - 0,,"1,770 / 4"
506,507,FRA FRA,Thom GICQUEL Vimala HERIAU,12,0 - 0,,"1,770 / 2"
507,507,RUS RUS,Kirill Romanuk Anna ASTRAKHANTSEVA,12,0 - 0,,"1,770 / 2"
508,509,ENG ENG,David KING Nicola GRESTY,12,0 - 0,,"1,760 / 2"
509,510,ISR ISR,Ariel SHAINSKI Pugach ALINA,12,0 - 0,,"1,756 / 1"
510,511,GER BRA,Jonathan PERSSON Ana Paula CAMPOS,0,0 - 0,,"1,750 / 1"
511,511,DEN DEN,Mikkel MIKKELSEN Mai SURROW,12,0 - 0,,"1,750 / 1"
512,511,BRN BRN,Heri SETIAWAN Sandra SAKARIA,12,0 - 0,,"1,750 / 1"
513,511,NCL NCL,Yohan DE GEOFFROY Soizick HO-YAGUES,12,0 - 0,,"1,750 / 1"
514,511,NCL NCL,Ronan HO-YAGUES Dgenyva MATAULI,12,0 - 0,,"1,750 / 1"
515,511,JOR JOR,Quasi ABID Razan ALKOTOP,12,0 - 0,,"1,750 / 1"
516,511,BRA BRA,Rafael LAJUSTICIA Estefane VENTURA,12,0 - 0,,"1,750 / 1"
517,511,ARG ARG,Lucio CORONATO Ana MONTEFINALE,12,0 - 0,,"1,750 / 1"
518,511,INA INA,Hardianto HARDIANTO Ulfa ZAKIA,12,0 - 0,,"1,750 / 1"
519,511,VEN VEN,Jhonatan WU ZHENG Damaris Mercedes ORTIZ PARADA,12,0 - 0,,"1,750 / 1"
520,511,KOR KOR,Yong Hoon JIN OH Bo Kyung,12,0 - 0,,"1,750 / 1"
521,511,KOR KOR,LEE Cheol Ho Min Ji CHOI,12,0 - 0,,"1,750 / 1"
522,511,CZE CZE,Jan FROHLICH Veronika KOLDOVA,12,0 - 0,,"1,750 / 1"
523,511,TPE TPE,Ming-Tse YANG Wan Ting CHEN,12,0 - 0,,"1,750 / 1"
524,511,MRI MRI,Aatish LUBAH Kobita DOKHEE,12,0 - 0,,"1,750 / 1"
525,511,INA INA,Ramadiansyah ANDIKA Mychelle Crhystine BANDASO,12,0 - 0,,"1,750 / 1"
526,511,FIN FIN,Arttu MAHONEN Sonja PEKKOLA,12,0 - 0,,"1,750 / 1"
527,511,JAM JAM,Willroy MILES Katherine WYNTER,12,0 - 0,,"1,750 / 1"
528,511,JAM JAM,Dennis COKE Mikaylia HALDANE,12,0 - 0,,"1,750 / 1"
529,511,TUR TUR,Burak Furkan DEMIR Büşra BENK,12,0 - 0,,"1,750 / 1"
530,511,ZAM ZAM,Ngosa CHONGO Ogar SIAMUPANGILA,12,0 - 0,,"1,750 / 1"
531,511,COL COL,Barrientos MATEO Laura SANCHEZ,12,0 - 0,,"1,750 / 1"
532,511,TUR TUR,Bahadir Kaan KOLA Busra YALÇINKAYA,12,0 - 0,,"1,750 / 1"
533,511,MEX MEX,Arturo HERNANDEZ Mariana UGALDE,0,0 - 0,,"1,750 / 1"
534,511,NZL NZL,Kevin DENNERLY-MINTURN Susannah LEYDON-DAVIS,12,0 - 0,,"1,750 / 1"
535,511,NED NED,Jelle MAAS Ilse VAESSEN,12,0 - 0,,"1,750 / 1"
536,511,FIN FIN,Anton KAISTI Jenny NYSTROM,12,0 - 0,,"1,750 / 1"
537,511,NGR NGR,Olorunfemi ELEWA Braimoh MARIA,12,0 - 0,,"1,750 / 1"
538,539,THA THA,Viriyangkura TANUPAT Thanyasuda WONGYA,11,0 - 0,,"1,730 / 2"
539,539,POL POL,Maciej DABROWSKI Weronika GRUDZINA,11,0 - 0,,"1,730 / 2"
540,541,DEN FRA,Soeren TOFT HANSEN Teshana VIGNES WARAN,11,0 - 0,,"1,700 / 1"
541,541,ISR BLR,Ariel SHAINSKI Krestina SILICH,11,0 - 0,,"1,700 / 1"
542,543,NZL TPE,Oliver LEYDON-DAVIS Xiao Min LIN,11,0 - 0,,"1,670 / 1"
543,543,TPE TPE,Chi-Lin WANG Chien Hui YU,11,0 - 0,,"1,670 / 1"
544,543,NED TPE,Ruud BOSCH Wan Ching LIN,11,0 - 0,,"1,670 / 1"
545,543,TPE TPE,HUANG Po Jui CHIANG Kai Hsin,11,0 - 0,,"1,670 / 1"
546,543,TPE TPE,CHEN Hung Ling Ling Fang HU,11,0 - 0,,"1,670 / 1"
547,543,TPE TPE,TIEN Tzu Chieh WU Fang Chien,11,0 - 0,,"1,670 / 1"
548,543,INA INA,Didit JUANG Aprilsasi Putri LEJARSAR VARIELLA,11,0 - 0,,"1,670 / 1"
549,543,THA THA,Chaloempon CHAROENKITAMORN Panjarat PRANSOPON,11,0 - 0,,"1,670 / 1"
550,543,CHN CHN,LIU Yuchen ZHONG Qianxin,11,0 - 0,,"1,670 / 1"
551,543,CHN CHN,HE Jiting JIA Yifan,11,0 - 0,,"1,670 / 1"
552,543,AUS AUS,Alphonsus NG Ruwindi SERASINGHE,11,0 - 0,,"1,670 / 1"
553,543,NZL NZL,Brock MATHESON Angie LEUNG,11,0 - 0,,"1,670 / 1"
554,543,NZL TPE,Joe WU HUNG Shih Han,11,0 - 0,,"1,670 / 1"
555,543,CHN CHN,LI Junhui ZHONG Qianxin,11,0 - 0,,"1,670 / 1"
556,543,TPE TPE,LU Chia Pin Chien Hui YU,11,0 - 0,,"1,670 / 1"
557,543,FRA FRA,Bastian KERSAUDY Lorraine BAUMANN,11,0 - 0,,"1,670 / 1"
558,543,FRA FRA,Ronan GUEGUIN Joanna CHAUBE,11,0 - 0,,"1,670 / 1"
559,543,IND IND,Dinesh CHAUDHRY Rucha NIKAM,11,0 - 0,,"1,670 / 1"
560,543,IND IND,Shivam SHARMA Sanskriti CHHABRA,11,0 - 0,,"1,670 / 1"
561,543,MAS MAS,Khim Wah LIM Meng Yean LEE,11,0 - 0,,"1,670 / 1"
562,543,HKG HKG,LAW Cheuk Him NG Wing Yung,11,0 - 0,,"1,670 / 1"
563,543,TPE TPE,Cheng Heng SU HUNG Shih Han,11,0 - 0,,"1,670 / 1"
564,543,KOR KOR,BAE Kwon Young KIM Ji Won,11,0 - 0,,"1,670 / 1"
565,543,SUI BUL,Gilles TRIPET Diana DIMOVA,11,0 - 0,,"1,670 / 1"
566,543,CHN CHN,ZHANG Wen OU Dongni,11,0 - 0,,"1,670 / 1"
567,543,TPE TPE,HUNG Ying Yuan CHIANG Kai Hsin,11,0 - 0,,"1,670 / 1"
568,543,TPE TPE,CHEN Chung Jen Yu Chieh CHENG,-160,0 - 0,,"1,670 / 1"
569,543,TPE TPE,LIANG Jui Wei Chia Hsin LEE,11,0 - 0,,"1,670 / 1"
570,543,KOR KOR,KIM Dae Eun CHOI Hye In,11,0 - 0,,"1,670 / 1"
571,543,KOR KOR,KANG Ji Wook EOM Hye Won,11,0 - 0,,"1,670 / 1"
572,573,BLR BLR,Dzmitry SAIDAKOU Alesia ZAITSAVA,13,0 - 0,,"1,660 / 4"
573,574,SWE SWE,Christian PETTERSON Amanda ANDERN,-110,0 - 0,,"1,640 / 3"
574,575,NZL NZL,Kent PALMER Emma CHAPPLE,12,0 - 0,,"1,610 / 2"
575,576,NOR NOR,Fredrik KRISTENSEN Natalie SYVERTSEN,12,0 - 0,,"1,600 / 4"
576,577,DEN DEN,Mathias BAY-SMIDT Nanna VESTERGAARD,12,0 - 0,,"1,540 / 2"
577,578,ALG ALG,Adel HAMEK Baya NESRINE,12,0 - 0,,"1,522 / 2"
578,579,TPE TPE,Jhe-Huei LEE Ya-Han CHANG,0,0 - 0,,"1,520 / 1"
579,579,TPE TPE,Yuan Cheng WU Yu Chen CHANG,0,0 - 0,,"1,520 / 1"
580,579,CHI CHI,Cristobal CAMPOS Nicole NAVARRETE,12,0 - 0,,"1,520 / 1"
581,579,CHI CHI,Sebastian MARTINEZ Nicol SALINAS,12,0 - 0,,"1,520 / 1"
582,579,ENG ENG,Ben LANE Emily WESTWOOD,12,0 - 0,,"1,520 / 1"
583,579,AUS INA,Michael FARIMAN Sylvina KURNIAWAN,12,0 - 0,,"1,520 / 1"
584,579,GHA GHA,Emmanuel YAW DONKOR Victoria ASMAH,12,0 - 0,,"1,520 / 1"
585,579,NGR NGR,Clement KROBAKPO Augustina EBHOMIEN SUNDAY,12,0 - 0,,"1,520 / 1"
586,579,GUA GUA,Christopher Alexander MARTINEZ SALVADOR Alejandra Jose PAIZ QUAN,12,0 - 0,,"1,520 / 1"
587,579,INA INA,Yohanes Rendy SUGIARTO Dian FITRIANI,12,0 - 0,,"1,520 / 1"
588,579,INA INA,Afiat Yuris WIRAWAN Nadya MELATI,12,0 - 0,,"1,520 / 1"
589,579,NGR NGR,Joshua Adeyemi ODELABI Fatima AZEEZ,12,0 - 0,,"1,520 / 1"
590,579,RUS RUS,Sergey SCHERBIN Anastasia NAZARCHUK,12,0 - 0,,"1,520 / 1"
591,579,MAS MAS,Ahmad Maziri MAZLAN Sannatasah SANIRU,12,0 - 0,,"1,520 / 1"
592,579,PER PER,Javier JIMENO Sandra JIMENO GOICOCHEA,12,0 - 0,,"1,520 / 1"
593,579,JPN JPN,Kento SAKAI Hikari SAITO,12,0 - 0,,"1,520 / 1"
594,579,THA THA,Trawut POTIENG Pacharapun CHOCHUWONG,12,0 - 0,,"1,520 / 1"
595,579,THA THA,Parinyawat THONGNUAM Chaladchalam Chayanit,12,0 - 0,,"1,520 / 1"
596,579,SIN SIN,Bimo Adi PRAKOSO Yu Yan Vanessa NEO,12,0 - 0,,"1,520 / 1"
597,579,GUA PER,Rodolfo RAMIREZ Camila DUANY,12,0 - 0,,"1,520 / 1"
598,579,ENG GER,Matthew NOTTINGHAM Jennifer KARNOTT,12,0 - 0,,"1,520 / 1"
599,579,CHN CHN,YU Chen XIA Chunyu,12,0 - 0,,"1,520 / 1"
600,579,NZL TPE,Oliver LEYDON-DAVIS WU Fang Chien,12,0 - 0,,"1,520 / 1"
601,579,CHN CHN,LI Xun LI Yinhui,12,0 - 0,,"1,520 / 1"
602,579,TPE TPE,Shang Kai LIN Ying Chun LIN,12,0 - 0,,"1,520 / 1"
603,579,CHN CHN,ZHOU Haodong CHEN Lu,12,0 - 0,,"1,520 / 1"
604,579,CHN CHN,ZHAO Jian JIANG Binbin,12,0 - 0,,"1,520 / 1"
605,579,CHN CHN,OU Zhe CHEN Xiaofei,12,0 - 0,,"1,520 / 1"
606,579,INA SWE,Wibowo SETYALDI PUTRA Cecilia BJUNER,12,0 - 0,,"1,520 / 1"
607,579,THA THA,Pasin SONGHONG Sararat CHUEBOCA,12,0 - 0,,"1,520 / 1"
608,579,INA INA,Fachriza ABIMANYU Phita Haningtyas MENTARI,12,0 - 0,,"1,520 / 1"
609,579,INA INA,Hendrik K CLINTON Zarra Faza AZKA,12,0 - 0,,"1,520 / 1"
610,579,IND IND,Abhinav PRAKASH Nimmi PATEL,12,0 - 0,,"1,520 / 1"
611,579,BAN BAN,Mohammed Jabed MOSTAFA Alina SULTANA,12,0 - 0,,"1,520 / 1"
612,579,NEP NEP,Indra MEHATA Meena SHRESTHA,12,0 - 0,,"1,520 / 1"
613,579,NEP NEP,Pankaj CHAND Amita GIRI,12,0 - 0,,"1,520 / 1"
614,579,BAN BAN,Tushar Krishna ROY MST Rehana PARVIN,12,0 - 0,,"1,520 / 1"
615,579,TPE WAL,Hsuan Ming LEE Carissa TURNER,12,0 - 0,,"1,520 / 1"
616,579,WAL WAL,Oliver GWILT Emilie GWILT,12,0 - 0,,"1,520 / 1"
617,579,ENG ENG,Joel DOUSE Paige BUTLER,12,0 - 0,,"1,520 / 1"
618,579,SCO ENG,Matthew CARDER Lexi GILDERS,12,0 - 0,,"1,520 / 1"
619,579,THA THA,Kittisak NAMDASH Chanisa TEACHAVORASINSKUN,-253,0 - 0,,"1,520 / 1"
620,579,CHN CHN,HUANG Kaixiang JIA Yifan,12,0 - 0,,"1,520 / 1"
621,579,POL POL,Milosz BOCHAT Aneta WOJTKOWSKA,-85,0 - 0,,"1,520 / 1"
622,579,AUS AUS,Bernhard HALIM Elena Yee-Man KWOK,12,0 - 0,,"1,520 / 1"
623,579,SWE SWE,Toni HOLM-LOWEN Berfin ASLAN,-182,0 - 0,,"1,520 / 1"
624,579,INA INA,Muhammad Rian ARDIANTO Rosyita Eka PUTRI SARI,-182,0 - 0,,"1,520 / 1"
625,579,INA INA,Yodhi SATRIO Wulan Sari SRI,12,0 - 0,,"1,520 / 1"
626,579,RUS RUS,Aleksandr VASILKIN Kristina VIRVICH,12,0 - 0,,"1,520 / 1"
627,579,JPN JPN,Naoki ISHIKAWA Atsuko KOIKE,12,0 - 0,,"1,520 / 1"
628,579,TPE TPE,Cheng Heng SU WU Fang Chien,0,0 - 0,,"1,520 / 1"
629,579,DEN DEN,Theodor JOHANSEN Isabella NIELSEN,12,0 - 0,,"1,520 / 1"
630,579,FRA FRA,Thomas ROUXEL Lea PALERMO,12,0 - 0,,"1,520 / 1"
631,579,BRA BRA,Luiz dos SANTOS JR Ana Paula CAMPOS,12,0 - 0,,"1,520 / 1"
632,579,RUS RUS,Gordey KOSENKO Olga LIPKINA,12,0 - 0,,"1,520 / 1"
633,579,SRI SRI,Hasitha Chanaka MANANI HEWA Kavindi Ishandika SIRIMANNAGE,12,0 - 0,,"1,520 / 1"
634,579,KEN KEN,Matheri Joseph GITHITU Lavina MARTINS,12,0 - 0,,"1,520 / 1"
635,579,RUS RUS,Tatjana BIBIK Nikolai UKK,12,0 - 0,,"1,520 / 1"
636,637,CZE CZE,Bedrich VALENTA Veronika KOLDOVA,11,0 - 0,,"1,500 / 4"
637,638,DEN SWE,Andreas HOFFMANN Berfin ASLAN,164,0 - 0,,"1,470 / 2"
638,638,AUS AUS,Blake HAGGERTY Chloe LEE,11,0 - 0,,"1,470 / 2"
639,638,NZL NZL,Niccolo TAGLE Sally FU,11,0 - 0,,"1,470 / 2"
640,638,MAS MAS,"Ahmad Maziri MAZLAN Peiy Yee, Payee LIM",11,0 - 0,,"1,470 / 2"
641,638,POL POL,Pawel SMILOWSKI Magdalena SWIERCZYNSKA,11,0 - 0,,"1,470 / 2"
642,638,THA THA,Natchanon TULAMOK Pattaranan CHAMNAKTAN,11,0 - 0,,"1,470 / 2"
643,638,DOM DOM,Nelson JAVIER Bermary Altagracia POLANCO MUNOZ,11,0 - 0,,"1,470 / 2"
644,638,CHI CHI,Bastian LIZAMA Niria BAEZA,11,0 - 0,,"1,470 / 2"
645,638,INA INA,Gea KAMAHAMAS Brigita Marcelia RUMAMBI,11,0 - 0,,"1,470 / 2"
646,638,TPE TPE,Chia-Han LEE Wen Chi HSU,11,0 - 0,,"1,470 / 2"
647,638,NZL NZL,Dylan SOEDJASA Alyse DERBY,11,0 - 0,,"1,470 / 2"
648,638,AUT CZE,Dominik STIPSITS Katerina TOMALOVA,11,0 - 0,,"1,470 / 2"
649,638,PER PER,Leonardo ISA Chiara CARRANZA,11,0 - 0,,"1,470 / 2"
650,638,POL POL,Maciej DABROWSKI WITEK MAGDALENA,-139,0 - 0,,"1,470 / 2"
651,638,BRN BRN,Rohit JAYKUMAR Sapna PRABHU,11,0 - 0,,"1,470 / 2"
652,638,TRI TRI,Nicholas BONKOWSKY Solangel GUZMAN,11,0 - 0,,"1,470 / 2"
653,638,INA INA,Indra Viki OKVANA Rosy Oktavia PANCASARI,11,0 - 0,,"1,470 / 2"
654,638,POL POL,Milosz BOCHAT WITEK MAGDALENA,11,0 - 0,,"1,470 / 2"
655,656,NOR NOR,Carl Christian MORK Elisa WIBORG,9,0 - 0,,"1,450 / 3"
656,656,NOR NOR,Sturla Flaten JORGENSEN Solvar FLATEN JORGENSEN,9,0 - 0,,"1,450 / 3"
657,658,ISR ISR,Lior KROYTER Dana KUGEL,10,0 - 0,,"1,420 / 1"
658,659,PUR PUR,Raynaldo VARGAS CARMENATTY Vitmary RIVERA RODRIGUEZ,0,0 - 0,,"1,370 / 1"
659,659,PUR PUR,Joshua SOLER ROMÁN Saribel CACERES,0,0 - 0,,"1,370 / 1"
660,659,PUR PUR,Luis PEREZ JUSTINIANO Yuneyshka GUZMÁN ROSA,0,0 - 0,,"1,370 / 1"
661,659,DEN DEN,Soeren TOFT HANSEN Alexandra BOJE,0,0 - 0,,"1,370 / 1"
662,659,DEN DEN,Theodor JOHANSEN Mai SURROW,0,0 - 0,,"1,370 / 1"
663,659,DEN DEN,Joshua EIPE Irina Amalie ANDERSEN,0,0 - 0,,"1,370 / 1"
664,659,NCL NCL,Glenn GOWET Pampimol PRAKRAIWAN,10,0 - 0,,"1,370 / 1"
665,659,NCL NCL,Carl NGUELA Julie DERNE,10,0 - 0,,"1,370 / 1"
666,659,JOR JOR,Thaer AMRO Haneen Derar AL-WEDYAN,10,0 - 0,,"1,370 / 1"
667,659,MAR MAR,Yassine ERRAJI Khawla MAKRANE,10,0 - 0,,"1,370 / 1"
668,659,ARG ARG,Serafin ZAYAS Micaela SUAREZ,10,0 - 0,,"1,370 / 1"
669,659,INA INA,Albert ADIDJUWONO Fransisca Angelica RAHARDJA,10,0 - 0,,"1,370 / 1"
670,659,NGR NGR,Julius OLUKOTUN Zainab AKINYEMI,10,0 - 0,,"1,370 / 1"
671,659,CHI CHI,Alonso MEDEL Jenny CEPEDA,10,0 - 0,,"1,370 / 1"
672,659,KOR KOR,RHO Ye Wook Soo Bin LIM,10,0 - 0,,"1,370 / 1"
673,659,CRO NED,Zvonimir HOELBLING Gayle MAHULETTE,10,0 - 0,,"1,370 / 1"
674,659,AUS AUS,David Seng Hong LEE Chloe CHEN,10,0 - 0,,"1,370 / 1"
675,659,AUS AUS,Le The Hung PHAM Grace HANRATTY,10,0 - 0,,"1,370 / 1"
676,659,AUS AUS,Eric VUONG Talia SAUNDERS,10,0 - 0,,"1,370 / 1"
677,659,TPE TPE,Chia Hung LU Ching Hui CHANG,10,0 - 0,,"1,370 / 1"
678,659,TPE TPE,Wei Chi LIU Tzu Chin PAN,10,0 - 0,,"1,370 / 1"
679,659,TUR TUR,Mehmet OZTURK Kurba OZTURK,10,0 - 0,,"1,370 / 1"
680,659,RUS RUS,Nikita FEDOTOVSKIKH Lela MINADZE,10,0 - 0,,"1,370 / 1"
681,659,RSA RSA,Cameron COETZER Sandra LE GRANGE,10,0 - 0,,"1,370 / 1"
682,659,BAR CZE,Sabeel FOSTER Marcela RUZICKA,10,0 - 0,,"1,370 / 1"
683,659,TRI TRI,Will LEE Avril PLAZA MARCELLE,10,0 - 0,,"1,370 / 1"
684,659,CZE TRI,Jan FROHLICH Kamasha ROBERTSON,10,0 - 0,,"1,370 / 1"
685,659,INA INA,Yantoni Edy SAPUTRA Marsheilla Gischa ISLAMI,10,0 - 0,,"1,370 / 1"
686,659,MAS MAS,Sze Fei GOH Mei Xing TEOH,10,0 - 0,,"1,370 / 1"
687,659,SWE SWE,Paul OHLSSON Berfin ASLAN,10,0 - 0,,"1,370 / 1"
688,659,CHI CHI,Bastian LIZAMA Tingting CHOU,10,0 - 0,,"1,370 / 1"
689,659,INA GER,Maziyyah NADHIR Ari TRISNANTO,10,0 - 0,,"1,370 / 1"
690,659,INA INA,Arya Maulana ADIARTAMA Surya DELLA AUGUSTIA,10,0 - 0,,"1,370 / 1"
691,659,SIN SIN,Kean Yew LOH Ai Ninna TAN,10,0 - 0,,"1,370 / 1"
692,659,DEN DEN,Mathias Lund HANSEN Cecilie FINNE-IPSEN,10,0 - 0,,"1,370 / 1"
693,659,FRA FRA,Toma Junior POPOV Delphine DELRUE,10,0 - 0,,"1,370 / 1"
694,659,BOT BOT,Tlhoego CHAMO MALEPA Dintle,10,0 - 0,,"1,370 / 1"
695,659,DOM DOM,Cesar Adonis BRITO GONZALEZ Nairoby Abigail JIMENEZ,10,0 - 0,,"1,370 / 1"
696,659,RSA RSA,Jason COETZER Karen COETZER,10,0 - 0,,"1,370 / 1"
697,659,TUR TUR,Kubilay SADI Yaren DOLCU,10,0 - 0,,"1,370 / 1"
698,659,MRI MRI,Yeldy Marie LOUISON Denneshsing BABOOLALL,10,0 - 0,,"1,370 / 1"
699,659,GUA GUA,Brandon SAMAYOA Maria Regina DEL VALLE LEYSBETH,10,0 - 0,,"1,370 / 1"
700,659,SUI SUI,Gilles TRIPET Tiffany GIRONA,10,0 - 0,,"1,370 / 1"
701,659,DEN DEN,Mikkel STOFFERSEN Mathilde BJERGEN,10,0 - 0,,"1,370 / 1"
702,659,DEN DEN,Mathias Lund HANSEN Emilie FURBO,10,0 - 0,,"1,370 / 1"
703,659,MAR MAR,Yassine EL MERNISSI Jinane BITARIE,10,0 - 0,,"1,370 / 1"
704,659,GER GER,Tobias WADENKA Kira KATTENBECK,10,0 - 0,,"1,370 / 1"
705,659,PUR PUR,Pedro ZAPATA Genesis VALENTIN,10,0 - 0,,"1,370 / 1"
706,659,DOM DOM,Miguel MARINEZ Licelott SANCHEZ,10,0 - 0,,"1,370 / 1"
707,659,MAR MAR,Hamza HOUMIDA Harag NAZIK,10,0 - 0,,"1,370 / 1"
708,659,NCL NCL,Joey SANTINO Cecilia MOUSSY,10,0 - 0,,"1,370 / 1"
709,659,INA INA,Yahya Adi KUMARA Rahmadhani Hasiyanti PUTRI,10,0 - 0,,"1,370 / 1"
710,659,MDV MDV,Mohamed Ajfan RASHEED Aishath Afnaan RASHEED,10,0 - 0,,"1,370 / 1"
711,659,BOT BOT,Tefo KABOMO Tessa KABELO,10,0 - 0,,"1,370 / 1"
712,659,SUR SUR,Mitchel WONGSODIKROMO Crystal LEEFMANS,-252,0 - 0,,"1,370 / 1"
713,659,PER PER,Sebastian MACIAS Danica NISHIMURA,10,0 - 0,,"1,370 / 1"
714,659,ISL ISL,Daniel THOMSEN Margrét JOHANNSDOTTIR,10,0 - 0,,"1,370 / 1"
715,659,DOM DOM,Nelson JAVIER VIBIECA BERONICA,-371,0 - 0,,"1,370 / 1"
716,717,TPE TPE,CHEN Chung Jen Ching Hui CHANG,6,0 - 0,,"1,290 / 1"
717,717,JPN JPN,Kohei GONDO Sayaka HIROTA,6,0 - 0,,"1,290 / 1"
718,717,HKG HKG,YEUNG Shing Choi CHEUNG Ying Mei,6,0 - 0,,"1,290 / 1"
719,717,TPE TPE,Chi-Hung LIAO Ya Ting CHIANG,6,0 - 0,,"1,290 / 1"
720,717,GER GER,Tobias WADENKA Barbara BELLENBERG,6,0 - 0,,"1,290 / 1"
721,717,NED NED,Robin TABELING Samantha BARNING,6,0 - 0,,"1,290 / 1"
722,717,INA INA,Hendra Aprida GUNAWAN Shendy Puspa IRAWATI,6,0 - 0,,"1,290 / 1"
723,717,TPE TPE,TSENG Min Hao Jing Ya YE,6,0 - 0,,"1,290 / 1"
724,717,RUS RUS,Andrey JDANOV Olesia KISTER,6,0 - 0,,"1,290 / 1"
725,717,MEX MEX,Antonio OCEGUEDA Sabrina SOLIS,6,0 - 0,,"1,290 / 1"
726,717,GUY GUY,Narayan RAMDHANI Priyanna RAMDHANI,6,0 - 0,,"1,290 / 1"
727,717,ESA ESA,GUARDADO Jassiel Fatima Beatriz CENTENO FUENTES,6,0 - 0,,"1,290 / 1"
728,717,SUR SUR,Dylan DARMOHOETOMO Priscila TJITRODIPO,6,0 - 0,,"1,290 / 1"
729,717,CAN CAN,Austin James BAUER Joanne Yu CHEN,6,0 - 0,,"1,290 / 1"
730,717,GUM COK,David YAO Kate SCOTT,6,0 - 0,,"1,290 / 1"
731,717,COK COK,John TAULU Ngaoa RANGINUI,6,0 - 0,,"1,290 / 1"
732,717,NZL NZL,Kerwyn LEE Angie LEUNG,6,0 - 0,,"1,290 / 1"
733,717,NZL NZL,Luke CHARLESWORTH Alyse DERBY,6,0 - 0,,"1,290 / 1"
734,717,AUS AUS,Mitchell WHELLER Hsuan-Yu Wendy CHEN,6,0 - 0,,"1,290 / 1"
735,717,USA USA,Ryan CHEW Sydney LEE,6,0 - 0,,"1,290 / 1"
736,717,BRA BRA,Alex Yuwan TJONG Ana Paula CAMPOS,-391,0 - 0,,"1,290 / 1"
737,717,TPE TPE,Chi Yu LO HSIEH Pei Chen,6,0 - 0,,"1,290 / 1"
738,717,USA USA,Rudi GUNAWAN Ariel LEE,6,0 - 0,,"1,290 / 1"
739,717,TPE TPE,KUO Ching-Hung YU Min Ju,6,0 - 0,,"1,290 / 1"
740,717,SCO SCO,Alexander DUNN Holly NEWALL,6,0 - 0,,"1,290 / 1"
