,RANK,COUNTRY,PLAYER,CHANGE +/-,WIN - LOSE,PRIZE MONEY,POINTS / TOURNAMENTS
360,361,INA INA,Henry Jansen Putra WIBOWO Rena ASELA,-5,0 - 0,,"2,720 / 1"
361,361,CHN CHN,LI Junhui DU Yue,-5,0 - 0,,"2,720 / 1"
362,361,KOR KOR,Dong Joo KIM KIM Chan Mi,-5,0 - 0,,"2,720 / 1"
363,361,TPE TPE,YANG Po Han CHEN Hsiao Huan,-5,0 - 0,,"2,720 / 1"
364,361,CHN CHN,HUANG Kaixiang ZHONG Qianxin,-5,0 - 0,,"2,720 / 1"
365,361,IND IND,K. Ajay Kumar Smriti NAGARKOTI,-5,0 - 0,,"2,720 / 1"
366,361,IND IND,SINGH Vinay Kumar MUKHERJEE Riya,-5,0 - 0,,"2,720 / 1"
367,361,JPN JPN,Kenta KAZUNO Shizuka MATSUO,-5,0 - 0,,"2,720 / 1"
368,361,IND IND,Utkarsh ARORA Mohita SAHDEV,-5,0 - 0,,"2,720 / 1"
369,361,IND IND,Sanyam SHUKLA Sanyogita GHORPADE,-5,0 - 0,,"2,720 / 1"
370,361,NZL IND,Abhinav MANOTA Rachita SAHDEV,-5,0 - 0,,"2,720 / 1"
371,361,GER GER,Andreas HEINZ Annika HORBACH,-5,0 - 0,,"2,720 / 1"
372,373,RUS RUS,Artem SERPIONOV Tatjana BIBIK,-4,0 - 0,,"2,670 / 2"
373,373,TUR TUR,Burak Furkan DEMIR Büşra BENK,142,0 - 0,,"2,670 / 2"
374,373,NGR NGR,Idowu Timothy ADEKUNLE Asisat OGUNKANBI,-4,0 - 0,,"2,670 / 2"
375,373,INA INA,Reinard DHANRIANO Sinta Arum ANTASARI,-4,0 - 0,,"2,670 / 2"
376,373,BOT BOT,Orideetse THELA Botho MAKUBATE,-4,0 - 0,,"2,670 / 2"
377,378,THA THA,Sudket PRAPAKAMOL Sapsiree TAERATTANACHAI,-5,0 - 0,,"2,660 / 1"
378,379,SLO SLO,Martin CERKOVNIK Ana Marija SETINA,-5,0 - 0,,"2,640 / 3"
379,380,UZB UZB,Amrullo BAKHSHULLAEV Anait KHURSHUDYAN,-5,0 - 0,,"2,590 / 5"
380,381,INA INA,Jeka WIRATAMA Surya DELLA AUGUSTIA,-5,0 - 0,,"2,590 / 2"
381,381,NZL NZL,Kevin DENNERLY-MINTURN Danielle TAHURI,-5,0 - 0,,"2,590 / 2"
382,381,INA INA,Afiat Yuris WIRAWAN Jenna GOZALI,-5,0 - 0,,"2,590 / 2"
383,381,CHN CHN,YU Xiaoyu ZHU Mai Ci,-5,0 - 0,,"2,590 / 2"
384,385,USA USA,Yan Tuck CHAN Yuko KAWASAKI,341,0 - 0,,"2,580 / 2"
385,385,SCO AUS,Alistair CASEY Melinda SUN,341,0 - 0,,"2,580 / 2"
386,385,IND IND,Rajat RATHORE Parssa NAQVI,-5,0 - 0,,"2,580 / 2"
387,388,RUS RUS,Vladimir NIKULOV Daria SEREBRIAKOVA,-7,0 - 0,,"2,560 / 4"
388,389,HKG HKG,CHUNG Yonny NG Tsz Yau,-7,0 - 0,,"2,550 / 2"
389,389,IND IND,Prem Singh CHOUHAN Saruni SHARMA,-7,0 - 0,,"2,550 / 2"
390,391,MAS MAS,Wee Gieen TAN Yen Wei PECK,-7,0 - 0,,"2,520 / 4"
391,392,SEY SEY,Georgie CUPIDON Allisen CAMILLE,-7,0 - 0,,"2,515 / 2"
392,393,NZL NZL,Dhanny OUD Jasmin Chung Man NG,-7,0 - 0,,"2,510 / 4"
393,394,POL POL,Maciej OCIEPA GAJOS KAROLINA,-7,0 - 0,,"2,500 / 6"
394,395,BRA BRA,Alex Yuwan TJONG Fabiana SILVA,-7,0 - 0,,"2,500 / 1"
395,395,KOR KOR,KIM Young Sun Ja Yeong LEE,-7,0 - 0,,"2,500 / 1"
396,395,CRO CRO,Zvonimir DURKINJAK Mateja CICA,-7,0 - 0,,"2,500 / 1"
397,395,TPE TPE,Chia-Han LEE Chia Hsin LEE,-7,0 - 0,,"2,500 / 1"
398,395,INA INA,Rian SWASTEDIAN Masita MAHMUDIN,-7,0 - 0,,"2,500 / 1"
399,400,TPE TPE,Li-Wei PO Hsin-Yu TSAI,-6,0 - 0,,"2,470 / 3"
400,401,SCO SCO,Josh NEIL Rebekka FINDLAY,-6,0 - 0,,"2,450 / 4"
401,402,ETH ETH,TEKLU Endale Yerusksew Legssey TURA,-6,0 - 0,,"2,442 / 3"
402,403,ESP ESP,Juan Manuel FERNANDEZ QUILES Haidee OJEDA,-6,0 - 0,,"2,440 / 2"
403,403,BUL BUL,Alex VLAAR Petya NEDELCHEVA,-6,0 - 0,,"2,440 / 2"
404,405,ESP ESP,Javier SANCHEZ SOLER Laura MOLINA,-6,0 - 0,,"2,410 / 4"
405,406,INA INA,Agripinna Prima Rahmanto PUTRA Aprilsasi Putri LEJARSAR VARIELLA,-6,0 - 0,,"2,400 / 2"
406,407,INA INA,Fachriza ABIMANYU Syifa FAUZIAH,-6,0 - 0,,"2,390 / 3"
407,407,GER GER,Johannes PISTORIUS Ramona HACKS,-6,0 - 0,,"2,390 / 3"
408,407,THA THA,Panachai WORASAKTYANAN Rawimon IAMRATANAMAETHEEKUL,-6,0 - 0,,"2,390 / 3"
409,407,ARG ARG,Federico DIAZ Daiana GARMENDIA,-6,0 - 0,,"2,390 / 3"
410,411,WAL ENG,William KITCHING Til'Shiloh SHAW,-6,0 - 0,,"2,380 / 3"
411,412,ESP ESP,Pablo ABIAN Haidee OJEDA,-6,0 - 0,,"2,370 / 2"
412,413,JOR JOR,Mohd Naser Mansour NAYEF Mazahreh LEINA FEHMI,-6,0 - 0,,"2,350 / 2"
413,414,MAS MAS,"Zhen Ting LIM Peiy Yee, Payee LIM",-6,0 - 0,,"2,320 / 3"
414,415,IND IND,Manu ATTRI NELAKURIHI Sikki Reddy,-6,0 - 0,,"2,306 / 1"
415,416,SCO SCO,Patrick MACHUGH Rebekka FINDLAY,-6,0 - 0,,"2,300 / 2"
416,417,ZAM ZAM,Topsy PHIRI Elizaberth CHIPELEME,-6,0 - 0,,"2,290 / 2"
417,417,BRN BRN,Vishnu SREEKUMAR Anza ABDULRAHIM,-6,0 - 0,,"2,290 / 2"
418,417,SLO SLO,Miha IVANIC Lia SALEHAR,-6,0 - 0,,"2,290 / 2"
419,417,PHI PHI,Christian BERNARDO Eleanor Christine INLAYO,-6,0 - 0,,"2,290 / 2"
420,417,PER PER,Daniel LA TORRE REGAL Camilla GARCIA,-6,0 - 0,,"2,290 / 2"
421,417,UZB RUS,Artyom SAVATYUGIN Polina VORONKO,-6,0 - 0,,"2,290 / 2"
422,417,TUR TUR,Kubilay SADI Yaren DOLCU,244,0 - 0,,"2,290 / 2"
423,417,NGR NGR,Ayila GWAMBEH Patricia AKPUSUGH,-6,0 - 0,,"2,290 / 2"
424,417,GRE GRE,George GALVAS Zoi ALELI,-6,0 - 0,,"2,290 / 2"
425,417,AUS AUS,Ashwant GOBINATHAN Alice WU,-6,0 - 0,,"2,290 / 2"
426,427,TPE TPE,TSENG Min Hao HUANG Mei Ching,-7,0 - 0,,"2,220 / 1"
427,427,IND IND,Kamaldeep SINGH Smriti NAGARKOTI,-7,0 - 0,,"2,220 / 1"
428,427,IND IND,Rishabh SAHDEV Mohita SAHDEV,-7,0 - 0,,"2,220 / 1"
429,427,IND IND,Varun SHARMA Rachita SAHDEV,-7,0 - 0,,"2,220 / 1"
430,427,UZB UZB,Amrullo BAKHSHULLAEV Valeriya MUSHTAKOVA,-7,0 - 0,,"2,220 / 1"
431,427,MAC MAC,WONG Chi Chong Teng Iok U,-7,0 - 0,,"2,220 / 1"
432,427,CHN CHN,WANG YILYU XIA Huan,-7,0 - 0,,"2,220 / 1"
433,427,KAZ KAZ,Artur NIYAZOV Ilyana FILIPCHUK,-7,0 - 0,,"2,220 / 1"
434,435,CAN CAN,Pierre-Etienne PILOTE Michelle TONG,-7,0 - 0,,"2,210 / 2"
435,436,MRI MRI,Yeldy Marie LOUISON Christopher PAUL,-7,0 - 0,,"2,202 / 2"
436,437,TUR TUR,Emre SONMEZ Bengisu ERCETIN,0,0 - 0,,"2,200 / 1"
437,437,TUR TUR,Mert TUNCO Merve COBAN,0,0 - 0,,"2,200 / 1"
438,437,INA INA,Amri SYAHNAWI AZISAH Syafitri Nur,-7,0 - 0,,"2,200 / 1"
439,437,CRO RUS,Zvonimir HOELBLING Olga MOROZOVA,-7,0 - 0,,"2,200 / 1"
440,437,CAN CAN,PHILLIPE Gaumond Josephine WU,-7,0 - 0,,"2,200 / 1"
441,437,ENG ENG,ROE Michael Nicola GRESTY,-7,0 - 0,,"2,200 / 1"
442,437,INA INA,Agripinna Prima Rahmanto PUTRA Syifa FAUZIAH,-7,0 - 0,,"2,200 / 1"
443,437,UKR UKR,Valeriy ATRASHCHENKOV Natalya VOYTSEKH,-7,0 - 0,,"2,200 / 1"
444,437,ESA ESA,GUARDADO Jassiel Georgina Penelope ORELLANA SANTOS,-7,0 - 0,,"2,200 / 1"
445,437,INA INA,Angger SUDRAJAT Jenna GOZALI,-7,0 - 0,,"2,200 / 1"
446,437,RUS RUS,Konstantin ABRAMOV Natalia Rogova,-7,0 - 0,,"2,200 / 1"
447,437,JPN JPN,Akira KOGA Yuki FUKUSHIMA,-7,0 - 0,,"2,200 / 1"
448,437,JPN JPN,Takuto INOUE Naru SHINOYA,-7,0 - 0,,"2,200 / 1"
449,437,DEN DEN,David DAUGAARD Maria HELSBOL,-7,0 - 0,,"2,200 / 1"
450,437,TPE TPE,HUANG Po Jui WU Fang Chien,-7,0 - 0,,"2,200 / 1"
451,437,CHN CHN,GAO Xiangcheng WU Qianqian,-7,0 - 0,,"2,200 / 1"
452,437,CHN CHN,GUO Yuchen ZHENG Yuwen,-7,0 - 0,,"2,200 / 1"
453,437,THA THA,Wasapon UTTAMANG Thanaporn KIAWCHA-ON,-7,0 - 0,,"2,200 / 1"
454,437,THA THA,Pakkawat VILAILAK Phataimas MUENWONG,-7,0 - 0,,"2,200 / 1"
455,437,THA THA,Takdanai BOONRAWD Kilasu OSTERMEYER,-7,0 - 0,,"2,200 / 1"
456,437,NGR NGR,Enejoh ABAH Tosin Damilola ATOLAGBE,-7,0 - 0,,"2,200 / 1"
457,437,NGR NGR,Ola FAGBEMI Dorcas Ajoke ADESOKAN,-7,0 - 0,,"2,200 / 1"
458,437,USA USA,Mathew FOGARTY Lina TAFT,-7,0 - 0,,"2,200 / 1"
459,437,IND IND,Pranaav Jerry CHOPRA K. Maneesha,-7,0 - 0,,"2,200 / 1"
460,437,CHN CHN,LI Junhui OU Dongni,-7,0 - 0,,"2,200 / 1"
461,437,THA THA,Nipitphon PUANGPUAPECH Savitree AMITRAPAI,-7,0 - 0,,"2,200 / 1"
462,437,BAN BAN,Parash Md.AHSUN HABIB Aktar SHAPLA,-7,0 - 0,,"2,200 / 1"
463,437,SEY SEY,Steve MALCOUZANNE Cynthia COURSE,-7,0 - 0,,"2,200 / 1"
464,437,NGR NGR,Jinkan Ifraimu BULUS Susan IDEH,-7,0 - 0,,"2,200 / 1"
465,437,CZE CZE,Milan LUDIK Kristina GAVNHOLT,-7,0 - 0,,"2,200 / 1"
466,467,MAS SUI,Beryno Jiann Tze WONG Ayla HUSER,-9,0 - 0,,"2,160 / 3"
467,468,GHA GHA,Daniel SAM Gifty MENSAH,-9,0 - 0,,"2,130 / 2"
468,469,SUR SUR,Dylan DARMOHOETOMO Jill SJAUW - MOOK,-9,0 - 0,,"2,130 / 1"
469,469,KOR KOR,KIM Dae Sung Ga Ae KANG,-9,0 - 0,,"2,130 / 1"
470,469,DEN DEN,Maja RINDSHOEJ Kristoffer KNUDSEN,-9,0 - 0,,"2,130 / 1"
471,469,DEN DEN,Lasse MOELHEDE Trine VILLADSEN,-9,0 - 0,,"2,130 / 1"
472,469,TUR TUR,Muhammed Ali KURT Kader İNAL,-9,0 - 0,,"2,130 / 1"
473,469,TPE TPE,Yuan Cheng WU Hsin Tien CHANG,-9,0 - 0,,"2,130 / 1"
474,469,NCL NCL,Loic MENNESSON Johanna KOU,-9,0 - 0,,"2,130 / 1"
475,469,JOR JOR,Bahaedeen Ahmad ALSHANNIK Domou AMRO,-9,0 - 0,,"2,130 / 1"
476,469,PER PER,Daniel LA TORRE REGAL Daniela MACIAS,-9,0 - 0,,"2,130 / 1"
477,469,GER GER,Max WEISSKIRCHEN Eva JANSSENS,-9,0 - 0,,"2,130 / 1"
478,469,BRA BRA,Daniel PAIOLA Fabiana SILVA,-9,0 - 0,,"2,130 / 1"
479,469,MRI MRI,Sahir Abdool EDOO Yeldy Marie LOUISON,-9,0 - 0,,"2,130 / 1"
480,481,MEX MEX,Humberto AGUIRRE FAJARDO Yesenia DUARTE,0,0 - 0,,"2,110 / 1"
481,481,ENG ENG,Andrew SMITH Jenny WALLWORK,-9,0 - 0,,"2,110 / 1"
482,481,SCO SCO,Martin CAMPBELL Julie MACPHERSON,-9,0 - 0,,"2,110 / 1"
483,481,TPE TPE,HUNG Ying Yuan Pei Shan HSIEH,-9,0 - 0,,"2,110 / 1"
484,481,TPE TPE,Hsu JUI TING LEE Wei Tzu,-9,0 - 0,,"2,110 / 1"
485,481,CHN CHN,WANG Sijie OU Dongni,-9,0 - 0,,"2,110 / 1"
486,481,JPN JPN,Kenya MITSUHASHI Chisato HOSHI,-9,0 - 0,,"2,110 / 1"
487,481,AUS AUS,Edwin LUK Ruwindi SERASINGHE,-9,0 - 0,,"2,110 / 1"
488,481,AUS AUS,Simon Wing Hang LEUNG Claudia LAM,-9,0 - 0,,"2,110 / 1"
489,481,NZL NZL,Brock MATHESON Rebecca GODDARD,-9,0 - 0,,"2,110 / 1"
490,491,IND IND,Harinder MALIK Teenu DAHIYA,-9,0 - 0,,"2,100 / 2"
491,491,IND IND,Gaurav KALIA Ekta KALIA,-9,0 - 0,,"2,100 / 2"
492,493,SRB SRB,Dragoslav PETROVIC Milica SIMIC,-9,0 - 0,,"2,090 / 3"
493,494,NZL NZL,Abhinav MANOTA Justine VILLEGAS,-9,0 - 0,,"2,070 / 3"
494,495,INA INA,Richard KUNCORO Zarra Faza AZKA,-9,0 - 0,,"2,070 / 2"
495,495,PER PER,Diego MINI Paula LA TORRE REGAL,-9,0 - 0,,"2,070 / 2"
496,495,CHI CHI,Cristian ARAYA Camila MACAYA,-9,0 - 0,,"2,070 / 2"
497,495,KEN KEN,Patrick Kinyua MBOGO Mercy JOSEPH,-9,0 - 0,,"2,070 / 2"
498,499,DEN DEN,Jeppe LUDVIGSEN Josephine VAN ZAANE,-9,0 - 0,,"2,050 / 3"
499,500,CZE CZE,Ondrej KOPRIVA Katerina TOMALOVA,-9,0 - 0,,"2,020 / 3"
500,500,SLO SLO,Primoz FLIS Kaja STANKOVIC,-9,0 - 0,,"2,020 / 3"
501,502,NOR NOR,Carl Christian MORK Elisa WIBORG,-9,0 - 0,,"2,000 / 4"
502,502,NOR NOR,Sturla Flaten JORGENSEN Solvar FLATEN JORGENSEN,-9,0 - 0,,"2,000 / 4"
503,504,AUS AUS,Cham CHEN Susan WANG,-9,0 - 0,,"1,950 / 2"
504,504,NZL NZL,Dylan SOEDJASA Justine VILLEGAS,-9,0 - 0,,"1,950 / 2"
505,504,NZL NZL,Maoni HU HE Ashleigh KARL,-9,0 - 0,,"1,950 / 2"
506,504,JPN JPN,Daisuke SUZUKI Midori SAKURAI,-9,0 - 0,,"1,950 / 2"
507,508,TPE TPE,Yu-Hua LAI Shuo Yun SUNG,-9,0 - 0,,"1,920 / 2"
508,508,SUR SUR,Mitchel WONGSODIKROMO Crystal LEEFMANS,-9,0 - 0,,"1,920 / 2"
509,510,GER GER,Andreas HEINZ Jennifer KARNOTT,-9,0 - 0,,"1,900 / 3"
510,511,NZL NZL,Thomas ELLIS Samantha MCCAMISH,-9,0 - 0,,"1,890 / 2"
511,512,INA INA,Muhammad Reza Pahlevi ISFAHANI Zarra Faza AZKA,-9,0 - 0,,"1,880 / 2"
512,512,THA THA,Watchara BURANAKUEA Chaladchalam Chayanit,-9,0 - 0,,"1,880 / 2"
513,514,DEN DEN,Jeppe Bay MADSEN Cecilie FINNE-IPSEN,-9,0 - 0,,"1,840 / 2"
514,514,ENG ENG,Matthew NOTTINGHAM Jessica PUGH,-9,0 - 0,,"1,840 / 2"
515,514,TUR TUR,Mesut SEZER Edanur KOYBASI,288,0 - 0,,"1,840 / 2"
516,514,GRE GRE,Panagiotis SKARLATOS Polyvia TZIKA,-9,0 - 0,,"1,840 / 2"
517,514,INA INA,Indra LESMANA Hera DESI,-9,0 - 0,,"1,840 / 2"
518,514,DEN DEN,Tobias SUDER Line NOERGAARD,-9,0 - 0,,"1,840 / 2"
519,514,GUA GUA,Brandon SAMAYOA Alejandra SAMAYOA ARREAGA,-9,0 - 0,,"1,840 / 2"
520,521,CZE CZE,IVO Stoklas Denisa SIKALOVA,-10,0 - 0,,"1,770 / 4"
521,522,FRA FRA,Thom GICQUEL Vimala HERIAU,-10,0 - 0,,"1,770 / 2"
522,522,RUS RUS,Kirill Romanuk Anna ASTRAKHANTSEVA,-10,0 - 0,,"1,770 / 2"
523,524,ISR ISR,Ariel SHAINSKI Pugach ALINA,-10,0 - 0,,"1,756 / 1"
524,525,BOT BOT,Tlamelang KEPALETSWE Penouua KAHAKA,-10,0 - 0,,"1,750 / 1"
525,525,RSA RSA,James Hilton MCMANUS Jade KRAEMER,-10,0 - 0,,"1,750 / 1"
526,525,RSA RSA,Dorian JAMES Shereen MATTHEWS,-10,0 - 0,,"1,750 / 1"
527,525,ZAM ZAM,Chongo Ezra MULENGA Mary CHILAMBE,-10,0 - 0,,"1,750 / 1"
528,525,DEN DEN,Mikkel MIKKELSEN Mai SURROW,-10,0 - 0,,"1,750 / 1"
529,525,BRN BRN,Heri SETIAWAN Sandra SAKARIA,-10,0 - 0,,"1,750 / 1"
530,525,NCL NCL,Yohan DE GEOFFROY Soizick HO-YAGUES,-10,0 - 0,,"1,750 / 1"
531,525,NCL NCL,Ronan HO-YAGUES Dgenyva MATAULI,-10,0 - 0,,"1,750 / 1"
532,525,JOR JOR,Quasi ABID Razan ALKOTOP,-10,0 - 0,,"1,750 / 1"
533,525,BRA BRA,Rafael LAJUSTICIA Estefane VENTURA,-10,0 - 0,,"1,750 / 1"
534,525,ARG ARG,Lucio CORONATO Ana MONTEFINALE,-10,0 - 0,,"1,750 / 1"
535,525,INA INA,Hardianto HARDIANTO Ulfa ZAKIA,-10,0 - 0,,"1,750 / 1"
536,525,KOR KOR,Yong Hoon JIN OH Bo Kyung,-10,0 - 0,,"1,750 / 1"
537,525,KOR KOR,LEE Cheol Ho Min Ji CHOI,-10,0 - 0,,"1,750 / 1"
538,525,CZE CZE,Jan FROHLICH Veronika KOLDOVA,-10,0 - 0,,"1,750 / 1"
539,525,TPE TPE,Ming-Tse YANG Wan Ting CHEN,-10,0 - 0,,"1,750 / 1"
540,525,MRI MRI,Aatish LUBAH Kobita DOKHEE,-10,0 - 0,,"1,750 / 1"
541,525,INA INA,Ramadiansyah ANDIKA Mychelle Crhystine BANDASO,-10,0 - 0,,"1,750 / 1"
542,525,FIN FIN,Arttu MAHONEN Sonja PEKKOLA,-10,0 - 0,,"1,750 / 1"
543,525,JAM JAM,Willroy MILES Katherine WYNTER,-10,0 - 0,,"1,750 / 1"
544,525,JAM JAM,Dennis COKE Mikaylia HALDANE,-10,0 - 0,,"1,750 / 1"
545,525,ZAM ZAM,Mark BANDA Evelyn SIAMUPANGILA,-10,0 - 0,,"1,750 / 1"
546,525,COL COL,Barrientos MATEO Laura SANCHEZ,-10,0 - 0,,"1,750 / 1"
547,525,NZL NZL,Kevin DENNERLY-MINTURN Susannah LEYDON-DAVIS,-10,0 - 0,,"1,750 / 1"
548,525,NED NED,Jelle MAAS Ilse VAESSEN,-10,0 - 0,,"1,750 / 1"
549,525,FIN FIN,Anton KAISTI Jenny NYSTROM,-10,0 - 0,,"1,750 / 1"
550,525,NGR NGR,Olorunfemi ELEWA Braimoh MARIA,-10,0 - 0,,"1,750 / 1"
551,552,THA THA,Viriyangkura TANUPAT Thanyasuda WONGYA,-8,0 - 0,,"1,730 / 2"
552,552,POL POL,Maciej DABROWSKI Weronika GRUDZINA,-8,0 - 0,,"1,730 / 2"
553,554,DEN FRA,Soeren TOFT HANSEN Teshana VIGNES WARAN,-8,0 - 0,,"1,700 / 1"
554,554,ISR BLR,Ariel SHAINSKI Krestina SILICH,-8,0 - 0,,"1,700 / 1"
555,556,INA INA,Hendra TANDJAYA Monika Intan TUTIHARTA,-8,0 - 0,,"1,670 / 1"
556,556,INA INA,Riky WIDIANTO Annisa SAUFIKA,-8,0 - 0,,"1,670 / 1"
557,556,TPE TPE,YANG Po Han CHEN Shih Ying,-8,0 - 0,,"1,670 / 1"
558,556,TPE TPE,Wei Chen LIU HUNG Shih Han,-8,0 - 0,,"1,670 / 1"
559,556,TPE TPE,Yuan Cheng WU Shuo Yun SUNG,-8,0 - 0,,"1,670 / 1"
560,556,TPE TPE,YANG Po-Hsuan Su Yu CHEN,-8,0 - 0,,"1,670 / 1"
561,556,NZL TPE,Oliver LEYDON-DAVIS Xiao Min LIN,-8,0 - 0,,"1,670 / 1"
562,556,NED TPE,Ruud BOSCH Wan Ching LIN,-8,0 - 0,,"1,670 / 1"
563,556,TPE TPE,HUANG Po Jui CHIANG Kai Hsin,-8,0 - 0,,"1,670 / 1"
564,556,TPE TPE,TIEN Tzu Chieh WU Fang Chien,-8,0 - 0,,"1,670 / 1"
565,556,INA INA,Didit JUANG Aprilsasi Putri LEJARSAR VARIELLA,-8,0 - 0,,"1,670 / 1"
566,556,THA THA,Chaloempon CHAROENKITAMORN Panjarat PRANSOPON,-8,0 - 0,,"1,670 / 1"
567,556,CHN CHN,LIU Yuchen ZHONG Qianxin,-8,0 - 0,,"1,670 / 1"
568,556,CHN CHN,HE Jiting JIA Yifan,-8,0 - 0,,"1,670 / 1"
569,556,AUS AUS,Alphonsus NG Ruwindi SERASINGHE,-8,0 - 0,,"1,670 / 1"
570,556,NZL NZL,Brock MATHESON Angie LEUNG,-8,0 - 0,,"1,670 / 1"
571,556,NZL TPE,Joe WU HUNG Shih Han,-8,0 - 0,,"1,670 / 1"
572,556,CHN CHN,LI Junhui ZHONG Qianxin,-8,0 - 0,,"1,670 / 1"
573,556,TPE TPE,LU Chia Pin Chien Hui YU,-8,0 - 0,,"1,670 / 1"
574,556,FRA FRA,Bastian KERSAUDY Lorraine BAUMANN,-8,0 - 0,,"1,670 / 1"
575,556,FRA FRA,Ronan GUEGUIN Joanna CHAUBE,-8,0 - 0,,"1,670 / 1"
576,556,IND IND,Dinesh CHAUDHRY Rucha NIKAM,-8,0 - 0,,"1,670 / 1"
577,556,IND IND,Shivam SHARMA Sanskriti CHHABRA,-8,0 - 0,,"1,670 / 1"
578,556,MAS MAS,Khim Wah LIM Meng Yean LEE,-8,0 - 0,,"1,670 / 1"
579,556,IND IND,Rishabh SAHDEV Rachita SAHDEV,-8,0 - 0,,"1,670 / 1"
580,556,SUI BUL,Gilles TRIPET Diana DIMOVA,-8,0 - 0,,"1,670 / 1"
581,556,INA INA,Arya Maulana ADIARTAMA Febriani Endar KUSUMAWATI,-8,0 - 0,,"1,670 / 1"
582,556,CHN CHN,ZHANG Wen OU Dongni,-8,0 - 0,,"1,670 / 1"
583,556,IND IND,Varun SHARMA Jyoti NASHIER,-8,0 - 0,,"1,670 / 1"
584,556,TPE TPE,LIANG Jui Wei Chia Hsin LEE,-8,0 - 0,,"1,670 / 1"
585,586,BLR BLR,Dzmitry SAIDAKOU Alesia ZAITSAVA,-8,0 - 0,,"1,660 / 4"
586,587,SWE SWE,Christian PETTERSON Amanda ANDERN,-8,0 - 0,,"1,640 / 3"
587,588,NZL NZL,Kent PALMER Emma CHAPPLE,-8,0 - 0,,"1,610 / 2"
588,589,NOR NOR,Fredrik KRISTENSEN Natalie SYVERTSEN,-8,0 - 0,,"1,600 / 4"
589,590,FRA MRI,Florent RIANCHO Kate FOO KUNE,-8,0 - 0,,"1,580 / 2"
590,591,ALG ALG,Adel HAMEK Baya NESRINE,-8,0 - 0,,"1,522 / 2"
591,592,IND IND,Satinder MALIK Teenu DAHIYA,-8,0 - 0,,"1,520 / 1"
592,592,IND IND,Utkarsh ARORA Nimmi PATEL,-8,0 - 0,,"1,520 / 1"
593,592,IND IND,Kamaldeep SINGH Dhanya NAIR,-8,0 - 0,,"1,520 / 1"
594,592,GER GER,Raphael BECK Barbara BELLENBERG,-8,0 - 0,,"1,520 / 1"
595,592,ENG ENG,Callum HEMMING Evie BURBIDGE,-8,0 - 0,,"1,520 / 1"
596,592,IRL IRL,Paul REYNOLDS Moya RYAN,-8,0 - 0,,"1,520 / 1"
597,592,INA INA,Sandy I KOMANG Jenna GOZALI,-8,0 - 0,,"1,520 / 1"
598,592,CAN CAN,Maxime MARIN Stephanie PAKENHAM,-8,0 - 0,,"1,520 / 1"
599,592,ENG ENG,David JONES Freya PATEL-REDFEARN,-8,0 - 0,,"1,520 / 1"
600,592,TPE TPE,Jhe-Huei LEE Ya-Han CHANG,-8,0 - 0,,"1,520 / 1"
601,592,TPE TPE,Yuan Cheng WU Yu Chen CHANG,-8,0 - 0,,"1,520 / 1"
602,592,CHI CHI,Cristobal CAMPOS Nicole NAVARRETE,-8,0 - 0,,"1,520 / 1"
603,592,CHI CHI,Sebastian MARTINEZ Nicol SALINAS,-8,0 - 0,,"1,520 / 1"
604,592,ENG ENG,Ben LANE Emily WESTWOOD,-8,0 - 0,,"1,520 / 1"
605,592,AUS INA,Michael FARIMAN Sylvina KURNIAWAN,-8,0 - 0,,"1,520 / 1"
606,592,GHA GHA,Emmanuel YAW DONKOR Victoria ASMAH,-8,0 - 0,,"1,520 / 1"
607,592,NGR NGR,Clement KROBAKPO Augustina EBHOMIEN SUNDAY,-8,0 - 0,,"1,520 / 1"
608,592,GUA GUA,Christopher Alexander MARTINEZ SALVADOR Alejandra Jose PAIZ QUAN,-8,0 - 0,,"1,520 / 1"
609,592,NGR NGR,Joshua Adeyemi ODELABI Fatima AZEEZ,-8,0 - 0,,"1,520 / 1"
610,592,RUS RUS,Sergey SCHERBIN Anastasia NAZARCHUK,-8,0 - 0,,"1,520 / 1"
611,592,MAS MAS,Ahmad Maziri MAZLAN Sannatasah SANIRU,-8,0 - 0,,"1,520 / 1"
612,592,PER PER,Javier JIMENO Sandra JIMENO GOICOCHEA,-8,0 - 0,,"1,520 / 1"
613,592,JPN JPN,Kento SAKAI Hikari SAITO,-8,0 - 0,,"1,520 / 1"
614,592,THA THA,Trawut POTIENG Pacharapun CHOCHUWONG,-8,0 - 0,,"1,520 / 1"
615,592,THA THA,Parinyawat THONGNUAM Chaladchalam Chayanit,-8,0 - 0,,"1,520 / 1"
616,592,SIN SIN,Bimo Adi PRAKOSO Yu Yan Vanessa NEO,-8,0 - 0,,"1,520 / 1"
617,592,GUA PER,Rodolfo RAMIREZ Camila DUANY,-8,0 - 0,,"1,520 / 1"
618,592,ENG GER,Matthew NOTTINGHAM Jennifer KARNOTT,-8,0 - 0,,"1,520 / 1"
619,592,CHN CHN,YU Chen XIA Chunyu,-8,0 - 0,,"1,520 / 1"
620,592,NZL TPE,Oliver LEYDON-DAVIS WU Fang Chien,-8,0 - 0,,"1,520 / 1"
621,592,CHN CHN,LI Xun LI Yinhui,-8,0 - 0,,"1,520 / 1"
622,592,TPE TPE,Shang Kai LIN Ying Chun LIN,-8,0 - 0,,"1,520 / 1"
623,592,CHN CHN,ZHOU Haodong CHEN Lu,-8,0 - 0,,"1,520 / 1"
624,592,CHN CHN,ZHAO Jian JIANG Binbin,-8,0 - 0,,"1,520 / 1"
625,592,CHN CHN,OU Zhe CHEN Xiaofei,-8,0 - 0,,"1,520 / 1"
626,592,INA SWE,Wibowo SETYALDI PUTRA Cecilia BJUNER,-8,0 - 0,,"1,520 / 1"
627,592,THA THA,Pasin SONGHONG Sararat CHUEBOCA,-8,0 - 0,,"1,520 / 1"
628,592,INA INA,Fachriza ABIMANYU Phita Haningtyas MENTARI,-8,0 - 0,,"1,520 / 1"
629,592,INA INA,Hendrik K CLINTON Zarra Faza AZKA,-8,0 - 0,,"1,520 / 1"
630,592,IRL IRL,Sam MAGEE Rachael DARRAGH,-8,0 - 0,,"1,520 / 1"
631,592,ITA ESP,Wisnu Haryo PUTRO Laia OSET,-8,0 - 0,,"1,520 / 1"
632,592,THA THA,Kittisak NAMDASH Chanisa TEACHAVORASINSKUN,-8,0 - 0,,"1,520 / 1"
633,592,NEP NEP,Ratnajit TAMANG Sara Devi TAMANG,-8,0 - 0,,"1,520 / 1"
634,592,CHN CHN,HUANG Kaixiang JIA Yifan,-8,0 - 0,,"1,520 / 1"
635,592,AUS AUS,Bernhard HALIM Elena Yee-Man KWOK,-8,0 - 0,,"1,520 / 1"
636,592,SWE SWE,Toni HOLM-LOWEN Berfin ASLAN,-8,0 - 0,,"1,520 / 1"
637,592,INA INA,Muhammad Rian ARDIANTO Rosyita Eka PUTRI SARI,-8,0 - 0,,"1,520 / 1"
638,592,INA INA,Yodhi SATRIO Wulan Sari SRI,-8,0 - 0,,"1,520 / 1"
639,592,RUS RUS,Aleksandr VASILKIN Kristina VIRVICH,-8,0 - 0,,"1,520 / 1"
640,592,JPN JPN,Naoki ISHIKAWA Atsuko KOIKE,-8,0 - 0,,"1,520 / 1"
641,592,BAN BAN,Chand LAL MST Rehana PARVIN,-8,0 - 0,,"1,520 / 1"
642,592,DEN DEN,Theodor JOHANSEN Isabella NIELSEN,-8,0 - 0,,"1,520 / 1"
643,592,FRA FRA,Thomas ROUXEL Lea PALERMO,-8,0 - 0,,"1,520 / 1"
644,592,BRA BRA,Luiz dos SANTOS JR Ana Paula CAMPOS,-8,0 - 0,,"1,520 / 1"
645,592,RUS RUS,Gordey KOSENKO Olga LIPKINA,-8,0 - 0,,"1,520 / 1"
646,592,SRI SRI,Hasitha Chanaka MANANI HEWA Kavindi Ishandika SIRIMANNAGE,-8,0 - 0,,"1,520 / 1"
647,592,KEN KEN,Matheri Joseph GITHITU Lavina MARTINS,-8,0 - 0,,"1,520 / 1"
648,592,RUS RUS,Tatjana BIBIK Nikolai UKK,-8,0 - 0,,"1,520 / 1"
649,650,CZE CZE,Bedrich VALENTA Veronika KOLDOVA,-8,0 - 0,,"1,500 / 4"
650,651,DEN SWE,Andreas HOFFMANN Berfin ASLAN,-8,0 - 0,,"1,470 / 2"
651,651,AUS AUS,Blake HAGGERTY Chloe LEE,-8,0 - 0,,"1,470 / 2"
652,651,NZL NZL,Niccolo TAGLE Sally FU,-8,0 - 0,,"1,470 / 2"
653,651,MAS MAS,"Ahmad Maziri MAZLAN Peiy Yee, Payee LIM",-8,0 - 0,,"1,470 / 2"
654,651,TUR TUR,Semih OZKAN Dilek OZKAN,443,0 - 0,,"1,470 / 2"
655,651,POL POL,Pawel SMILOWSKI Magdalena SWIERCZYNSKA,-8,0 - 0,,"1,470 / 2"
656,651,THA THA,Natchanon TULAMOK Pattaranan CHAMNAKTAN,-8,0 - 0,,"1,470 / 2"
657,651,DOM DOM,Nelson JAVIER Bermary Altagracia POLANCO MUNOZ,-8,0 - 0,,"1,470 / 2"
658,651,CHI CHI,Bastian LIZAMA Niria BAEZA,-8,0 - 0,,"1,470 / 2"
659,651,INA INA,Gea KAMAHAMAS Brigita Marcelia RUMAMBI,-8,0 - 0,,"1,470 / 2"
660,651,TPE TPE,Chia-Han LEE Wen Chi HSU,-8,0 - 0,,"1,470 / 2"
661,651,NZL NZL,Dylan SOEDJASA Alyse DERBY,-8,0 - 0,,"1,470 / 2"
662,651,AUT CZE,Dominik STIPSITS Katerina TOMALOVA,-8,0 - 0,,"1,470 / 2"
663,651,PER PER,Leonardo ISA Chiara CARRANZA,-8,0 - 0,,"1,470 / 2"
664,651,BRN BRN,Rohit JAYKUMAR Sapna PRABHU,-8,0 - 0,,"1,470 / 2"
665,651,TRI TRI,Nicholas BONKOWSKY Solangel GUZMAN,-8,0 - 0,,"1,470 / 2"
666,651,POL POL,Milosz BOCHAT WITEK MAGDALENA,-8,0 - 0,,"1,470 / 2"
667,668,ENG ENG,Oliver BACZALA Victoria WILLIAMS,-9,0 - 0,,"1,440 / 2"
668,669,ISR ISR,Lior KROYTER Dana KUGEL,-9,0 - 0,,"1,420 / 1"
669,670,RSA RSA,Enrico JAMES Lee-Ann DE WET,-9,0 - 0,,"1,370 / 1"
670,670,RSA RSA,Patric KRAEMER Stacey DOUBELL,-9,0 - 0,,"1,370 / 1"
671,670,ZAM ZAM,Peter ZULU Victoria MUKONCHI,-9,0 - 0,,"1,370 / 1"
672,670,ZAM ZAM,Julius MBEWE Jenipher PHIRI,-9,0 - 0,,"1,370 / 1"
673,670,ZAM ZAM,Kalonde CHARLES Ngandwe MIYAMBO,-9,0 - 0,,"1,370 / 1"
674,670,ZAM ZAM,Ngosa CHONGO Nieces CHISENGA,-9,0 - 0,,"1,370 / 1"
675,670,RUS RUS,Shokhzod GULOMZODA Elena TYURINA,-9,0 - 0,,"1,370 / 1"
676,670,DEN DEN,Mathias Lund HANSEN Marie Louise STEFFENSEN,-9,0 - 0,,"1,370 / 1"
677,670,SUR SUR,Gilmar JONES Rugshaar ISHAAK,-9,0 - 0,,"1,370 / 1"
678,670,SUR SUR,Alroy TONEY Shemara LINDVELD,-9,0 - 0,,"1,370 / 1"
679,670,PUR PUR,Raynaldo VARGAS CARMENATTY Vitmary RIVERA RODRIGUEZ,-9,0 - 0,,"1,370 / 1"
680,670,PUR PUR,Joshua SOLER ROMÁN Saribel CACERES,-9,0 - 0,,"1,370 / 1"
681,670,PUR PUR,Luis PEREZ JUSTINIANO Yuneyshka GUZMÁN ROSA,-9,0 - 0,,"1,370 / 1"
682,670,DEN DEN,Soeren TOFT HANSEN Alexandra BOJE,-9,0 - 0,,"1,370 / 1"
683,670,DEN DEN,Theodor JOHANSEN Mai SURROW,-9,0 - 0,,"1,370 / 1"
684,670,DEN DEN,Joshua EIPE Irina Amalie ANDERSEN,-9,0 - 0,,"1,370 / 1"
685,670,NCL NCL,Glenn GOWET Pampimol PRAKRAIWAN,-9,0 - 0,,"1,370 / 1"
686,670,NCL NCL,Carl NGUELA Julie DERNE,-9,0 - 0,,"1,370 / 1"
687,670,JOR JOR,Thaer AMRO Haneen Derar AL-WEDYAN,-9,0 - 0,,"1,370 / 1"
688,670,MAR MAR,Yassine ERRAJI Khawla MAKRANE,-9,0 - 0,,"1,370 / 1"
689,670,ARG ARG,Serafin ZAYAS Micaela SUAREZ,-9,0 - 0,,"1,370 / 1"
690,670,INA INA,Albert ADIDJUWONO Fransisca Angelica RAHARDJA,-9,0 - 0,,"1,370 / 1"
691,670,NGR NGR,Julius OLUKOTUN Zainab AKINYEMI,-9,0 - 0,,"1,370 / 1"
692,670,CHI CHI,Alonso MEDEL Jenny CEPEDA,-9,0 - 0,,"1,370 / 1"
693,670,KOR KOR,RHO Ye Wook Soo Bin LIM,-9,0 - 0,,"1,370 / 1"
694,670,CRO NED,Zvonimir HOELBLING Gayle MAHULETTE,-9,0 - 0,,"1,370 / 1"
695,670,AUS AUS,David Seng Hong LEE Chloe CHEN,-9,0 - 0,,"1,370 / 1"
696,670,AUS AUS,Le The Hung PHAM Grace HANRATTY,-9,0 - 0,,"1,370 / 1"
697,670,AUS AUS,Eric VUONG Talia SAUNDERS,-9,0 - 0,,"1,370 / 1"
698,670,TPE TPE,Chia Hung LU Ching Hui CHANG,-9,0 - 0,,"1,370 / 1"
699,670,TPE TPE,Wei Chi LIU Tzu Chin PAN,-9,0 - 0,,"1,370 / 1"
700,670,TUR TUR,Mehmet OZTURK Kurba OZTURK,-9,0 - 0,,"1,370 / 1"
701,670,RUS RUS,Nikita FEDOTOVSKIKH Lela MINADZE,-9,0 - 0,,"1,370 / 1"
702,670,RSA RSA,Cameron COETZER Sandra LE GRANGE,-9,0 - 0,,"1,370 / 1"
703,670,BAR CZE,Sabeel FOSTER Marcela RUZICKA,-9,0 - 0,,"1,370 / 1"
704,670,TRI TRI,Will LEE Avril PLAZA MARCELLE,-9,0 - 0,,"1,370 / 1"
705,670,CZE TRI,Jan FROHLICH Kamasha ROBERTSON,-9,0 - 0,,"1,370 / 1"
706,670,INA INA,Yantoni Edy SAPUTRA Marsheilla Gischa ISLAMI,-9,0 - 0,,"1,370 / 1"
707,670,MAS MAS,Sze Fei GOH Mei Xing TEOH,-9,0 - 0,,"1,370 / 1"
708,670,SWE SWE,Paul OHLSSON Berfin ASLAN,-9,0 - 0,,"1,370 / 1"
709,670,CHI CHI,Bastian LIZAMA Tingting CHOU,-9,0 - 0,,"1,370 / 1"
710,670,INA GER,Maziyyah NADHIR Ari TRISNANTO,-9,0 - 0,,"1,370 / 1"
711,670,INA INA,Arya Maulana ADIARTAMA Surya DELLA AUGUSTIA,-9,0 - 0,,"1,370 / 1"
712,670,SIN SIN,Kean Yew LOH Ai Ninna TAN,-9,0 - 0,,"1,370 / 1"
713,670,DEN DEN,Mathias Lund HANSEN Cecilie FINNE-IPSEN,-9,0 - 0,,"1,370 / 1"
714,670,FRA FRA,Toma Junior POPOV Delphine DELRUE,-9,0 - 0,,"1,370 / 1"
715,670,DOM DOM,Cesar Adonis BRITO GONZALEZ Nairoby Abigail JIMENEZ,-9,0 - 0,,"1,370 / 1"
716,670,RSA RSA,Cameron COETZER Michelle BUTLER-EMMETT,-9,0 - 0,,"1,370 / 1"
717,670,GER GER,Johannes PISTORIUS Lara KAEPPLEIN,-9,0 - 0,,"1,370 / 1"
718,670,GUA GUA,Brandon SAMAYOA Maria Regina DEL VALLE LEYSBETH,-9,0 - 0,,"1,370 / 1"
719,670,SUI SUI,Gilles TRIPET Tiffany GIRONA,-9,0 - 0,,"1,370 / 1"
720,670,DEN DEN,Mikkel STOFFERSEN Mathilde BJERGEN,-9,0 - 0,,"1,370 / 1"
721,670,MAR MAR,Yassine EL MERNISSI Jinane BITARIE,-9,0 - 0,,"1,370 / 1"
722,670,GER GER,Tobias WADENKA Kira KATTENBECK,-9,0 - 0,,"1,370 / 1"
723,670,PUR PUR,Pedro ZAPATA Genesis VALENTIN,-9,0 - 0,,"1,370 / 1"
724,670,SUR SUR,Redon COULOR Santusha RAMZAN,-9,0 - 0,,"1,370 / 1"
725,670,DOM DOM,Miguel MARINEZ Licelott SANCHEZ,-9,0 - 0,,"1,370 / 1"
726,670,MAR MAR,Hamza HOUMIDA Harag NAZIK,-9,0 - 0,,"1,370 / 1"
727,670,NCL NCL,Joey SANTINO Cecilia MOUSSY,-9,0 - 0,,"1,370 / 1"
728,670,INA INA,Yahya Adi KUMARA Rahmadhani Hasiyanti PUTRI,-9,0 - 0,,"1,370 / 1"
729,670,MDV MDV,Mohamed Ajfan RASHEED Aishath Afnaan RASHEED,-9,0 - 0,,"1,370 / 1"
