,RANK,COUNTRY,PLAYER,CHANGE +/-,WIN - LOSE,PRIZE MONEY,POINTS / TOURNAMENTS
0,1,CHN CHN,ZHANG Nan ZHAO Yunlei,0,244 - 37,"$955,150.00","99,785 / 12"
1,2,INA INA,Tontowi AHMAD Liliyana NATSIR,0,210 - 54,"$706,246.25","81,332 / 13"
2,3,CHN CHN,XU Chen MA Jin,0,183 - 50,"$787,393.12","81,181 / 13"
3,4,CHN CHN,LIU Cheng BAO Yixin,0,72 - 28,"$170,296.24","77,000 / 14"
4,5,DEN DEN,Joachim FISCHER NIELSEN Christinna PEDERSEN,0,229 - 69,"$638,571.49","68,264 / 13"
5,6,ENG ENG,Chris ADCOCK Gabrielle ADCOCK,0,124 - 85,"$163,999.77","63,634 / 16"
6,7,CHN CHN,LU Kai HUANG Yaqiong,0,58 - 23,"$117,704.99","60,940 / 15"
7,8,KOR KOR,KO Sung Hyun KIM Ha Na,0,67 - 36,"$187,924.99","59,315 / 14"
8,9,INA INA,Riky WIDIANTO Puspita Richi DILI,0,98 - 58,"$98,733.58","55,010 / 16"
9,10,INA INA,Praveen JORDAN Debby SUSANTO,0,47 - 27,"$103,931.85","54,782 / 15"
10,11,HKG HKG,LEE Chun Hei Reginald CHAU Hoi Wah,0,82 - 41,"$134,802.10","52,995 / 17"
11,12,INA INA,Edi SUBAKTIAR Gloria Emanuelle WIDJAJA,0,52 - 28,"$44,619.10","50,460 / 15"
12,13,DEN DEN,Mads Pieler KOLDING Kamilla RYTTER JUHL,0,49 - 32,"$155,575.62","48,390 / 9"
13,14,GER GER,Michael FUCHS Birgit MICHELS,0,131 - 78,"$151,341.26","44,778 / 16"
14,15,NED NED,Jacco ARENDS Selena PIEK,0,83 - 55,"$30,311.99","43,175 / 20"
15,16,HKG HKG,CHAN Alan Yun Lung TSE Ying Suet,0,52 - 44,"$40,954.74","38,527 / 18"
16,17,JPN JPN,Kenichi HAYAKAWA Misaki MATSUTOMO,0,62 - 64,"$42,371.34","37,180 / 12"
17,18,SIN SIN,Danny Bawa CHRISNANTA Yu Yan Vanessa NEO,0,106 - 99,"$66,066.12","36,204 / 17"
18,19,MAS MAS,Peng Soon CHAN Liu Ying GOH,0,146 - 88,"$188,501.87","36,040 / 10"
19,20,NED NED,Jorrit DE RUITER Samantha BARNING,0,65 - 47,"$24,159.41","35,367 / 20"
20,21,USA USA,Phillip CHEW Jamie SUBANDHI,0,60 - 53,"$16,532.40","34,518 / 19"
21,22,FRA FRA,Ronan LABAR Emilie LEFEL,0,62 - 39,"$9,973.49","33,578 / 25"
22,23,CAN CAN,Toby NG Alex BRUCE,0,48 - 21,"$16,404.96","33,384 / 13"
23,24,INA INA,Markis KIDO Pia Zebadiah BERNADETH,0,82 - 59,"$102,761.10","33,000 / 12"
24,25,SIN SIN,Chayut TRIYACHART Shinta Mulia SARI,0,35 - 27,"$21,756.30","32,658 / 11"
25,26,RUS RUS,Vitalij DURKIN Nina VISLOVA,0,157 - 71,"$63,584.23","32,650 / 17"
26,27,INA INA,Ronald ALEXANDER Melati Daeva OKTAVIANI,0,41 - 22,"$10,919.86","32,650 / 13"
27,28,IRL IRL,Sam MAGEE Chloe MAGEE,0,111 - 84,"$20,715.74","32,360 / 14"
28,29,RUS RUS,Evgenij DREMIN Evgenia DIMOVA,0,53 - 35,"$16,109.99","31,798 / 14"
29,30,FRA FRA,Gaetan MITTELHEISSER Audrey FONTAINE,0,49 - 37,"$6,399.00","30,860 / 22"
30,31,CHN CHN,ZHENG Siwei CHEN Qingchen,0,46 - 3,"$38,151.24","30,620 / 6"
31,32,GER GER,Peter KAESBAUER Isabel HERTTRICH,0,49 - 34,"$22,003.99","30,130 / 10"
32,33,DEN DEN,Niclas NOHR Sara THYGESEN,0,47 - 20,"$10,150.75","29,740 / 12"
33,34,GER GER,Max SCHWENGER Carla NELTE,0,47 - 38,"$14,108.01","29,093 / 12"
34,35,AUS AUS,Robin MIDDLETON Leanne CHOO,0,21 - 14,"$10,723.49","26,971 / 10"
35,36,THA THA,Nipitphon PUANGPUAPECH Puttita SUPAJIRAKUL,0,18 - 24,"$13,038.72","26,858 / 10"
36,37,INA INA,Irfan FADHILAH Weni ANGGRAINI,0,70 - 49,"$36,337.48","26,790 / 10"
37,38,MAS MAS,WONG Fai Yin Mei Kuan CHOW,1,22 - 23,"$5,159.98","26,510 / 14"
38,39,MAS MAS,Aik Quan TAN Pei Jing LAI,1,62 - 52,"$30,336.46","26,030 / 10"
39,40,PER PER,Mario CUBA Katherine WINDER,1,69 - 28,"$5,398.70","25,795 / 13"
40,41,TPE TPE,LIAO Min Chun CHEN Hsiao Huan,1,50 - 55,"$16,253.74","25,710 / 12"
41,42,RUS RUS,Anatoliy YARTSEV Evgeniya KOSETSKAYA,2,68 - 42,"$5,008.99","25,260 / 15"
42,43,INA INA,Fran KURNIAWAN Komala DEWI,2,30 - 15,"$49,784.73","25,090 / 10"
43,44,MAS MAS,Chee Tean TAN Shevon Jemie LAI,-1,25 - 21,"$4,383.12","25,050 / 12"
44,45,THA THA,Sudket PRAPAKAMOL Saralee THOUNGTHONGKAM,1,275 - 167,"$326,022.47","24,490 / 7"
45,46,SIN SIN,Yong Kai Terry HEE Wei Han TAN,-8,21 - 8,"$3,860.61","24,249 / 9"
46,47,USA USA,Howard SHU Eva LEE,0,0 - 1,"$13,710.98","23,921 / 12"
47,48,INA INA,Alfian Eko PRASETYA Annisa SAUFIKA,0,0 - 0,"$27,530.57","23,480 / 7"
48,49,SWE SWE,Jonatan NORDH Emelie FABBEKE,0,2 - 2,"$3,489.38","22,856 / 18"
49,50,KOR KOR,SolGyu CHOI CHAE Yoo Jung,0,0 - 0,"$50,436.24","22,850 / 7"
50,51,PER PER,Andres CORPANCHO Luz Maria ZORNOZA,0,0 - 0,"$1,783.99","22,497 / 13"
51,52,IND IND,KONA Tarun NELAKURIHI Sikki Reddy,0,0 - 0,"$11,772.46","22,250 / 14"
52,53,DEN DEN,Mathias CHRISTIANSEN Lena GREBAK,0,0 - 0,"$12,617.00","21,790 / 8"
53,54,ENG ENG,Harley TOWLER Emily WESTWOOD,0,0 - 0,,"20,900 / 13"
54,55,CHN CHN,HUANG Kaixiang HUANG Dongping,0,0 - 0,,"20,660 / 5"
55,56,FRA FRA,Bastian KERSAUDY Lea PALERMO,3,0 - 0,,"20,650 / 13"
56,57,INA INA,Andrei ADISTIA Vita MARISSA,0,0 - 0,,"20,450 / 6"
57,58,KOR KOR,SHIN Baek Cheol CHANG Ye Na,0,0 - 0,,"20,260 / 6"
58,59,RUS RUS,Rodion KARGAEV Ekaterina BOLOTOVA,1,0 - 0,,"20,140 / 13"
59,60,GER GER,Jones Ralfy JANSEN Cisita Joity JANSEN,-4,0 - 0,,"19,050 / 11"
60,61,BRA BRA,Alex Yuwan TJONG Lohaynny VICENTE,0,0 - 0,,"18,796 / 10"
61,62,CAN CAN,PHILLIPE Charron Phyllis CHAN,0,0 - 0,,"18,775 / 11"
62,63,INA INA,Muhammad RIJAL Vita MARISSA,0,0 - 0,,"18,440 / 5"
63,64,GER GER,Marvin Emil SEIDEL Linda EFLER,0,0 - 0,,"18,000 / 11"
64,65,DEN DEN,Kasper ANTONSEN Amanda MADSEN,0,0 - 0,,"16,910 / 9"
65,66,KOR KOR,KIM Gi Jung SHIN Seung Chan,0,0 - 0,,"16,890 / 7"
66,67,KOR KOR,YOO Yeon Seong EOM Hye Won,0,0 - 0,,"16,800 / 3"
67,68,TPE TPE,LIN Chia Yu WU Ti Jung,0,0 - 0,,"16,660 / 10"
68,69,TPE TPE,TSENG Min Hao LAI Chia Wen,0,0 - 0,,"16,656 / 8"
69,70,TPE TPE,Chi-Lin WANG CHENG Chi Ya,0,0 - 0,,"16,440 / 9"
70,71,RUS IND,Vladimir IVANOV Ashwini PONNAPPA,0,0 - 0,,"16,070 / 6"
71,72,GER GER,Raphael BECK Kira KATTENBECK,0,0 - 0,,"15,620 / 9"
72,73,MEX MEX,Lino MUNOZ Cynthia GONZALEZ,1,0 - 0,,"15,519 / 9"
73,74,UKR UKR,Gennadiy NATAROV Yuliya KAZARINOVA,1,0 - 0,,"15,440 / 9"
74,75,BRA BRA,Hugo ARTHUSO Fabiana SILVA,1,0 - 0,,"15,340 / 9"
75,76,SWE SWE,Nico RUPONEN Amanda HOGSTROM,3,0 - 0,,"14,360 / 9"
76,77,RUS RUS,Andrey PARAKHODIN Anastasia CHERVYAKOVA,3,0 - 0,,"14,260 / 8"
77,78,CAN CAN,Nyl YAKURA Brittney TAM,3,0 - 0,,"14,170 / 8"
78,79,CZE CZE,Jakub BITMAN Alzbeta BASOVA,3,0 - 0,,"14,158 / 11"
79,80,IND IND,Akshay DEWALKAR Pradnya GADRE,3,0 - 0,,"13,960 / 5"
80,81,POL POL,Pawel PIETRYJA Aneta WOJTKOWSKA,-8,0 - 0,,"13,950 / 10"
81,82,ENG ENG,Christopher COLES Sophie BROWN,2,0 - 0,,"13,900 / 8"
82,83,IND IND,Arun VISHNU Aparna BALAN,2,0 - 0,,"13,820 / 5"
83,84,FRA FRA,Marin BAUMANN Lorraine BAUMANN,-7,0 - 0,,"13,680 / 10"
84,85,SWE SWE,Filip Michael Duwall MYHREN Emma WENGBERG,1,0 - 0,,"13,650 / 10"
85,86,TUR TUR,Ramazan OZTURK Neslihan KILIC,-8,0 - 0,,"13,388 / 10"
86,87,ENG ENG,Gregory MAIRS Jenny MOORE,0,0 - 0,,"13,190 / 8"
87,88,THA THA,Maneepong JONGJIT Sapsiree TAERATTANACHAI,0,0 - 0,,"13,150 / 4"
88,89,PER PER,Martin DEL VALLE Daniela MACIAS,0,0 - 0,,"12,877 / 10"
89,90,GER GER,Mark LAMSFUSS Franziska VOLKMANN,0,0 - 0,,"12,730 / 9"
90,91,CAN CAN,Kevin LI Rachel HONDERICH,0,0 - 0,,"12,600 / 9"
91,92,JPN JPN,Keigo SONODA Naoko FUKUMAN,0,0 - 0,,"12,580 / 4"
92,93,JPN JPN,Hirokatsu HASHIMOTO Miyuki MAEDA,0,0 - 0,,"12,520 / 4"
93,94,AUT AUT,David OBERNOSTERER Elisabeth BALDAUF,0,0 - 0,,"12,350 / 6"
94,95,EGY EGY,Abdelrahman KASHKAL Hadia HOSNY,0,0 - 0,,"12,210 / 11"
95,96,KOR KOR,SHIN Baek Cheol CHAE Yoo Jung,0,0 - 0,,"12,210 / 3"
96,97,AUS AUS,Matthew CHAU Gronya SOMERVILLE,1,0 - 0,,"11,380 / 6"
97,98,KOR KOR,LEE Yong Dae LEE So Hee,1,0 - 0,,"11,300 / 3"
98,99,TPE TPE,Ko-Chi CHANG Hsin Tien CHANG,1,0 - 0,,"11,160 / 8"
99,100,KOR KOR,SolGyu CHOI EOM Hye Won,1,0 - 0,,"11,030 / 3"
100,101,FRA FRA,Baptiste CAREME Anne TRAN,1,0 - 0,,"10,920 / 8"
101,102,GUA GUA,SOLIS JONATHAN Nikte Alejandra SOTOMAYOR,1,0 - 0,,"10,790 / 6"
102,103,SUI SUI,Oliver SCHALLER Celine BURKART,-6,0 - 0,,"10,760 / 13"
103,104,CHN CHN,LIU Yuchen YU Xiaohan,0,0 - 0,,"10,440 / 3"
104,105,KOR KOR,DukYoung KIM GO Ah Ra,0,0 - 0,,"10,420 / 3"
105,106,BRA BRA,Daniel PAIOLA Paula B PEREIRA,0,0 - 0,,"10,135 / 8"
106,107,FRA FRA,Laurent CONSTANTIN Laura CHOINET,0,0 - 0,,"10,080 / 9"
107,108,SCO SCO,Robert BLAIR Imogen BANKIER,1,0 - 0,,"9,958 / 3"
108,109,INA INA,Fran KURNIAWAN Shendy Puspa IRAWATI,1,0 - 0,,"9,810 / 3"
109,110,MAS MAS,Peng Soon CHAN Pei Jing LAI,1,0 - 0,,"9,800 / 2"
110,111,INA INA,HAFIZ Faisal Shella Devi Aulia,32,0 - 0,,"9,740 / 4"
111,112,INA INA,Lukhi Apri NUGROHO Masita MAHMUDIN,1,0 - 0,,"9,680 / 4"
112,113,IND IND,Juhi DEWANGAN Venkat Gaurav PRASAD,2,0 - 0,,"9,450 / 6"
113,114,EGY EGY,Ali Ahmed EL KHATEEB Doha HANY,2,0 - 0,,"9,380 / 7"
114,115,BEL BEL,Floris OLEFFE Steffi ANNYS,-7,0 - 0,,"9,253 / 12"
115,116,FIN FIN,Henri AARNIO Jenny NYSTROM,1,0 - 0,,"9,250 / 11"
116,117,GER GER,Peter KAESBAUER Carla NELTE,1,0 - 0,,"9,240 / 4"
117,118,AUS AUS,Sawan SERASINGHE Setyana MAPASA,3,0 - 0,,"9,020 / 5"
118,119,RSA RSA,Andries MALAN Jennifer FRY,3,0 - 0,,"8,983 / 5"
119,120,INA INA,Agripinna Prima Rahmanto PUTRA Rizki Amelia PRADIPTA,3,0 - 0,,"8,930 / 8"
120,121,NED NED,Jelle MAAS Iris TABELING,4,0 - 0,,"8,776 / 4"
121,122,GER GER,Mark LAMSFUSS Isabel HERTTRICH,4,0 - 0,,"8,370 / 4"
122,123,DEN DEN,Alexander BOND Ditte SØBY HANSEN,40,0 - 0,,"8,350 / 7"
123,123,BUL SUI,Stilian MAKARSKI Celine TRIPET,-3,0 - 0,,"8,350 / 7"
124,125,DOM DOM,Nelson JAVIER VIBIECA BERONICA,2,0 - 0,,"8,325 / 5"
125,126,INA INA,Akbar PANJI Apriani RAHAYU,8,0 - 0,,"8,220 / 8"
126,127,VIE VIE,Manh Thang DAO Nhu Thao PHAM,-8,0 - 0,,"8,210 / 3"
127,128,IND IND,Manu ATTRI K. Maneesha,0,0 - 0,,"8,170 / 2"
128,129,EGY EGY,Ahmed SALAH Menna ELTANANY,0,0 - 0,,"8,120 / 8"
129,130,TPE AUS,LU Ching Yao Hsuan-Yu Wendy CHEN,-16,0 - 0,,"8,090 / 3"
130,131,FIN NED,Anton KAISTI Cheryl SEINEN,-1,0 - 0,,"8,040 / 4"
131,132,TPE TPE,Hsiao-Lin WU HSIEH Pei Chen,-1,0 - 0,,"8,010 / 7"
132,133,MAS IND,Vountus Indra MAWAN Prajakta SAWANT,-21,0 - 0,,"8,010 / 4"
133,134,IND IND,Manu ATTRI NELAKURIHI Sikki Reddy,-2,0 - 0,,"7,976 / 3"
134,135,TUR TUR,Melih TURGUT Fatma Nur YAVUZ,37,0 - 0,,"7,930 / 6"
135,136,CZE CZE,Ondrej KOPRIVA Katerina TOMALOVA,-12,0 - 0,,"7,910 / 9"
136,137,ENG ENG,Matthew NOTTINGHAM Alyssa LIM,-4,0 - 0,,"7,900 / 5"
137,138,MAS MAS,Mohd Lutfi Zaim ABDUL KHALID Fie Cho SOONG,-3,0 - 0,,"7,700 / 6"
138,139,CHN CHN,WANG YILYU OU Dongni,-3,0 - 0,,"7,630 / 3"
139,140,HUN HUN,Gergely KRAUSZ Laura SAROSI,24,0 - 0,,"7,570 / 7"
140,141,INA INA,Yonathan Suryatama DASUKI Aprilsasi Putri LEJARSAR VARIELLA,-4,0 - 0,,"7,530 / 5"
141,142,NED TPE,Ruud BOSCH SHUAI Pei Ling,-4,0 - 0,,"7,450 / 4"
142,143,POL POL,Robert MATEUSIAK Nadiezda ZIEBA,-4,0 - 0,,"7,400 / 2"
143,144,RSA RSA,Cameron COETZER Michelle BUTLER-EMMETT,-4,0 - 0,,"7,370 / 4"
144,145,VIE VIE,Bao Duc DUONG Thi Hong Gam THAI,-4,0 - 0,,"7,339 / 4"
145,146,INA INA,Alfian Eko PRASETYA Shella Devi Aulia,-4,0 - 0,,"7,270 / 3"
146,147,CAN CAN,Henry WIEBE Grace GAO,-2,0 - 0,,"7,210 / 5"
147,148,TPE TPE,LU Chia Pin Szu Yu CHEN,-2,0 - 0,,"7,140 / 5"
148,149,TPE TPE,LU Ching Yao CHENG Wen Hsing,-2,0 - 0,,"7,040 / 3"
149,150,FRA FRA,Lucas CLAERBOUT Teshana VIGNES WARAN,-2,0 - 0,,"6,990 / 6"
150,151,HKG HKG,TANG Chun Man CHAN Kaka Tsz Ka,-2,0 - 0,,"6,940 / 3"
151,152,PER PER,Jose GUEVARA Danica NISHIMURA,-2,0 - 0,,"6,930 / 5"
152,153,INA INA,Muhammad Rian ARDIANTO Rosyita Eka PUTRI SARI,-2,0 - 0,,"6,910 / 4"
153,154,TPE TPE,HUANG Po Jui SHUAI Pei Ling,-2,0 - 0,,"6,870 / 6"
154,155,AUS AUS,Daniel GUDA Joy LAI,-2,0 - 0,,"6,700 / 5"
155,156,NZL NZL,Maika PHILLIPS Anona PAK,-2,0 - 0,,"6,670 / 3"
156,157,IND IND,Pranaav Jerry CHOPRA Ashwini PONNAPPA,-2,0 - 0,,"6,660 / 3"
157,158,KOR KOR,DukYoung KIM YOO Hae Won,-2,0 - 0,,"6,630 / 2"
158,159,CHN CHN,LIU Yuchen LUO Yu,-2,0 - 0,,"6,540 / 2"
159,159,JPN JPN,Keigo SONODA Shizuka MATSUO,-2,0 - 0,,"6,540 / 2"
160,161,JPN JPN,Kenta KAZUNO Ayane KURIHARA,-2,0 - 0,,"6,433 / 4"
161,162,SIN SIN,Guang Liang Jason WONG Citra Dewi SARI,28,0 - 0,,"6,300 / 7"
162,163,IND IND,Shlok RAMCHANDRAN J. Meghana,-2,0 - 0,,"6,270 / 4"
163,164,RUS RUS,Ilya ZHDANOV Tatjana BIBIK,-2,0 - 0,,"6,230 / 4"
164,165,NZL NZL,Shane MASINIPENI Maria MASINIPENI,20,0 - 0,,"6,170 / 4"
165,166,EGY EGY,Abdelrahman ABDELHAKIM Nadine ASHRAF,-1,0 - 0,,"6,150 / 7"
166,167,RUS RUS,Ilya ZHDANOV Irina KHLEBKO,0,0 - 0,,"6,110 / 7"
167,168,CHN CHN,KANG Jun LUO Ying,0,0 - 0,,"6,050 / 1"
168,169,DEN DEN,Jeppe LUDVIGSEN Mai SURROW,0,0 - 0,,"6,030 / 6"
169,170,SVK UGA,Matej HLINICAN Bridget Shamim BANGI,0,0 - 0,,"6,000 / 3"
170,171,DEN DEN,Soren GRAVHOLT Maiken FRUERGAARD,0,0 - 0,,"5,990 / 6"
171,172,POL POL,Robert MATEUSIAK Agnieszka WOJTKOWSKA,1,0 - 0,,"5,977 / 3"
172,173,CHN CHN,YU Xiaoyu XIA Huan,1,0 - 0,,"5,950 / 1"
173,174,DEN DEN,Patrick BUHL Isabella NIELSEN,1,0 - 0,,"5,930 / 5"
174,175,MAS MAS,Wee Gieen TAN Yen Wei PECK,1,0 - 0,,"5,920 / 5"
175,176,BEL BEL,Nick MARCOEN Flore VANDENHOUCKE,-16,0 - 0,,"5,876 / 9"
176,177,RUS RUS,Alexandr ZINCHENKO Olga MOROZOVA,-33,0 - 0,,"5,850 / 3"
177,178,NED NED,Ruben JILLE Alida CHEN,-1,0 - 0,,"5,833 / 6"
178,179,ARG ARG,Pablo MACAGNO Florencia BERNATENE,-1,0 - 0,,"5,766 / 6"
179,180,MEX MEX,Job CASTILLO Sabrina SOLIS,-1,0 - 0,,"5,720 / 4"
180,181,HKG HKG,TANG Chun Man POON Lok Yan,-1,0 - 0,,"5,680 / 3"
181,182,IRL IRL,Ciaran CHAMBERS Sinead CHAMBERS,-1,0 - 0,,"5,660 / 5"
182,183,UKR UKR,Valeriy ATRASHCHENKOV Yelyzaveta ZHARKA,-1,0 - 0,,"5,650 / 5"
183,183,ECU ECU,Emilio ZAMBRANO Maria Delia ZAMBRANO,-1,0 - 0,,"5,650 / 5"
184,185,INA INA,HAFIZ Faisal Masita MAHMUDIN,1,0 - 0,,"5,600 / 2"
185,186,FRA MRI,Florent RIANCHO Kate FOO KUNE,-20,0 - 0,,"5,590 / 5"
186,187,GER GER,Max WEISSKIRCHEN Eva JANSSENS,0,0 - 0,,"5,530 / 2"
187,188,KOR KOR,SolGyu CHOI SHIN Seung Chan,0,0 - 0,,"5,500 / 1"
188,189,GER GER,Fabian HOLZER Barbara BELLENBERG,0,0 - 0,,"5,390 / 7"
189,190,CHI CHI,Ivan LEON Camila MACAYA,1,0 - 0,,"5,330 / 4"
190,191,ESP ESP,Pablo ABIAN Haidee OJEDA,1,0 - 0,,"5,320 / 3"
191,192,RUS RUS,Gordey KOSENKO Olga LIPKINA,1,0 - 0,,"5,260 / 4"
192,193,ARG ARG,Tomas THOUYARET Barbara Maria BERRUEZO,1,0 - 0,,"5,150 / 6"
193,194,TPE TPE,LU Chia Pin Chia Hsin LEE,1,0 - 0,,"5,140 / 2"
194,195,MAS MAS,Jian Yi LEE Peiy Zhean LIM,-11,0 - 0,,"5,080 / 6"
195,196,INA INA,Tontowi AHMAD Debby SUSANTO,0,0 - 0,,"5,040 / 1"
196,197,RUS RUS,Vadim NOVOSELOV Julia ZAPOLSKAYA,0,0 - 0,,"5,000 / 3"
197,198,ENG ENG,Oliver BACZALA Victoria WILLIAMS,0,0 - 0,,"4,930 / 4"
198,199,CHN CHN,HE Jiting DU Yue,0,0 - 0,,"4,920 / 2"
199,200,CHN CHN,WANG YILYU TANG Yuanting,0,0 - 0,,"4,900 / 1"
200,200,INA INA,Afiat Yuris WIRAWAN Komala DEWI,0,0 - 0,,"4,900 / 1"
201,202,SCO USA,Alistair CASEY Yuko KAWASAKI,0,0 - 0,,"4,880 / 4"
202,203,MAS MAS,Bolriffin KHAIRUL TOR Sin Er NG,21,0 - 0,,"4,880 / 3"
203,204,KOR KOR,YOO Yeon Seong CHANG Ye Na,-1,0 - 0,,"4,880 / 2"
204,205,SCO SCO,Patrick MACHUGH Rebekka FINDLAY,-1,0 - 0,,"4,872 / 6"
205,206,DEN DEN,Rene MATTISSON Thilde MATTISSON,-1,0 - 0,,"4,870 / 3"
206,207,INA INA,Kevin Sanjaya SUKAMULJO Maretha Dea GIOVANI,-1,0 - 0,,"4,830 / 2"
207,208,FIN FIN,Anton KAISTI Mathilda LINDHOLM,-1,0 - 0,,"4,760 / 5"
208,209,AUT AUT,Roman ZIRNWALD Elisabeth BALDAUF,-1,0 - 0,,"4,748 / 5"
209,210,TPE TPE,CHEN Chung Jen Yu Chieh CHENG,-1,0 - 0,,"4,700 / 3"
210,211,TPE TPE,Yang LEE WU Fang Chien,-1,0 - 0,,"4,700 / 2"
211,211,NGR NGR,Jinkan Ifraimu BULUS Susan IDEH,-1,0 - 0,,"4,700 / 2"
212,213,JPN JPN,Yuta WATANABE Arisa HIGASHINO,-1,0 - 0,,"4,680 / 1"
213,213,NZL NZL,Oliver LEYDON-DAVIS Danielle TAHURI,-1,0 - 0,,"4,680 / 1"
214,215,IND IND,T. Hema Nagendra Babu S. Poorvisha Ram,-1,0 - 0,,"4,660 / 3"
215,216,FRA SUI,Baptiste CAREME Sabrina JAQUET,-1,0 - 0,,"4,630 / 3"
216,217,THA THA,Krit TANTIANANKUL Panjarat PRANSOPON,61,0 - 0,,"4,490 / 3"
217,218,FRA FRA,Jordan CORVEE Stacey GUERIN,-1,0 - 0,,"4,440 / 6"
218,219,CHI CHI,Cristian ARAYA Tingting CHOU,-1,0 - 0,,"4,400 / 3"
219,220,CUB CUB,Leodannis MARTINEZ Tahimara OROPEZA,-1,0 - 0,,"4,400 / 2"
220,220,CUB CUB,Ernesto REYES Melissa AZCUY PEREZ,-1,0 - 0,,"4,400 / 2"
221,220,POL SCO,Robert MATEUSIAK Imogen BANKIER,-1,0 - 0,,"4,400 / 2"
222,223,JPN JPN,Takuto INOUE Shizuka MATSUO,-1,0 - 0,,"4,390 / 2"
223,224,INA INA,Lukhi Apri NUGROHO Ulfa ZAKIA,-1,0 - 0,,"4,360 / 4"
224,225,MAS MAS,Peng Soon CHAN Hui Lin NG,-1,0 - 0,,"4,330 / 2"
225,225,NGR NGR,Ola FAGBEMI Dorcas Ajoke ADESOKAN,-1,0 - 0,,"4,330 / 2"
226,227,INA INA,Kevin Sanjaya SUKAMULJO Greysia POLII,0,0 - 0,,"4,320 / 1"
227,227,KOR KOR,KIM Gi Jung KIM So Yeong,0,0 - 0,,"4,320 / 1"
228,229,ENG ENG,Peter BRIGGS Helena LEWCZYNSKA,0,0 - 0,,"4,310 / 2"
229,230,AUS AUS,Simon Wing Hang LEUNG Tiffany HO,0,0 - 0,,"4,300 / 3"
230,231,SCO SCO,Adam HALL Julie MACPHERSON,1,0 - 0,,"4,280 / 4"
231,232,DOM DOM,William CABRERA Bermary Altagracia POLANCO MUNOZ,1,0 - 0,,"4,270 / 3"
232,233,IND IND,Utkarsh ARORA Mohita SAHDEV,1,0 - 0,,"4,240 / 2"
233,233,CHN CHN,HUANG Kaixiang JIA Yifan,1,0 - 0,,"4,240 / 2"
234,235,FIN EST,Marko PYYKONEN Karoliine HOIM,1,0 - 0,,"4,200 / 3"
235,236,GER GER,Andreas HEINZ Jennifer KARNOTT,1,0 - 0,,"4,190 / 7"
236,237,GER GER,Johannes PISTORIUS Ramona HACKS,1,0 - 0,,"4,080 / 5"
237,238,IND IND,Prem Singh CHOUHAN Saruni SHARMA,1,0 - 0,,"4,070 / 3"
238,239,SIN SIN,Kean Hean LOH Yi Ling Elaine CHUA,77,0 - 0,,"4,020 / 4"
239,240,TPE TPE,LIANG Jui Wei CHENG Chi Ya,2,0 - 0,,"4,010 / 2"
240,241,THA THA,Parinyawat THONGNUAM Phataimas MUENWONG,131,0 - 0,,"4,000 / 3"
241,242,KOR KOR,DukYoung KIM EOM Hye Won,1,0 - 0,,"4,000 / 1"
242,243,NEP NEP,Ratnajit TAMANG Sara Devi TAMANG,1,0 - 0,,"3,960 / 3"
243,244,RUS RUS,Rodion ALIMOV Alina DAVLETOVA,-28,0 - 0,,"3,950 / 2"
244,245,LTU LTU,Povilas BARTUSIS Vytaute FOMKINAITE,0,0 - 0,,"3,930 / 4"
245,246,FIN FIN,Pekka RYHANEN Sonja PEKKOLA,0,0 - 0,,"3,910 / 4"
246,247,MRI MRI,Sahir Abdool EDOO Yeldy Marie LOUISON,0,0 - 0,,"3,880 / 2"
247,248,MRI MRI,Georges Julien PAUL Kate FOO KUNE,0,0 - 0,,"3,870 / 2"
248,249,IND IND,Akshay DEWALKAR Prajakta SAWANT,0,0 - 0,,"3,850 / 1"
249,249,AUS AUS,Michael FARIMAN Talia SAUNDERS,0,0 - 0,,"3,850 / 1"
250,249,MAS MAS,Aik Quan TAN Meng Yean LEE,0,0 - 0,,"3,850 / 1"
251,249,IND IND,V. Gangadhara Rao D. Sudha Kalyani,0,0 - 0,,"3,850 / 1"
252,249,INA INA,Afiat Yuris WIRAWAN Vita MARISSA,0,0 - 0,,"3,850 / 1"
253,249,CHN CHN,SHI Longfei ZHONG Qianxin,0,0 - 0,,"3,850 / 1"
254,249,MAS MAS,Jian Guo ONG Meng Yean LEE,0,0 - 0,,"3,850 / 1"
255,249,USA USA,Halim Haryanto HO Jing Yu HONG,0,0 - 0,,"3,850 / 1"
256,249,TPE TPE,CHEN Hung Ling Chia Hsin LEE,0,0 - 0,,"3,850 / 1"
257,249,GER GER,Johannes SCHOETTLER Johanna GOLISZEWSKI,0,0 - 0,,"3,850 / 1"
258,259,MAS MAS,Muhammad Shahdan MAT DESA Chew HAN HUEY,36,0 - 0,,"3,820 / 3"
259,260,TPE TPE,TIEN Tzu Chieh Ling Fang HU,-1,0 - 0,,"3,810 / 3"
260,260,SWE SWE,Toni HOLM-LOWEN Berfin ASLAN,-1,0 - 0,,"3,810 / 3"
261,262,DOM DOM,Nelson JAVIER Daigenis SATURRIA,-1,0 - 0,,"3,800 / 4"
262,263,KOR KOR,KIM Dae Eun CHOI Hye In,-1,0 - 0,,"3,780 / 2"
263,264,IND IND,Sanyam SHUKLA K. Maneesha,0,0 - 0,,"3,720 / 2"
264,264,INA INA,Fajar ALFIAN Mahadewi Istirani NI KETUT,0,0 - 0,,"3,720 / 2"
265,264,BRA BRA,Fabio SOARES Luana VICENTE,0,0 - 0,,"3,720 / 2"
266,264,RUS RUS,Vasily KUZNETSOV Victoria SLOBODJANUK,0,0 - 0,,"3,720 / 2"
267,268,RUS RUS,Vladimir RUSIN Ekaterina KUT,0,0 - 0,,"3,680 / 4"
268,269,JPN JPN,Koshun MIURA Koharu YONEMOTO,1,0 - 0,,"3,640 / 2"
269,270,INA INA,Praveen JORDAN Liliyana NATSIR,1,0 - 0,,"3,600 / 1"
270,270,INA HKG,Fernando KURNIAWAN POON Lok Yan,1,0 - 0,,"3,600 / 1"
271,270,GER GER,Michael FUCHS Isabel HERTTRICH,1,0 - 0,,"3,600 / 1"
272,273,POL POL,Milosz BOCHAT Aneta WOJTKOWSKA,1,0 - 0,,"3,590 / 3"
273,273,AUS AUS,Daniel GUDA Gronya SOMERVILLE,1,0 - 0,,"3,590 / 3"
274,275,BAR BAR,Dakeil Jonathan THORPE Sabrina SCOTT,1,0 - 0,,"3,580 / 3"
275,276,RSA RSA,Michelle BUTLER-EMMETT Willem VILJOEN,1,0 - 0,,"3,570 / 3"
276,277,NGR NGR,Enejoh ABAH Tosin Damilola ATOLAGBE,1,0 - 0,,"3,570 / 2"
277,278,IND IND,Gaurav MALHAN Meenu SINGH,3,0 - 0,,"3,510 / 3"
278,279,ISR ISR,Ariel SHAINSKI Pugach ALINA,3,0 - 0,,"3,506 / 3"
279,280,GRE GRE,Petros TENTAS Irini TENTA,3,0 - 0,,"3,490 / 5"
280,281,INA INA,Kevin Sanjaya SUKAMULJO Della Destiara HARIS,3,0 - 0,,"3,490 / 2"
281,282,RUS RUS,Vladimir NIKULOV Daria SEREBRIAKOVA,-42,0 - 0,,"3,480 / 5"
282,283,TPE TPE,Li-Wei PO Hsin Tien CHANG,2,0 - 0,,"3,440 / 3"
283,284,SEY SEY,Georgie CUPIDON Allisen CAMILLE,2,0 - 0,,"3,435 / 3"
284,285,VIE VIE,Tuan Duc DO Nhu Thao PHAM,463,0 - 0,,"3,420 / 2"
285,285,ENG ENG,Ben LANE Jessica PUGH,-44,0 - 0,,"3,420 / 2"
286,287,AUS AUS,Pit Seng LOW Alice WU,1,0 - 0,,"3,410 / 3"
287,288,AUS INA,Tran Hoang PHAM Sylvina KURNIAWAN,1,0 - 0,,"3,400 / 1"
288,288,CHN CHN,LIU Yuchen HUANG Dongping,1,0 - 0,,"3,400 / 1"
289,290,POL POL,Maciej DABROWSKI WITEK MAGDALENA,-59,0 - 0,,"3,390 / 4"
290,291,HKG HKG,WONG Wai Hong CHAN Hung Yung,0,0 - 0,,"3,390 / 3"
291,292,KAZ KAZ,Artur NIYAZOV Veronika SOROKINA,0,0 - 0,,"3,384 / 5"
292,293,GER GER,Johannes PISTORIUS Lara KAEPPLEIN,0,0 - 0,,"3,290 / 3"
293,294,THA THA,Trawut POTIENG Jongkolphan KITITHARAKUL,0,0 - 0,,"3,280 / 2"
294,295,POL POL,Pawel PIETRYJA Agnieszka WOJTKOWSKA,0,0 - 0,,"3,270 / 2"
295,295,DOM DOM,William CABRERA Daigenis SATURRIA,0,0 - 0,,"3,270 / 2"
296,297,TPE TPE,Shang Kai LIN Hsin-Yu TSAI,1,0 - 0,,"3,220 / 3"
297,298,CRO CRO,Zvonimir HOELBLING Maja PAVLINIC,1,0 - 0,,"3,210 / 3"
298,298,TPE TPE,Yuan Cheng WU Ching Hui CHANG,1,0 - 0,,"3,210 / 3"
299,298,SUR SUR,Mitchel WONGSODIKROMO Crystal LEEFMANS,1,0 - 0,,"3,210 / 3"
300,298,CZE CZE,Jaromir JANACEK Lucie CERNA,1,0 - 0,,"3,210 / 3"
301,302,UZB UZB,Oleg SAVATUGIN Valeriya MUSHTAKOVA,69,0 - 0,,"3,200 / 4"
302,303,KOR KOR,JUN Bong Chan KIM Ji Won,2,0 - 0,,"3,190 / 2"
303,303,IND IND,Rishabh SAHDEV Rachita SAHDEV,2,0 - 0,,"3,190 / 2"
304,303,IND IND,Varun SHARMA Jyoti NASHIER,2,0 - 0,,"3,190 / 2"
305,306,INA INA,Gideon Markus FERNALDI Rizki Amelia PRADIPTA,2,0 - 0,,"3,170 / 3"
306,307,IND IND,Kashish SHARMA Ritu VINAYAK,2,0 - 0,,"3,150 / 2"
307,308,ARG ARG,Federico DIAZ Daiana GARMENDIA,2,0 - 0,,"3,140 / 4"
308,309,SLO SLO,Primoz FLIS Kaja STANKOVIC,2,0 - 0,,"3,120 / 5"
309,310,BUL NED,Alex VLAAR Cheryl SEINEN,2,0 - 0,,"3,120 / 4"
310,311,THA THA,Pichaya CHEENADIT Fareeda LOOG,2,0 - 0,,"3,120 / 2"
311,311,NEP NEP,Bikash SHRESTHA Nangsal TAMANG,2,0 - 0,,"3,120 / 2"
312,311,PUR PUR,Pedro ZAPATA Genesis VALENTIN,2,0 - 0,,"3,120 / 2"
313,314,RSA RSA,Willem VILJOEN Annari VILJOEN,3,0 - 0,,"3,050 / 2"
314,315,INA INA,Hendra Aprida GUNAWAN Nadya MELATI,3,0 - 0,,"3,040 / 2"
315,315,BRA BRA,Alex Yuwan TJONG Ana Paula CAMPOS,3,0 - 0,,"3,040 / 2"
316,315,IRL IRL,Sam MAGEE Rachael DARRAGH,3,0 - 0,,"3,040 / 2"
317,315,THA THA,Kittisak NAMDASH Chanisa TEACHAVORASINSKUN,3,0 - 0,,"3,040 / 2"
318,315,INA INA,Ardiansyah LastName Devi Tika PERMATASARI,3,0 - 0,,"3,040 / 2"
319,320,NZL NZL,Joshua CURRY Tegan WESTON,4,0 - 0,,"3,030 / 1"
320,320,USA USA,Tony GUNAWAN Eti GUNAWAN,4,0 - 0,,"3,030 / 1"
321,320,KOR KOR,JUNG Jae Wook GO Ah Ra,4,0 - 0,,"3,030 / 1"
322,320,TPE TPE,Tzu Wei WANG Ling Fang HU,4,0 - 0,,"3,030 / 1"
323,320,JAM JAM,Gareth HENRY Katherine WYNTER,4,0 - 0,,"3,030 / 1"
324,325,INA INA,Andrei ADISTIA Dian FITRIANI,4,0 - 0,,"2,990 / 2"
325,326,GER GER,Daniel BENZ Lara KAEPPLEIN,4,0 - 0,,"2,980 / 4"
326,327,GUA GUA,Anibal MARROQUIN Beatriz RAMOS,4,0 - 0,,"2,975 / 2"
327,328,TPE TPE,Cheng Heng SU HUNG Shih Han,4,0 - 0,,"2,960 / 2"
328,328,KOR KOR,BAE Kwon Young KIM Ji Won,4,0 - 0,,"2,960 / 2"
329,328,INA INA,Yohanes Rendy SUGIARTO Ririn AMELIA,4,0 - 0,,"2,960 / 2"
330,328,INA INA,Trikusuma WARDHANA Meiliana JAUHARI,4,0 - 0,,"2,960 / 2"
331,332,THA THA,Kantawat LEELAVECHABUTR Panjarat PRANSOPON,4,0 - 0,,"2,950 / 3"
332,333,FIN FIN,Petri HAUTALA Noora AHOLA,4,0 - 0,,"2,920 / 5"
333,334,AUT AUT,Roman ZIRNWALD Sonja LANGTHALER,55,0 - 0,,"2,850 / 3"
334,335,PUR PUR,Joshua SOLER Saribel CACERES,3,0 - 0,,"2,840 / 3"
335,335,TPE TPE,Ming-Tse YANG Pin Chi CHAO,3,0 - 0,,"2,840 / 3"
336,337,ENG ENG,Sean VENDY Lydia Jane POWELL,-74,0 - 0,,"2,810 / 2"
337,338,JPN JPN,Ryota TAOHATA Ayane KURIHARA,2,0 - 0,,"2,800 / 1"
338,338,ENG DEN,Matthew NOTTINGHAM Maria HELSBOL,2,0 - 0,,"2,800 / 1"
339,338,CHN CHN,FAN Qiuyue JIA Yifan,2,0 - 0,,"2,800 / 1"
340,338,THA THA,Thanadol JUMPANOI Thidarat KLEEBYEESOON,2,0 - 0,,"2,800 / 1"
341,338,BAN BAN,Moajjam HOSSAIN Bristy KHATUN,2,0 - 0,,"2,800 / 1"
342,338,JPN JPN,Kohei GONDO Naoko FUKUMAN,2,0 - 0,,"2,800 / 1"
343,338,CRO USA,Zvonimir DURKINJAK Eva LEE,2,0 - 0,,"2,800 / 1"
344,338,AUS AUS,Matthew CHAU Jacqueline GUAN,2,0 - 0,,"2,800 / 1"
345,338,BAN BAN,Parash Md.AHSUN HABIB Aktar SHAPLA,2,0 - 0,,"2,800 / 1"
346,347,DEN DEN,Mads Emil CHRISTENSEN Cecilie SENTOW,2,0 - 0,,"2,790 / 2"
347,348,CRO CRO,Zvonimir DURKINJAK Stasa POZNANOVIC,2,0 - 0,,"2,777 / 1"
348,349,PHI PHI,Alvin MORADA Alyssa Yasbel LEONARDO,130,0 - 0,,"2,760 / 3"
349,350,PUR PUR,Torres HERIBERTO Jaylene FORESTIER,1,0 - 0,,"2,740 / 2"
350,351,MAS MAS,Mohd Razif ABDUL LATIF Sannatasah SANIRU,2,0 - 0,,"2,720 / 3"
351,352,THA THA,Bodin ISSARA Savitree AMITRAPAI,2,0 - 0,,"2,720 / 1"
352,352,CHN CHN,HUANG Kaixiang ZHONG Qianxin,2,0 - 0,,"2,720 / 1"
353,352,MAS MAS,Kah Ming CHOOI Meng Yean LEE,2,0 - 0,,"2,720 / 1"
354,352,IND IND,K. Ajay Kumar Smriti NAGARKOTI,2,0 - 0,,"2,720 / 1"
355,352,IND IND,SINGH Vinay Kumar MUKHERJEE Riya,2,0 - 0,,"2,720 / 1"
356,352,JPN JPN,Kenta KAZUNO Shizuka MATSUO,2,0 - 0,,"2,720 / 1"
357,352,CHN CHN,ZHANG Wen ZHU Mai Ci,2,0 - 0,,"2,720 / 1"
358,352,KOR KOR,SolGyu CHOI YOO Hae Won,2,0 - 0,,"2,720 / 1"
359,352,INA INA,Rafiddias Akhdan NUGROHO Ulfa ZAKIA,2,0 - 0,,"2,720 / 1"
360,352,INA INA,Hardianto HARDIANTO Della Destiara HARIS,2,0 - 0,,"2,720 / 1"
361,352,CHN CHN,ZHANG Wen XIA Huan,2,0 - 0,,"2,720 / 1"
362,352,IND IND,Sanyam SHUKLA Sanyogita GHORPADE,2,0 - 0,,"2,720 / 1"
363,352,NZL IND,Abhinav MANOTA Rachita SAHDEV,2,0 - 0,,"2,720 / 1"
364,352,GER GER,Andreas HEINZ Annika HORBACH,2,0 - 0,,"2,720 / 1"
365,366,RUS RUS,Artem SERPIONOV Tatjana BIBIK,129,0 - 0,,"2,670 / 2"
366,366,DEN DEN,Philip SEERUP Irina Amalie ANDERSEN,382,0 - 0,,"2,670 / 2"
367,366,INA INA,Reinard DHANRIANO Sinta Arum ANTASARI,2,0 - 0,,"2,670 / 2"
368,369,THA THA,Sudket PRAPAKAMOL Sapsiree TAERATTANACHAI,1,0 - 0,,"2,660 / 1"
